Sheet: Структура
A1: Тип | B1: Значение | C1: Имя листа | D1: Поля
A2: Расширение | B2: Ключ таблицы | C2: Ключ строки | D2: Ключи полей
A3: text | B3: <?xml version="1.0" encoding="UTF-8" standalone="yes" ?> <!DOCTYPE boost_serialization> <boost_serialization signature="serialization::archive" version="5"> <data_bin class_id="0" tracking_level="0" version="0">
A4: table_0_1 | B4: >BOOST_SERIALIZATION>DATA_BIN>CLASSES | C4: classes | D4: NAME | E4: PRICE | F4: WEIGHT | G4: DAMAGE | H4: TOHIT | I4: DEFENCE | J4: ABSORBTION | K4: MAGICVOLUME
A5: XML data | B5: <classes class_id="1" tracking_level="0" version="0"> | C5: <item class_id="2" tracking_level="0" version="0"> | D5: <name> | E5: <price> | F5: <weight> | G5: <damage> | H5: <toHit> | I5: <defence> | J5: <absorbtion> | K5: <magicVolume>
A6: table_0_2 | B6: >BOOST_SERIALIZATION>DATA_BIN>MATERIALS | C6: materials | D6: NAME | E6: PRICE | F6: WEIGHT | G6: DAMAGE | H6: TOHIT | I6: DEFENCE | J6: ABSORBTION | K6: MAGICVOLUME
A7: XML data | B7: <materials> | C7: <item> | D7: <name> | E7: <price> | F7: <weight> | G7: <damage> | H7: <toHit> | I7: <defence> | J7: <absorbtion> | K7: <magicVolume>
A8: table_0_3 | B8: >BOOST_SERIALIZATION>DATA_BIN>MODIFIERS | C8: modifiers | D8: NAME | E8: MANACOST | F8: AFFECTMIN | G8: AFFECTMAX | H8: USABLEBY | I8: IN_WARRIORWEAPON | J8: IN_WARRIORSHIELD | K8: IN_WARRIORNOTUSED3 | L8: IN_WARRIORRING | M8: IN_WARRIORAMULET | N8: IN_WARRIORHELM | O8: IN_WARRIORMAIL | P8: IN_WARRIORCUIRASS | Q8: IN_WARRIORBRACERS | R8: IN_WARRIORGAUNTLETS | S8: IN_WARRIORNOTUSED11 | T8: IN_WARRIORBOOTS | U8: IN_MAGEWEAPON | V8: IN_MAGENOTUSED2 | W8: IN_MAGENOTUSED3 | X8: IN_MAGERING | Y8: IN_MAGEAMULET | Z8: IN_MAGEHAT | AA8: IN_MAGEROBE | AB8: IN_MAGECLOAK | AC8: IN_MAGENOTUSED9 | AD8: IN_MAGEGLOVES | AE8: IN_MAGENOTUSED11 | AF8: IN_MAGESHOES
A9: XML data | B9: <modifiers class_id="3" tracking_level="0" version="0"> | C9: <item class_id="4" tracking_level="0" version="0"> | D9: <name> | E9: <manaCost> | F9: <affectMin> | G9: <affectMax> | H9: <usableBy> | I9: <in_WarriorWeapon> | J9: <in_WarriorShield> | K9: <in_WarriorNotUsed3> | L9: <in_WarriorRing> | M9: <in_WarriorAmulet> | N9: <in_WarriorHelm> | O9: <in_WarriorMail> | P9: <in_WarriorCuirass> | Q9: <in_WarriorBracers> | R9: <in_WarriorGauntlets> | S9: <in_WarriorNotUsed11> | T9: <in_WarriorBoots> | U9: <in_MageWeapon> | V9: <in_MageNotUsed2> | W9: <in_MageNotUsed3> | X9: <in_MageRing> | Y9: <in_MageAmulet> | Z9: <in_MageHat> | AA9: <in_MageRobe> | AB9: <in_MageCloak> | AC9: <in_MageNotUsed9> | AD9: <in_MageGloves> | AE9: <in_MageNotUsed11> | AF9: <in_MageShoes>
A10: table_3_5 | B10: >BOOST_SERIALIZATION>DATA_BIN>ARMOURS>ITEM>SHAPESALLOWED | C10: shapesAllowed_armours | D10: PARENTID | E10: FIRST | F10: SECOND
A11: XML data | B11: <shapesAllowed class_id="7" tracking_level="0" version="0"> | C11: <item class_id="8" tracking_level="0" version="0"> | D11: ParentID | E11: <first> | F11: <second>
A12: table_0_4 | B12: >BOOST_SERIALIZATION>DATA_BIN>ARMOURS | C12: armours | D12: NAME | E12: SHAPE | F12: MATERIAL | G12: PRICE | H12: WEIGHT | I12: SLOT | J12: ATTACKTYPE | K12: PHYSICALMIN | L12: PHYSICALMAX | M12: TOHIT | N12: DEFENCE | O12: ABSORBTION | P12: RANGE | Q12: CHARGE | R12: RELAX | S12: TWOHANDED | T12: SUITABLEFOR | U12: OTHERPARAM | V12: SHAPESALLOWED
A13: XML data | B13: <armours class_id="5" tracking_level="0" version="0"> | C13: <item class_id="6" tracking_level="0" version="0"> | D13: <name> | E13: <shape> | F13: <material> | G13: <price> | H13: <weight> | I13: <slot> | J13: <attackType> | K13: <physicalMin> | L13: <physicalMax> | M13: <toHit> | N13: <defence> | O13: <absorbtion> | P13: <range> | Q13: <charge> | R13: <relax> | S13: <twoHanded> | T13: <suitableFor> | U13: <otherParam> | V13: <shapesAllowed class_id="7" tracking_level="0" version="0">
A14: table_3_7 | B14: >BOOST_SERIALIZATION>DATA_BIN>SHIELDS>ITEM>SHAPESALLOWED | C14: shapesAllowed_shields | D14: PARENTID | E14: FIRST | F14: SECOND
A15: XML data | B15: <shapesAllowed> | C15: <item> | D15: ParentID | E15: <first> | F15: <second>
A16: table_0_6 | B16: >BOOST_SERIALIZATION>DATA_BIN>SHIELDS | C16: shields | D16: NAME | E16: SHAPE | F16: MATERIAL | G16: PRICE | H16: WEIGHT | I16: SLOT | J16: ATTACKTYPE | K16: PHYSICALMIN | L16: PHYSICALMAX | M16: TOHIT | N16: DEFENCE | O16: ABSORBTION | P16: RANGE | Q16: CHARGE | R16: RELAX | S16: TWOHANDED | T16: SUITABLEFOR | U16: OTHERPARAM | V16: SHAPESALLOWED
A17: XML data | B17: <shields> | C17: <item> | D17: <name> | E17: <shape> | F17: <material> | G17: <price> | H17: <weight> | I17: <slot> | J17: <attackType> | K17: <physicalMin> | L17: <physicalMax> | M17: <toHit> | N17: <defence> | O17: <absorbtion> | P17: <range> | Q17: <charge> | R17: <relax> | S17: <twoHanded> | T17: <suitableFor> | U17: <otherParam> | V17: <shapesAllowed>
A18: table_3_9 | B18: >BOOST_SERIALIZATION>DATA_BIN>WEAPONS>ITEM>SHAPESALLOWED | C18: shapesAllowed_weapons | D18: PARENTID | E18: FIRST | F18: SECOND
A19: XML data | B19: <shapesAllowed> | C19: <item> | D19: ParentID | E19: <first> | F19: <second>
A20: table_0_8 | B20: >BOOST_SERIALIZATION>DATA_BIN>WEAPONS | C20: weapons | D20: NAME | E20: SHAPE | F20: MATERIAL | G20: PRICE | H20: WEIGHT | I20: SLOT | J20: ATTACKTYPE | K20: PHYSICALMIN | L20: PHYSICALMAX | M20: TOHIT | N20: DEFENCE | O20: ABSORBTION | P20: RANGE | Q20: CHARGE | R20: RELAX | S20: TWOHANDED | T20: SUITABLEFOR | U20: OTHERPARAM | V20: SHAPESALLOWED
A21: XML data | B21: <weapons> | C21: <item> | D21: <name> | E21: <shape> | F21: <material> | G21: <price> | H21: <weight> | I21: <slot> | J21: <attackType> | K21: <physicalMin> | L21: <physicalMax> | M21: <toHit> | N21: <defence> | O21: <absorbtion> | P21: <range> | Q21: <charge> | R21: <relax> | S21: <twoHanded> | T21: <suitableFor> | U21: <otherParam> | V21: <shapesAllowed>
A22: table_0_10 | B22: >BOOST_SERIALIZATION>DATA_BIN>MAGICITEMS | C22: magicItems | D22: NAME | E22: PRICE | F22: WEIGHT | G22: EFFECT
A23: XML data | B23: <magicItems class_id="9" tracking_level="0" version="0"> | C23: <item class_id="10" tracking_level="0" version="0"> | D23: <name> | E23: <price> | F23: <weight> | G23: <effect>
A24: table_126_12 | B24: >BOOST_SERIALIZATION>DATA_BIN>MONSTERS>ITEM>KNOWNSPELLS | C24: knownSpells_monsters | D24: PARENTID | E24: [VALUE]
A25: XML data | B25: <knownSpells class_id="13" tracking_level="0" version="0"> | C25: <item> | D25: ParentID
A26: table_0_11 | B26: >BOOST_SERIALIZATION>DATA_BIN>MONSTERS | C26: monsters | D26: EMPTY | E26: NAME | F26: BODY | G26: REACTION | H26: MIND | I26: SPIRIT | J26: HEALTHMAX | K26: HEALTHREGENERATION | L26: MANAMAX | M26: MANAREGENERATION | N26: SPEED | O26: ROTATIONSPEED | P26: SCANRANGE | Q26: PHYSICALMIN | R26: PHYSICALMAX | S26: ATTACKTYPE | T26: TOHIT | U26: DEFENCE | V26: ABSORBTION | W26: CHARGE | X26: RELAX | Y26: PROTECTIONFIRE | Z26: PROTECTIONWATER | AA26: PROTECTIONAIR | AB26: PROTECTIONEARTH | AC26: PROTECTIONASTRAL | AD26: PROTECTIONBLADE | AE26: PROTECTIONAXE | AF26: PROTECTIONBLUDGEON | AG26: PROTECTIONPIKE | AH26: PROTECTIONSHOOTING | AI26: TYPEID | AJ26: FACE | AK26: TOKENSIZE | AL26: MOVEMENTTYPE | AM26: DYINGTIME | AN26: WITHDRAW | AO26: WIMPY | AP26: SEEINVISIBLE | AQ26: EXPERIENCE | AR26: TREASUREGOLD | AS26: TREASUREGOLDMIN | AT26: TREASUREGOLDMAX | AU26: TREASUREITEM | AV26: TREASUREITEMMIN | AW26: TREASUREITEMMAX | AX26: TREASUREITEMMASK | AY26: NOTUSED | AZ26: NOTUSED1 | BA26: POWER | BB26: SPELL1 | BC26: SPELLPROBABILITY1 | BD26: SPELL2 | BE26: SPELLPROBABILITY2 | BF26: SPELL3 | BG26: SPELLPROBABILITY3 | BH26: SPELLPOWER | BI26: SERVERID | BJ26: KNOWNSPELLSAREEMPTY | BK26: KNOWNSPELLS | BL26: SKILLFIRE | BM26: SKILLWATER | BN26: SKILLAIR | BO26: SKILLEARTH | BP26: SKILLASTRAL | BQ26: EQUIPITEM1 | BR26: EQUIPITEM2
A27: XML data | B27: <monsters class_id="11" tracking_level="0" version="0"> | C27: <item class_id="12" tracking_level="0" version="0"> | D27: <empty> | E27: <name> | F27: <body> | G27: <reaction> | H27: <mind> | I27: <spirit> | J27: <healthMax> | K27: <healthRegeneration> | L27: <manaMax> | M27: <manaRegeneration> | N27: <speed> | O27: <rotationSpeed> | P27: <scanRange> | Q27: <physicalMin> | R27: <physicalMax> | S27: <attackType> | T27: <toHit> | U27: <defence> | V27: <absorbtion> | W27: <charge> | X27: <relax> | Y27: <protectionFire> | Z27: <protectionWater> | AA27: <protectionAir> | AB27: <protectionEarth> | AC27: <protectionAstral> | AD27: <protectionBlade> | AE27: <protectionAxe> | AF27: <protectionBludgeon> | AG27: <protectionPike> | AH27: <protectionShooting> | AI27: <typeId> | AJ27: <face> | AK27: <tokenSize> | AL27: <movementType> | AM27: <dyingTime> | AN27: <withdraw> | AO27: <wimpy> | AP27: <seeInvisible> | AQ27: <experience> | AR27: <treasureGold> | AS27: <treasureGoldMin> | AT27: <treasureGoldMax> | AU27: <treasureItem> | AV27: <treasureItemMin> | AW27: <treasureItemMax> | AX27: <treasureItemMask> | AY27: <notUsed> | AZ27: <notUsed1> | BA27: <power> | BB27: <spell1> | BC27: <spellProbability1> | BD27: <spell2> | BE27: <spellProbability2> | BF27: <spell3> | BG27: <spellProbability3> | BH27: <spellPower> | BI27: <serverId> | BJ27: <knownSpellsAreEmpty> | BK27: <knownSpells class_id="13" tracking_level="0" version="0"> | BL27: <skillFire> | BM27: <skillWater> | BN27: <skillAir> | BO27: <skillEarth> | BP27: <skillAstral> | BQ27: <equipItem1> | BR27: <equipItem2>
A28: table_25_14 | B28: >BOOST_SERIALIZATION>DATA_BIN>HUMANS>ITEM>KNOWNSPELLS | C28: knownSpells_humans | D28: PARENTID | E28: [VALUE]
A29: XML data | B29: <knownSpells> | C29: <item> | D29: ParentID
A30: table_0_13 | B30: >BOOST_SERIALIZATION>DATA_BIN>HUMANS | C30: humans | D30: EMPTY | E30: NAME | F30: BODY | G30: REACTION | H30: MIND | I30: SPIRIT | J30: HEALTHMAX | K30: MANAMAX | L30: SPEED | M30: ROTATIONSPEED | N30: SCANRANGE | O30: DEFENCE | P30: SKILL0 | Q30: SKILLBLADEFIRE | R30: SKILLAXEWATER | S30: SKILLBLUDGEONAIR | T30: SKILLPIKEEARTH | U30: SKILLSHOOTINGASTRAL | V30: TYPEID | W30: FACE | X30: GENDER | Y30: CHARGE | Z30: RELAX | AA30: TOKENSIZE | AB30: MOVEMENTTYPE | AC30: DYINGTIME | AD30: SERVERID | AE30: KNOWNSPELLSAREEMPTY | AF30: KNOWNSPELLS | AG30: EQUIPITEM1 | AH30: EQUIPITEM2 | AI30: EQUIPITEM3 | AJ30: EQUIPITEM4 | AK30: EQUIPITEM5 | AL30: EQUIPITEM6 | AM30: EQUIPITEM7 | AN30: EQUIPITEM8 | AO30: EQUIPITEM9 | AP30: EQUIPITEM10
A31: XML data | B31: <humans class_id="14" tracking_level="0" version="0"> | C31: <item class_id="15" tracking_level="0" version="0"> | D31: <empty> | E31: <name> | F31: <body> | G31: <reaction> | H31: <mind> | I31: <spirit> | J31: <healthMax> | K31: <manaMax> | L31: <speed> | M31: <rotationSpeed> | N31: <scanRange> | O31: <defence> | P31: <skill0> | Q31: <skillBladeFire> | R31: <skillAxeWater> | S31: <skillBludgeonAir> | T31: <skillPikeEarth> | U31: <skillShootingAstral> | V31: <typeId> | W31: <face> | X31: <gender> | Y31: <charge> | Z31: <relax> | AA31: <tokenSize> | AB31: <movementType> | AC31: <dyingTime> | AD31: <serverId> | AE31: <knownSpellsAreEmpty> | AF31: <knownSpells> | AG31: <equipItem1> | AH31: <equipItem2> | AI31: <equipItem3> | AJ31: <equipItem4> | AK31: <equipItem5> | AL31: <equipItem6> | AM31: <equipItem7> | AN31: <equipItem8> | AO31: <equipItem9> | AP31: <equipItem10>
A32: table_3_16 | B32: >BOOST_SERIALIZATION>DATA_BIN>BUILDINGS>ITEM>CANNOTPASS | C32: canNotPass | D32: PARENTID | E32: FIRST | F32: SECOND
A33: XML data | B33: <canNotPass class_id="18" tracking_level="0" version="0"> | C33: <item class_id="19" tracking_level="0" version="0"> | D33: ParentID | E33: <first> | F33: <second>
A34: table_3_17 | B34: >BOOST_SERIALIZATION>DATA_BIN>BUILDINGS>ITEM>TILES | C34: tiles | D34: PARENTID | E34: FIRST | F34: SECOND
A35: XML data | B35: <tiles> | C35: <item> | D35: ParentID | E35: <first> | F35: <second>
A36: table_0_15 | B36: >BOOST_SERIALIZATION>DATA_BIN>BUILDINGS | C36: buildings | D36: NAME | E36: WIDTH | F36: HEIGHT | G36: SCANRANGE | H36: HEALTHMAX | I36: CANNOTPASS | J36: TILES
A37: XML data | B37: <buildings class_id="16" tracking_level="0" version="0"> | C37: <item class_id="17" tracking_level="0" version="0"> | D37: <name> | E37: <width> | F37: <height> | G37: <scanRange> | H37: <healthMax> | I37: <canNotPass class_id="18" tracking_level="0" version="0"> | J37: <tiles>
A38: table_0_18 | B38: >BOOST_SERIALIZATION>DATA_BIN>SPELLS | C38: spells | D38: EMPTY | E38: NAME | F38: LEVEL | G38: MANACOST | H38: SPHERE | I38: ITEM | J38: SPELLTARGET | K38: DELIVERYSYSTEM | L38: MAXRANGE | M38: EFFECTSPEED | N38: DISTRIBUTION | O38: RADIUS | P38: AREAAFFECT | Q38: AREADURATION | R38: AREAFREQUENCY | S38: UNITAPPLYMETHOD | T38: DURATION | U38: FREQUENCY | V38: DAMAGEMIN | W38: DAMAGEMAX | X38: DEFENSIVE | Y38: SKILLOFFSET | Z38: SCROLLCOST | AA38: BOOKCOST | AB38: EFFECT
A39: XML data | B39: <spells class_id="20" tracking_level="0" version="0"> | C39: <item class_id="21" tracking_level="0" version="0"> | D39: <empty> | E39: <name> | F39: <level> | G39: <manaCost> | H39: <sphere> | I39: <item> | J39: <spellTarget> | K39: <deliverySystem> | L39: <maxRange> | M39: <effectSpeed> | N39: <distribution> | O39: <radius> | P39: <areaAffect> | Q39: <areaDuration> | R39: <areaFrequency> | S39: <unitApplyMethod> | T39: <duration> | U39: <frequency> | V39: <damageMin> | W39: <damageMax> | X39: <defensive> | Y39: <skillOffset> | Z39: <scrollCost> | AA39: <bookCost> | AB39: <effect>
A40: text | B40: </data_bin>
A41: text | B41: </boost_serialization>

Sheet: classes
A1: NAME | B1: PRICE | C1: WEIGHT | D1: DAMAGE | E1: TOHIT | F1: DEFENCE | G1: ABSORBTION | H1: MAGICVOLUME
A2: name | B2: price | C2: weight | D2: damage | E2: toHit | F2: defence | G2: absorbtion | H2: magicVolume
A3: Common | B3: 1 | C3: 1 | D3: 0.20000100000000001 | E3: 1 | F3: 0.25000099999999997 | G3: 1 | H3: 1
A4: Uncommon | B4: 2 | C4: 1.1000000000000001 | D4: 0.24000099999999999 | E4: 1.2 | F4: 0.30000100000000002 | G4: 1.1000000000000001 | H4: 2
A5: Rare | B5: 4 | C5: 1.2 | D5: 0.28800100000000001 | E5: 1.4399999999999999 | F5: 0.36000100000000002 | G5: 1.21 | H5: 3
A6: Very Rare | B6: 10 | C6: 1.3 | D6: 0.34560099999999999 | E6: 1.728 | F6: 0.43200100000000002 | G6: 1.331 | H6: 4
A7: Elven | B7: 8 | C7: 1 | D7: 0.30541099999999999 | E7: 2 | F7: 0.38176300000000002 | G7: 1.2477020000000001 | H7: 5
A8: Bad | B8: 4 | C8: 1.2 | D8: 0.28800100000000001 | E8: 1.4399999999999999 | F8: 0.36000100000000002 | G8: 1.21 | H8: 3
A9: Good | B9: 8 | C9: 1.3 | D9: 0.34560099999999999 | E9: 1.728 | F9: 0.43200100000000002 | G9: 1.331 | H9: 5

Sheet: materials
A1: NAME | B1: PRICE | C1: WEIGHT | D1: DAMAGE | E1: TOHIT | F1: DEFENCE | G1: ABSORBTION | H1: MAGICVOLUME
A2: name | B2: price | C2: weight | D2: damage | E2: toHit | F2: defence | G2: absorbtion | H2: magicVolume
A3: Iron | B3: 1 | C3: 1 | D3: 1.0000009999999999 | E3: 1 | F3: 1.0000009999999999 | G3: 1 | H3: 0
A4: Bronze | B4: 0.25000099999999997 | C4: 0.5 | D4: 0.69444499999999998 | E4: 1 | F4: 0.69444499999999998 | G4: 1 | H4: 3
A5: Steel | B5: 3 | C5: 1.3 | D5: 1.335056 | E5: 1 | F5: 1.335056 | G5: 1.16307 | H5: 1
A6: Silver | B6: 4 | C6: 0.69999999999999996 | D6: 0.83333400000000002 | E6: 1 | F6: 0.83333400000000002 | G6: 1 | H6: 50
A7: Gold | B7: 6 | C7: 0.80000000000000004 | D7: 0.62419500000000006 | E7: 1 | F7: 0.62419500000000006 | G7: 1 | H7: 100
A8: Mithrill | B8: 8 | C8: 0.5 | D8: 1.7280009999999999 | E8: 1.5 | F8: 1.7280009999999999 | G8: 1.331 | H8: 20
A9: Adamantium | B9: 30 | C9: 1 | D9: 2.1989529999999999 | E9: 2 | F9: 2.1989529999999999 | G9: 1.509719 | H9: 50
A10: Meteoric | B10: 100 | C10: 1.5 | D10: 2.7683719999999998 | E10: 2.5 | F10: 2.7683719999999998 | G10: 1.7028509999999999 | H10: 100
A11: Wood | B11: 0.16666800000000001 | C11: 0.5 | D11: 0.62419500000000006 | E11: 1 | F11: 0.62419500000000006 | G11: 1 | H11: 20
A12: Magic Wood | B12: 6 | C12: 0.69999999999999996 | D12: 1.602068 | E12: 2 | F12: 1.602068 | G12: 1.279377 | H12: 150
A13: Leather | B13: 0.0078139999999999998 | C13: 0.20000000000000001 | D13: 0.27908300000000003 | E13: 1 | F13: 0.27908300000000003 | G13: 1 | H13: 0
A14: Hard Leather | B14: 0.125001 | C14: 0.40000000000000002 | D14: 0.57870500000000002 | E14: 1 | F14: 0.57870500000000002 | G14: 1 | H14: 1
A15: Dragon Leather | B15: 300 | C15: 1 | D15: 1.4400010000000001 | E15: 1 | F15: 2.875120388 | G15: 1.509719 | H15: 150
A16: Bone | B16: 1 | C16: 1 | D16: 1.0000009999999999 | E16: 1 | F16: 1.0000009999999999 | G16: 1 | H16: 0
A17: Crystal | B17: 900 | C17: 2 | D17: 2.9859849999999999 | E17: 3 | F17: 2.9859849999999999 | G17: 1.7715609999999999 | H17: 150
A18: None | B18: 1 | C18: 0.20000000000000001 | D18: 0.48225400000000002 | E18: 1 | F18: 0.48225400000000002 | G18: 1 | H18: 150

Sheet: modifiers
A1: NAME | B1: MANACOST | C1: AFFECTMIN | D1: AFFECTMAX | E1: USABLEBY | F1: IN_WARRIORWEAPON | G1: IN_WARRIORSHIELD | H1: IN_WARRIORNOTUSED3 | I1: IN_WARRIORRING | J1: IN_WARRIORAMULET | K1: IN_WARRIORHELM | L1: IN_WARRIORMAIL | M1: IN_WARRIORCUIRASS | N1: IN_WARRIORBRACERS | O1: IN_WARRIORGAUNTLETS | P1: IN_WARRIORNOTUSED11 | Q1: IN_WARRIORBOOTS | R1: IN_MAGEWEAPON | S1: IN_MAGENOTUSED2 | T1: IN_MAGENOTUSED3 | U1: IN_MAGERING | V1: IN_MAGEAMULET | W1: IN_MAGEHAT | X1: IN_MAGEROBE | Y1: IN_MAGECLOAK | Z1: IN_MAGENOTUSED9 | AA1: IN_MAGEGLOVES | AB1: IN_MAGENOTUSED11 | AC1: IN_MAGESHOES
A2: name | B2: manaCost | C2: affectMin | D2: affectMax | E2: usableBy | F2: in_WarriorWeapon | G2: in_WarriorShield | H2: in_WarriorNotUsed3 | I2: in_WarriorRing | J2: in_WarriorAmulet | K2: in_WarriorHelm | L2: in_WarriorMail | M2: in_WarriorCuirass | N2: in_WarriorBracers | O2: in_WarriorGauntlets | P2: in_WarriorNotUsed11 | Q2: in_WarriorBoots | R2: in_MageWeapon | S2: in_MageNotUsed2 | T2: in_MageNotUsed3 | U2: in_MageRing | V2: in_MageAmulet | W2: in_MageHat | X2: in_MageRobe | Y2: in_MageCloak | Z2: in_MageNotUsed9 | AA2: in_MageGloves | AB2: in_MageNotUsed11 | AC2: in_MageShoes
B3: 0 | C3: 0 | D3: 0 | E3: 0 | F3: 0 | G3: 0 | H3: 0 | I3: 0 | J3: 0 | K3: 0 | L3: 0 | M3: 0 | N3: 0 | O3: 0 | P3: 0 | Q3: 0 | R3: 0 | S3: 0 | T3: 0 | U3: 0 | V3: 0 | W3: 0 | X3: 0 | Y3: 0 | Z3: 0 | AA3: 0 | AB3: 0 | AC3: 0
A4: price | B4: 0 | C4: -1 | D4: -1 | E4: -1 | F4: 0 | G4: 0 | H4: 0 | I4: 0 | J4: 0 | K4: 0 | L4: 0 | M4: 0 | N4: 0 | O4: 0 | P4: 0 | Q4: 0 | R4: 0 | S4: 0 | T4: 0 | U4: 0 | V4: 0 | W4: 0 | X4: 0 | Y4: 0 | Z4: 0 | AA4: 0 | AB4: 0 | AC4: 0
A5: body | B5: 301 | C5: 1 | D5: 3 | E5: 3 | F5: 0 | G5: 0 | H5: 0 | I5: 10 | J5: 10 | K5: 5 | L5: 5 | M5: 5 | N5: 5 | O5: 5 | P5: 0 | Q5: 5 | R5: 0 | S5: 0 | T5: 0 | U5: 10 | V5: 10 | W5: 5 | X5: 5 | Y5: 5 | Z5: 0 | AA5: 5 | AB5: 0 | AC5: 5
A6: mind | B6: 200 | C6: 1 | D6: 5 | E6: 3 | F6: 0 | G6: 0 | H6: 0 | I6: 20 | J6: 20 | K6: 10 | L6: 10 | M6: 10 | N6: 10 | O6: 10 | P6: 0 | Q6: 10 | R6: 0 | S6: 0 | T6: 0 | U6: 20 | V6: 20 | W6: 10 | X6: 10 | Y6: 10 | Z6: 0 | AA6: 10 | AB6: 0 | AC6: 10
A7: reaction | B7: 200 | C7: 1 | D7: 5 | E7: 3 | F7: 0 | G7: 0 | H7: 0 | I7: 30 | J7: 30 | K7: 15 | L7: 15 | M7: 15 | N7: 15 | O7: 15 | P7: 0 | Q7: 15 | R7: 0 | S7: 0 | T7: 0 | U7: 30 | V7: 30 | W7: 15 | X7: 15 | Y7: 15 | Z7: 0 | AA7: 15 | AB7: 0 | AC7: 15
A8: spirit | B8: 200 | C8: 1 | D8: 5 | E8: 3 | F8: 0 | G8: 0 | H8: 0 | I8: 40 | J8: 40 | K8: 20 | L8: 20 | M8: 20 | N8: 20 | O8: 20 | P8: 0 | Q8: 20 | R8: 0 | S8: 0 | T8: 0 | U8: 40 | V8: 40 | W8: 20 | X8: 20 | Y8: 20 | Z8: 0 | AA8: 20 | AB8: 0 | AC8: 20
A9: health | B9: 10 | C9: 3 | D9: 50 | E9: -1 | F9: 0 | G9: 0 | H9: 0 | I9: 40 | J9: 40 | K9: 20 | L9: 20 | M9: 20 | N9: 20 | O9: 20 | P9: 0 | Q9: 20 | R9: 0 | S9: 0 | T9: 0 | U9: 40 | V9: 40 | W9: 20 | X9: 20 | Y9: 20 | Z9: 0 | AA9: 20 | AB9: 0 | AC9: 20
A10: healthMax | B10: 10 | C10: 3 | D10: 50 | E10: 3 | F10: 0 | G10: 0 | H10: 0 | I10: 60 | J10: 60 | K10: 30 | L10: 30 | M10: 30 | N10: 30 | O10: 30 | P10: 0 | Q10: 30 | R10: 0 | S10: 0 | T10: 0 | U10: 60 | V10: 60 | W10: 30 | X10: 30 | Y10: 30 | Z10: 0 | AA10: 30 | AB10: 0 | AC10: 30
A11: healthRegeneration | B11: 6 | C11: 10 | D11: 250 | E11: 3 | F11: 0 | G11: 0 | H11: 0 | I11: 80 | J11: 80 | K11: 30 | L11: 30 | M11: 30 | N11: 30 | O11: 30 | P11: 0 | Q11: 30 | R11: 0 | S11: 0 | T11: 0 | U11: 80 | V11: 80 | W11: 30 | X11: 30 | Y11: 30 | Z11: 0 | AA11: 30 | AB11: 0 | AC11: 30
A12: mana | B12: 10 | C12: 3 | D12: 50 | E12: -1 | F12: 0 | G12: 0 | H12: 0 | I12: 80 | J12: 80 | K12: 30 | L12: 30 | M12: 30 | N12: 30 | O12: 30 | P12: 0 | Q12: 30 | R12: 0 | S12: 0 | T12: 0 | U12: 80 | V12: 80 | W12: 30 | X12: 30 | Y12: 30 | Z12: 0 | AA12: 30 | AB12: 0 | AC12: 30
A13: manaMax | B13: 10 | C13: 3 | D13: 50 | E13: 2 | F13: 0 | G13: 0 | H13: 0 | I13: 95 | J13: 95 | K13: 30 | L13: 30 | M13: 30 | N13: 30 | O13: 30 | P13: 0 | Q13: 30 | R13: 0 | S13: 0 | T13: 0 | U13: 95 | V13: 95 | W13: 50 | X13: 50 | Y13: 50 | Z13: 0 | AA13: 50 | AB13: 0 | AC13: 50
A14: manaRegeneration | B14: 3 | C14: 10 | D14: 250 | E14: 2 | F14: 0 | G14: 0 | H14: 0 | I14: 110 | J14: 110 | K14: 30 | L14: 30 | M14: 30 | N14: 30 | O14: 30 | P14: 0 | Q14: 30 | R14: 0 | S14: 0 | T14: 0 | U14: 110 | V14: 110 | W14: 50 | X14: 50 | Y14: 50 | Z14: 0 | AA14: 50 | AB14: 0 | AC14: 50
A15: toHit | B15: 10 | C15: 1 | D15: 75 | E15: 1 | F15: 100 | G15: 0 | H15: 0 | I15: 130 | J15: 130 | K15: 30 | L15: 30 | M15: 30 | N15: 30 | O15: 30 | P15: 0 | Q15: 30 | R15: 0 | S15: 0 | T15: 0 | U15: 130 | V15: 130 | W15: 50 | X15: 50 | Y15: 50 | Z15: 0 | AA15: 50 | AB15: 0 | AC15: 50
A16: damageMin | B16: 15 | C16: 1 | D16: 5 | E16: -1 | F16: 100 | G16: 0 | H16: 0 | I16: 130 | J16: 130 | K16: 30 | L16: 30 | M16: 30 | N16: 30 | O16: 30 | P16: 0 | Q16: 30 | R16: 0 | S16: 0 | T16: 0 | U16: 130 | V16: 130 | W16: 50 | X16: 50 | Y16: 50 | Z16: 0 | AA16: 50 | AB16: 0 | AC16: 50
A17: damageMax | B17: 10 | C17: 1 | D17: 5 | E17: -1 | F17: 100 | G17: 0 | H17: 0 | I17: 130 | J17: 130 | K17: 30 | L17: 30 | M17: 30 | N17: 30 | O17: 30 | P17: 0 | Q17: 30 | R17: 0 | S17: 0 | T17: 0 | U17: 130 | V17: 130 | W17: 50 | X17: 50 | Y17: 50 | Z17: 0 | AA17: 50 | AB17: 0 | AC17: 50
A18: defence | B18: 40 | C18: 1 | D18: 20 | E18: 3 | F18: 100 | G18: 100 | H18: 0 | I18: 160 | J18: 160 | K18: 130 | L18: 130 | M18: 130 | N18: 130 | O18: 130 | P18: 0 | Q18: 130 | R18: 0 | S18: 0 | T18: 0 | U18: 160 | V18: 160 | W18: 50 | X18: 50 | Y18: 50 | Z18: 0 | AA18: 50 | AB18: 0 | AC18: 50
A19: absorbtion | B19: 150 | C19: 1 | D19: 3 | E19: 1 | F19: 100 | G19: 150 | H19: 0 | I19: 175 | J19: 175 | K19: 180 | L19: 180 | M19: 180 | N19: 180 | O19: 180 | P19: 0 | Q19: 180 | R19: 0 | S19: 0 | T19: 0 | U19: 175 | V19: 175 | W19: 100 | X19: 100 | Y19: 100 | Z19: 0 | AA19: 100 | AB19: 0 | AC19: 100
A20: speed | B20: 120 | C20: 1 | D20: 6 | E20: 3 | F20: 100 | G20: 150 | H20: 0 | I20: 185 | J20: 185 | K20: 180 | L20: 180 | M20: 180 | N20: 180 | O20: 180 | P20: 0 | Q20: 280 | R20: 0 | S20: 0 | T20: 0 | U20: 185 | V20: 185 | W20: 100 | X20: 100 | Y20: 100 | Z20: 0 | AA20: 100 | AB20: 0 | AC20: 200
A21: rotationSpeed | B21: 20 | C21: 1 | D21: 8 | E21: 3 | F21: 100 | G21: 150 | H21: 0 | I21: 195 | J21: 195 | K21: 180 | L21: 180 | M21: 180 | N21: 180 | O21: 180 | P21: 0 | Q21: 380 | R21: 0 | S21: 0 | T21: 0 | U21: 195 | V21: 195 | W21: 100 | X21: 100 | Y21: 100 | Z21: 0 | AA21: 100 | AB21: 0 | AC21: 300
A22: scanRange | B22: 200 | C22: 1 | D22: 2 | E22: 3 | F22: 100 | G22: 150 | H22: 0 | I22: 205 | J22: 205 | K22: 280 | L22: 180 | M22: 180 | N22: 180 | O22: 180 | P22: 0 | Q22: 380 | R22: 0 | S22: 0 | T22: 0 | U22: 205 | V22: 205 | W22: 200 | X22: 100 | Y22: 100 | Z22: 0 | AA22: 100 | AB22: 0 | AC22: 300
A23: protection0 | B23: 10 | C23: 1 | D23: 50 | E23: -1 | F23: 100 | G23: 150 | H23: 0 | I23: 205 | J23: 205 | K23: 280 | L23: 180 | M23: 180 | N23: 180 | O23: 180 | P23: 0 | Q23: 380 | R23: 0 | S23: 0 | T23: 0 | U23: 205 | V23: 205 | W23: 200 | X23: 100 | Y23: 100 | Z23: 0 | AA23: 100 | AB23: 0 | AC23: 300
A24: protectionFire | B24: 10 | C24: 5 | D24: 30 | E24: 3 | F24: 100 | G24: 165 | H24: 0 | I24: 220 | J24: 220 | K24: 290 | L24: 190 | M24: 190 | N24: 190 | O24: 190 | P24: 0 | Q24: 390 | R24: 0 | S24: 0 | T24: 0 | U24: 220 | V24: 215 | W24: 210 | X24: 110 | Y24: 110 | Z24: 0 | AA24: 110 | AB24: 0 | AC24: 310
A25: protectionWater | B25: 10 | C25: 5 | D25: 30 | E25: 3 | F25: 100 | G25: 180 | H25: 0 | I25: 235 | J25: 235 | K25: 300 | L25: 200 | M25: 200 | N25: 200 | O25: 200 | P25: 0 | Q25: 400 | R25: 0 | S25: 0 | T25: 0 | U25: 235 | V25: 225 | W25: 220 | X25: 120 | Y25: 120 | Z25: 0 | AA25: 120 | AB25: 0 | AC25: 320
A26: protectionAir | B26: 10 | C26: 5 | D26: 30 | E26: 3 | F26: 100 | G26: 195 | H26: 0 | I26: 250 | J26: 250 | K26: 310 | L26: 210 | M26: 210 | N26: 210 | O26: 210 | P26: 0 | Q26: 410 | R26: 0 | S26: 0 | T26: 0 | U26: 250 | V26: 235 | W26: 230 | X26: 130 | Y26: 130 | Z26: 0 | AA26: 130 | AB26: 0 | AC26: 330
A27: protectionEarth | B27: 20 | C27: 5 | D27: 30 | E27: 3 | F27: 100 | G27: 210 | H27: 0 | I27: 265 | J27: 265 | K27: 320 | L27: 220 | M27: 220 | N27: 220 | O27: 220 | P27: 0 | Q27: 420 | R27: 0 | S27: 0 | T27: 0 | U27: 265 | V27: 245 | W27: 240 | X27: 140 | Y27: 140 | Z27: 0 | AA27: 140 | AB27: 0 | AC27: 340
A28: protectionAstral | B28: 10 | C28: 5 | D28: 20 | E28: 3 | F28: 100 | G28: 220 | H28: 0 | I28: 275 | J28: 275 | K28: 325 | L28: 225 | M28: 225 | N28: 225 | O28: 225 | P28: 0 | Q28: 425 | R28: 0 | S28: 0 | T28: 0 | U28: 275 | V28: 255 | W28: 245 | X28: 145 | Y28: 145 | Z28: 0 | AA28: 145 | AB28: 0 | AC28: 345
A29: fighterSkill0 | B29: 10 | C29: 1 | D29: 20 | E29: -1 | F29: 100 | G29: 220 | H29: 0 | I29: 275 | J29: 275 | K29: 325 | L29: 225 | M29: 225 | N29: 225 | O29: 225 | P29: 0 | Q29: 425 | R29: 0 | S29: 0 | T29: 0 | U29: 275 | V29: 255 | W29: 245 | X29: 145 | Y29: 145 | Z29: 0 | AA29: 145 | AB29: 0 | AC29: 345
A30: skillBlade | B30: 40 | C30: 1 | D30: 15 | E30: 1 | F30: 100 | G30: 220 | H30: 0 | I30: 285 | J30: 285 | K30: 335 | L30: 235 | M30: 235 | N30: 235 | O30: 235 | P30: 0 | Q30: 435 | R30: 0 | S30: 0 | T30: 0 | U30: 285 | V30: 265 | W30: 245 | X30: 145 | Y30: 145 | Z30: 0 | AA30: 145 | AB30: 0 | AC30: 345
A31: skillAxe | B31: 40 | C31: 1 | D31: 15 | E31: 1 | F31: 100 | G31: 220 | H31: 0 | I31: 295 | J31: 295 | K31: 345 | L31: 245 | M31: 245 | N31: 245 | O31: 245 | P31: 0 | Q31: 445 | R31: 0 | S31: 0 | T31: 0 | U31: 295 | V31: 275 | W31: 245 | X31: 145 | Y31: 145 | Z31: 0 | AA31: 145 | AB31: 0 | AC31: 345
A32: skillBludgeon | B32: 40 | C32: 1 | D32: 15 | E32: 1 | F32: 100 | G32: 220 | H32: 0 | I32: 305 | J32: 305 | K32: 355 | L32: 255 | M32: 255 | N32: 255 | O32: 255 | P32: 0 | Q32: 455 | R32: 0 | S32: 0 | T32: 0 | U32: 305 | V32: 285 | W32: 245 | X32: 145 | Y32: 145 | Z32: 0 | AA32: 145 | AB32: 0 | AC32: 345
A33: skillPike | B33: 40 | C33: 1 | D33: 15 | E33: 1 | F33: 100 | G33: 220 | H33: 0 | I33: 315 | J33: 315 | K33: 365 | L33: 265 | M33: 265 | N33: 265 | O33: 265 | P33: 0 | Q33: 465 | R33: 0 | S33: 0 | T33: 0 | U33: 315 | V33: 295 | W33: 245 | X33: 145 | Y33: 145 | Z33: 0 | AA33: 145 | AB33: 0 | AC33: 345
A34: skillShooting | B34: 40 | C34: 1 | D34: 15 | E34: 1 | F34: 100 | G34: 220 | H34: 0 | I34: 325 | J34: 325 | K34: 375 | L34: 275 | M34: 275 | N34: 275 | O34: 275 | P34: 0 | Q34: 475 | R34: 0 | S34: 0 | T34: 0 | U34: 325 | V34: 305 | W34: 245 | X34: 145 | Y34: 145 | Z34: 0 | AA34: 145 | AB34: 0 | AC34: 345
A35: mageSkill0 | B35: 10 | C35: 1 | D35: 20 | E35: -1 | F35: 100 | G35: 220 | H35: 0 | I35: 325 | J35: 325 | K35: 375 | L35: 275 | M35: 275 | N35: 275 | O35: 275 | P35: 0 | Q35: 475 | R35: 0 | S35: 0 | T35: 0 | U35: 325 | V35: 305 | W35: 245 | X35: 145 | Y35: 145 | Z35: 0 | AA35: 145 | AB35: 0 | AC35: 345
A36: skillFire | B36: 40 | C36: 1 | D36: 20 | E36: 2 | F36: 100 | G36: 220 | H36: 0 | I36: 335 | J36: 335 | K36: 375 | L36: 275 | M36: 275 | N36: 275 | O36: 275 | P36: 0 | Q36: 475 | R36: 0 | S36: 0 | T36: 0 | U36: 335 | V36: 315 | W36: 255 | X36: 155 | Y36: 155 | Z36: 0 | AA36: 155 | AB36: 0 | AC36: 355
A37: skillWater | B37: 40 | C37: 1 | D37: 20 | E37: 2 | F37: 100 | G37: 220 | H37: 0 | I37: 345 | J37: 345 | K37: 375 | L37: 275 | M37: 275 | N37: 275 | O37: 275 | P37: 0 | Q37: 475 | R37: 0 | S37: 0 | T37: 0 | U37: 345 | V37: 325 | W37: 265 | X37: 165 | Y37: 165 | Z37: 0 | AA37: 165 | AB37: 0 | AC37: 365
A38: skillAir | B38: 40 | C38: 1 | D38: 20 | E38: 2 | F38: 100 | G38: 220 | H38: 0 | I38: 355 | J38: 355 | K38: 375 | L38: 275 | M38: 275 | N38: 275 | O38: 275 | P38: 0 | Q38: 475 | R38: 0 | S38: 0 | T38: 0 | U38: 355 | V38: 335 | W38: 275 | X38: 175 | Y38: 175 | Z38: 0 | AA38: 175 | AB38: 0 | AC38: 375
A39: skillEarth | B39: 40 | C39: 1 | D39: 20 | E39: 2 | F39: 100 | G39: 220 | H39: 0 | I39: 365 | J39: 365 | K39: 375 | L39: 275 | M39: 275 | N39: 275 | O39: 275 | P39: 0 | Q39: 475 | R39: 0 | S39: 0 | T39: 0 | U39: 365 | V39: 345 | W39: 285 | X39: 185 | Y39: 185 | Z39: 0 | AA39: 185 | AB39: 0 | AC39: 385
A40: skillAstral | B40: 40 | C40: 1 | D40: 20 | E40: 2 | F40: 100 | G40: 220 | H40: 0 | I40: 375 | J40: 375 | K40: 375 | L40: 275 | M40: 275 | N40: 275 | O40: 275 | P40: 0 | Q40: 475 | R40: 0 | S40: 0 | T40: 0 | U40: 375 | V40: 355 | W40: 295 | X40: 195 | Y40: 195 | Z40: 0 | AA40: 195 | AB40: 0 | AC40: 395
A41: itemLore | B41: -1 | C41: -1 | D41: 0 | E41: -1 | F41: 100 | G41: 220 | H41: 0 | I41: 375 | J41: 375 | K41: 375 | L41: 275 | M41: 275 | N41: 275 | O41: 275 | P41: 0 | Q41: 475 | R41: 0 | S41: 0 | T41: 0 | U41: 375 | V41: 355 | W41: 295 | X41: 195 | Y41: 195 | Z41: 0 | AA41: 195 | AB41: 0 | AC41: 395
A42: magicLore | B42: -1 | C42: -1 | D42: 0 | E42: -1 | F42: 100 | G42: 220 | H42: 0 | I42: 375 | J42: 375 | K42: 375 | L42: 275 | M42: 275 | N42: 275 | O42: 275 | P42: 0 | Q42: 475 | R42: 0 | S42: 0 | T42: 0 | U42: 375 | V42: 355 | W42: 295 | X42: 195 | Y42: 195 | Z42: 0 | AA42: 195 | AB42: 0 | AC42: 395
A43: creatureLore | B43: -1 | C43: -1 | D43: 0 | E43: -1 | F43: 100 | G43: 220 | H43: 0 | I43: 375 | J43: 375 | K43: 375 | L43: 275 | M43: 275 | N43: 275 | O43: 275 | P43: 0 | Q43: 475 | R43: 0 | S43: 0 | T43: 0 | U43: 375 | V43: 355 | W43: 295 | X43: 195 | Y43: 195 | Z43: 0 | AA43: 195 | AB43: 0 | AC43: 395
A44: castSpell | B44: 1 | C44: -1 | D44: 0 | E44: 3 | F44: 130 | G44: 220 | H44: 0 | I44: 375 | J44: 375 | K44: 375 | L44: 275 | M44: 275 | N44: 275 | O44: 275 | P44: 0 | Q44: 475 | R44: 100 | S44: 0 | T44: 0 | U44: 375 | V44: 355 | W44: 295 | X44: 195 | Y44: 195 | Z44: 0 | AA44: 195 | AB44: 0 | AC44: 395
A45: teachSpell | B45: -1 | C45: -1 | D45: 0 | E45: 2 | F45: 130 | G45: 220 | H45: 0 | I45: 375 | J45: 375 | K45: 375 | L45: 275 | M45: 275 | N45: 275 | O45: 275 | P45: 0 | Q45: 475 | R45: 100 | S45: 0 | T45: 0 | U45: 375 | V45: 355 | W45: 295 | X45: 195 | Y45: 195 | Z45: 0 | AA45: 195 | AB45: 0 | AC45: 395
A46: damage | B46: -1 | C46: -1 | D46: -1 | E46: -1 | F46: 130 | G46: 220 | H46: 0 | I46: 375 | J46: 375 | K46: 375 | L46: 275 | M46: 275 | N46: 275 | O46: 275 | P46: 0 | Q46: 475 | R46: 100 | S46: 0 | T46: 0 | U46: 375 | V46: 355 | W46: 295 | X46: 195 | Y46: 195 | Z46: 0 | AA46: 195 | AB46: 0 | AC46: 395
A47: damageFire | B47: 15 | C47: 5 | D47: 50 | E47: 1 | F47: 140 | G47: 220 | H47: 0 | I47: 375 | J47: 375 | K47: 375 | L47: 275 | M47: 275 | N47: 275 | O47: 275 | P47: 0 | Q47: 475 | R47: 100 | S47: 0 | T47: 0 | U47: 375 | V47: 355 | W47: 295 | X47: 195 | Y47: 195 | Z47: 0 | AA47: 195 | AB47: 0 | AC47: 395
A48: damageWater | B48: 15 | C48: 5 | D48: 50 | E48: 1 | F48: 150 | G48: 220 | H48: 0 | I48: 375 | J48: 375 | K48: 375 | L48: 275 | M48: 275 | N48: 275 | O48: 275 | P48: 0 | Q48: 475 | R48: 100 | S48: 0 | T48: 0 | U48: 375 | V48: 355 | W48: 295 | X48: 195 | Y48: 195 | Z48: 0 | AA48: 195 | AB48: 0 | AC48: 395
A49: damageAir | B49: 15 | C49: 5 | D49: 50 | E49: 1 | F49: 160 | G49: 220 | H49: 0 | I49: 375 | J49: 375 | K49: 375 | L49: 275 | M49: 275 | N49: 275 | O49: 275 | P49: 0 | Q49: 475 | R49: 100 | S49: 0 | T49: 0 | U49: 375 | V49: 355 | W49: 295 | X49: 195 | Y49: 195 | Z49: 0 | AA49: 195 | AB49: 0 | AC49: 395
A50: damageEarth | B50: 15 | C50: 5 | D50: 50 | E50: 1 | F50: 170 | G50: 220 | H50: 0 | I50: 375 | J50: 375 | K50: 375 | L50: 275 | M50: 275 | N50: 275 | O50: 275 | P50: 0 | Q50: 475 | R50: 100 | S50: 0 | T50: 0 | U50: 375 | V50: 355 | W50: 295 | X50: 195 | Y50: 195 | Z50: 0 | AA50: 195 | AB50: 0 | AC50: 395
A51: damageAstral | B51: 15 | C51: 5 | D51: 30 | E51: 1 | F51: 175 | G51: 220 | H51: 0 | I51: 375 | J51: 375 | K51: 375 | L51: 275 | M51: 275 | N51: 275 | O51: 275 | P51: 0 | Q51: 475 | R51: 100 | S51: 0 | T51: 0 | U51: 375 | V51: 355 | W51: 295 | X51: 195 | Y51: 195 | Z51: 0 | AA51: 195 | AB51: 0 | AC51: 395
A52: damageBonus | B52: 40 | C52: 5 | D52: 30 | E52: 1 | F52: 275 | G52: 240 | H52: 0 | I52: 375 | J52: 375 | K52: 375 | L52: 275 | M52: 275 | N52: 275 | O52: 275 | P52: 0 | Q52: 475 | R52: 100 | S52: 0 | T52: 0 | U52: 375 | V52: 355 | W52: 295 | X52: 195 | Y52: 195 | Z52: 0 | AA52: 195 | AB52: 0 | AC52: 395

Sheet: armours
A1: NAME | B1: SHAPE | C1: MATERIAL | D1: PRICE | E1: WEIGHT | F1: SLOT | G1: ATTACKTYPE | H1: PHYSICALMIN | I1: PHYSICALMAX | J1: TOHIT | K1: DEFENCE | L1: ABSORBTION | M1: RANGE | N1: CHARGE | O1: RELAX | P1: TWOHANDED | Q1: SUITABLEFOR | R1: OTHERPARAM | S1: SHAPESALLOWED
A2: name | B2: shape | C2: material | D2: price | E2: weight | F2: slot | G2: attackType | H2: physicalMin | I2: physicalMax | J2: toHit | K2: defence | L2: absorbtion | M2: range | N2: charge | O2: relax | P2: twoHanded | Q2: suitableFor | R2: otherParam | S2: shapesAllowed | T2: задано
A3: Ring | B3: 0 | C3: 0 | D3: 50 | E3: 3 | F3: 4 | G3: -1 | H3: 0 | I3: 0 | J3: 0 | K3: 2 | L3: 0 | M3: -1 | N3: -1 | O3: -1 | P3: -1 | Q3: 3 | R3: -1 | S3: [3] | T3: =COUNTIF(shapesAllowed_armours!C[-19],RC[-1]) -> 11
A4: Amulet | B4: 0 | C4: 0 | D4: 100 | E4: 5 | F4: 5 | G4: -1 | H4: 0 | I4: 0 | J4: 0 | K4: 3 | L4: 0 | M4: -1 | N4: -1 | O4: -1 | P4: -1 | Q4: 3 | R4: -1 | S4: [4] | T4: =COUNTIF(shapesAllowed_armours!C[-19],RC[-1]) -> 14
A5: Hat | B5: 0 | C5: 0 | D5: 1600 | E5: 25 | F5: 6 | G5: -1 | H5: 0 | I5: 0 | J5: 0 | K5: 40 | L5: 0 | M5: -1 | N5: -1 | O5: -1 | P5: -1 | Q5: 2 | R5: 5 | S5: [5] | T5: =COUNTIF(shapesAllowed_armours!C[-19],RC[-1]) -> 5
A6: Cap | B6: 0 | C6: 0 | D6: 10 | E6: 15 | F6: 6 | G6: -1 | H6: 0 | I6: 0 | J6: 0 | K6: 10 | L6: 0 | M6: -1 | N6: -1 | O6: -1 | P6: -1 | Q6: 2 | R6: 1 | S6: [6] | T6: =COUNTIF(shapesAllowed_armours!C[-19],RC[-1]) -> 6
A7: Low Hat | B7: 0 | C7: 0 | D7: 100 | E7: 20 | F7: 6 | G7: -1 | H7: 0 | I7: 0 | J7: 0 | K7: 22 | L7: 0 | M7: -1 | N7: -1 | O7: -1 | P7: -1 | Q7: 2 | R7: 3 | S7: [7] | T7: =COUNTIF(shapesAllowed_armours!C[-19],RC[-1]) -> 5
A8: Helm | B8: 0 | C8: 0 | D8: 170 | E8: 20 | F8: 6 | G8: -1 | H8: 0 | I8: 0 | J8: 0 | K8: 24 | L8: 0 | M8: -1 | N8: -1 | O8: -1 | P8: -1 | Q8: 1 | R8: -1 | S8: [8] | T8: =COUNTIF(shapesAllowed_armours!C[-19],RC[-1]) -> 12
A9: Soft Helm | B9: 0 | C9: 0 | D9: 100 | E9: 20 | F9: 6 | G9: -1 | H9: 0 | I9: 0 | J9: 0 | K9: 21 | L9: 0 | M9: -1 | N9: -1 | O9: -1 | P9: -1 | Q9: 1 | R9: -1 | S9: [9] | T9: =COUNTIF(shapesAllowed_armours!C[-19],RC[-1]) -> 5
A10: Chain Helm | B10: 0 | C10: 0 | D10: 140 | E10: 20 | F10: 6 | G10: -1 | H10: 0 | I10: 0 | J10: 0 | K10: 23 | L10: 0 | M10: -1 | N10: -1 | O10: -1 | P10: -1 | Q10: 1 | R10: -1 | S10: [10] | T10: =COUNTIF(shapesAllowed_armours!C[-19],RC[-1]) -> 3
A11: Full Helm | B11: 0 | C11: 0 | D11: 225 | E11: 30 | F11: 6 | G11: -1 | H11: 0 | I11: 0 | J11: 0 | K11: 26 | L11: 0 | M11: -1 | N11: -1 | O11: -1 | P11: -1 | Q11: 1 | R11: -1 | S11: [11] | T11: =COUNTIF(shapesAllowed_armours!C[-19],RC[-1]) -> 11
A12: Plate Helm | B12: 0 | C12: 0 | D12: 450 | E12: 40 | F12: 6 | G12: -1 | H12: 0 | I12: 0 | J12: 0 | K12: 28 | L12: 1 | M12: -1 | N12: -1 | O12: -1 | P12: -1 | Q12: 1 | R12: -1 | S12: [12] | T12: =COUNTIF(shapesAllowed_armours!C[-19],RC[-1]) -> 9
A13: Cloak | B13: 0 | C13: 0 | D13: 150 | E13: 30 | F13: 8 | G13: -1 | H13: 0 | I13: 0 | J13: 0 | K13: 28 | L13: 0 | M13: -1 | N13: -1 | O13: -1 | P13: -1 | Q13: 2 | R13: 3 | S13: [13] | T13: =COUNTIF(shapesAllowed_armours!C[-19],RC[-1]) -> 5
A14: Cape | B14: 0 | C14: 0 | D14: 1200 | E14: 40 | F14: 8 | G14: -1 | H14: 0 | I14: 0 | J14: 0 | K14: 48 | L14: 0 | M14: -1 | N14: -1 | O14: -1 | P14: -1 | Q14: 2 | R14: 6 | S14: [14] | T14: =COUNTIF(shapesAllowed_armours!C[-19],RC[-1]) -> 5
A15: Robe | B15: 0 | C15: 0 | D15: 125 | E15: 40 | F15: 7 | G15: -1 | H15: 0 | I15: 0 | J15: 0 | K15: 40 | L15: 0 | M15: -1 | N15: -1 | O15: -1 | P15: -1 | Q15: 2 | R15: 5 | S15: [15] | T15: =COUNTIF(shapesAllowed_armours!C[-19],RC[-1]) -> 4
A16: Dress | B16: 0 | C16: 0 | D16: 2000 | E16: 60 | F16: 7 | G16: -1 | H16: 0 | I16: 0 | J16: 0 | K16: 79 | L16: 0 | M16: -1 | N16: -1 | O16: -1 | P16: -1 | Q16: 2 | R16: 10 | S16: [16] | T16: =COUNTIF(shapesAllowed_armours!C[-19],RC[-1]) -> 7
A17: Soft Mail | B17: 0 | C17: 0 | D17: 300 | E17: 40 | F17: 7 | G17: -1 | H17: 0 | I17: 0 | J17: 0 | K17: 30 | L17: 0 | M17: -1 | N17: -1 | O17: -1 | P17: -1 | Q17: 1 | R17: -1 | S17: [17] | T17: =COUNTIF(shapesAllowed_armours!C[-19],RC[-1]) -> 5
A18: Chain Mail | B18: 0 | C18: 0 | D18: 170 | E18: 40 | F18: 7 | G18: -1 | H18: 0 | I18: 0 | J18: 0 | K18: 26 | L18: 0 | M18: -1 | N18: -1 | O18: -1 | P18: -1 | Q18: 1 | R18: -1 | S18: [18] | T18: =COUNTIF(shapesAllowed_armours!C[-19],RC[-1]) -> 6
A19: Scale Mail | B19: 0 | C19: 0 | D19: 350 | E19: 60 | F19: 7 | G19: -1 | H19: 0 | I19: 0 | J19: 0 | K19: 32 | L19: 0 | M19: -1 | N19: -1 | O19: -1 | P19: -1 | Q19: 1 | R19: -1 | S19: [19] | T19: =COUNTIF(shapesAllowed_armours!C[-19],RC[-1]) -> 6
A20: Cuirass | B20: 0 | C20: 0 | D20: 250 | E20: 75 | F20: 8 | G20: -1 | H20: 0 | I20: 0 | J20: 0 | K20: 41 | L20: 1 | M20: -1 | N20: -1 | O20: -1 | P20: -1 | Q20: 1 | R20: -1 | S20: [20] | T20: =COUNTIF(shapesAllowed_armours!C[-19],RC[-1]) -> 10
A21: Plate Cuirass | B21: 0 | C21: 0 | D21: 700 | E21: 100 | F21: 8 | G21: -1 | H21: 0 | I21: 0 | J21: 0 | K21: 46 | L21: 2 | M21: -1 | N21: -1 | O21: -1 | P21: -1 | Q21: 1 | R21: -1 | S21: [21] | T21: =COUNTIF(shapesAllowed_armours!C[-19],RC[-1]) -> 10
A22: Bracers | B22: 0 | C22: 0 | D22: 100 | E22: 15 | F22: 9 | G22: -1 | H22: 0 | I22: 0 | J22: 0 | K22: 18 | L22: 0 | M22: -1 | N22: -1 | O22: -1 | P22: -1 | Q22: 1 | R22: -1 | S22: [22] | T22: =COUNTIF(shapesAllowed_armours!C[-19],RC[-1]) -> 6
A23: Soft Bracers | B23: 0 | C23: 0 | D23: 64 | E23: 15 | F23: 9 | G23: -1 | H23: 0 | I23: 0 | J23: 0 | K23: 15 | L23: 0 | M23: -1 | N23: -1 | O23: -1 | P23: -1 | Q23: 1 | R23: -1 | S23: [23] | T23: =COUNTIF(shapesAllowed_armours!C[-19],RC[-1]) -> 5
A24: Plate Bracers | B24: 0 | C24: 0 | D24: 300 | E24: 40 | F24: 9 | G24: -1 | H24: 0 | I24: 0 | J24: 0 | K24: 20 | L24: 1 | M24: -1 | N24: -1 | O24: -1 | P24: -1 | Q24: 1 | R24: -1 | S24: [24] | T24: =COUNTIF(shapesAllowed_armours!C[-19],RC[-1]) -> 9
A25: Gloves | B25: 0 | C25: 0 | D25: 800 | E25: 5 | F25: 10 | G25: -1 | H25: 0 | I25: 0 | J25: 0 | K25: 20 | L25: 0 | M25: -1 | N25: -1 | O25: -1 | P25: -1 | Q25: 2 | R25: 2 | S25: [25] | T25: =COUNTIF(shapesAllowed_armours!C[-19],RC[-1]) -> 5
A26: Soft Gauntlets | B26: 0 | C26: 0 | D26: 64 | E26: 8 | F26: 10 | G26: -1 | H26: 0 | I26: 0 | J26: 0 | K26: 10 | L26: 0 | M26: -1 | N26: -1 | O26: -1 | P26: -1 | Q26: 1 | R26: -1 | S26: [26] | T26: =COUNTIF(shapesAllowed_armours!C[-19],RC[-1]) -> 5
A27: Chain Gauntlets | B27: 0 | C27: 0 | D27: 125 | E27: 8 | F27: 10 | G27: -1 | H27: 0 | I27: 0 | J27: 0 | K27: 11 | L27: 0 | M27: -1 | N27: -1 | O27: -1 | P27: -1 | Q27: 1 | R27: -1 | S27: [27] | T27: =COUNTIF(shapesAllowed_armours!C[-19],RC[-1]) -> 3
A28: Scale Gauntlets | B28: 0 | C28: 0 | D28: 200 | E28: 10 | F28: 10 | G28: -1 | H28: 0 | I28: 0 | J28: 0 | K28: 13 | L28: 0 | M28: -1 | N28: -1 | O28: -1 | P28: -1 | Q28: 1 | R28: -1 | S28: [28] | T28: =COUNTIF(shapesAllowed_armours!C[-19],RC[-1]) -> 9
A29: Shoes | B29: 0 | C29: 0 | D29: 1000 | E29: 15 | F29: 12 | G29: -1 | H29: 0 | I29: 0 | J29: 0 | K29: 28 | L29: 0 | M29: -1 | N29: -1 | O29: -1 | P29: -1 | Q29: 2 | R29: 3 | S29: [29] | T29: =COUNTIF(shapesAllowed_armours!C[-19],RC[-1]) -> 5
A30: Soft Boots | B30: 0 | C30: 0 | D30: 100 | E30: 15 | F30: 12 | G30: -1 | H30: 0 | I30: 0 | J30: 0 | K30: 21 | L30: 0 | M30: -1 | N30: -1 | O30: -1 | P30: -1 | Q30: 1 | R30: -1 | S30: [30] | T30: =COUNTIF(shapesAllowed_armours!C[-19],RC[-1]) -> 6
A31: Chain Boots | B31: 0 | C31: 0 | D31: 140 | E31: 30 | F31: 12 | G31: -1 | H31: 0 | I31: 0 | J31: 0 | K31: 23 | L31: 0 | M31: -1 | N31: -1 | O31: -1 | P31: -1 | Q31: 1 | R31: -1 | S31: [31] | T31: =COUNTIF(shapesAllowed_armours!C[-19],RC[-1]) -> 3
A32: Plate Boots | B32: 0 | C32: 0 | D32: 400 | E32: 50 | F32: 12 | G32: -1 | H32: 0 | I32: 0 | J32: 0 | K32: 28 | L32: 1 | M32: -1 | N32: -1 | O32: -1 | P32: -1 | Q32: 1 | R32: -1 | S32: [32] | T32: =COUNTIF(shapesAllowed_armours!C[-19],RC[-1]) -> 9

Sheet: shapesAllowed_armours
A1: PARENTID | B1: FIRST | C1: SECOND
A2: ParentID | B2: first | C2: second
A3: [3] | B3: Elven | C3: Adamantium
A4: [3] | B4: Elven | C4: Meteoric
A5: [3] | B5: Elven | C5: Mithrill
A6: [3] | B6: Rare | C6: Adamantium
A7: [3] | B7: Rare | C7: Mithrill
A8: [3] | B8: Rare | C8: Silver
A9: [3] | B9: Uncommon | C9: Silver
A10: [3] | B10: Very Rare | C10: Adamantium
A11: [3] | B11: Very Rare | C11: Crystal
A12: [3] | B12: Very Rare | C12: Gold
A13: [3] | B13: Very Rare | C13: Meteoric
A14: [4] | B14: Common | C14: Bronze
A15: [4] | B15: Common | C15: Iron
A16: [4] | B16: Elven | C16: Adamantium
A17: [4] | B17: Elven | C17: Gold
A18: [4] | B18: Elven | C18: Meteoric
A19: [4] | B19: Elven | C19: Mithrill
A20: [4] | B20: Rare | C20: Adamantium
A21: [4] | B21: Rare | C21: Mithrill
A22: [4] | B22: Rare | C22: Silver
A23: [4] | B23: Uncommon | C23: Silver
A24: [4] | B24: Very Rare | C24: Adamantium
A25: [4] | B25: Very Rare | C25: Crystal
A26: [4] | B26: Very Rare | C26: Gold
A27: [4] | B27: Very Rare | C27: Meteoric
A28: [5] | B28: Common | C28: None
A29: [5] | B29: Elven | C29: None
A30: [5] | B30: Rare | C30: None
A31: [5] | B31: Uncommon | C31: None
A32: [5] | B32: Very Rare | C32: None
A33: [6] | B33: Common | C33: None
A34: [6] | B34: Elven | C34: None
A35: [6] | B35: Good | C35: None
A36: [6] | B36: Rare | C36: None
A37: [6] | B37: Uncommon | C37: None
A38: [6] | B38: Very Rare | C38: None
A39: [7] | B39: Common | C39: None
A40: [7] | B40: Elven | C40: None
A41: [7] | B41: Rare | C41: None
A42: [7] | B42: Uncommon | C42: None
A43: [7] | B43: Very Rare | C43: None
A44: [8] | B44: Common | C44: Bronze
A45: [8] | B45: Common | C45: Iron
A46: [8] | B46: Elven | C46: Adamantium
A47: [8] | B47: Elven | C47: Meteoric
A48: [8] | B48: Elven | C48: Mithrill
A49: [8] | B49: Good | C49: Gold
A50: [8] | B50: Rare | C50: Adamantium
A51: [8] | B51: Rare | C51: Mithrill
A52: [8] | B52: Uncommon | C52: Bronze
A53: [8] | B53: Uncommon | C53: Steel
A54: [8] | B54: Very Rare | C54: Adamantium
A55: [8] | B55: Very Rare | C55: Meteoric
A56: [9] | B56: Common | C56: Hard Leather
A57: [9] | B57: Common | C57: Leather
A58: [9] | B58: Uncommon | C58: Hard Leather
A59: [9] | B59: Uncommon | C59: Leather
A60: [9] | B60: Very Rare | C60: Dragon Leather
A61: [10] | B61: Rare | C61: Adamantium
A62: [10] | B62: Rare | C62: Mithrill
A63: [10] | B63: Uncommon | C63: Steel
A64: [11] | B64: Elven | C64: Adamantium
A65: [11] | B65: Elven | C65: Meteoric
A66: [11] | B66: Elven | C66: Mithrill
A67: [11] | B67: Good | C67: Gold
A68: [11] | B68: Good | C68: Mithrill
A69: [11] | B69: Rare | C69: Adamantium
A70: [11] | B70: Rare | C70: Mithrill
A71: [11] | B71: Uncommon | C71: Bronze
A72: [11] | B72: Uncommon | C72: Steel
A73: [11] | B73: Very Rare | C73: Adamantium
A74: [11] | B74: Very Rare | C74: Meteoric
A75: [12] | B75: Common | C75: Bronze
A76: [12] | B76: Common | C76: Iron
A77: [12] | B77: Rare | C77: Adamantium
A78: [12] | B78: Rare | C78: Mithrill
A79: [12] | B79: Uncommon | C79: Bronze
A80: [12] | B80: Uncommon | C80: Steel
A81: [12] | B81: Very Rare | C81: Adamantium
A82: [12] | B82: Very Rare | C82: Crystal
A83: [12] | B83: Very Rare | C83: Meteoric
A84: [13] | B84: Bad | C84: None
A85: [13] | B85: Common | C85: None
A86: [13] | B86: Good | C86: None
A87: [13] | B87: Rare | C87: None
A88: [13] | B88: Uncommon | C88: None
A89: [14] | B89: Common | C89: None
A90: [14] | B90: Elven | C90: None
A91: [14] | B91: Rare | C91: None
A92: [14] | B92: Uncommon | C92: None
A93: [14] | B93: Very Rare | C93: None
A94: [15] | B94: Bad | C94: None
A95: [15] | B95: Common | C95: None
A96: [15] | B96: Rare | C96: None
A97: [15] | B97: Uncommon | C97: None
A98: [16] | B98: Bad | C98: None
A99: [16] | B99: Common | C99: None
A100: [16] | B100: Elven | C100: None
A101: [16] | B101: Good | C101: None
A102: [16] | B102: Rare | C102: None
A103: [16] | B103: Uncommon | C103: None
A104: [16] | B104: Very Rare | C104: None
A105: [17] | B105: Common | C105: Hard Leather
A106: [17] | B106: Common | C106: Leather
A107: [17] | B107: Uncommon | C107: Hard Leather
A108: [17] | B108: Uncommon | C108: Leather
A109: [17] | B109: Very Rare | C109: Dragon Leather
A110: [18] | B110: Elven | C110: Adamantium
A111: [18] | B111: Elven | C111: Meteoric
A112: [18] | B112: Elven | C112: Mithrill
A113: [18] | B113: Rare | C113: Adamantium
A114: [18] | B114: Rare | C114: Mithrill
A115: [18] | B115: Uncommon | C115: Steel
A116: [19] | B116: Rare | C116: Adamantium
A117: [19] | B117: Rare | C117: Mithrill
A118: [19] | B118: Uncommon | C118: Bronze
A119: [19] | B119: Uncommon | C119: Steel
A120: [19] | B120: Very Rare | C120: Adamantium
A121: [19] | B121: Very Rare | C121: Meteoric
A122: [20] | B122: Common | C122: Bronze
A123: [20] | B123: Common | C123: Iron
A124: [20] | B124: Good | C124: Mithrill
A125: [20] | B125: Rare | C125: Adamantium
A126: [20] | B126: Rare | C126: Mithrill
A127: [20] | B127: Uncommon | C127: Bronze
A128: [20] | B128: Uncommon | C128: Steel
A129: [20] | B129: Very Rare | C129: Adamantium
A130: [20] | B130: Very Rare | C130: Crystal
A131: [20] | B131: Very Rare | C131: Meteoric
A132: [21] | B132: Common | C132: Bronze
A133: [21] | B133: Common | C133: Iron
A134: [21] | B134: Good | C134: Gold
A135: [21] | B135: Rare | C135: Adamantium
A136: [21] | B136: Rare | C136: Mithrill
A137: [21] | B137: Uncommon | C137: Bronze
A138: [21] | B138: Uncommon | C138: Steel
A139: [21] | B139: Very Rare | C139: Adamantium
A140: [21] | B140: Very Rare | C140: Crystal
A141: [21] | B141: Very Rare | C141: Meteoric
A142: [22] | B142: Common | C142: Bronze
A143: [22] | B143: Common | C143: Iron
A144: [22] | B144: Rare | C144: Adamantium
A145: [22] | B145: Rare | C145: Mithrill
A146: [22] | B146: Uncommon | C146: Bronze
A147: [22] | B147: Uncommon | C147: Steel
A148: [23] | B148: Common | C148: Hard Leather
A149: [23] | B149: Common | C149: Leather
A150: [23] | B150: Uncommon | C150: Hard Leather
A151: [23] | B151: Uncommon | C151: Leather
A152: [23] | B152: Very Rare | C152: Dragon Leather
A153: [24] | B153: Common | C153: Bronze
A154: [24] | B154: Common | C154: Iron
A155: [24] | B155: Rare | C155: Adamantium
A156: [24] | B156: Rare | C156: Mithrill
A157: [24] | B157: Uncommon | C157: Bronze
A158: [24] | B158: Uncommon | C158: Steel
A159: [24] | B159: Very Rare | C159: Adamantium
A160: [24] | B160: Very Rare | C160: Crystal
A161: [24] | B161: Very Rare | C161: Meteoric
A162: [25] | B162: Common | C162: None
A163: [25] | B163: Elven | C163: None
A164: [25] | B164: Rare | C164: None
A165: [25] | B165: Uncommon | C165: None
A166: [25] | B166: Very Rare | C166: None
A167: [26] | B167: Common | C167: Hard Leather
A168: [26] | B168: Common | C168: Leather
A169: [26] | B169: Uncommon | C169: Hard Leather
A170: [26] | B170: Uncommon | C170: Leather
A171: [26] | B171: Very Rare | C171: Dragon Leather
A172: [27] | B172: Rare | C172: Adamantium
A173: [27] | B173: Rare | C173: Mithrill
A174: [27] | B174: Uncommon | C174: Steel
A175: [28] | B175: Common | C175: Bronze
A176: [28] | B176: Common | C176: Iron
A177: [28] | B177: Rare | C177: Adamantium
A178: [28] | B178: Rare | C178: Mithrill
A179: [28] | B179: Uncommon | C179: Bronze
A180: [28] | B180: Uncommon | C180: Steel
A181: [28] | B181: Very Rare | C181: Adamantium
A182: [28] | B182: Very Rare | C182: Crystal
A183: [28] | B183: Very Rare | C183: Meteoric
A184: [29] | B184: Common | C184: None
A185: [29] | B185: Elven | C185: None
A186: [29] | B186: Rare | C186: None
A187: [29] | B187: Uncommon | C187: None
A188: [29] | B188: Very Rare | C188: None
A189: [30] | B189: Common | C189: Hard Leather
A190: [30] | B190: Common | C190: Leather
A191: [30] | B191: Rare | C191: Hard Leather
A192: [30] | B192: Uncommon | C192: Hard Leather
A193: [30] | B193: Uncommon | C193: Leather
A194: [30] | B194: Very Rare | C194: Dragon Leather
A195: [31] | B195: Rare | C195: Adamantium
A196: [31] | B196: Rare | C196: Mithrill
A197: [31] | B197: Uncommon | C197: Steel
A198: [32] | B198: Common | C198: Bronze
A199: [32] | B199: Common | C199: Iron
A200: [32] | B200: Rare | C200: Adamantium
A201: [32] | B201: Rare | C201: Mithrill
A202: [32] | B202: Uncommon | C202: Bronze
A203: [32] | B203: Uncommon | C203: Steel
A204: [32] | B204: Very Rare | C204: Adamantium
A205: [32] | B205: Very Rare | C205: Crystal
A206: [32] | B206: Very Rare | C206: Meteoric

Sheet: shields
A1: NAME | B1: SHAPE | C1: MATERIAL | D1: PRICE | E1: WEIGHT | F1: SLOT | G1: ATTACKTYPE | H1: PHYSICALMIN | I1: PHYSICALMAX | J1: TOHIT | K1: DEFENCE | L1: ABSORBTION | M1: RANGE | N1: CHARGE | O1: RELAX | P1: TWOHANDED | Q1: SUITABLEFOR | R1: OTHERPARAM | S1: SHAPESALLOWED
A2: name | B2: shape | C2: material | D2: price | E2: weight | F2: slot | G2: attackType | H2: physicalMin | I2: physicalMax | J2: toHit | K2: defence | L2: absorbtion | M2: range | N2: charge | O2: relax | P2: twoHanded | Q2: suitableFor | R2: otherParam | S2: shapesAllowed | T2: задано
A3: Buckler | B3: 0 | C3: 0 | D3: 12 | E3: 10 | F3: 2 | G3: -1 | H3: 0 | I3: 0 | J3: 0 | K3: 20 | L3: 0 | M3: -1 | N3: -1 | O3: -1 | P3: -1 | Q3: 1 | R3: -1 | S3: [3] | T3: =COUNTIF(shapesAllowed_shields!C[-19],RC[-1]) -> 2
A4: Small | B4: 0 | C4: 0 | D4: 450 | E4: 20 | F4: 2 | G4: -1 | H4: 0 | I4: 0 | J4: 0 | K4: 49 | L4: 1 | M4: -1 | N4: -1 | O4: -1 | P4: -1 | Q4: 1 | R4: -1 | S4: [4] | T4: =COUNTIF(shapesAllowed_shields!C[-19],RC[-1]) -> 5
A5: Soft Small | B5: 0 | C5: 0 | D5: 350 | E5: 20 | F5: 2 | G5: -1 | H5: 0 | I5: 0 | J5: 0 | K5: 49 | L5: 0 | M5: -1 | N5: -1 | O5: -1 | P5: -1 | Q5: 1 | R5: -1 | S5: [5] | T5: =COUNTIF(shapesAllowed_shields!C[-19],RC[-1]) -> 5
A6: Wooden Small | B6: 0 | C6: 0 | D6: 350 | E6: 20 | F6: 2 | G6: -1 | H6: 0 | I6: 0 | J6: 0 | K6: 49 | L6: 0 | M6: -1 | N6: -1 | O6: -1 | P6: -1 | Q6: 1 | R6: -1 | S6: [6] | T6: =COUNTIF(shapesAllowed_shields!C[-19],RC[-1]) -> 4
A7: Large | B7: 0 | C7: 0 | D7: 1050 | E7: 40 | F7: 2 | G7: -1 | H7: 0 | I7: 0 | J7: 0 | K7: 61 | L7: 1 | M7: -1 | N7: -1 | O7: -1 | P7: -1 | Q7: 1 | R7: -1 | S7: [7] | T7: =COUNTIF(shapesAllowed_shields!C[-19],RC[-1]) -> 5
A8: Soft Large | B8: 0 | C8: 0 | D8: 1350 | E8: 40 | F8: 2 | G8: -1 | H8: 0 | I8: 0 | J8: 0 | K8: 70 | L8: 0 | M8: -1 | N8: -1 | O8: -1 | P8: -1 | Q8: 1 | R8: -1 | S8: [8] | T8: =COUNTIF(shapesAllowed_shields!C[-19],RC[-1]) -> 5
A9: Wooden Large | B9: 0 | C9: 0 | D9: 1050 | E9: 40 | F9: 2 | G9: -1 | H9: 0 | I9: 0 | J9: 0 | K9: 61 | L9: 1 | M9: -1 | N9: -1 | O9: -1 | P9: -1 | Q9: 1 | R9: -1 | S9: [9] | T9: =COUNTIF(shapesAllowed_shields!C[-19],RC[-1]) -> 4
A10: Tower | B10: 0 | C10: 0 | D10: 3200 | E10: 100 | F10: 2 | G10: -1 | H10: 0 | I10: 0 | J10: 0 | K10: 76 | L10: 2 | M10: -1 | N10: -1 | O10: -1 | P10: -1 | Q10: 1 | R10: -1 | S10: [10] | T10: =COUNTIF(shapesAllowed_shields!C[-19],RC[-1]) -> 4
A11: Wooden Tower | B11: 0 | C11: 0 | D11: 2400 | E11: 100 | F11: 2 | G11: -1 | H11: 0 | I11: 0 | J11: 0 | K11: 76 | L11: 1 | M11: -1 | N11: -1 | O11: -1 | P11: -1 | Q11: 1 | R11: -1 | S11: [11] | T11: =COUNTIF(shapesAllowed_shields!C[-19],RC[-1]) -> 3

Sheet: shapesAllowed_shields
A1: PARENTID | B1: FIRST | C1: SECOND
A2: ParentID | B2: first | C2: second
A3: [3] | B3: Common | C3: Bronze
A4: [3] | B4: Common | C4: Iron
A5: [4] | B5: Common | C5: Bronze
A6: [4] | B6: Common | C6: Iron
A7: [4] | B7: Rare | C7: Mithrill
A8: [4] | B8: Uncommon | C8: Bronze
A9: [4] | B9: Uncommon | C9: Steel
A10: [5] | B10: Common | C10: Hard Leather
A11: [5] | B11: Common | C11: Leather
A12: [5] | B12: Uncommon | C12: Hard Leather
A13: [5] | B13: Uncommon | C13: Leather
A14: [5] | B14: Very Rare | C14: Dragon Leather
A15: [6] | B15: Common | C15: Wood
A16: [6] | B16: Rare | C16: Magic Wood
A17: [6] | B17: Uncommon | C17: Magic Wood
A18: [6] | B18: Uncommon | C18: Wood
A19: [7] | B19: Bad | C19: Steel
A20: [7] | B20: Rare | C20: Adamantium
A21: [7] | B21: Rare | C21: Mithrill
A22: [7] | B22: Uncommon | C22: Steel
A23: [7] | B23: Very Rare | C23: Adamantium
A24: [8] | B24: Common | C24: Hard Leather
A25: [8] | B25: Common | C25: Leather
A26: [8] | B26: Uncommon | C26: Hard Leather
A27: [8] | B27: Uncommon | C27: Leather
A28: [8] | B28: Very Rare | C28: Dragon Leather
A29: [9] | B29: Common | C29: Wood
A30: [9] | B30: Rare | C30: Magic Wood
A31: [9] | B31: Uncommon | C31: Magic Wood
A32: [9] | B32: Uncommon | C32: Wood
A33: [10] | B33: Rare | C33: Adamantium
A34: [10] | B34: Rare | C34: Mithrill
A35: [10] | B35: Uncommon | C35: Bronze
A36: [10] | B36: Uncommon | C36: Steel
A37: [11] | B37: Rare | C37: Magic Wood
A38: [11] | B38: Uncommon | C38: Magic Wood
A39: [11] | B39: Uncommon | C39: Wood

Sheet: weapons
A1: NAME | B1: SHAPE | C1: MATERIAL | D1: PRICE | E1: WEIGHT | F1: SLOT | G1: ATTACKTYPE | H1: PHYSICALMIN | I1: PHYSICALMAX | J1: TOHIT | K1: DEFENCE | L1: ABSORBTION | M1: RANGE | N1: CHARGE | O1: RELAX | P1: TWOHANDED | Q1: SUITABLEFOR | R1: OTHERPARAM | S1: SHAPESALLOWED
A2: name | B2: shape | C2: material | D2: price | E2: weight | F2: slot | G2: attackType | H2: physicalMin | I2: physicalMax | J2: toHit | K2: defence | L2: absorbtion | M2: range | N2: charge | O2: relax | P2: twoHanded | Q2: suitableFor | R2: otherParam | S2: shapesAllowed | T2: задано
A3: BareHands | B3: -1 | C3: -1 | D3: 0 | E3: 0 | F3: 1 | G3: 3 | H3: 1 | I3: 2 | J3: 0 | K3: 0 | L3: 0 | M3: -1 | N3: -1 | O3: -1 | P3: -1 | Q3: 3 | R3: -1 | S3: [3] | T3: =COUNTIF(shapesAllowed_weapons!C[-19],RC[-1]) -> 0
A4: Dagger | B4: 0 | C4: 0 | D4: 100 | E4: 5 | F4: 1 | G4: 1 | H4: 18 | I4: 27 | J4: 10 | K4: 0 | L4: 0 | M4: -1 | N4: 7 | O4: 4 | P4: -1 | Q4: 1 | R4: -1 | S4: [4] | T4: =COUNTIF(shapesAllowed_weapons!C[-19],RC[-1]) -> 13
A5: Short Sword | B5: 0 | C5: 0 | D5: 250 | E5: 10 | F5: 1 | G5: 1 | H5: 23 | I5: 40 | J5: 5 | K5: 0 | L5: 0 | M5: -1 | N5: 7 | O5: 4 | P5: -1 | Q5: 1 | R5: -1 | S5: [5] | T5: =COUNTIF(shapesAllowed_weapons!C[-19],RC[-1]) -> 12
A6: Long Sword | B6: 0 | C6: 0 | D6: 600 | E6: 20 | F6: 1 | G6: 1 | H6: 28 | I6: 56 | J6: 3 | K6: 0 | L6: 0 | M6: -1 | N6: 7 | O6: 4 | P6: -1 | Q6: 1 | R6: -1 | S6: [6] | T6: =COUNTIF(shapesAllowed_weapons!C[-19],RC[-1]) -> 13
A7: Bastard Sword | B7: 0 | C7: 0 | D7: 900 | E7: 30 | F7: 1 | G7: 1 | H7: 28 | I7: 67 | J7: 1 | K7: 0 | L7: 0 | M7: -1 | N7: 7 | O7: 4 | P7: -1 | Q7: 1 | R7: -1 | S7: [7] | T7: =COUNTIF(shapesAllowed_weapons!C[-19],RC[-1]) -> 3
A8: Two Handed Sword | B8: 0 | C8: 0 | D8: 800 | E8: 40 | F8: 1 | G8: 1 | H8: 41 | I8: 82 | J8: 3 | K8: 0 | L8: 0 | M8: -1 | N8: 10 | O8: 4 | P8: 2 | Q8: 1 | R8: -1 | S8: [8] | T8: =COUNTIF(shapesAllowed_weapons!C[-19],RC[-1]) -> 13
A9: Club | B9: 0 | C9: 0 | D9: 21 | E9: 8 | F9: 1 | G9: 3 | H9: 13 | I9: 26 | J9: 2 | K9: 0 | L9: 0 | M9: -1 | N9: 7 | O9: 4 | P9: -1 | Q9: 1 | R9: -1 | S9: [9] | T9: =COUNTIF(shapesAllowed_weapons!C[-19],RC[-1]) -> 3
A10: Spiked Club | B10: 0 | C10: 0 | D10: 64 | E10: 10 | F10: 1 | G10: 3 | H10: 17 | I10: 35 | J10: 1 | K10: 0 | L10: 0 | M10: -1 | N10: 7 | O10: 4 | P10: -1 | Q10: 1 | R10: -1 | S10: [10] | T10: =COUNTIF(shapesAllowed_weapons!C[-19],RC[-1]) -> 4
A11: Mace | B11: 0 | C11: 0 | D11: 290 | E11: 20 | F11: 1 | G11: 3 | H11: 26 | I11: 52 | J11: 2 | K11: 0 | L11: 0 | M11: -1 | N11: 7 | O11: 4 | P11: -1 | Q11: 1 | R11: -1 | S11: [11] | T11: =COUNTIF(shapesAllowed_weapons!C[-19],RC[-1]) -> 8
A12: Morning Star | B12: 0 | C12: 0 | D12: 600 | E12: 20 | F12: 1 | G12: 3 | H12: 32 | I12: 63 | J12: 1 | K12: 0 | L12: 0 | M12: -1 | N12: 7 | O12: 4 | P12: -1 | Q12: 1 | R12: -1 | S12: [12] | T12: =COUNTIF(shapesAllowed_weapons!C[-19],RC[-1]) -> 8
A13: Pick Hammer | B13: 0 | C13: 0 | D13: 460 | E13: 35 | F13: 1 | G13: 3 | H13: 35 | I13: 70 | J13: 1 | K13: 0 | L13: 0 | M13: -1 | N13: 7 | O13: 4 | P13: -1 | Q13: 1 | R13: -1 | S13: [13] | T13: =COUNTIF(shapesAllowed_weapons!C[-19],RC[-1]) -> 4
A14: War Hammer | B14: 0 | C14: 0 | D14: 800 | E14: 70 | F14: 1 | G14: 3 | H14: 40 | I14: 105 | J14: 0 | K14: 0 | L14: 0 | M14: -1 | N14: 10 | O14: 4 | P14: 2 | Q14: 1 | R14: -1 | S14: [14] | T14: =COUNTIF(shapesAllowed_weapons!C[-19],RC[-1]) -> 8
A15: Staff | B15: 0 | C15: 0 | D15: 1000 | E15: 10 | F15: 1 | G15: 3 | H15: 0 | I15: 0 | J15: 0 | K15: 0 | L15: 0 | M15: 6 | N15: 8 | O15: 4 | P15: 2 | Q15: 2 | R15: -1 | S15: [15] | T15: =COUNTIF(shapesAllowed_weapons!C[-19],RC[-1]) -> 7
A16: Shaman Staff | B16: 0 | C16: 0 | D16: 500 | E16: 10 | F16: 1 | G16: 3 | H16: 0 | I16: 0 | J16: 0 | K16: 0 | L16: 0 | M16: 5 | N16: 8 | O16: 4 | P16: 2 | Q16: 2 | R16: -1 | S16: [16] | T16: =COUNTIF(shapesAllowed_weapons!C[-19],RC[-1]) -> 6
A17: Pike | B17: 0 | C17: 0 | D17: 600 | E17: 20 | F17: 1 | G17: 4 | H17: 28 | I17: 56 | J17: 1 | K17: 6 | L17: 0 | M17: -1 | N17: 6 | O17: 4 | P17: -1 | Q17: 1 | R17: -1 | S17: [17] | T17: =COUNTIF(shapesAllowed_weapons!C[-19],RC[-1]) -> 9
A18: Halberd | B18: 0 | C18: 0 | D18: 800 | E18: 35 | F18: 1 | G18: 4 | H18: 29 | I18: 58 | J18: 0 | K18: 10 | L18: 0 | M18: -1 | N18: 6 | O18: 4 | P18: -1 | Q18: 1 | R18: -1 | S18: [18] | T18: =COUNTIF(shapesAllowed_weapons!C[-19],RC[-1]) -> 5
A19: Lance | B19: 0 | C19: 0 | D19: 1600 | E19: 60 | F19: 1 | G19: 4 | H19: 36 | I19: 71 | J19: 0 | K19: 10 | L19: 0 | M19: -1 | N19: 6 | O19: 4 | P19: -1 | Q19: 1 | R19: -1 | S19: [19] | T19: =COUNTIF(shapesAllowed_weapons!C[-19],RC[-1]) -> 2
A20: Axe | B20: 0 | C20: 0 | D20: 700 | E20: 30 | F20: 1 | G20: 2 | H20: 30 | I20: 65 | J20: 0 | K20: 0 | L20: 0 | M20: -1 | N20: 8 | O20: 4 | P20: -1 | Q20: 1 | R20: -1 | S20: [20] | T20: =COUNTIF(shapesAllowed_weapons!C[-19],RC[-1]) -> 10
A21: Two Handed Axe | B21: 0 | C21: 0 | D21: 900 | E21: 60 | F21: 1 | G21: 2 | H21: 48 | I21: 97 | J21: 0 | K21: 0 | L21: 0 | M21: -1 | N21: 10 | O21: 4 | P21: 2 | Q21: 1 | R21: -1 | S21: [21] | T21: =COUNTIF(shapesAllowed_weapons!C[-19],RC[-1]) -> 9
A22: Short Bow | B22: 0 | C22: 0 | D22: 800 | E22: 5 | F22: 1 | G22: 5 | H22: 18 | I22: 36 | J22: 8 | K22: 0 | L22: 0 | M22: 4 | N22: 20 | O22: 5 | P22: 2 | Q22: 1 | R22: -1 | S22: [22] | T22: =COUNTIF(shapesAllowed_weapons!C[-19],RC[-1]) -> 5
A23: Long Bow | B23: 0 | C23: 0 | D23: 4200 | E23: 10 | F23: 1 | G23: 5 | H23: 31 | I23: 61 | J23: 5 | K23: 0 | L23: 0 | M23: 5 | N23: 20 | O23: 5 | P23: 2 | Q23: 1 | R23: -1 | S23: [23] | T23: =COUNTIF(shapesAllowed_weapons!C[-19],RC[-1]) -> 6
A24: Crossbow | B24: 0 | C24: 0 | D24: 2000 | E24: 40 | F24: 1 | G24: 5 | H24: 26 | I24: 52 | J24: 2 | K24: 0 | L24: 0 | M24: 6 | N24: 8 | O24: 16 | P24: 2 | Q24: 1 | R24: -1 | S24: [24] | T24: =COUNTIF(shapesAllowed_weapons!C[-19],RC[-1]) -> 6
A25: rem | B25: -1 | C25: -1 | D25: -1 | E25: -1 | F25: -1 | G25: -1 | H25: -1 | I25: -1 | J25: -1 | K25: -1 | L25: -1 | M25: -1 | N25: -1 | O25: -1 | P25: -1 | Q25: -1 | R25: -1 | S25: [25] | T25: =COUNTIF(shapesAllowed_weapons!C[-19],RC[-1]) -> 0
A26: Sonic Beam | B26: 0 | C26: 0 | D26: 2000 | E26: 1 | F26: 1 | G26: 5 | H26: 2 | I26: 4 | J26: 5 | K26: 0 | L26: -1 | M26: 4 | N26: -1 | O26: -1 | P26: -1 | Q26: 0 | R26: -1 | S26: [26] | T26: =COUNTIF(shapesAllowed_weapons!C[-19],RC[-1]) -> 0
A27: Flame Thrower | B27: 0 | C27: -805306368 | D27: 7 | E27: 100 | F27: 1 | G27: 11 | H27: 10 | I27: 80 | J27: 2 | K27: 0 | L27: -1 | M27: 8 | N27: -1 | O27: -1 | P27: -1 | Q27: 0 | R27: -1 | S27: [27] | T27: =COUNTIF(shapesAllowed_weapons!C[-19],RC[-1]) -> 0
A28: Boulder Thrower | B28: 0 | C28: -1 | D28: 0 | E28: 900 | F28: 1 | G28: 5 | H28: 0 | I28: 0 | J28: 0 | K28: 0 | L28: -1 | M28: 20 | N28: -1 | O28: -1 | P28: -1 | Q28: 0 | R28: -1 | S28: [28] | T28: =COUNTIF(shapesAllowed_weapons!C[-19],RC[-1]) -> 0
A29: Plasma Sword | B29: 0 | C29: -1 | D29: 0 | E29: 1 | F29: 1 | G29: 1 | H29: 200 | I29: 900 | J29: 20 | K29: 99 | L29: -1 | M29: -1 | N29: -1 | O29: -1 | P29: -1 | Q29: 3 | R29: -1 | S29: [29] | T29: =COUNTIF(shapesAllowed_weapons!C[-19],RC[-1]) -> 0

Sheet: shapesAllowed_weapons
A1: PARENTID | B1: FIRST | C1: SECOND
A2: ParentID | B2: first | C2: second
A3: [4] | B3: Common | C3: Bronze
A4: [4] | B4: Common | C4: Iron
A5: [4] | B5: Elven | C5: Adamantium
A6: [4] | B6: Elven | C6: Meteoric
A7: [4] | B7: Elven | C7: Mithrill
A8: [4] | B8: Rare | C8: Adamantium
A9: [4] | B9: Rare | C9: Mithrill
A10: [4] | B10: Rare | C10: Silver
A11: [4] | B11: Uncommon | C11: Bronze
A12: [4] | B12: Uncommon | C12: Steel
A13: [4] | B13: Very Rare | C13: Adamantium
A14: [4] | B14: Very Rare | C14: Gold
A15: [4] | B15: Very Rare | C15: Meteoric
A16: [5] | B16: Bad | C16: Steel
A17: [5] | B17: Common | C17: Bronze
A18: [5] | B18: Common | C18: Iron
A19: [5] | B19: Elven | C19: Adamantium
A20: [5] | B20: Elven | C20: Meteoric
A21: [5] | B21: Elven | C21: Mithrill
A22: [5] | B22: Rare | C22: Adamantium
A23: [5] | B23: Rare | C23: Mithrill
A24: [5] | B24: Uncommon | C24: Bronze
A25: [5] | B25: Uncommon | C25: Steel
A26: [5] | B26: Very Rare | C26: Adamantium
A27: [5] | B27: Very Rare | C27: Meteoric
A28: [6] | B28: Common | C28: Bronze
A29: [6] | B29: Common | C29: Iron
A30: [6] | B30: Elven | C30: Adamantium
A31: [6] | B31: Elven | C31: Meteoric
A32: [6] | B32: Elven | C32: Mithrill
A33: [6] | B33: Good | C33: Steel
A34: [6] | B34: Rare | C34: Adamantium
A35: [6] | B35: Rare | C35: Mithrill
A36: [6] | B36: Uncommon | C36: Bronze
A37: [6] | B37: Uncommon | C37: Steel
A38: [6] | B38: Very Rare | C38: Adamantium
A39: [6] | B39: Very Rare | C39: Crystal
A40: [6] | B40: Very Rare | C40: Meteoric
A41: [7] | B41: Rare | C41: Adamantium
A42: [7] | B42: Rare | C42: Mithrill
A43: [7] | B43: Uncommon | C43: Steel
A44: [8] | B44: Common | C44: Bronze
A45: [8] | B45: Common | C45: Iron
A46: [8] | B46: Elven | C46: Adamantium
A47: [8] | B47: Elven | C47: Meteoric
A48: [8] | B48: Elven | C48: Mithrill
A49: [8] | B49: Good | C49: Silver
A50: [8] | B50: Rare | C50: Adamantium
A51: [8] | B51: Rare | C51: Mithrill
A52: [8] | B52: Uncommon | C52: Bronze
A53: [8] | B53: Uncommon | C53: Steel
A54: [8] | B54: Very Rare | C54: Adamantium
A55: [8] | B55: Very Rare | C55: Crystal
A56: [8] | B56: Very Rare | C56: Meteoric
A57: [9] | B57: Common | C57: Wood
A58: [9] | B58: Uncommon | C58: Magic Wood
A59: [9] | B59: Uncommon | C59: Wood
A60: [10] | B60: Common | C60: Bronze
A61: [10] | B61: Common | C61: Iron
A62: [10] | B62: Uncommon | C62: Bronze
A63: [10] | B63: Uncommon | C63: Steel
A64: [11] | B64: Common | C64: Bronze
A65: [11] | B65: Common | C65: Iron
A66: [11] | B66: Rare | C66: Adamantium
A67: [11] | B67: Rare | C67: Mithrill
A68: [11] | B68: Uncommon | C68: Bronze
A69: [11] | B69: Uncommon | C69: Steel
A70: [11] | B70: Very Rare | C70: Crystal
A71: [11] | B71: Very Rare | C71: Meteoric
A72: [12] | B72: Common | C72: Bronze
A73: [12] | B73: Common | C73: Iron
A74: [12] | B74: Rare | C74: Adamantium
A75: [12] | B75: Rare | C75: Mithrill
A76: [12] | B76: Uncommon | C76: Bronze
A77: [12] | B77: Uncommon | C77: Steel
A78: [12] | B78: Very Rare | C78: Crystal
A79: [12] | B79: Very Rare | C79: Meteoric
A80: [13] | B80: Common | C80: Bronze
A81: [13] | B81: Common | C81: Iron
A82: [13] | B82: Uncommon | C82: Bronze
A83: [13] | B83: Uncommon | C83: Steel
A84: [14] | B84: Common | C84: Bronze
A85: [14] | B85: Common | C85: Iron
A86: [14] | B86: Rare | C86: Adamantium
A87: [14] | B87: Rare | C87: Mithrill
A88: [14] | B88: Uncommon | C88: Bronze
A89: [14] | B89: Uncommon | C89: Steel
A90: [14] | B90: Very Rare | C90: Crystal
A91: [14] | B91: Very Rare | C91: Meteoric
A92: [15] | B92: Common | C92: Wood
A93: [15] | B93: Elven | C93: Magic Wood
A94: [15] | B94: Good | C94: Magic Wood
A95: [15] | B95: Good | C95: Wood
A96: [15] | B96: Uncommon | C96: Magic Wood
A97: [15] | B97: Uncommon | C97: Wood
A98: [15] | B98: Very Rare | C98: Magic Wood
A99: [16] | B99: Bad | C99: Wood
A100: [16] | B100: Common | C100: Wood
A101: [16] | B101: Rare | C101: Magic Wood
A102: [16] | B102: Uncommon | C102: Magic Wood
A103: [16] | B103: Uncommon | C103: Wood
A104: [16] | B104: Very Rare | C104: Magic Wood
A105: [17] | B105: Common | C105: Bronze
A106: [17] | B106: Common | C106: Iron
A107: [17] | B107: Rare | C107: Adamantium
A108: [17] | B108: Rare | C108: Mithrill
A109: [17] | B109: Uncommon | C109: Bronze
A110: [17] | B110: Uncommon | C110: Steel
A111: [17] | B111: Very Rare | C111: Adamantium
A112: [17] | B112: Very Rare | C112: Crystal
A113: [17] | B113: Very Rare | C113: Meteoric
A114: [18] | B114: Rare | C114: Adamantium
A115: [18] | B115: Rare | C115: Mithrill
A116: [18] | B116: Uncommon | C116: Steel
A117: [18] | B117: Very Rare | C117: Adamantium
A118: [18] | B118: Very Rare | C118: Meteoric
A119: [19] | B119: Common | C119: Bronze
A120: [19] | B120: Common | C120: Iron
A121: [20] | B121: Bad | C121: Iron
A122: [20] | B122: Common | C122: Bronze
A123: [20] | B123: Common | C123: Iron
A124: [20] | B124: Rare | C124: Adamantium
A125: [20] | B125: Rare | C125: Mithrill
A126: [20] | B126: Uncommon | C126: Bronze
A127: [20] | B127: Uncommon | C127: Steel
A128: [20] | B128: Very Rare | C128: Adamantium
A129: [20] | B129: Very Rare | C129: Crystal
A130: [20] | B130: Very Rare | C130: Meteoric
A131: [21] | B131: Common | C131: Bronze
A132: [21] | B132: Common | C132: Iron
A133: [21] | B133: Rare | C133: Adamantium
A134: [21] | B134: Rare | C134: Mithrill
A135: [21] | B135: Uncommon | C135: Bronze
A136: [21] | B136: Uncommon | C136: Steel
A137: [21] | B137: Very Rare | C137: Adamantium
A138: [21] | B138: Very Rare | C138: Crystal
A139: [21] | B139: Very Rare | C139: Meteoric
A140: [22] | B140: Common | C140: Wood
A141: [22] | B141: Elven | C141: Magic Wood
A142: [22] | B142: Rare | C142: Magic Wood
A143: [22] | B143: Uncommon | C143: Magic Wood
A144: [22] | B144: Uncommon | C144: Wood
A145: [23] | B145: Common | C145: Wood
A146: [23] | B146: Elven | C146: Magic Wood
A147: [23] | B147: Good | C147: Magic Wood
A148: [23] | B148: Rare | C148: Magic Wood
A149: [23] | B149: Uncommon | C149: Magic Wood
A150: [23] | B150: Uncommon | C150: Wood
A151: [24] | B151: Common | C151: Wood
A152: [24] | B152: Rare | C152: Adamantium
A153: [24] | B153: Rare | C153: Mithrill
A154: [24] | B154: Uncommon | C154: Steel
A155: [24] | B155: Very Rare | C155: Adamantium
A156: [24] | B156: Very Rare | C156: Meteoric

Sheet: magicItems
A1: NAME | B1: PRICE | C1: WEIGHT | D1: EFFECT
A2: name | B2: price | C2: weight | D2: effect
A3: Book Air | B3: 1 | C3: 10
A4: Book Water | B4: 1 | C4: 10
A5: Book Fire | B5: 1 | C5: 10
A6: Book Earth | B6: 1 | C6: 10
A7: Book Astral | B7: 1 | C7: 10
A8: Scroll Fire Arrow | B8: 500 | C8: 1 | D8: castSpell=Fire_Arrow:50
A9: Scroll Fire Ball | B9: 3000 | C9: 1 | D9: castSpell=Fire_Ball:50
A10: Scroll Fire Wall | B10: 50000 | C10: 1 | D10: castSpell=Wall_of_Fire:50
A11: Scroll Protection from Fire | B11: 25000 | C11: 1 | D11: castSpell=Protection_from_Fire:50
A12: Scroll Ice Missile | B12: 500 | C12: 1 | D12: castSpell=Ice_Missile:50
A13: Scroll Poison Cloud | B13: 50000 | C13: 1 | D13: castSpell=Poison_Cloud:50
A14: Scroll Blizzard | B14: 150000 | C14: 1 | D14: castSpell=Blizzard:50
A15: Scroll Protection from Water | B15: 25000 | C15: 1 | D15: castSpell=Protection_from_Water:50
A16: Scroll Acid Stream | B16: 50000 | C16: 1 | D16: castSpell=Acid_Stream:50
A17: Scroll Lightning | B17: 500 | C17: 1 | D17: castSpell=Lightning:50
A18: Scroll Prismatic Spray | B18: 10000 | C18: 1 | D18: castSpell=Prismatic_Spray:50
A19: Scroll Invisibility | B19: 150000 | C19: 1 | D19: castSpell=Invisibility:50
A20: Scroll Protection from Air | B20: 25000 | C20: 1 | D20: castSpell=Protection_from_Air:50
A21: Scroll Darkness | B21: 1000 | C21: 1 | D21: castSpell=Darkness:50
A22: Scroll Light- | B22: 1000 | C22: 1 | D22: castSpell=Light:50
A23: Scroll Diamond Dust | B23: 500 | C23: 1 | D23: castSpell=Diamond_Dust:50
A24: Scroll Wall of Earth | B24: 100000 | C24: 1 | D24: castSpell=Wall_of_Earth:20
A25: Scroll Stone Curse | B25: 300000 | C25: 1 | D25: castSpell=Stone_Curse:50
A26: Scroll Protection from Earth | B26: 100000 | C26: 1 | D26: castSpell=Protection_from_Earth:50
A27: Scroll Bless | B27: 20000 | C27: 1 | D27: castSpell=Bless:50
A28: Scroll Haste | B28: 25000 | C28: 1 | D28: castSpell=Haste:50
A29: Scroll Control Spirit | B29: 200000 | C29: 1 | D29: castSpell=Control_Spirit:50
A30: Scroll Teleport | B30: 100000 | C30: 1 | D30: castSpell=Teleport:25
A31: Scroll Heal | B31: 1000 | C31: 1 | D31: castSpell=Heal:50
A32: Scroll Summon | B32: 50000 | C32: 1 | D32: castSpell=Summon:50
A33: Scroll Drain Life | B33: 1000 | C33: 1 | D33: castSpell=Drain_Life:50
A34: Scroll Shield | B34: 20000 | C34: 1 | D34: castSpell=Shield:50
A35: Scroll Curse | B35: 10000 | C35: 1 | D35: castSpell=Curse:50
A36: Scroll Slow | B36: 1000 | C36: 1 | D36: castSpell=Slow:01
A37: SuperScroll Fire Arrow | B37: 2000 | C37: 1 | D37: castSpell=Fire_Arrow:100
A38: SuperScroll Fire Ball | B38: 30000 | C38: 1 | D38: castSpell=Fire_Ball:100
A39: SuperScroll Fire Wall | B39: 300000 | C39: 1 | D39: castSpell=Wall_of_Fire:100
A40: SuperScroll Protection from Fire | B40: 150000 | C40: 1 | D40: castSpell=Protection_from_Fire:100
A41: SuperScroll Ice Missile | B41: 2000 | C41: 1 | D41: castSpell=Ice_Missile:100
A42: SuperScroll Poison Cloud | B42: 300000 | C42: 1 | D42: castSpell=Poison_Cloud:100
A43: SuperScroll Blizzard | B43: 1500000 | C43: 1 | D43: castSpell=Blizzard:100
A44: SuperScroll Protection from Water | B44: 150000 | C44: 1 | D44: castSpell=Protection_from_Water:100
A45: SuperScroll Acid Stream | B45: 400000 | C45: 1 | D45: castSpell=Acid_Stream:100
A46: SuperScroll Lightning | B46: 2000 | C46: 1 | D46: castSpell=Lightning:100
A47: SuperScroll Prismatic Spray | B47: 100000 | C47: 1 | D47: castSpell=Prismatic_Spray:100
A48: SuperScroll Invisibility | B48: 800000 | C48: 1 | D48: castSpell=Invisibility:100
A49: SuperScroll Protection from Air | B49: 150000 | C49: 1 | D49: castSpell=Protection_from_Air:100
A50: SuperScroll Darkness | B50: 10000 | C50: 1 | D50: castSpell=Darkness:100
A51: SuperScroll Light- | B51: 10000 | C51: 1 | D51: castSpell=Light:100
A52: SuperScroll Diamond Dust | B52: 2000 | C52: 1 | D52: castSpell=Diamond_Dust:100
A53: SuperScroll Wall of Earth | B53: 350000 | C53: 1 | D53: castSpell=Wall_of_Earth:100
A54: SuperScroll Stone Curse | B54: 1500000 | C54: 1 | D54: castSpell=Stone_Curse:100
A55: SuperScroll Protection from Earth | B55: 300000 | C55: 1 | D55: castSpell=Protection_from_Earth:100
A56: SuperScroll Bless | B56: 200000 | C56: 1 | D56: castSpell=Bless:100
A57: SuperScroll Haste | B57: 150000 | C57: 1 | D57: castSpell=Haste:100
A58: SuperScroll Control Spirit | B58: 1000000 | C58: 1 | D58: castSpell=Control_Spirit:100
A59: SuperScroll Teleport | B59: 750000 | C59: 1 | D59: castSpell=Teleport:40
A60: SuperScroll Heal | B60: 5000 | C60: 1 | D60: castSpell=Heal:100
A61: SuperScroll Summon | B61: 300000 | C61: 1 | D61: castSpell=Summon:100
A62: SuperScroll Drain Life | B62: 3000 | C62: 1 | D62: castSpell=Drain_Life:100
A63: SuperScroll Shield | B63: 200000 | C63: 1 | D63: castSpell=Shield:100
A64: SuperScroll Curse | B64: 250000 | C64: 1 | D64: castSpell=Curse:100
A65: SuperScroll Slow | B65: 10000 | C65: 1 | D65: castSpell=Slow:1
A66: Potion Antipoison | B66: 1000000 | C66: 1 | D66: absorbtion=+50: duration 30
A67: Potion Body | B67: 1000000 | C67: 5 | D67: body=+1
A68: Potion Reaction | B68: 1000000 | C68: 5 | D68: reaction=+1
A69: Potion Mind | B69: 1000000 | C69: 5 | D69: mind=+1
A70: Potion Spirit | B70: 1000000 | C70: 5 | D70: spirit=+1
A71: Potion Health Regeneration | B71: 100 | C71: 1 | D71: healthRegeneration=100: duration 60
A72: Potion Medium Healing | B72: 1000 | C72: 3 | D72: health=+10
A73: Potion Big Healing | B73: 10000 | C73: 5 | D73: health=+30
A74: Potion Mana Regeneration | B74: 100 | C74: 1 | D74: manaRegeneration=100: duration 60
A75: Potion Medium Mana | B75: 1000 | C75: 2 | D75: mana=+30
A76: Potion Big Mana | B76: 10000 | C76: 3 | D76: mana=+100
A77: Potion Fighter Bonus | B77: 5000 | C77: 3 | D77: healthRegeneration=250: duration 120
A78: Potion Mage Bonus | B78: 5000 | C78: 3 | D78: manaRegeneration=250: duration 120
A79: Quest Documents | B79: -1 | C79: 1
A80: Quest Banner | B80: -1 | C80: 1
A81: Quest Crown1 | B81: -1 | C81: 1
A82: Quest Crown12 | B82: -1 | C82: 1
A83: Quest Crown13 | B83: -1 | C83: 1
A84: Quest Ingredient | B84: -1 | C84: 1
A85: Quest Treasure | B85: 20000 | C85: 1
A86: Quest Amulet | B86: -1 | C86: 1 | D86: 1
A87: Quest Map | B87: -1 | C87: 1 | D87: 1
A88: Quest Head | B88: -1 | C88: 1 | D88: 1
A89: Quest Stone | B89: -1 | C89: 1 | D89: 1
A90: Quest Meta1 | B90: -1 | C90: 1 | D90: 1
A91: Quest Meta2 | B91: -1 | C91: 1 | D91: 1
A92: Quest Meta3 | B92: -1 | C92: 1 | D92: 1
A93: Quest Meta4 | B93: -1 | C93: 1 | D93: 1
A94: Quest RuneA | B94: -1 | C94: 1 | D94: 1
A95: Quest RuneE | B95: -1 | C95: 1 | D95: 1
A96: Quest RuneF | B96: -1 | C96: 1 | D96: 1
A97: Quest RuneW | B97: -1 | C97: 1 | D97: 1
A98: Quest Ring | B98: -1 | C98: 1 | D98: 1
A99: Quest CraftEasy1 | B99: -1 | C99: 1 | D99: 1
A100: Quest CraftEasy2 | B100: -1 | C100: 1 | D100: 1
A101: Quest CraftEasy3 | B101: -1 | C101: 1 | D101: 1
A102: Quest CraftEasy4 | B102: -1 | C102: 1 | D102: 1
A103: Quest CraftEasy5 | B103: -1 | C103: 1 | D103: 1
A104: Quest CraftEasy6 | B104: -1 | C104: 1 | D104: 1
A105: Quest CraftEasy7 | B105: -1 | C105: 1 | D105: 1
A106: Quest CraftEasy8 | B106: -1 | C106: 1 | D106: 1
A107: Quest CraftMedium1 | B107: -1 | C107: 1 | D107: 1
A108: Quest CraftMedium2 | B108: -1 | C108: 1 | D108: 1
A109: Quest CraftMedium3 | B109: -1 | C109: 1 | D109: 1
A110: Quest CraftMedium4 | B110: -1 | C110: 1 | D110: 1
A111: Quest CraftMedium5 | B111: -1 | C111: 1 | D111: 1
A112: Quest CraftMedium6 | B112: -1 | C112: 1 | D112: 1
A113: Quest CraftMedium7 | B113: -1 | C113: 1 | D113: 1
A114: Quest CraftMedium8 | B114: -1 | C114: 1 | D114: 1
A115: Quest CraftHard1 | B115: -1 | C115: 1 | D115: 1
A116: Quest CraftHard2 | B116: -1 | C116: 1 | D116: 1
A117: Quest CraftHard3 | B117: -1 | C117: 1 | D117: 1
A118: Quest CraftHard4 | B118: -1 | C118: 1 | D118: 1
A119: Quest CraftHard5 | B119: -1 | C119: 1 | D119: 1
A120: Quest CraftHard6 | B120: -1 | C120: 1 | D120: 1
A121: Quest CraftHard7 | B121: -1 | C121: 1 | D121: 1
A122: Quest CraftHard8 | B122: -1 | C122: 1 | D122: 1
A123: Quest CraftNightmare1 | B123: -1 | C123: 1 | D123: 1
A124: Quest CraftNightmare2 | B124: -1 | C124: 1 | D124: 1
A125: Quest CraftNightmare3 | B125: -1 | C125: 1 | D125: 1
A126: Quest CraftNightmare4 | B126: -1 | C126: 1 | D126: 1
A127: Quest CraftNightmare5 | B127: -1 | C127: 1 | D127: 1
A128: Quest CraftNightmare6 | B128: -1 | C128: 1 | D128: 1
A129: Quest CraftNightmare7 | B129: -1 | C129: 1 | D129: 1
A130: Quest CraftNightmare8 | B130: -1 | C130: 1 | D130: 1
A131: Quest CraftNightmare9 | B131: -1 | C131: 1 | D131: 1
A132: Quest CraftNightmare10 | B132: -1 | C132: 1 | D132: 1
A133: Quest CraftNightmare11 | B133: -1 | C133: 1 | D133: 1
A134: Quest CraftNightmare12 | B134: -1 | C134: 1 | D134: 1
A135: Quest CraftNightmare13 | B135: -1 | C135: 1 | D135: 1
A136: Quest CraftNightmare14 | B136: -1 | C136: 1 | D136: 1
A137: Quest CraftNightmare15 | B137: -1 | C137: 1 | D137: 1
A138: Quest CraftNightmare16 | B138: -1 | C138: 1 | D138: 1
A139: Quest CraftMage1 | B139: -1 | C139: 1 | D139: 1
A140: Quest CraftMage2 | B140: -1 | C140: 1 | D140: 1
A141: Quest CraftMage3 | B141: -1 | C141: 1 | D141: 1
A142: Quest CraftMage4 | B142: -1 | C142: 1 | D142: 1
A143: Quest CraftMage5 | B143: -1 | C143: 1 | D143: 1
A144: Quest CraftMage6 | B144: -1 | C144: 1 | D144: 1
A145: Quest CraftMage7 | B145: -1 | C145: 1 | D145: 1
A146: Quest CraftMage8 | B146: -1 | C146: 1 | D146: 1
A147: Quest CraftMage9 | B147: -1 | C147: 1 | D147: 1
A148: Quest CraftMage10 | B148: -1 | C148: 1 | D148: 1
A149: Quest CraftMage11 | B149: -1 | C149: 1 | D149: 1
A150: Quest CraftMage12 | B150: -1 | C150: 1 | D150: 1
A151: Quest CraftMage13 | B151: -1 | C151: 1 | D151: 1
A152: Quest CraftMage14 | B152: -1 | C152: 1 | D152: 1

Sheet: monsters
A1: EMPTY | B1: NAME | C1: BODY | D1: REACTION | E1: MIND | F1: SPIRIT | G1: HEALTHMAX | H1: HEALTHREGENERATION | I1: MANAMAX | J1: MANAREGENERATION | K1: SPEED | L1: ROTATIONSPEED | M1: SCANRANGE | N1: PHYSICALMIN | O1: PHYSICALMAX | P1: ATTACKTYPE | Q1: TOHIT | R1: DEFENCE | S1: ABSORBTION | T1: CHARGE | U1: RELAX | V1: PROTECTIONFIRE | W1: PROTECTIONWATER | X1: PROTECTIONAIR | Y1: PROTECTIONEARTH | Z1: PROTECTIONASTRAL | AA1: PROTECTIONBLADE | AB1: PROTECTIONAXE | AC1: PROTECTIONBLUDGEON | AD1: PROTECTIONPIKE | AE1: PROTECTIONSHOOTING | AF1: TYPEID | AG1: FACE | AH1: TOKENSIZE | AI1: MOVEMENTTYPE | AJ1: DYINGTIME | AK1: WITHDRAW | AL1: WIMPY | AM1: SEEINVISIBLE | AN1: EXPERIENCE | AO1: TREASUREGOLD | AP1: TREASUREGOLDMIN | AQ1: TREASUREGOLDMAX | AR1: TREASUREITEM | AS1: TREASUREITEMMIN | AT1: TREASUREITEMMAX | AU1: TREASUREITEMMASK | AV1: NOTUSED | AW1: NOTUSED1 | AX1: POWER | AY1: SPELL1 | AZ1: SPELLPROBABILITY1 | BA1: SPELL2 | BB1: SPELLPROBABILITY2 | BC1: SPELL3 | BD1: SPELLPROBABILITY3 | BE1: SPELLPOWER | BF1: SERVERID | BG1: KNOWNSPELLSAREEMPTY | BH1: SKILLFIRE | BI1: SKILLWATER | BJ1: SKILLAIR | BK1: SKILLEARTH | BL1: SKILLASTRAL | BM1: EQUIPITEM1 | BN1: EQUIPITEM2 | BO1: KNOWNSPELLS
A2: empty | B2: name | C2: body | D2: reaction | E2: mind | F2: spirit | G2: healthMax | H2: healthRegeneration | I2: manaMax | J2: manaRegeneration | K2: speed | L2: rotationSpeed | M2: scanRange | N2: physicalMin | O2: physicalMax | P2: attackType | Q2: toHit | R2: defence | S2: absorbtion | T2: charge | U2: relax | V2: protectionFire | W2: protectionWater | X2: protectionAir | Y2: protectionEarth | Z2: protectionAstral | AA2: protectionBlade | AB2: protectionAxe | AC2: protectionBludgeon | AD2: protectionPike | AE2: protectionShooting | AF2: typeId | AG2: face | AH2: tokenSize | AI2: movementType | AJ2: dyingTime | AK2: withdraw | AL2: wimpy | AM2: seeInvisible | AN2: experience | AO2: treasureGold | AP2: treasureGoldMin | AQ2: treasureGoldMax | AR2: treasureItem | AS2: treasureItemMin | AT2: treasureItemMax | AU2: treasureItemMask | AV2: notUsed | AW2: notUsed1 | AX2: power | AY2: spell1 | AZ2: spellProbability1 | BA2: spell2 | BB2: spellProbability2 | BC2: spell3 | BD2: spellProbability3 | BE2: spellPower | BF2: serverId | BG2: knownSpellsAreEmpty | BH2: skillFire | BI2: skillWater | BJ2: skillAir | BK2: skillEarth | BL2: skillAstral | BM2: equipItem1 | BN2: equipItem2 | BO2: knownSpells | BP2: задано
A3: 1 | BP3: =COUNTIF(knownSpells_monsters!C[-67],RC[-1]) -> 0
A4: 1 | BP4: =COUNTIF(knownSpells_monsters!C[-67],RC[-1]) -> 0
A5: 1 | BP5: =COUNTIF(knownSpells_monsters!C[-67],RC[-1]) -> 0
A6: 1 | BP6: =COUNTIF(knownSpells_monsters!C[-67],RC[-1]) -> 0
A7: 1 | BP7: =COUNTIF(knownSpells_monsters!C[-67],RC[-1]) -> 0
A8: 1 | BP8: =COUNTIF(knownSpells_monsters!C[-67],RC[-1]) -> 0
A9: 1 | BP9: =COUNTIF(knownSpells_monsters!C[-67],RC[-1]) -> 0
A10: 1 | BP10: =COUNTIF(knownSpells_monsters!C[-67],RC[-1]) -> 0
A11: 1 | BP11: =COUNTIF(knownSpells_monsters!C[-67],RC[-1]) -> 0
A12: 1 | BP12: =COUNTIF(knownSpells_monsters!C[-67],RC[-1]) -> 0
A13: 1 | BP13: =COUNTIF(knownSpells_monsters!C[-67],RC[-1]) -> 0
A14: 1 | BP14: =COUNTIF(knownSpells_monsters!C[-67],RC[-1]) -> 0
A15: 1 | BP15: =COUNTIF(knownSpells_monsters!C[-67],RC[-1]) -> 0
A16: 1 | BP16: =COUNTIF(knownSpells_monsters!C[-67],RC[-1]) -> 0
A17: 1 | BP17: =COUNTIF(knownSpells_monsters!C[-67],RC[-1]) -> 0
A18: 1 | BP18: =COUNTIF(knownSpells_monsters!C[-67],RC[-1]) -> 0
A19: 1 | BP19: =COUNTIF(knownSpells_monsters!C[-67],RC[-1]) -> 0
A20: 1 | BP20: =COUNTIF(knownSpells_monsters!C[-67],RC[-1]) -> 0
A21: 1 | BP21: =COUNTIF(knownSpells_monsters!C[-67],RC[-1]) -> 0
A22: 1 | BP22: =COUNTIF(knownSpells_monsters!C[-67],RC[-1]) -> 0
A23: 1 | BP23: =COUNTIF(knownSpells_monsters!C[-67],RC[-1]) -> 0
A24: 1 | BP24: =COUNTIF(knownSpells_monsters!C[-67],RC[-1]) -> 0
A25: 1 | BP25: =COUNTIF(knownSpells_monsters!C[-67],RC[-1]) -> 0
A26: 1 | BP26: =COUNTIF(knownSpells_monsters!C[-67],RC[-1]) -> 0
A27: 1 | BP27: =COUNTIF(knownSpells_monsters!C[-67],RC[-1]) -> 0
A28: 0 | B28: Catapult | C28: 40 | D28: 30 | E28: 30 | F28: 0 | G28: 250 | H28: 0 | I28: 0 | J28: 0 | K28: 8 | L28: 8 | M28: 7 | N28: 40 | O28: 80 | P28: -1 | Q28: 400 | R28: 150 | S28: 7 | T28: 2 | U28: 38 | V28: 0 | W28: 100 | X28: 100 | Y28: 50 | Z28: 100 | AA28: 40 | AB28: 0 | AC28: 20 | AD28: 60 | AE28: 80 | AF28: 26 | AG28: 1 | AH28: 2 | AI28: 1 | AJ28: 8 | AK28: -1 | AL28: -1 | AM28: -1 | AN28: 0 | AO28: -1 | AP28: -1 | AQ28: -1 | AR28: -1 | AS28: -1 | AT28: -1 | AU28: -1 | AV28: -1 | AW28: -1 | AX28: -1 | AZ28: -1 | BB28: -1 | BD28: -1 | BE28: 0 | BF28: 999 | BG28: 1 | BH28: -1 | BI28: -1 | BJ28: -1 | BK28: -1 | BL28: -1 | BM28: Boulder Thrower{castSpell=Fire_Ball:70} | BP28: =COUNTIF(knownSpells_monsters!C[-67],RC[-1]) -> 0
A29: 0 | B29: CatapultBase | C29: 40 | D29: 30 | E29: 30 | F29: 0 | G29: 250 | H29: 0 | I29: 0 | J29: 0 | K29: 8 | L29: 8 | M29: 7 | N29: 40 | O29: 80 | P29: -1 | Q29: 400 | R29: 150 | S29: 7 | T29: 2 | U29: 38 | V29: 0 | W29: 100 | X29: 100 | Y29: 50 | Z29: 100 | AA29: 40 | AB29: 0 | AC29: 20 | AD29: 60 | AE29: 80 | AF29: 26 | AG29: 1 | AH29: 2 | AI29: 1 | AJ29: 8 | AK29: -1 | AL29: -1 | AM29: -1 | AN29: 0 | AO29: -1 | AP29: -1 | AQ29: -1 | AR29: -1 | AS29: -1 | AT29: -1 | AU29: -1 | AV29: -1 | AW29: -1 | AX29: -1 | AZ29: -1 | BB29: -1 | BD29: -1 | BE29: 0 | BF29: 10070 | BG29: 1 | BH29: -1 | BI29: -1 | BJ29: -1 | BK29: -1 | BL29: -1 | BM29: Boulder Thrower{castSpell=Fire_Ball:70} | BP29: =COUNTIF(knownSpells_monsters!C[-67],RC[-1]) -> 0
A30: 0 | B30: MercenaryCatapult | C30: 40 | D30: 30 | E30: 30 | F30: 0 | G30: 250 | H30: 0 | I30: 0 | J30: 0 | K30: 8 | L30: 8 | M30: 7 | N30: 40 | O30: 80 | P30: -1 | Q30: 400 | R30: 150 | S30: 7 | T30: 2 | U30: 38 | V30: 0 | W30: 100 | X30: 100 | Y30: 50 | Z30: 100 | AA30: 40 | AB30: 0 | AC30: 20 | AD30: 60 | AE30: 80 | AF30: 26 | AG30: 1 | AH30: 2 | AI30: 1 | AJ30: 8 | AK30: -1 | AL30: -1 | AM30: -1 | AN30: 0 | AO30: -1 | AP30: -1 | AQ30: -1 | AR30: -1 | AS30: -1 | AT30: -1 | AU30: -1 | AV30: -1 | AW30: -1 | AX30: -1 | AZ30: -1 | BB30: -1 | BD30: -1 | BE30: 0 | BF30: 10079 | BG30: 1 | BH30: -1 | BI30: -1 | BJ30: -1 | BK30: -1 | BL30: -1 | BM30: Boulder Thrower{castSpell=Fire_Ball:70} | BP30: =COUNTIF(knownSpells_monsters!C[-67],RC[-1]) -> 0
A31: 1 | BP31: =COUNTIF(knownSpells_monsters!C[-67],RC[-1]) -> 0
A32: 1 | BP32: =COUNTIF(knownSpells_monsters!C[-67],RC[-1]) -> 0
A33: 1 | BP33: =COUNTIF(knownSpells_monsters!C[-67],RC[-1]) -> 0
A34: 1 | BP34: =COUNTIF(knownSpells_monsters!C[-67],RC[-1]) -> 0
A35: 1 | BP35: =COUNTIF(knownSpells_monsters!C[-67],RC[-1]) -> 0
A36: 1 | BP36: =COUNTIF(knownSpells_monsters!C[-67],RC[-1]) -> 0
A37: 1 | BP37: =COUNTIF(knownSpells_monsters!C[-67],RC[-1]) -> 0
A38: 1 | BP38: =COUNTIF(knownSpells_monsters!C[-67],RC[-1]) -> 0
A39: 1 | BP39: =COUNTIF(knownSpells_monsters!C[-67],RC[-1]) -> 0
A40: 1 | BP40: =COUNTIF(knownSpells_monsters!C[-67],RC[-1]) -> 0
A41: 1 | BP41: =COUNTIF(knownSpells_monsters!C[-67],RC[-1]) -> 0
A42: 1 | BP42: =COUNTIF(knownSpells_monsters!C[-67],RC[-1]) -> 0
A43: 1 | BP43: =COUNTIF(knownSpells_monsters!C[-67],RC[-1]) -> 0
A44: 1 | BP44: =COUNTIF(knownSpells_monsters!C[-67],RC[-1]) -> 0
A45: 1 | BP45: =COUNTIF(knownSpells_monsters!C[-67],RC[-1]) -> 0
A46: 1 | BP46: =COUNTIF(knownSpells_monsters!C[-67],RC[-1]) -> 0
A47: 1 | BP47: =COUNTIF(knownSpells_monsters!C[-67],RC[-1]) -> 0
A48: 1 | BP48: =COUNTIF(knownSpells_monsters!C[-67],RC[-1]) -> 0
A49: 1 | BP49: =COUNTIF(knownSpells_monsters!C[-67],RC[-1]) -> 0
A50: 1 | BP50: =COUNTIF(knownSpells_monsters!C[-67],RC[-1]) -> 0
A51: 1 | BP51: =COUNTIF(knownSpells_monsters!C[-67],RC[-1]) -> 0
A52: 1 | BP52: =COUNTIF(knownSpells_monsters!C[-67],RC[-1]) -> 0
A53: 1 | BP53: =COUNTIF(knownSpells_monsters!C[-67],RC[-1]) -> 0
A54: 1 | BP54: =COUNTIF(knownSpells_monsters!C[-67],RC[-1]) -> 0
A55: 1 | BP55: =COUNTIF(knownSpells_monsters!C[-67],RC[-1]) -> 0
A56: 1 | BP56: =COUNTIF(knownSpells_monsters!C[-67],RC[-1]) -> 0
A57: 1 | BP57: =COUNTIF(knownSpells_monsters!C[-67],RC[-1]) -> 0
A58: 1 | BP58: =COUNTIF(knownSpells_monsters!C[-67],RC[-1]) -> 0
A59: 1 | BP59: =COUNTIF(knownSpells_monsters!C[-67],RC[-1]) -> 0
A60: 1 | BP60: =COUNTIF(knownSpells_monsters!C[-67],RC[-1]) -> 0
A61: 1 | BP61: =COUNTIF(knownSpells_monsters!C[-67],RC[-1]) -> 0
A62: 1 | BP62: =COUNTIF(knownSpells_monsters!C[-67],RC[-1]) -> 0
A63: 1 | BP63: =COUNTIF(knownSpells_monsters!C[-67],RC[-1]) -> 0
A64: 1 | BP64: =COUNTIF(knownSpells_monsters!C[-67],RC[-1]) -> 0
A65: 1 | BP65: =COUNTIF(knownSpells_monsters!C[-67],RC[-1]) -> 0
A66: 0 | B66: Goblin_Pike | C66: 20 | D66: 60 | E66: 10 | F66: 10 | G66: 40 | H66: 50 | I66: 0 | J66: 0 | K66: 24 | L66: 16 | M66: 6 | N66: 4 | O66: 8 | P66: -1 | Q66: 15 | R66: 30 | S66: 0 | T66: 7 | U66: 3 | V66: 50 | W66: 0 | X66: 0 | Y66: 0 | Z66: 0 | AA66: 0 | AB66: 0 | AC66: 0 | AD66: 0 | AE66: 0 | AF66: 64 | AG66: 1 | AH66: 1 | AI66: 1 | AJ66: 12 | AK66: 0 | AL66: 10 | AM66: 1 | AN66: 60 | AO66: 60 | AP66: 30 | AQ66: 90 | AR66: 0 | AS66: -1 | AT66: -1 | AU66: 289931263 | AV66: -1 | AW66: -1 | AX66: 48 | AZ66: -1 | BB66: -1 | BD66: -1 | BE66: 0 | BF66: 600 | BG66: 1 | BH66: -1 | BI66: -1 | BJ66: -1 | BK66: -1 | BL66: -1 | BM66: Bronze Pike | BP66: =COUNTIF(knownSpells_monsters!C[-67],RC[-1]) -> 0
A67: 0 | B67: Goblin_Pike.2 | C67: 25 | D67: 67 | E67: 15 | F67: 15 | G67: 64 | H67: 45 | I67: 0 | J67: 0 | K67: 25 | L67: 17 | M67: 7 | N67: 6 | O67: 13 | P67: -1 | Q67: 105 | R67: 100 | S67: 1 | T67: 7 | U67: 3 | V67: 50 | W67: 0 | X67: 0 | Y67: 0 | Z67: 0 | AA67: 0 | AB67: 0 | AC67: 0 | AD67: 0 | AE67: 0 | AF67: 64 | AG67: 2 | AH67: 1 | AI67: 1 | AJ67: 12 | AK67: 0 | AL67: 10 | AM67: 2 | AN67: 315 | AO67: 60 | AP67: 210 | AQ67: 603 | AR67: 0 | AS67: -1 | AT67: -1 | AU67: 289931263 | AV67: -1 | AW67: -1 | AX67: 123 | AZ67: -1 | BB67: -1 | BD67: -1 | BE67: 0 | BF67: 601 | BG67: 1 | BH67: -1 | BI67: -1 | BJ67: -1 | BK67: -1 | BL67: -1 | BM67: Uncommon Bronze Pike | BP67: =COUNTIF(knownSpells_monsters!C[-67],RC[-1]) -> 0
A68: 0 | B68: Goblin_Pike.3 | C68: 30 | D68: 74 | E68: 19 | F68: 19 | G68: 102 | H68: 41 | I68: 0 | J68: 0 | K68: 26 | L68: 18 | M68: 7 | N68: 10 | O68: 20 | P68: -1 | Q68: 195 | R68: 170 | S68: 3 | T68: 7 | U68: 3 | V68: 50 | W68: 0 | X68: 0 | Y68: 0 | Z68: 0 | AA68: 0 | AB68: 0 | AC68: 0 | AD68: 0 | AE68: 0 | AF68: 64 | AG68: 3 | AH68: 1 | AI68: 1 | AJ68: 12 | AK68: 0 | AL68: 10 | AM68: 3 | AN68: 1654 | AO68: 60 | AP68: 1470 | AQ68: 4040 | AR68: 0 | AS68: -1 | AT68: -1 | AU68: 289931263 | AV68: -1 | AW68: -1 | AX68: 315 | AZ68: -1 | BB68: -1 | BD68: -1 | BE68: 0 | BF68: 602 | BG68: 1 | BH68: -1 | BI68: -1 | BJ68: -1 | BK68: -1 | BL68: -1 | BM68: Iron Pike | BP68: =COUNTIF(knownSpells_monsters!C[-67],RC[-1]) -> 0
A69: 0 | B69: Goblin_Pike.4 | C69: 36 | D69: 82 | E69: 24 | F69: 24 | G69: 164 | H69: 36 | I69: 0 | J69: 0 | K69: 27 | L69: 19 | M69: 8 | N69: 16 | O69: 33 | P69: -1 | Q69: 285 | R69: 240 | S69: 5 | T69: 7 | U69: 3 | V69: 50 | W69: 0 | X69: 0 | Y69: 0 | Z69: 0 | AA69: 0 | AB69: 0 | AC69: 0 | AD69: 0 | AE69: 0 | AF69: 64 | AG69: 4 | AH69: 1 | AI69: 1 | AJ69: 12 | AK69: 0 | AL69: 10 | AM69: 4 | AN69: 8682 | AO69: 60 | AP69: 10290 | AQ69: 27069 | AR69: 0 | AS69: -1 | AT69: -1 | AU69: 289931263 | AV69: -1 | AW69: -1 | AX69: 805 | AY69: Slow | AZ69: 10 | BB69: -1 | BD69: -1 | BE69: 30 | BF69: 603 | BG69: 1 | BH69: -1 | BI69: -1 | BJ69: -1 | BK69: -1 | BL69: -1 | BM69: Uncommon Steel Pike | BP69: =COUNTIF(knownSpells_monsters!C[-67],RC[-1]) -> 0
A70: 0 | B70: Goblin_Pike.5 | C70: 64 | D70: 110 | E70: 52 | F70: 52 | G70: 2458 | H70: 36 | I70: 0 | J70: 0 | K70: 27 | L70: 27 | M70: 8 | N70: 131 | O70: 262 | P70: -1 | Q70: 385 | R70: 340 | S70: 5 | T70: 7 | U70: 3 | V70: 50 | W70: 0 | X70: 0 | Y70: 0 | Z70: 0 | AA70: 0 | AB70: 0 | AC70: 0 | AD70: 0 | AE70: 0 | AF70: 64 | AG70: 5 | AH70: 1 | AI70: 1 | AJ70: 12 | AK70: 0 | AL70: 10 | AM70: 6 | AN70: 17364 | AO70: 60 | AP70: 30870 | AQ70: 81206 | AR70: 0 | AS70: -1 | AT70: -1 | AU70: 289931263 | AV70: 0 | AW70: 0 | AX70: 96637 | AY70: Slow | AZ70: 10 | BB70: -1 | BD70: -1 | BE70: 100 | BF70: 801 | BG70: 1 | BH70: -1 | BI70: -1 | BJ70: -1 | BK70: -1 | BL70: -1 | BM70: Uncommon Steel Pike | BP70: =COUNTIF(knownSpells_monsters!C[-67],RC[-1]) -> 0
A71: 0 | B71: Goblin_Sling | C71: 15 | D71: 60 | E71: 10 | F71: 10 | G71: 30 | H71: 50 | I71: 0 | J71: 0 | K71: 24 | L71: 16 | M71: 6 | N71: 3 | O71: 6 | P71: -1 | Q71: 20 | R71: 25 | S71: 0 | T71: 21 | U71: 7 | V71: 50 | W71: 0 | X71: 0 | Y71: 0 | Z71: 0 | AA71: 0 | AB71: 0 | AC71: 0 | AD71: 0 | AE71: 0 | AF71: 79 | AG71: 1 | AH71: 1 | AI71: 1 | AJ71: 12 | AK71: 60 | AL71: 8 | AM71: 1 | AN71: 72 | AO71: 60 | AP71: 30 | AQ71: 90 | AR71: 0 | AS71: -1 | AT71: -1 | AU71: 289931263 | AV71: -1 | AW71: -1 | AX71: 54 | AZ71: -1 | BB71: -1 | BD71: -1 | BE71: 0 | BF71: 604 | BG71: 1 | BH71: -1 | BI71: -1 | BJ71: -1 | BK71: -1 | BL71: -1 | BM71: Wood Short Bow | BP71: =COUNTIF(knownSpells_monsters!C[-67],RC[-1]) -> 0
A72: 0 | B72: Goblin_Sling.2 | C72: 20 | D72: 67 | E72: 15 | F72: 15 | G72: 48 | H72: 45 | I72: 0 | J72: 0 | K72: 25 | L72: 17 | M72: 7 | N72: 5 | O72: 10 | P72: -1 | Q72: 110 | R72: 95 | S72: 1 | T72: 21 | U72: 7 | V72: 50 | W72: 0 | X72: 0 | Y72: 0 | Z72: 0 | AA72: 0 | AB72: 0 | AC72: 0 | AD72: 0 | AE72: 0 | AF72: 79 | AG72: 2 | AH72: 1 | AI72: 1 | AJ72: 12 | AK72: 60 | AL72: 8 | AM72: 2 | AN72: 378 | AO72: 60 | AP72: 210 | AQ72: 603 | AR72: 0 | AS72: -1 | AT72: -1 | AU72: 289931263 | AV72: -1 | AW72: -1 | AX72: 138 | AZ72: -1 | BB72: -1 | BD72: -1 | BE72: 0 | BF72: 605 | BG72: 1 | BH72: -1 | BI72: -1 | BJ72: -1 | BK72: -1 | BL72: -1 | BM72: Uncommon Wood Short Bow | BP72: =COUNTIF(knownSpells_monsters!C[-67],RC[-1]) -> 0
A73: 0 | B73: Goblin_Sling.3 | C73: 25 | D73: 74 | E73: 19 | F73: 19 | G73: 77 | H73: 41 | I73: 0 | J73: 0 | K73: 26 | L73: 18 | M73: 7 | N73: 8 | O73: 15 | P73: -1 | Q73: 200 | R73: 165 | S73: 3 | T73: 21 | U73: 7 | V73: 50 | W73: 0 | X73: 0 | Y73: 0 | Z73: 0 | AA73: 0 | AB73: 0 | AC73: 0 | AD73: 0 | AE73: 0 | AF73: 79 | AG73: 3 | AH73: 1 | AI73: 1 | AJ73: 12 | AK73: 60 | AL73: 8 | AM73: 3 | AN73: 1985 | AO73: 60 | AP73: 1470 | AQ73: 4040 | AR73: 0 | AS73: -1 | AT73: -1 | AU73: 289931263 | AV73: -1 | AW73: -1 | AX73: 354 | AZ73: -1 | BB73: -1 | BD73: -1 | BE73: 0 | BF73: 606 | BG73: 1 | BH73: -1 | BI73: -1 | BJ73: -1 | BK73: -1 | BL73: -1 | BM73: Wood Long Bow | BP73: =COUNTIF(knownSpells_monsters!C[-67],RC[-1]) -> 0
A74: 0 | B74: Goblin_Sling.4 | C74: 30 | D74: 82 | E74: 24 | F74: 24 | G74: 123 | H74: 36 | I74: 0 | J74: 0 | K74: 27 | L74: 19 | M74: 8 | N74: 12 | O74: 25 | P74: -1 | Q74: 290 | R74: 235 | S74: 5 | T74: 21 | U74: 7 | V74: 50 | W74: 0 | X74: 0 | Y74: 0 | Z74: 0 | AA74: 0 | AB74: 0 | AC74: 0 | AD74: 0 | AE74: 0 | AF74: 79 | AG74: 4 | AH74: 1 | AI74: 1 | AJ74: 12 | AK74: 60 | AL74: 8 | AM74: 4 | AN74: 10419 | AO74: 60 | AP74: 10290 | AQ74: 27069 | AR74: 0 | AS74: -1 | AT74: -1 | AU74: 289931263 | AV74: -1 | AW74: -1 | AX74: 906 | AY74: Shield | AZ74: 10 | BB74: -1 | BD74: -1 | BE74: 30 | BF74: 607 | BG74: 1 | BH74: -1 | BI74: -1 | BJ74: -1 | BK74: -1 | BL74: -1 | BM74: Uncommon Wood Long Bow | BP74: =COUNTIF(knownSpells_monsters!C[-67],RC[-1]) -> 0
A75: 0 | B75: Goblin_Sling.5 | C75: 58 | D75: 110 | E75: 52 | F75: 52 | G75: 1843 | H75: 36 | I75: 0 | J75: 0 | K75: 27 | L75: 27 | M75: 8 | N75: 98 | O75: 197 | P75: -1 | Q75: 390 | R75: 335 | S75: 5 | T75: 21 | U75: 7 | V75: 50 | W75: 0 | X75: 0 | Y75: 0 | Z75: 0 | AA75: 0 | AB75: 0 | AC75: 0 | AD75: 0 | AE75: 0 | AF75: 79 | AG75: 5 | AH75: 1 | AI75: 1 | AJ75: 12 | AK75: 0 | AL75: 8 | AM75: 6 | AN75: 20837 | AO75: 60 | AP75: 30870 | AQ75: 81206 | AR75: 0 | AS75: -1 | AT75: -1 | AU75: 289931263 | AV75: 0 | AW75: 0 | AX75: 54358 | AY75: Shield | AZ75: 10 | BB75: -1 | BD75: -1 | BE75: 100 | BF75: 802 | BG75: 1 | BH75: -1 | BI75: -1 | BJ75: -1 | BK75: -1 | BL75: -1 | BM75: Uncommon Wood Long Bow | BP75: =COUNTIF(knownSpells_monsters!C[-67],RC[-1]) -> 0
A76: 0 | B76: Orc_Sword | C76: 33 | D76: 20 | E76: 15 | F76: 10 | G76: 80 | H76: 100 | I76: 0 | J76: 0 | K76: 16 | L76: 16 | M76: 6 | N76: 8 | O76: 16 | P76: -1 | Q76: 50 | R76: 50 | S76: 2 | T76: 11 | U76: 4 | V76: 0 | W76: 0 | X76: 50 | Y76: 0 | Z76: 0 | AA76: 0 | AB76: 0 | AC76: 0 | AD76: 0 | AE76: 0 | AF76: 80 | AG76: 1 | AH76: 1 | AI76: 1 | AJ76: 14 | AK76: 0 | AL76: 0 | AM76: 1 | AN76: 300 | AO76: 80 | AP76: 90 | AQ76: 270 | AR76: 30 | AS76: 180 | AT76: 540 | AU76: 826802175 | AV76: -1 | AW76: -1 | AX76: 192 | AZ76: -1 | BB76: -1 | BD76: -1 | BE76: 0 | BF76: 608 | BG76: 1 | BH76: -1 | BI76: -1 | BJ76: -1 | BK76: -1 | BL76: -1 | BM76: Bronze Long Sword | BP76: =COUNTIF(knownSpells_monsters!C[-67],RC[-1]) -> 0
A77: 0 | B77: Orc_Sword.2 | C77: 39 | D77: 25 | E77: 20 | F77: 15 | G77: 128 | H77: 90 | I77: 0 | J77: 0 | K77: 17 | L77: 17 | M77: 7 | N77: 13 | O77: 26 | P77: -1 | Q77: 140 | R77: 120 | S77: 4 | T77: 11 | U77: 4 | V77: 0 | W77: 0 | X77: 50 | Y77: 0 | Z77: 0 | AA77: 0 | AB77: 0 | AC77: 0 | AD77: 0 | AE77: 0 | AF77: 80 | AG77: 2 | AH77: 1 | AI77: 1 | AJ77: 14 | AK77: 0 | AL77: 0 | AM77: 2 | AN77: 1575 | AO77: 80 | AP77: 630 | AQ77: 1809 | AR77: 30 | AS77: 1260 | AT77: 3618 | AU77: 826802175 | AV77: -1 | AW77: -1 | AX77: 492 | AZ77: -1 | BB77: -1 | BD77: -1 | BE77: 0 | BF77: 609 | BG77: 1 | BH77: -1 | BI77: -1 | BJ77: -1 | BK77: -1 | BL77: -1 | BM77: Uncommon Bronze Long Sword | BP77: =COUNTIF(knownSpells_monsters!C[-67],RC[-1]) -> 0
A78: 0 | B78: Orc_Sword.3 | C78: 45 | D78: 30 | E78: 25 | F78: 19 | G78: 205 | H78: 81 | I78: 0 | J78: 0 | K78: 18 | L78: 18 | M78: 7 | N78: 20 | O78: 41 | P78: -1 | Q78: 230 | R78: 190 | S78: 7 | T78: 11 | U78: 4 | V78: 0 | W78: 0 | X78: 50 | Y78: 0 | Z78: 0 | AA78: 0 | AB78: 0 | AC78: 0 | AD78: 0 | AE78: 0 | AF78: 80 | AG78: 3 | AH78: 1 | AI78: 1 | AJ78: 14 | AK78: 0 | AL78: 0 | AM78: 3 | AN78: 8269 | AO78: 80 | AP78: 4410 | AQ78: 12120 | AR78: 30 | AS78: 8820 | AT78: 24241 | AU78: 826802175 | AV78: -1 | AW78: -1 | AX78: 1258 | AZ78: -1 | BB78: -1 | BD78: -1 | BE78: 0 | BF78: 610 | BG78: 1 | BH78: -1 | BI78: -1 | BJ78: -1 | BK78: -1 | BL78: -1 | BM78: Iron Long Sword | BP78: =COUNTIF(knownSpells_monsters!C[-67],RC[-1]) -> 0
A79: 0 | B79: Orc_Sword.4 | C79: 51 | D79: 36 | E79: 30 | F79: 24 | G79: 328 | H79: 73 | I79: 0 | J79: 0 | K79: 19 | L79: 19 | M79: 8 | N79: 33 | O79: 66 | P79: -1 | Q79: 320 | R79: 260 | S79: 12 | T79: 11 | U79: 4 | V79: 0 | W79: 0 | X79: 50 | Y79: 0 | Z79: 0 | AA79: 0 | AB79: 0 | AC79: 0 | AD79: 0 | AE79: 0 | AF79: 80 | AG79: 4 | AH79: 1 | AI79: 1 | AJ79: 14 | AK79: 0 | AL79: 0 | AM79: 4 | AN79: 43411 | AO79: 80 | AP79: 30870 | AQ79: 81206 | AR79: 30 | AS79: 61740 | AT79: 162412 | AU79: 826802175 | AV79: -1 | AW79: -1 | AX79: 3221 | AY79: Teleport | AZ79: 30 | BB79: -1 | BD79: -1 | BE79: 30 | BF79: 611 | BG79: 1 | BH79: -1 | BI79: -1 | BJ79: -1 | BK79: -1 | BL79: -1 | BM79: Uncommon Steel Long Sword | BP79: =COUNTIF(knownSpells_monsters!C[-67],RC[-1]) -> 0
A80: 0 | B80: Orc_Sword.5 | C80: 79 | D80: 64 | E80: 58 | F80: 52 | G80: 4915 | H80: 73 | I80: 0 | J80: 0 | K80: 19 | L80: 19 | M80: 8 | N80: 262 | O80: 517 | P80: -1 | Q80: 420 | R80: 360 | S80: 12 | T80: 11 | U80: 4 | V80: 0 | W80: 0 | X80: 50 | Y80: 0 | Z80: 0 | AA80: 0 | AB80: 0 | AC80: 0 | AD80: 0 | AE80: 0 | AF80: 80 | AG80: 5 | AH80: 1 | AI80: 1 | AJ80: 14 | AK80: 0 | AL80: 0 | AM80: 6 | AN80: 86822 | AO80: 80 | AP80: 92610 | AQ80: 243618 | AR80: 30 | AS80: 185220 | AT80: 487236 | AU80: 826802175 | AV80: 0 | AW80: 0 | AX80: 383036 | AY80: Teleport | AZ80: 50 | BB80: -1 | BD80: -1 | BE80: 100 | BF80: 803 | BG80: 1 | BH80: -1 | BI80: -1 | BJ80: -1 | BK80: -1 | BL80: -1 | BM80: Uncommon Steel Long Sword | BP80: =COUNTIF(knownSpells_monsters!C[-67],RC[-1]) -> 0
A81: 0 | B81: Orc_Bow | C81: 27 | D81: 20 | E81: 15 | F81: 10 | G81: 60 | H81: 100 | I81: 0 | J81: 0 | K81: 18 | L81: 20 | M81: 6 | N81: 6 | O81: 12 | P81: -1 | Q81: 55 | R81: 45 | S81: 2 | T81: 21 | U81: 7 | V81: 0 | W81: 0 | X81: 50 | Y81: 0 | Z81: 0 | AA81: 0 | AB81: 0 | AC81: 0 | AD81: 0 | AE81: 0 | AF81: 65 | AG81: 1 | AH81: 1 | AI81: 1 | AJ81: 14 | AK81: 90 | AL81: 0 | AM81: 1 | AN81: 420 | AO81: 80 | AP81: 90 | AQ81: 270 | AR81: 30 | AS81: 180 | AT81: 540 | AU81: 826802175 | AV81: -1 | AW81: -1 | AX81: 216 | AZ81: -1 | BB81: -1 | BD81: -1 | BE81: 0 | BF81: 612 | BG81: 1 | BH81: -1 | BI81: -1 | BJ81: -1 | BK81: -1 | BL81: -1 | BM81: Uncommon Wood Short Bow | BP81: =COUNTIF(knownSpells_monsters!C[-67],RC[-1]) -> 0
A82: 0 | B82: Orc_Bow.2 | C82: 32 | D82: 25 | E82: 20 | F82: 15 | G82: 96 | H82: 90 | I82: 0 | J82: 0 | K82: 19 | L82: 21 | M82: 7 | N82: 10 | O82: 19 | P82: -1 | Q82: 145 | R82: 115 | S82: 4 | T82: 21 | U82: 7 | V82: 0 | W82: 0 | X82: 50 | Y82: 0 | Z82: 0 | AA82: 0 | AB82: 0 | AC82: 0 | AD82: 0 | AE82: 0 | AF82: 65 | AG82: 2 | AH82: 1 | AI82: 1 | AJ82: 14 | AK82: 90 | AL82: 0 | AM82: 2 | AN82: 2205 | AO82: 80 | AP82: 630 | AQ82: 1809 | AR82: 30 | AS82: 1260 | AT82: 3618 | AU82: 826802175 | AV82: -1 | AW82: -1 | AX82: 553 | AZ82: -1 | BB82: -1 | BD82: -1 | BE82: 0 | BF82: 613 | BG82: 1 | BH82: -1 | BI82: -1 | BJ82: -1 | BK82: -1 | BL82: -1 | BM82: Wood Long Bow | BP82: =COUNTIF(knownSpells_monsters!C[-67],RC[-1]) -> 0
A83: 0 | B83: Orc_Bow.3 | C83: 38 | D83: 30 | E83: 25 | F83: 19 | G83: 154 | H83: 81 | I83: 0 | J83: 0 | K83: 20 | L83: 22 | M83: 7 | N83: 15 | O83: 31 | P83: -1 | Q83: 235 | R83: 185 | S83: 7 | T83: 21 | U83: 7 | V83: 0 | W83: 0 | X83: 50 | Y83: 0 | Z83: 0 | AA83: 0 | AB83: 0 | AC83: 0 | AD83: 0 | AE83: 0 | AF83: 65 | AG83: 3 | AH83: 1 | AI83: 1 | AJ83: 14 | AK83: 90 | AL83: 0 | AM83: 3 | AN83: 11576 | AO83: 80 | AP83: 4410 | AQ83: 12120 | AR83: 30 | AS83: 8820 | AT83: 24241 | AU83: 826802175 | AV83: -1 | AW83: -1 | AX83: 1416 | AZ83: -1 | BB83: -1 | BD83: -1 | BE83: 0 | BF83: 614 | BG83: 1 | BH83: -1 | BI83: -1 | BJ83: -1 | BK83: -1 | BL83: -1 | BM83: Uncommon Wood Long Bow | BP83: =COUNTIF(knownSpells_monsters!C[-67],RC[-1]) -> 0
A84: 0 | B84: Orc_Bow.4 | C84: 44 | D84: 36 | E84: 30 | F84: 24 | G84: 246 | H84: 73 | I84: 0 | J84: 0 | K84: 21 | L84: 23 | M84: 8 | N84: 25 | O84: 49 | P84: -1 | Q84: 325 | R84: 255 | S84: 12 | T84: 21 | U84: 7 | V84: 0 | W84: 0 | X84: 50 | Y84: 0 | Z84: 0 | AA84: 0 | AB84: 0 | AC84: 0 | AD84: 0 | AE84: 0 | AF84: 65 | AG84: 4 | AH84: 1 | AI84: 1 | AJ84: 14 | AK84: 90 | AL84: 0 | AM84: 4 | AN84: 60775 | AO84: 80 | AP84: 30870 | AQ84: 81206 | AR84: 30 | AS84: 61740 | AT84: 162412 | AU84: 826802175 | AV84: -1 | AW84: -1 | AX84: 3624 | AY84: Bless | AZ84: 10 | BB84: -1 | BD84: -1 | BE84: 30 | BF84: 615 | BG84: 1 | BH84: -1 | BI84: -1 | BJ84: -1 | BK84: -1 | BL84: -1 | BM84: Uncommon Magic Wood Short Bow | BP84: =COUNTIF(knownSpells_monsters!C[-67],RC[-1]) -> 0
A85: 0 | B85: Orc_Bow.5 | C85: 72 | D85: 64 | E85: 58 | F85: 52 | G85: 3686 | H85: 73 | I85: 0 | J85: 0 | K85: 21 | L85: 21 | M85: 8 | N85: 197 | O85: 393 | P85: -1 | Q85: 425 | R85: 355 | S85: 12 | T85: 21 | U85: 7 | V85: 0 | W85: 0 | X85: 50 | Y85: 0 | Z85: 0 | AA85: 0 | AB85: 0 | AC85: 0 | AD85: 0 | AE85: 0 | AF85: 65 | AG85: 5 | AH85: 1 | AI85: 1 | AJ85: 14 | AK85: 0 | AL85: 0 | AM85: 6 | AN85: 121551 | AO85: 80 | AP85: 92610 | AQ85: 243618 | AR85: 30 | AS85: 185220 | AT85: 487236 | AU85: 826802175 | AV85: 0 | AW85: 0 | AX85: 217433 | AY85: Bless | AZ85: 10 | BB85: -1 | BD85: -1 | BE85: 100 | BF85: 804 | BG85: 1 | BH85: -1 | BI85: -1 | BJ85: -1 | BK85: -1 | BL85: -1 | BM85: Uncommon Magic Wood Short Bow | BP85: =COUNTIF(knownSpells_monsters!C[-67],RC[-1]) -> 0
A86: 0 | B86: Ogre | C86: 49 | D86: 15 | E86: 10 | F86: 15 | G86: 200 | H86: 150 | I86: 0 | J86: 0 | K86: 15 | L86: 12 | M86: 5 | N86: 20 | O86: 40 | P86: -1 | Q86: 80 | R86: 70 | S86: 5 | T86: 12 | U86: 6 | V86: 60 | W86: 30 | X86: 60 | Y86: 30 | Z86: 30 | AA86: 0 | AB86: 0 | AC86: 20 | AD86: 0 | AE86: 20 | AF86: 66 | AG86: 1 | AH86: 2 | AI86: 1 | AJ86: 8 | AK86: 0 | AL86: 0 | AM86: 1 | AN86: 1200 | AO86: 90 | AP86: 150 | AQ86: 750 | AR86: 40 | AS86: 300 | AT86: 1500 | AU86: 566755327 | AV86: -1 | AW86: -1 | AX86: 1200 | AZ86: -1 | BB86: -1 | BD86: -1 | BE86: 0 | BF86: 616 | BG86: 1 | BH86: -1 | BI86: -1 | BJ86: -1 | BK86: -1 | BL86: -1 | BP86: =COUNTIF(knownSpells_monsters!C[-67],RC[-1]) -> 0
A87: 0 | B87: Ogre.2 | C87: 55 | D87: 20 | E87: 15 | F87: 20 | G87: 320 | H87: 135 | I87: 0 | J87: 0 | K87: 16 | L87: 13 | M87: 6 | N87: 32 | O87: 64 | P87: -1 | Q87: 170 | R87: 140 | S87: 9 | T87: 12 | U87: 6 | V87: 60 | W87: 30 | X87: 60 | Y87: 30 | Z87: 30 | AA87: 0 | AB87: 0 | AC87: 20 | AD87: 0 | AE87: 20 | AF87: 66 | AG87: 2 | AH87: 2 | AI87: 1 | AJ87: 8 | AK87: 0 | AL87: 0 | AM87: 2 | AN87: 6300 | AO87: 90 | AP87: 1050 | AQ87: 5025 | AR87: 40 | AS87: 2100 | AT87: 10050 | AU87: 566755327 | AV87: -1 | AW87: -1 | AX87: 3072 | AZ87: -1 | BB87: -1 | BD87: -1 | BE87: 0 | BF87: 617 | BG87: 1 | BH87: -1 | BI87: -1 | BJ87: -1 | BK87: -1 | BL87: -1 | BP87: =COUNTIF(knownSpells_monsters!C[-67],RC[-1]) -> 0
A88: 0 | B88: Ogre.3 | C88: 62 | D88: 25 | E88: 19 | F88: 25 | G88: 512 | H88: 122 | I88: 0 | J88: 0 | K88: 17 | L88: 14 | M88: 6 | N88: 51 | O88: 102 | P88: -1 | Q88: 260 | R88: 210 | S88: 14 | T88: 12 | U88: 6 | V88: 60 | W88: 30 | X88: 60 | Y88: 30 | Z88: 30 | AA88: 0 | AB88: 0 | AC88: 20 | AD88: 0 | AE88: 20 | AF88: 66 | AG88: 3 | AH88: 2 | AI88: 1 | AJ88: 8 | AK88: 0 | AL88: 0 | AM88: 3 | AN88: 33075 | AO88: 90 | AP88: 7350 | AQ88: 33668 | AR88: 40 | AS88: 14700 | AT88: 67335 | AU88: 566755327 | AV88: -1 | AW88: -1 | AX88: 7864 | AZ88: -1 | BB88: -1 | BD88: -1 | BE88: 0 | BF88: 618 | BG88: 1 | BH88: -1 | BI88: -1 | BJ88: -1 | BK88: -1 | BL88: -1 | BP88: =COUNTIF(knownSpells_monsters!C[-67],RC[-1]) -> 0
A89: 0 | B89: Ogre.4 | C89: 69 | D89: 30 | E89: 24 | F89: 30 | G89: 819 | H89: 109 | I89: 0 | J89: 0 | K89: 18 | L89: 15 | M89: 7 | N89: 82 | O89: 164 | P89: -1 | Q89: 350 | R89: 280 | S89: 22 | T89: 12 | U89: 6 | V89: 60 | W89: 30 | X89: 60 | Y89: 30 | Z89: 30 | AA89: 0 | AB89: 0 | AC89: 20 | AD89: 0 | AE89: 20 | AF89: 66 | AG89: 4 | AH89: 2 | AI89: 1 | AJ89: 8 | AK89: 0 | AL89: 0 | AM89: 4 | AN89: 173644 | AO89: 90 | AP89: 51450 | AQ89: 225572 | AR89: 40 | AS89: 102900 | AT89: 451145 | AU89: 566755327 | AV89: -1 | AW89: -1 | AX89: 20133 | AY89: Haste | AZ89: 10 | BB89: -1 | BD89: -1 | BE89: 30 | BF89: 619 | BG89: 1 | BH89: -1 | BI89: -1 | BJ89: -1 | BK89: -1 | BL89: -1 | BP89: =COUNTIF(knownSpells_monsters!C[-67],RC[-1]) -> 0
A90: 0 | B90: Ogre.5 | C90: 97 | D90: 58 | E90: 52 | F90: 58 | G90: 12288 | H90: 109 | I90: 0 | J90: 0 | K90: 18 | L90: 18 | M90: 7 | N90: 655 | O90: 910 | P90: -1 | Q90: 450 | R90: 380 | S90: 22 | T90: 12 | U90: 6 | V90: 60 | W90: 30 | X90: 60 | Y90: 30 | Z90: 30 | AA90: 0 | AB90: 0 | AC90: 20 | AD90: 0 | AE90: 20 | AF90: 66 | AG90: 5 | AH90: 2 | AI90: 1 | AJ90: 8 | AK90: 0 | AL90: 0 | AM90: 6 | AN90: 347288 | AO90: 90 | AP90: 154350 | AQ90: 676717 | AR90: 40 | AS90: 308700 | AT90: 1353434 | AU90: 566755327 | AV90: 0 | AW90: 0 | AX90: 1923957 | AY90: Haste | AZ90: 10 | BB90: -1 | BD90: -1 | BE90: 100 | BF90: 805 | BG90: 1 | BH90: -1 | BI90: -1 | BJ90: -1 | BK90: -1 | BL90: -1 | BP90: =COUNTIF(knownSpells_monsters!C[-67],RC[-1]) -> 0
A91: 0 | B91: Troll | C91: 55 | D91: 10 | E91: 8 | F91: 20 | G91: 300 | H91: 100 | I91: 0 | J91: 0 | K91: 8 | L91: 8 | M91: 4 | N91: 15 | O91: 30 | P91: -1 | Q91: 60 | R91: 100 | S91: 10 | T91: 10 | U91: 6 | V91: 30 | W91: 60 | X91: 30 | Y91: 60 | Z91: 30 | AA91: 0 | AB91: 0 | AC91: 50 | AD91: 30 | AE91: 30 | AF91: 68 | AG91: 1 | AH91: 2 | AI91: 1 | AJ91: 18 | AK91: 0 | AL91: 0 | AM91: 1 | AN91: 1800 | AO91: 90 | AP91: 600 | AQ91: 900 | AR91: -1 | AS91: -1 | AT91: -1 | AU91: 629669887 | AV91: 500 | AW91: 2000 | AX91: 1350 | AZ91: -1 | BB91: -1 | BD91: -1 | BE91: 0 | BF91: 620 | BG91: 1 | BH91: -1 | BI91: -1 | BJ91: -1 | BK91: -1 | BL91: -1 | BP91: =COUNTIF(knownSpells_monsters!C[-67],RC[-1]) -> 0
A92: 0 | B92: Troll.2 | C92: 62 | D92: 15 | E92: 12 | F92: 25 | G92: 480 | H92: 90 | I92: 0 | J92: 0 | K92: 9 | L92: 9 | M92: 5 | N92: 24 | O92: 48 | P92: -1 | Q92: 150 | R92: 170 | S92: 16 | T92: 10 | U92: 6 | V92: 30 | W92: 60 | X92: 30 | Y92: 60 | Z92: 30 | AA92: 0 | AB92: 0 | AC92: 50 | AD92: 30 | AE92: 30 | AF92: 68 | AG92: 2 | AH92: 2 | AI92: 1 | AJ92: 18 | AK92: 0 | AL92: 0 | AM92: 2 | AN92: 9450 | AO92: 90 | AP92: 4200 | AQ92: 6030 | AR92: -1 | AS92: -1 | AT92: -1 | AU92: 629669887 | AV92: 3500 | AW92: 13400 | AX92: 3456 | AZ92: -1 | BB92: -1 | BD92: -1 | BE92: 0 | BF92: 621 | BG92: 1 | BH92: -1 | BI92: -1 | BJ92: -1 | BK92: -1 | BL92: -1 | BP92: =COUNTIF(knownSpells_monsters!C[-67],RC[-1]) -> 0
A93: 0 | B93: Troll.3 | C93: 69 | D93: 19 | E93: 17 | F93: 30 | G93: 768 | H93: 81 | I93: 0 | J93: 0 | K93: 10 | L93: 10 | M93: 5 | N93: 38 | O93: 77 | P93: -1 | Q93: 240 | R93: 240 | S93: 25 | T93: 10 | U93: 6 | V93: 30 | W93: 60 | X93: 30 | Y93: 60 | Z93: 30 | AA93: 0 | AB93: 0 | AC93: 50 | AD93: 30 | AE93: 30 | AF93: 68 | AG93: 3 | AH93: 2 | AI93: 1 | AJ93: 18 | AK93: 0 | AL93: 0 | AM93: 3 | AN93: 49613 | AO93: 90 | AP93: 29400 | AQ93: 40401 | AR93: -1 | AS93: -1 | AT93: -1 | AU93: 629669887 | AV93: 24500 | AW93: 89780 | AX93: 8847 | AZ93: -1 | BB93: -1 | BD93: -1 | BE93: 0 | BF93: 622 | BG93: 1 | BH93: -1 | BI93: -1 | BJ93: -1 | BK93: -1 | BL93: -1 | BP93: =COUNTIF(knownSpells_monsters!C[-67],RC[-1]) -> 0
A94: 0 | B94: Troll.4 | C94: 76 | D94: 24 | E94: 22 | F94: 36 | G94: 1229 | H94: 73 | I94: 0 | J94: 0 | K94: 11 | L94: 11 | M94: 6 | N94: 61 | O94: 123 | P94: -1 | Q94: 330 | R94: 310 | S94: 39 | T94: 10 | U94: 6 | V94: 30 | W94: 60 | X94: 30 | Y94: 60 | Z94: 30 | AA94: 0 | AB94: 0 | AC94: 50 | AD94: 30 | AE94: 30 | AF94: 68 | AG94: 4 | AH94: 2 | AI94: 1 | AJ94: 18 | AK94: 0 | AL94: 0 | AM94: 4 | AN94: 260466 | AO94: 90 | AP94: 205800 | AQ94: 270687 | AR94: -1 | AS94: -1 | AT94: -1 | AU94: 629669887 | AV94: 171500 | AW94: 601526 | AX94: 22649 | AY94: Stone Curse | AZ94: 10 | BB94: -1 | BD94: -1 | BE94: 30 | BF94: 623 | BG94: 1 | BH94: -1 | BI94: -1 | BJ94: -1 | BK94: -1 | BL94: -1 | BP94: =COUNTIF(knownSpells_monsters!C[-67],RC[-1]) -> 0
A95: 0 | B95: Troll.5 | C95: 104 | D95: 52 | E95: 50 | F95: 64 | G95: 18432 | H95: 73 | I95: 0 | J95: 0 | K95: 11 | L95: 11 | M95: 6 | N95: 492 | O95: 747 | P95: -1 | Q95: 430 | R95: 410 | S95: 39 | T95: 10 | U95: 6 | V95: 30 | W95: 60 | X95: 30 | Y95: 60 | Z95: 30 | AA95: 0 | AB95: 0 | AC95: 50 | AD95: 30 | AE95: 30 | AF95: 68 | AG95: 5 | AH95: 2 | AI95: 1 | AJ95: 18 | AK95: 0 | AL95: 0 | AM95: 6 | AN95: 520931 | AO95: 90 | AP95: 617400 | AQ95: 812060 | AR95: 0 | AS95: 0 | AT95: 0 | AU95: 629669887 | AV95: 514500 | AW95: 1804578 | AX95: 2281955 | AY95: Stone Curse | AZ95: 10 | BB95: -1 | BD95: -1 | BE95: 100 | BF95: 806 | BG95: 1 | BH95: -1 | BI95: -1 | BJ95: -1 | BK95: -1 | BL95: -1 | BP95: =COUNTIF(knownSpells_monsters!C[-67],RC[-1]) -> 0
A96: 0 | B96: Bat_Sonic | C96: 7 | D96: 75 | E96: 3 | F96: 5 | G96: 15 | H96: 40 | I96: 0 | J96: 0 | K96: 32 | L96: 20 | M96: 6 | N96: 1 | O96: 4 | P96: 3 | Q96: 50 | R96: 45 | S96: 0 | T96: 8 | U96: 2 | V96: 0 | W96: 0 | X96: 50 | Y96: 0 | Z96: 0 | AA96: 100 | AB96: 100 | AC96: 100 | AD96: 100 | AE96: 0 | AF96: 70 | AG96: 1 | AH96: 1 | AI96: 3 | AJ96: 8 | AK96: 15 | AL96: 4 | AM96: 1 | AN96: 90 | AO96: -1 | AP96: -1 | AQ96: -1 | AR96: -1 | AS96: -1 | AT96: -1 | AU96: -1 | AV96: -1 | AW96: -1 | AX96: 38 | AZ96: -1 | BB96: -1 | BD96: -1 | BE96: 0 | BF96: 624 | BG96: 1 | BH96: -1 | BI96: -1 | BJ96: -1 | BK96: -1 | BL96: -1 | BM96: Sonic Beam | BP96: =COUNTIF(knownSpells_monsters!C[-67],RC[-1]) -> 0
A97: 0 | B97: Bat_Sonic.2 | C97: 11 | D97: 83 | E97: 7 | F97: 9 | G97: 24 | H97: 36 | I97: 0 | J97: 0 | K97: 33 | L97: 21 | M97: 7 | N97: 2 | O97: 6 | P97: 3 | Q97: 140 | R97: 115 | S97: 1 | T97: 8 | U97: 2 | V97: 0 | W97: 0 | X97: 50 | Y97: 0 | Z97: 0 | AA97: 100 | AB97: 100 | AC97: 100 | AD97: 100 | AE97: 0 | AF97: 70 | AG97: 2 | AH97: 1 | AI97: 3 | AJ97: 8 | AK97: 15 | AL97: 4 | AM97: 2 | AN97: 473 | AO97: -1 | AP97: -1 | AQ97: -1 | AR97: -1 | AS97: -1 | AT97: -1 | AU97: -1 | AV97: -1 | AW97: -1 | AX97: 96 | AZ97: -1 | BB97: -1 | BD97: -1 | BE97: 0 | BF97: 625 | BG97: 1 | BH97: -1 | BI97: -1 | BJ97: -1 | BK97: -1 | BL97: -1 | BM97: Sonic Beam | BP97: =COUNTIF(knownSpells_monsters!C[-67],RC[-1]) -> 0
A98: 0 | B98: Bat_Sonic.3 | C98: 16 | D98: 91 | E98: 12 | F98: 14 | G98: 38 | H98: 32 | I98: 0 | J98: 0 | K98: 34 | L98: 22 | M98: 7 | N98: 3 | O98: 10 | P98: 3 | Q98: 230 | R98: 185 | S98: 3 | T98: 8 | U98: 2 | V98: 0 | W98: 0 | X98: 50 | Y98: 0 | Z98: 0 | AA98: 100 | AB98: 100 | AC98: 100 | AD98: 100 | AE98: 0 | AF98: 70 | AG98: 3 | AH98: 1 | AI98: 3 | AJ98: 8 | AK98: 15 | AL98: 4 | AM98: 3 | AN98: 2481 | AO98: -1 | AP98: -1 | AQ98: -1 | AR98: -1 | AS98: -1 | AT98: -1 | AU98: -1 | AV98: -1 | AW98: -1 | AX98: 246 | AZ98: -1 | BB98: -1 | BD98: -1 | BE98: 0 | BF98: 626 | BG98: 1 | BH98: -1 | BI98: -1 | BJ98: -1 | BK98: -1 | BL98: -1 | BM98: Sonic Beam | BP98: =COUNTIF(knownSpells_monsters!C[-67],RC[-1]) -> 0
A99: 0 | B99: Bat_Sonic.4 | C99: 21 | D99: 99 | E99: 16 | F99: 18 | G99: 61 | H99: 29 | I99: 0 | J99: 0 | K99: 35 | L99: 23 | M99: 8 | N99: 4 | O99: 16 | P99: 3 | Q99: 320 | R99: 255 | S99: 5 | T99: 8 | U99: 2 | V99: 0 | W99: 0 | X99: 50 | Y99: 0 | Z99: 0 | AA99: 100 | AB99: 100 | AC99: 100 | AD99: 100 | AE99: 0 | AF99: 70 | AG99: 4 | AH99: 1 | AI99: 3 | AJ99: 8 | AK99: 15 | AL99: 4 | AM99: 4 | AN99: 13023 | AO99: -1 | AP99: -1 | AQ99: -1 | AR99: -1 | AS99: -1 | AT99: -1 | AU99: -1 | AV99: -1 | AW99: -1 | AX99: 629 | AY99: Darkness | AZ99: 10 | BB99: -1 | BD99: -1 | BE99: 30 | BF99: 627 | BG99: 1 | BH99: -1 | BI99: -1 | BJ99: -1 | BK99: -1 | BL99: -1 | BM99: Sonic Beam | BP99: =COUNTIF(knownSpells_monsters!C[-67],RC[-1]) -> 0
A100: 0 | B100: Bat_Sonic.5 | C100: 49 | D100: 127 | E100: 44 | F100: 46 | G100: 922 | H100: 29 | I100: 0 | J100: 0 | K100: 32 | L100: 32 | M100: 8 | N100: 33 | O100: 131 | P100: 3 | Q100: 420 | R100: 355 | S100: 5 | T100: 8 | U100: 2 | V100: 0 | W100: 0 | X100: 50 | Y100: 0 | Z100: 0 | AA100: 100 | AB100: 100 | AC100: 100 | AD100: 100 | AE100: 0 | AF100: 70 | AG100: 5 | AH100: 1 | AI100: 3 | AJ100: 8 | AK100: 0 | AL100: 4 | AM100: 6 | AN100: 26047 | AO100: 0 | AP100: 0 | AQ100: 0 | AR100: 0 | AS100: 0 | AT100: 0 | AU100: -1 | AV100: 0 | AW100: 0 | AX100: 15099 | AY100: Darkness | AZ100: 10 | BB100: -1 | BD100: -1 | BE100: 100 | BF100: 807 | BG100: 1 | BH100: -1 | BI100: -1 | BJ100: -1 | BK100: -1 | BL100: -1 | BM100: Sonic Beam | BP100: =COUNTIF(knownSpells_monsters!C[-67],RC[-1]) -> 0
A101: 0 | B101: Ghost | C101: 0 | D101: 10 | E101: 30 | F101: 50 | G101: 50 | H101: 200 | I101: 0 | J101: 0 | K101: 10 | L101: 16 | M101: 6 | N101: 1 | O101: 8 | P101: -1 | Q101: 40 | R101: 50 | S101: 2 | T101: 8 | U101: 4 | V101: 0 | W101: 50 | X101: 0 | Y101: 100 | Z101: 0 | AA101: 0 | AB101: 0 | AC101: 0 | AD101: 0 | AE101: 0 | AF101: 69 | AG101: 1 | AH101: 1 | AI101: 2 | AJ101: 12 | AK101: 0 | AL101: 0 | AM101: 2 | AN101: 120 | AO101: -1 | AP101: -1 | AQ101: -1 | AR101: -1 | AS101: -1 | AT101: -1 | AU101: -1 | AV101: -1 | AW101: -1 | AX101: 45 | AZ101: -1 | BB101: -1 | BD101: -1 | BE101: 0 | BF101: 628 | BG101: 1 | BH101: -1 | BI101: -1 | BJ101: -1 | BK101: -1 | BL101: -1 | BP101: =COUNTIF(knownSpells_monsters!C[-67],RC[-1]) -> 0
A102: 0 | B102: Ghost.2 | C102: 0 | D102: 15 | E102: 36 | F102: 57 | G102: 80 | H102: 180 | I102: 0 | J102: 0 | K102: 11 | L102: 17 | M102: 7 | N102: 2 | O102: 13 | P102: -1 | Q102: 130 | R102: 120 | S102: 4 | T102: 8 | U102: 4 | V102: 0 | W102: 50 | X102: 0 | Y102: 100 | Z102: 0 | AA102: 0 | AB102: 0 | AC102: 0 | AD102: 0 | AE102: 0 | AF102: 69 | AG102: 2 | AH102: 1 | AI102: 2 | AJ102: 12 | AK102: 0 | AL102: 0 | AM102: 3 | AN102: 630 | AO102: -1 | AP102: -1 | AQ102: -1 | AR102: -1 | AS102: -1 | AT102: -1 | AU102: -1 | AV102: -1 | AW102: -1 | AX102: 115 | AZ102: -1 | BB102: -1 | BD102: -1 | BE102: 0 | BF102: 629 | BG102: 1 | BH102: -1 | BI102: -1 | BJ102: -1 | BK102: -1 | BL102: -1 | BP102: =COUNTIF(knownSpells_monsters!C[-67],RC[-1]) -> 0
A103: 0 | B103: Ghost.3 | C103: 0 | D103: 19 | E103: 41 | F103: 63 | G103: 128 | H103: 162 | I103: 0 | J103: 0 | K103: 12 | L103: 18 | M103: 7 | N103: 3 | O103: 20 | P103: -1 | Q103: 220 | R103: 190 | S103: 7 | T103: 8 | U103: 4 | V103: 0 | W103: 50 | X103: 0 | Y103: 100 | Z103: 0 | AA103: 0 | AB103: 0 | AC103: 0 | AD103: 0 | AE103: 0 | AF103: 69 | AG103: 3 | AH103: 1 | AI103: 2 | AJ103: 12 | AK103: 0 | AL103: 0 | AM103: 4 | AN103: 3308 | AO103: -1 | AP103: -1 | AQ103: -1 | AR103: -1 | AS103: -1 | AT103: -1 | AU103: -1 | AV103: -1 | AW103: -1 | AX103: 295 | AZ103: -1 | BB103: -1 | BD103: -1 | BE103: 0 | BF103: 630 | BG103: 1 | BH103: -1 | BI103: -1 | BJ103: -1 | BK103: -1 | BL103: -1 | BP103: =COUNTIF(knownSpells_monsters!C[-67],RC[-1]) -> 0
A104: 0 | B104: Ghost.4 | C104: 0 | D104: 24 | E104: 47 | F104: 70 | G104: 205 | H104: 146 | I104: 0 | J104: 0 | K104: 13 | L104: 19 | M104: 8 | N104: 4 | O104: 33 | P104: -1 | Q104: 310 | R104: 260 | S104: 12 | T104: 8 | U104: 4 | V104: 0 | W104: 50 | X104: 0 | Y104: 100 | Z104: 0 | AA104: 0 | AB104: 0 | AC104: 0 | AD104: 0 | AE104: 0 | AF104: 69 | AG104: 4 | AH104: 1 | AI104: 2 | AJ104: 12 | AK104: 0 | AL104: 0 | AM104: 5 | AN104: 17364 | AO104: -1 | AP104: -1 | AQ104: -1 | AR104: -1 | AS104: -1 | AT104: -1 | AU104: -1 | AV104: -1 | AW104: -1 | AX104: 755 | AY104: Drain Life | AZ104: 10 | BB104: -1 | BD104: -1 | BE104: 30 | BF104: 631 | BG104: 1 | BH104: -1 | BI104: -1 | BJ104: -1 | BK104: -1 | BL104: -1 | BP104: =COUNTIF(knownSpells_monsters!C[-67],RC[-1]) -> 0
A105: 0 | B105: Ghost.5 | C105: 28 | D105: 52 | E105: 75 | F105: 98 | G105: 3072 | H105: 146 | I105: 0 | J105: 0 | K105: 13 | L105: 13 | M105: 8 | N105: 33 | O105: 262 | P105: -1 | Q105: 410 | R105: 360 | S105: 12 | T105: 8 | U105: 4 | V105: 0 | W105: 50 | X105: 0 | Y105: 100 | Z105: 0 | AA105: 0 | AB105: 0 | AC105: 0 | AD105: 0 | AE105: 0 | AF105: 69 | AG105: 5 | AH105: 1 | AI105: 2 | AJ105: 12 | AK105: 0 | AL105: 0 | AM105: 7 | AN105: 34729 | AO105: 0 | AP105: 0 | AQ105: 0 | AR105: 0 | AS105: 0 | AT105: 0 | AU105: -1 | AV105: 0 | AW105: 0 | AX105: 90597 | AY105: Drain Life | AZ105: 10 | BB105: -1 | BD105: -1 | BE105: 100 | BF105: 808 | BG105: 1 | BH105: -1 | BI105: -1 | BJ105: -1 | BK105: -1 | BL105: -1 | BP105: =COUNTIF(knownSpells_monsters!C[-67],RC[-1]) -> 0
A106: 0 | B106: Bee | C106: 5 | D106: 60 | E106: 1 | F106: 2 | G106: 10 | H106: 40 | I106: 0 | J106: 0 | K106: 24 | L106: 20 | M106: 6 | N106: 3 | O106: 5 | P106: 3 | Q106: 30 | R106: 10 | S106: 0 | T106: 6 | U106: 2 | V106: 0 | W106: 50 | X106: 0 | Y106: 0 | Z106: 0 | AA106: 0 | AB106: 0 | AC106: 0 | AD106: 0 | AE106: 0 | AF106: 73 | AG106: 1 | AH106: 1 | AI106: 2 | AJ106: 8 | AK106: 0 | AL106: 3 | AM106: 1 | AN106: 84 | AO106: -1 | AP106: -1 | AQ106: -1 | AR106: -1 | AS106: -1 | AT106: -1 | AU106: -1 | AV106: -1 | AW106: -1 | AX106: 8 | AZ106: -1 | BB106: -1 | BD106: -1 | BE106: 0 | BF106: 632 | BG106: 1 | BH106: -1 | BI106: -1 | BJ106: -1 | BK106: -1 | BL106: -1 | BP106: =COUNTIF(knownSpells_monsters!C[-67],RC[-1]) -> 0
A107: 0 | B107: Bee.2 | C107: 9 | D107: 67 | E107: 5 | F107: 6 | G107: 16 | H107: 36 | I107: 0 | J107: 0 | K107: 25 | L107: 21 | M107: 7 | N107: 5 | O107: 8 | P107: 3 | Q107: 120 | R107: 80 | S107: 1 | T107: 6 | U107: 2 | V107: 0 | W107: 50 | X107: 0 | Y107: 0 | Z107: 0 | AA107: 0 | AB107: 0 | AC107: 0 | AD107: 0 | AE107: 0 | AF107: 73 | AG107: 2 | AH107: 1 | AI107: 2 | AJ107: 8 | AK107: 0 | AL107: 3 | AM107: 2 | AN107: 441 | AO107: -1 | AP107: -1 | AQ107: -1 | AR107: -1 | AS107: -1 | AT107: -1 | AU107: -1 | AV107: -1 | AW107: -1 | AX107: 20 | AZ107: -1 | BB107: -1 | BD107: -1 | BE107: 0 | BF107: 633 | BG107: 1 | BH107: -1 | BI107: -1 | BJ107: -1 | BK107: -1 | BL107: -1 | BP107: =COUNTIF(knownSpells_monsters!C[-67],RC[-1]) -> 0
A108: 0 | B108: Bee.3 | C108: 14 | D108: 74 | E108: 9 | F108: 10 | G108: 26 | H108: 32 | I108: 0 | J108: 0 | K108: 26 | L108: 22 | M108: 7 | N108: 8 | O108: 13 | P108: 3 | Q108: 210 | R108: 150 | S108: 3 | T108: 6 | U108: 2 | V108: 0 | W108: 50 | X108: 0 | Y108: 0 | Z108: 0 | AA108: 0 | AB108: 0 | AC108: 0 | AD108: 0 | AE108: 0 | AF108: 73 | AG108: 3 | AH108: 1 | AI108: 2 | AJ108: 8 | AK108: 0 | AL108: 3 | AM108: 3 | AN108: 2315 | AO108: -1 | AP108: -1 | AQ108: -1 | AR108: -1 | AS108: -1 | AT108: -1 | AU108: -1 | AV108: -1 | AW108: -1 | AX108: 52 | AZ108: -1 | BB108: -1 | BD108: -1 | BE108: 0 | BF108: 634 | BG108: 1 | BH108: -1 | BI108: -1 | BJ108: -1 | BK108: -1 | BL108: -1 | BP108: =COUNTIF(knownSpells_monsters!C[-67],RC[-1]) -> 0
A109: 0 | B109: Bee.4 | C109: 18 | D109: 82 | E109: 14 | F109: 15 | G109: 41 | H109: 29 | I109: 0 | J109: 0 | K109: 27 | L109: 23 | M109: 8 | N109: 12 | O109: 20 | P109: 3 | Q109: 300 | R109: 220 | S109: 5 | T109: 6 | U109: 2 | V109: 0 | W109: 50 | X109: 0 | Y109: 0 | Z109: 0 | AA109: 0 | AB109: 0 | AC109: 0 | AD109: 0 | AE109: 0 | AF109: 73 | AG109: 4 | AH109: 1 | AI109: 2 | AJ109: 8 | AK109: 0 | AL109: 3 | AM109: 4 | AN109: 12155 | AO109: -1 | AP109: -1 | AQ109: -1 | AR109: -1 | AS109: -1 | AT109: -1 | AU109: -1 | AV109: -1 | AW109: -1 | AX109: 134 | AY109: Invisibility | AZ109: 10 | BB109: -1 | BD109: -1 | BE109: 30 | BF109: 635 | BG109: 1 | BH109: -1 | BI109: -1 | BJ109: -1 | BK109: -1 | BL109: -1 | BP109: =COUNTIF(knownSpells_monsters!C[-67],RC[-1]) -> 0
A110: 0 | B110: Bee.5 | C110: 46 | D110: 110 | E110: 42 | F110: 43 | G110: 614 | H110: 29 | I110: 0 | J110: 0 | K110: 27 | L110: 27 | M110: 8 | N110: 98 | O110: 164 | P110: 3 | Q110: 400 | R110: 320 | S110: 5 | T110: 6 | U110: 2 | V110: 0 | W110: 50 | X110: 0 | Y110: 0 | Z110: 0 | AA110: 0 | AB110: 0 | AC110: 0 | AD110: 0 | AE110: 0 | AF110: 73 | AG110: 5 | AH110: 1 | AI110: 2 | AJ110: 8 | AK110: 0 | AL110: 3 | AM110: 6 | AN110: 24310 | AO110: 0 | AP110: 0 | AQ110: 0 | AR110: 0 | AS110: 0 | AT110: 0 | AU110: -1 | AV110: 0 | AW110: 0 | AX110: 16106 | AY110: Invisibility | AZ110: 10 | BB110: -1 | BD110: -1 | BE110: 100 | BF110: 809 | BG110: 1 | BH110: -1 | BI110: -1 | BJ110: -1 | BK110: -1 | BL110: -1 | BP110: =COUNTIF(knownSpells_monsters!C[-67],RC[-1]) -> 0
A111: 0 | B111: Squirrel | C111: 10 | D111: 60 | E111: 3 | F111: 6 | G111: 20 | H111: 50 | I111: 0 | J111: 0 | K111: 24 | L111: 16 | M111: 8 | N111: 3 | O111: 6 | P111: -1 | Q111: 40 | R111: 0 | S111: 0 | T111: 8 | U111: 4 | V111: 50 | W111: 0 | X111: 0 | Y111: 0 | Z111: 0 | AA111: 0 | AB111: 0 | AC111: 0 | AD111: 0 | AE111: 0 | AF111: 74 | AG111: 1 | AH111: 1 | AI111: 1 | AJ111: 10 | AK111: 0 | AL111: 5 | AM111: 1 | AN111: 36 | AO111: -1 | AP111: -1 | AQ111: -1 | AR111: -1 | AS111: -1 | AT111: -1 | AU111: -1 | AV111: -1 | AW111: -1 | AX111: 18 | AZ111: -1 | BB111: -1 | BD111: -1 | BE111: 0 | BF111: 636 | BG111: 1 | BH111: -1 | BI111: -1 | BJ111: -1 | BK111: -1 | BL111: -1 | BP111: =COUNTIF(knownSpells_monsters!C[-67],RC[-1]) -> 0
A112: 0 | B112: Squirrel.2 | C112: 15 | D112: 67 | E112: 7 | F112: 10 | G112: 32 | H112: 45 | I112: 0 | J112: 0 | K112: 25 | L112: 17 | M112: 9 | N112: 5 | O112: 10 | P112: -1 | Q112: 130 | R112: 70 | S112: 1 | T112: 8 | U112: 4 | V112: 50 | W112: 0 | X112: 0 | Y112: 0 | Z112: 0 | AA112: 0 | AB112: 0 | AC112: 0 | AD112: 0 | AE112: 0 | AF112: 74 | AG112: 2 | AH112: 1 | AI112: 1 | AJ112: 10 | AK112: 0 | AL112: 5 | AM112: 2 | AN112: 189 | AO112: -1 | AP112: -1 | AQ112: -1 | AR112: -1 | AS112: -1 | AT112: -1 | AU112: -1 | AV112: -1 | AW112: -1 | AX112: 46 | AZ112: -1 | BB112: -1 | BD112: -1 | BE112: 0 | BF112: 637 | BG112: 1 | BH112: -1 | BI112: -1 | BJ112: -1 | BK112: -1 | BL112: -1 | BP112: =COUNTIF(knownSpells_monsters!C[-67],RC[-1]) -> 0
A113: 0 | B113: Squirrel.3 | C113: 19 | D113: 74 | E113: 12 | F113: 15 | G113: 51 | H113: 41 | I113: 0 | J113: 0 | K113: 26 | L113: 18 | M113: 9 | N113: 8 | O113: 15 | P113: -1 | Q113: 220 | R113: 140 | S113: 3 | T113: 8 | U113: 4 | V113: 50 | W113: 0 | X113: 0 | Y113: 0 | Z113: 0 | AA113: 0 | AB113: 0 | AC113: 0 | AD113: 0 | AE113: 0 | AF113: 74 | AG113: 3 | AH113: 1 | AI113: 1 | AJ113: 10 | AK113: 0 | AL113: 5 | AM113: 3 | AN113: 992 | AO113: -1 | AP113: -1 | AQ113: -1 | AR113: -1 | AS113: -1 | AT113: -1 | AU113: -1 | AV113: -1 | AW113: -1 | AX113: 118 | AZ113: -1 | BB113: -1 | BD113: -1 | BE113: 0 | BF113: 638 | BG113: 1 | BH113: -1 | BI113: -1 | BJ113: -1 | BK113: -1 | BL113: -1 | BP113: =COUNTIF(knownSpells_monsters!C[-67],RC[-1]) -> 0
A114: 0 | B114: Squirrel.4 | C114: 24 | D114: 82 | E114: 16 | F114: 20 | G114: 82 | H114: 36 | I114: 0 | J114: 0 | K114: 27 | L114: 19 | M114: 10 | N114: 12 | O114: 25 | P114: -1 | Q114: 310 | R114: 210 | S114: 5 | T114: 8 | U114: 4 | V114: 50 | W114: 0 | X114: 0 | Y114: 0 | Z114: 0 | AA114: 0 | AB114: 0 | AC114: 0 | AD114: 0 | AE114: 0 | AF114: 74 | AG114: 4 | AH114: 1 | AI114: 1 | AJ114: 10 | AK114: 0 | AL114: 5 | AM114: 4 | AN114: 5209 | AO114: -1 | AP114: -1 | AQ114: -1 | AR114: -1 | AS114: -1 | AT114: -1 | AU114: -1 | AV114: -1 | AW114: -1 | AX114: 302 | AY114: Fire Arrow | AZ114: 10 | BB114: -1 | BD114: -1 | BE114: 30 | BF114: 639 | BG114: 1 | BH114: -1 | BI114: -1 | BJ114: -1 | BK114: -1 | BL114: -1 | BP114: =COUNTIF(knownSpells_monsters!C[-67],RC[-1]) -> 0
A115: 0 | B115: Squirrel.5 | C115: 52 | D115: 110 | E115: 44 | F115: 48 | G115: 1229 | H115: 36 | I115: 0 | J115: 0 | K115: 27 | L115: 27 | M115: 10 | N115: 98 | O115: 197 | P115: -1 | Q115: 410 | R115: 310 | S115: 5 | T115: 8 | U115: 4 | V115: 50 | W115: 0 | X115: 0 | Y115: 0 | Z115: 0 | AA115: 0 | AB115: 0 | AC115: 0 | AD115: 0 | AE115: 0 | AF115: 74 | AG115: 5 | AH115: 1 | AI115: 1 | AJ115: 10 | AK115: 0 | AL115: 5 | AM115: 6 | AN115: 10419 | AO115: 0 | AP115: 0 | AQ115: 0 | AR115: 0 | AS115: 0 | AT115: 0 | AU115: -1 | AV115: 0 | AW115: 0 | AX115: 36239 | AY115: Fire Arrow | AZ115: 10 | BB115: -1 | BD115: -1 | BE115: 100 | BF115: 810 | BG115: 1 | BH115: -1 | BI115: -1 | BJ115: -1 | BK115: -1 | BL115: -1 | BP115: =COUNTIF(knownSpells_monsters!C[-67],RC[-1]) -> 0
A116: 0 | B116: Foot_Animated | C116: 15 | D116: 30 | E116: 1 | F116: 3 | G116: 30 | H116: 60 | I116: 0 | J116: 0 | K116: 18 | L116: 16 | M116: 4 | N116: 1 | O116: 5 | P116: -1 | Q116: 0 | R116: 30 | S116: 0 | T116: 10 | U116: 4 | V116: 0 | W116: 0 | X116: 66 | Y116: 0 | Z116: 0 | AA116: 0 | AB116: 0 | AC116: 0 | AD116: 0 | AE116: 0 | AF116: 75 | AG116: 1 | AH116: 1 | AI116: 1 | AJ116: 10 | AK116: 0 | AL116: 0 | AM116: 0 | AN116: 24 | AO116: -1 | AP116: -1 | AQ116: -1 | AR116: -1 | AS116: -1 | AT116: -1 | AU116: -1 | AV116: -1 | AW116: -1 | AX116: 18 | AZ116: -1 | BB116: -1 | BD116: -1 | BE116: 0 | BF116: 640 | BG116: 1 | BH116: -1 | BI116: -1 | BJ116: -1 | BK116: -1 | BL116: -1 | BP116: =COUNTIF(knownSpells_monsters!C[-67],RC[-1]) -> 0
A117: 0 | B117: Foot_Animated.2 | C117: 20 | D117: 36 | E117: 5 | F117: 7 | G117: 48 | H117: 54 | I117: 0 | J117: 0 | K117: 19 | L117: 17 | M117: 5 | N117: 2 | O117: 8 | P117: -1 | Q117: 90 | R117: 100 | S117: 1 | T117: 10 | U117: 4 | V117: 0 | W117: 0 | X117: 66 | Y117: 0 | Z117: 0 | AA117: 0 | AB117: 0 | AC117: 0 | AD117: 0 | AE117: 0 | AF117: 75 | AG117: 2 | AH117: 1 | AI117: 1 | AJ117: 10 | AK117: 0 | AL117: 0 | AM117: 0 | AN117: 126 | AO117: -1 | AP117: -1 | AQ117: -1 | AR117: -1 | AS117: -1 | AT117: -1 | AU117: -1 | AV117: -1 | AW117: -1 | AX117: 46 | AZ117: -1 | BB117: -1 | BD117: -1 | BE117: 0 | BF117: 641 | BG117: 1 | BH117: -1 | BI117: -1 | BJ117: -1 | BK117: -1 | BL117: -1 | BP117: =COUNTIF(knownSpells_monsters!C[-67],RC[-1]) -> 0
A118: 0 | B118: Foot_Animated.3 | C118: 25 | D118: 41 | E118: 9 | F118: 12 | G118: 77 | H118: 49 | I118: 0 | J118: 0 | K118: 20 | L118: 18 | M118: 5 | N118: 3 | O118: 13 | P118: -1 | Q118: 180 | R118: 170 | S118: 3 | T118: 10 | U118: 4 | V118: 0 | W118: 0 | X118: 66 | Y118: 0 | Z118: 0 | AA118: 0 | AB118: 0 | AC118: 0 | AD118: 0 | AE118: 0 | AF118: 75 | AG118: 3 | AH118: 1 | AI118: 1 | AJ118: 10 | AK118: 0 | AL118: 0 | AM118: 1 | AN118: 662 | AO118: -1 | AP118: -1 | AQ118: -1 | AR118: -1 | AS118: -1 | AT118: -1 | AU118: -1 | AV118: -1 | AW118: -1 | AX118: 118 | AZ118: -1 | BB118: -1 | BD118: -1 | BE118: 0 | BF118: 642 | BG118: 1 | BH118: -1 | BI118: -1 | BJ118: -1 | BK118: -1 | BL118: -1 | BP118: =COUNTIF(knownSpells_monsters!C[-67],RC[-1]) -> 0
A119: 0 | B119: Foot_Animated.4 | C119: 30 | D119: 47 | E119: 14 | F119: 16 | G119: 123 | H119: 44 | I119: 0 | J119: 0 | K119: 21 | L119: 19 | M119: 6 | N119: 4 | O119: 20 | P119: -1 | Q119: 270 | R119: 240 | S119: 5 | T119: 10 | U119: 4 | V119: 0 | W119: 0 | X119: 66 | Y119: 0 | Z119: 0 | AA119: 0 | AB119: 0 | AC119: 0 | AD119: 0 | AE119: 0 | AF119: 75 | AG119: 4 | AH119: 1 | AI119: 1 | AJ119: 10 | AK119: 0 | AL119: 0 | AM119: 2 | AN119: 3473 | AO119: -1 | AP119: -1 | AQ119: -1 | AR119: -1 | AS119: -1 | AT119: -1 | AU119: -1 | AV119: -1 | AW119: -1 | AX119: 302 | AY119: Curse | AZ119: 10 | BB119: -1 | BD119: -1 | BE119: 30 | BF119: 643 | BG119: 1 | BH119: -1 | BI119: -1 | BJ119: -1 | BK119: -1 | BL119: -1 | BP119: =COUNTIF(knownSpells_monsters!C[-67],RC[-1]) -> 0
A120: 0 | B120: Foot_Animated.5 | C120: 58 | D120: 75 | E120: 42 | F120: 44 | G120: 1843 | H120: 44 | I120: 0 | J120: 0 | K120: 21 | L120: 21 | M120: 6 | N120: 33 | O120: 164 | P120: -1 | Q120: 370 | R120: 340 | S120: 5 | T120: 10 | U120: 4 | V120: 0 | W120: 0 | X120: 66 | Y120: 0 | Z120: 0 | AA120: 0 | AB120: 0 | AC120: 0 | AD120: 0 | AE120: 0 | AF120: 75 | AG120: 5 | AH120: 1 | AI120: 1 | AJ120: 10 | AK120: 0 | AL120: 0 | AM120: 4 | AN120: 6946 | AO120: 0 | AP120: 0 | AQ120: 0 | AR120: 0 | AS120: 0 | AT120: 0 | AU120: -1 | AV120: 0 | AW120: 0 | AX120: 36239 | AY120: Curse | AZ120: 10 | BB120: -1 | BD120: -1 | BE120: 100 | BF120: 811 | BG120: 1 | BH120: -1 | BI120: -1 | BJ120: -1 | BK120: -1 | BL120: -1 | BP120: =COUNTIF(knownSpells_monsters!C[-67],RC[-1]) -> 0
A121: 0 | B121: Turtle | C121: 27 | D121: 5 | E121: 2 | F121: 10 | G121: 60 | H121: 150 | I121: 0 | J121: 0 | K121: 8 | L121: 12 | M121: 5 | N121: 1 | O121: 12 | P121: -1 | Q121: 30 | R121: 80 | S121: 4 | T121: 8 | U121: 4 | V121: 0 | W121: 50 | X121: 0 | Y121: 50 | Z121: 0 | AA121: 0 | AB121: 0 | AC121: 0 | AD121: 0 | AE121: 0 | AF121: 76 | AG121: 1 | AH121: 1 | AI121: 1 | AJ121: 4 | AK121: 0 | AL121: 0 | AM121: 1 | AN121: 96 | AO121: -1 | AP121: -1 | AQ121: -1 | AR121: -1 | AS121: -1 | AT121: -1 | AU121: -1 | AV121: -1 | AW121: -1 | AX121: 78 | AZ121: -1 | BB121: -1 | BD121: -1 | BE121: 0 | BF121: 644 | BG121: 1 | BH121: -1 | BI121: -1 | BJ121: -1 | BK121: -1 | BL121: -1 | BP121: =COUNTIF(knownSpells_monsters!C[-67],RC[-1]) -> 0
A122: 0 | B122: Turtle.2 | C122: 32 | D122: 9 | E122: 6 | F122: 15 | G122: 96 | H122: 135 | I122: 0 | J122: 0 | K122: 9 | L122: 13 | M122: 6 | N122: 2 | O122: 19 | P122: -1 | Q122: 120 | R122: 150 | S122: 7 | T122: 8 | U122: 4 | V122: 0 | W122: 50 | X122: 0 | Y122: 50 | Z122: 0 | AA122: 0 | AB122: 0 | AC122: 0 | AD122: 0 | AE122: 0 | AF122: 76 | AG122: 2 | AH122: 1 | AI122: 1 | AJ122: 4 | AK122: 0 | AL122: 0 | AM122: 2 | AN122: 504 | AO122: -1 | AP122: -1 | AQ122: -1 | AR122: -1 | AS122: -1 | AT122: -1 | AU122: -1 | AV122: -1 | AW122: -1 | AX122: 200 | AZ122: -1 | BB122: -1 | BD122: -1 | BE122: 0 | BF122: 645 | BG122: 1 | BH122: -1 | BI122: -1 | BJ122: -1 | BK122: -1 | BL122: -1 | BP122: =COUNTIF(knownSpells_monsters!C[-67],RC[-1]) -> 0
A123: 0 | B123: Turtle.3 | C123: 38 | D123: 14 | E123: 10 | F123: 19 | G123: 154 | H123: 122 | I123: 0 | J123: 0 | K123: 10 | L123: 14 | M123: 6 | N123: 3 | O123: 31 | P123: -1 | Q123: 210 | R123: 220 | S123: 12 | T123: 8 | U123: 4 | V123: 0 | W123: 50 | X123: 0 | Y123: 50 | Z123: 0 | AA123: 0 | AB123: 0 | AC123: 0 | AD123: 0 | AE123: 0 | AF123: 76 | AG123: 3 | AH123: 1 | AI123: 1 | AJ123: 4 | AK123: 0 | AL123: 0 | AM123: 3 | AN123: 2646 | AO123: -1 | AP123: -1 | AQ123: -1 | AR123: -1 | AS123: -1 | AT123: -1 | AU123: -1 | AV123: -1 | AW123: -1 | AX123: 511 | AZ123: -1 | BB123: -1 | BD123: -1 | BE123: 0 | BF123: 646 | BG123: 1 | BH123: -1 | BI123: -1 | BJ123: -1 | BK123: -1 | BL123: -1 | BP123: =COUNTIF(knownSpells_monsters!C[-67],RC[-1]) -> 0
A124: 0 | B124: Turtle.4 | C124: 44 | D124: 18 | E124: 15 | F124: 24 | G124: 246 | H124: 109 | I124: 0 | J124: 0 | K124: 11 | L124: 15 | M124: 7 | N124: 4 | O124: 49 | P124: -1 | Q124: 300 | R124: 290 | S124: 18 | T124: 8 | U124: 4 | V124: 0 | W124: 50 | X124: 0 | Y124: 50 | Z124: 0 | AA124: 0 | AB124: 0 | AC124: 0 | AD124: 0 | AE124: 0 | AF124: 76 | AG124: 4 | AH124: 1 | AI124: 1 | AJ124: 4 | AK124: 0 | AL124: 0 | AM124: 4 | AN124: 13892 | AO124: -1 | AP124: -1 | AQ124: -1 | AR124: -1 | AS124: -1 | AT124: -1 | AU124: -1 | AV124: -1 | AW124: -1 | AX124: 1309 | AY124: Acid Stream | AZ124: 10 | BB124: -1 | BD124: -1 | BE124: 30 | BF124: 647 | BG124: 1 | BH124: -1 | BI124: -1 | BJ124: -1 | BK124: -1 | BL124: -1 | BP124: =COUNTIF(knownSpells_monsters!C[-67],RC[-1]) -> 0
A125: 0 | B125: Turtle.5 | C125: 72 | D125: 46 | E125: 43 | F125: 52 | G125: 3686 | H125: 109 | I125: 0 | J125: 0 | K125: 11 | L125: 11 | M125: 7 | N125: 33 | O125: 288 | P125: -1 | Q125: 400 | R125: 390 | S125: 18 | T125: 8 | U125: 4 | V125: 0 | W125: 50 | X125: 0 | Y125: 50 | Z125: 0 | AA125: 0 | AB125: 0 | AC125: 0 | AD125: 0 | AE125: 0 | AF125: 76 | AG125: 5 | AH125: 1 | AI125: 1 | AJ125: 4 | AK125: 0 | AL125: 0 | AM125: 6 | AN125: 27783 | AO125: 0 | AP125: 0 | AQ125: 0 | AR125: 0 | AS125: 0 | AT125: 0 | AU125: -1 | AV125: 0 | AW125: 0 | AX125: 118162 | AY125: Acid Stream | AZ125: 10 | BB125: -1 | BD125: -1 | BE125: 100 | BF125: 812 | BG125: 1 | BH125: -1 | BI125: -1 | BJ125: -1 | BK125: -1 | BL125: -1 | BP125: =COUNTIF(knownSpells_monsters!C[-67],RC[-1]) -> 0
A126: 0 | B126: Dragon | C126: 50 | D126: 60 | E126: 75 | F126: 60 | G126: 250 | H126: 120 | I126: 500 | J126: 150 | K126: 24 | L126: 12 | M126: 10 | N126: 10 | O126: 15 | P126: -1 | Q126: 100 | R126: 60 | S126: 4 | T126: 10 | U126: 4 | V126: 30 | W126: 60 | X126: 30 | Y126: 60 | Z126: 30 | AA126: 100 | AB126: 100 | AC126: 100 | AD126: 100 | AE126: 0 | AF126: 71 | AG126: 1 | AH126: 3 | AI126: 3 | AJ126: 12 | AK126: 0 | AL126: 0 | AM126: 3 | AN126: 5400 | AO126: 100 | AP126: 3000 | AQ126: 6000 | AR126: 100 | AS126: 1500 | AT126: 4500 | AU126: 739246079 | AV126: 1500 | AW126: 2500 | AX126: 3125 | AZ126: -1 | BB126: -1 | BD126: -1 | BE126: 0 | BF126: 648 | BG126: 0 | BH126: 20 | BI126: 20 | BJ126: 20 | BK126: 20 | BL126: 20 | BM126: Flame Thrower | BO126: [126] | BP126: =COUNTIF(knownSpells_monsters!C[-67],RC[-1]) -> 3
A127: 0 | B127: Dragon.2 | C127: 57 | D127: 67 | E127: 83 | F127: 67 | G127: 400 | H127: 108 | I127: 750 | J127: 135 | K127: 25 | L127: 13 | M127: 11 | N127: 16 | O127: 24 | P127: -1 | Q127: 190 | R127: 130 | S127: 7 | T127: 10 | U127: 4 | V127: 30 | W127: 60 | X127: 30 | Y127: 60 | Z127: 30 | AA127: 100 | AB127: 100 | AC127: 100 | AD127: 100 | AE127: 0 | AF127: 71 | AG127: 2 | AH127: 3 | AI127: 3 | AJ127: 12 | AK127: 0 | AL127: 0 | AM127: 4 | AN127: 28350 | AO127: 100 | AP127: 21000 | AQ127: 40200 | AR127: 100 | AS127: 10500 | AT127: 30150 | AU127: 739246079 | AV127: 10500 | AW127: 17500 | AX127: 8000 | AZ127: -1 | BB127: -1 | BD127: -1 | BE127: 0 | BF127: 649 | BG127: 0 | BH127: 50 | BI127: 50 | BJ127: 50 | BK127: 50 | BL127: 50 | BM127: Flame Thrower | BO127: [127] | BP127: =COUNTIF(knownSpells_monsters!C[-67],RC[-1]) -> 3
A128: 0 | B128: Dragon.3 | C128: 63 | D128: 74 | E128: 91 | F128: 74 | G128: 640 | H128: 97 | I128: 1125 | J128: 122 | K128: 26 | L128: 14 | M128: 11 | N128: 26 | O128: 38 | P128: -1 | Q128: 280 | R128: 200 | S128: 12 | T128: 10 | U128: 4 | V128: 30 | W128: 70 | X128: 30 | Y128: 60 | Z128: 30 | AA128: 100 | AB128: 100 | AC128: 100 | AD128: 100 | AE128: 0 | AF128: 71 | AG128: 3 | AH128: 3 | AI128: 3 | AJ128: 12 | AK128: 0 | AL128: 0 | AM128: 5 | AN128: 148838 | AO128: 100 | AP128: 147000 | AQ128: 269340 | AR128: 100 | AS128: 73500 | AT128: 202005 | AU128: 739246079 | AV128: 73500 | AW128: 122500 | AX128: 20480 | AZ128: -1 | BB128: -1 | BD128: -1 | BE128: 0 | BF128: 650 | BG128: 0 | BH128: 80 | BI128: 80 | BJ128: 80 | BK128: 80 | BL128: 80 | BM128: Flame Thrower | BO128: [128] | BP128: =COUNTIF(knownSpells_monsters!C[-67],RC[-1]) -> 6
A129: 0 | B129: Dragon.4 | C129: 70 | D129: 82 | E129: 99 | F129: 82 | G129: 1024 | H129: 87 | I129: 1688 | J129: 109 | K129: 27 | L129: 15 | M129: 12 | N129: 41 | O129: 61 | P129: -1 | Q129: 370 | R129: 270 | S129: 18 | T129: 10 | U129: 4 | V129: 30 | W129: 70 | X129: 30 | Y129: 60 | Z129: 30 | AA129: 100 | AB129: 100 | AC129: 100 | AD129: 100 | AE129: 0 | AF129: 71 | AG129: 4 | AH129: 3 | AI129: 3 | AJ129: 12 | AK129: 0 | AL129: 0 | AM129: 6 | AN129: 781397 | AO129: 100 | AP129: 1029000 | AQ129: 1804578 | AR129: 100 | AS129: 514500 | AT129: 1353434 | AU129: 739246079 | AV129: 514500 | AW129: 857500 | AX129: 52429 | AZ129: -1 | BB129: -1 | BD129: -1 | BE129: 30 | BF129: 651 | BG129: 0 | BH129: 100 | BI129: 100 | BJ129: 100 | BK129: 100 | BL129: 100 | BM129: Flame Thrower | BO129: [129] | BP129: =COUNTIF(knownSpells_monsters!C[-67],RC[-1]) -> 8
A130: 0 | B130: Dragon.5 | C130: 98 | D130: 110 | E130: 127 | F130: 110 | G130: 15360 | H130: 87 | I130: 15000 | J130: 109 | K130: 27 | L130: 27 | M130: 12 | N130: 328 | O130: 492 | P130: -1 | Q130: 470 | R130: 370 | S130: 18 | T130: 10 | U130: 4 | V130: 30 | W130: 70 | X130: 30 | Y130: 60 | Z130: 30 | AA130: 100 | AB130: 100 | AC130: 100 | AD130: 100 | AE130: 0 | AF130: 71 | AG130: 5 | AH130: 3 | AI130: 3 | AJ130: 12 | AK130: 0 | AL130: 0 | AM130: 8 | AN130: 1562794 | AO130: 100 | AP130: 3087000 | AQ130: 5413734 | AR130: 100 | AS130: 1543500 | AT130: 4060301 | AU130: 739246079 | AV130: 1543500 | AW130: 2572500 | AX130: 1258291 | AZ130: -1 | BB130: -1 | BD130: -1 | BE130: 100 | BF130: 813 | BG130: 0 | BH130: 100 | BI130: 100 | BJ130: 100 | BK130: 100 | BL130: 100 | BM130: Flame Thrower | BO130: [130] | BP130: =COUNTIF(knownSpells_monsters!C[-67],RC[-1]) -> 8
A131: 0 | B131: Urd | C131: 80 | D131: 36 | E131: 99 | F131: 90 | G131: 10000 | H131: 200 | I131: 10000 | J131: 100 | K131: 30 | L131: 30 | M131: 12 | N131: 82 | O131: 164 | P131: -1 | Q131: 370 | R131: 310 | S131: 39 | T131: 8 | U131: 6 | V131: 0 | W131: 0 | X131: 0 | Y131: 100 | Z131: 100 | AA131: 0 | AB131: 0 | AC131: 0 | AD131: 0 | AE131: 0 | AF131: 72 | AG131: 1 | AH131: 1 | AI131: 1 | AJ131: 12 | AK131: 0 | AL131: 0 | AM131: 10 | AN131: 1 | AO131: 100 | AP131: 5000000 | AQ131: 9000000 | AR131: 100 | AS131: 10000 | AT131: 100000 | AU131: 0 | AV131: 10000 | AW131: 100000 | AX131: 491520 | AZ131: -1 | BB131: -1 | BD131: -1 | BE131: 0 | BF131: 652 | BG131: 1 | BH131: -1 | BI131: -1 | BJ131: -1 | BK131: -1 | BL131: -1 | BM131: Good Wood Staff {castSpell=Drain_Life:99} | BP131: =COUNTIF(knownSpells_monsters!C[-67],RC[-1]) -> 0
A132: 1 | BP132: =COUNTIF(knownSpells_monsters!C[-67],RC[-1]) -> 0
A133: 0 | B133: Orc_Shaman.1 | C133: 30 | D133: 20 | E133: 20 | F133: 30 | G133: 50 | H133: 100 | I133: 150 | J133: 100 | K133: 14 | L133: 20 | M133: 7 | N133: 4 | O133: 8 | P133: -1 | Q133: 40 | R133: 40 | S133: 2 | T133: 9 | U133: 15 | V133: 0 | W133: 0 | X133: 50 | Y133: 0 | Z133: 0 | AA133: 0 | AB133: 0 | AC133: 0 | AD133: 0 | AE133: 0 | AF133: 81 | AG133: 1 | AH133: 1 | AI133: 1 | AJ133: 14 | AK133: 0 | AL133: 0 | AM133: 1 | AN133: 240 | AO133: 80 | AP133: 300 | AQ133: 600 | AR133: 30 | AS133: 600 | AT133: 900 | AU133: 600309759 | AV133: 200 | AW133: 400 | AX133: 120 | AZ133: -1 | BB133: -1 | BD133: -1 | BE133: 0 | BF133: 653 | BG133: 0 | BH133: 20 | BI133: 20 | BJ133: 20 | BK133: 20 | BL133: 20 | BM133: Wood Shaman Staff {castSpell=Fire_Arrow:1} | BO133: [133] | BP133: =COUNTIF(knownSpells_monsters!C[-67],RC[-1]) -> 4
A134: 0 | B134: Orc_Shaman.2 | C134: 36 | D134: 25 | E134: 25 | F134: 36 | G134: 80 | H134: 90 | I134: 225 | J134: 90 | K134: 15 | L134: 21 | M134: 8 | N134: 6 | O134: 13 | P134: -1 | Q134: 130 | R134: 110 | S134: 4 | T134: 9 | U134: 15 | V134: 0 | W134: 0 | X134: 50 | Y134: 0 | Z134: 0 | AA134: 50 | AB134: 50 | AC134: 50 | AD134: 50 | AE134: 50 | AF134: 81 | AG134: 2 | AH134: 1 | AI134: 1 | AJ134: 14 | AK134: 0 | AL134: 0 | AM134: 2 | AN134: 1608 | AO134: 80 | AP134: 2100 | AQ134: 4020 | AR134: 30 | AS134: 4200 | AT134: 6030 | AU134: 600309759 | AV134: 1400 | AW134: 2680 | AX134: 307 | AZ134: -1 | BB134: -1 | BD134: -1 | BE134: 0 | BF134: 654 | BG134: 0 | BH134: 50 | BI134: 50 | BJ134: 50 | BK134: 50 | BL134: 50 | BM134: Wood Shaman Staff {castSpell=Fire_Arrow:5} | BO134: [134] | BP134: =COUNTIF(knownSpells_monsters!C[-67],RC[-1]) -> 5
A135: 0 | B135: Orc_Shaman.3 | C135: 41 | D135: 30 | E135: 30 | F135: 41 | G135: 128 | H135: 81 | I135: 338 | J135: 81 | K135: 16 | L135: 22 | M135: 8 | N135: 10 | O135: 20 | P135: -1 | Q135: 220 | R135: 180 | S135: 7 | T135: 9 | U135: 15 | V135: 0 | W135: 0 | X135: 50 | Y135: 0 | Z135: 0 | AA135: 75 | AB135: 75 | AC135: 75 | AD135: 75 | AE135: 75 | AF135: 81 | AG135: 3 | AH135: 1 | AI135: 1 | AJ135: 14 | AK135: 0 | AL135: 0 | AM135: 3 | AN135: 10774 | AO135: 80 | AP135: 14700 | AQ135: 26934 | AR135: 30 | AS135: 29400 | AT135: 40401 | AU135: 600309759 | AV135: 9800 | AW135: 17956 | AX135: 786 | AZ135: -1 | BB135: -1 | BD135: -1 | BE135: 0 | BF135: 655 | BG135: 0 | BH135: 80 | BI135: 80 | BJ135: 80 | BK135: 80 | BL135: 80 | BM135: Wood Shaman Staff {castSpell=Fire_Arrow:10} | BO135: [135] | BP135: =COUNTIF(knownSpells_monsters!C[-67],RC[-1]) -> 6
A136: 0 | B136: Orc_Shaman.4 | C136: 47 | D136: 36 | E136: 36 | F136: 47 | G136: 205 | H136: 73 | I136: 506 | J136: 73 | K136: 17 | L136: 23 | M136: 9 | N136: 16 | O136: 33 | P136: -1 | Q136: 310 | R136: 250 | S136: 12 | T136: 9 | U136: 15 | V136: 0 | W136: 0 | X136: 50 | Y136: 0 | Z136: 0 | AA136: 88 | AB136: 88 | AC136: 88 | AD136: 88 | AE136: 88 | AF136: 81 | AG136: 4 | AH136: 1 | AI136: 1 | AJ136: 14 | AK136: 0 | AL136: 0 | AM136: 4 | AN136: 72183 | AO136: 80 | AP136: 102900 | AQ136: 180458 | AR136: 30 | AS136: 205800 | AT136: 270687 | AU136: 600309759 | AV136: 68600 | AW136: 120305 | AX136: 2013 | AZ136: -1 | BB136: -1 | BD136: -1 | BE136: 0 | BF136: 656 | BG136: 0 | BH136: 100 | BI136: 100 | BJ136: 100 | BK136: 100 | BL136: 100 | BM136: Wood Shaman Staff {castSpell=Fire_Arrow:35} | BO136: [136] | BP136: =COUNTIF(knownSpells_monsters!C[-67],RC[-1]) -> 6
A137: 0 | B137: Orc_Shaman.5 | C137: 75 | D137: 64 | E137: 64 | F137: 75 | G137: 3072 | H137: 73 | I137: 7594 | J137: 73 | K137: 17 | L137: 17 | M137: 9 | N137: 131 | O137: 262 | P137: -1 | Q137: 410 | R137: 350 | S137: 12 | T137: 9 | U137: 15 | V137: 0 | W137: 0 | X137: 50 | Y137: 0 | Z137: 0 | AA137: 88 | AB137: 88 | AC137: 88 | AD137: 88 | AE137: 88 | AF137: 81 | AG137: 5 | AH137: 1 | AI137: 1 | AJ137: 14 | AK137: 0 | AL137: 0 | AM137: 6 | AN137: 144366 | AO137: 80 | AP137: 308700 | AQ137: 541373 | AR137: 30 | AS137: 617400 | AT137: 812060 | AU137: 600309759 | AV137: 205800 | AW137: 360916 | AX137: 120796 | AZ137: -1 | BB137: -1 | BD137: -1 | BE137: 0 | BF137: 814 | BG137: 0 | BH137: 100 | BI137: 100 | BJ137: 100 | BK137: 100 | BL137: 100 | BM137: Wood Shaman Staff {castSpell=Fire_Arrow:99} | BO137: [137] | BP137: =COUNTIF(knownSpells_monsters!C[-67],RC[-1]) -> 6
A138: 0 | B138: F_Zombie.1 | C138: 40 | D138: 25 | E138: 5 | F138: 10 | G138: 100 | H138: 100 | I138: 0 | J138: 0 | K138: 16 | L138: 16 | M138: 5 | N138: 6 | O138: 12 | P138: -1 | Q138: 40 | R138: 60 | S138: 4 | T138: 6 | U138: 6 | V138: 0 | W138: 50 | X138: 0 | Y138: 30 | Z138: 0 | AA138: 30 | AB138: 75 | AC138: 0 | AD138: 50 | AE138: 50 | AF138: 82 | AG138: 1 | AH138: 1 | AI138: 1 | AJ138: 10 | AK138: 0 | AL138: 0 | AM138: 1 | AN138: 240 | AO138: 80 | AP138: 30 | AQ138: 210 | AR138: 30 | AS138: 300 | AT138: 600 | AU138: 838860799 | AV138: -1 | AW138: -1 | AX138: 180 | AZ138: -1 | BB138: -1 | BD138: -1 | BE138: 0 | BF138: 657 | BG138: 1 | BH138: -1 | BI138: -1 | BJ138: -1 | BK138: -1 | BL138: -1 | BP138: =COUNTIF(knownSpells_monsters!C[-67],RC[-1]) -> 0
A139: 0 | B139: F_Zombie.2 | C139: 46 | D139: 30 | E139: 9 | F139: 15 | G139: 160 | H139: 90 | I139: 0 | J139: 0 | K139: 17 | L139: 17 | M139: 6 | N139: 10 | O139: 19 | P139: -1 | Q139: 130 | R139: 130 | S139: 7 | T139: 6 | U139: 6 | V139: 0 | W139: 50 | X139: 0 | Y139: 30 | Z139: 0 | AA139: 30 | AB139: 75 | AC139: 0 | AD139: 50 | AE139: 50 | AF139: 83 | AG139: 1 | AH139: 1 | AI139: 1 | AJ139: 12 | AK139: 0 | AL139: 0 | AM139: 2 | AN139: 1608 | AO139: 80 | AP139: 210 | AQ139: 1407 | AR139: 30 | AS139: 2100 | AT139: 4020 | AU139: 838860799 | AV139: -1 | AW139: -1 | AX139: 461 | AZ139: -1 | BB139: -1 | BD139: -1 | BE139: 0 | BF139: 658 | BG139: 1 | BH139: -1 | BI139: -1 | BJ139: -1 | BK139: -1 | BL139: -1 | BP139: =COUNTIF(knownSpells_monsters!C[-67],RC[-1]) -> 0
A140: 0 | B140: F_Zombie.3 | C140: 52 | D140: 36 | E140: 14 | F140: 19 | G140: 256 | H140: 81 | I140: 0 | J140: 0 | K140: 18 | L140: 18 | M140: 6 | N140: 15 | O140: 31 | P140: -1 | Q140: 220 | R140: 200 | S140: 12 | T140: 8 | U140: 6 | V140: 0 | W140: 50 | X140: 0 | Y140: 30 | Z140: 0 | AA140: 30 | AB140: 75 | AC140: 0 | AD140: 50 | AE140: 50 | AF140: 84 | AG140: 1 | AH140: 1 | AI140: 1 | AJ140: 8 | AK140: 0 | AL140: 0 | AM140: 3 | AN140: 10774 | AO140: 80 | AP140: 1470 | AQ140: 9427 | AR140: 30 | AS140: 14700 | AT140: 26934 | AU140: 838860799 | AV140: -1 | AW140: -1 | AX140: 1180 | AZ140: -1 | BB140: -1 | BD140: -1 | BE140: 0 | BF140: 659 | BG140: 1 | BH140: -1 | BI140: -1 | BJ140: -1 | BK140: -1 | BL140: -1 | BP140: =COUNTIF(knownSpells_monsters!C[-67],RC[-1]) -> 0
A141: 0 | B141: F_Zombie.4 | C141: 59 | D141: 42 | E141: 18 | F141: 24 | G141: 410 | H141: 73 | I141: 0 | J141: 0 | K141: 19 | L141: 19 | M141: 7 | N141: 25 | O141: 49 | P141: -1 | Q141: 310 | R141: 270 | S141: 18 | T141: 8 | U141: 6 | V141: 0 | W141: 90 | X141: 0 | Y141: 30 | Z141: 0 | AA141: 30 | AB141: 75 | AC141: 0 | AD141: 50 | AE141: 50 | AF141: 85 | AG141: 1 | AH141: 1 | AI141: 1 | AJ141: 8 | AK141: 0 | AL141: 0 | AM141: 4 | AN141: 72183 | AO141: 80 | AP141: 10290 | AQ141: 63160 | AR141: 30 | AS141: 102900 | AT141: 180458 | AU141: 838860799 | AV141: -1 | AW141: -1 | AX141: 3020 | AY141: Poison Cloud | AZ141: 10 | BA141: Stone Curse | BB141: 1 | BC141: Shield | BD141: 3 | BE141: 30 | BF141: 660 | BG141: 1 | BH141: -1 | BI141: -1 | BJ141: -1 | BK141: -1 | BL141: -1 | BP141: =COUNTIF(knownSpells_monsters!C[-67],RC[-1]) -> 0
A142: 0 | B142: F_Zombie.5 | C142: 87 | D142: 70 | E142: 46 | F142: 52 | G142: 6144 | H142: 73 | I142: 0 | J142: 0 | K142: 19 | L142: 19 | M142: 7 | N142: 197 | O142: 393 | P142: -1 | Q142: 410 | R142: 370 | S142: 18 | T142: 8 | U142: 6 | V142: 0 | W142: 90 | X142: 0 | Y142: 30 | Z142: 0 | AA142: 30 | AB142: 75 | AC142: 0 | AD142: 50 | AE142: 50 | AF142: 85 | AG142: 2 | AH142: 1 | AI142: 1 | AJ142: 8 | AK142: 0 | AL142: 0 | AM142: 6 | AN142: 144366 | AO142: 80 | AP142: 30870 | AQ142: 189481 | AR142: 30 | AS142: 308700 | AT142: 541373 | AU142: 838860799 | AV142: 0 | AW142: 0 | AX142: 362388 | AY142: Poison Cloud | AZ142: 10 | BA142: Stone Curse | BB142: 1 | BC142: Shield | BD142: 3 | BE142: 100 | BF142: 815 | BG142: 1 | BH142: -1 | BI142: -1 | BJ142: -1 | BK142: -1 | BL142: -1 | BP142: =COUNTIF(knownSpells_monsters!C[-67],RC[-1]) -> 0
A143: 0 | B143: A_Zombie.2 | C143: 35 | D143: 30 | E143: 5 | F143: 10 | G143: 80 | H143: 100 | I143: 0 | J143: 0 | K143: 16 | L143: 16 | M143: 5 | N143: 5 | O143: 10 | P143: -1 | Q143: 45 | R143: 50 | S143: 4 | T143: 8 | U143: 16 | V143: 0 | W143: 50 | X143: 0 | Y143: 30 | Z143: 0 | AA143: 30 | AB143: 75 | AC143: 0 | AD143: 50 | AE143: 50 | AF143: 86 | AG143: 1 | AH143: 1 | AI143: 1 | AJ143: 12 | AK143: 0 | AL143: 0 | AM143: 2 | AN143: 300 | AO143: 80 | AP143: 210 | AQ143: 1407 | AR143: 30 | AS143: 2100 | AT143: 4020 | AU143: 838860799 | AV143: -1 | AW143: -1 | AX143: 240 | AZ143: -1 | BB143: -1 | BD143: -1 | BE143: 0 | BF143: 661 | BG143: 1 | BH143: -1 | BI143: -1 | BJ143: -1 | BK143: -1 | BL143: -1 | BM143: Wood Crossbow | BP143: =COUNTIF(knownSpells_monsters!C[-67],RC[-1]) -> 0
A144: 0 | B144: A_Zombie.3 | C144: 41 | D144: 36 | E144: 9 | F144: 15 | G144: 128 | H144: 90 | I144: 0 | J144: 0 | K144: 17 | L144: 17 | M144: 6 | N144: 8 | O144: 16 | P144: -1 | Q144: 135 | R144: 120 | S144: 7 | T144: 8 | U144: 16 | V144: 0 | W144: 50 | X144: 0 | Y144: 30 | Z144: 0 | AA144: 30 | AB144: 75 | AC144: 0 | AD144: 50 | AE144: 50 | AF144: 87 | AG144: 1 | AH144: 1 | AI144: 1 | AJ144: 8 | AK144: 0 | AL144: 0 | AM144: 3 | AN144: 2010 | AO144: 80 | AP144: 1470 | AQ144: 9427 | AR144: 30 | AS144: 14700 | AT144: 26934 | AU144: 838860799 | AV144: -1 | AW144: -1 | AX144: 614 | AZ144: -1 | BB144: -1 | BD144: -1 | BE144: 0 | BF144: 662 | BG144: 1 | BH144: -1 | BI144: -1 | BJ144: -1 | BK144: -1 | BL144: -1 | BM144: Wood Crossbow | BP144: =COUNTIF(knownSpells_monsters!C[-67],RC[-1]) -> 0
A145: 0 | B145: A_Zombie.4 | C145: 47 | D145: 41 | E145: 14 | F145: 19 | G145: 205 | H145: 81 | I145: 0 | J145: 0 | K145: 18 | L145: 18 | M145: 6 | N145: 13 | O145: 26 | P145: -1 | Q145: 225 | R145: 190 | S145: 12 | T145: 8 | U145: 16 | V145: 0 | W145: 90 | X145: 0 | Y145: 30 | Z145: 0 | AA145: 30 | AB145: 75 | AC145: 0 | AD145: 50 | AE145: 50 | AF145: 88 | AG145: 1 | AH145: 1 | AI145: 1 | AJ145: 8 | AK145: 0 | AL145: 0 | AM145: 4 | AN145: 13467 | AO145: 80 | AP145: 10290 | AQ145: 63160 | AR145: 30 | AS145: 102900 | AT145: 180458 | AU145: 838860799 | AV145: -1 | AW145: -1 | AX145: 1573 | AY145: Blizzard | AZ145: 10 | BA145: Stone Curse | BB145: 1 | BC145: Shield | BD145: 3 | BE145: 100 | BF145: 663 | BG145: 1 | BH145: -1 | BI145: -1 | BJ145: -1 | BK145: -1 | BL145: -1 | BM145: Uncommon Steel Crossbow | BP145: =COUNTIF(knownSpells_monsters!C[-67],RC[-1]) -> 0
A146: 0 | B146: A_Zombie.5 | C146: 75 | D146: 69 | E146: 42 | F146: 47 | G146: 3072 | H146: 81 | I146: 0 | J146: 0 | K146: 18 | L146: 18 | M146: 6 | N146: 102 | O146: 205 | P146: -1 | Q146: 325 | R146: 290 | S146: 12 | T146: 8 | U146: 16 | V146: 0 | W146: 90 | X146: 0 | Y146: 30 | Z146: 0 | AA146: 30 | AB146: 75 | AC146: 0 | AD146: 50 | AE146: 50 | AF146: 88 | AG146: 2 | AH146: 1 | AI146: 1 | AJ146: 8 | AK146: 0 | AL146: 0 | AM146: 6 | AN146: 26934 | AO146: 80 | AP146: 30870 | AQ146: 189481 | AR146: 30 | AS146: 308700 | AT146: 541373 | AU146: 838860799 | AV146: 0 | AW146: 0 | AX146: 94372 | AY146: Blizzard | AZ146: 10 | BA146: Stone Curse | BB146: 1 | BC146: Shield | BD146: 3 | BE146: 100 | BF146: 816 | BG146: 1 | BH146: -1 | BI146: -1 | BJ146: -1 | BK146: -1 | BL146: -1 | BP146: =COUNTIF(knownSpells_monsters!C[-67],RC[-1]) -> 0
A147: 0 | B147: F_Skeleton.1 | C147: 30 | D147: 35 | E147: 5 | F147: 10 | G147: 80 | H147: 100 | I147: 0 | J147: 0 | K147: 20 | L147: 16 | M147: 6 | N147: 8 | O147: 16 | P147: -1 | Q147: 50 | R147: 45 | S147: 2 | T147: 8 | U147: 6 | V147: 30 | W147: 0 | X147: 50 | Y147: 0 | Z147: 0 | AA147: 50 | AB147: 0 | AC147: 75 | AD147: 30 | AE147: 50 | AF147: 89 | AG147: 1 | AH147: 1 | AI147: 1 | AJ147: 12 | AK147: 0 | AL147: 0 | AM147: 1 | AN147: 330 | AO147: 80 | AP147: 150 | AQ147: 330 | AR147: 30 | AS147: 150 | AT147: 450 | AU147: 838860799 | AV147: -1 | AW147: -1 | AX147: 192 | AZ147: -1 | BB147: -1 | BD147: -1 | BE147: 0 | BF147: 664 | BG147: 1 | BH147: -1 | BI147: -1 | BJ147: -1 | BK147: -1 | BL147: -1 | BP147: =COUNTIF(knownSpells_monsters!C[-67],RC[-1]) -> 0
A148: 0 | B148: F_Skeleton.2 | C148: 36 | D148: 41 | E148: 9 | F148: 15 | G148: 128 | H148: 90 | I148: 0 | J148: 0 | K148: 21 | L148: 17 | M148: 7 | N148: 13 | O148: 26 | P148: -1 | Q148: 140 | R148: 115 | S148: 4 | T148: 8 | U148: 6 | V148: 30 | W148: 0 | X148: 50 | Y148: 0 | Z148: 0 | AA148: 50 | AB148: 0 | AC148: 75 | AD148: 30 | AE148: 50 | AF148: 90 | AG148: 1 | AH148: 1 | AI148: 1 | AJ148: 12 | AK148: 0 | AL148: 0 | AM148: 2 | AN148: 2211 | AO148: 80 | AP148: 1050 | AQ148: 2211 | AR148: 30 | AS148: 1050 | AT148: 3015 | AU148: 838860799 | AV148: -1 | AW148: -1 | AX148: 492 | AZ148: -1 | BB148: -1 | BD148: -1 | BE148: 0 | BF148: 665 | BG148: 1 | BH148: -1 | BI148: -1 | BJ148: -1 | BK148: -1 | BL148: -1 | BP148: =COUNTIF(knownSpells_monsters!C[-67],RC[-1]) -> 0
A149: 0 | B149: F_Skeleton.3 | C149: 41 | D149: 47 | E149: 14 | F149: 19 | G149: 205 | H149: 81 | I149: 0 | J149: 0 | K149: 22 | L149: 18 | M149: 7 | N149: 20 | O149: 41 | P149: -1 | Q149: 230 | R149: 185 | S149: 7 | T149: 8 | U149: 6 | V149: 30 | W149: 0 | X149: 50 | Y149: 0 | Z149: 0 | AA149: 50 | AB149: 0 | AC149: 75 | AD149: 30 | AE149: 50 | AF149: 91 | AG149: 1 | AH149: 1 | AI149: 1 | AJ149: 12 | AK149: 0 | AL149: 0 | AM149: 3 | AN149: 14814 | AO149: 80 | AP149: 7350 | AQ149: 14814 | AR149: 30 | AS149: 7350 | AT149: 20201 | AU149: 838860799 | AV149: -1 | AW149: -1 | AX149: 1258 | AZ149: -1 | BB149: -1 | BD149: -1 | BE149: 0 | BF149: 666 | BG149: 1 | BH149: -1 | BI149: -1 | BJ149: -1 | BK149: -1 | BL149: -1 | BP149: =COUNTIF(knownSpells_monsters!C[-67],RC[-1]) -> 0
A150: 0 | B150: F_Skeleton.4 | C150: 47 | D150: 53 | E150: 18 | F150: 24 | G150: 328 | H150: 73 | I150: 0 | J150: 0 | K150: 23 | L150: 19 | M150: 8 | N150: 33 | O150: 66 | P150: -1 | Q150: 320 | R150: 255 | S150: 12 | T150: 8 | U150: 6 | V150: 30 | W150: 0 | X150: 50 | Y150: 0 | Z150: 0 | AA150: 50 | AB150: 0 | AC150: 75 | AD150: 30 | AE150: 50 | AF150: 92 | AG150: 1 | AH150: 1 | AI150: 1 | AJ150: 12 | AK150: 0 | AL150: 0 | AM150: 4 | AN150: 99252 | AO150: 80 | AP150: 51450 | AQ150: 99252 | AR150: 30 | AS150: 51450 | AT150: 135343 | AU150: 838860799 | AV150: -1 | AW150: -1 | AX150: 3221 | AY150: Prismatic Spray | AZ150: 10 | BA150: Drain Life | BB150: 1 | BC150: Invisibility | BD150: 3 | BE150: 30 | BF150: 667 | BG150: 1 | BH150: -1 | BI150: -1 | BJ150: -1 | BK150: -1 | BL150: -1 | BP150: =COUNTIF(knownSpells_monsters!C[-67],RC[-1]) -> 0
A151: 0 | B151: F_Skeleton.5 | C151: 75 | D151: 81 | E151: 46 | F151: 52 | G151: 4915 | H151: 73 | I151: 0 | J151: 0 | K151: 23 | L151: 23 | M151: 8 | N151: 262 | O151: 197 | P151: -1 | Q151: 420 | R151: 355 | S151: 12 | T151: 8 | U151: 6 | V151: 30 | W151: 0 | X151: 50 | Y151: 0 | Z151: 0 | AA151: 50 | AB151: 0 | AC151: 75 | AD151: 30 | AE151: 50 | AF151: 92 | AG151: 2 | AH151: 1 | AI151: 1 | AJ151: 12 | AK151: 0 | AL151: 0 | AM151: 6 | AN151: 198504 | AO151: 80 | AP151: 154350 | AQ151: 297755 | AR151: 30 | AS151: 154350 | AT151: 406030 | AU151: 838860799 | AV151: 0 | AW151: 0 | AX151: 225486 | AY151: Prismatic Spray | AZ151: 10 | BA151: Drain Life | BB151: 1 | BC151: Invisibility | BD151: 3 | BE151: 100 | BF151: 817 | BG151: 1 | BH151: -1 | BI151: -1 | BJ151: -1 | BK151: -1 | BL151: -1 | BP151: =COUNTIF(knownSpells_monsters!C[-67],RC[-1]) -> 0
A152: 0 | B152: A_Skeleton.1 | C152: 25 | D152: 40 | E152: 5 | F152: 10 | G152: 60 | H152: 100 | I152: 0 | J152: 0 | K152: 20 | L152: 16 | M152: 6 | N152: 6 | O152: 12 | P152: -1 | Q152: 55 | R152: 40 | S152: 2 | T152: 20 | U152: 5 | V152: 30 | W152: 0 | X152: 50 | Y152: 0 | Z152: 0 | AA152: 50 | AB152: 0 | AC152: 75 | AD152: 30 | AE152: 50 | AF152: 93 | AG152: 1 | AH152: 1 | AI152: 1 | AJ152: 12 | AK152: 0 | AL152: 0 | AM152: 1 | AN152: 360 | AO152: 80 | AP152: 150 | AQ152: 330 | AR152: 30 | AS152: 150 | AT152: 450 | AU152: 838860799 | AV152: -1 | AW152: -1 | AX152: 216 | AZ152: -1 | BB152: -1 | BD152: -1 | BE152: 0 | BF152: 668 | BG152: 1 | BH152: -1 | BI152: -1 | BJ152: -1 | BK152: -1 | BL152: -1 | BM152: Uncommon Wood Short Bow | BP152: =COUNTIF(knownSpells_monsters!C[-67],RC[-1]) -> 0
A153: 0 | B153: A_Skeleton.2 | C153: 30 | D153: 46 | E153: 9 | F153: 15 | G153: 96 | H153: 90 | I153: 0 | J153: 0 | K153: 21 | L153: 17 | M153: 7 | N153: 10 | O153: 19 | P153: -1 | Q153: 145 | R153: 110 | S153: 4 | T153: 20 | U153: 5 | V153: 30 | W153: 0 | X153: 50 | Y153: 0 | Z153: 0 | AA153: 50 | AB153: 0 | AC153: 75 | AD153: 30 | AE153: 50 | AF153: 94 | AG153: 1 | AH153: 1 | AI153: 1 | AJ153: 12 | AK153: 0 | AL153: 0 | AM153: 2 | AN153: 2412 | AO153: 80 | AP153: 1050 | AQ153: 2211 | AR153: 30 | AS153: 1050 | AT153: 3015 | AU153: 838860799 | AV153: -1 | AW153: -1 | AX153: 553 | AZ153: -1 | BB153: -1 | BD153: -1 | BE153: 0 | BF153: 669 | BG153: 1 | BH153: -1 | BI153: -1 | BJ153: -1 | BK153: -1 | BL153: -1 | BM153: Wood Long Bow | BP153: =COUNTIF(knownSpells_monsters!C[-67],RC[-1]) -> 0
A154: 0 | B154: A_Skeleton.3 | C154: 36 | D154: 52 | E154: 14 | F154: 19 | G154: 154 | H154: 81 | I154: 0 | J154: 0 | K154: 22 | L154: 18 | M154: 7 | N154: 15 | O154: 31 | P154: -1 | Q154: 235 | R154: 180 | S154: 7 | T154: 20 | U154: 5 | V154: 30 | W154: 0 | X154: 50 | Y154: 0 | Z154: 0 | AA154: 50 | AB154: 0 | AC154: 75 | AD154: 30 | AE154: 50 | AF154: 95 | AG154: 1 | AH154: 1 | AI154: 1 | AJ154: 12 | AK154: 0 | AL154: 0 | AM154: 3 | AN154: 16160 | AO154: 80 | AP154: 7350 | AQ154: 14814 | AR154: 30 | AS154: 7350 | AT154: 20201 | AU154: 838860799 | AV154: -1 | AW154: -1 | AX154: 1416 | AZ154: -1 | BB154: -1 | BD154: -1 | BE154: 0 | BF154: 670 | BG154: 1 | BH154: -1 | BI154: -1 | BJ154: -1 | BK154: -1 | BL154: -1 | BM154: Uncommon Wood Long Bow | BP154: =COUNTIF(knownSpells_monsters!C[-67],RC[-1]) -> 0
A155: 0 | B155: A_Skeleton.4 | C155: 42 | D155: 59 | E155: 18 | F155: 24 | G155: 246 | H155: 73 | I155: 0 | J155: 0 | K155: 23 | L155: 19 | M155: 8 | N155: 25 | O155: 49 | P155: -1 | Q155: 325 | R155: 250 | S155: 12 | T155: 20 | U155: 5 | V155: 30 | W155: 0 | X155: 50 | Y155: 0 | Z155: 0 | AA155: 50 | AB155: 0 | AC155: 75 | AD155: 30 | AE155: 50 | AF155: 96 | AG155: 1 | AH155: 1 | AI155: 1 | AJ155: 12 | AK155: 0 | AL155: 0 | AM155: 4 | AN155: 108275 | AO155: 80 | AP155: 51450 | AQ155: 99252 | AR155: 30 | AS155: 51450 | AT155: 135343 | AU155: 838860799 | AV155: -1 | AW155: -1 | AX155: 3624 | AY155: Darkness | AZ155: 10 | BA155: Drain Life | BB155: 1 | BC155: Invisibility | BD155: 3 | BE155: 30 | BF155: 671 | BG155: 1 | BH155: -1 | BI155: -1 | BJ155: -1 | BK155: -1 | BL155: -1 | BM155: Uncommon Magic Wood Short Bow | BP155: =COUNTIF(knownSpells_monsters!C[-67],RC[-1]) -> 0
A156: 0 | B156: A_Skeleton.5 | C156: 70 | D156: 87 | E156: 46 | F156: 52 | G156: 3686 | H156: 73 | I156: 0 | J156: 0 | K156: 23 | L156: 23 | M156: 8 | N156: 197 | O156: 393 | P156: -1 | Q156: 425 | R156: 350 | S156: 12 | T156: 20 | U156: 5 | V156: 30 | W156: 0 | X156: 50 | Y156: 0 | Z156: 0 | AA156: 50 | AB156: 0 | AC156: 75 | AD156: 30 | AE156: 50 | AF156: 96 | AG156: 2 | AH156: 1 | AI156: 1 | AJ156: 12 | AK156: 0 | AL156: 0 | AM156: 6 | AN156: 216549 | AO156: 80 | AP156: 154350 | AQ156: 297755 | AR156: 30 | AS156: 154350 | AT156: 406030 | AU156: 838860799 | AV156: 0 | AW156: 0 | AX156: 217433 | AY156: Darkness | AZ156: 10 | BA156: Drain Life | BB156: 1 | BC156: Invisibility | BD156: 3 | BE156: 100 | BF156: 818 | BG156: 1 | BH156: -1 | BI156: -1 | BJ156: -1 | BK156: -1 | BL156: -1 | BM156: Uncommon Magic Wood Short Bow | BP156: =COUNTIF(knownSpells_monsters!C[-67],RC[-1]) -> 0
A157: 0 | B157: M_Skeleton.3 | C157: 25 | D157: 25 | E157: 50 | F157: 60 | G157: 150 | H157: 81 | I157: 1000 | J157: 81 | K157: 16 | L157: 16 | M157: 9 | N157: 5 | O157: 10 | P157: -1 | Q157: 200 | R157: 200 | S157: 2 | T157: 8 | U157: 6 | V157: 30 | W157: 0 | X157: 50 | Y157: 0 | Z157: 0 | AA157: 50 | AB157: 0 | AC157: 75 | AD157: 30 | AE157: 50 | AF157: 97 | AG157: 1 | AH157: 1 | AI157: 1 | AJ157: 14 | AK157: 0 | AL157: 0 | AM157: 4 | AN157: 1200 | AO157: 80 | AP157: 29400 | AQ157: 59255 | AR157: 30 | AS157: 29400 | AT157: 80802 | AU157: 774796280 | AV157: 50000 | AW157: 100000 | AX157: 450 | AZ157: -1 | BB157: -1 | BD157: -1 | BE157: 0 | BF157: 672 | BG157: 0 | BH157: 80 | BI157: 80 | BJ157: 80 | BK157: 80 | BL157: 80 | BM157: Good Wood Staff {castSpell=Lightning:10} | BO157: [157] | BP157: =COUNTIF(knownSpells_monsters!C[-67],RC[-1]) -> 5
A158: 0 | B158: M_Skeleton.4 | C158: 30 | D158: 30 | E158: 57 | F158: 67 | G158: 240 | H158: 73 | I158: 1500 | J158: 73 | K158: 17 | L158: 17 | M158: 10 | N158: 8 | O158: 16 | P158: -1 | Q158: 290 | R158: 270 | S158: 4 | T158: 8 | U158: 6 | V158: 30 | W158: 0 | X158: 50 | Y158: 0 | Z158: 0 | AA158: 50 | AB158: 0 | AC158: 75 | AD158: 30 | AE158: 50 | AF158: 98 | AG158: 1 | AH158: 1 | AI158: 1 | AJ158: 14 | AK158: 0 | AL158: 0 | AM158: 6 | AN158: 8040 | AO158: 80 | AP158: 205800 | AQ158: 397007 | AR158: 30 | AS158: 205800 | AT158: 541373 | AU158: 774796280 | AV158: 350000 | AW158: 670000 | AX158: 1152 | AZ158: -1 | BB158: -1 | BD158: -1 | BE158: 0 | BF158: 673 | BG158: 0 | BH158: 100 | BI158: 100 | BJ158: 100 | BK158: 100 | BL158: 100 | BM158: Good Wood Staff {castSpell=Lightning:35} | BO158: [158] | BP158: =COUNTIF(knownSpells_monsters!C[-67],RC[-1]) -> 7
A159: 0 | B159: M_Skeleton.5 | C159: 58 | D159: 58 | E159: 85 | F159: 95 | G159: 3600 | H159: 73 | I159: 22500 | J159: 73 | K159: 17 | L159: 17 | M159: 10 | N159: 64 | O159: 128 | P159: -1 | Q159: 390 | R159: 370 | S159: 4 | T159: 8 | U159: 6 | V159: 30 | W159: 0 | X159: 50 | Y159: 0 | Z159: 0 | AA159: 50 | AB159: 0 | AC159: 75 | AD159: 30 | AE159: 50 | AF159: 98 | AG159: 2 | AH159: 1 | AI159: 1 | AJ159: 14 | AK159: 0 | AL159: 0 | AM159: 8 | AN159: 16080 | AO159: 80 | AP159: 617400 | AQ159: 1191021 | AR159: 30 | AS159: 617400 | AT159: 1624120 | AU159: 774796280 | AV159: 1050000 | AW159: 2010000 | AX159: 69120 | AZ159: -1 | BB159: -1 | BD159: -1 | BE159: 0 | BF159: 819 | BG159: 0 | BH159: 100 | BI159: 100 | BJ159: 100 | BK159: 100 | BL159: 100 | BO159: [159] | BP159: =COUNTIF(knownSpells_monsters!C[-67],RC[-1]) -> 7
A160: 0 | B160: Necromancer | C160: 20 | D160: 30 | E160: 50 | F160: 40 | G160: 80 | H160: 100 | I160: 250 | J160: 100 | K160: 16 | L160: 16 | M160: 6 | N160: 8 | O160: 16 | P160: -1 | Q160: 50 | R160: 50 | S160: 2 | T160: 6 | U160: 8 | V160: 0 | W160: 0 | X160: 30 | Y160: 0 | Z160: 0 | AA160: 0 | AB160: 0 | AC160: 0 | AD160: 0 | AE160: 0 | AF160: 99 | AG160: 1 | AH160: 1 | AI160: 1 | AJ160: 12 | AK160: 0 | AL160: 0 | AM160: 1 | AN160: 50 | AO160: -1 | AP160: -1 | AQ160: -1 | AR160: -1 | AS160: -1 | AT160: -1 | AU160: 461373439 | AV160: 10 | AW160: 1200 | AX160: 384 | AZ160: -1 | BB160: -1 | BD160: -1 | BE160: 0 | BF160: 674 | BG160: 0 | BH160: -1 | BI160: -1 | BJ160: -1 | BK160: -1 | BL160: -1 | BO160: [160] | BP160: =COUNTIF(knownSpells_monsters!C[-67],RC[-1]) -> 4
A161: 0 | B161: Druid | C161: 20 | D161: 30 | E161: 40 | F161: 50 | G161: 80 | H161: 100 | I161: 350 | J161: 100 | K161: 16 | L161: 16 | M161: 6 | N161: 8 | O161: 16 | P161: -1 | Q161: 50 | R161: 50 | S161: 2 | T161: 6 | U161: 8 | V161: 0 | W161: 0 | X161: 30 | Y161: 0 | Z161: 0 | AA161: 0 | AB161: 0 | AC161: 0 | AD161: 0 | AE161: 0 | AF161: 100 | AG161: 7 | AH161: 1 | AI161: 1 | AJ161: 12 | AK161: 0 | AL161: 0 | AM161: 1 | AN161: 50 | AO161: -1 | AP161: -1 | AQ161: -1 | AR161: -1 | AS161: -1 | AT161: -1 | AU161: 0 | AV161: 10 | AW161: 1200 | AX161: 384 | AZ161: -1 | BB161: -1 | BD161: -1 | BE161: 0 | BF161: 675 | BG161: 0 | BH161: -1 | BI161: -1 | BJ161: -1 | BK161: -1 | BL161: -1 | BO161: [161] | BP161: =COUNTIF(knownSpells_monsters!C[-67],RC[-1]) -> 2
A162: 0 | B162: Root | C162: 50 | D162: 5 | E162: 1 | F162: 5 | G162: 80 | H162: 100 | I162: 0 | J162: 0 | K162: 16 | L162: 16 | M162: 6 | N162: 8 | O162: 16 | P162: -1 | Q162: 50 | R162: 50 | S162: 2 | T162: 11 | U162: 4 | V162: 0 | W162: 0 | X162: 30 | Y162: 0 | Z162: 0 | AA162: 0 | AB162: 0 | AC162: 0 | AD162: 0 | AE162: 0 | AF162: 78 | AG162: 1 | AH162: 1 | AI162: 1 | AJ162: 14 | AK162: 0 | AL162: 0 | AM162: 1 | AN162: 0 | AO162: -1 | AP162: -1 | AQ162: -1 | AR162: -1 | AS162: -1 | AT162: -1 | AU162: -1 | AV162: -1 | AW162: -1 | AX162: 192 | AZ162: -1 | BB162: -1 | BD162: -1 | BE162: 0 | BF162: 676 | BG162: 1 | BH162: -1 | BI162: -1 | BJ162: -1 | BK162: -1 | BL162: -1 | BP162: =COUNTIF(knownSpells_monsters!C[-67],RC[-1]) -> 0
A163: 0 | B163: MercenaryOrc3 | C163: 46 | D163: 44 | E163: 15 | F163: 20 | G163: 200 | H163: 80 | I163: 0 | J163: 0 | K163: 20 | L163: 24 | M163: 7 | N163: 25 | O163: 50 | P163: -1 | Q163: 240 | R163: 180 | S163: 6 | T163: 21 | U163: 7 | V163: 0 | W163: 0 | X163: 50 | Y163: 0 | Z163: 0 | AA163: 0 | AB163: 0 | AC163: 0 | AD163: 0 | AE163: 0 | AF163: 101 | AG163: 1 | AH163: 1 | AI163: 1 | AJ163: 14 | AK163: 100 | AL163: 0 | AM163: 3 | AN163: 0 | AO163: -1 | AP163: -1 | AQ163: -1 | AR163: -1 | AS163: -1 | AT163: -1 | AU163: -1 | AV163: -1 | AW163: -1 | AX163: 3000 | AZ163: -1 | BB163: -1 | BD163: -1 | BE163: 0 | BF163: 677 | BG163: 1 | BH163: -1 | BI163: -1 | BJ163: -1 | BK163: -1 | BL163: -1 | BM163: Uncommon Wood Short Bow | BP163: =COUNTIF(knownSpells_monsters!C[-67],RC[-1]) -> 0
A164: 0 | B164: MercenaryTroll3 | C164: 69 | D164: 20 | E164: 10 | F164: 30 | G164: 800 | H164: 81 | I164: 0 | J164: 0 | K164: 10 | L164: 10 | M164: 5 | N164: 40 | O164: 75 | P164: -1 | Q164: 240 | R164: 240 | S164: 25 | T164: 10 | U164: 6 | V164: 0 | W164: 50 | X164: 0 | Y164: 50 | Z164: 0 | AA164: 0 | AB164: 0 | AC164: 50 | AD164: 30 | AE164: 30 | AF164: 102 | AG164: 1 | AH164: 2 | AI164: 1 | AJ164: 18 | AK164: 0 | AL164: 0 | AM164: 3 | AN164: 0 | AO164: -1 | AP164: -1 | AQ164: -1 | AR164: -1 | AS164: -1 | AT164: -1 | AU164: -1 | AV164: -1 | AW164: -1 | AX164: 9200 | AZ164: -1 | BB164: -1 | BD164: -1 | BE164: 0 | BF164: 678 | BG164: 1 | BH164: -1 | BI164: -1 | BJ164: -1 | BK164: -1 | BL164: -1 | BP164: =COUNTIF(knownSpells_monsters!C[-67],RC[-1]) -> 0
A165: 0 | B165: Orc_ShamanLeader3 | C165: 41 | D165: 30 | E165: 30 | F165: 41 | G165: 128 | H165: 81 | I165: 338 | J165: 81 | K165: 16 | L165: 22 | M165: 8 | N165: 10 | O165: 20 | P165: -1 | Q165: 220 | R165: 180 | S165: 7 | T165: 9 | U165: 15 | V165: 0 | W165: 0 | X165: 50 | Y165: 0 | Z165: 0 | AA165: 75 | AB165: 75 | AC165: 75 | AD165: 75 | AE165: 75 | AF165: 81 | AG165: 3 | AH165: 1 | AI165: 1 | AJ165: 14 | AK165: 0 | AL165: 0 | AM165: 3 | AN165: 0 | AO165: 80 | AP165: 12100 | AQ165: 24200 | AR165: 30 | AS165: 24200 | AT165: 36300 | AU165: 100 | AV165: 24200 | AW165: 48400 | AX165: 786 | AZ165: -1 | BB165: -1 | BD165: -1 | BE165: 0 | BF165: 679 | BG165: 0 | BH165: 60 | BI165: 60 | BJ165: 60 | BK165: 60 | BL165: 60 | BM165: Wood Shaman Staff {castSpell=Fire_Arrow:5} | BO165: [165] | BP165: =COUNTIF(knownSpells_monsters!C[-67],RC[-1]) -> 1
A166: 0 | B166: Druid_Mercenary | C166: 20 | D166: 30 | E166: 40 | F166: 50 | G166: 80 | H166: 100 | I166: 350 | J166: 100 | K166: 16 | L166: 16 | M166: 6 | N166: 8 | O166: 16 | P166: -1 | Q166: 50 | R166: 50 | S166: 2 | T166: 6 | U166: 8 | V166: 0 | W166: 0 | X166: 0 | Y166: 0 | Z166: 0 | AA166: 0 | AB166: 0 | AC166: 0 | AD166: 0 | AE166: 0 | AF166: 100 | AG166: 4 | AH166: 1 | AI166: 1 | AJ166: 14 | AK166: 0 | AL166: 0 | AM166: 3 | AN166: 0 | AO166: -1 | AP166: -1 | AQ166: -1 | AR166: -1 | AS166: -1 | AT166: -1 | AU166: -1 | AV166: -1 | AW166: -1 | AX166: 384 | AZ166: -1 | BB166: -1 | BD166: -1 | BE166: 0 | BF166: 680 | BG166: 0 | BH166: 50 | BI166: 50 | BJ166: 50 | BK166: 50 | BL166: 50 | BO166: [166] | BP166: =COUNTIF(knownSpells_monsters!C[-67],RC[-1]) -> 2
A167: 0 | B167: Druid_Preacher | C167: 20 | D167: 30 | E167: 40 | F167: 50 | G167: 80 | H167: 100 | I167: 350 | J167: 100 | K167: 16 | L167: 16 | M167: 6 | N167: 8 | O167: 16 | P167: -1 | Q167: 50 | R167: 50 | S167: 2 | T167: 6 | U167: 8 | V167: 0 | W167: 0 | X167: 0 | Y167: 0 | Z167: 0 | AA167: 0 | AB167: 0 | AC167: 0 | AD167: 0 | AE167: 0 | AF167: 100 | AG167: 7 | AH167: 1 | AI167: 1 | AJ167: 14 | AK167: 0 | AL167: 0 | AM167: 4 | AN167: 0 | AO167: -1 | AP167: -1 | AQ167: -1 | AR167: -1 | AS167: -1 | AT167: -1 | AU167: -1 | AV167: -1 | AW167: -1 | AX167: 384 | AZ167: -1 | BB167: -1 | BD167: -1 | BE167: 0 | BF167: 681 | BG167: 0 | BH167: 100 | BI167: 100 | BJ167: 100 | BK167: 100 | BL167: 100 | BO167: [167] | BP167: =COUNTIF(knownSpells_monsters!C[-67],RC[-1]) -> 2
A168: 0 | B168: Druid_Male2 | C168: 30 | D168: 30 | E168: 45 | F168: 55 | G168: 100 | H168: 90 | I168: 250 | J168: 90 | K168: 17 | L168: 17 | M168: 7 | N168: 2 | O168: 3 | P168: -1 | Q168: 90 | R168: 70 | S168: 10 | T168: 6 | U168: 8 | V168: 0 | W168: 0 | X168: 0 | Y168: 0 | Z168: 0 | AA168: 0 | AB168: 0 | AC168: 0 | AD168: 0 | AE168: 0 | AF168: 100 | AG168: 2 | AH168: 1 | AI168: 1 | AJ168: 12 | AK168: 0 | AL168: 0 | AM168: 2 | AN168: 2010 | AO168: -1 | AP168: -1 | AQ168: -1 | AR168: -1 | AS168: -1 | AT168: -1 | AU168: 0 | AV168: 70 | AW168: 8040 | AX168: 100 | AZ168: -1 | BB168: -1 | BD168: -1 | BE168: 0 | BF168: 682 | BG168: 0 | BH168: 50 | BI168: 50 | BJ168: 50 | BK168: 50 | BL168: 50 | BM168: Wood Shaman Staff {castSpell=Ice_Missile:5} | BO168: [168] | BP168: =COUNTIF(knownSpells_monsters!C[-67],RC[-1]) -> 3
A169: 0 | B169: Druid_Female2 | C169: 35 | D169: 25 | E169: 50 | F169: 50 | G169: 80 | H169: 90 | I169: 300 | J169: 90 | K169: 17 | L169: 17 | M169: 7 | N169: 2 | O169: 3 | P169: -1 | Q169: 90 | R169: 70 | S169: 10 | T169: 6 | U169: 8 | V169: 0 | W169: 0 | X169: 0 | Y169: 0 | Z169: 0 | AA169: 0 | AB169: 0 | AC169: 0 | AD169: 0 | AE169: 0 | AF169: 100 | AG169: 3 | AH169: 1 | AI169: 1 | AJ169: 12 | AK169: 0 | AL169: 0 | AM169: 2 | AN169: 2010 | AO169: -1 | AP169: -1 | AQ169: -1 | AR169: -1 | AS169: -1 | AT169: -1 | AU169: 0 | AV169: 70 | AW169: 8040 | AX169: 80 | AZ169: -1 | BB169: -1 | BD169: -1 | BE169: 0 | BF169: 683 | BG169: 0 | BH169: 50 | BI169: 50 | BJ169: 50 | BK169: 50 | BL169: 50 | BM169: Wood Shaman Staff {castSpell=Ice_Missile:5} | BO169: [169] | BP169: =COUNTIF(knownSpells_monsters!C[-67],RC[-1]) -> 3
A170: 0 | B170: Druid_Leader2 | C170: 35 | D170: 35 | E170: 50 | F170: 60 | G170: 130 | H170: 90 | I170: 300 | J170: 90 | K170: 17 | L170: 17 | M170: 7 | N170: 2 | O170: 3 | P170: -1 | Q170: 90 | R170: 70 | S170: 13 | T170: 6 | U170: 8 | V170: 0 | W170: 0 | X170: 0 | Y170: 0 | Z170: 0 | AA170: 0 | AB170: 0 | AC170: 0 | AD170: 0 | AE170: 0 | AF170: 100 | AG170: 6 | AH170: 1 | AI170: 1 | AJ170: 12 | AK170: 0 | AL170: 0 | AM170: 2 | AN170: 3015 | AO170: -1 | AP170: -1 | AQ170: -1 | AR170: -1 | AS170: -1 | AT170: -1 | AU170: 0 | AV170: 140 | AW170: 16080 | AX170: 130 | AZ170: -1 | BB170: -1 | BD170: -1 | BE170: 0 | BF170: 684 | BG170: 0 | BH170: 50 | BI170: 50 | BJ170: 50 | BK170: 50 | BL170: 50 | BM170: Wood Shaman Staff {castSpell=Ice_Missile:5} | BO170: [170] | BP170: =COUNTIF(knownSpells_monsters!C[-67],RC[-1]) -> 4
A171: 0 | B171: Druid_Male3 | C171: 36 | D171: 36 | E171: 51 | F171: 62 | G171: 160 | H171: 81 | I171: 375 | J171: 81 | K171: 18 | L171: 18 | M171: 7 | N171: 3 | O171: 5 | P171: -1 | Q171: 180 | R171: 140 | S171: 16 | T171: 6 | U171: 8 | V171: 0 | W171: 0 | X171: 0 | Y171: 0 | Z171: 0 | AA171: 0 | AB171: 0 | AC171: 0 | AD171: 0 | AE171: 0 | AF171: 100 | AG171: 2 | AH171: 1 | AI171: 1 | AJ171: 12 | AK171: 0 | AL171: 0 | AM171: 3 | AN171: 13467 | AO171: -1 | AP171: -1 | AQ171: -1 | AR171: -1 | AS171: -1 | AT171: -1 | AU171: 0 | AV171: 490 | AW171: 53868 | AX171: 256 | AZ171: -1 | BB171: -1 | BD171: -1 | BE171: 0 | BF171: 685 | BG171: 0 | BH171: 80 | BI171: 80 | BJ171: 80 | BK171: 80 | BL171: 80 | BM171: Wood Shaman Staff {castSpell=Ice_Missile:10} | BO171: [171] | BP171: =COUNTIF(knownSpells_monsters!C[-67],RC[-1]) -> 3
A172: 0 | B172: Druid_Female3 | C172: 41 | D172: 30 | E172: 57 | F172: 57 | G172: 128 | H172: 81 | I172: 450 | J172: 81 | K172: 18 | L172: 18 | M172: 7 | N172: 3 | O172: 5 | P172: -1 | Q172: 180 | R172: 140 | S172: 16 | T172: 6 | U172: 8 | V172: 0 | W172: 0 | X172: 0 | Y172: 0 | Z172: 0 | AA172: 0 | AB172: 0 | AC172: 0 | AD172: 0 | AE172: 0 | AF172: 100 | AG172: 3 | AH172: 1 | AI172: 1 | AJ172: 12 | AK172: 0 | AL172: 0 | AM172: 3 | AN172: 13467 | AO172: -1 | AP172: -1 | AQ172: -1 | AR172: -1 | AS172: -1 | AT172: -1 | AU172: 0 | AV172: 490 | AW172: 53868 | AX172: 205 | AZ172: -1 | BB172: -1 | BD172: -1 | BE172: 0 | BF172: 686 | BG172: 0 | BH172: 80 | BI172: 80 | BJ172: 80 | BK172: 80 | BL172: 80 | BM172: Wood Shaman Staff {castSpell=Ice_Missile:10} | BO172: [172] | BP172: =COUNTIF(knownSpells_monsters!C[-67],RC[-1]) -> 4
A173: 0 | B173: Druid_Leader3 | C173: 41 | D173: 41 | E173: 57 | F173: 67 | G173: 208 | H173: 81 | I173: 450 | J173: 81 | K173: 18 | L173: 18 | M173: 7 | N173: 3 | O173: 5 | P173: -1 | Q173: 180 | R173: 140 | S173: 21 | T173: 6 | U173: 8 | V173: 0 | W173: 0 | X173: 0 | Y173: 0 | Z173: 0 | AA173: 0 | AB173: 0 | AC173: 0 | AD173: 0 | AE173: 0 | AF173: 100 | AG173: 6 | AH173: 1 | AI173: 1 | AJ173: 12 | AK173: 0 | AL173: 0 | AM173: 3 | AN173: 20201 | AO173: -1 | AP173: -1 | AQ173: -1 | AR173: -1 | AS173: -1 | AT173: -1 | AU173: 0 | AV173: 980 | AW173: 107736 | AX173: 333 | AZ173: -1 | BB173: -1 | BD173: -1 | BE173: 0 | BF173: 687 | BG173: 0 | BH173: 80 | BI173: 80 | BJ173: 80 | BK173: 80 | BL173: 80 | BM173: Wood Shaman Staff {castSpell=Ice_Missile:10} | BO173: [173] | BP173: =COUNTIF(knownSpells_monsters!C[-67],RC[-1]) -> 3
A174: 0 | B174: Druid_Male4 | C174: 42 | D174: 42 | E174: 58 | F174: 69 | G174: 256 | H174: 73 | I174: 563 | J174: 73 | K174: 19 | L174: 19 | M174: 8 | N174: 5 | O174: 8 | P174: -1 | Q174: 270 | R174: 210 | S174: 25 | T174: 6 | U174: 8 | V174: 0 | W174: 0 | X174: 0 | Y174: 0 | Z174: 0 | AA174: 0 | AB174: 0 | AC174: 0 | AD174: 0 | AE174: 0 | AF174: 100 | AG174: 5 | AH174: 1 | AI174: 1 | AJ174: 12 | AK174: 0 | AL174: 0 | AM174: 4 | AN174: 90229 | AO174: -1 | AP174: -1 | AQ174: -1 | AR174: -1 | AS174: -1 | AT174: -1 | AU174: 0 | AV174: 3430 | AW174: 360916 | AX174: 655 | AZ174: -1 | BB174: -1 | BD174: -1 | BE174: 0 | BF174: 688 | BG174: 0 | BH174: 100 | BI174: 100 | BJ174: 100 | BK174: 100 | BL174: 100 | BM174: Wood Shaman Staff {castSpell=Ice_Missile:35} | BO174: [174] | BP174: =COUNTIF(knownSpells_monsters!C[-67],RC[-1]) -> 3
A175: 0 | B175: Druid_Female4 | C175: 47 | D175: 36 | E175: 63 | F175: 63 | G175: 205 | H175: 73 | I175: 675 | J175: 73 | K175: 19 | L175: 19 | M175: 8 | N175: 5 | O175: 8 | P175: -1 | Q175: 270 | R175: 210 | S175: 25 | T175: 6 | U175: 8 | V175: 0 | W175: 0 | X175: 0 | Y175: 0 | Z175: 0 | AA175: 0 | AB175: 0 | AC175: 0 | AD175: 0 | AE175: 0 | AF175: 100 | AG175: 3 | AH175: 1 | AI175: 1 | AJ175: 12 | AK175: 0 | AL175: 0 | AM175: 4 | AN175: 90229 | AO175: -1 | AP175: -1 | AQ175: -1 | AR175: -1 | AS175: -1 | AT175: -1 | AU175: 0 | AV175: 3430 | AW175: 360916 | AX175: 524 | AZ175: -1 | BB175: -1 | BD175: -1 | BE175: 0 | BF175: 689 | BG175: 0 | BH175: 100 | BI175: 100 | BJ175: 100 | BK175: 100 | BL175: 100 | BM175: Wood Shaman Staff {castSpell=Ice_Missile:35} | BO175: [175] | BP175: =COUNTIF(knownSpells_monsters!C[-67],RC[-1]) -> 4
A176: 0 | B176: Druid_Leader4 | C176: 47 | D176: 47 | E176: 63 | F176: 74 | G176: 333 | H176: 73 | I176: 675 | J176: 73 | K176: 19 | L176: 19 | M176: 8 | N176: 5 | O176: 8 | P176: -1 | Q176: 270 | R176: 210 | S176: 32 | T176: 6 | U176: 8 | V176: 0 | W176: 0 | X176: 0 | Y176: 0 | Z176: 0 | AA176: 0 | AB176: 0 | AC176: 0 | AD176: 0 | AE176: 0 | AF176: 100 | AG176: 6 | AH176: 1 | AI176: 1 | AJ176: 12 | AK176: 0 | AL176: 0 | AM176: 4 | AN176: 135343 | AO176: -1 | AP176: -1 | AQ176: -1 | AR176: -1 | AS176: -1 | AT176: -1 | AU176: 0 | AV176: 6860 | AW176: 721831 | AX176: 852 | AZ176: -1 | BB176: -1 | BD176: -1 | BE176: 0 | BF176: 690 | BG176: 0 | BH176: 100 | BI176: 100 | BJ176: 100 | BK176: 100 | BL176: 100 | BM176: Wood Shaman Staff {castSpell=Ice_Missile:35} | BO176: [176] | BP176: =COUNTIF(knownSpells_monsters!C[-67],RC[-1]) -> 4
A177: 0 | B177: Druid_Male5 | C177: 70 | D177: 70 | E177: 86 | F177: 97 | G177: 3840 | H177: 73 | I177: 8438 | J177: 73 | K177: 19 | L177: 19 | M177: 8 | N177: 5 | O177: 8 | P177: -1 | Q177: 270 | R177: 310 | S177: 25 | T177: 6 | U177: 8 | V177: 0 | W177: 0 | X177: 0 | Y177: 0 | Z177: 0 | AA177: 0 | AB177: 0 | AC177: 0 | AD177: 0 | AE177: 0 | AF177: 100 | AG177: 5 | AH177: 1 | AI177: 1 | AJ177: 12 | AK177: 0 | AL177: 0 | AM177: 6 | AN177: 180458 | AO177: -1 | AP177: -1 | AQ177: -1 | AR177: -1 | AS177: -1 | AT177: -1 | AU177: 0 | AV177: 10290 | AW177: 1082747 | AX177: 4915 | AZ177: -1 | BB177: -1 | BD177: -1 | BE177: 0 | BF177: 820 | BG177: 0 | BH177: 100 | BI177: 100 | BJ177: 100 | BK177: 100 | BL177: 100 | BM177: Wood Shaman Staff {castSpell=Ice_Missile:99} | BO177: [177] | BP177: =COUNTIF(knownSpells_monsters!C[-67],RC[-1]) -> 3
A178: 0 | B178: Druid_Female5 | C178: 75 | D178: 64 | E178: 91 | F178: 91 | G178: 3072 | H178: 73 | I178: 10125 | J178: 73 | K178: 19 | L178: 19 | M178: 8 | N178: 5 | O178: 8 | P178: -1 | Q178: 270 | R178: 310 | S178: 25 | T178: 6 | U178: 8 | V178: 0 | W178: 0 | X178: 0 | Y178: 0 | Z178: 0 | AA178: 0 | AB178: 0 | AC178: 0 | AD178: 0 | AE178: 0 | AF178: 100 | AG178: 3 | AH178: 1 | AI178: 1 | AJ178: 12 | AK178: 0 | AL178: 0 | AM178: 6 | AN178: 180458 | AO178: -1 | AP178: -1 | AQ178: -1 | AR178: -1 | AS178: -1 | AT178: -1 | AU178: 0 | AV178: 10290 | AW178: 1082747 | AX178: 3932 | AZ178: -1 | BB178: -1 | BD178: -1 | BE178: 0 | BF178: 821 | BG178: 0 | BH178: 100 | BI178: 100 | BJ178: 100 | BK178: 100 | BL178: 100 | BM178: Wood Shaman Staff {castSpell=Ice_Missile:99} | BO178: [178] | BP178: =COUNTIF(knownSpells_monsters!C[-67],RC[-1]) -> 4
A179: 0 | B179: Druid_Leader5 | C179: 75 | D179: 75 | E179: 91 | F179: 102 | G179: 4992 | H179: 73 | I179: 10125 | J179: 73 | K179: 19 | L179: 19 | M179: 8 | N179: 5 | O179: 8 | P179: -1 | Q179: 270 | R179: 310 | S179: 32 | T179: 6 | U179: 8 | V179: 0 | W179: 0 | X179: 0 | Y179: 0 | Z179: 0 | AA179: 0 | AB179: 0 | AC179: 0 | AD179: 0 | AE179: 0 | AF179: 100 | AG179: 6 | AH179: 1 | AI179: 1 | AJ179: 12 | AK179: 0 | AL179: 0 | AM179: 6 | AN179: 270687 | AO179: -1 | AP179: -1 | AQ179: -1 | AR179: -1 | AS179: -1 | AT179: -1 | AU179: 0 | AV179: 20580 | AW179: 2165494 | AX179: 6390 | AZ179: -1 | BB179: -1 | BD179: -1 | BE179: 0 | BF179: 822 | BG179: 0 | BH179: 100 | BI179: 100 | BJ179: 100 | BK179: 100 | BL179: 100 | BM179: Wood Shaman Staff {castSpell=Ice_Missile:99} | BO179: [179] | BP179: =COUNTIF(knownSpells_monsters!C[-67],RC[-1]) -> 4
A180: 0 | B180: Necro_Male1 | C180: 25 | D180: 25 | E180: 50 | F180: 40 | G180: 60 | H180: 100 | I180: 150 | J180: 100 | K180: 16 | L180: 16 | M180: 6 | N180: 1 | O180: 2 | P180: -1 | Q180: 0 | R180: 0 | S180: 6 | T180: 6 | U180: 8 | V180: 0 | W180: 0 | X180: 0 | Y180: 0 | Z180: 50 | AA180: 0 | AB180: 0 | AC180: 0 | AD180: 0 | AE180: 0 | AF180: 99 | AG180: 1 | AH180: 1 | AI180: 1 | AJ180: 12 | AK180: 0 | AL180: 0 | AM180: 1 | AN180: 300 | AO180: 100 | AP180: 300 | AQ180: 1500 | AR180: 30 | AS180: 900 | AT180: 3000 | AU180: 780140543 | AV180: 10 | AW180: 1200 | AX180: 36 | AZ180: -1 | BB180: -1 | BD180: -1 | BE180: 0 | BF180: 691 | BG180: 0 | BH180: 20 | BI180: 20 | BJ180: 20 | BK180: 20 | BL180: 20 | BM180: Good Wood Staff {castSpell=Drain_Life:1} | BO180: [180] | BP180: =COUNTIF(knownSpells_monsters!C[-67],RC[-1]) -> 3
A181: 0 | B181: Necro_Female1 | C181: 20 | D181: 30 | E181: 45 | F181: 45 | G181: 50 | H181: 100 | I181: 200 | J181: 100 | K181: 16 | L181: 16 | M181: 6 | N181: 1 | O181: 2 | P181: -1 | Q181: 0 | R181: 0 | S181: 6 | T181: 6 | U181: 8 | V181: 0 | W181: 0 | X181: 0 | Y181: 0 | Z181: 50 | AA181: 0 | AB181: 0 | AC181: 0 | AD181: 0 | AE181: 0 | AF181: 99 | AG181: 1 | AH181: 1 | AI181: 1 | AJ181: 12 | AK181: 0 | AL181: 0 | AM181: 1 | AN181: 300 | AO181: 100 | AP181: 300 | AQ181: 1500 | AR181: 30 | AS181: 900 | AT181: 3000 | AU181: 780140543 | AV181: 10 | AW181: 1200 | AX181: 30 | AZ181: -1 | BB181: -1 | BD181: -1 | BE181: 0 | BF181: 692 | BG181: 0 | BH181: 20 | BI181: 20 | BJ181: 20 | BK181: 20 | BL181: 20 | BM181: Good Wood Staff {castSpell=Drain_Life:1} | BO181: [181] | BP181: =COUNTIF(knownSpells_monsters!C[-67],RC[-1]) -> 3
A182: 0 | B182: Necro_Leader1 | C182: 30 | D182: 30 | E182: 55 | F182: 45 | G182: 80 | H182: 100 | I182: 200 | J182: 100 | K182: 16 | L182: 16 | M182: 6 | N182: 1 | O182: 2 | P182: -1 | Q182: 0 | R182: 0 | S182: 8 | T182: 6 | U182: 8 | V182: 0 | W182: 0 | X182: 0 | Y182: 0 | Z182: 50 | AA182: 0 | AB182: 0 | AC182: 0 | AD182: 0 | AE182: 0 | AF182: 99 | AG182: 1 | AH182: 1 | AI182: 1 | AJ182: 12 | AK182: 0 | AL182: 0 | AM182: 1 | AN182: 450 | AO182: 100 | AP182: 900 | AQ182: 4500 | AR182: 30 | AS182: 2700 | AT182: 9000 | AU182: 780140543 | AV182: 20 | AW182: 2400 | AX182: 48 | AZ182: -1 | BB182: -1 | BD182: -1 | BE182: 0 | BF182: 693 | BG182: 0 | BH182: 20 | BI182: 20 | BJ182: 20 | BK182: 20 | BL182: 20 | BM182: Good Wood Staff {castSpell=Drain_Life:1} | BO182: [182] | BP182: =COUNTIF(knownSpells_monsters!C[-67],RC[-1]) -> 4
A183: 0 | B183: Necro_Male2 | C183: 30 | D183: 30 | E183: 57 | F183: 46 | G183: 96 | H183: 90 | I183: 225 | J183: 90 | K183: 17 | L183: 17 | M183: 7 | N183: 2 | O183: 3 | P183: -1 | Q183: 90 | R183: 70 | S183: 10 | T183: 6 | U183: 8 | V183: 0 | W183: 0 | X183: 0 | Y183: 0 | Z183: 50 | AA183: 0 | AB183: 0 | AC183: 0 | AD183: 0 | AE183: 0 | AF183: 99 | AG183: 2 | AH183: 1 | AI183: 1 | AJ183: 12 | AK183: 0 | AL183: 0 | AM183: 2 | AN183: 2010 | AO183: 100 | AP183: 2100 | AQ183: 10500 | AR183: 30 | AS183: 6300 | AT183: 21000 | AU183: 780140543 | AV183: 70 | AW183: 8040 | AX183: 92 | AZ183: -1 | BB183: -1 | BD183: -1 | BE183: 0 | BF183: 694 | BG183: 0 | BH183: 40 | BI183: 40 | BJ183: 40 | BK183: 40 | BL183: 40 | BM183: Good Wood Staff {castSpell=Drain_Life:5} | BO183: [183] | BP183: =COUNTIF(knownSpells_monsters!C[-67],RC[-1]) -> 4
A184: 0 | B184: Necro_Female2 | C184: 25 | D184: 36 | E184: 51 | F184: 51 | G184: 80 | H184: 90 | I184: 300 | J184: 90 | K184: 17 | L184: 17 | M184: 7 | N184: 2 | O184: 3 | P184: -1 | Q184: 90 | R184: 70 | S184: 10 | T184: 6 | U184: 8 | V184: 0 | W184: 0 | X184: 0 | Y184: 0 | Z184: 50 | AA184: 0 | AB184: 0 | AC184: 0 | AD184: 0 | AE184: 0 | AF184: 99 | AG184: 1 | AH184: 1 | AI184: 1 | AJ184: 12 | AK184: 0 | AL184: 0 | AM184: 2 | AN184: 2010 | AO184: 100 | AP184: 2100 | AQ184: 10500 | AR184: 30 | AS184: 6300 | AT184: 21000 | AU184: 780140543 | AV184: 70 | AW184: 8040 | AX184: 77 | AZ184: -1 | BB184: -1 | BD184: -1 | BE184: 0 | BF184: 695 | BG184: 0 | BH184: 40 | BI184: 40 | BJ184: 40 | BK184: 40 | BL184: 40 | BM184: Good Wood Staff {castSpell=Drain_Life:5} | BO184: [184] | BP184: =COUNTIF(knownSpells_monsters!C[-67],RC[-1]) -> 4
A185: 0 | B185: Necro_Leader2 | C185: 36 | D185: 36 | E185: 62 | F185: 51 | G185: 128 | H185: 90 | I185: 300 | J185: 90 | K185: 17 | L185: 17 | M185: 7 | N185: 2 | O185: 3 | P185: -1 | Q185: 90 | R185: 70 | S185: 13 | T185: 6 | U185: 8 | V185: 0 | W185: 0 | X185: 0 | Y185: 0 | Z185: 50 | AA185: 0 | AB185: 0 | AC185: 0 | AD185: 0 | AE185: 0 | AF185: 99 | AG185: 3 | AH185: 1 | AI185: 1 | AJ185: 12 | AK185: 0 | AL185: 0 | AM185: 2 | AN185: 3015 | AO185: 100 | AP185: 6300 | AQ185: 31500 | AR185: 30 | AS185: 18900 | AT185: 63000 | AU185: 780140543 | AV185: 140 | AW185: 16080 | AX185: 123 | AZ185: -1 | BB185: -1 | BD185: -1 | BE185: 0 | BF185: 696 | BG185: 0 | BH185: 40 | BI185: 40 | BJ185: 40 | BK185: 40 | BL185: 40 | BM185: Good Wood Staff {castSpell=Drain_Life:5} | BO185: [185] | BP185: =COUNTIF(knownSpells_monsters!C[-67],RC[-1]) -> 5
A186: 0 | B186: Necro_Male3 | C186: 36 | D186: 36 | E186: 63 | F186: 52 | G186: 154 | H186: 81 | I186: 338 | J186: 81 | K186: 18 | L186: 18 | M186: 7 | N186: 3 | O186: 5 | P186: -1 | Q186: 180 | R186: 140 | S186: 16 | T186: 6 | U186: 8 | V186: 0 | W186: 0 | X186: 0 | Y186: 0 | Z186: 50 | AA186: 0 | AB186: 0 | AC186: 0 | AD186: 0 | AE186: 0 | AF186: 99 | AG186: 2 | AH186: 1 | AI186: 1 | AJ186: 12 | AK186: 0 | AL186: 0 | AM186: 3 | AN186: 13467 | AO186: 100 | AP186: 14700 | AQ186: 73500 | AR186: 30 | AS186: 44100 | AT186: 147000 | AU186: 780140543 | AV186: 490 | AW186: 53868 | AX186: 236 | AZ186: -1 | BB186: -1 | BD186: -1 | BE186: 0 | BF186: 697 | BG186: 0 | BH186: 60 | BI186: 60 | BJ186: 60 | BK186: 60 | BL186: 60 | BM186: Good Wood Staff {castSpell=Drain_Life:10} | BO186: [186] | BP186: =COUNTIF(knownSpells_monsters!C[-67],RC[-1]) -> 5
A187: 0 | B187: Necro_Female3 | C187: 30 | D187: 41 | E187: 58 | F187: 58 | G187: 128 | H187: 81 | I187: 450 | J187: 81 | K187: 18 | L187: 18 | M187: 7 | N187: 3 | O187: 5 | P187: -1 | Q187: 180 | R187: 140 | S187: 16 | T187: 6 | U187: 8 | V187: 0 | W187: 0 | X187: 0 | Y187: 0 | Z187: 50 | AA187: 0 | AB187: 0 | AC187: 0 | AD187: 0 | AE187: 0 | AF187: 99 | AG187: 1 | AH187: 1 | AI187: 1 | AJ187: 12 | AK187: 0 | AL187: 0 | AM187: 3 | AN187: 13467 | AO187: 100 | AP187: 14700 | AQ187: 73500 | AR187: 30 | AS187: 44100 | AT187: 147000 | AU187: 780140543 | AV187: 490 | AW187: 53868 | AX187: 197 | AZ187: -1 | BB187: -1 | BD187: -1 | BE187: 0 | BF187: 698 | BG187: 0 | BH187: 60 | BI187: 60 | BJ187: 60 | BK187: 60 | BL187: 60 | BM187: Good Wood Staff {castSpell=Drain_Life:10} | BO187: [187] | BP187: =COUNTIF(knownSpells_monsters!C[-67],RC[-1]) -> 5
A188: 0 | B188: Necro_Leader3 | C188: 41 | D188: 41 | E188: 69 | F188: 58 | G188: 205 | H188: 81 | I188: 450 | J188: 81 | K188: 18 | L188: 18 | M188: 7 | N188: 3 | O188: 5 | P188: -1 | Q188: 180 | R188: 140 | S188: 21 | T188: 6 | U188: 8 | V188: 0 | W188: 0 | X188: 0 | Y188: 0 | Z188: 50 | AA188: 0 | AB188: 0 | AC188: 0 | AD188: 0 | AE188: 0 | AF188: 99 | AG188: 3 | AH188: 1 | AI188: 1 | AJ188: 12 | AK188: 0 | AL188: 0 | AM188: 3 | AN188: 20201 | AO188: 100 | AP188: 44100 | AQ188: 220500 | AR188: 30 | AS188: 132300 | AT188: 441000 | AU188: 780140543 | AV188: 980 | AW188: 107736 | AX188: 315 | AZ188: -1 | BB188: -1 | BD188: -1 | BE188: 0 | BF188: 699 | BG188: 0 | BH188: 60 | BI188: 60 | BJ188: 60 | BK188: 60 | BL188: 60 | BM188: Good Wood Staff {castSpell=Drain_Life:10} | BO188: [188] | BP188: =COUNTIF(knownSpells_monsters!C[-67],RC[-1]) -> 6
A189: 0 | B189: Necro_Male4 | C189: 42 | D189: 42 | E189: 70 | F189: 59 | G189: 246 | H189: 73 | I189: 506 | J189: 73 | K189: 19 | L189: 19 | M189: 8 | N189: 4 | O189: 8 | P189: -1 | Q189: 270 | R189: 210 | S189: 25 | T189: 6 | U189: 8 | V189: 0 | W189: 0 | X189: 0 | Y189: 0 | Z189: 50 | AA189: 0 | AB189: 0 | AC189: 0 | AD189: 0 | AE189: 0 | AF189: 99 | AG189: 2 | AH189: 1 | AI189: 1 | AJ189: 12 | AK189: 0 | AL189: 0 | AM189: 4 | AN189: 90229 | AO189: 100 | AP189: 102900 | AQ189: 514500 | AR189: 30 | AS189: 308700 | AT189: 1029000 | AU189: 780140543 | AV189: 3430 | AW189: 360916 | AX189: 604 | AZ189: -1 | BB189: -1 | BD189: -1 | BE189: 0 | BF189: 700 | BG189: 0 | BH189: 80 | BI189: 80 | BJ189: 80 | BK189: 80 | BL189: 80 | BM189: Good Wood Staff {castSpell=Drain_Life:35} | BO189: [189] | BP189: =COUNTIF(knownSpells_monsters!C[-67],RC[-1]) -> 7
A190: 0 | B190: Necro_Female4 | C190: 36 | D190: 47 | E190: 65 | F190: 65 | G190: 205 | H190: 73 | I190: 675 | J190: 73 | K190: 19 | L190: 19 | M190: 8 | N190: 4 | O190: 8 | P190: -1 | Q190: 270 | R190: 210 | S190: 25 | T190: 6 | U190: 8 | V190: 0 | W190: 0 | X190: 0 | Y190: 0 | Z190: 50 | AA190: 0 | AB190: 0 | AC190: 0 | AD190: 0 | AE190: 0 | AF190: 99 | AG190: 1 | AH190: 1 | AI190: 1 | AJ190: 12 | AK190: 0 | AL190: 0 | AM190: 4 | AN190: 90229 | AO190: 100 | AP190: 102900 | AQ190: 514500 | AR190: 30 | AS190: 308700 | AT190: 1029000 | AU190: 780140543 | AV190: 3430 | AW190: 360916 | AX190: 503 | AZ190: -1 | BB190: -1 | BD190: -1 | BE190: 0 | BF190: 701 | BG190: 0 | BH190: 80 | BI190: 80 | BJ190: 80 | BK190: 80 | BL190: 80 | BM190: Good Wood Staff {castSpell=Drain_Life:35} | BO190: [190] | BP190: =COUNTIF(knownSpells_monsters!C[-67],RC[-1]) -> 7
A191: 0 | B191: Necro_Leader4 | C191: 47 | D191: 47 | E191: 76 | F191: 65 | G191: 328 | H191: 73 | I191: 675 | J191: 73 | K191: 19 | L191: 19 | M191: 8 | N191: 4 | O191: 8 | P191: -1 | Q191: 270 | R191: 210 | S191: 32 | T191: 6 | U191: 8 | V191: 0 | W191: 0 | X191: 0 | Y191: 0 | Z191: 50 | AA191: 0 | AB191: 0 | AC191: 0 | AD191: 0 | AE191: 0 | AF191: 99 | AG191: 3 | AH191: 1 | AI191: 1 | AJ191: 12 | AK191: 0 | AL191: 0 | AM191: 4 | AN191: 135343 | AO191: 100 | AP191: 308700 | AQ191: 1543500 | AR191: 30 | AS191: 926100 | AT191: 3087000 | AU191: 780140543 | AV191: 6860 | AW191: 721831 | AX191: 805 | AZ191: -1 | BB191: -1 | BD191: -1 | BE191: 0 | BF191: 702 | BG191: 0 | BH191: 80 | BI191: 80 | BJ191: 80 | BK191: 80 | BL191: 80 | BM191: Good Wood Staff {castSpell=Drain_Life:35} | BO191: [191] | BP191: =COUNTIF(knownSpells_monsters!C[-67],RC[-1]) -> 8
A192: 0 | B192: Necro_Male5 | C192: 70 | D192: 70 | E192: 98 | F192: 87 | G192: 3686 | H192: 73 | I192: 7594 | J192: 73 | K192: 19 | L192: 19 | M192: 8 | N192: 4 | O192: 8 | P192: -1 | Q192: 270 | R192: 310 | S192: 25 | T192: 6 | U192: 8 | V192: 0 | W192: 0 | X192: 0 | Y192: 0 | Z192: 50 | AA192: 0 | AB192: 0 | AC192: 0 | AD192: 0 | AE192: 0 | AF192: 99 | AG192: 2 | AH192: 1 | AI192: 1 | AJ192: 12 | AK192: 0 | AL192: 0 | AM192: 6 | AN192: 180458 | AO192: 100 | AP192: 308700 | AQ192: 1543500 | AR192: 30 | AS192: 926100 | AT192: 3087000 | AU192: 780140543 | AV192: 10290 | AW192: 1082747 | AX192: 4530 | AZ192: -1 | BB192: -1 | BD192: -1 | BE192: 0 | BF192: 823 | BG192: 0 | BH192: 100 | BI192: 100 | BJ192: 100 | BK192: 100 | BL192: 100 | BM192: Good Wood Staff {castSpell=Drain_Life:99} | BO192: [192] | BP192: =COUNTIF(knownSpells_monsters!C[-67],RC[-1]) -> 7
A193: 0 | B193: Necro_Female5 | C193: 64 | D193: 75 | E193: 93 | F193: 93 | G193: 3072 | H193: 73 | I193: 10125 | J193: 73 | K193: 19 | L193: 19 | M193: 8 | N193: 4 | O193: 8 | P193: -1 | Q193: 270 | R193: 310 | S193: 25 | T193: 6 | U193: 8 | V193: 0 | W193: 0 | X193: 0 | Y193: 0 | Z193: 50 | AA193: 0 | AB193: 0 | AC193: 0 | AD193: 0 | AE193: 0 | AF193: 99 | AG193: 1 | AH193: 1 | AI193: 1 | AJ193: 12 | AK193: 0 | AL193: 0 | AM193: 6 | AN193: 180458 | AO193: 100 | AP193: 308700 | AQ193: 1543500 | AR193: 30 | AS193: 926100 | AT193: 3087000 | AU193: 780140543 | AV193: 10290 | AW193: 1082747 | AX193: 3775 | AZ193: -1 | BB193: -1 | BD193: -1 | BE193: 0 | BF193: 824 | BG193: 0 | BH193: 100 | BI193: 100 | BJ193: 100 | BK193: 100 | BL193: 100 | BM193: Good Wood Staff {castSpell=Drain_Life:99} | BO193: [193] | BP193: =COUNTIF(knownSpells_monsters!C[-67],RC[-1]) -> 7
A194: 0 | B194: Necro_Leader5 | C194: 75 | D194: 75 | E194: 104 | F194: 93 | G194: 4915 | H194: 73 | I194: 10125 | J194: 73 | K194: 19 | L194: 19 | M194: 8 | N194: 4 | O194: 8 | P194: -1 | Q194: 270 | R194: 310 | S194: 32 | T194: 6 | U194: 8 | V194: 0 | W194: 0 | X194: 0 | Y194: 0 | Z194: 50 | AA194: 0 | AB194: 0 | AC194: 0 | AD194: 0 | AE194: 0 | AF194: 99 | AG194: 3 | AH194: 1 | AI194: 1 | AJ194: 12 | AK194: 0 | AL194: 0 | AM194: 6 | AN194: 270687 | AO194: 100 | AP194: 926100 | AQ194: 4630500 | AR194: 30 | AS194: 2778300 | AT194: 9261000 | AU194: 780140543 | AV194: 20580 | AW194: 2165494 | AX194: 6040 | AZ194: -1 | BB194: -1 | BD194: -1 | BE194: 0 | BF194: 825 | BG194: 0 | BH194: 100 | BI194: 100 | BJ194: 100 | BK194: 100 | BL194: 100 | BM194: Good Wood Staff {castSpell=Drain_Life:99} | BO194: [194] | BP194: =COUNTIF(knownSpells_monsters!C[-67],RC[-1]) -> 8
A195: 0 | B195: Necro_Fire3 | C195: 36 | D195: 36 | E195: 63 | F195: 52 | G195: 150 | H195: 80 | I195: 400 | J195: 80 | K195: 20 | L195: 18 | M195: 7 | N195: 3 | O195: 5 | P195: -1 | Q195: 180 | R195: 140 | S195: 50 | T195: 6 | U195: 8 | V195: 100 | W195: 0 | X195: 0 | Y195: 0 | Z195: 0 | AA195: 0 | AB195: 0 | AC195: 0 | AD195: 0 | AE195: 0 | AF195: 99 | AG195: 1 | AH195: 1 | AI195: 1 | AJ195: 12 | AK195: 0 | AL195: 0 | AM195: 3 | AN195: 13467 | AO195: -1 | AP195: -1 | AQ195: -1 | AR195: -1 | AS195: -1 | AT195: -1 | AU195: -1 | AV195: 1210 | AW195: 145200 | AX195: 236 | AZ195: -1 | BB195: -1 | BD195: -1 | BE195: 0 | BF195: 830 | BG195: 0 | BH195: 80 | BI195: 80 | BJ195: 80 | BK195: 80 | BL195: 80 | BM195: Good Wood Staff {castSpell=Drain_Life:5} | BO195: [195] | BP195: =COUNTIF(knownSpells_monsters!C[-67],RC[-1]) -> 3
A196: 0 | B196: Necro_Air3 | C196: 36 | D196: 36 | E196: 63 | F196: 52 | G196: 150 | H196: 80 | I196: 400 | J196: 80 | K196: 24 | L196: 18 | M196: 7 | N196: 3 | O196: 5 | P196: -1 | Q196: 180 | R196: 140 | S196: 50 | T196: 6 | U196: 8 | V196: 0 | W196: 0 | X196: 100 | Y196: 0 | Z196: 0 | AA196: 0 | AB196: 0 | AC196: 0 | AD196: 0 | AE196: 0 | AF196: 99 | AG196: 1 | AH196: 1 | AI196: 1 | AJ196: 12 | AK196: 0 | AL196: 0 | AM196: 3 | AN196: 13467 | AO196: -1 | AP196: -1 | AQ196: -1 | AR196: -1 | AS196: -1 | AT196: -1 | AU196: -1 | AV196: 1210 | AW196: 145200 | AX196: 236 | AZ196: -1 | BB196: -1 | BD196: -1 | BE196: 0 | BF196: 831 | BG196: 0 | BH196: 80 | BI196: 80 | BJ196: 80 | BK196: 80 | BL196: 80 | BM196: Good Wood Staff {castSpell=Drain_Life:5} | BO196: [196] | BP196: =COUNTIF(knownSpells_monsters!C[-67],RC[-1]) -> 3
A197: 0 | B197: Necro_Earth3 | C197: 30 | D197: 41 | E197: 58 | F197: 58 | G197: 150 | H197: 80 | I197: 400 | J197: 80 | K197: 10 | L197: 18 | M197: 7 | N197: 3 | O197: 5 | P197: -1 | Q197: 180 | R197: 140 | S197: 50 | T197: 6 | U197: 8 | V197: 0 | W197: 0 | X197: 0 | Y197: 100 | Z197: 0 | AA197: 0 | AB197: 0 | AC197: 0 | AD197: 0 | AE197: 0 | AF197: 99 | AG197: 1 | AH197: 1 | AI197: 1 | AJ197: 12 | AK197: 0 | AL197: 0 | AM197: 3 | AN197: 13467 | AO197: -1 | AP197: -1 | AQ197: -1 | AR197: -1 | AS197: -1 | AT197: -1 | AU197: -1 | AV197: 1210 | AW197: 145200 | AX197: 197 | AZ197: -1 | BB197: -1 | BD197: -1 | BE197: 0 | BF197: 832 | BG197: 0 | BH197: 80 | BI197: 80 | BJ197: 80 | BK197: 80 | BL197: 80 | BM197: Good Wood Staff {castSpell=Drain_Life:5} | BO197: [197] | BP197: =COUNTIF(knownSpells_monsters!C[-67],RC[-1]) -> 4
A198: 0 | B198: Necro_Water3 | C198: 30 | D198: 41 | E198: 58 | F198: 58 | G198: 150 | H198: 80 | I198: 400 | J198: 80 | K198: 16 | L198: 18 | M198: 7 | N198: 3 | O198: 5 | P198: -1 | Q198: 180 | R198: 140 | S198: 50 | T198: 6 | U198: 8 | V198: 0 | W198: 100 | X198: 0 | Y198: 0 | Z198: 0 | AA198: 0 | AB198: 0 | AC198: 0 | AD198: 0 | AE198: 0 | AF198: 99 | AG198: 1 | AH198: 1 | AI198: 1 | AJ198: 12 | AK198: 0 | AL198: 0 | AM198: 3 | AN198: 13467 | AO198: -1 | AP198: -1 | AQ198: -1 | AR198: -1 | AS198: -1 | AT198: -1 | AU198: -1 | AV198: 1210 | AW198: 145200 | AX198: 197 | AZ198: -1 | BB198: -1 | BD198: -1 | BE198: 0 | BF198: 833 | BG198: 0 | BH198: 80 | BI198: 80 | BJ198: 80 | BK198: 80 | BL198: 80 | BM198: Good Wood Staff {castSpell=Drain_Life:5} | BO198: [198] | BP198: =COUNTIF(knownSpells_monsters!C[-67],RC[-1]) -> 3
A199: 0 | B199: Necro_Astral3 | C199: 41 | D199: 41 | E199: 69 | F199: 58 | G199: 250 | H199: 80 | I199: 500 | J199: 80 | K199: 18 | L199: 18 | M199: 7 | N199: 3 | O199: 5 | P199: -1 | Q199: 180 | R199: 140 | S199: 50 | T199: 6 | U199: 8 | V199: 0 | W199: 0 | X199: 0 | Y199: 0 | Z199: 100 | AA199: 0 | AB199: 0 | AC199: 0 | AD199: 0 | AE199: 0 | AF199: 99 | AG199: 1 | AH199: 1 | AI199: 1 | AJ199: 12 | AK199: 0 | AL199: 0 | AM199: 3 | AN199: 20201 | AO199: -1 | AP199: -1 | AQ199: -1 | AR199: -1 | AS199: -1 | AT199: -1 | AU199: -1 | AV199: 2420 | AW199: 290400 | AX199: 315 | AZ199: -1 | BB199: -1 | BD199: -1 | BE199: 0 | BF199: 834 | BG199: 0 | BH199: 80 | BI199: 80 | BJ199: 80 | BK199: 80 | BL199: 80 | BM199: Good Wood Staff {castSpell=Drain_Life:5} | BO199: [199] | BP199: =COUNTIF(knownSpells_monsters!C[-67],RC[-1]) -> 4
A200: 0 | B200: GoodNecroLeader3 | C200: 41 | D200: 41 | E200: 69 | F200: 58 | G200: 205 | H200: 81 | I200: 450 | J200: 81 | K200: 18 | L200: 18 | M200: 12 | N200: 3 | O200: 5 | P200: -1 | Q200: 180 | R200: 140 | S200: 21 | T200: 6 | U200: 8 | V200: 0 | W200: 0 | X200: 0 | Y200: 0 | Z200: 50 | AA200: 0 | AB200: 0 | AC200: 0 | AD200: 0 | AE200: 0 | AF200: 99 | AG200: 3 | AH200: 1 | AI200: 1 | AJ200: 12 | AK200: 0 | AL200: 0 | AM200: 3 | AN200: 20201 | AO200: 0 | AP200: 44100 | AQ200: 220500 | AR200: 30 | AS200: 132300 | AT200: 441000 | AU200: 780140543 | AV200: 2420 | AW200: 290400 | AX200: 315 | AZ200: -1 | BB200: -1 | BD200: -1 | BE200: 0 | BF200: 835 | BG200: 0 | BH200: 80 | BI200: 80 | BJ200: 100 | BK200: 80 | BL200: 80 | BM200: Good Wood Staff {castSpell=Drain_Life:10} | BO200: [200] | BP200: =COUNTIF(knownSpells_monsters!C[-67],RC[-1]) -> 7
A201: 0 | B201: GoodNecro3 | C201: 36 | D201: 36 | E201: 63 | F201: 52 | G201: 154 | H201: 81 | I201: 338 | J201: 81 | K201: 18 | L201: 18 | M201: 12 | N201: 3 | O201: 5 | P201: -1 | Q201: 180 | R201: 140 | S201: 16 | T201: 6 | U201: 8 | V201: 0 | W201: 0 | X201: 0 | Y201: 0 | Z201: 50 | AA201: 0 | AB201: 0 | AC201: 0 | AD201: 0 | AE201: 0 | AF201: 99 | AG201: 2 | AH201: 1 | AI201: 1 | AJ201: 12 | AK201: 0 | AL201: 0 | AM201: 3 | AN201: 13467 | AO201: 0 | AP201: 102900 | AQ201: 514500 | AR201: 30 | AS201: 308700 | AT201: 1029000 | AU201: 780140543 | AV201: 1210 | AW201: 145200 | AX201: 236 | AZ201: -1 | BB201: -1 | BD201: -1 | BE201: 0 | BF201: 836 | BG201: 0 | BH201: 80 | BI201: 80 | BJ201: 100 | BK201: 80 | BL201: 80 | BM201: Good Wood Staff {castSpell=Drain_Life:10} | BO201: [201] | BP201: =COUNTIF(knownSpells_monsters!C[-67],RC[-1]) -> 6
A202: 0 | B202: Wolf | C202: 25 | D202: 60 | E202: 5 | F202: 10 | G202: 40 | H202: 50 | I202: 0 | J202: 0 | K202: 16 | L202: 16 | M202: 8 | N202: 4 | O202: 8 | P202: -1 | Q202: 40 | R202: 30 | S202: 2 | T202: 6 | U202: 6 | V202: 50 | W202: 0 | X202: 0 | Y202: 0 | Z202: 0 | AA202: 0 | AB202: 0 | AC202: 0 | AD202: 0 | AE202: 0 | AF202: 103 | AG202: 1 | AH202: 1 | AI202: 1 | AJ202: 12 | AK202: 0 | AL202: 20 | AM202: 1 | AN202: 60 | AO202: -1 | AP202: -1 | AQ202: -1 | AR202: -1 | AS202: -1 | AT202: -1 | AU202: -1 | AV202: -1 | AW202: -1 | AX202: 48 | AZ202: -1 | BB202: -1 | BD202: -1 | BE202: 0 | BF202: 703 | BG202: 1 | BH202: -1 | BI202: -1 | BJ202: -1 | BK202: -1 | BL202: -1 | BP202: =COUNTIF(knownSpells_monsters!C[-67],RC[-1]) -> 0
A203: 0 | B203: Wolf.2 | C203: 30 | D203: 67 | E203: 9 | F203: 15 | G203: 64 | H203: 45 | I203: 0 | J203: 0 | K203: 17 | L203: 17 | M203: 9 | N203: 6 | O203: 13 | P203: -1 | Q203: 130 | R203: 100 | S203: 4 | T203: 6 | U203: 6 | V203: 50 | W203: 0 | X203: 0 | Y203: 0 | Z203: 0 | AA203: 0 | AB203: 0 | AC203: 0 | AD203: 0 | AE203: 0 | AF203: 103 | AG203: 2 | AH203: 1 | AI203: 1 | AJ203: 12 | AK203: 0 | AL203: 32 | AM203: 2 | AN203: 315 | AO203: -1 | AP203: -1 | AQ203: -1 | AR203: -1 | AS203: -1 | AT203: -1 | AU203: -1 | AV203: -1 | AW203: -1 | AX203: 123 | AZ203: -1 | BB203: -1 | BD203: -1 | BE203: 0 | BF203: 704 | BG203: 1 | BH203: -1 | BI203: -1 | BJ203: -1 | BK203: -1 | BL203: -1 | BP203: =COUNTIF(knownSpells_monsters!C[-67],RC[-1]) -> 0
A204: 0 | B204: Wolf.3 | C204: 36 | D204: 74 | E204: 14 | F204: 19 | G204: 102 | H204: 41 | I204: 0 | J204: 0 | K204: 18 | L204: 18 | M204: 9 | N204: 10 | O204: 20 | P204: -1 | Q204: 220 | R204: 170 | S204: 7 | T204: 6 | U204: 6 | V204: 50 | W204: 0 | X204: 0 | Y204: 0 | Z204: 0 | AA204: 0 | AB204: 0 | AC204: 0 | AD204: 0 | AE204: 0 | AF204: 103 | AG204: 3 | AH204: 1 | AI204: 1 | AJ204: 12 | AK204: 0 | AL204: 51 | AM204: 3 | AN204: 1654 | AO204: -1 | AP204: -1 | AQ204: -1 | AR204: -1 | AS204: -1 | AT204: -1 | AU204: -1 | AV204: -1 | AW204: -1 | AX204: 315 | AZ204: -1 | BB204: -1 | BD204: -1 | BE204: 0 | BF204: 705 | BG204: 1 | BH204: -1 | BI204: -1 | BJ204: -1 | BK204: -1 | BL204: -1 | BP204: =COUNTIF(knownSpells_monsters!C[-67],RC[-1]) -> 0
A205: 0 | B205: Wolf.4 | C205: 42 | D205: 82 | E205: 18 | F205: 24 | G205: 164 | H205: 36 | I205: 0 | J205: 0 | K205: 19 | L205: 19 | M205: 10 | N205: 16 | O205: 33 | P205: -1 | Q205: 310 | R205: 240 | S205: 12 | T205: 6 | U205: 6 | V205: 50 | W205: 0 | X205: 0 | Y205: 0 | Z205: 0 | AA205: 0 | AB205: 0 | AC205: 0 | AD205: 0 | AE205: 0 | AF205: 103 | AG205: 4 | AH205: 1 | AI205: 1 | AJ205: 12 | AK205: 0 | AL205: 82 | AM205: 4 | AN205: 8682 | AO205: -1 | AP205: -1 | AQ205: -1 | AR205: -1 | AS205: -1 | AT205: -1 | AU205: -1 | AV205: -1 | AW205: -1 | AX205: 805 | AY205: Diamond Dust | AZ205: 10 | BB205: -1 | BD205: -1 | BE205: 30 | BF205: 706 | BG205: 1 | BH205: -1 | BI205: -1 | BJ205: -1 | BK205: -1 | BL205: -1 | BP205: =COUNTIF(knownSpells_monsters!C[-67],RC[-1]) -> 0
A206: 0 | B206: Wolf.5 | C206: 70 | D206: 110 | E206: 46 | F206: 52 | G206: 2458 | H206: 36 | I206: 0 | J206: 0 | K206: 19 | L206: 19 | M206: 10 | N206: 131 | O206: 262 | P206: -1 | Q206: 410 | R206: 340 | S206: 12 | T206: 6 | U206: 6 | V206: 50 | W206: 0 | X206: 0 | Y206: 0 | Z206: 0 | AA206: 0 | AB206: 0 | AC206: 0 | AD206: 0 | AE206: 0 | AF206: 103 | AG206: 5 | AH206: 1 | AI206: 1 | AJ206: 12 | AK206: 0 | AL206: 82 | AM206: 4 | AN206: 17364 | AO206: 0 | AP206: 0 | AQ206: 0 | AR206: 0 | AS206: 0 | AT206: 0 | AU206: 0 | AV206: 0 | AW206: 0 | AX206: 96637 | AY206: Diamond Dust | AZ206: 10 | BB206: -1 | BD206: -1 | BE206: 100 | BF206: 826 | BG206: 1 | BH206: -1 | BI206: -1 | BJ206: -1 | BK206: -1 | BL206: -1 | BP206: =COUNTIF(knownSpells_monsters!C[-67],RC[-1]) -> 0
A207: 0 | B207: Spider | C207: 10 | D207: 60 | E207: 1 | F207: 5 | G207: 30 | H207: 50 | I207: 0 | J207: 0 | K207: 24 | L207: 24 | M207: 6 | N207: 4 | O207: 8 | P207: 3 | Q207: 60 | R207: 30 | S207: 1 | T207: 2 | U207: 4 | V207: 0 | W207: 50 | X207: 0 | Y207: 0 | Z207: 0 | AA207: 0 | AB207: 0 | AC207: 0 | AD207: 0 | AE207: 0 | AF207: 104 | AG207: 1 | AH207: 1 | AI207: 1 | AJ207: 8 | AK207: 0 | AL207: 5 | AM207: 1 | AN207: 72 | AO207: -1 | AP207: -1 | AQ207: -1 | AR207: -1 | AS207: -1 | AT207: -1 | AU207: -1 | AV207: -1 | AW207: -1 | AX207: 36 | AZ207: -1 | BB207: -1 | BD207: -1 | BE207: 0 | BF207: 707 | BG207: 1 | BH207: -1 | BI207: -1 | BJ207: -1 | BK207: -1 | BL207: -1 | BP207: =COUNTIF(knownSpells_monsters!C[-67],RC[-1]) -> 0
A208: 0 | B208: Spider.2 | C208: 15 | D208: 67 | E208: 5 | F208: 9 | G208: 48 | H208: 45 | I208: 0 | J208: 0 | K208: 25 | L208: 25 | M208: 7 | N208: 6 | O208: 13 | P208: 3 | Q208: 150 | R208: 100 | S208: 3 | T208: 2 | U208: 4 | V208: 0 | W208: 50 | X208: 0 | Y208: 0 | Z208: 0 | AA208: 0 | AB208: 0 | AC208: 0 | AD208: 0 | AE208: 0 | AF208: 104 | AG208: 2 | AH208: 1 | AI208: 1 | AJ208: 8 | AK208: 0 | AL208: 8 | AM208: 2 | AN208: 378 | AO208: -1 | AP208: -1 | AQ208: -1 | AR208: -1 | AS208: -1 | AT208: -1 | AU208: -1 | AV208: -1 | AW208: -1 | AX208: 92 | AZ208: -1 | BB208: -1 | BD208: -1 | BE208: 0 | BF208: 708 | BG208: 1 | BH208: -1 | BI208: -1 | BJ208: -1 | BK208: -1 | BL208: -1 | BP208: =COUNTIF(knownSpells_monsters!C[-67],RC[-1]) -> 0
A209: 0 | B209: Spider.3 | C209: 19 | D209: 74 | E209: 9 | F209: 14 | G209: 77 | H209: 41 | I209: 0 | J209: 0 | K209: 26 | L209: 26 | M209: 7 | N209: 10 | O209: 20 | P209: 3 | Q209: 240 | R209: 170 | S209: 5 | T209: 2 | U209: 4 | V209: 0 | W209: 50 | X209: 0 | Y209: 0 | Z209: 0 | AA209: 0 | AB209: 0 | AC209: 0 | AD209: 0 | AE209: 0 | AF209: 104 | AG209: 3 | AH209: 1 | AI209: 1 | AJ209: 8 | AK209: 0 | AL209: 13 | AM209: 3 | AN209: 1985 | AO209: -1 | AP209: -1 | AQ209: -1 | AR209: -1 | AS209: -1 | AT209: -1 | AU209: -1 | AV209: -1 | AW209: -1 | AX209: 236 | AZ209: -1 | BB209: -1 | BD209: -1 | BE209: 0 | BF209: 709 | BG209: 1 | BH209: -1 | BI209: -1 | BJ209: -1 | BK209: -1 | BL209: -1 | BP209: =COUNTIF(knownSpells_monsters!C[-67],RC[-1]) -> 0
A210: 0 | B210: Spider.4 | C210: 24 | D210: 82 | E210: 14 | F210: 18 | G210: 123 | H210: 36 | I210: 0 | J210: 0 | K210: 27 | L210: 27 | M210: 8 | N210: 16 | O210: 33 | P210: 3 | Q210: 330 | R210: 240 | S210: 8 | T210: 2 | U210: 4 | V210: 0 | W210: 100 | X210: 0 | Y210: 0 | Z210: 0 | AA210: 0 | AB210: 0 | AC210: 0 | AD210: 0 | AE210: 0 | AF210: 104 | AG210: 4 | AH210: 1 | AI210: 1 | AJ210: 8 | AK210: 0 | AL210: 20 | AM210: 4 | AN210: 10419 | AO210: -1 | AP210: -1 | AQ210: -1 | AR210: -1 | AS210: -1 | AT210: -1 | AU210: -1 | AV210: -1 | AW210: -1 | AX210: 604 | AY210: Poison Cloud | AZ210: 20 | BB210: -1 | BD210: -1 | BE210: 30 | BF210: 710 | BG210: 1 | BH210: -1 | BI210: -1 | BJ210: -1 | BK210: -1 | BL210: -1 | BP210: =COUNTIF(knownSpells_monsters!C[-67],RC[-1]) -> 0
A211: 0 | B211: Spider.5 | C211: 52 | D211: 110 | E211: 42 | F211: 46 | G211: 1843 | H211: 36 | I211: 0 | J211: 0 | K211: 27 | L211: 27 | M211: 8 | N211: 131 | O211: 262 | P211: 3 | Q211: 430 | R211: 340 | S211: 8 | T211: 2 | U211: 4 | V211: 0 | W211: 100 | X211: 0 | Y211: 0 | Z211: 0 | AA211: 0 | AB211: 0 | AC211: 0 | AD211: 0 | AE211: 0 | AF211: 104 | AG211: 5 | AH211: 1 | AI211: 1 | AJ211: 8 | AK211: 0 | AL211: 20 | AM211: 4 | AN211: 20837 | AO211: 0 | AP211: 0 | AQ211: 0 | AR211: 0 | AS211: 0 | AT211: 0 | AU211: 0 | AV211: 0 | AW211: 0 | AX211: 72478 | AY211: Poison Cloud | AZ211: 20 | BB211: -1 | BD211: -1 | BE211: 100 | BF211: 827 | BG211: 1 | BH211: -1 | BI211: -1 | BJ211: -1 | BK211: -1 | BL211: -1 | BP211: =COUNTIF(knownSpells_monsters!C[-67],RC[-1]) -> 0
A212: 0 | B212: Succubus | C212: 40 | D212: 50 | E212: 65 | F212: 50 | G212: 100 | H212: 100 | I212: 200 | J212: 150 | K212: 20 | L212: 20 | M212: 8 | N212: 1 | O212: 10 | P212: -1 | Q212: 50 | R212: 45 | S212: 3 | T212: 6 | U212: 10 | V212: 50 | W212: 0 | X212: 0 | Y212: 0 | Z212: 0 | AA212: 100 | AB212: 100 | AC212: 100 | AD212: 100 | AE212: 0 | AF212: 105 | AG212: 1 | AH212: 1 | AI212: 3 | AJ212: 10 | AK212: 0 | AL212: 33 | AM212: 1 | AN212: 900 | AO212: 100 | AP212: 600 | AQ212: 900 | AR212: -1 | AS212: -1 | AT212: -1 | AU212: 775946239 | AV212: 10 | AW212: 2500 | AX212: 550 | AZ212: -1 | BB212: -1 | BD212: -1 | BE212: 0 | BF212: 711 | BG212: 0 | BH212: 20 | BI212: 20 | BJ212: 20 | BK212: 20 | BL212: 20 | BM212: Sonic Beam | BO212: [212] | BP212: =COUNTIF(knownSpells_monsters!C[-67],RC[-1]) -> 4
A213: 0 | B213: Succubus.2 | C213: 46 | D213: 57 | E213: 72 | F213: 57 | G213: 160 | H213: 90 | I213: 300 | J213: 135 | K213: 21 | L213: 21 | M213: 9 | N213: 2 | O213: 16 | P213: -1 | Q213: 140 | R213: 115 | S213: 6 | T213: 6 | U213: 10 | V213: 0 | W213: 50 | X213: 0 | Y213: 0 | Z213: 0 | AA213: 100 | AB213: 100 | AC213: 100 | AD213: 100 | AE213: 0 | AF213: 105 | AG213: 2 | AH213: 1 | AI213: 3 | AJ213: 10 | AK213: 0 | AL213: 53 | AM213: 2 | AN213: 4725 | AO213: 100 | AP213: 4200 | AQ213: 6030 | AR213: -1 | AS213: -1 | AT213: -1 | AU213: 775946239 | AV213: 70 | AW213: 17500 | AX213: 1408 | AZ213: -1 | BB213: -1 | BD213: -1 | BE213: 0 | BF213: 712 | BG213: 0 | BH213: 50 | BI213: 50 | BJ213: 50 | BK213: 50 | BL213: 50 | BM213: Sonic Beam | BO213: [213] | BP213: =COUNTIF(knownSpells_monsters!C[-67],RC[-1]) -> 4
A214: 0 | B214: Succubus.3 | C214: 52 | D214: 63 | E214: 80 | F214: 63 | G214: 256 | H214: 81 | I214: 450 | J214: 122 | K214: 22 | L214: 22 | M214: 9 | N214: 3 | O214: 26 | P214: -1 | Q214: 230 | R214: 185 | S214: 9 | T214: 6 | U214: 10 | V214: 0 | W214: 0 | X214: 50 | Y214: 0 | Z214: 0 | AA214: 100 | AB214: 100 | AC214: 100 | AD214: 100 | AE214: 0 | AF214: 105 | AG214: 3 | AH214: 1 | AI214: 3 | AJ214: 10 | AK214: 0 | AL214: 85 | AM214: 3 | AN214: 24806 | AO214: 100 | AP214: 29400 | AQ214: 40401 | AR214: -1 | AS214: -1 | AT214: -1 | AU214: 775946239 | AV214: 490 | AW214: 122500 | AX214: 3604 | AZ214: -1 | BB214: -1 | BD214: -1 | BE214: 0 | BF214: 713 | BG214: 0 | BH214: 80 | BI214: 80 | BJ214: 80 | BK214: 80 | BL214: 80 | BM214: Sonic Beam | BO214: [214] | BP214: =COUNTIF(knownSpells_monsters!C[-67],RC[-1]) -> 4
A215: 0 | B215: Succubus.4 | C215: 59 | D215: 70 | E215: 88 | F215: 70 | G215: 410 | H215: 73 | I215: 675 | J215: 109 | K215: 23 | L215: 23 | M215: 10 | N215: 4 | O215: 41 | P215: -1 | Q215: 320 | R215: 255 | S215: 15 | T215: 6 | U215: 10 | V215: 0 | W215: 0 | X215: 0 | Y215: 50 | Z215: 0 | AA215: 100 | AB215: 100 | AC215: 100 | AD215: 100 | AE215: 0 | AF215: 105 | AG215: 4 | AH215: 1 | AI215: 3 | AJ215: 10 | AK215: 0 | AL215: 137 | AM215: 4 | AN215: 130233 | AO215: 100 | AP215: 205800 | AQ215: 270687 | AR215: -1 | AS215: -1 | AT215: -1 | AU215: 775946239 | AV215: 3430 | AW215: 857500 | AX215: 9227 | AZ215: -1 | BB215: -1 | BD215: -1 | BE215: 0 | BF215: 714 | BG215: 0 | BH215: 100 | BI215: 100 | BJ215: 100 | BK215: 100 | BL215: 100 | BM215: Sonic Beam | BO215: [215] | BP215: =COUNTIF(knownSpells_monsters!C[-67],RC[-1]) -> 8
A216: 0 | B216: Succubus.5 | C216: 87 | D216: 98 | E216: 116 | F216: 98 | G216: 6144 | H216: 73 | I216: 10125 | J216: 109 | K216: 23 | L216: 23 | M216: 10 | N216: 33 | O216: 288 | P216: -1 | Q216: 420 | R216: 355 | S216: 15 | T216: 6 | U216: 10 | V216: 0 | W216: 0 | X216: 0 | Y216: 0 | Z216: 0 | AA216: 100 | AB216: 100 | AC216: 100 | AD216: 100 | AE216: 0 | AF216: 105 | AG216: 5 | AH216: 1 | AI216: 3 | AJ216: 10 | AK216: 0 | AL216: 137 | AM216: 4 | AN216: 260466 | AO216: 100 | AP216: 617400 | AQ216: 812060 | AR216: 0 | AS216: 0 | AT216: 0 | AU216: 775946239 | AV216: 10290 | AW216: 2572500 | AX216: 196937 | AZ216: -1 | BB216: -1 | BD216: -1 | BE216: 0 | BF216: 828 | BG216: 0 | BH216: 100 | BI216: 100 | BJ216: 100 | BK216: 100 | BL216: 100 | BM216: Sonic Beam | BO216: [216] | BP216: =COUNTIF(knownSpells_monsters!C[-67],RC[-1]) -> 8
A217: 0 | B217: Dino | C217: 30 | D217: 20 | E217: 7 | F217: 7 | G217: 80 | H217: 100 | I217: 0 | J217: 0 | K217: 22 | L217: 22 | M217: 6 | N217: 8 | O217: 16 | P217: -1 | Q217: 50 | R217: 50 | S217: 4 | T217: 6 | U217: 8 | V217: 0 | W217: 50 | X217: 0 | Y217: 0 | Z217: 0 | AA217: 0 | AB217: 0 | AC217: 0 | AD217: 0 | AE217: 0 | AF217: 106 | AG217: 1 | AH217: 1 | AI217: 1 | AJ217: 16 | AK217: 0 | AL217: 10 | AM217: 1 | AN217: 300 | AO217: -1 | AP217: -1 | AQ217: -1 | AR217: -1 | AS217: -1 | AT217: -1 | AU217: -1 | AV217: -1 | AW217: -1 | AX217: 192 | AZ217: -1 | BB217: -1 | BD217: -1 | BE217: 0 | BF217: 715 | BG217: 1 | BH217: -1 | BI217: -1 | BJ217: -1 | BK217: -1 | BL217: -1 | BP217: =COUNTIF(knownSpells_monsters!C[-67],RC[-1]) -> 0
A218: 0 | B218: Dino.2 | C218: 36 | D218: 25 | E218: 11 | F218: 11 | G218: 128 | H218: 90 | I218: 0 | J218: 0 | K218: 23 | L218: 23 | M218: 7 | N218: 13 | O218: 26 | P218: -1 | Q218: 140 | R218: 120 | S218: 7 | T218: 6 | U218: 8 | V218: 0 | W218: 50 | X218: 0 | Y218: 0 | Z218: 0 | AA218: 0 | AB218: 0 | AC218: 0 | AD218: 0 | AE218: 0 | AF218: 106 | AG218: 2 | AH218: 1 | AI218: 1 | AJ218: 16 | AK218: 0 | AL218: 16 | AM218: 2 | AN218: 1575 | AO218: -1 | AP218: -1 | AQ218: -1 | AR218: -1 | AS218: -1 | AT218: -1 | AU218: -1 | AV218: -1 | AW218: -1 | AX218: 492 | AZ218: -1 | BB218: -1 | BD218: -1 | BE218: 0 | BF218: 716 | BG218: 1 | BH218: -1 | BI218: -1 | BJ218: -1 | BK218: -1 | BL218: -1 | BP218: =COUNTIF(knownSpells_monsters!C[-67],RC[-1]) -> 0
A219: 0 | B219: Dino.3 | C219: 41 | D219: 30 | E219: 16 | F219: 16 | G219: 205 | H219: 81 | I219: 0 | J219: 0 | K219: 24 | L219: 24 | M219: 7 | N219: 20 | O219: 41 | P219: -1 | Q219: 230 | R219: 190 | S219: 12 | T219: 6 | U219: 8 | V219: 0 | W219: 50 | X219: 0 | Y219: 0 | Z219: 0 | AA219: 0 | AB219: 0 | AC219: 0 | AD219: 0 | AE219: 0 | AF219: 106 | AG219: 3 | AH219: 1 | AI219: 1 | AJ219: 16 | AK219: 0 | AL219: 26 | AM219: 3 | AN219: 8269 | AO219: -1 | AP219: -1 | AQ219: -1 | AR219: -1 | AS219: -1 | AT219: -1 | AU219: -1 | AV219: -1 | AW219: -1 | AX219: 1258 | AZ219: -1 | BB219: -1 | BD219: -1 | BE219: 0 | BF219: 717 | BG219: 1 | BH219: -1 | BI219: -1 | BJ219: -1 | BK219: -1 | BL219: -1 | BP219: =COUNTIF(knownSpells_monsters!C[-67],RC[-1]) -> 0
A220: 0 | B220: Dino.4 | C220: 47 | D220: 36 | E220: 21 | F220: 21 | G220: 328 | H220: 73 | I220: 0 | J220: 0 | K220: 25 | L220: 25 | M220: 8 | N220: 33 | O220: 66 | P220: -1 | Q220: 320 | R220: 260 | S220: 18 | T220: 6 | U220: 8 | V220: 0 | W220: 50 | X220: 0 | Y220: 0 | Z220: 0 | AA220: 0 | AB220: 0 | AC220: 0 | AD220: 0 | AE220: 0 | AF220: 106 | AG220: 4 | AH220: 1 | AI220: 1 | AJ220: 16 | AK220: 0 | AL220: 41 | AM220: 4 | AN220: 43411 | AO220: -1 | AP220: -1 | AQ220: -1 | AR220: -1 | AS220: -1 | AT220: -1 | AU220: -1 | AV220: -1 | AW220: -1 | AX220: 3221 | AY220: Ice Missile | AZ220: 10 | BB220: -1 | BD220: -1 | BE220: 30 | BF220: 718 | BG220: 1 | BH220: -1 | BI220: -1 | BJ220: -1 | BK220: -1 | BL220: -1 | BP220: =COUNTIF(knownSpells_monsters!C[-67],RC[-1]) -> 0
A221: 0 | B221: Dino.5 | C221: 75 | D221: 64 | E221: 49 | F221: 49 | G221: 4915 | H221: 73 | I221: 0 | J221: 0 | K221: 25 | L221: 25 | M221: 8 | N221: 262 | O221: 517 | P221: -1 | Q221: 420 | R221: 360 | S221: 18 | T221: 6 | U221: 8 | V221: 0 | W221: 50 | X221: 0 | Y221: 0 | Z221: 0 | AA221: 0 | AB221: 0 | AC221: 0 | AD221: 0 | AE221: 0 | AF221: 106 | AG221: 5 | AH221: 1 | AI221: 1 | AJ221: 16 | AK221: 0 | AL221: 41 | AM221: 4 | AN221: 86822 | AO221: 0 | AP221: 0 | AQ221: 0 | AR221: 0 | AS221: 0 | AT221: 0 | AU221: 0 | AV221: 0 | AW221: 0 | AX221: 383036 | AY221: Ice Missile | AZ221: 10 | BB221: -1 | BD221: -1 | BE221: 100 | BF221: 829 | BG221: 1 | BH221: -1 | BI221: -1 | BJ221: -1 | BK221: -1 | BL221: -1 | BP221: =COUNTIF(knownSpells_monsters!C[-67],RC[-1]) -> 0
A222: 0 | B222: Sheep | C222: 15 | D222: 5 | E222: 1 | F222: 1 | G222: 5 | H222: 100 | I222: 0 | J222: 0 | K222: 12 | L222: 12 | M222: 4 | N222: 1 | O222: 2 | P222: -1 | Q222: 0 | R222: 0 | S222: 0 | T222: 1 | U222: 1 | V222: 0 | W222: 0 | X222: 0 | Y222: 0 | Z222: 0 | AA222: 0 | AB222: 0 | AC222: 0 | AD222: 0 | AE222: 0 | AF222: 107 | AG222: 1 | AH222: 1 | AI222: 1 | AJ222: 8 | AK222: 0 | AL222: 1 | AM222: 1 | AN222: 10 | AO222: -1 | AP222: -1 | AQ222: -1 | AR222: -1 | AS222: -1 | AT222: -1 | AU222: -1 | AV222: -1 | AW222: -1 | AX222: 2 | AZ222: -1 | BB222: -1 | BD222: -1 | BE222: 0 | BF222: 719 | BG222: 1 | BH222: -1 | BI222: -1 | BJ222: -1 | BK222: -1 | BL222: -1 | BP222: =COUNTIF(knownSpells_monsters!C[-67],RC[-1]) -> 0
A223: 0 | B223: MercenaryDruidBase | C223: 20 | D223: 30 | E223: 40 | F223: 50 | G223: 80 | H223: 100 | I223: 350 | J223: 100 | K223: 16 | L223: 16 | M223: 6 | N223: 8 | O223: 16 | P223: -1 | Q223: 50 | R223: 50 | S223: 2 | T223: 6 | U223: 8 | V223: 0 | W223: 0 | X223: 30 | Y223: 0 | Z223: 0 | AA223: 0 | AB223: 0 | AC223: 0 | AD223: 0 | AE223: 0 | AF223: 100 | AG223: 4 | AH223: 1 | AI223: 1 | AJ223: 14 | AK223: 0 | AL223: 0 | AM223: 3 | AN223: 0 | AO223: -1 | AP223: -1 | AQ223: -1 | AR223: -1 | AS223: -1 | AT223: -1 | AU223: -1 | AV223: -1 | AW223: -1 | AX223: 384 | AZ223: -1 | BB223: -1 | BD223: -1 | BE223: 0 | BF223: 10030 | BG223: 0 | BH223: 30 | BI223: 50 | BJ223: 30 | BK223: 40 | BL223: 30 | BO223: [223] | BP223: =COUNTIF(knownSpells_monsters!C[-67],RC[-1]) -> 9
A224: 0 | B224: MercenaryDruid60 | C224: 20 | D224: 30 | E224: 40 | F224: 50 | G224: 80 | H224: 100 | I224: 350 | J224: 100 | K224: 16 | L224: 16 | M224: 6 | N224: 8 | O224: 16 | P224: -1 | Q224: 50 | R224: 50 | S224: 2 | T224: 6 | U224: 8 | V224: 0 | W224: 0 | X224: 30 | Y224: 0 | Z224: 0 | AA224: 0 | AB224: 0 | AC224: 0 | AD224: 0 | AE224: 0 | AF224: 100 | AG224: 4 | AH224: 1 | AI224: 1 | AJ224: 14 | AK224: 0 | AL224: 0 | AM224: 3 | AN224: 0 | AO224: -1 | AP224: -1 | AQ224: -1 | AR224: -1 | AS224: -1 | AT224: -1 | AU224: -1 | AV224: -1 | AW224: -1 | AX224: 384 | AZ224: -1 | BB224: -1 | BD224: -1 | BE224: 0 | BF224: 10034 | BG224: 0 | BH224: 20 | BI224: 40 | BJ224: 20 | BK224: 30 | BL224: 20 | BO224: [224] | BP224: =COUNTIF(knownSpells_monsters!C[-67],RC[-1]) -> 9
A225: 0 | B225: MercenaryDruid70 | C225: 20 | D225: 30 | E225: 40 | F225: 50 | G225: 90 | H225: 100 | I225: 370 | J225: 100 | K225: 16 | L225: 16 | M225: 6 | N225: 8 | O225: 16 | P225: -1 | Q225: 50 | R225: 50 | S225: 2 | T225: 6 | U225: 8 | V225: 0 | W225: 0 | X225: 30 | Y225: 0 | Z225: 0 | AA225: 0 | AB225: 0 | AC225: 0 | AD225: 0 | AE225: 0 | AF225: 100 | AG225: 4 | AH225: 1 | AI225: 1 | AJ225: 14 | AK225: 0 | AL225: 0 | AM225: 3 | AN225: 0 | AO225: -1 | AP225: -1 | AQ225: -1 | AR225: -1 | AS225: -1 | AT225: -1 | AU225: -1 | AV225: -1 | AW225: -1 | AX225: 432 | AZ225: -1 | BB225: -1 | BD225: -1 | BE225: 0 | BF225: 10035 | BG225: 0 | BH225: 25 | BI225: 49 | BJ225: 25 | BK225: 37 | BL225: 25 | BO225: [225] | BP225: =COUNTIF(knownSpells_monsters!C[-67],RC[-1]) -> 11
A226: 0 | B226: MercenaryDruid80 | C226: 20 | D226: 30 | E226: 40 | F226: 50 | G226: 100 | H226: 100 | I226: 390 | J226: 100 | K226: 16 | L226: 16 | M226: 6 | N226: 8 | O226: 16 | P226: -1 | Q226: 50 | R226: 50 | S226: 2 | T226: 6 | U226: 8 | V226: 0 | W226: 0 | X226: 30 | Y226: 0 | Z226: 0 | AA226: 0 | AB226: 0 | AC226: 0 | AD226: 0 | AE226: 0 | AF226: 100 | AG226: 4 | AH226: 1 | AI226: 1 | AJ226: 14 | AK226: 0 | AL226: 0 | AM226: 3 | AN226: 0 | AO226: -1 | AP226: -1 | AQ226: -1 | AR226: -1 | AS226: -1 | AT226: -1 | AU226: -1 | AV226: -1 | AW226: -1 | AX226: 480 | AZ226: -1 | BB226: -1 | BD226: -1 | BE226: 0 | BF226: 10036 | BG226: 0 | BH226: 30 | BI226: 58 | BJ226: 30 | BK226: 44 | BL226: 30 | BO226: [226] | BP226: =COUNTIF(knownSpells_monsters!C[-67],RC[-1]) -> 12
A227: 0 | B227: MercenaryDruid90 | C227: 20 | D227: 30 | E227: 40 | F227: 50 | G227: 110 | H227: 100 | I227: 410 | J227: 100 | K227: 16 | L227: 16 | M227: 6 | N227: 8 | O227: 16 | P227: -1 | Q227: 50 | R227: 50 | S227: 2 | T227: 1 | U227: 1 | V227: 0 | W227: 0 | X227: 30 | Y227: 0 | Z227: 0 | AA227: 0 | AB227: 0 | AC227: 0 | AD227: 0 | AE227: 0 | AF227: 100 | AG227: 4 | AH227: 1 | AI227: 1 | AJ227: 14 | AK227: 0 | AL227: 0 | AM227: 3 | AN227: 0 | AO227: -1 | AP227: -1 | AQ227: -1 | AR227: -1 | AS227: -1 | AT227: -1 | AU227: -1 | AV227: -1 | AW227: -1 | AX227: 528 | AZ227: -1 | BB227: -1 | BD227: -1 | BE227: 0 | BF227: 10037 | BG227: 0 | BH227: 35 | BI227: 67 | BJ227: 35 | BK227: 51 | BL227: 35 | BO227: [227] | BP227: =COUNTIF(knownSpells_monsters!C[-67],RC[-1]) -> 14
A228: 0 | B228: MercenaryDruid100 | C228: 20 | D228: 30 | E228: 40 | F228: 50 | G228: 120 | H228: 100 | I228: 430 | J228: 100 | K228: 16 | L228: 16 | M228: 6 | N228: 8 | O228: 16 | P228: -1 | Q228: 50 | R228: 50 | S228: 2 | T228: 6 | U228: 8 | V228: 0 | W228: 0 | X228: 30 | Y228: 0 | Z228: 0 | AA228: 0 | AB228: 0 | AC228: 0 | AD228: 0 | AE228: 0 | AF228: 100 | AG228: 4 | AH228: 1 | AI228: 1 | AJ228: 14 | AK228: 0 | AL228: 0 | AM228: 3 | AN228: 0 | AO228: -1 | AP228: -1 | AQ228: -1 | AR228: -1 | AS228: -1 | AT228: -1 | AU228: -1 | AV228: -1 | AW228: -1 | AX228: 576 | AZ228: -1 | BB228: -1 | BD228: -1 | BE228: 0 | BF228: 10038 | BG228: 0 | BH228: 40 | BI228: 76 | BJ228: 40 | BK228: 58 | BL228: 40 | BO228: [228] | BP228: =COUNTIF(knownSpells_monsters!C[-67],RC[-1]) -> 15
A229: 0 | B229: MercenaryDruid110 | C229: 20 | D229: 30 | E229: 40 | F229: 50 | G229: 130 | H229: 100 | I229: 450 | J229: 100 | K229: 16 | L229: 16 | M229: 6 | N229: 8 | O229: 16 | P229: -1 | Q229: 50 | R229: 50 | S229: 2 | T229: 6 | U229: 8 | V229: 0 | W229: 0 | X229: 30 | Y229: 0 | Z229: 0 | AA229: 0 | AB229: 0 | AC229: 0 | AD229: 0 | AE229: 0 | AF229: 100 | AG229: 4 | AH229: 1 | AI229: 1 | AJ229: 14 | AK229: 0 | AL229: 0 | AM229: 3 | AN229: 0 | AO229: -1 | AP229: -1 | AQ229: -1 | AR229: -1 | AS229: -1 | AT229: -1 | AU229: -1 | AV229: -1 | AW229: -1 | AX229: 624 | AZ229: -1 | BB229: -1 | BD229: -1 | BE229: 0 | BF229: 10039 | BG229: 0 | BH229: 45 | BI229: 85 | BJ229: 45 | BK229: 65 | BL229: 45 | BO229: [229] | BP229: =COUNTIF(knownSpells_monsters!C[-67],RC[-1]) -> 15
A230: 0 | B230: MercenaryTrollBase | C230: 69 | D230: 20 | E230: 10 | F230: 30 | G230: 800 | H230: 81 | I230: 0 | J230: 0 | K230: 10 | L230: 10 | M230: 5 | N230: 40 | O230: 75 | P230: -1 | Q230: 240 | R230: 240 | S230: 25 | T230: 10 | U230: 6 | V230: 30 | W230: 75 | X230: 88 | Y230: 92 | Z230: 50 | AA230: 0 | AB230: 0 | AC230: 50 | AD230: 30 | AE230: 30 | AF230: 102 | AG230: 3 | AH230: 2 | AI230: 1 | AJ230: 18 | AK230: 0 | AL230: 0 | AM230: 3 | AN230: 0 | AO230: -1 | AP230: -1 | AQ230: -1 | AR230: -1 | AS230: -1 | AT230: -1 | AU230: -1 | AV230: -1 | AW230: -1 | AX230: 9200 | AZ230: -1 | BB230: -1 | BD230: -1 | BE230: 0 | BF230: 10040 | BG230: 1 | BH230: -1 | BI230: -1 | BJ230: -1 | BK230: -1 | BL230: -1 | BP230: =COUNTIF(knownSpells_monsters!C[-67],RC[-1]) -> 0
A231: 0 | B231: MercenaryTroll70 | C231: 69 | D231: 20 | E231: 10 | F231: 30 | G231: 800 | H231: 81 | I231: 0 | J231: 0 | K231: 10 | L231: 10 | M231: 5 | N231: 40 | O231: 75 | P231: -1 | Q231: 240 | R231: 240 | S231: 25 | T231: 10 | U231: 6 | V231: 30 | W231: 75 | X231: 88 | Y231: 92 | Z231: 50 | AA231: 0 | AB231: 0 | AC231: 50 | AD231: 30 | AE231: 30 | AF231: 102 | AG231: 3 | AH231: 2 | AI231: 1 | AJ231: 18 | AK231: 0 | AL231: 0 | AM231: 3 | AN231: 0 | AO231: -1 | AP231: -1 | AQ231: -1 | AR231: -1 | AS231: -1 | AT231: -1 | AU231: -1 | AV231: -1 | AW231: -1 | AX231: 9200 | AZ231: -1 | BB231: -1 | BD231: -1 | BE231: 0 | BF231: 10045 | BG231: 1 | BH231: -1 | BI231: -1 | BJ231: -1 | BK231: -1 | BL231: -1 | BP231: =COUNTIF(knownSpells_monsters!C[-67],RC[-1]) -> 0
A232: 0 | B232: MercenaryTroll80 | C232: 69 | D232: 20 | E232: 10 | F232: 30 | G232: 800 | H232: 81 | I232: 0 | J232: 0 | K232: 10 | L232: 10 | M232: 5 | N232: 40 | O232: 75 | P232: -1 | Q232: 260 | R232: 260 | S232: 25 | T232: 10 | U232: 6 | V232: 30 | W232: 75 | X232: 88 | Y232: 92 | Z232: 50 | AA232: 0 | AB232: 0 | AC232: 50 | AD232: 30 | AE232: 30 | AF232: 102 | AG232: 3 | AH232: 2 | AI232: 1 | AJ232: 18 | AK232: 0 | AL232: 0 | AM232: 3 | AN232: 0 | AO232: -1 | AP232: -1 | AQ232: -1 | AR232: -1 | AS232: -1 | AT232: -1 | AU232: -1 | AV232: -1 | AW232: -1 | AX232: 9200 | AZ232: -1 | BB232: -1 | BD232: -1 | BE232: 0 | BF232: 10046 | BG232: 1 | BH232: -1 | BI232: -1 | BJ232: -1 | BK232: -1 | BL232: -1 | BP232: =COUNTIF(knownSpells_monsters!C[-67],RC[-1]) -> 0
A233: 0 | B233: MercenaryTroll90 | C233: 69 | D233: 20 | E233: 10 | F233: 30 | G233: 850 | H233: 81 | I233: 0 | J233: 0 | K233: 10 | L233: 10 | M233: 5 | N233: 40 | O233: 75 | P233: -1 | Q233: 280 | R233: 280 | S233: 25 | T233: 10 | U233: 6 | V233: 30 | W233: 75 | X233: 88 | Y233: 92 | Z233: 50 | AA233: 0 | AB233: 0 | AC233: 50 | AD233: 30 | AE233: 30 | AF233: 102 | AG233: 3 | AH233: 2 | AI233: 1 | AJ233: 18 | AK233: 0 | AL233: 0 | AM233: 3 | AN233: 0 | AO233: -1 | AP233: -1 | AQ233: -1 | AR233: -1 | AS233: -1 | AT233: -1 | AU233: -1 | AV233: -1 | AW233: -1 | AX233: 9775 | AZ233: -1 | BB233: -1 | BD233: -1 | BE233: 0 | BF233: 10047 | BG233: 1 | BH233: -1 | BI233: -1 | BJ233: -1 | BK233: -1 | BL233: -1 | BP233: =COUNTIF(knownSpells_monsters!C[-67],RC[-1]) -> 0
A234: 0 | B234: MercenaryTroll100 | C234: 69 | D234: 20 | E234: 10 | F234: 30 | G234: 900 | H234: 81 | I234: 0 | J234: 0 | K234: 10 | L234: 10 | M234: 5 | N234: 40 | O234: 75 | P234: -1 | Q234: 300 | R234: 300 | S234: 25 | T234: 10 | U234: 6 | V234: 30 | W234: 75 | X234: 88 | Y234: 92 | Z234: 50 | AA234: 0 | AB234: 0 | AC234: 50 | AD234: 30 | AE234: 30 | AF234: 102 | AG234: 3 | AH234: 2 | AI234: 1 | AJ234: 18 | AK234: 0 | AL234: 0 | AM234: 3 | AN234: 0 | AO234: -1 | AP234: -1 | AQ234: -1 | AR234: -1 | AS234: -1 | AT234: -1 | AU234: -1 | AV234: -1 | AW234: -1 | AX234: 10350 | AZ234: -1 | BB234: -1 | BD234: -1 | BE234: 0 | BF234: 10048 | BG234: 1 | BH234: -1 | BI234: -1 | BJ234: -1 | BK234: -1 | BL234: -1 | BP234: =COUNTIF(knownSpells_monsters!C[-67],RC[-1]) -> 0
A235: 0 | B235: MercenaryTroll110 | C235: 69 | D235: 20 | E235: 10 | F235: 30 | G235: 950 | H235: 81 | I235: 0 | J235: 0 | K235: 10 | L235: 10 | M235: 5 | N235: 40 | O235: 75 | P235: -1 | Q235: 320 | R235: 320 | S235: 25 | T235: 10 | U235: 6 | V235: 30 | W235: 75 | X235: 88 | Y235: 92 | Z235: 50 | AA235: 0 | AB235: 0 | AC235: 50 | AD235: 30 | AE235: 30 | AF235: 102 | AG235: 3 | AH235: 2 | AI235: 1 | AJ235: 18 | AK235: 0 | AL235: 0 | AM235: 3 | AN235: 0 | AO235: -1 | AP235: -1 | AQ235: -1 | AR235: -1 | AS235: -1 | AT235: -1 | AU235: -1 | AV235: -1 | AW235: -1 | AX235: 10925 | AZ235: -1 | BB235: -1 | BD235: -1 | BE235: 0 | BF235: 10049 | BG235: 1 | BH235: -1 | BI235: -1 | BJ235: -1 | BK235: -1 | BL235: -1 | BP235: =COUNTIF(knownSpells_monsters!C[-67],RC[-1]) -> 0
A236: 0 | B236: MercenaryOrcBase | C236: 46 | D236: 44 | E236: 15 | F236: 20 | G236: 200 | H236: 80 | I236: 0 | J236: 0 | K236: 20 | L236: 24 | M236: 7 | N236: 25 | O236: 50 | P236: -1 | Q236: 240 | R236: 180 | S236: 6 | T236: 21 | U236: 7 | V236: 0 | W236: 50 | X236: 83 | Y236: 50 | Z236: 50 | AA236: 0 | AB236: 0 | AC236: 0 | AD236: 0 | AE236: 0 | AF236: 101 | AG236: 1 | AH236: 1 | AI236: 1 | AJ236: 14 | AK236: 100 | AL236: 0 | AM236: 3 | AN236: 0 | AO236: -1 | AP236: -1 | AQ236: -1 | AR236: -1 | AS236: -1 | AT236: -1 | AU236: -1 | AV236: -1 | AW236: -1 | AX236: 3000 | AZ236: -1 | BB236: -1 | BD236: -1 | BE236: 0 | BF236: 10050 | BG236: 1 | BH236: -1 | BI236: -1 | BJ236: -1 | BK236: -1 | BL236: -1 | BM236: Uncommon Wood Short Bow | BP236: =COUNTIF(knownSpells_monsters!C[-67],RC[-1]) -> 0
A237: 0 | B237: MercenaryOrc60 | C237: 46 | D237: 44 | E237: 15 | F237: 20 | G237: 200 | H237: 80 | I237: 0 | J237: 0 | K237: 20 | L237: 24 | M237: 7 | N237: 25 | O237: 50 | P237: -1 | Q237: 240 | R237: 180 | S237: 6 | T237: 21 | U237: 7 | V237: 0 | W237: 50 | X237: 83 | Y237: 50 | Z237: 50 | AA237: 0 | AB237: 0 | AC237: 0 | AD237: 0 | AE237: 0 | AF237: 101 | AG237: 1 | AH237: 1 | AI237: 1 | AJ237: 14 | AK237: 100 | AL237: 0 | AM237: 3 | AN237: 0 | AO237: -1 | AP237: -1 | AQ237: -1 | AR237: -1 | AS237: -1 | AT237: -1 | AU237: -1 | AV237: -1 | AW237: -1 | AX237: 3000 | AZ237: -1 | BB237: -1 | BD237: -1 | BE237: 0 | BF237: 10054 | BG237: 1 | BH237: -1 | BI237: -1 | BJ237: -1 | BK237: -1 | BL237: -1 | BM237: Uncommon Wood Short Bow | BP237: =COUNTIF(knownSpells_monsters!C[-67],RC[-1]) -> 0
A238: 0 | B238: MercenaryOrc70 | C238: 46 | D238: 44 | E238: 15 | F238: 20 | G238: 200 | H238: 80 | I238: 0 | J238: 0 | K238: 20 | L238: 24 | M238: 7 | N238: 25 | O238: 50 | P238: -1 | Q238: 240 | R238: 180 | S238: 6 | T238: 21 | U238: 7 | V238: 0 | W238: 50 | X238: 83 | Y238: 50 | Z238: 50 | AA238: 0 | AB238: 0 | AC238: 0 | AD238: 0 | AE238: 0 | AF238: 101 | AG238: 1 | AH238: 1 | AI238: 1 | AJ238: 14 | AK238: 100 | AL238: 0 | AM238: 3 | AN238: 0 | AO238: -1 | AP238: -1 | AQ238: -1 | AR238: -1 | AS238: -1 | AT238: -1 | AU238: -1 | AV238: -1 | AW238: -1 | AX238: 3000 | AZ238: -1 | BB238: -1 | BD238: -1 | BE238: 0 | BF238: 10055 | BG238: 1 | BH238: -1 | BI238: -1 | BJ238: -1 | BK238: -1 | BL238: -1 | BM238: Uncommon Wood Short Bow | BP238: =COUNTIF(knownSpells_monsters!C[-67],RC[-1]) -> 0
A239: 0 | B239: MercenaryOrc80 | C239: 46 | D239: 44 | E239: 15 | F239: 20 | G239: 220 | H239: 80 | I239: 0 | J239: 0 | K239: 20 | L239: 24 | M239: 7 | N239: 25 | O239: 50 | P239: -1 | Q239: 260 | R239: 200 | S239: 6 | T239: 21 | U239: 7 | V239: 0 | W239: 50 | X239: 83 | Y239: 50 | Z239: 50 | AA239: 0 | AB239: 0 | AC239: 0 | AD239: 0 | AE239: 0 | AF239: 101 | AG239: 1 | AH239: 1 | AI239: 1 | AJ239: 14 | AK239: 100 | AL239: 0 | AM239: 3 | AN239: 0 | AO239: -1 | AP239: -1 | AQ239: -1 | AR239: -1 | AS239: -1 | AT239: -1 | AU239: -1 | AV239: -1 | AW239: -1 | AX239: 3300 | AZ239: -1 | BB239: -1 | BD239: -1 | BE239: 0 | BF239: 10056 | BG239: 1 | BH239: -1 | BI239: -1 | BJ239: -1 | BK239: -1 | BL239: -1 | BM239: Uncommon Wood Long Bow | BP239: =COUNTIF(knownSpells_monsters!C[-67],RC[-1]) -> 0
A240: 0 | B240: MercenaryOrc90 | C240: 46 | D240: 44 | E240: 15 | F240: 20 | G240: 240 | H240: 80 | I240: 0 | J240: 0 | K240: 20 | L240: 24 | M240: 7 | N240: 25 | O240: 50 | P240: -1 | Q240: 280 | R240: 220 | S240: 6 | T240: 21 | U240: 7 | V240: 0 | W240: 50 | X240: 83 | Y240: 50 | Z240: 50 | AA240: 0 | AB240: 0 | AC240: 0 | AD240: 0 | AE240: 0 | AF240: 101 | AG240: 1 | AH240: 1 | AI240: 1 | AJ240: 14 | AK240: 100 | AL240: 0 | AM240: 3 | AN240: 0 | AO240: -1 | AP240: -1 | AQ240: -1 | AR240: -1 | AS240: -1 | AT240: -1 | AU240: -1 | AV240: -1 | AW240: -1 | AX240: 3600 | AZ240: -1 | BB240: -1 | BD240: -1 | BE240: 0 | BF240: 10057 | BG240: 1 | BH240: -1 | BI240: -1 | BJ240: -1 | BK240: -1 | BL240: -1 | BM240: Uncommon Magic Wood Short Bow | BP240: =COUNTIF(knownSpells_monsters!C[-67],RC[-1]) -> 0
A241: 0 | B241: MercenaryOrc100 | C241: 46 | D241: 44 | E241: 15 | F241: 20 | G241: 260 | H241: 80 | I241: 0 | J241: 0 | K241: 20 | L241: 24 | M241: 7 | N241: 25 | O241: 50 | P241: -1 | Q241: 300 | R241: 240 | S241: 6 | T241: 21 | U241: 7 | V241: 0 | W241: 50 | X241: 83 | Y241: 50 | Z241: 50 | AA241: 0 | AB241: 0 | AC241: 0 | AD241: 0 | AE241: 0 | AF241: 101 | AG241: 1 | AH241: 1 | AI241: 1 | AJ241: 14 | AK241: 100 | AL241: 0 | AM241: 3 | AN241: 0 | AO241: -1 | AP241: -1 | AQ241: -1 | AR241: -1 | AS241: -1 | AT241: -1 | AU241: -1 | AV241: -1 | AW241: -1 | AX241: 3900 | AZ241: -1 | BB241: -1 | BD241: -1 | BE241: 0 | BF241: 10058 | BG241: 1 | BH241: -1 | BI241: -1 | BJ241: -1 | BK241: -1 | BL241: -1 | BM241: Uncommon Magic Wood Long Bow | BP241: =COUNTIF(knownSpells_monsters!C[-67],RC[-1]) -> 0
A242: 0 | B242: MercenaryOrc110 | C242: 46 | D242: 44 | E242: 15 | F242: 20 | G242: 280 | H242: 80 | I242: 0 | J242: 0 | K242: 20 | L242: 24 | M242: 7 | N242: 25 | O242: 50 | P242: -1 | Q242: 320 | R242: 260 | S242: 6 | T242: 21 | U242: 7 | V242: 0 | W242: 50 | X242: 83 | Y242: 50 | Z242: 50 | AA242: 0 | AB242: 0 | AC242: 0 | AD242: 0 | AE242: 0 | AF242: 101 | AG242: 1 | AH242: 1 | AI242: 1 | AJ242: 14 | AK242: 100 | AL242: 0 | AM242: 3 | AN242: 0 | AO242: -1 | AP242: -1 | AQ242: -1 | AR242: -1 | AS242: -1 | AT242: -1 | AU242: -1 | AV242: -1 | AW242: -1 | AX242: 4200 | AZ242: -1 | BB242: -1 | BD242: -1 | BE242: 0 | BF242: 10059 | BG242: 1 | BH242: -1 | BI242: -1 | BJ242: -1 | BK242: -1 | BL242: -1 | BM242: Uncommon Magic Wood Long Bow | BP242: =COUNTIF(knownSpells_monsters!C[-67],RC[-1]) -> 0
A243: 0 | B243: Demon | C243: 55 | D243: 25 | E243: 66 | F243: 60 | G243: 400 | H243: 100 | I243: 400 | J243: 100 | K243: 12 | L243: 8 | M243: 6 | N243: 25 | O243: 45 | P243: -1 | Q243: 110 | R243: 90 | S243: 9 | T243: 12 | U243: 6 | V243: 10 | W243: 10 | X243: 10 | Y243: 50 | Z243: 10 | AA243: 0 | AB243: 0 | AC243: 0 | AD243: 0 | AE243: 0 | AF243: 108 | AG243: 1 | AH243: 2 | AI243: 1 | AJ243: 12 | AK243: 0 | AL243: 0 | AM243: 1 | AN243: 2400 | AO243: 95 | AP243: 2000 | AQ243: 2500 | AR243: -1 | AS243: -1 | AT243: -1 | AU243: 629669887 | AV243: 500 | AW243: 2000 | AX243: 1350 | AY243: Fire Ball | AZ243: 30 | BB243: -1 | BD243: -1 | BE243: 25 | BF243: 2374 | BG243: 1 | BH243: -1 | BI243: -1 | BJ243: -1 | BK243: -1 | BL243: -1 | BP243: =COUNTIF(knownSpells_monsters!C[-67],RC[-1]) -> 0
A244: 0 | B244: Demon.2 | C244: 65 | D244: 27 | E244: 77 | F244: 70 | G244: 750 | H244: 100 | I244: 750 | J244: 100 | K244: 14 | L244: 12 | M244: 7 | N244: 40 | O244: 66 | P244: -1 | Q244: 180 | R244: 150 | S244: 15 | T244: 12 | U244: 6 | V244: 20 | W244: 20 | X244: 20 | Y244: 65 | Z244: 20 | AA244: 0 | AB244: 0 | AC244: 0 | AD244: 0 | AE244: 0 | AF244: 108 | AG244: 2 | AH244: 2 | AI244: 1 | AJ244: 12 | AK244: 0 | AL244: 0 | AM244: 1 | AN244: 15750 | AO244: 95 | AP244: 15000 | AQ244: 20000 | AR244: -1 | AS244: -1 | AT244: -1 | AU244: 629669887 | AV244: 500 | AW244: 2000 | AX244: 1350 | AY244: Fire Ball | AZ244: 20 | BA244: Poison Cloud | BB244: 10 | BD244: -1 | BE244: 40 | BF244: 2375 | BG244: 1 | BH244: -1 | BI244: -1 | BJ244: -1 | BK244: -1 | BL244: -1 | BP244: =COUNTIF(knownSpells_monsters!C[-67],RC[-1]) -> 0
A245: 0 | B245: Demon.3 | C245: 75 | D245: 32 | E245: 88 | F245: 80 | G245: 1300 | H245: 100 | I245: 1300 | J245: 100 | K245: 16 | L245: 16 | M245: 7 | N245: 62 | O245: 105 | P245: -1 | Q245: 280 | R245: 240 | S245: 22 | T245: 12 | U245: 6 | V245: 30 | W245: 30 | X245: 30 | Y245: 80 | Z245: 30 | AA245: 0 | AB245: 0 | AC245: 0 | AD245: 0 | AE245: 0 | AF245: 108 | AG245: 3 | AH245: 2 | AI245: 1 | AJ245: 12 | AK245: 0 | AL245: 0 | AM245: 1 | AN245: 55000 | AO245: 95 | AP245: 80000 | AQ245: 120000 | AR245: -1 | AS245: -1 | AT245: -1 | AU245: 629669887 | AV245: 500 | AW245: 2000 | AX245: 1350 | AY245: Fire Ball | AZ245: 20 | BA245: Poison Cloud | BB245: 10 | BD245: -1 | BE245: 65 | BF245: 2376 | BG245: 1 | BH245: -1 | BI245: -1 | BJ245: -1 | BK245: -1 | BL245: -1 | BP245: =COUNTIF(knownSpells_monsters!C[-67],RC[-1]) -> 0
A246: 0 | B246: Demon.4 | C246: 80 | D246: 36 | E246: 99 | F246: 90 | G246: 2000 | H246: 100 | I246: 2000 | J246: 100 | K246: 18 | L246: 18 | M246: 8 | N246: 82 | O246: 164 | P246: -1 | Q246: 370 | R246: 310 | S246: 39 | T246: 12 | U246: 6 | V246: 50 | W246: 50 | X246: 50 | Y246: 100 | Z246: 50 | AA246: 0 | AB246: 0 | AC246: 0 | AD246: 0 | AE246: 0 | AF246: 108 | AG246: 4 | AH246: 2 | AI246: 1 | AJ246: 12 | AK246: 0 | AL246: 0 | AM246: 1 | AN246: 300000 | AO246: 95 | AP246: 400000 | AQ246: 8000000 | AR246: -1 | AS246: -1 | AT246: -1 | AU246: 629669887 | AV246: 500 | AW246: 2000 | AX246: 1350 | AY246: Fire Ball | AZ246: 20 | BA246: Poison Cloud | BB246: 10 | BC246: Stone Curse | BD246: 20 | BE246: 100 | BF246: 2377 | BG246: 1 | BH246: -1 | BI246: -1 | BJ246: -1 | BK246: -1 | BL246: -1 | BP246: =COUNTIF(knownSpells_monsters!C[-67],RC[-1]) -> 0
A247: 0 | B247: Demon.5 | C247: 99 | D247: 56 | E247: 150 | F247: 130 | G247: 20000 | H247: 50 | I247: 20000 | J247: 50 | K247: 20 | L247: 18 | M247: 9 | N247: 492 | O247: 1148 | P247: -1 | Q247: 470 | R247: 390 | S247: 43 | T247: 12 | U247: 6 | V247: 66 | W247: 66 | X247: 66 | Y247: 100 | Z247: 66 | AA247: 0 | AB247: 0 | AC247: 0 | AD247: 0 | AE247: 0 | AF247: 108 | AG247: 5 | AH247: 2 | AI247: 1 | AJ247: 12 | AK247: 0 | AL247: 0 | AM247: 1 | AN247: 490000 | AO247: 95 | AP247: 1000000 | AQ247: 2000000 | AR247: -1 | AS247: -1 | AT247: -1 | AU247: 629669887 | AV247: 500 | AW247: 2000 | AX247: 1350 | AY247: Fire Ball | AZ247: 20 | BA247: Poison Cloud | BB247: 10 | BC247: Stone Curse | BD247: 20 | BE247: 255 | BF247: 2378 | BG247: 1 | BH247: -1 | BI247: -1 | BJ247: -1 | BK247: -1 | BL247: -1 | BP247: =COUNTIF(knownSpells_monsters!C[-67],RC[-1]) -> 0
A248: 0 | B248: Human | C248: 30 | D248: 30 | E248: 30 | F248: 25 | G248: 50 | H248: 100 | I248: 0 | J248: 50 | K248: 16 | L248: 12 | M248: 5 | N248: 1 | O248: 2 | P248: -1 | Q248: 0 | R248: 0 | S248: 0 | T248: 8 | U248: 4 | V248: 0 | W248: 0 | X248: 0 | Y248: 0 | Z248: 0 | AA248: 0 | AB248: 0 | AC248: 0 | AD248: 0 | AE248: 0 | AF248: -1 | AG248: 1 | AH248: 1 | AI248: 1 | AJ248: 8 | AK248: -1 | AL248: -1 | AM248: 1 | AN248: 0 | AO248: -1 | AP248: -1 | AQ248: -1 | AR248: -1 | AS248: -1 | AT248: -1 | AU248: -1 | AV248: -1 | AW248: -1 | AX248: -1 | AZ248: -1 | BB248: -1 | BD248: -1 | BE248: 0 | BF248: -1 | BG248: 1 | BH248: -1 | BI248: -1 | BJ248: -1 | BK248: -1 | BL248: -1 | BP248: =COUNTIF(knownSpells_monsters!C[-67],RC[-1]) -> 0

Sheet: knownSpells_monsters
A1: PARENTID | B1: [VALUE]
A2: ParentID | B2: [value]
A3: [126] | B3: Fire Ball
A4: [126] | B4: Heal
A5: [126] | B5: Ice Missile
A6: [127] | B6: Fire Ball
A7: [127] | B7: Heal
A8: [127] | B8: Lightning
A9: [128] | B9: Darkness
A10: [128] | B10: Haste
A11: [128] | B11: Heal
A12: [128] | B12: Poison Cloud
A13: [128] | B13: Prismatic Spray
A14: [128] | B14: Wall of Fire
A15: [129] | B15: Darkness
A16: [129] | B16: Haste
A17: [129] | B17: Heal
A18: [129] | B18: Invisibility
A19: [129] | B19: Poison Cloud
A20: [129] | B20: Prismatic Spray
A21: [129] | B21: Stone Curse
A22: [129] | B22: Wall of Fire
A23: [130] | B23: Darkness
A24: [130] | B24: Haste
A25: [130] | B25: Heal
A26: [130] | B26: Invisibility
A27: [130] | B27: Poison Cloud
A28: [130] | B28: Prismatic Spray
A29: [130] | B29: Stone Curse
A30: [130] | B30: Wall of Fire
A31: [133] | B31: Diamond Dust
A32: [133] | B32: Fire Arrow
A33: [133] | B33: Heal
A34: [133] | B34: Shield
A35: [134] | B35: Diamond Dust
A36: [134] | B36: Fire Ball
A37: [134] | B37: Haste
A38: [134] | B38: Heal
A39: [134] | B39: Shield
A40: [135] | B40: Bless
A41: [135] | B41: Diamond Dust
A42: [135] | B42: Haste
A43: [135] | B43: Heal
A44: [135] | B44: Shield
A45: [135] | B45: Wall of Fire
A46: [136] | B46: Bless
A47: [136] | B47: Haste
A48: [136] | B48: Heal
A49: [136] | B49: Shield
A50: [136] | B50: Stone Curse
A51: [136] | B51: Wall of Fire
A52: [137] | B52: Bless
A53: [137] | B53: Haste
A54: [137] | B54: Heal
A55: [137] | B55: Shield
A56: [137] | B56: Stone Curse
A57: [137] | B57: Wall of Fire
A58: [157] | B58: Darkness
A59: [157] | B59: Drain Life
A60: [157] | B60: Heal
A61: [157] | B61: Prismatic Spray
A62: [157] | B62: Shield
A63: [158] | B63: Bless
A64: [158] | B64: Darkness
A65: [158] | B65: Drain Life
A66: [158] | B66: Heal
A67: [158] | B67: Invisibility
A68: [158] | B68: Prismatic Spray
A69: [158] | B69: Shield
A70: [159] | B70: Bless
A71: [159] | B71: Darkness
A72: [159] | B72: Drain Life
A73: [159] | B73: Heal
A74: [159] | B74: Invisibility
A75: [159] | B75: Prismatic Spray
A76: [159] | B76: Shield
A77: [160] | B77: Curse
A78: [160] | B78: Drain Life
A79: [160] | B79: Shield
A80: [160] | B80: Slow
A81: [161] | B81: Heal
A82: [161] | B82: Shield
A83: [165] | B83: Drain Life
A84: [166] | B84: Heal
A85: [166] | B85: Shield
A86: [167] | B86: Heal
A87: [167] | B87: Shield
A88: [168] | B88: Heal
A89: [168] | B89: Ice Missile
A90: [168] | B90: Shield
A91: [169] | B91: Diamond Dust
A92: [169] | B92: Heal
A93: [169] | B93: Shield
A94: [170] | B94: Diamond Dust
A95: [170] | B95: Heal
A96: [170] | B96: Ice Missile
A97: [170] | B97: Shield
A98: [171] | B98: Heal
A99: [171] | B99: Ice Missile
A100: [171] | B100: Shield
A101: [172] | B101: Diamond Dust
A102: [172] | B102: Heal
A103: [172] | B103: Shield
A104: [172] | B104: Stone Curse
A105: [173] | B105: Heal
A106: [173] | B106: Shield
A107: [173] | B107: Stone Curse
A108: [174] | B108: Blizzard
A109: [174] | B109: Heal
A110: [174] | B110: Shield
A111: [175] | B111: Diamond Dust
A112: [175] | B112: Heal
A113: [175] | B113: Shield
A114: [175] | B114: Stone Curse
A115: [176] | B115: Blizzard
A116: [176] | B116: Heal
A117: [176] | B117: Shield
A118: [176] | B118: Stone Curse
A119: [177] | B119: Blizzard
A120: [177] | B120: Heal
A121: [177] | B121: Shield
A122: [178] | B122: Diamond Dust
A123: [178] | B123: Heal
A124: [178] | B124: Shield
A125: [178] | B125: Stone Curse
A126: [179] | B126: Blizzard
A127: [179] | B127: Heal
A128: [179] | B128: Shield
A129: [179] | B129: Stone Curse
A130: [180] | B130: Drain Life
A131: [180] | B131: Fire Arrow
A132: [180] | B132: Shield
A133: [181] | B133: Drain Life
A134: [181] | B134: Lightning
A135: [181] | B135: Shield
A136: [182] | B136: Drain Life
A137: [182] | B137: Fire Arrow
A138: [182] | B138: Lightning
A139: [182] | B139: Shield
A140: [183] | B140: Drain Life
A141: [183] | B141: Fire Ball
A142: [183] | B142: Haste
A143: [183] | B143: Shield
A144: [184] | B144: Darkness
A145: [184] | B145: Drain Life
A146: [184] | B146: Haste
A147: [184] | B147: Shield
A148: [185] | B148: Darkness
A149: [185] | B149: Drain Life
A150: [185] | B150: Fire Ball
A151: [185] | B151: Haste
A152: [185] | B152: Shield
A153: [186] | B153: Bless
A154: [186] | B154: Drain Life
A155: [186] | B155: Haste
A156: [186] | B156: Shield
A157: [186] | B157: Wall of Fire
A158: [187] | B158: Bless
A159: [187] | B159: Drain Life
A160: [187] | B160: Haste
A161: [187] | B161: Prismatic Spray
A162: [187] | B162: Shield
A163: [188] | B163: Bless
A164: [188] | B164: Drain Life
A165: [188] | B165: Haste
A166: [188] | B166: Prismatic Spray
A167: [188] | B167: Shield
A168: [188] | B168: Wall of Fire
A169: [189] | B169: Bless
A170: [189] | B170: Drain Life
A171: [189] | B171: Haste
A172: [189] | B172: Invisibility
A173: [189] | B173: Prismatic Spray
A174: [189] | B174: Shield
A175: [189] | B175: Wall of Fire
A176: [190] | B176: Bless
A177: [190] | B177: Drain Life
A178: [190] | B178: Haste
A179: [190] | B179: Invisibility
A180: [190] | B180: Prismatic Spray
A181: [190] | B181: Shield
A182: [190] | B182: Wall of Fire
A183: [191] | B183: Bless
A184: [191] | B184: Darkness
A185: [191] | B185: Drain Life
A186: [191] | B186: Haste
A187: [191] | B187: Invisibility
A188: [191] | B188: Prismatic Spray
A189: [191] | B189: Shield
A190: [191] | B190: Wall of Fire
A191: [192] | B191: Bless
A192: [192] | B192: Drain Life
A193: [192] | B193: Haste
A194: [192] | B194: Invisibility
A195: [192] | B195: Prismatic Spray
A196: [192] | B196: Shield
A197: [192] | B197: Wall of Fire
A198: [193] | B198: Bless
A199: [193] | B199: Drain Life
A200: [193] | B200: Haste
A201: [193] | B201: Invisibility
A202: [193] | B202: Prismatic Spray
A203: [193] | B203: Shield
A204: [193] | B204: Wall of Fire
A205: [194] | B205: Bless
A206: [194] | B206: Darkness
A207: [194] | B207: Drain Life
A208: [194] | B208: Haste
A209: [194] | B209: Invisibility
A210: [194] | B210: Prismatic Spray
A211: [194] | B211: Shield
A212: [194] | B212: Wall of Fire
A213: [195] | B213: Drain Life
A214: [195] | B214: Shield
A215: [195] | B215: Wall of Fire
A216: [196] | B216: Drain Life
A217: [196] | B217: Prismatic Spray
A218: [196] | B218: Shield
A219: [197] | B219: Diamond Dust
A220: [197] | B220: Drain Life
A221: [197] | B221: Shield
A222: [197] | B222: Stone Curse
A223: [198] | B223: Drain Life
A224: [198] | B224: Poison Cloud
A225: [198] | B225: Shield
A226: [199] | B226: Curse
A227: [199] | B227: Drain Life
A228: [199] | B228: Shield
A229: [199] | B229: Slow
A230: [200] | B230: Bless
A231: [200] | B231: Drain Life
A232: [200] | B232: Haste
A233: [200] | B233: Invisibility
A234: [200] | B234: Prismatic Spray
A235: [200] | B235: Shield
A236: [200] | B236: Wall of Fire
A237: [201] | B237: Bless
A238: [201] | B238: Drain Life
A239: [201] | B239: Haste
A240: [201] | B240: Invisibility
A241: [201] | B241: Shield
A242: [201] | B242: Wall of Fire
A243: [212] | B243: Fire Arrow
A244: [212] | B244: Fire Ball
A245: [212] | B245: Heal
A246: [212] | B246: Shield
A247: [213] | B247: Heal
A248: [213] | B248: Ice Missile
A249: [213] | B249: Poison Cloud
A250: [213] | B250: Shield
A251: [214] | B251: Darkness
A252: [214] | B252: Heal
A253: [214] | B253: Prismatic Spray
A254: [214] | B254: Shield
A255: [215] | B255: Darkness
A256: [215] | B256: Heal
A257: [215] | B257: Invisibility
A258: [215] | B258: Poison Cloud
A259: [215] | B259: Prismatic Spray
A260: [215] | B260: Shield
A261: [215] | B261: Stone Curse
A262: [215] | B262: Wall of Fire
A263: [216] | B263: Darkness
A264: [216] | B264: Heal
A265: [216] | B265: Invisibility
A266: [216] | B266: Poison Cloud
A267: [216] | B267: Prismatic Spray
A268: [216] | B268: Shield
A269: [216] | B269: Stone Curse
A270: [216] | B270: Wall of Fire
A271: [223] | B271: Bless
A272: [223] | B272: Diamond Dust
A273: [223] | B273: Haste
A274: [223] | B274: Heal
A275: [223] | B275: Poison Cloud
A276: [223] | B276: Protection from Air
A277: [223] | B277: Protection from Earth
A278: [223] | B278: Protection from Water
A279: [223] | B279: Shield
A280: [224] | B280: Bless
A281: [224] | B281: Diamond Dust
A282: [224] | B282: Haste
A283: [224] | B283: Heal
A284: [224] | B284: Poison Cloud
A285: [224] | B285: Protection from Air
A286: [224] | B286: Protection from Earth
A287: [224] | B287: Protection from Water
A288: [224] | B288: Shield
A289: [225] | B289: Bless
A290: [225] | B290: Diamond Dust
A291: [225] | B291: Haste
A292: [225] | B292: Heal
A293: [225] | B293: Poison Cloud
A294: [225] | B294: Protection from Air
A295: [225] | B295: Protection from Earth
A296: [225] | B296: Protection from Fire
A297: [225] | B297: Protection from Water
A298: [225] | B298: Shield
A299: [225] | B299: Wall of Earth
A300: [226] | B300: Bless
A301: [226] | B301: Diamond Dust
A302: [226] | B302: Haste
A303: [226] | B303: Heal
A304: [226] | B304: Poison Cloud
A305: [226] | B305: Protection from Air
A306: [226] | B306: Protection from Earth
A307: [226] | B307: Protection from Fire
A308: [226] | B308: Protection from Water
A309: [226] | B309: Shield
A310: [226] | B310: Summon
A311: [226] | B311: Wall of Earth
A312: [227] | B312: Bless
A313: [227] | B313: Diamond Dust
A314: [227] | B314: Haste
A315: [227] | B315: Heal
A316: [227] | B316: Invisibility
A317: [227] | B317: Poison Cloud
A318: [227] | B318: Protection from Air
A319: [227] | B319: Protection from Earth
A320: [227] | B320: Protection from Fire
A321: [227] | B321: Protection from Water
A322: [227] | B322: Shield
A323: [227] | B323: Stone Curse
A324: [227] | B324: Summon
A325: [227] | B325: Wall of Earth
A326: [228] | B326: Bless
A327: [228] | B327: Blizzard
A328: [228] | B328: Diamond Dust
A329: [228] | B329: Haste
A330: [228] | B330: Heal
A331: [228] | B331: Invisibility
A332: [228] | B332: Poison Cloud
A333: [228] | B333: Protection from Air
A334: [228] | B334: Protection from Earth
A335: [228] | B335: Protection from Fire
A336: [228] | B336: Protection from Water
A337: [228] | B337: Shield
A338: [228] | B338: Stone Curse
A339: [228] | B339: Summon
A340: [228] | B340: Wall of Earth
A341: [229] | B341: Bless
A342: [229] | B342: Blizzard
A343: [229] | B343: Diamond Dust
A344: [229] | B344: Haste
A345: [229] | B345: Heal
A346: [229] | B346: Invisibility
A347: [229] | B347: Poison Cloud
A348: [229] | B348: Protection from Air
A349: [229] | B349: Protection from Earth
A350: [229] | B350: Protection from Fire
A351: [229] | B351: Protection from Water
A352: [229] | B352: Shield
A353: [229] | B353: Stone Curse
A354: [229] | B354: Summon
A355: [229] | B355: Wall of Earth

Sheet: humans
A1: EMPTY | B1: NAME | C1: BODY | D1: REACTION | E1: MIND | F1: SPIRIT | G1: HEALTHMAX | H1: MANAMAX | I1: SPEED | J1: ROTATIONSPEED | K1: SCANRANGE | L1: DEFENCE | M1: SKILL0 | N1: SKILLBLADEFIRE | O1: SKILLAXEWATER | P1: SKILLBLUDGEONAIR | Q1: SKILLPIKEEARTH | R1: SKILLSHOOTINGASTRAL | S1: TYPEID | T1: FACE | U1: GENDER | V1: CHARGE | W1: RELAX | X1: TOKENSIZE | Y1: MOVEMENTTYPE | Z1: DYINGTIME | AA1: SERVERID | AB1: KNOWNSPELLSAREEMPTY | AC1: EQUIPITEM1 | AD1: EQUIPITEM2 | AE1: EQUIPITEM3 | AF1: EQUIPITEM4 | AG1: EQUIPITEM5 | AH1: EQUIPITEM6 | AI1: EQUIPITEM7 | AJ1: EQUIPITEM8 | AK1: EQUIPITEM9 | AL1: EQUIPITEM10 | AM1: KNOWNSPELLS
A2: empty | B2: name | C2: body | D2: reaction | E2: mind | F2: spirit | G2: healthMax | H2: manaMax | I2: speed | J2: rotationSpeed | K2: scanRange | L2: defence | M2: skill0 | N2: skillBladeFire | O2: skillAxeWater | P2: skillBludgeonAir | Q2: skillPikeEarth | R2: skillShootingAstral | S2: typeId | T2: face | U2: gender | V2: charge | W2: relax | X2: tokenSize | Y2: movementType | Z2: dyingTime | AA2: serverId | AB2: knownSpellsAreEmpty | AC2: equipItem1 | AD2: equipItem2 | AE2: equipItem3 | AF2: equipItem4 | AG2: equipItem5 | AH2: equipItem6 | AI2: equipItem7 | AJ2: equipItem8 | AK2: equipItem9 | AL2: equipItem10 | AM2: knownSpells | AN2: задано
A3: 0 | B3: Man_Unarmed | C3: 25 | D3: 30 | E3: 25 | F3: 25 | G3: 20 | H3: -1 | I3: 18 | J3: 18 | K3: 6 | L3: 6 | M3: 0 | N3: 10 | O3: 5 | P3: 10 | Q3: 0 | R3: 5 | S3: 1 | T3: 1 | U3: -1 | V3: 8 | W3: 4 | X3: 1 | Y3: -1 | Z3: -1 | AA3: 1 | AB3: 1 | AN3: =COUNTIF(knownSpells_humans!C[-39],RC[-1]) -> 0
A4: 1 | AN4: =COUNTIF(knownSpells_humans!C[-39],RC[-1]) -> 0
A5: 0 | B5: Man_Sword | C5: 20 | D5: 35 | E5: 25 | F5: 25 | G5: 50 | H5: -1 | I5: 19 | J5: 19 | K5: 6 | L5: 7 | M5: 0 | N5: 20 | O5: -1 | P5: -1 | Q5: -1 | R5: -1 | S5: 3 | T5: 1 | U5: -1 | V5: 7 | W5: 4 | X5: -1 | Y5: -1 | Z5: -1 | AA5: 3 | AB5: 1 | AC5: Iron Short Sword | AE5: Uncommon Steel Chain Helm | AF5: Uncommon Hard Leather Mail | AG5: Leather Bracers | AH5: Leather Gauntlets | AI5: Uncommon Hard Leather Boots | AN5: =COUNTIF(knownSpells_humans!C[-39],RC[-1]) -> 0
A6: 0 | B6: Man_SwordShield | C6: 20 | D6: 35 | E6: 25 | F6: 25 | G6: 50 | H6: -1 | I6: 19 | J6: 19 | K6: 6 | L6: 7 | M6: 0 | N6: 20 | O6: -1 | P6: -1 | Q6: -1 | R6: -1 | S6: 4 | T6: 1 | U6: -1 | V6: 7 | W6: 4 | X6: -1 | Y6: -1 | Z6: -1 | AA6: 4 | AB6: 1 | AC6: Iron Long Sword | AD6: Wood Large Shield | AE6: Iron Helm | AF6: Uncommon Steel Chain Mail | AG6: Uncommon Steel Chain Gauntlets | AH6: Uncommon Hard Leather Boots | AN6: =COUNTIF(knownSpells_humans!C[-39],RC[-1]) -> 0
A7: 0 | B7: Man_Sword2Handed | C7: 42 | D7: 36 | E7: 31 | F7: 31 | G7: 50 | H7: -1 | I7: 19 | J7: 19 | K7: 7 | L7: 7 | M7: 0 | N7: 25 | O7: -1 | P7: -1 | Q7: -1 | R7: -1 | S7: 5 | T7: 1 | U7: -1 | V7: 10 | W7: 4 | X7: -1 | Y7: -1 | Z7: -1 | AA7: 5 | AB7: 1 | AC7: Iron Two Handed Sword | AE7: Iron Plate Helm | AF7: Uncommon Steel Chain Mail | AG7: Iron Plate Cuirass | AH7: Iron Plate Bracers | AI7: Iron Plate Boots | AN7: =COUNTIF(knownSpells_humans!C[-39],RC[-1]) -> 0
A8: 1 | AN8: =COUNTIF(knownSpells_humans!C[-39],RC[-1]) -> 0
A9: 0 | B9: Man_Axe | C9: 20 | D9: 35 | E9: 25 | F9: 25 | G9: 50 | H9: -1 | I9: 19 | J9: 19 | K9: 6 | L9: 7 | M9: 0 | N9: -1 | O9: 15 | P9: -1 | Q9: -1 | R9: -1 | S9: 7 | T9: 1 | U9: -1 | V9: 8 | W9: 4 | X9: -1 | Y9: -1 | Z9: -1 | AA9: 7 | AB9: 1 | AC9: Iron Axe | AE9: Iron Helm | AF9: Uncommon Steel Chain Mail | AG9: Uncommon Hard Leather Boots | AN9: =COUNTIF(knownSpells_humans!C[-39],RC[-1]) -> 0
A10: 0 | B10: Man_AxeShield | C10: 33 | D10: 35 | E10: 25 | F10: 25 | G10: 50 | H10: -1 | I10: 19 | J10: 19 | K10: 6 | L10: 7 | M10: 0 | N10: -1 | O10: 15 | P10: -1 | Q10: -1 | R10: -1 | S10: 8 | T10: 1 | U10: -1 | V10: 8 | W10: 4 | X10: -1 | Y10: -1 | Z10: -1 | AA10: 8 | AB10: 1 | AC10: Iron Axe | AD10: Wood Large Shield | AE10: Iron Helm | AF10: Uncommon Steel Chain Mail | AG10: Leather Gauntlets | AH10: Uncommon Hard Leather Boots | AN10: =COUNTIF(knownSpells_humans!C[-39],RC[-1]) -> 0
A11: 0 | B11: Man_Axe2Handed | C11: 42 | D11: 36 | E11: 31 | F11: 31 | G11: 30 | H11: -1 | I11: 19 | J11: 19 | K11: 7 | L11: 7 | M11: 0 | N11: -1 | O11: 20 | P11: -1 | Q11: -1 | R11: -1 | S11: 9 | T11: 1 | U11: -1 | V11: 10 | W11: 4 | X11: -1 | Y11: -1 | Z11: -1 | AA11: 9 | AB11: 1 | AC11: Iron Two Handed Axe | AE11: Iron Helm | AF11: Uncommon Steel Chain Mail | AG11: Leather Gauntlets | AH11: Uncommon Hard Leather Boots | AN11: =COUNTIF(knownSpells_humans!C[-39],RC[-1]) -> 0
A12: 0 | B12: Man_Club | C12: 19 | D12: 25 | E12: 25 | F12: 25 | G12: 20 | H12: -1 | I12: 17 | J12: 17 | K12: 6 | L12: 5 | M12: 0 | N12: -1 | O12: -1 | P12: 10 | Q12: -1 | R12: -1 | S12: 10 | T12: 1 | U12: -1 | V12: 7 | W12: 4 | X12: -1 | Y12: -1 | Z12: -1 | AA12: 10 | AB12: 1 | AC12: Iron Mace | AE12: Leather Helm | AF12: Uncommon Hard Leather Mail | AG12: Leather Boots | AN12: =COUNTIF(knownSpells_humans!C[-39],RC[-1]) -> 0
A13: 0 | B13: Man_ClubShield | C13: 25 | D13: 24 | E13: 25 | F13: 25 | G13: 50 | H13: -1 | I13: 17 | J13: 17 | K13: 6 | L13: 5 | M13: 0 | N13: -1 | O13: -1 | P13: 15 | Q13: -1 | R13: -1 | S13: 11 | T13: 1 | U13: -1 | V13: 7 | W13: 4 | X13: -1 | Y13: -1 | Z13: -1 | AA13: 11 | AB13: 1 | AC13: Uncommon Steel Morning Star | AD13: Leather Large Shield | AE13: Uncommon Steel Helm | AF13: Uncommon Hard Leather Mail | AG13: Leather Bracers | AH13: Leather Gauntlets | AI13: Uncommon Hard Leather Boots | AN13: =COUNTIF(knownSpells_humans!C[-39],RC[-1]) -> 0
A14: 0 | B14: Man_Pike | C14: 20 | D14: 35 | E14: 25 | F14: 25 | G14: 50 | H14: -1 | I14: 19 | J14: 19 | K14: 6 | L14: 7 | M14: 0 | N14: -1 | O14: -1 | P14: -1 | Q14: 15 | R14: -1 | S14: 12 | T14: 1 | U14: -1 | V14: 6 | W14: 4 | X14: -1 | Y14: -1 | Z14: -1 | AA14: 12 | AB14: 1 | AC14: Iron Pike | AE14: Iron Helm | AF14: Uncommon Steel Chain Mail | AG14: Uncommon Hard Leather Boots | AN14: =COUNTIF(knownSpells_humans!C[-39],RC[-1]) -> 0
A15: 0 | B15: Man_PikeShield | C15: 20 | D15: 35 | E15: 25 | F15: 25 | G15: 50 | H15: -1 | I15: 19 | J15: 19 | K15: 6 | L15: 7 | M15: 0 | N15: -1 | O15: -1 | P15: -1 | Q15: 15 | R15: -1 | S15: 13 | T15: 1 | U15: -1 | V15: 6 | W15: 4 | X15: -1 | Y15: -1 | Z15: -1 | AA15: 13 | AB15: 1 | AC15: Iron Pike | AD15: Wood Large Shield | AE15: Iron Helm | AF15: Uncommon Steel Chain Mail | AG15: Leather Gauntlets | AH15: Uncommon Hard Leather Boots | AN15: =COUNTIF(knownSpells_humans!C[-39],RC[-1]) -> 0
A16: 0 | B16: Man_Bow | C16: 10 | D16: 40 | E16: 25 | F16: 25 | G16: 20 | H16: -1 | I16: 20 | J16: 20 | K16: 7 | L16: 8 | M16: 0 | N16: -1 | O16: -1 | P16: -1 | Q16: -1 | R16: 25 | S16: 14 | T16: 1 | U16: -1 | V16: 20 | W16: 5 | X16: -1 | Y16: -1 | Z16: -1 | AA16: 14 | AB16: 1 | AC16: Elven Magic Wood Long Bow | AE16: Leather Helm | AF16: Uncommon Hard Leather Mail | AG16: Leather Bracers | AH16: Uncommon Hard Leather Boots | AN16: =COUNTIF(knownSpells_humans!C[-39],RC[-1]) -> 0
A17: 0 | B17: Man_Crossbow | C17: 14 | D17: 35 | E17: 25 | F17: 25 | G17: 30 | H17: -1 | I17: 19 | J17: 19 | K17: 6 | L17: 7 | M17: 0 | N17: -1 | O17: -1 | P17: -1 | Q17: -1 | R17: 20 | S17: 15 | T17: 1 | U17: -1 | V17: 8 | W17: 16 | X17: -1 | Y17: -1 | Z17: -1 | AA17: 15 | AB17: 1 | AC17: Wood Crossbow | AE17: Uncommon Hard Leather Mail | AF17: Leather Gauntlets | AG17: Leather Boots | AN17: =COUNTIF(knownSpells_humans!C[-39],RC[-1]) -> 0
A18: 1 | AN18: =COUNTIF(knownSpells_humans!C[-39],RC[-1]) -> 0
A19: 0 | B19: ManHorse_Unarmed | C19: 25 | D19: 25 | E19: 25 | F19: 25 | G19: 60 | H19: -1 | I19: 17 | J19: 17 | K19: 6 | L19: 5 | M19: 0 | N19: -1 | O19: -1 | P19: -1 | Q19: -1 | R19: -1 | S19: 17 | T19: 1 | U19: -1 | V19: -1 | W19: -1 | X19: 1 | Y19: -1 | Z19: -1 | AA19: 17 | AB19: 1 | AN19: =COUNTIF(knownSpells_humans!C[-39],RC[-1]) -> 0
A20: 0 | B20: ManHorse_Sword | C20: 34 | D20: 30 | E20: 24 | F20: 21 | G20: 60 | H20: -1 | I20: 18 | J20: 18 | K20: 6 | L20: 6 | M20: 0 | N20: 20 | O20: -1 | P20: -1 | Q20: -1 | R20: -1 | S20: 18 | T20: 1 | U20: -1 | V20: -1 | W20: -1 | X20: 1 | Y20: -1 | Z20: -1 | AA20: 18 | AB20: 1 | AC20: Iron Long Sword | AN20: =COUNTIF(knownSpells_humans!C[-39],RC[-1]) -> 0
A21: 0 | B21: ManHorse_SwordShield | C21: 25 | D21: 25 | E21: 25 | F21: 25 | G21: 60 | H21: -1 | I21: 17 | J21: 17 | K21: 6 | L21: 5 | M21: 0 | N21: 30 | O21: -1 | P21: -1 | Q21: -1 | R21: -1 | S21: 19 | T21: 1 | U21: -1 | V21: 10 | W21: 4 | X21: 1 | Y21: -1 | Z21: -1 | AA21: 19 | AB21: 1 | AC21: Rare Mithrill Bastard Sword | AD21: Uncommon Wood Large Shield | AE21: Uncommon Steel Chain Helm | AF21: Uncommon Steel Chain Mail | AG21: Uncommon Steel Chain Gauntlets | AH21: Uncommon Steel Chain Boots | AN21: =COUNTIF(knownSpells_humans!C[-39],RC[-1]) -> 0
A22: 0 | B22: ManHorse_Lance | C22: 37 | D22: 39 | E22: 22 | F22: 32 | G22: 60 | H22: -1 | I22: 20 | J22: 20 | K22: 6 | L22: 8 | M22: 0 | N22: -1 | O22: -1 | P22: -1 | Q22: 20 | R22: -1 | S22: 20 | T22: 1 | U22: -1 | V22: -1 | W22: -1 | X22: 1 | Y22: -1 | Z22: -1 | AA22: 20 | AB22: 1 | AC22: Iron Lance | AN22: =COUNTIF(knownSpells_humans!C[-39],RC[-1]) -> 0
A23: 0 | B23: ManHorse_LanceShield | C23: 25 | D23: 25 | E23: 25 | F23: 25 | G23: 60 | H23: -1 | I23: 17 | J23: 17 | K23: 6 | L23: 5 | M23: 0 | N23: -1 | O23: -1 | P23: -1 | Q23: 20 | R23: -1 | S23: 21 | T23: 1 | U23: -1 | V23: 10 | W23: 4 | X23: 1 | Y23: -1 | Z23: -1 | AA23: 21 | AB23: 1 | AC23: Iron Lance | AD23: Uncommon Wood Large Shield | AE23: Uncommon Steel Chain Helm | AF23: Uncommon Steel Chain Mail | AG23: Uncommon Steel Chain Gauntlets | AH23: Uncommon Steel Chain Boots | AN23: =COUNTIF(knownSpells_humans!C[-39],RC[-1]) -> 0
A24: 1 | AN24: =COUNTIF(knownSpells_humans!C[-39],RC[-1]) -> 0
A25: 0 | B25: ManMage_Unarmed | C25: 10 | D25: 25 | E25: 35 | F25: 35 | G25: -1 | H25: 50 | I25: 17 | J25: 17 | K25: 6 | L25: 5 | M25: 0 | N25: -1 | O25: -1 | P25: -1 | Q25: -1 | R25: -1 | S25: 23 | T25: 1 | U25: -1 | V25: 8 | W25: 4 | X25: -1 | Y25: -1 | Z25: 12 | AA25: 23 | AB25: 0 | AE25: Robe | AM25: [25] | AN25: =COUNTIF(knownSpells_humans!C[-39],RC[-1]) -> 2
A26: 0 | B26: ManMage_Staff | C26: 14 | D26: 27 | E26: 35 | F26: 35 | G26: 30 | H26: 70 | I26: 17 | J26: 17 | K26: 6 | L26: 5 | M26: 0 | N26: -1 | O26: -1 | P26: -1 | Q26: -1 | R26: -1 | S26: 24 | T26: 1 | U26: -1 | V26: 8 | W26: 4 | X26: -1 | Y26: -1 | Z26: 12 | AA26: 24 | AB26: 0 | AC26: Wood Staff {castSpell=Fire_Arrow:5} | AE26: Robe | AM26: [26] | AN26: =COUNTIF(knownSpells_humans!C[-39],RC[-1]) -> 2
A27: 1 | AN27: =COUNTIF(knownSpells_humans!C[-39],RC[-1]) -> 0
A28: 0 | B28: Start_MF | C28: 40 | D28: 36 | E28: 25 | F28: 17 | G28: 50 | H28: -1 | I28: 19 | J28: 19 | K28: 6 | L28: 7 | M28: 0 | N28: 20 | O28: -1 | P28: -1 | Q28: -1 | R28: -1 | S28: 3 | T28: 32 | U28: 0 | V28: -1 | W28: -1 | X28: -1 | Y28: -1 | Z28: -1 | AA28: 10210 | AB28: 1 | AN28: =COUNTIF(knownSpells_humans!C[-39],RC[-1]) -> 0
A29: 0 | B29: Start_FF | C29: 37 | D29: 39 | E29: 21 | F29: 25 | G29: 20 | H29: -1 | I29: 20 | J29: 20 | K29: 6 | L29: 8 | M29: 0 | N29: 20 | O29: -1 | P29: -1 | Q29: -1 | R29: -1 | S29: 14 | T29: 11 | U29: 1 | V29: 20 | W29: 5 | X29: -1 | Y29: -1 | Z29: -1 | AA29: 10211 | AB29: 1 | AN29: =COUNTIF(knownSpells_humans!C[-39],RC[-1]) -> 0
A30: 0 | B30: Start_MM | C30: 28 | D30: 20 | E30: 41 | F30: 32 | G30: 30 | H30: 70 | I30: 16 | J30: 16 | K30: 6 | L30: 4 | M30: 0 | N30: 20 | O30: -1 | P30: -1 | Q30: -1 | R30: -1 | S30: 24 | T30: 15 | U30: 0 | V30: -1 | W30: -1 | X30: -1 | Y30: -1 | Z30: 12 | AA30: 10212 | AB30: 0 | AC30: Wood Staff {castSpell=Fire_Arrow:1} | AM30: [30] | AN30: =COUNTIF(knownSpells_humans!C[-39],RC[-1]) -> 1
A31: 0 | B31: Start_FM | C31: 19 | D31: 23 | E31: 30 | F31: 42 | G31: 30 | H31: 70 | I31: 17 | J31: 17 | K31: 6 | L31: 5 | M31: 0 | N31: 20 | O31: -1 | P31: -1 | Q31: -1 | R31: -1 | S31: 24 | T31: 6 | U31: 1 | V31: -1 | W31: -1 | X31: -1 | Y31: -1 | Z31: 12 | AA31: 10213 | AB31: 0 | AC31: Wood Staff {castSpell=Fire_Arrow:1} | AM31: [31] | AN31: =COUNTIF(knownSpells_humans!C[-39],RC[-1]) -> 1
A32: 0 | B32: Fighter_Hero | C32: 41 | D32: 39 | E32: 25 | F32: 21 | G32: 50 | H32: -1 | I32: 20 | J32: 20 | K32: 7 | L32: 8 | M32: 0 | N32: 25 | O32: 0 | P32: 0 | Q32: 0 | R32: 10 | S32: 5 | T32: 49 | U32: 0 | V32: 10 | W32: 4 | X32: -1 | Y32: -1 | Z32: -1 | AA32: 10220 | AB32: 1 | AC32: Uncommon Steel Two Handed Sword | AE32: Uncommon Steel Chain Mail | AF32: Uncommon Steel Plate Cuirass | AG32: Uncommon Steel Plate Bracers | AH32: Uncommon Steel Plate Boots | AI32: Uncommon Steel Scale Gauntlets | AN32: =COUNTIF(knownSpells_humans!C[-39],RC[-1]) -> 0
A33: 0 | B33: Mage_Hero | C33: 14 | D33: 33 | E33: 35 | F33: 44 | G33: 30 | H33: 70 | I33: 19 | J33: 19 | K33: 7 | L33: 7 | M33: 0 | N33: 25 | O33: 0 | P33: 0 | Q33: 0 | R33: 10 | S33: 23 | T33: 20 | U33: 1 | V33: -1 | W33: -1 | X33: -1 | Y33: -1 | Z33: 12 | AA33: 10230 | AB33: 0 | AE33: Uncommon None Shoes | AF33: None Dress | AM33: [33] | AN33: =COUNTIF(knownSpells_humans!C[-39],RC[-1]) -> 6
A34: 0 | B34: NPC03_1 | C34: 14 | D34: 20 | E34: 39 | F34: 45 | G34: 30 | H34: 70 | I34: 16 | J34: 16 | K34: 6 | L34: 4 | M34: 0 | N34: -1 | O34: -1 | P34: -1 | Q34: -1 | R34: -1 | S34: 24 | T34: 2 | U34: 0 | V34: -1 | W34: -1 | X34: -1 | Y34: -1 | Z34: 12 | AA34: 103 | AB34: 1 | AN34: =COUNTIF(knownSpells_humans!C[-39],RC[-1]) -> 0
A35: 0 | B35: NPC04_1 | C35: 14 | D35: 26 | E35: 37 | F35: 42 | G35: 30 | H35: 70 | I35: 17 | J35: 17 | K35: 7 | L35: 5 | M35: 0 | N35: -1 | O35: -1 | P35: -1 | Q35: -1 | R35: -1 | S35: 24 | T35: 2 | U35: 1 | V35: -1 | W35: -1 | X35: -1 | Y35: -1 | Z35: 12 | AA35: 104 | AB35: 1 | AN35: =COUNTIF(knownSpells_humans!C[-39],RC[-1]) -> 0
A36: 0 | B36: NPC05_1 | C36: 14 | D36: 20 | E36: 39 | F36: 45 | G36: 30 | H36: 70 | I36: 16 | J36: 16 | K36: 6 | L36: 4 | M36: 0 | N36: -1 | O36: -1 | P36: -1 | Q36: -1 | R36: -1 | S36: 24 | T36: 1 | U36: 0 | V36: -1 | W36: -1 | X36: -1 | Y36: -1 | Z36: 12 | AA36: 105 | AB36: 1 | AN36: =COUNTIF(knownSpells_humans!C[-39],RC[-1]) -> 0
A37: 0 | B37: NPC06_1 | C37: 27 | D37: 43 | E37: 25 | F37: 27 | G37: 20 | H37: -1 | I37: 21 | J37: 21 | K37: 7 | L37: 9 | M37: 0 | N37: 5 | O37: 7 | P37: 1 | Q37: 2 | R37: 25 | S37: 14 | T37: 3 | U37: 1 | V37: 20 | W37: 5 | X37: -1 | Y37: -1 | Z37: -1 | AA37: 106 | AB37: 1 | AC37: Uncommon Wood Long Bow | AE37: Uncommon Hard Leather Helm | AF37: Uncommon Hard Leather Mail | AG37: Uncommon Hard Leather Bracers | AH37: Uncommon Hard Leather Boots | AN37: =COUNTIF(knownSpells_humans!C[-39],RC[-1]) -> 0
A38: 0 | B38: NPC07_1 | C38: 32 | D38: 40 | E38: 28 | F38: 22 | G38: 30 | H38: -1 | I38: 20 | J38: 20 | K38: 7 | L38: 8 | M38: 0 | N38: -1 | O38: -1 | P38: -1 | Q38: -1 | R38: -1 | S38: 15 | T38: 4 | U38: 1 | V38: -1 | W38: -1 | X38: -1 | Y38: -1 | Z38: -1 | AA38: 107 | AB38: 1 | AN38: =COUNTIF(knownSpells_humans!C[-39],RC[-1]) -> 0
A39: 0 | B39: NPC08_1 | C39: 43 | D39: 30 | E39: 27 | F39: 18 | G39: 60 | H39: -1 | I39: 18 | J39: 18 | K39: 6 | L39: 6 | M39: 0 | N39: -1 | O39: -1 | P39: -1 | Q39: -1 | R39: -1 | S39: 21 | T39: 2 | U39: 0 | V39: -1 | W39: -1 | X39: 1 | Y39: -1 | Z39: -1 | AA39: 108 | AB39: 1 | AN39: =COUNTIF(knownSpells_humans!C[-39],RC[-1]) -> 0
A40: 0 | B40: NPC09_1 | C40: 44 | D40: 36 | E40: 22 | F40: 30 | G40: 60 | H40: -1 | I40: 19 | J40: 19 | K40: 6 | L40: 7 | M40: 0 | N40: -1 | O40: -1 | P40: -1 | Q40: -1 | R40: -1 | S40: 19 | T40: 10 | U40: 0 | V40: -1 | W40: -1 | X40: 1 | Y40: -1 | Z40: -1 | AA40: 109 | AB40: 1 | AN40: =COUNTIF(knownSpells_humans!C[-39],RC[-1]) -> 0
A41: 0 | B41: NPC10_1 | C41: 35 | D41: 49 | E41: 25 | F41: 22 | G41: 50 | H41: -1 | I41: 22 | J41: 22 | K41: 7 | L41: 10 | M41: 0 | N41: 23 | O41: 5 | P41: 1 | Q41: 3 | R41: 7 | S41: 4 | T41: 2 | U41: 1 | V41: 7 | W41: 4 | X41: -1 | Y41: -1 | Z41: -1 | AA41: 110 | AB41: 1 | AC41: Rare Mithrill Short Sword{toHit=10} | AD41: Uncommon Hard Leather Small Shield{protectionAir=22} | AE41: Rare Mithrill Chain Helm | AF41: Uncommon Hard Leather Boots{speed=1} | AG41: Uncommon Hard Leather Bracers {scanRange=1} | AH41: Uncommon Hard Leather Gauntlets {protectionEarth=29} | AI41: Rare Mithrill Chain Mail | AJ41: Rare Mithrill Ring{protectionWater=27} | AK41: Rare Mithrill Amulet{protectionFire=32} | AN41: =COUNTIF(knownSpells_humans!C[-39],RC[-1]) -> 0
A42: 0 | B42: NPC11_1 | C42: -1 | D42: -1 | E42: -1 | F42: -1 | G42: 50 | H42: -1 | I42: 12 | J42: 12 | K42: 4 | L42: 0 | M42: 0 | N42: -1 | O42: -1 | P42: -1 | Q42: -1 | R42: -1 | S42: 7 | T42: 6 | U42: 1 | V42: -1 | W42: -1 | X42: -1 | Y42: -1 | Z42: -1 | AA42: 111 | AB42: 1 | AN42: =COUNTIF(knownSpells_humans!C[-39],RC[-1]) -> 0
A43: 0 | B43: NPC12_1 | C43: 45 | D43: 29 | E43: 28 | F43: 18 | G43: 30 | H43: -1 | I43: 18 | J43: 18 | K43: 6 | L43: 6 | M43: 0 | N43: -1 | O43: -1 | P43: -1 | Q43: -1 | R43: -1 | S43: 9 | T43: 6 | U43: 0 | V43: -1 | W43: -1 | X43: -1 | Y43: -1 | Z43: -1 | AA43: 112 | AB43: 1 | AN43: =COUNTIF(knownSpells_humans!C[-39],RC[-1]) -> 0
A44: 0 | B44: NPC13_1 | C44: 44 | D44: 36 | E44: 31 | F44: 31 | G44: 50 | H44: -1 | I44: 19 | J44: 19 | K44: 7 | L44: 7 | M44: 0 | N44: 26 | O44: 8 | P44: 4 | Q44: 2 | R44: 9 | S44: 5 | T44: 7 | U44: 0 | V44: 10 | W44: 4 | X44: -1 | Y44: -1 | Z44: -1 | AA44: 113 | AB44: 1 | AC44: Uncommon Steel Two Handed Sword | AE44: Uncommon Steel Plate Helm | AF44: Uncommon Steel Scale Mail | AG44: Uncommon Steel Plate Boots | AH44: Uncommon Steel Plate Cuirass | AI44: Uncommon Steel Scale Gauntlets | AJ44: Uncommon Steel Plate Bracers | AN44: =COUNTIF(knownSpells_humans!C[-39],RC[-1]) -> 0
A45: 0 | B45: NPC14_1 | C45: 35 | D45: 29 | E45: 24 | F45: 17 | G45: 20 | H45: -1 | I45: 18 | J45: 18 | K45: 6 | L45: 6 | M45: 0 | N45: 6 | O45: 7 | P45: 24 | Q45: 3 | R45: 1 | S45: 10 | T45: 4 | U45: 0 | V45: 7 | W45: 4 | X45: -1 | Y45: -1 | Z45: -1 | AA45: 114 | AB45: 1 | AC45: Iron Mace | AD45: Hard Leather Small Shield | AE45: Uncommon Hard Leather Helm | AF45: Bronze Cuirass | AG45: Uncommon Hard Leather Mail | AH45: Bronze Bracers | AI45: Leather Gauntlets | AJ45: Leather Boots | AN45: =COUNTIF(knownSpells_humans!C[-39],RC[-1]) -> 0
A46: 0 | B46: NPC15_1 | C46: -1 | D46: -1 | E46: -1 | F46: -1 | G46: 50 | H46: -1 | I46: 12 | J46: 12 | K46: 4 | L46: 0 | M46: 0 | N46: -1 | O46: -1 | P46: -1 | Q46: -1 | R46: -1 | S46: 12 | T46: 7 | U46: 1 | V46: -1 | W46: -1 | X46: -1 | Y46: -1 | Z46: -1 | AA46: 115 | AB46: 1 | AN46: =COUNTIF(knownSpells_humans!C[-39],RC[-1]) -> 0
A47: 0 | B47: NPC03_2 | C47: 14 | D47: 20 | E47: 39 | F47: 45 | G47: 30 | H47: 70 | I47: 16 | J47: 16 | K47: 6 | L47: 4 | M47: 0 | N47: 39 | O47: 10 | P47: 0 | Q47: 20 | R47: 27 | S47: 24 | T47: 2 | U47: 0 | V47: -1 | W47: -1 | X47: -1 | Y47: -1 | Z47: 12 | AA47: 203 | AB47: 0 | AC47: Uncommon Wood Staff {castSpell=Lightning:34} | AE47: Rare None Dress{protectionFire=23} | AF47: Very Rare None Gloves | AG47: Rare None Shoes | AH47: Very Rare None Low Hat | AI47: Rare None Cape | AJ47: Rare Mithrill Amulet | AM47: [47] | AN47: =COUNTIF(knownSpells_humans!C[-39],RC[-1]) -> 9
A48: 0 | B48: NPC04_2 | C48: 14 | D48: 26 | E48: 37 | F48: 42 | G48: 30 | H48: 70 | I48: 17 | J48: 17 | K48: 7 | L48: 5 | M48: 0 | N48: 0 | O48: 38 | P48: 28 | Q48: 14 | R48: 12 | S48: 24 | T48: 2 | U48: 1 | V48: -1 | W48: -1 | X48: -1 | Y48: -1 | Z48: 12 | AA48: 204 | AB48: 0 | AC48: Wood Staff {castSpell=Fire_Arrow:25} | AE48: None Dress | AF48: None Cape{protectionWater=24} | AG48: Rare None Gloves{protectionAir=26} | AH48: None Shoes | AI48: Uncommon Silver Amulet | AM48: [48] | AN48: =COUNTIF(knownSpells_humans!C[-39],RC[-1]) -> 9
A49: 0 | B49: NPC05_2 | C49: 14 | D49: 20 | E49: 39 | F49: 45 | G49: 30 | H49: 70 | I49: 16 | J49: 16 | K49: 6 | L49: 4 | M49: 0 | N49: -1 | O49: -1 | P49: -1 | Q49: -1 | R49: -1 | S49: 24 | T49: 1 | U49: 0 | V49: -1 | W49: -1 | X49: -1 | Y49: -1 | Z49: 12 | AA49: 205 | AB49: 1 | AN49: =COUNTIF(knownSpells_humans!C[-39],RC[-1]) -> 0
A50: 0 | B50: NPC06_2 | C50: 27 | D50: 43 | E50: 25 | F50: 27 | G50: 20 | H50: -1 | I50: 21 | J50: 21 | K50: 7 | L50: 9 | M50: 0 | N50: 22 | O50: 11 | P50: 7 | Q50: 5 | R50: 49 | S50: 14 | T50: 3 | U50: 1 | V50: 20 | W50: 5 | X50: -1 | Y50: -1 | Z50: -1 | AA50: 206 | AB50: 1 | AC50: Elven Magic Wood Short Bow{toHit=20} | AE50: Very Rare Dragon Leather Helm | AF50: Very Rare Dragon Leather Mail{defence=20} | AG50: Very Rare Dragon Leather Bracers | AH50: Uncommon Hard Leather Boots{defence=9} | AI50: Uncommon Hard Leather Gauntlets{defence=8} | AN50: =COUNTIF(knownSpells_humans!C[-39],RC[-1]) -> 0
A51: 0 | B51: NPC07_2 | C51: 32 | D51: 32 | E51: 28 | F51: 22 | G51: 30 | H51: -1 | I51: 18 | J51: 18 | K51: 6 | L51: 6 | M51: 0 | N51: 12 | O51: 23 | P51: 4 | Q51: 9 | R51: 48 | S51: 15 | T51: 4 | U51: 1 | V51: 8 | W51: 16 | X51: -1 | Y51: -1 | Z51: -1 | AA51: 207 | AB51: 1 | AC51: Rare Mithrill Crossbow | AE51: Rare Mithrill Chain Mail{defence=10} | AF51: Rare Mithrill Cuirass{defence=23} | AG51: Uncommon Hard Leather Gauntlets | AH51: Rare Mithrill Bracers | AI51: Rare Mithrill Chain Boots | AJ51: Rare Mithrill Chain Helm{defence=10} | AK51: Rare Mithrill Amulet { protectionAir=25} | AN51: =COUNTIF(knownSpells_humans!C[-39],RC[-1]) -> 0
A52: 0 | B52: NPC08_2 | C52: 43 | D52: 30 | E52: 27 | F52: 18 | G52: 60 | H52: -1 | I52: 18 | J52: 18 | K52: 6 | L52: 6 | M52: 0 | N52: 12 | O52: 7 | P52: 3 | Q52: 51 | R52: 15 | S52: 21 | T52: 2 | U52: 0 | V52: 10 | W52: 4 | X52: 1 | Y52: -1 | Z52: -1 | AA52: 208 | AB52: 1 | AC52: Rare Mithrill Pike{ protectionEarth=95} | AD52: Uncommon Steel Large Shield | AE52: Uncommon Steel Chain Helm | AF52: Rare Mithrill Chain Mail{defence=11} | AG52: Rare Mithrill Cuirass{defence=27} | AH52: Uncommon Steel Chain Gauntlets | AI52: Uncommon Steel Chain Boots | AJ52: Uncommon Steel Bracers | AK52: Rare Mithrill Ring | AL52: Rare Mithrill Amulet {protectionAir=26} | AN52: =COUNTIF(knownSpells_humans!C[-39],RC[-1]) -> 0
A53: 0 | B53: NPC09_2 | C53: 44 | D53: 36 | E53: 22 | F53: 30 | G53: 60 | H53: -1 | I53: 19 | J53: 19 | K53: 6 | L53: 7 | M53: 0 | N53: -1 | O53: -1 | P53: -1 | Q53: -1 | R53: -1 | S53: 19 | T53: 10 | U53: 0 | V53: -1 | W53: -1 | X53: 1 | Y53: -1 | Z53: -1 | AA53: 209 | AB53: 1 | AN53: =COUNTIF(knownSpells_humans!C[-39],RC[-1]) -> 0
A54: 0 | B54: NPC10_2 | C54: 35 | D54: 49 | E54: 25 | F54: 22 | G54: 50 | H54: -1 | I54: 22 | J54: 22 | K54: 7 | L54: 10 | M54: 0 | N54: 53 | O54: 12 | P54: 3 | Q54: 5 | R54: 15 | S54: 4 | T54: 2 | U54: 1 | V54: 7 | W54: 4 | X54: -1 | Y54: -1 | Z54: -1 | AA54: 210 | AB54: 1 | AC54: Rare Mithrill Long Sword{toHit=20} | AD54: Rare Mithrill Small Shield{protectionAir=39} | AE54: Rare Mithrill Chain Helm | AF54: Rare Mithrill Chain Boots{speed=2} | AG54: Rare Mithrill Bracers{scanRange=1} | AH54: Rare Mithrill Scale Gauntlets{protectionEarth=46} | AI54: Rare Mithrill Chain Mail{defence=28} | AJ54: Rare Mithrill Ring{protectionWater=39} | AK54: Rare Mithrill Amulet{protectionFire=51} | AN54: =COUNTIF(knownSpells_humans!C[-39],RC[-1]) -> 0
A55: 0 | B55: NPC11_2 | C55: -1 | D55: -1 | E55: -1 | F55: -1 | G55: 50 | H55: -1 | I55: 12 | J55: 12 | K55: 4 | L55: 0 | M55: 0 | N55: -1 | O55: -1 | P55: -1 | Q55: -1 | R55: -1 | S55: 7 | T55: 6 | U55: 1 | V55: -1 | W55: -1 | X55: -1 | Y55: -1 | Z55: -1 | AA55: 211 | AB55: 1 | AN55: =COUNTIF(knownSpells_humans!C[-39],RC[-1]) -> 0
A56: 0 | B56: NPC12_2 | C56: 45 | D56: 29 | E56: 28 | F56: 18 | G56: 30 | H56: -1 | I56: 18 | J56: 18 | K56: 6 | L56: 6 | M56: 0 | N56: -1 | O56: -1 | P56: -1 | Q56: -1 | R56: -1 | S56: 9 | T56: 6 | U56: 0 | V56: -1 | W56: -1 | X56: -1 | Y56: -1 | Z56: -1 | AA56: 212 | AB56: 1 | AN56: =COUNTIF(knownSpells_humans!C[-39],RC[-1]) -> 0
A57: 0 | B57: NPC13_2 | C57: 44 | D57: 36 | E57: 31 | F57: 31 | G57: 50 | H57: -1 | I57: 19 | J57: 19 | K57: 7 | L57: 7 | M57: 0 | N57: 51 | O57: 22 | P57: 11 | Q57: 7 | R57: 13 | S57: 5 | T57: 7 | U57: 0 | V57: 10 | W57: 4 | X57: -1 | Y57: -1 | Z57: -1 | AA57: 213 | AB57: 1 | AC57: Rare Mithrill Two Handed Sword | AE57: Rare Mithrill Plate Helm{defence=6} | AF57: Rare Mithrill Chain Mail{defence=19} | AG57: Rare Mithrill Plate Cuirass{defence=25} | AH57: Rare Mithrill Plate Bracers | AI57: Rare Mithrill Plate Boots{absorbtion=3} | AJ57: Rare Mithrill Scale Gauntlets | AK57: Rare Mithrill Amulet {protectionFire=19} | AL57: Rare Mithrill Ring {protectionAir=15} | AN57: =COUNTIF(knownSpells_humans!C[-39],RC[-1]) -> 0
A58: 0 | B58: NPC14_2 | C58: 35 | D58: 29 | E58: 24 | F58: 17 | G58: 20 | H58: -1 | I58: 18 | J58: 18 | K58: 6 | L58: 6 | M58: 0 | N58: 11 | O58: 8 | P58: 49 | Q58: 9 | R58: 2 | S58: 10 | T58: 4 | U58: 0 | V58: 7 | W58: 4 | X58: -1 | Y58: -1 | Z58: -1 | AA58: 214 | AB58: 1 | AC58: Uncommon Steel Mace | AD58: Very Rare Dragon Leather Large Shield | AE58: Uncommon Steel Helm | AF58: Rare Mithrill Cuirass | AG58: Uncommon Steel Chain Mail | AH58: Iron Bracers | AI58: Uncommon Hard Leather Gauntlets | AJ58: Uncommon Hard Leather Boots | AN58: =COUNTIF(knownSpells_humans!C[-39],RC[-1]) -> 0
A59: 0 | B59: NPC15_2 | C59: -1 | D59: -1 | E59: -1 | F59: -1 | G59: 50 | H59: -1 | I59: 12 | J59: 12 | K59: 4 | L59: 0 | M59: 0 | N59: -1 | O59: -1 | P59: -1 | Q59: -1 | R59: -1 | S59: 12 | T59: 7 | U59: 1 | V59: -1 | W59: -1 | X59: -1 | Y59: -1 | Z59: -1 | AA59: 215 | AB59: 1 | AN59: =COUNTIF(knownSpells_humans!C[-39],RC[-1]) -> 0
A60: 0 | B60: NPC03_3 | C60: 14 | D60: 20 | E60: 39 | F60: 45 | G60: 30 | H60: 70 | I60: 16 | J60: 16 | K60: 6 | L60: 4 | M60: 0 | N60: 61 | O60: 22 | P60: 0 | Q60: 30 | R60: 41 | S60: 24 | T60: 2 | U60: 0 | V60: -1 | W60: -1 | X60: -1 | Y60: -1 | Z60: 12 | AA60: 303 | AB60: 0 | AC60: Uncommon Wood Staff {castSpell=Lightning:65} | AE60: Rare None Dress{protectionFire=54} | AF60: Very Rare None Gloves | AG60: Rare None Shoes | AH60: Very Rare None Low Hat | AI60: Rare None Cape{protectionAir=31} | AJ60: Rare Mithrill Amulet{protectionEarth=44} | AM60: [60] | AN60: =COUNTIF(knownSpells_humans!C[-39],RC[-1]) -> 12
A61: 0 | B61: NPC04_3 | C61: 14 | D61: 26 | E61: 37 | F61: 42 | G61: 30 | H61: 70 | I61: 17 | J61: 17 | K61: 7 | L61: 5 | M61: 0 | N61: 0 | O61: 60 | P61: 42 | Q61: 22 | R61: 14 | S61: 24 | T61: 2 | U61: 1 | V61: -1 | W61: -1 | X61: -1 | Y61: -1 | Z61: 12 | AA61: 304 | AB61: 0 | AC61: Wood Staff {castSpell=Fire_Arrow:63} | AE61: None Dress{protectionWater=57} | AF61: None Cape{protectionAir=44} | AG61: Rare None Gloves | AH61: None Shoes | AI61: Uncommon Silver Amulet | AM61: [61] | AN61: =COUNTIF(knownSpells_humans!C[-39],RC[-1]) -> 12
A62: 0 | B62: NPC05_3 | C62: 14 | D62: 20 | E62: 39 | F62: 45 | G62: 30 | H62: 70 | I62: 16 | J62: 16 | K62: 6 | L62: 4 | M62: 0 | N62: -1 | O62: -1 | P62: -1 | Q62: -1 | R62: -1 | S62: 24 | T62: 1 | U62: 0 | V62: -1 | W62: -1 | X62: -1 | Y62: -1 | Z62: 12 | AA62: 305 | AB62: 1 | AN62: =COUNTIF(knownSpells_humans!C[-39],RC[-1]) -> 0
A63: 0 | B63: NPC06_3 | C63: 27 | D63: 43 | E63: 25 | F63: 27 | G63: 20 | H63: -1 | I63: 21 | J63: 21 | K63: 7 | L63: 9 | M63: 0 | N63: 32 | O63: 15 | P63: 8 | Q63: 5 | R63: 76 | S63: 14 | T63: 3 | U63: 1 | V63: 20 | W63: 5 | X63: -1 | Y63: -1 | Z63: -1 | AA63: 306 | AB63: 1 | AC63: Uncommon Magic Wood Long Bow{toHit=35} | AE63: Very Rare Dragon Leather Helm{scanRange=1} | AF63: Very Rare Dragon Leather Mail{defence=46} | AG63: Very Rare Dragon Leather Bracers{defence=17} | AH63: Very Rare Dragon Leather Boots{defence=14} | AI63: Very Rare Dragon Leather Gauntlets{defence=20} | AN63: =COUNTIF(knownSpells_humans!C[-39],RC[-1]) -> 0
A64: 0 | B64: NPC07_3 | C64: 32 | D64: 32 | E64: 28 | F64: 22 | G64: 30 | H64: -1 | I64: 18 | J64: 18 | K64: 6 | L64: 6 | M64: 0 | N64: 15 | O64: 31 | P64: 5 | Q64: 6 | R64: 77 | S64: 15 | T64: 4 | U64: 1 | V64: 8 | W64: 16 | X64: -1 | Y64: -1 | Z64: -1 | AA64: 307 | AB64: 1 | AC64: Rare Adamantium Crossbow | AE64: Rare Adamantium Chain Mail{defence=33} | AF64: Very Rare Adamantium Cuirass{defence=45} | AG64: Uncommon Hard Leather Gauntlets | AH64: Rare Adamantium Bracers | AI64: Rare Adamantium Chain Boots{defence=9} | AJ64: Rare Adamantium Chain Helm{defence=9} | AK64: Very Rare Adamantium Ring { protectionFire=18 } | AL64: Very Rare Adamantium Amulet { protectionAir=39} | AN64: =COUNTIF(knownSpells_humans!C[-39],RC[-1]) -> 0
A65: 0 | B65: NPC08_3 | C65: 43 | D65: 30 | E65: 27 | F65: 18 | G65: 60 | H65: -1 | I65: 18 | J65: 18 | K65: 6 | L65: 6 | M65: 0 | N65: 28 | O65: 22 | P65: 7 | Q65: 75 | R65: 11 | S65: 21 | T65: 2 | U65: 0 | V65: 10 | W65: 4 | X65: 1 | Y65: -1 | Z65: -1 | AA65: 308 | AB65: 1 | AC65: Very Rare Adamantium Pike {protectionEarth=95} | AD65: Rare Mithrill Large Shield | AE65: Rare Mithrill Chain Helm{defence=15} | AF65: Rare Mithrill Chain Mail{defence=32} | AG65: Very Rare Adamantium Cuirass{defence=38} | AH65: Rare Mithrill Chain Gauntlets{defence=5} | AI65: Rare Mithrill Chain Boots | AJ65: Rare Mithrill Bracers | AK65: Very Rare Adamantium Ring | AL65: Very Rare Adamantium Amulet {protectionAir=34} | AN65: =COUNTIF(knownSpells_humans!C[-39],RC[-1]) -> 0
A66: 0 | B66: NPC09_3 | C66: 44 | D66: 36 | E66: 22 | F66: 30 | G66: 60 | H66: -1 | I66: 19 | J66: 19 | K66: 6 | L66: 7 | M66: 0 | N66: 78 | O66: 34 | P66: 8 | Q66: 25 | R66: 15 | S66: 19 | T66: 10 | U66: 0 | V66: 10 | W66: 4 | X66: 1 | Y66: -1 | Z66: -1 | AA66: 309 | AB66: 1 | AC66: Rare Mithrill Bastard Sword | AD66: Rare Mithrill Large Shield | AE66: Rare Mithrill Chain Helm{defence=31} | AF66: Rare Mithrill Chain Mail{defence=49} | AG66: Rare Mithrill Chain Gauntlets{defence=7,Rare Mithrill Chain Boots{defence=19} | AH66: Rare Mithrill Bracers | AI66: Rare Mithrill Ring | AJ66: Rare Mithrill Amulet {protectionFire=38} | AN66: =COUNTIF(knownSpells_humans!C[-39],RC[-1]) -> 0
A67: 0 | B67: NPC10_3 | C67: 35 | D67: 49 | E67: 25 | F67: 22 | G67: 50 | H67: -1 | I67: 22 | J67: 22 | K67: 7 | L67: 10 | M67: 0 | N67: 77 | O67: 24 | P67: 12 | Q67: 11 | R67: 29 | S67: 4 | T67: 2 | U67: 1 | V67: 7 | W67: 4 | X67: -1 | Y67: -1 | Z67: -1 | AA67: 310 | AB67: 1 | AC67: Rare Mithrill Bastard Sword{damageBonus=3} | AD67: Rare Mithrill Small Shield{protectionAir=47} | AE67: Rare Mithrill Chain Helm{defence=35} | AF67: Rare Mithrill Chain Boots{speed=2} | AG67: Rare Mithrill Bracers{scanRange=2,defence=18,toHit=28} | AH67: Rare Mithrill Scale Gauntlets{protectionEarth=61} | AI67: Rare Mithrill Chain Mail{defence=50} | AJ67: Rare Mithrill Ring{protectionWater=55} | AK67: Rare Mithrill Amulet{protectionFire=58} | AN67: =COUNTIF(knownSpells_humans!C[-39],RC[-1]) -> 0
A68: 0 | B68: NPC11_3 | C68: -1 | D68: -1 | E68: -1 | F68: -1 | G68: 50 | H68: -1 | I68: 12 | J68: 12 | K68: 4 | L68: 0 | M68: 0 | N68: -1 | O68: -1 | P68: -1 | Q68: -1 | R68: -1 | S68: 7 | T68: 6 | U68: 1 | V68: -1 | W68: -1 | X68: -1 | Y68: -1 | Z68: -1 | AA68: 311 | AB68: 1 | AN68: =COUNTIF(knownSpells_humans!C[-39],RC[-1]) -> 0
A69: 0 | B69: NPC12_3 | C69: 45 | D69: 29 | E69: 28 | F69: 18 | G69: 30 | H69: -1 | I69: 18 | J69: 18 | K69: 6 | L69: 6 | M69: 0 | N69: -1 | O69: -1 | P69: -1 | Q69: -1 | R69: -1 | S69: 9 | T69: 6 | U69: 0 | V69: -1 | W69: -1 | X69: -1 | Y69: -1 | Z69: -1 | AA69: 312 | AB69: 1 | AN69: =COUNTIF(knownSpells_humans!C[-39],RC[-1]) -> 0
A70: 0 | B70: NPC13_3 | C70: 44 | D70: 36 | E70: 31 | F70: 31 | G70: 50 | H70: -1 | I70: 19 | J70: 19 | K70: 7 | L70: 7 | M70: 0 | N70: 75 | O70: 35 | P70: 9 | Q70: 4 | R70: 22 | S70: 5 | T70: 7 | U70: 0 | V70: 10 | W70: 4 | X70: -1 | Y70: -1 | Z70: -1 | AA70: 313 | AB70: 1 | AC70: Very Rare Adamantium Two Handed Sword | AE70: Very Rare Adamantium Plate Helm{defence=5} | AF70: Very Rare Adamantium Scale Mail{defence=35} | AG70: Very Rare Adamantium Plate Cuirass{defence=42} | AH70: Very Rare Adamantium Plate Bracers{absorbtion=2} | AI70: Very Rare Adamantium Plate Boots{absorbtion=3} | AJ70: Very Rare Adamantium Scale Gauntlets{protectionEarth=21} | AK70: Very Rare Adamantium Amulet {protectionFire=27} | AL70: Very Rare Adamantium Ring {protectionAir=18} | AN70: =COUNTIF(knownSpells_humans!C[-39],RC[-1]) -> 0
A71: 0 | B71: NPC14_3 | C71: 35 | D71: 29 | E71: 24 | F71: 17 | G71: 20 | H71: -1 | I71: 18 | J71: 18 | K71: 6 | L71: 6 | M71: 0 | N71: 16 | O71: 12 | P71: 77 | Q71: 8 | R71: 4 | S71: 10 | T71: 4 | U71: 0 | V71: 7 | W71: 4 | X71: -1 | Y71: -1 | Z71: -1 | AA71: 314 | AB71: 1 | AC71: Rare Mithrill Mace | AD71: Uncommon Magic Wood Tower Shield | AE71: Elven Mithrill Full Helm | AF71: Very Rare Adamantium Cuirass{defence=37} | AG71: Uncommon Steel Chain Mail{defence=23} | AH71: Iron Plate Bracers | AI71: Very Rare Dragon Leather Gauntlets | AJ71: Very Rare Gold Ring {protectionFire=20} | AK71: Bronze Plate Boots | AN71: =COUNTIF(knownSpells_humans!C[-39],RC[-1]) -> 0
A72: 0 | B72: NPC15_3 | C72: -1 | D72: -1 | E72: -1 | F72: -1 | G72: 50 | H72: -1 | I72: 12 | J72: 12 | K72: 4 | L72: 0 | M72: 0 | N72: -1 | O72: -1 | P72: -1 | Q72: -1 | R72: -1 | S72: 12 | T72: 7 | U72: 1 | V72: -1 | W72: -1 | X72: -1 | Y72: -1 | Z72: -1 | AA72: 315 | AB72: 1 | AN72: =COUNTIF(knownSpells_humans!C[-39],RC[-1]) -> 0
A73: 0 | B73: NPC03_4 | C73: 14 | D73: 20 | E73: 39 | F73: 45 | G73: 30 | H73: 70 | I73: 16 | J73: 16 | K73: 6 | L73: 4 | M73: 0 | N73: 79 | O73: 32 | P73: 0 | Q73: 43 | R73: 68 | S73: 24 | T73: 2 | U73: 0 | V73: -1 | W73: -1 | X73: -1 | Y73: -1 | Z73: 12 | AA73: 403 | AB73: 0 | AC73: Uncommon Wood Staff {castSpell=Lightning:99} | AE73: Rare None Dress{protectionFire=71} | AF73: Very Rare None Gloves{protectionEarth=69} | AG73: Rare None Shoes{protectionAstral=55} | AH73: Very Rare None Low Hat{protectionAir=58} | AI73: Rare None Cape | AJ73: Rare Mithrill Amulet | AM73: [73] | AN73: =COUNTIF(knownSpells_humans!C[-39],RC[-1]) -> 16
A74: 0 | B74: NPC04_4 | C74: 14 | D74: 26 | E74: 37 | F74: 42 | G74: 30 | H74: 70 | I74: 17 | J74: 17 | K74: 7 | L74: 5 | M74: 0 | N74: 0 | O74: 78 | P74: 63 | Q74: 31 | R74: 18 | S74: 24 | T74: 2 | U74: 1 | V74: -1 | W74: -1 | X74: -1 | Y74: -1 | Z74: 12 | AA74: 404 | AB74: 0 | AC74: Wood Staff {castSpell=Fire_Arrow:82} | AE74: None Dress{protectionWater=74} | AF74: None Cape{protectionAir=65} | AG74: Rare None Gloves{protectionEarth=51} | AH74: None Shoes | AI74: Uncommon Silver Amulet | AM74: [74] | AN74: =COUNTIF(knownSpells_humans!C[-39],RC[-1]) -> 17
A75: 0 | B75: NPC05_4 | C75: 14 | D75: 20 | E75: 39 | F75: 45 | G75: 30 | H75: 70 | I75: 16 | J75: 16 | K75: 6 | L75: 4 | M75: 0 | N75: 35 | O75: 52 | P75: 80 | Q75: 0 | R75: 25 | S75: 24 | T75: 1 | U75: 0 | V75: -1 | W75: -1 | X75: -1 | Y75: -1 | Z75: 12 | AA75: 405 | AB75: 0 | AC75: Rare Magic Wood Shaman Staff {castSpell=Prismatic_Spray:98} | AE75: Rare None Robe{protectionWater=51} | AF75: Rare None Cloak{protectionAir=80} | AG75: Rare None Hat | AH75: None Gloves | AI75: Uncommon None Shoes | AJ75: Rare Adamantium Amulet | AM75: [75] | AN75: =COUNTIF(knownSpells_humans!C[-39],RC[-1]) -> 17
A76: 0 | B76: NPC06_4 | C76: 27 | D76: 43 | E76: 25 | F76: 27 | G76: 20 | H76: -1 | I76: 21 | J76: 21 | K76: 7 | L76: 9 | M76: 0 | N76: 30 | O76: 15 | P76: 4 | Q76: 7 | R76: 99 | S76: 14 | T76: 3 | U76: 1 | V76: 20 | W76: 5 | X76: -1 | Y76: -1 | Z76: -1 | AA76: 406 | AB76: 1 | AC76: Elven Magic Wood Long Bow{toHit=50} | AE76: Very Rare Dragon Leather Helm{scanRange=2} | AF76: Very Rare Dragon Leather Mail{defence=66} | AG76: Very Rare Dragon Leather Bracers{defence=29} | AH76: Very Rare Dragon Leather Boots{defence=34} | AI76: Very Rare Dragon Leather Gauntlets{defence=33} | AN76: =COUNTIF(knownSpells_humans!C[-39],RC[-1]) -> 0
A77: 0 | B77: NPC07_4 | C77: 32 | D77: 32 | E77: 28 | F77: 22 | G77: 30 | H77: -1 | I77: 18 | J77: 18 | K77: 6 | L77: 6 | M77: 0 | N77: 29 | O77: 17 | P77: 4 | Q77: 7 | R77: 100 | S77: 15 | T77: 4 | U77: 1 | V77: 8 | W77: 16 | X77: -1 | Y77: -1 | Z77: -1 | AA77: 407 | AB77: 1 | AC77: Very Rare Meteoric Crossbow | AE77: Elven Meteoric Chain Mail{defence=35} | AF77: Very Rare Meteoric Cuirass{defence=50} | AG77: Uncommon Hard Leather Gauntlets | AH77: Very Rare Meteoric Plate Bracers | AI77: Very Rare Meteoric Plate Boots | AJ77: Elven Meteoric Helm{defence=22} | AK77: Very Rare Meteoric Ring { protectionFire=32 } | AL77: Very Rare Meteoric Amulet { protectionAir=48} | AN77: =COUNTIF(knownSpells_humans!C[-39],RC[-1]) -> 0
A78: 0 | B78: NPC08_4 | C78: 43 | D78: 30 | E78: 27 | F78: 18 | G78: 60 | H78: -1 | I78: 18 | J78: 18 | K78: 6 | L78: 6 | M78: 0 | N78: 35 | O78: 25 | P78: 6 | Q78: 98 | R78: 9 | S78: 21 | T78: 2 | U78: 0 | V78: 10 | W78: 4 | X78: 1 | Y78: -1 | Z78: -1 | AA78: 408 | AB78: 1 | AC78: Very Rare Crystal Pike {protectionEarth=95} | AD78: Rare Adamantium Large Shield | AE78: Rare Adamantium Chain Helm{defence=13} | AF78: Very Rare Meteoric Scale Mail{defence=36} | AG78: Very Rare Meteoric Cuirass{defence=39} | AH78: Rare Adamantium Chain Gauntlets | AI78: Rare Adamantium Chain Boots | AJ78: Rare Adamantium Bracers | AK78: Very Rare Meteoric Ring | AL78: Very Rare Meteoric Amulet {protectionAir=47} | AN78: =COUNTIF(knownSpells_humans!C[-39],RC[-1]) -> 0
A79: 0 | B79: NPC09_4 | C79: 44 | D79: 36 | E79: 22 | F79: 30 | G79: 60 | H79: -1 | I79: 19 | J79: 19 | K79: 6 | L79: 7 | M79: 0 | N79: 98 | O79: 30 | P79: 11 | Q79: 22 | R79: 5 | S79: 19 | T79: 10 | U79: 0 | V79: 10 | W79: 4 | X79: 1 | Y79: -1 | Z79: -1 | AA79: 409 | AB79: 1 | AC79: Rare Adamantium Bastard Sword | AD79: Rare Adamantium Large Shield{defence=30} | AE79: Rare Adamantium Chain Helm{defence=32} | AF79: Rare Adamantium Chain Mail{defence=50} | AG79: Rare Adamantium Chain Gauntlets{defence=23} | AH79: Rare Adamantium Chain Boots{protectionWater=48} | AI79: Rare Adamantium Bracers{protectionAir=66} | AJ79: Very Rare Adamantium Ring | AK79: Very Rare Adamantium Amulet {protectionFire=49} | AN79: =COUNTIF(knownSpells_humans!C[-39],RC[-1]) -> 0
A80: 0 | B80: NPC10_4 | C80: 35 | D80: 49 | E80: 25 | F80: 22 | G80: 50 | H80: -1 | I80: 22 | J80: 22 | K80: 7 | L80: 10 | M80: 0 | N80: 99 | O80: 30 | P80: 4 | Q80: 12 | R80: 34 | S80: 4 | T80: 2 | U80: 1 | V80: 7 | W80: 4 | X80: -1 | Y80: -1 | Z80: -1 | AA80: 410 | AB80: 1 | AC80: Rare Mithrill Bastard Sword {damageBonus=10} | AD80: Rare Mithrill Small Shield{defence=24,protectionAir=67} | AE80: Rare Mithrill Chain Helm{defence=45} | AF80: Rare Mithrill Chain Boots{speed=3,defence=16} | AG80: Rare Mithrill Bracers{scanRange=2} | AH80: Rare Mithrill Scale Gauntlets{protectionEarth=81,defence=30,toHit=42} | AI80: Rare Mithrill Chain Mail{defence=50} | AJ80: Rare Mithrill Ring{protectionWater=76} | AK80: Rare Mithrill Amulet{protectionFire=78} | AN80: =COUNTIF(knownSpells_humans!C[-39],RC[-1]) -> 0
A81: 0 | B81: NPC11_4 | C81: -1 | D81: -1 | E81: -1 | F81: -1 | G81: 50 | H81: -1 | I81: 12 | J81: 12 | K81: 4 | L81: 0 | M81: 0 | N81: -1 | O81: -1 | P81: -1 | Q81: -1 | R81: -1 | S81: 7 | T81: 6 | U81: 1 | V81: -1 | W81: -1 | X81: -1 | Y81: -1 | Z81: -1 | AA81: 411 | AB81: 1 | AN81: =COUNTIF(knownSpells_humans!C[-39],RC[-1]) -> 0
A82: 0 | B82: NPC12_4 | C82: 45 | D82: 29 | E82: 28 | F82: 18 | G82: 30 | H82: -1 | I82: 18 | J82: 18 | K82: 6 | L82: 6 | M82: 0 | N82: 85 | O82: 100 | P82: 90 | Q82: 77 | R82: 76 | S82: 9 | T82: 6 | U82: 0 | V82: 10 | W82: 4 | X82: -1 | Y82: -1 | Z82: -1 | AA82: 412 | AB82: 1 | AC82: Very Rare Meteoric Two Handed Axe | AE82: Very Rare Meteoric Plate Helm | AF82: Very Rare Meteoric Scale Mail{defence=30} | AG82: Very Rare Meteoric Plate Cuirass{defence=45} | AH82: Very Rare Meteoric Scale Gauntlets{defence=15} | AI82: Very Rare Meteoric Plate Boots{protectionEarth=29} | AJ82: Very Rare Meteoric Plate Bracers | AK82: Very Rare Meteoric Amulet {protectionAir=33} | AL82: Very Rare Meteoric Ring { protectionFire=41} | AN82: =COUNTIF(knownSpells_humans!C[-39],RC[-1]) -> 0
A83: 0 | B83: NPC13_4 | C83: 44 | D83: 36 | E83: 31 | F83: 31 | G83: 50 | H83: -1 | I83: 19 | J83: 19 | K83: 7 | L83: 7 | M83: 0 | N83: 100 | O83: 54 | P83: 45 | Q83: 34 | R83: 11 | S83: 5 | T83: 7 | U83: 0 | V83: 10 | W83: 4 | X83: -1 | Y83: -1 | Z83: -1 | AA83: 413 | AB83: 1 | AC83: Very Rare Meteoric Two Handed Sword | AE83: Very Rare Crystal Plate Helm{defence=10} | AF83: Very Rare Meteoric Scale Mail{defence=40} | AG83: Very Rare Crystal Plate Cuirass{defence=44} | AH83: Very Rare Crystal Plate Bracers{absorbtion=4} | AI83: Very Rare Crystal Plate Boots{absorbtion=4} | AJ83: Very Rare Crystal Scale Gauntlets{protectionEarth=49} | AK83: Very Rare Crystal Amulet {protectionFire=51} | AL83: Very Rare Crystal Ring {protectionAir=54} | AN83: =COUNTIF(knownSpells_humans!C[-39],RC[-1]) -> 0
A84: 0 | B84: NPC14_4 | C84: 35 | D84: 29 | E84: 24 | F84: 17 | G84: 20 | H84: -1 | I84: 18 | J84: 18 | K84: 6 | L84: 6 | M84: 0 | N84: 34 | O84: 22 | P84: 91 | Q84: 12 | R84: 10 | S84: 10 | T84: 4 | U84: 0 | V84: 7 | W84: 4 | X84: -1 | Y84: -1 | Z84: -1 | AA84: 414 | AB84: 1 | AC84: Rare Adamantium Mace | AD84: Rare Adamantium Tower Shield | AE84: Elven Meteoric Full Helm | AF84: Very Rare Crystal Plate Cuirass{defence=35} | AG84: Uncommon Steel Scale Mail | AH84: Rare Mithrill Plate Bracers | AI84: Very Rare Dragon Leather Gauntlets | AJ84: Very Rare Gold Ring {protectionFire=27} | AK84: Iron Plate Boots{defence=30} | AN84: =COUNTIF(knownSpells_humans!C[-39],RC[-1]) -> 0
A85: 0 | B85: NPC15_4 | C85: -1 | D85: -1 | E85: -1 | F85: -1 | G85: 50 | H85: -1 | I85: 12 | J85: 12 | K85: 4 | L85: 0 | M85: 0 | N85: -1 | O85: -1 | P85: -1 | Q85: -1 | R85: -1 | S85: 12 | T85: 7 | U85: 1 | V85: -1 | W85: -1 | X85: -1 | Y85: -1 | Z85: -1 | AA85: 415 | AB85: 1 | AN85: =COUNTIF(knownSpells_humans!C[-39],RC[-1]) -> 0
A86: 0 | B86: U_Peasant1 | C86: 15 | D86: 20 | E86: 25 | F86: 25 | G86: 45 | H86: -1 | I86: 16 | J86: 16 | K86: 6 | L86: 4 | M86: 0 | N86: 0 | O86: 0 | P86: 0 | Q86: 0 | R86: 0 | S86: 1 | T86: 17 | U86: 0 | V86: -1 | W86: -1 | X86: -1 | Y86: -1 | Z86: -1 | AA86: 1001 | AB86: 1 | AN86: =COUNTIF(knownSpells_humans!C[-39],RC[-1]) -> 0
A87: 0 | B87: F_PeasantGuard1 | C87: 30 | D87: 25 | E87: 25 | F87: 25 | G87: 108 | H87: -1 | I87: 17 | J87: 17 | K87: 6 | L87: 5 | M87: 10 | N87: 0 | O87: 0 | P87: 10 | Q87: 0 | R87: 0 | S87: 10 | T87: 17 | U87: 0 | V87: 7 | W87: 4 | X87: -1 | Y87: -1 | Z87: -1 | AA87: 1002 | AB87: 1 | AC87: Wood Club | AN87: =COUNTIF(knownSpells_humans!C[-39],RC[-1]) -> 0
A88: 0 | B88: A_PeasantGuard1 | C88: 25 | D88: 35 | E88: 25 | F88: 25 | G88: 90 | H88: -1 | I88: 19 | J88: 19 | K88: 6 | L88: 7 | M88: 10 | N88: 0 | O88: 0 | P88: 0 | Q88: 0 | R88: 10 | S88: 14 | T88: 9 | U88: 1 | V88: 20 | W88: 5 | X88: -1 | Y88: -1 | Z88: -1 | AA88: 1003 | AB88: 1 | AC88: Wood Short Bow | AN88: =COUNTIF(knownSpells_humans!C[-39],RC[-1]) -> 0
A89: 0 | B89: U_PeasantLeader1 | C89: 20 | D89: 25 | E89: 30 | F89: 30 | G89: 60 | H89: -1 | I89: 17 | J89: 17 | K89: 6 | L89: 5 | M89: 0 | N89: 0 | O89: 0 | P89: 0 | Q89: 0 | R89: 0 | S89: 1 | T89: 27 | U89: 0 | V89: -1 | W89: -1 | X89: -1 | Y89: -1 | Z89: -1 | AA89: 1004 | AB89: 1 | AE89: Uncommon Silver Ring | AN89: =COUNTIF(knownSpells_humans!C[-39],RC[-1]) -> 0
A90: 0 | B90: U_Peasant2 | C90: 20 | D90: 20 | E90: 25 | F90: 25 | G90: 60 | H90: -1 | I90: 16 | J90: 16 | K90: 6 | L90: 4 | M90: 0 | N90: 0 | O90: 0 | P90: 0 | Q90: 0 | R90: 0 | S90: 1 | T90: 17 | U90: 0 | V90: -1 | W90: -1 | X90: -1 | Y90: -1 | Z90: -1 | AA90: 1005 | AB90: 1 | AN90: =COUNTIF(knownSpells_humans!C[-39],RC[-1]) -> 0
A91: 0 | B91: F_PeasantGuard2 | C91: 35 | D91: 25 | E91: 25 | F91: 25 | G91: 147 | H91: -1 | I91: 17 | J91: 17 | K91: 6 | L91: 5 | M91: 20 | N91: 0 | O91: 0 | P91: 20 | Q91: 0 | R91: 0 | S91: 10 | T91: 17 | U91: 0 | V91: 7 | W91: 4 | X91: -1 | Y91: -1 | Z91: -1 | AA91: 1006 | AB91: 1 | AC91: Uncommon Wood Club | AN91: =COUNTIF(knownSpells_humans!C[-39],RC[-1]) -> 0
A92: 0 | B92: A_PeasantGuard2 | C92: 30 | D92: 35 | E92: 25 | F92: 25 | G92: 126 | H92: -1 | I92: 19 | J92: 19 | K92: 6 | L92: 7 | M92: 20 | N92: 0 | O92: 0 | P92: 0 | Q92: 0 | R92: 20 | S92: 14 | T92: 9 | U92: 1 | V92: 20 | W92: 5 | X92: -1 | Y92: -1 | Z92: -1 | AA92: 1007 | AB92: 1 | AC92: Uncommon Wood Short Bow | AN92: =COUNTIF(knownSpells_humans!C[-39],RC[-1]) -> 0
A93: 0 | B93: U_PeasantLeader2 | C93: 25 | D93: 25 | E93: 35 | F93: 35 | G93: 75 | H93: -1 | I93: 17 | J93: 17 | K93: 6 | L93: 5 | M93: 0 | N93: 0 | O93: 0 | P93: 0 | Q93: 0 | R93: 0 | S93: 1 | T93: 27 | U93: 0 | V93: -1 | W93: -1 | X93: -1 | Y93: -1 | Z93: -1 | AA93: 1008 | AB93: 1 | AE93: Rare Silver Ring | AN93: =COUNTIF(knownSpells_humans!C[-39],RC[-1]) -> 0
A94: 0 | B94: U_Peasant3 | C94: 25 | D94: 20 | E94: 25 | F94: 25 | G94: 75 | H94: -1 | I94: 16 | J94: 16 | K94: 6 | L94: 4 | M94: 0 | N94: 0 | O94: 0 | P94: 0 | Q94: 0 | R94: 0 | S94: 1 | T94: 17 | U94: 0 | V94: -1 | W94: -1 | X94: -1 | Y94: -1 | Z94: -1 | AA94: 1009 | AB94: 1 | AN94: =COUNTIF(knownSpells_humans!C[-39],RC[-1]) -> 0
A95: 0 | B95: F_PeasantGuard3 | C95: 40 | D95: 25 | E95: 25 | F95: 25 | G95: 192 | H95: -1 | I95: 17 | J95: 17 | K95: 6 | L95: 5 | M95: 30 | N95: 0 | O95: 0 | P95: 30 | Q95: 0 | R95: 0 | S95: 10 | T95: 17 | U95: 0 | V95: 7 | W95: 4 | X95: -1 | Y95: -1 | Z95: -1 | AA95: 1010 | AB95: 1 | AC95: Wood Club | AN95: =COUNTIF(knownSpells_humans!C[-39],RC[-1]) -> 0
A96: 0 | B96: A_PeasantGuard3 | C96: 35 | D96: 35 | E96: 25 | F96: 25 | G96: 168 | H96: -1 | I96: 19 | J96: 19 | K96: 6 | L96: 7 | M96: 30 | N96: 0 | O96: 0 | P96: 0 | Q96: 0 | R96: 30 | S96: 14 | T96: 9 | U96: 1 | V96: 20 | W96: 5 | X96: -1 | Y96: -1 | Z96: -1 | AA96: 1011 | AB96: 1 | AC96: Wood Long Bow | AN96: =COUNTIF(knownSpells_humans!C[-39],RC[-1]) -> 0
A97: 0 | B97: U_PeasantLeader3 | C97: 30 | D97: 25 | E97: 40 | F97: 40 | G97: 90 | H97: -1 | I97: 17 | J97: 17 | K97: 7 | L97: 5 | M97: 0 | N97: 0 | O97: 0 | P97: 0 | Q97: 0 | R97: 0 | S97: 1 | T97: 27 | U97: 0 | V97: -1 | W97: -1 | X97: -1 | Y97: -1 | Z97: -1 | AA97: 1012 | AB97: 1 | AE97: Rare Mithrill Ring | AN97: =COUNTIF(knownSpells_humans!C[-39],RC[-1]) -> 0
A98: 0 | B98: U_Peasant4 | C98: 30 | D98: 20 | E98: 25 | F98: 25 | G98: 90 | H98: -1 | I98: 16 | J98: 16 | K98: 6 | L98: 4 | M98: 0 | N98: 0 | O98: 0 | P98: 0 | Q98: 0 | R98: 0 | S98: 1 | T98: 17 | U98: 0 | V98: -1 | W98: -1 | X98: -1 | Y98: -1 | Z98: -1 | AA98: 1013 | AB98: 1 | AN98: =COUNTIF(knownSpells_humans!C[-39],RC[-1]) -> 0
A99: 0 | B99: F_PeasantGuard4 | C99: 45 | D99: 25 | E99: 25 | F99: 25 | G99: 243 | H99: -1 | I99: 17 | J99: 17 | K99: 6 | L99: 5 | M99: 40 | N99: 0 | O99: 0 | P99: 40 | Q99: 0 | R99: 0 | S99: 10 | T99: 17 | U99: 0 | V99: 7 | W99: 4 | X99: -1 | Y99: -1 | Z99: -1 | AA99: 1014 | AB99: 1 | AC99: Uncommon Magic Wood Club | AN99: =COUNTIF(knownSpells_humans!C[-39],RC[-1]) -> 0
A100: 0 | B100: A_PeasantGuard4 | C100: 40 | D100: 35 | E100: 25 | F100: 25 | G100: 216 | H100: -1 | I100: 19 | J100: 19 | K100: 6 | L100: 7 | M100: 40 | N100: 0 | O100: 0 | P100: 0 | Q100: 0 | R100: 40 | S100: 14 | T100: 9 | U100: 1 | V100: 20 | W100: 5 | X100: -1 | Y100: -1 | Z100: -1 | AA100: 1015 | AB100: 1 | AC100: Uncommon Wood Long Bow | AN100: =COUNTIF(knownSpells_humans!C[-39],RC[-1]) -> 0
A101: 0 | B101: U_PeasantLeader4 | C101: 35 | D101: 25 | E101: 45 | F101: 45 | G101: 105 | H101: -1 | I101: 17 | J101: 17 | K101: 7 | L101: 5 | M101: 0 | N101: 0 | O101: 0 | P101: 0 | Q101: 0 | R101: 0 | S101: 1 | T101: 27 | U101: 0 | V101: -1 | W101: -1 | X101: -1 | Y101: -1 | Z101: -1 | AA101: 1016 | AB101: 1 | AE101: Very Rare Gold Ring | AN101: =COUNTIF(knownSpells_humans!C[-39],RC[-1]) -> 0
A102: 0 | B102: F_Brigand1 | C102: 25 | D102: 25 | E102: 15 | F102: 20 | G102: 90 | H102: -1 | I102: 17 | J102: 17 | K102: 6 | L102: 5 | M102: 10 | N102: 10 | O102: 10 | P102: 10 | Q102: 10 | R102: 10 | S102: 8 | T102: 24 | U102: 0 | V102: -1 | W102: -1 | X102: -1 | Y102: -1 | Z102: -1 | AA102: 1017 | AB102: 1 | AC102: Bronze Axe | AE102: Leather Mail | AF102: Leather Boots | AN102: =COUNTIF(knownSpells_humans!C[-39],RC[-1]) -> 0
A103: 0 | B103: A_Brigand1 | C103: 25 | D103: 30 | E103: 25 | F103: 25 | G103: 90 | H103: -1 | I103: 18 | J103: 18 | K103: 6 | L103: 6 | M103: 10 | N103: 10 | O103: 10 | P103: 10 | Q103: 10 | R103: 10 | S103: 14 | T103: 10 | U103: 1 | V103: 20 | W103: 5 | X103: -1 | Y103: -1 | Z103: -1 | AA103: 1018 | AB103: 1 | AC103: Wood Short Bow | AE103: Leather Mail | AF103: Leather Boots | AN103: =COUNTIF(knownSpells_humans!C[-39],RC[-1]) -> 0
A104: 0 | B104: M_Brigand1 | C104: 15 | D104: 20 | E104: 25 | F104: 30 | G104: 27 | H104: 108 | I104: 16 | J104: 16 | K104: 6 | L104: 4 | M104: 10 | N104: 10 | O104: 10 | P104: 10 | Q104: 10 | R104: 10 | S104: 24 | T104: 3 | U104: 1 | V104: -1 | W104: -1 | X104: -1 | Y104: -1 | Z104: 12 | AA104: 1019 | AB104: 0 | AC104: Wood Shaman Staff {castSpell=Fire_Arrow:5} | AE104: Robe | AF104: Cloak | AM104: [104] | AN104: =COUNTIF(knownSpells_humans!C[-39],RC[-1]) -> 2
A105: 0 | B105: F_BrigandLeader1 | C105: 30 | D105: 30 | E105: 20 | F105: 25 | G105: 126 | H105: -1 | I105: 18 | J105: 18 | K105: 6 | L105: 6 | M105: 20 | N105: 20 | O105: 20 | P105: 20 | Q105: 20 | R105: 20 | S105: 9 | T105: 25 | U105: 0 | V105: 10 | W105: 4 | X105: -1 | Y105: -1 | Z105: -1 | AA105: 1020 | AB105: 1 | AC105: Bronze Two Handed Axe | AE105: Leather Helm | AF105: Leather Mail | AG105: Leather Gauntlets | AH105: Leather Boots | AN105: =COUNTIF(knownSpells_humans!C[-39],RC[-1]) -> 0
A106: 0 | B106: F_Brigand2 | C106: 30 | D106: 30 | E106: 20 | F106: 25 | G106: 126 | H106: -1 | I106: 18 | J106: 18 | K106: 6 | L106: 6 | M106: 20 | N106: 20 | O106: 20 | P106: 20 | Q106: 20 | R106: 20 | S106: 8 | T106: 24 | U106: 0 | V106: -1 | W106: -1 | X106: -1 | Y106: -1 | Z106: -1 | AA106: 1021 | AB106: 1 | AC106: Uncommon Bronze Axe | AD106: Hard Leather Large Shield | AE106: Hard Leather Helm | AF106: Hard Leather Mail | AG106: Hard Leather Gauntlets | AH106: Hard Leather Boots | AN106: =COUNTIF(knownSpells_humans!C[-39],RC[-1]) -> 0
A107: 0 | B107: A_Brigand2 | C107: 30 | D107: 35 | E107: 20 | F107: 25 | G107: 126 | H107: -1 | I107: 19 | J107: 19 | K107: 6 | L107: 7 | M107: 20 | N107: 20 | O107: 20 | P107: 20 | Q107: 20 | R107: 20 | S107: 14 | T107: 10 | U107: 1 | V107: 20 | W107: 5 | X107: -1 | Y107: -1 | Z107: -1 | AA107: 1022 | AB107: 1 | AC107: Uncommon Wood Short Bow | AE107: Hard Leather Mail | AF107: Hard Leather Gauntlets | AG107: Hard Leather Boots | AN107: =COUNTIF(knownSpells_humans!C[-39],RC[-1]) -> 0
A108: 0 | B108: M_Brigand2 | C108: 20 | D108: 25 | E108: 30 | F108: 35 | G108: 42 | H108: 147 | I108: 17 | J108: 17 | K108: 6 | L108: 5 | M108: 20 | N108: 20 | O108: 20 | P108: 20 | Q108: 20 | R108: 20 | S108: 24 | T108: 3 | U108: 1 | V108: -1 | W108: -1 | X108: -1 | Y108: -1 | Z108: 12 | AA108: 1023 | AB108: 0 | AC108: Uncommon Wood Shaman Staff {castSpell=Fire_Arrow:25} | AE108: Uncommon Robe | AF108: Uncommon Cloak | AM108: [108] | AN108: =COUNTIF(knownSpells_humans!C[-39],RC[-1]) -> 3
A109: 0 | B109: F_BrigandLeader2 | C109: 35 | D109: 35 | E109: 25 | F109: 30 | G109: 189 | H109: -1 | I109: 19 | J109: 19 | K109: 6 | L109: 7 | M109: 40 | N109: 40 | O109: 40 | P109: 40 | Q109: 40 | R109: 40 | S109: 9 | T109: 25 | U109: 0 | V109: 10 | W109: 4 | X109: -1 | Y109: -1 | Z109: -1 | AA109: 1024 | AB109: 1 | AC109: Iron Two Handed Axe | AE109: Hard Leather Helm | AF109: Hard Leather Mail | AG109: Hard Leather Gauntlets | AH109: Hard Leather Boots | AN109: =COUNTIF(knownSpells_humans!C[-39],RC[-1]) -> 0
A110: 0 | B110: F_Brigand3 | C110: 35 | D110: 35 | E110: 25 | F110: 30 | G110: 189 | H110: -1 | I110: 19 | J110: 19 | K110: 6 | L110: 7 | M110: 40 | N110: 40 | O110: 40 | P110: 40 | Q110: 40 | R110: 40 | S110: 8 | T110: 24 | U110: 0 | V110: -1 | W110: -1 | X110: -1 | Y110: -1 | Z110: -1 | AA110: 1025 | AB110: 1 | AC110: Uncommon Steel Axe | AD110: Iron Small Shield | AE110: Uncommon Bronze Helm | AF110: Uncommon Steel Scale Mail | AG110: Uncommon Steel Scale Gauntlets | AH110: Uncommon Bronze Plate Bracers | AI110: Uncommon Bronze Plate Boots | AN110: =COUNTIF(knownSpells_humans!C[-39],RC[-1]) -> 0
A111: 0 | B111: A_Brigand3 | C111: 35 | D111: 40 | E111: 25 | F111: 30 | G111: 189 | H111: -1 | I111: 20 | J111: 20 | K111: 7 | L111: 8 | M111: 40 | N111: 40 | O111: 40 | P111: 40 | Q111: 40 | R111: 40 | S111: 14 | T111: 10 | U111: 1 | V111: 20 | W111: 5 | X111: -1 | Y111: -1 | Z111: -1 | AA111: 1026 | AB111: 1 | AC111: Uncommon Magic Wood Short Bow | AE111: Uncommon Leather Helm | AF111: Uncommon Leather Mail | AG111: Uncommon Leather Gauntlets | AH111: Uncommon Leather Boots | AN111: =COUNTIF(knownSpells_humans!C[-39],RC[-1]) -> 0
A112: 0 | B112: M_Brigand3 | C112: 25 | D112: 30 | E112: 35 | F112: 40 | G112: 68 | H112: 216 | I112: 18 | J112: 18 | K112: 7 | L112: 6 | M112: 40 | N112: 40 | O112: 40 | P112: 40 | Q112: 40 | R112: 40 | S112: 24 | T112: 3 | U112: 1 | V112: -1 | W112: -1 | X112: -1 | Y112: -1 | Z112: 12 | AA112: 1027 | AB112: 0 | AC112: Rare Magic Wood Shaman Staff {castSpell=Lightning:15} | AE112: Uncommon Dress | AF112: Cape | AG112: Hat | AH112: Uncommon Shoes | AM112: [112] | AN112: =COUNTIF(knownSpells_humans!C[-39],RC[-1]) -> 3
A113: 0 | B113: F_BrigandLeader3 | C113: 40 | D113: 40 | E113: 30 | F113: 35 | G113: 312 | H113: -1 | I113: 20 | J113: 20 | K113: 7 | L113: 8 | M113: 80 | N113: 80 | O113: 80 | P113: 80 | Q113: 80 | R113: 80 | S113: 9 | T113: 25 | U113: 0 | V113: 10 | W113: 4 | X113: -1 | Y113: -1 | Z113: -1 | AA113: 1028 | AB113: 1 | AC113: Uncommon Steel Two Handed Axe | AE113: Uncommon Bronze Helm | AF113: Uncommon Steel Scale Mail | AG113: Uncommon Steel Scale Gauntlets | AH113: Uncommon Bronze Plate Bracers | AI113: Uncommon Bronze Plate Boots | AN113: =COUNTIF(knownSpells_humans!C[-39],RC[-1]) -> 0
A114: 0 | B114: F_Brigand4 | C114: 40 | D114: 40 | E114: 30 | F114: 35 | G114: 312 | H114: -1 | I114: 20 | J114: 20 | K114: 7 | L114: 8 | M114: 80 | N114: 80 | O114: 80 | P114: 80 | Q114: 80 | R114: 80 | S114: 8 | T114: 24 | U114: 0 | V114: -1 | W114: -1 | X114: -1 | Y114: -1 | Z114: -1 | AA114: 1029 | AB114: 1 | AC114: Rare Adamantium Axe | AD114: Uncommon Steel Large Shield | AE114: Uncommon Steel Full Helm | AF114: Uncommon Steel Cuirass | AG114: Uncommon Steel Chain Gauntlets | AH114: Uncommon Steel Scale Mail | AI114: Uncommon Steel Chain Boots | AN114: =COUNTIF(knownSpells_humans!C[-39],RC[-1]) -> 0
A115: 0 | B115: A_Brigand4 | C115: 40 | D115: 45 | E115: 30 | F115: 35 | G115: 312 | H115: -1 | I115: 21 | J115: 21 | K115: 7 | L115: 9 | M115: 80 | N115: 80 | O115: 80 | P115: 80 | Q115: 80 | R115: 80 | S115: 14 | T115: 10 | U115: 1 | V115: 20 | W115: 5 | X115: -1 | Y115: -1 | Z115: -1 | AA115: 1030 | AB115: 1 | AC115: Uncommon Magic Wood Long Bow | AE115: Uncommon Hard Leather Helm | AF115: Uncommon Hard Leather Mail | AG115: Uncommon Hard Leather Gauntlets | AH115: Uncommon Hard Leather Boots | AN115: =COUNTIF(knownSpells_humans!C[-39],RC[-1]) -> 0
A116: 0 | B116: M_Brigand4 | C116: 30 | D116: 35 | E116: 40 | F116: 45 | G116: 117 | H116: 351 | I116: 19 | J116: 19 | K116: 7 | L116: 7 | M116: 80 | N116: 80 | O116: 80 | P116: 80 | Q116: 80 | R116: 80 | S116: 24 | T116: 3 | U116: 1 | V116: -1 | W116: -1 | X116: -1 | Y116: -1 | Z116: 12 | AA116: 1031 | AB116: 0 | AC116: Very Rare Magic Wood Shaman Staff {castSpell=Prismatic_Spray:30} | AE116: Elven Dress | AF116: Elven Cape | AG116: Very Rare Hat | AH116: Elven Gloves | AI116: Elven Shoes | AM116: [116] | AN116: =COUNTIF(knownSpells_humans!C[-39],RC[-1]) -> 3
A117: 0 | B117: F_BrigandLeader4 | C117: 45 | D117: 45 | E117: 35 | F117: 40 | G117: 402 | H117: -1 | I117: 21 | J117: 21 | K117: 7 | L117: 9 | M117: 99 | N117: 99 | O117: 99 | P117: 99 | Q117: 99 | R117: 99 | S117: 9 | T117: 25 | U117: 0 | V117: 10 | W117: 4 | X117: -1 | Y117: -1 | Z117: -1 | AA117: 1032 | AB117: 1 | AC117: Rare Adamantium Two Handed Axe | AE117: Uncommon Steel Full Helm | AF117: Uncommon Steel Cuirass | AG117: Uncommon Steel Chain Gauntlets | AH117: Uncommon Steel Scale Mail | AI117: Uncommon Steel Chain Boots | AN117: =COUNTIF(knownSpells_humans!C[-39],RC[-1]) -> 0
A118: 0 | B118: M_EvilMale1 | C118: 20 | D118: 25 | E118: 30 | F118: 35 | G118: 48 | H118: 168 | I118: 17 | J118: 17 | K118: 6 | L118: 5 | M118: 30 | N118: 20 | O118: 20 | P118: 0 | Q118: 0 | R118: 0 | S118: 24 | T118: 9 | U118: 0 | V118: -1 | W118: -1 | X118: -1 | Y118: -1 | Z118: 12 | AA118: 1033 | AB118: 0 | AC118: Wood Shaman Staff {castSpell=Fire_Arrow:5} | AE118: Robe | AM118: [118] | AN118: =COUNTIF(knownSpells_humans!C[-39],RC[-1]) -> 2
A119: 0 | B119: M_EvilFemale1 | C119: 20 | D119: 25 | E119: 30 | F119: 35 | G119: 48 | H119: 168 | I119: 17 | J119: 17 | K119: 6 | L119: 5 | M119: 30 | N119: 20 | O119: 20 | P119: 0 | Q119: 0 | R119: 0 | S119: 24 | T119: 3 | U119: 1 | V119: -1 | W119: -1 | X119: -1 | Y119: -1 | Z119: 12 | AA119: 1034 | AB119: 0 | AC119: Wood Shaman Staff {castSpell=Fire_Arrow:5} | AE119: Robe | AM119: [119] | AN119: =COUNTIF(knownSpells_humans!C[-39],RC[-1]) -> 2
A120: 0 | B120: M_EvilMale2 | C120: 25 | D120: 30 | E120: 35 | F120: 40 | G120: 75 | H120: 240 | I120: 18 | J120: 18 | K120: 7 | L120: 6 | M120: 50 | N120: 40 | O120: 40 | P120: 30 | Q120: 0 | R120: 0 | S120: 24 | T120: 9 | U120: 0 | V120: -1 | W120: -1 | X120: -1 | Y120: -1 | Z120: 12 | AA120: 1035 | AB120: 0 | AC120: Uncommon Wood Shaman Staff {castSpell=Lightning:5} | AE120: Uncommon Robe | AF120: Uncommon Cloak | AM120: [120] | AN120: =COUNTIF(knownSpells_humans!C[-39],RC[-1]) -> 3
A121: 0 | B121: M_EvilFemale2 | C121: 25 | D121: 30 | E121: 35 | F121: 40 | G121: 75 | H121: 240 | I121: 18 | J121: 18 | K121: 7 | L121: 6 | M121: 50 | N121: 50 | O121: 40 | P121: 0 | Q121: 0 | R121: 0 | S121: 24 | T121: 3 | U121: 1 | V121: -1 | W121: -1 | X121: -1 | Y121: -1 | Z121: 12 | AA121: 1036 | AB121: 0 | AC121: Uncommon Wood Shaman Staff {castSpell=Fire_Arrow:25} | AE121: Uncommon Robe | AF121: Uncommon Cloak | AM121: [121] | AN121: =COUNTIF(knownSpells_humans!C[-39],RC[-1]) -> 2
A122: 0 | B122: M_EvilMale3 | C122: 30 | D122: 35 | E122: 40 | F122: 45 | G122: 117 | H122: 351 | I122: 19 | J122: 19 | K122: 7 | L122: 7 | M122: 80 | N122: 60 | O122: 60 | P122: 50 | Q122: 0 | R122: 0 | S122: 24 | T122: 9 | U122: 0 | V122: -1 | W122: -1 | X122: -1 | Y122: -1 | Z122: 12 | AA122: 1037 | AB122: 0 | AC122: Rare Magic Wood Shaman Staff {castSpell=Lightning:25} | AE122: Uncommon Dress | AF122: Rare Cape | AG122: Shoes | AM122: [122] | AN122: =COUNTIF(knownSpells_humans!C[-39],RC[-1]) -> 3
A123: 0 | B123: M_EvilFemale3 | C123: 30 | D123: 35 | E123: 40 | F123: 45 | G123: 117 | H123: 351 | I123: 19 | J123: 19 | K123: 7 | L123: 7 | M123: 80 | N123: 60 | O123: 60 | P123: 50 | Q123: 0 | R123: 0 | S123: 24 | T123: 3 | U123: 1 | V123: -1 | W123: -1 | X123: -1 | Y123: -1 | Z123: 12 | AA123: 1038 | AB123: 0 | AC123: Rare Magic Wood Shaman Staff {castSpell=Fire_Arrow:70} | AE123: Uncommon Dress | AF123: Rare Cape | AG123: Shoes | AM123: [123] | AN123: =COUNTIF(knownSpells_humans!C[-39],RC[-1]) -> 3
A124: 0 | B124: M_EvilMale4 | C124: 35 | D124: 40 | E124: 45 | F124: 50 | G124: 156 | H124: 447 | I124: 20 | J124: 20 | K124: 7 | L124: 8 | M124: 99 | N124: 80 | O124: 80 | P124: 80 | Q124: 50 | R124: 0 | S124: 24 | T124: 9 | U124: 0 | V124: -1 | W124: -1 | X124: -1 | Y124: -1 | Z124: 12 | AA124: 1039 | AB124: 0 | AC124: Very Rare Magic Wood Shaman Staff {castSpell=Prismatic_Spray:30} | AE124: Very Rare Dress | AF124: Very Rare Cape | AG124: Very Rare Gloves | AH124: Very Rare Shoes | AM124: [124] | AN124: =COUNTIF(knownSpells_humans!C[-39],RC[-1]) -> 4
A125: 0 | B125: M_EvilFemale4 | C125: 35 | D125: 40 | E125: 45 | F125: 50 | G125: 156 | H125: 447 | I125: 20 | J125: 20 | K125: 7 | L125: 8 | M125: 99 | N125: 80 | O125: 80 | P125: 80 | Q125: 50 | R125: 0 | S125: 24 | T125: 3 | U125: 1 | V125: -1 | W125: -1 | X125: -1 | Y125: -1 | Z125: 12 | AA125: 1040 | AB125: 0 | AC125: Very Rare Magic Wood Shaman Staff {castSpell=Lightning:60} | AE125: Very Rare Dress | AF125: Very Rare Cape | AG125: Very Rare Gloves | AH125: Very Rare Shoes | AM125: [125] | AN125: =COUNTIF(knownSpells_humans!C[-39],RC[-1]) -> 4
A126: 0 | B126: F_Knight1 | C126: 30 | D126: 30 | E126: 20 | F126: 20 | G126: 126 | H126: -1 | I126: 18 | J126: 18 | K126: 6 | L126: 6 | M126: 20 | N126: 20 | O126: 0 | P126: 0 | Q126: 0 | R126: 0 | S126: 4 | T126: 30 | U126: 0 | V126: 7 | W126: 4 | X126: -1 | Y126: -1 | Z126: -1 | AA126: 1041 | AB126: 1 | AC126: Bronze Short Sword | AD126: Leather Small Shield | AE126: Leather Helm | AF126: Leather Mail | AG126: Leather Bracers | AH126: Leather Boots | AN126: =COUNTIF(knownSpells_humans!C[-39],RC[-1]) -> 0
A127: 0 | B127: A_Knight1 | C127: 30 | D127: 30 | E127: 20 | F127: 20 | G127: 126 | H127: -1 | I127: 18 | J127: 18 | K127: 6 | L127: 6 | M127: 20 | N127: 0 | O127: 0 | P127: 0 | Q127: 0 | R127: 20 | S127: 15 | T127: 4 | U127: 1 | V127: 8 | W127: 16 | X127: -1 | Y127: -1 | Z127: -1 | AA127: 1042 | AB127: 1 | AC127: Wood Crossbow | AE127: Leather Mail | AF127: Leather Boots | AN127: =COUNTIF(knownSpells_humans!C[-39],RC[-1]) -> 0
A128: 0 | B128: H_Knight1 | C128: 30 | D128: 30 | E128: 20 | F128: 20 | G128: 126 | H128: -1 | I128: 18 | J128: 18 | K128: 6 | L128: 6 | M128: 20 | N128: 0 | O128: 0 | P128: 0 | Q128: 20 | R128: 0 | S128: 21 | T128: 30 | U128: 0 | V128: 10 | W128: 4 | X128: 1 | Y128: -1 | Z128: -1 | AA128: 1043 | AB128: 1 | AC128: Bronze Lance | AD128: Leather Small Shield | AE128: Leather Helm | AF128: Leather Mail | AG128: Leather Bracers | AH128: Leather Boots | AN128: =COUNTIF(knownSpells_humans!C[-39],RC[-1]) -> 0
A129: 0 | B129: M_Knight1 | C129: 20 | D129: 20 | E129: 30 | F129: 30 | G129: 42 | H129: 126 | I129: 16 | J129: 16 | K129: 6 | L129: 4 | M129: 20 | N129: 20 | O129: 20 | P129: 0 | Q129: 0 | R129: 0 | S129: 24 | T129: 5 | U129: 1 | V129: -1 | W129: -1 | X129: -1 | Y129: -1 | Z129: 12 | AA129: 1044 | AB129: 0 | AC129: Wood Staff {castSpell=Fire_Arrow:5} | AE129: Robe | AF129: Cloak | AM129: [129] | AN129: =COUNTIF(knownSpells_humans!C[-39],RC[-1]) -> 2
A130: 0 | B130: F_KnightLeader1 | C130: 35 | D130: 35 | E130: 25 | F130: 25 | G130: 189 | H130: -1 | I130: 19 | J130: 19 | K130: 6 | L130: 7 | M130: 40 | N130: 40 | O130: 0 | P130: 0 | Q130: 0 | R130: 0 | S130: 5 | T130: 30 | U130: 0 | V130: 10 | W130: 4 | X130: -1 | Y130: -1 | Z130: -1 | AA130: 1045 | AB130: 1 | AC130: Bronze Two Handed Sword | AE130: Leather Helm | AF130: Leather Mail | AG130: Leather Bracers | AH130: Leather Gauntless | AI130: Leather Boots | AN130: =COUNTIF(knownSpells_humans!C[-39],RC[-1]) -> 0
A131: 0 | B131: F_Knight2 | C131: 35 | D131: 35 | E131: 25 | F131: 25 | G131: 189 | H131: -1 | I131: 19 | J131: 19 | K131: 6 | L131: 7 | M131: 40 | N131: 40 | O131: 0 | P131: 0 | Q131: 0 | R131: 0 | S131: 4 | T131: 7 | U131: 0 | V131: 7 | W131: 4 | X131: -1 | Y131: -1 | Z131: -1 | AA131: 1046 | AB131: 1 | AC131: Iron Short Sword | AD131: Hard Leather Large Shield | AE131: Uncommon Hard Leather Helm | AF131: Uncommon Hard Leather Mail | AG131: Uncommon Hard Leather Bracers | AH131: Uncommon Hard Leather Gauntlets | AI131: Uncommon Hard Leather Boots | AN131: =COUNTIF(knownSpells_humans!C[-39],RC[-1]) -> 0
A132: 0 | B132: A_Knight2 | C132: 35 | D132: 35 | E132: 25 | F132: 25 | G132: 189 | H132: -1 | I132: 19 | J132: 19 | K132: 6 | L132: 7 | M132: 40 | N132: 0 | O132: 0 | P132: 0 | Q132: 0 | R132: 40 | S132: 15 | T132: 4 | U132: 1 | V132: 8 | W132: 16 | X132: -1 | Y132: -1 | Z132: -1 | AA132: 1047 | AB132: 1 | AC132: Wood Crossbow | AE132: Uncommon Hard Leather Helm | AF132: Uncommon Hard Leather Mail | AG132: Uncommon Hard Leather Bracers | AH132: Uncommon Hard Leather Gauntlets | AI132: Uncommon Hard Leather Boots | AN132: =COUNTIF(knownSpells_humans!C[-39],RC[-1]) -> 0
A133: 0 | B133: H_Knight2 | C133: 35 | D133: 35 | E133: 25 | F133: 25 | G133: 189 | H133: -1 | I133: 19 | J133: 19 | K133: 6 | L133: 7 | M133: 40 | N133: 0 | O133: 0 | P133: 0 | Q133: 40 | R133: 0 | S133: 21 | T133: 7 | U133: 0 | V133: 10 | W133: 4 | X133: 1 | Y133: -1 | Z133: -1 | AA133: 1048 | AB133: 1 | AC133: Bronze Lance | AD133: Hard Leather Large Shield | AE133: Uncommon Hard Leather Helm | AF133: Uncommon Hard Leather Mail | AG133: Uncommon Hard Leather Bracers | AH133: Uncommon Hard Leather Gauntlets | AI133: Uncommon Hard Leather Boots | AN133: =COUNTIF(knownSpells_humans!C[-39],RC[-1]) -> 0
A134: 0 | B134: M_Knight2 | C134: 25 | D134: 25 | E134: 35 | F134: 35 | G134: 68 | H134: 189 | I134: 17 | J134: 17 | K134: 6 | L134: 5 | M134: 40 | N134: 40 | O134: 40 | P134: 0 | Q134: 0 | R134: 0 | S134: 24 | T134: 5 | U134: 1 | V134: -1 | W134: -1 | X134: -1 | Y134: -1 | Z134: 12 | AA134: 1049 | AB134: 0 | AC134: Uncommon Wood Staff {castSpell=Fire_Arrow:35} | AE134: Uncommon Robe | AF134: Uncommon Cloak | AM134: [134] | AN134: =COUNTIF(knownSpells_humans!C[-39],RC[-1]) -> 2
A135: 0 | B135: F_KnightLeader2 | C135: 40 | D135: 40 | E135: 30 | F135: 30 | G135: 264 | H135: -1 | I135: 20 | J135: 20 | K135: 7 | L135: 8 | M135: 60 | N135: 60 | O135: 0 | P135: 0 | Q135: 0 | R135: 0 | S135: 5 | T135: 7 | U135: 0 | V135: 10 | W135: 4 | X135: -1 | Y135: -1 | Z135: -1 | AA135: 1050 | AB135: 1 | AC135: Uncommon Bronze Two Handed Sword | AF135: Uncommon Hard Leather Helm | AG135: Uncommon Hard Leather Mail | AH135: Uncommon Hard Leather Bracers | AI135: Uncommon Hard Leather Gauntlets | AJ135: Uncommon Hard Leather Boots | AN135: =COUNTIF(knownSpells_humans!C[-39],RC[-1]) -> 0
A136: 0 | B136: F_Knight3 | C136: 40 | D136: 40 | E136: 30 | F136: 30 | G136: 264 | H136: -1 | I136: 20 | J136: 20 | K136: 7 | L136: 8 | M136: 60 | N136: 60 | O136: 0 | P136: 0 | Q136: 0 | R136: 0 | S136: 4 | T136: 30 | U136: 0 | V136: 7 | W136: 4 | X136: -1 | Y136: -1 | Z136: -1 | AA136: 1051 | AB136: 1 | AC136: Uncommon Steel Long Sword | AD136: Uncommon Bronze Small Shield | AE136: Uncommon Bronze Plate Helm | AF136: Uncommon Steel Scale Mail | AG136: Uncommon Bronze Plate Cuirass | AH136: Uncommon Bronze Plate Bracers | AI136: Uncommon Steel Scale Gauntlets | AJ136: Uncommon Bronze Plate Boots | AN136: =COUNTIF(knownSpells_humans!C[-39],RC[-1]) -> 0
A137: 0 | B137: A_Knight3 | C137: 40 | D137: 40 | E137: 30 | F137: 30 | G137: 264 | H137: -1 | I137: 20 | J137: 20 | K137: 7 | L137: 8 | M137: 60 | N137: 0 | O137: 0 | P137: 0 | Q137: 0 | R137: 60 | S137: 15 | T137: 4 | U137: 1 | V137: 8 | W137: 16 | X137: -1 | Y137: -1 | Z137: -1 | AA137: 1052 | AB137: 1 | AC137: Wood Crossbow | AE137: Uncommon Steel Chain Helm | AF137: Rare Mithrill Chain Mail | AG137: Uncommon Steel Bracers | AH137: Uncommon Steel Chain Gauntlets | AI137: Uncommon Steel Chain Boots | AN137: =COUNTIF(knownSpells_humans!C[-39],RC[-1]) -> 0
A138: 0 | B138: H_Knight3 | C138: 40 | D138: 40 | E138: 30 | F138: 30 | G138: 264 | H138: -1 | I138: 20 | J138: 20 | K138: 7 | L138: 8 | M138: 60 | N138: 0 | O138: 0 | P138: 0 | Q138: 60 | R138: 0 | S138: 21 | T138: 30 | U138: 0 | V138: 10 | W138: 4 | X138: 1 | Y138: -1 | Z138: -1 | AA138: 1053 | AB138: 1 | AC138: Uncommon Steel Halberd | AD138: Uncommon Bronze Small Shield | AE138: Uncommon Bronze Plate Helm | AF138: Uncommon Steel Scale Mail | AG138: Uncommon Bronze Plate Cuirass | AH138: Uncommon Bronze Plate Bracers | AI138: Uncommon Steel Scale Gauntlets | AJ138: Uncommon Bronze Plate Boots | AN138: =COUNTIF(knownSpells_humans!C[-39],RC[-1]) -> 0
A139: 0 | B139: M_Knight3 | C139: 30 | D139: 30 | E139: 40 | F139: 40 | G139: 99 | H139: 264 | I139: 18 | J139: 18 | K139: 7 | L139: 6 | M139: 60 | N139: 0 | O139: 60 | P139: 60 | Q139: 0 | R139: 0 | S139: 24 | T139: 5 | U139: 1 | V139: -1 | W139: -1 | X139: -1 | Y139: -1 | Z139: 12 | AA139: 1054 | AB139: 0 | AC139: Very Rare Magic Wood Staff {castSpell=Lightning:25} | AE139: Very Rare Low Hat | AF139: Rare Dress | AG139: Rare Cloak | AH139: Shoes | AM139: [139] | AN139: =COUNTIF(knownSpells_humans!C[-39],RC[-1]) -> 2
A140: 0 | B140: F_KnightLeader3 | C140: 45 | D140: 45 | E140: 35 | F140: 35 | G140: 351 | H140: -1 | I140: 21 | J140: 21 | K140: 7 | L140: 9 | M140: 80 | N140: 80 | O140: 0 | P140: 0 | Q140: 0 | R140: 0 | S140: 5 | T140: 30 | U140: 0 | V140: 10 | W140: 4 | X140: -1 | Y140: -1 | Z140: -1 | AA140: 1055 | AB140: 1 | AC140: Uncommon Steel Two Handed Sword | AE140: Uncommon Bronze Plate Helm | AF140: Uncommon Steel Scale Mail | AG140: Uncommon Bronze Plate Cuirass | AH140: Uncommon Bronze Plate Bracers | AI140: Uncommon Steel Scale Gauntlets | AJ140: Uncommon Bronze Plate Boots | AN140: =COUNTIF(knownSpells_humans!C[-39],RC[-1]) -> 0
A141: 0 | B141: F_Knight4 | C141: 45 | D141: 45 | E141: 35 | F141: 35 | G141: 351 | H141: -1 | I141: 21 | J141: 21 | K141: 7 | L141: 9 | M141: 80 | N141: 80 | O141: 0 | P141: 0 | Q141: 0 | R141: 0 | S141: 4 | T141: 7 | U141: 0 | V141: 7 | W141: 4 | X141: -1 | Y141: -1 | Z141: -1 | AA141: 1056 | AB141: 1 | AC141: Uncommon Steel Long Sword | AD141: Uncommon Steel Small Shield | AE141: Rare Mithrill Plate Helm | AF141: Rare Mithrill Chain Mail | AG141: Rare Mithrill Plate Cuirass | AH141: Rare Mithrill Plate Bracers | AI141: Rare Mithrill Scale Gauntlets | AJ141: Rare Mithrill Plate Boots | AN141: =COUNTIF(knownSpells_humans!C[-39],RC[-1]) -> 0
A142: 0 | B142: A_Knight4 | C142: 45 | D142: 45 | E142: 35 | F142: 35 | G142: 351 | H142: -1 | I142: 21 | J142: 21 | K142: 7 | L142: 9 | M142: 80 | N142: 0 | O142: 0 | P142: 0 | Q142: 0 | R142: 80 | S142: 15 | T142: 4 | U142: 1 | V142: 8 | W142: 16 | X142: -1 | Y142: -1 | Z142: -1 | AA142: 1057 | AB142: 1 | AC142: Uncommon Steel Crossbow | AE142: Rare Mithrill Chain Helm | AF142: Rare Adamantium Scale Mail | AG142: Rare Mithrill Cuirass | AH142: Rare Mithrill Bracers | AI142: Rare Mithrill Scale Gauntlets | AJ142: Rare Mithrill Chain Boots | AN142: =COUNTIF(knownSpells_humans!C[-39],RC[-1]) -> 0
A143: 0 | B143: H_Knight4 | C143: 45 | D143: 45 | E143: 35 | F143: 35 | G143: 351 | H143: -1 | I143: 21 | J143: 21 | K143: 7 | L143: 9 | M143: 80 | N143: 0 | O143: 0 | P143: 0 | Q143: 80 | R143: 0 | S143: 21 | T143: 7 | U143: 0 | V143: 10 | W143: 4 | X143: 1 | Y143: -1 | Z143: -1 | AA143: 1058 | AB143: 1 | AC143: Rare Mithrill Halberd | AD143: Uncommon Steel Large Shield | AE143: Rare Mithrill Chain Helm | AF143: Rare Mithrill Scale Mail | AG143: Rare Mithrill Cuirass | AH143: Rare Mithrill Bracers | AI143: Rare Mithrill Chain Gauntlets | AJ143: Rare Mithrill Chain Boots | AN143: =COUNTIF(knownSpells_humans!C[-39],RC[-1]) -> 0
A144: 0 | B144: M_Knight4 | C144: 35 | D144: 35 | E144: 45 | F144: 45 | G144: 137 | H144: 351 | I144: 19 | J144: 19 | K144: 7 | L144: 7 | M144: 80 | N144: 0 | O144: 80 | P144: 80 | Q144: 0 | R144: 0 | S144: 24 | T144: 5 | U144: 1 | V144: -1 | W144: -1 | X144: -1 | Y144: -1 | Z144: 12 | AA144: 1059 | AB144: 0 | AC144: Elven Magic Wood Staff {castSpell=Prismatic_Spray:30} | AE144: Very Rare Low Hat | AF144: Very Rare Dress | AG144: Very Rare Cape | AH144: Very Rare Gloves | AI144: Very Rare Shoes | AM144: [144] | AN144: =COUNTIF(knownSpells_humans!C[-39],RC[-1]) -> 1
A145: 0 | B145: F_KnightLeader4 | C145: 50 | D145: 50 | E145: 40 | F145: 40 | G145: 447 | H145: -1 | I145: 22 | J145: 22 | K145: 8 | L145: 10 | M145: 99 | N145: 99 | O145: 0 | P145: 0 | Q145: 0 | R145: 0 | S145: 5 | T145: 7 | U145: 0 | V145: 10 | W145: 4 | X145: -1 | Y145: -1 | Z145: -1 | AA145: 1060 | AB145: 1 | AC145: Rare Mithrill Two Handed Sword | AE145: Rare Mithrill Plate Helm | AF145: Rare Mithrill Chain Mail | AG145: Rare Mithrill Plate Cuirass | AH145: Rare Mithrill Plate Bracers | AI145: Rare Mithrill Scale Gauntlets | AJ145: Rare Mithrill Plate Boots | AN145: =COUNTIF(knownSpells_humans!C[-39],RC[-1]) -> 0
A146: 0 | B146: F_Kadagan1 | C146: 30 | D146: 25 | E146: 15 | F146: 20 | G146: 126 | H146: -1 | I146: 17 | J146: 17 | K146: 6 | L146: 5 | M146: 20 | N146: 20 | O146: 0 | P146: 0 | Q146: 0 | R146: 0 | S146: 4 | T146: 29 | U146: 0 | V146: 7 | W146: 4 | X146: -1 | Y146: -1 | Z146: -1 | AA146: 1061 | AB146: 1 | AC146: Bronze Short Sword | AD146: Leather Small Shield | AE146: Leather Helm | AF146: Leather Mail | AG146: Leather Bracers | AH146: Leather Boots | AN146: =COUNTIF(knownSpells_humans!C[-39],RC[-1]) -> 0
A147: 0 | B147: A_Kadagan1 | C147: 25 | D147: 30 | E147: 25 | F147: 25 | G147: 105 | H147: -1 | I147: 18 | J147: 18 | K147: 6 | L147: 6 | M147: 20 | N147: 0 | O147: 0 | P147: 0 | Q147: 0 | R147: 20 | S147: 15 | T147: 10 | U147: 1 | V147: 8 | W147: 16 | X147: -1 | Y147: -1 | Z147: -1 | AA147: 1062 | AB147: 1 | AC147: Wood Crossbow | AE147: Leather Mail | AF147: Leather Gauntlets | AG147: Leather Boots | AN147: =COUNTIF(knownSpells_humans!C[-39],RC[-1]) -> 0
A148: 0 | B148: M_Kadagan1 | C148: 15 | D148: 20 | E148: 25 | F148: 30 | G148: 32 | H148: 126 | I148: 16 | J148: 16 | K148: 6 | L148: 4 | M148: 20 | N148: 20 | O148: 20 | P148: 0 | Q148: 0 | R148: 0 | S148: 24 | T148: 9 | U148: 0 | V148: -1 | W148: -1 | X148: -1 | Y148: -1 | Z148: 12 | AA148: 1063 | AB148: 0 | AC148: Uncommon Wood Shaman Staff {castSpell=Fire_Arrow:5} | AE148: Robe | AF148: Low Hat | AM148: [148] | AN148: =COUNTIF(knownSpells_humans!C[-39],RC[-1]) -> 2
A149: 0 | B149: F_Kadagan2 | C149: 35 | D149: 30 | E149: 20 | F149: 25 | G149: 189 | H149: -1 | I149: 18 | J149: 18 | K149: 6 | L149: 6 | M149: 40 | N149: 40 | O149: 0 | P149: 0 | Q149: 0 | R149: 0 | S149: 4 | T149: 29 | U149: 0 | V149: 7 | W149: 4 | X149: -1 | Y149: -1 | Z149: -1 | AA149: 1064 | AB149: 1 | AC149: Iron Short Sword | AD149: Hard Leather Large Shield | AE149: Uncommon Hard Leather Helm | AF149: Uncommon Hard Leather Mail | AG149: Uncommon Hard Leather Bracers | AH149: Uncommon Hard Leather Gauntlets | AI149: Uncommon Hard Leather Boots | AN149: =COUNTIF(knownSpells_humans!C[-39],RC[-1]) -> 0
A150: 0 | B150: A_Kadagan2 | C150: 30 | D150: 35 | E150: 20 | F150: 25 | G150: 162 | H150: -1 | I150: 19 | J150: 19 | K150: 6 | L150: 7 | M150: 40 | N150: 0 | O150: 0 | P150: 0 | Q150: 0 | R150: 40 | S150: 15 | T150: 10 | U150: 1 | V150: 8 | W150: 16 | X150: -1 | Y150: -1 | Z150: -1 | AA150: 1065 | AB150: 1 | AC150: Wood Crossbow | AE150: Uncommon Hard Leather Helm | AF150: Uncommon Hard Leather Mail | AG150: Uncommon Hard Leather Bracers | AH150: Uncommon Hard Leather Gauntlets | AI150: Uncommon Hard Leather Boots | AN150: =COUNTIF(knownSpells_humans!C[-39],RC[-1]) -> 0
A151: 0 | B151: M_Kadagan2 | C151: 20 | D151: 25 | E151: 30 | F151: 35 | G151: 54 | H151: 189 | I151: 17 | J151: 17 | K151: 6 | L151: 5 | M151: 40 | N151: 40 | O151: 40 | P151: 0 | Q151: 0 | R151: 0 | S151: 24 | T151: 9 | U151: 0 | V151: -1 | W151: -1 | X151: -1 | Y151: -1 | Z151: 12 | AA151: 1066 | AB151: 0 | AC151: Wood Staff {castSpell=Fire_Arrow:50} | AE151: Uncommon Robe | AF151: Rare Low Hat | AM151: [151] | AN151: =COUNTIF(knownSpells_humans!C[-39],RC[-1]) -> 2
A152: 0 | B152: F_Kadagan3 | C152: 40 | D152: 35 | E152: 25 | F152: 30 | G152: 264 | H152: -1 | I152: 19 | J152: 19 | K152: 6 | L152: 7 | M152: 60 | N152: 60 | O152: 0 | P152: 0 | Q152: 0 | R152: 0 | S152: 4 | T152: 29 | U152: 0 | V152: 7 | W152: 4 | X152: -1 | Y152: -1 | Z152: -1 | AA152: 1067 | AB152: 1 | AC152: Uncommon Steel Long Sword | AD152: Uncommon Bronze Small Shield | AE152: Uncommon Bronze Plate Helm | AF152: Uncommon Steel Scale Mail | AG152: Uncommon Bronze Plate Cuirass | AH152: Uncommon Bronze Plate Bracers | AI152: Uncommon Steel Scale Gauntlets | AJ152: Uncommon Bronze Plate Boots | AN152: =COUNTIF(knownSpells_humans!C[-39],RC[-1]) -> 0
A153: 0 | B153: A_Kadagan3 | C153: 35 | D153: 40 | E153: 25 | F153: 30 | G153: 231 | H153: -1 | I153: 20 | J153: 20 | K153: 7 | L153: 8 | M153: 60 | N153: 0 | O153: 0 | P153: 0 | Q153: 0 | R153: 60 | S153: 15 | T153: 10 | U153: 1 | V153: 8 | W153: 16 | X153: -1 | Y153: -1 | Z153: -1 | AA153: 1068 | AB153: 1 | AC153: Wood Crossbow | AE153: Uncommon Steel Chain Helm | AF153: Rare Mithrill Chain Mail | AG153: Uncommon Steel Bracers | AH153: Uncommon Steel Chain Gauntlets | AI153: Uncommon Steel Chain Boots | AN153: =COUNTIF(knownSpells_humans!C[-39],RC[-1]) -> 0
A154: 0 | B154: M_Kadagan3 | C154: 25 | D154: 30 | E154: 35 | F154: 40 | G154: 83 | H154: 264 | I154: 18 | J154: 18 | K154: 7 | L154: 6 | M154: 60 | N154: 0 | O154: 60 | P154: 60 | Q154: 0 | R154: 0 | S154: 24 | T154: 9 | U154: 0 | V154: -1 | W154: -1 | X154: -1 | Y154: -1 | Z154: 12 | AA154: 1069 | AB154: 0 | AC154: Wood Staff {castSpell=Lightning:30} | AE154: Rare Robe | AF154: Rare Low Hat | AG154: Rare Cape | AM154: [154] | AN154: =COUNTIF(knownSpells_humans!C[-39],RC[-1]) -> 2
A155: 0 | B155: F_Kadagan4 | C155: 45 | D155: 40 | E155: 30 | F155: 35 | G155: 351 | H155: -1 | I155: 20 | J155: 20 | K155: 7 | L155: 8 | M155: 80 | N155: 80 | O155: 0 | P155: 0 | Q155: 0 | R155: 0 | S155: 4 | T155: 29 | U155: 0 | V155: 7 | W155: 4 | X155: -1 | Y155: -1 | Z155: -1 | AA155: 1070 | AB155: 1 | AC155: Uncommon Steel Long Sword | AD155: Uncommon Steel Small Shield | AE155: Rare Mithrill Plate Helm | AF155: Rare Mithrill Chain Mail | AG155: Rare Mithrill Plate Cuirass | AH155: Rare Mithrill Plate Bracers | AI155: Rare Mithrill Scale Gauntlets | AJ155: Rare Mithrill Plate Boots | AN155: =COUNTIF(knownSpells_humans!C[-39],RC[-1]) -> 0
A156: 0 | B156: A_Kadagan4 | C156: 40 | D156: 45 | E156: 30 | F156: 35 | G156: 312 | H156: -1 | I156: 21 | J156: 21 | K156: 7 | L156: 9 | M156: 80 | N156: 0 | O156: 0 | P156: 0 | Q156: 0 | R156: 80 | S156: 15 | T156: 10 | U156: 1 | V156: 8 | W156: 16 | X156: -1 | Y156: -1 | Z156: -1 | AA156: 1071 | AB156: 1 | AC156: Uncommon Steel Crossbow | AE156: Rare Mithrill Chain Helm | AF156: Rare Adamantium Scale Mail | AG156: Rare Mithrill Cuirass | AH156: Rare Mithrill Bracers | AI156: Rare Mithrill Scale Gauntlets | AJ156: Rare Mithrill Chain Boots | AN156: =COUNTIF(knownSpells_humans!C[-39],RC[-1]) -> 0
A157: 0 | B157: M_Kadagan4 | C157: 30 | D157: 35 | E157: 40 | F157: 45 | G157: 117 | H157: 351 | I157: 19 | J157: 19 | K157: 7 | L157: 7 | M157: 80 | N157: 0 | O157: 80 | P157: 80 | Q157: 0 | R157: 0 | S157: 24 | T157: 9 | U157: 0 | V157: -1 | W157: -1 | X157: -1 | Y157: -1 | Z157: 12 | AA157: 1072 | AB157: 0 | AC157: Wood Staff {castSpell=Lightning:70} | AE157: Rare Robe | AF157: Rare Low Hat | AG157: Rare Cape | AH157: Rare Gloves | AI157: Rare Shoes | AM157: [157] | AN157: =COUNTIF(knownSpells_humans!C[-39],RC[-1]) -> 2
A158: 0 | B158: F_Monk | C158: 30 | D158: 25 | E158: 20 | F158: 25 | G158: 162 | H158: -1 | I158: 17 | J158: 17 | K158: 6 | L158: 5 | M158: 40 | N158: 0 | O158: 0 | P158: 50 | Q158: 0 | R158: 0 | S158: 11 | T158: 20 | U158: 0 | V158: 7 | W158: 4 | X158: -1 | Y158: -1 | Z158: -1 | AA158: 1073 | AB158: 1 | AC158: Common Iron Morning Star | AD158: Leather Large Shield | AN158: =COUNTIF(knownSpells_humans!C[-39],RC[-1]) -> 0
A159: 0 | B159: F_MonkLeader | C159: 40 | D159: 35 | E159: 30 | F159: 35 | G159: 312 | H159: -1 | I159: 19 | J159: 19 | K159: 7 | L159: 7 | M159: 80 | N159: 0 | O159: 0 | P159: 80 | Q159: 0 | R159: 0 | S159: 11 | T159: 20 | U159: 0 | V159: 7 | W159: 4 | X159: -1 | Y159: -1 | Z159: -1 | AA159: 1074 | AB159: 1 | AC159: Uncommon Steel Morning Star | AD159: Leather Large Shield | AN159: =COUNTIF(knownSpells_humans!C[-39],RC[-1]) -> 0
A160: 0 | B160: M_GoodMale1 | C160: 20 | D160: 25 | E160: 30 | F160: 35 | G160: 48 | H160: 168 | I160: 17 | J160: 17 | K160: 6 | L160: 5 | M160: 30 | N160: 20 | O160: 20 | P160: 0 | Q160: 0 | R160: 0 | S160: 24 | T160: 12 | U160: 0 | V160: -1 | W160: -1 | X160: -1 | Y160: -1 | Z160: 12 | AA160: 1075 | AB160: 0 | AC160: Wood Staff {castSpell=Fire_Arrow:5} | AE160: Robe | AF160: Cloak | AM160: [160] | AN160: =COUNTIF(knownSpells_humans!C[-39],RC[-1]) -> 2
A161: 0 | B161: M_GoodFemale1 | C161: 20 | D161: 25 | E161: 30 | F161: 35 | G161: 48 | H161: 168 | I161: 17 | J161: 17 | K161: 6 | L161: 5 | M161: 30 | N161: 20 | O161: 20 | P161: 0 | Q161: 0 | R161: 0 | S161: 24 | T161: 5 | U161: 1 | V161: -1 | W161: -1 | X161: -1 | Y161: -1 | Z161: 12 | AA161: 1076 | AB161: 0 | AC161: Wood Staff {castSpell=Fire_Arrow:5} | AE161: Robe | AF161: Cloak | AM161: [161] | AN161: =COUNTIF(knownSpells_humans!C[-39],RC[-1]) -> 2
A162: 0 | B162: M_GoodMale2 | C162: 25 | D162: 30 | E162: 35 | F162: 40 | G162: 75 | H162: 240 | I162: 18 | J162: 18 | K162: 7 | L162: 6 | M162: 50 | N162: 40 | O162: 40 | P162: 0 | Q162: 0 | R162: 0 | S162: 24 | T162: 12 | U162: 0 | V162: -1 | W162: -1 | X162: -1 | Y162: -1 | Z162: 12 | AA162: 1077 | AB162: 0 | AC162: Uncommon Wood Staff {castSpell=Lightning:10} | AE162: Uncommon Robe | AF162: Uncommon Cloak | AM162: [162] | AN162: =COUNTIF(knownSpells_humans!C[-39],RC[-1]) -> 2
A163: 0 | B163: M_GoodFemale2 | C163: 25 | D163: 30 | E163: 35 | F163: 40 | G163: 75 | H163: 240 | I163: 18 | J163: 18 | K163: 7 | L163: 6 | M163: 50 | N163: 40 | O163: 40 | P163: 0 | Q163: 0 | R163: 0 | S163: 24 | T163: 5 | U163: 1 | V163: -1 | W163: -1 | X163: -1 | Y163: -1 | Z163: 12 | AA163: 1078 | AB163: 0 | AC163: Uncommon Wood Staff {castSpell=Fire_Arrow:35} | AE163: Uncommon Robe | AF163: Uncommon Cloak | AM163: [163] | AN163: =COUNTIF(knownSpells_humans!C[-39],RC[-1]) -> 2
A164: 0 | B164: M_GoodMale3 | C164: 30 | D164: 35 | E164: 40 | F164: 45 | G164: 117 | H164: 351 | I164: 19 | J164: 19 | K164: 7 | L164: 7 | M164: 80 | N164: 0 | O164: 70 | P164: 70 | Q164: 0 | R164: 0 | S164: 24 | T164: 12 | U164: 0 | V164: -1 | W164: -1 | X164: -1 | Y164: -1 | Z164: 12 | AA164: 1079 | AB164: 0 | AC164: Very Rare Magic Wood Staff {castSpell=Lightning:25} | AE164: Uncommon Robe | AF164: Uncommon Cape | AG164: Hat | AH164: Uncommon Gloves | AI164: Uncommon Shoes | AM164: [164] | AN164: =COUNTIF(knownSpells_humans!C[-39],RC[-1]) -> 2
A165: 0 | B165: M_GoodFemale3 | C165: 30 | D165: 35 | E165: 40 | F165: 45 | G165: 117 | H165: 351 | I165: 19 | J165: 19 | K165: 7 | L165: 7 | M165: 80 | N165: 0 | O165: 70 | P165: 70 | Q165: 0 | R165: 0 | S165: 24 | T165: 5 | U165: 1 | V165: -1 | W165: -1 | X165: -1 | Y165: -1 | Z165: 12 | AA165: 1080 | AB165: 0 | AC165: Very Rare Magic Wood Staff {castSpell=Fire_Arrow:70} | AE165: Uncommon Dress | AF165: Uncommon Cape | AM165: [165] | AN165: =COUNTIF(knownSpells_humans!C[-39],RC[-1]) -> 2
A166: 0 | B166: M_GoodMale4 | C166: 35 | D166: 40 | E166: 45 | F166: 50 | G166: 156 | H166: 447 | I166: 20 | J166: 20 | K166: 7 | L166: 8 | M166: 99 | N166: 0 | O166: 99 | P166: 99 | Q166: 0 | R166: 0 | S166: 24 | T166: 12 | U166: 0 | V166: -1 | W166: -1 | X166: -1 | Y166: -1 | Z166: 12 | AA166: 1081 | AB166: 0 | AC166: Elven Magic Wood Staff {castSpell=Prismatic_Spray:30} | AE166: Rare Dress | AF166: Very Rare Cape | AG166: Hat | AH166: Very Rare Gloves | AI166: Very Rare Shoes | AM166: [166] | AN166: =COUNTIF(knownSpells_humans!C[-39],RC[-1]) -> 3
A167: 0 | B167: M_GoodFemale4 | C167: 35 | D167: 40 | E167: 45 | F167: 50 | G167: 156 | H167: 447 | I167: 20 | J167: 20 | K167: 7 | L167: 8 | M167: 99 | N167: 0 | O167: 99 | P167: 99 | Q167: 0 | R167: 0 | S167: 24 | T167: 5 | U167: 1 | V167: -1 | W167: -1 | X167: -1 | Y167: -1 | Z167: 12 | AA167: 1082 | AB167: 0 | AC167: Elven Magic Wood Staff {castSpell=Stone_Curse:30} | AE167: Elven Dress | AF167: Elven Cape | AG167: Very Rare Hat | AH167: Elven Gloves | AI167: Elven Shoes | AM167: [167] | AN167: =COUNTIF(knownSpells_humans!C[-39],RC[-1]) -> 3
A168: 0 | B168: U_FemalePeasant1 | C168: 15 | D168: 20 | E168: 25 | F168: 25 | G168: 45 | H168: -1 | I168: 16 | J168: 16 | K168: 6 | L168: 4 | M168: 0 | N168: 0 | O168: 0 | P168: 0 | Q168: 0 | R168: 0 | S168: 1 | T168: 9 | U168: 1 | V168: -1 | W168: -1 | X168: -1 | Y168: -1 | Z168: -1 | AA168: 1083 | AB168: 1 | AN168: =COUNTIF(knownSpells_humans!C[-39],RC[-1]) -> 0
A169: 0 | B169: U_FemalePeasant2 | C169: 20 | D169: 20 | E169: 25 | F169: 25 | G169: 60 | H169: -1 | I169: 16 | J169: 16 | K169: 6 | L169: 4 | M169: 0 | N169: 0 | O169: 0 | P169: 0 | Q169: 0 | R169: 0 | S169: 1 | T169: 9 | U169: 1 | V169: -1 | W169: -1 | X169: -1 | Y169: -1 | Z169: -1 | AA169: 1084 | AB169: 1 | AN169: =COUNTIF(knownSpells_humans!C[-39],RC[-1]) -> 0
A170: 0 | B170: U_FemalePeasant3 | C170: 25 | D170: 20 | E170: 25 | F170: 25 | G170: 75 | H170: -1 | I170: 16 | J170: 16 | K170: 6 | L170: 4 | M170: 0 | N170: 0 | O170: 0 | P170: 0 | Q170: 0 | R170: 0 | S170: 1 | T170: 9 | U170: 1 | V170: -1 | W170: -1 | X170: -1 | Y170: -1 | Z170: -1 | AA170: 1085 | AB170: 1 | AN170: =COUNTIF(knownSpells_humans!C[-39],RC[-1]) -> 0
A171: 0 | B171: U_FemalePeasant4 | C171: 30 | D171: 20 | E171: 25 | F171: 25 | G171: 90 | H171: -1 | I171: 16 | J171: 16 | K171: 6 | L171: 4 | M171: 0 | N171: 0 | O171: 0 | P171: 0 | Q171: 0 | R171: 0 | S171: 1 | T171: 9 | U171: 1 | V171: -1 | W171: -1 | X171: -1 | Y171: -1 | Z171: -1 | AA171: 1086 | AB171: 1 | AN171: =COUNTIF(knownSpells_humans!C[-39],RC[-1]) -> 0
A172: 0 | B172: M141_MageTooth | C172: 35 | D172: 40 | E172: 45 | F172: 50 | G172: 156 | H172: 447 | I172: 20 | J172: 20 | K172: 7 | L172: 8 | M172: 99 | N172: 0 | O172: 99 | P172: 99 | Q172: 0 | R172: 0 | S172: 24 | T172: 4 | U172: 1 | V172: -1 | W172: -1 | X172: -1 | Y172: -1 | Z172: 12 | AA172: 517 | AB172: 0 | AC172: Very Rare Magic Wood Staff {castSpell=Lightning:99} | AE172: Very Rare Dress | AF172: Very Rare Cape | AM172: [172] | AN172: =COUNTIF(knownSpells_humans!C[-39],RC[-1]) -> 1
A173: 0 | B173: M91_ShopperDaughter | C173: 20 | D173: 20 | E173: 25 | F173: 25 | G173: 60 | H173: -1 | I173: 16 | J173: 16 | K173: 6 | L173: 4 | M173: 0 | N173: 0 | O173: 0 | P173: 0 | Q173: 0 | R173: 0 | S173: 1 | T173: 6 | U173: 1 | V173: -1 | W173: -1 | X173: -1 | Y173: -1 | Z173: -1 | AA173: 518 | AB173: 1 | AN173: =COUNTIF(knownSpells_humans!C[-39],RC[-1]) -> 0
A174: 0 | B174: M61_VolcanoDweller | C174: 25 | D174: 30 | E174: 35 | F174: 40 | G174: 75 | H174: 240 | I174: 18 | J174: 18 | K174: 7 | L174: 6 | M174: 50 | N174: 40 | O174: 40 | P174: 0 | Q174: 0 | R174: 0 | S174: 24 | T174: 12 | U174: 0 | V174: -1 | W174: -1 | X174: -1 | Y174: -1 | Z174: 12 | AA174: 519 | AB174: 0 | AC174: Uncommon Wood Shaman Staff {castSpell=Fire_Arrow:10} | AE174: Uncommon Robe | AF174: Uncommon Cloak | AM174: [174] | AN174: =COUNTIF(knownSpells_humans!C[-39],RC[-1]) -> 2
A175: 0 | B175: M130_Veglud | C175: 35 | D175: 40 | E175: 45 | F175: 50 | G175: 156 | H175: 447 | I175: 20 | J175: 20 | K175: 7 | L175: 8 | M175: 99 | N175: 99 | O175: 99 | P175: 99 | Q175: 99 | R175: 99 | S175: 24 | T175: 10 | U175: 0 | V175: -1 | W175: -1 | X175: -1 | Y175: -1 | Z175: 12 | AA175: 520 | AB175: 0 | AC175: Elven Magic Wood Staff {castSpell=Stone_Curse:50} | AE175: Rare Robe | AF175: Elven Cap | AM175: [175] | AN175: =COUNTIF(knownSpells_humans!C[-39],RC[-1]) -> 2
A176: 0 | B176: M151_Lord | C176: 50 | D176: 46 | E176: 25 | F176: 16 | G176: 60 | H176: -1 | I176: 21 | J176: 21 | K176: 7 | L176: 9 | M176: 0 | N176: 55 | O176: 20 | P176: 5 | Q176: 6 | R176: 7 | S176: 1 | T176: 18 | U176: 0 | V176: -1 | W176: -1 | X176: -1 | Y176: -1 | Z176: -1 | AA176: 521 | AB176: 1 | AN176: =COUNTIF(knownSpells_humans!C[-39],RC[-1]) -> 0
A177: 0 | B177: M71_PoorGuy | C177: 36 | D177: 47 | E177: 28 | F177: 33 | G177: 60 | H177: -1 | I177: 21 | J177: 21 | K177: 7 | L177: 9 | M177: 0 | N177: 35 | O177: 14 | P177: 4 | Q177: 5 | R177: 3 | S177: 1 | T177: 19 | U177: 0 | V177: -1 | W177: -1 | X177: -1 | Y177: -1 | Z177: -1 | AA177: 522 | AB177: 1 | AN177: =COUNTIF(knownSpells_humans!C[-39],RC[-1]) -> 0
A178: 0 | B178: M40_Hima | C178: 15 | D178: 20 | E178: 25 | F178: 25 | G178: 45 | H178: -1 | I178: 16 | J178: 16 | K178: 6 | L178: 4 | M178: 0 | N178: 0 | O178: 0 | P178: 0 | Q178: 0 | R178: 0 | S178: 1 | T178: 26 | U178: 0 | V178: -1 | W178: -1 | X178: -1 | Y178: -1 | Z178: -1 | AA178: 523 | AB178: 1 | AN178: =COUNTIF(knownSpells_humans!C[-39],RC[-1]) -> 0
A179: 0 | B179: M120_BrigandChief | C179: 50 | D179: 50 | E179: 45 | F179: 40 | G179: 447 | H179: -1 | I179: 22 | J179: 22 | K179: 8 | L179: 10 | M179: 99 | N179: 0 | O179: 99 | P179: 0 | Q179: 0 | R179: 0 | S179: 9 | T179: 22 | U179: 0 | V179: 10 | W179: 4 | X179: -1 | Y179: -1 | Z179: -1 | AA179: 524 | AB179: 1 | AC179: Very Rare Meteoric Two Handed Axe | AN179: =COUNTIF(knownSpells_humans!C[-39],RC[-1]) -> 0
A180: 0 | B180: CH_Scrakan | C180: 46 | D180: 46 | E180: 50 | F180: 50 | G180: 30 | H180: 70 | I180: 21 | J180: 21 | K180: 8 | L180: 9 | M180: 0 | N180: 93 | O180: 91 | P180: 95 | Q180: 97 | R180: 99 | S180: 24 | T180: 5 | U180: 0 | V180: -1 | W180: -1 | X180: -1 | Y180: -1 | Z180: 12 | AA180: 2000 | AB180: 0 | AC180: Very Rare Magic Wood Staff {castSpell=Prismatic_Spray:99} | AE180: Very Rare None Dress {protectionFire=65} | AF180: Rare None Cloak {protectionAir=65} | AG180: Very Rare None Gloves {protectionEarth=65} | AH180: Very Rare None Shoes {protectionAstral=65} | AI180: Very Rare None Low Hat {protectionWater=65} | AJ180: Very Rare Crystal Ring {defence=250} | AK180: Iron Amulet {speed=4} | AM180: [180] | AN180: =COUNTIF(knownSpells_humans!C[-39],RC[-1]) -> 4
A181: 0 | B181: CH_Recruit | C181: 30 | D181: 25 | E181: 20 | F181: 15 | G181: 90 | H181: -1 | I181: 17 | J181: 17 | K181: 6 | L181: 5 | M181: 0 | N181: 0 | O181: 0 | P181: 0 | Q181: 0 | R181: 0 | S181: 1 | T181: 39 | U181: 0 | V181: -1 | W181: -1 | X181: -1 | Y181: -1 | Z181: -1 | AA181: 2001 | AB181: 1 | AN181: =COUNTIF(knownSpells_humans!C[-39],RC[-1]) -> 0
A182: 0 | B182: CH_BrigandsBoss | C182: 35 | D182: 35 | E182: 25 | F182: 30 | G182: 189 | H182: -1 | I182: 19 | J182: 19 | K182: 6 | L182: 7 | M182: 40 | N182: 0 | O182: 40 | P182: 0 | Q182: 0 | R182: 0 | S182: 9 | T182: 38 | U182: 0 | V182: 10 | W182: 4 | X182: -1 | Y182: -1 | Z182: -1 | AA182: 2002 | AB182: 1 | AC182: Rare Mithrill Two Handed Axe | AN182: =COUNTIF(knownSpells_humans!C[-39],RC[-1]) -> 0
A183: 0 | B183: CH_Elf | C183: 35 | D183: 40 | E183: 45 | F183: 50 | G183: 156 | H183: 447 | I183: 20 | J183: 20 | K183: 7 | L183: 8 | M183: 99 | N183: 99 | O183: 99 | P183: 99 | Q183: 99 | R183: 99 | S183: 24 | T183: 19 | U183: 0 | V183: -1 | W183: -1 | X183: -1 | Y183: -1 | Z183: 12 | AA183: 2003 | AB183: 0 | AC183: Elven Magic Wood Staff {castSpell=Stone_Curse:99} | AM183: [183] | AN183: =COUNTIF(knownSpells_humans!C[-39],RC[-1]) -> 4
A184: 0 | B184: CH_NecromancerAmbusher | C184: 35 | D184: 40 | E184: 45 | F184: 50 | G184: 156 | H184: 447 | I184: 20 | J184: 20 | K184: 7 | L184: 8 | M184: 99 | N184: 0 | O184: 99 | P184: 99 | Q184: 0 | R184: 0 | S184: 24 | T184: 8 | U184: 1 | V184: -1 | W184: -1 | X184: -1 | Y184: -1 | Z184: 12 | AA184: 2004 | AB184: 0 | AC184: Very Rare Magic Wood Staff {castSpell=Stone_Curse:10} | AE184: Bad Dress | AF184: Bad Cloak | AM184: [184] | AN184: =COUNTIF(knownSpells_humans!C[-39],RC[-1]) -> 4
A185: 0 | B185: CH_Orcologist | C185: 35 | D185: 40 | E185: 45 | F185: 50 | G185: 156 | H185: 447 | I185: 20 | J185: 20 | K185: 7 | L185: 8 | M185: 99 | N185: 99 | O185: 99 | P185: 99 | Q185: 99 | R185: 99 | S185: 24 | T185: 16 | U185: 0 | V185: -1 | W185: -1 | X185: -1 | Y185: -1 | Z185: 12 | AA185: 2005 | AB185: 0 | AC185: Elven Magic Wood Staff {castSpell=Stone_Curse:50} | AE185: Very Rare Dress | AF185: Cape | AG185: Very Rare Gold Ring | AM185: [185] | AN185: =COUNTIF(knownSpells_humans!C[-39],RC[-1]) -> 2
A186: 0 | B186: CH_UncleGeneral | C186: 50 | D186: 50 | E186: 40 | F186: 40 | G186: 447 | H186: -1 | I186: 22 | J186: 22 | K186: 8 | L186: 10 | M186: 99 | N186: 99 | O186: 0 | P186: 0 | Q186: 0 | R186: 0 | S186: 5 | T186: 35 | U186: 0 | V186: 10 | W186: 4 | X186: -1 | Y186: -1 | Z186: -1 | AA186: 2006 | AB186: 1 | AC186: Very Rare Meteoric Two Handed Sword | AE186: Elven Meteoric Chain Mail{defence=35} | AF186: Very Rare Meteoric Cuirass{defence=50} | AG186: Very Rare Meteoric Scale Gauntlets | AH186: Very Rare Meteoric Plate Bracers | AI186: Very Rare Meteoric Plate Boots | AJ186: Very Rare Meteoric Ring { protectionFire=32 } | AK186: Very Rare Meteoric Amulet { protectionAir=48} | AN186: =COUNTIF(knownSpells_humans!C[-39],RC[-1]) -> 0
A187: 0 | B187: CH_KingZombie | C187: 50 | D187: 50 | E187: 40 | F187: 40 | G187: 447 | H187: -1 | I187: 22 | J187: 22 | K187: 8 | L187: 10 | M187: 99 | N187: 99 | O187: 0 | P187: 0 | Q187: 0 | R187: 0 | S187: 5 | T187: 43 | U187: 0 | V187: 10 | W187: 4 | X187: -1 | Y187: -1 | Z187: -1 | AA187: 2007 | AB187: 1 | AC187: Very Rare Crystal Two Handed Sword | AE187: Very Rare Crystal Plate Helm | AF187: Very Rare Meteoric Scale Mail | AG187: Very Rare Crystal Plate Cuirass | AH187: Very Rare Crystal Plate Bracers | AI187: Very Rare Crystal Plate Boots | AJ187: Very Rare Crystal Scale Gauntlets | AK187: Very Rare Crystal Amulet | AL187: Very Rare Crystal Ring | AN187: =COUNTIF(knownSpells_humans!C[-39],RC[-1]) -> 0
A188: 0 | B188: CH_Ranger | C188: 50 | D188: 50 | E188: 40 | F188: 40 | G188: 447 | H188: -1 | I188: 22 | J188: 22 | K188: 8 | L188: 10 | M188: 99 | N188: 99 | O188: 0 | P188: 0 | Q188: 0 | R188: 0 | S188: 1 | T188: 37 | U188: 0 | V188: -1 | W188: -1 | X188: -1 | Y188: -1 | Z188: -1 | AA188: 2008 | AB188: 1 | AN188: =COUNTIF(knownSpells_humans!C[-39],RC[-1]) -> 0
A189: 0 | B189: CH_WizardHarmed | C189: 35 | D189: 40 | E189: 45 | F189: 50 | G189: 156 | H189: 447 | I189: 20 | J189: 20 | K189: 7 | L189: 8 | M189: 99 | N189: 0 | O189: 99 | P189: 99 | Q189: 0 | R189: 0 | S189: 24 | T189: 7 | U189: 1 | V189: -1 | W189: -1 | X189: -1 | Y189: -1 | Z189: 12 | AA189: 2009 | AB189: 0 | AM189: [189] | AN189: =COUNTIF(knownSpells_humans!C[-39],RC[-1]) -> 2
A190: 0 | B190: CH_WarriorHarmed | C190: 15 | D190: 20 | E190: 25 | F190: 25 | G190: 45 | H190: -1 | I190: 16 | J190: 16 | K190: 6 | L190: 4 | M190: 0 | N190: 0 | O190: 0 | P190: 0 | Q190: 0 | R190: 0 | S190: 1 | T190: 40 | U190: 0 | V190: -1 | W190: -1 | X190: -1 | Y190: -1 | Z190: -1 | AA190: 2010 | AB190: 1 | AN190: =COUNTIF(knownSpells_humans!C[-39],RC[-1]) -> 0
A191: 0 | B191: CH_HeraldFromSkrakan | C191: 35 | D191: 40 | E191: 45 | F191: 50 | G191: 156 | H191: 447 | I191: 20 | J191: 20 | K191: 7 | L191: 8 | M191: 99 | N191: 0 | O191: 99 | P191: 99 | Q191: 0 | R191: 0 | S191: 24 | T191: 2 | U191: 1 | V191: -1 | W191: -1 | X191: -1 | Y191: -1 | Z191: 12 | AA191: 2011 | AB191: 0 | AC191: Wood Staff {castSpell=Fire_Arrow:25} | AE191: None Dress | AF191: None Cape{protectionWater=24} | AG191: Rare None Gloves{protectionAir=26} | AH191: None Shoes | AI191: Uncommon Silver Amulet | AM191: [191] | AN191: =COUNTIF(knownSpells_humans!C[-39],RC[-1]) -> 3
A192: 0 | B192: CH_HeraldFromLayrisha | C192: 15 | D192: 20 | E192: 25 | F192: 25 | G192: 45 | H192: -1 | I192: 16 | J192: 16 | K192: 6 | L192: 4 | M192: 0 | N192: 0 | O192: 0 | P192: 0 | Q192: 0 | R192: 0 | S192: 1 | T192: 46 | U192: 0 | V192: -1 | W192: -1 | X192: -1 | Y192: -1 | Z192: -1 | AA192: 2012 | AB192: 1 | AN192: =COUNTIF(knownSpells_humans!C[-39],RC[-1]) -> 0
A193: 0 | B193: CH_FriendOfKnight | C193: 40 | D193: 40 | E193: 30 | F193: 30 | G193: 264 | H193: -1 | I193: 20 | J193: 20 | K193: 7 | L193: 8 | M193: 60 | N193: 60 | O193: 0 | P193: 0 | Q193: 0 | R193: 0 | S193: 4 | T193: 42 | U193: 0 | V193: 7 | W193: 4 | X193: -1 | Y193: -1 | Z193: -1 | AA193: 2013 | AB193: 1 | AC193: Rare Mithrill Two Handed Sword | AE193: Rare Mithrill Chain Mail | AF193: Rare Mithrill Plate Cuirass | AG193: Rare Mithrill Plate Bracers | AH193: Rare Mithrill Scale Gauntlets | AI193: Rare Mithrill Plate Boots | AN193: =COUNTIF(knownSpells_humans!C[-39],RC[-1]) -> 0
A194: 0 | B194: CH_KingZombieUnmasked | C194: 50 | D194: 50 | E194: 40 | F194: 40 | G194: 447 | H194: -1 | I194: 22 | J194: 22 | K194: 8 | L194: 10 | M194: 99 | N194: 99 | O194: 0 | P194: 0 | Q194: 0 | R194: 0 | S194: 5 | T194: 43 | U194: 0 | V194: 10 | W194: 4 | X194: -1 | Y194: -1 | Z194: -1 | AA194: 2014 | AB194: 1 | AC194: Very Rare Crystal Two Handed Sword | AE194: Very Rare Meteoric Scale Mail | AF194: Very Rare Crystal Plate Cuirass | AG194: Very Rare Crystal Plate Bracers | AH194: Very Rare Crystal Plate Boots | AI194: Very Rare Crystal Scale Gauntlets | AJ194: Very Rare Crystal Amulet | AK194: Very Rare Crystal Ring | AN194: =COUNTIF(knownSpells_humans!C[-39],RC[-1]) -> 0
A195: 0 | B195: CH_MageMonsterTrap | C195: 25 | D195: 25 | E195: 35 | F195: 40 | G195: 68 | H195: 216 | I195: 17 | J195: 17 | K195: 6 | L195: 5 | M195: 40 | N195: 40 | O195: 40 | P195: 0 | Q195: 0 | R195: 0 | S195: 24 | T195: 18 | U195: 1 | V195: -1 | W195: -1 | X195: -1 | Y195: -1 | Z195: 12 | AA195: 2015 | AB195: 0 | AC195: Uncommon Wood Staff {castSpell=Fire_Arrow:10} | AE195: Rare Robe | AF195: Uncommon Cape | AG195: Rare Mithrill Ring | AM195: [195] | AN195: =COUNTIF(knownSpells_humans!C[-39],RC[-1]) -> 3
A196: 0 | B196: CH_MageAmuletKeeper | C196: 35 | D196: 40 | E196: 45 | F196: 50 | G196: 156 | H196: 447 | I196: 20 | J196: 20 | K196: 7 | L196: 8 | M196: 99 | N196: 0 | O196: 0 | P196: 99 | Q196: 99 | R196: 99 | S196: 24 | T196: 20 | U196: 0 | V196: -1 | W196: -1 | X196: -1 | Y196: -1 | Z196: 12 | AA196: 2016 | AB196: 0 | AC196: Very Rare Magic Wood Staff {castSpell=Prismatic_Spray:45} | AE196: Bad Dress | AF196: Bad Cloak | AM196: [196] | AN196: =COUNTIF(knownSpells_humans!C[-39],RC[-1]) -> 4
A197: 0 | B197: CH_SmithBewitched | C197: 25 | D197: 20 | E197: 25 | F197: 20 | G197: 75 | H197: -1 | I197: 16 | J197: 16 | K197: 6 | L197: 4 | M197: 0 | N197: 0 | O197: 0 | P197: 0 | Q197: 0 | R197: 0 | S197: 1 | T197: 54 | U197: 0 | V197: -1 | W197: -1 | X197: -1 | Y197: -1 | Z197: -1 | AA197: 2017 | AB197: 1 | AN197: =COUNTIF(knownSpells_humans!C[-39],RC[-1]) -> 0
A198: 0 | B198: CH_SmithDispelled | C198: 25 | D198: 20 | E198: 25 | F198: 20 | G198: 75 | H198: -1 | I198: 16 | J198: 16 | K198: 6 | L198: 4 | M198: 0 | N198: 0 | O198: 0 | P198: 0 | Q198: 0 | R198: 0 | S198: 1 | T198: 53 | U198: 0 | V198: -1 | W198: -1 | X198: -1 | Y198: -1 | Z198: -1 | AA198: 2018 | AB198: 1 | AN198: =COUNTIF(knownSpells_humans!C[-39],RC[-1]) -> 0
A199: 0 | B199: CH_AtamanRunaway | C199: 50 | D199: 45 | E199: 35 | F199: 35 | G199: 390 | H199: -1 | I199: 21 | J199: 21 | K199: 7 | L199: 9 | M199: 80 | N199: 80 | O199: 0 | P199: 0 | Q199: 0 | R199: 0 | S199: 9 | T199: 52 | U199: 0 | V199: 10 | W199: 4 | X199: -1 | Y199: -1 | Z199: -1 | AA199: 2019 | AB199: 1 | AC199: Bronze Axe | AN199: =COUNTIF(knownSpells_humans!C[-39],RC[-1]) -> 0
A200: 0 | B200: CH_AtamanCamped | C200: 45 | D200: 40 | E200: 30 | F200: 30 | G200: 300 | H200: -1 | I200: 20 | J200: 20 | K200: 7 | L200: 8 | M200: 40 | N200: 40 | O200: 40 | P200: 40 | Q200: 40 | R200: 40 | S200: 9 | T200: 52 | U200: 0 | V200: 10 | W200: 4 | X200: -1 | Y200: -1 | Z200: -1 | AA200: 2020 | AB200: 1 | AC200: Very Rare Adamantium Two Handed Axe | AE200: Uncommon Steel Plate Helm | AF200: Uncommon Steel Scale Mail | AG200: Uncommon Steel Plate Boots | AH200: Uncommon Steel Plate Cuirass | AI200: Uncommon Steel Scale Gauntlets | AJ200: Uncommon Steel Plate Bracers | AN200: =COUNTIF(knownSpells_humans!C[-39],RC[-1]) -> 0
A201: 0 | B201: CH_SwordCarrier | C201: 25 | D201: 20 | E201: 25 | F201: 20 | G201: 75 | H201: -1 | I201: 16 | J201: 16 | K201: 6 | L201: 4 | M201: 0 | N201: 0 | O201: 0 | P201: 0 | Q201: 0 | R201: 0 | S201: 3 | T201: 45 | U201: 0 | V201: 7 | W201: 4 | X201: -1 | Y201: -1 | Z201: -1 | AA201: 2021 | AB201: 1 | AC201: Iron Short Sword | AN201: =COUNTIF(knownSpells_humans!C[-39],RC[-1]) -> 0
A202: 0 | B202: CH_Xara | C202: 25 | D202: 25 | E202: 40 | F202: 40 | G202: 105 | H202: 336 | I202: 17 | J202: 17 | K202: 7 | L202: 5 | M202: 90 | N202: 90 | O202: 90 | P202: 0 | Q202: 0 | R202: 0 | S202: 24 | T202: 9 | U202: 1 | V202: -1 | W202: -1 | X202: -1 | Y202: -1 | Z202: 12 | AA202: 2022 | AB202: 0 | AC202: Uncommon Wood Staff {castSpell=Fire_Arrow:35} | AE202: Rare Robe | AF202: Uncommon Cape | AG202: Rare Mithrill Ring | AM202: [202] | AN202: =COUNTIF(knownSpells_humans!C[-39],RC[-1]) -> 3
A203: 0 | B203: CH_Sister | C203: 25 | D203: 25 | E203: 35 | F203: 40 | G203: 68 | H203: 216 | I203: 17 | J203: 17 | K203: 6 | L203: 5 | M203: 40 | N203: 40 | O203: 40 | P203: 0 | Q203: 0 | R203: 0 | S203: 24 | T203: 16 | U203: 1 | V203: -1 | W203: -1 | X203: -1 | Y203: -1 | Z203: 12 | AA203: 2023 | AB203: 0 | AC203: Uncommon Wood Staff {castSpell=Fire_Arrow:35} | AE203: Rare Dress | AF203: Rare Cape | AG203: Rare Mithrill Ring | AM203: [203] | AN203: =COUNTIF(knownSpells_humans!C[-39],RC[-1]) -> 4
A204: 0 | B204: CH_Son | C204: 40 | D204: 35 | E204: 25 | F204: 25 | G204: 216 | H204: -1 | I204: 19 | J204: 19 | K204: 6 | L204: 7 | M204: 40 | N204: 40 | O204: 0 | P204: 0 | Q204: 0 | R204: 0 | S204: 1 | T204: 34 | U204: 0 | V204: -1 | W204: -1 | X204: -1 | Y204: -1 | Z204: -1 | AA204: 2024 | AB204: 1 | AE204: Uncommon Steel Chain Mail | AF204: Uncommon Steel Chain Boots | AN204: =COUNTIF(knownSpells_humans!C[-39],RC[-1]) -> 0
A205: 0 | B205: CH_Sphinx | C205: 25 | D205: 20 | E205: 25 | F205: 20 | G205: 75 | H205: -1 | I205: 16 | J205: 16 | K205: 6 | L205: 4 | M205: 0 | N205: 0 | O205: 0 | P205: 0 | Q205: 0 | R205: 0 | S205: 1 | T205: 22 | U205: 1 | V205: -1 | W205: -1 | X205: -1 | Y205: -1 | Z205: -1 | AA205: 2025 | AB205: 1 | AN205: =COUNTIF(knownSpells_humans!C[-39],RC[-1]) -> 0
A206: 0 | B206: CH_Girl | C206: 25 | D206: 30 | E206: 15 | F206: 20 | G206: 90 | H206: -1 | I206: 18 | J206: 18 | K206: 6 | L206: 6 | M206: 10 | N206: 0 | O206: 0 | P206: 0 | Q206: 0 | R206: 10 | S206: 1 | T206: 16 | U206: 1 | V206: -1 | W206: -1 | X206: -1 | Y206: -1 | Z206: -1 | AA206: 2026 | AB206: 1 | AN206: =COUNTIF(knownSpells_humans!C[-39],RC[-1]) -> 0
A207: 0 | B207: CH_PyramidFire | C207: 25 | D207: 20 | E207: 25 | F207: 20 | G207: 75 | H207: -1 | I207: 16 | J207: 16 | K207: 6 | L207: 4 | M207: 0 | N207: 0 | O207: 0 | P207: 0 | Q207: 0 | R207: 0 | S207: 1 | T207: 21 | U207: 1 | V207: -1 | W207: -1 | X207: -1 | Y207: -1 | Z207: -1 | AA207: 2027 | AB207: 1 | AN207: =COUNTIF(knownSpells_humans!C[-39],RC[-1]) -> 0
A208: 0 | B208: CH_PyramidWater | C208: 25 | D208: 20 | E208: 25 | F208: 20 | G208: 75 | H208: -1 | I208: 16 | J208: 16 | K208: 6 | L208: 4 | M208: 0 | N208: 0 | O208: 0 | P208: 0 | Q208: 0 | R208: 0 | S208: 1 | T208: 19 | U208: 1 | V208: -1 | W208: -1 | X208: -1 | Y208: -1 | Z208: -1 | AA208: 2028 | AB208: 1 | AN208: =COUNTIF(knownSpells_humans!C[-39],RC[-1]) -> 0
A209: 0 | B209: CH_PyramidEarth | C209: 25 | D209: 20 | E209: 25 | F209: 20 | G209: 75 | H209: -1 | I209: 16 | J209: 16 | K209: 6 | L209: 4 | M209: 0 | N209: 0 | O209: 0 | P209: 0 | Q209: 0 | R209: 0 | S209: 1 | T209: 20 | U209: 1 | V209: -1 | W209: -1 | X209: -1 | Y209: -1 | Z209: -1 | AA209: 2029 | AB209: 1 | AN209: =COUNTIF(knownSpells_humans!C[-39],RC[-1]) -> 0
A210: 0 | B210: CH_PyramidAir | C210: 25 | D210: 20 | E210: 25 | F210: 20 | G210: 75 | H210: -1 | I210: 16 | J210: 16 | K210: 6 | L210: 4 | M210: 0 | N210: 0 | O210: 0 | P210: 0 | Q210: 0 | R210: 0 | S210: 1 | T210: 18 | U210: 1 | V210: -1 | W210: -1 | X210: -1 | Y210: -1 | Z210: -1 | AA210: 2030 | AB210: 1 | AN210: =COUNTIF(knownSpells_humans!C[-39],RC[-1]) -> 0
A211: 0 | B211: 2F_Brigand1 | C211: 35 | D211: 30 | E211: 20 | F211: 20 | G211: 126 | H211: -1 | I211: 18 | J211: 18 | K211: 6 | L211: 6 | M211: 10 | N211: 10 | O211: 10 | P211: 10 | Q211: 10 | R211: 10 | S211: 8 | T211: 50 | U211: 0 | V211: -1 | W211: -1 | X211: -1 | Y211: -1 | Z211: -1 | AA211: 2100 | AB211: 1 | AC211: Bronze Axe | AE211: Leather Boots | AN211: =COUNTIF(knownSpells_humans!C[-39],RC[-1]) -> 0
A212: 0 | B212: 2A_Brigand1 | C212: 30 | D212: 35 | E212: 20 | F212: 20 | G212: 108 | H212: -1 | I212: 19 | J212: 19 | K212: 6 | L212: 7 | M212: 10 | N212: 10 | O212: 10 | P212: 10 | Q212: 10 | R212: 10 | S212: 14 | T212: 17 | U212: 1 | V212: 20 | W212: 5 | X212: -1 | Y212: -1 | Z212: -1 | AA212: 2101 | AB212: 1 | AC212: Wood Short Bow | AE212: Leather Boots | AN212: =COUNTIF(knownSpells_humans!C[-39],RC[-1]) -> 0
A213: 0 | B213: 2M_Brigand1 | C213: 20 | D213: 20 | E213: 30 | F213: 35 | G213: 36 | H213: 126 | I213: 16 | J213: 16 | K213: 6 | L213: 4 | M213: 10 | N213: 10 | O213: 10 | P213: 10 | Q213: 10 | R213: 10 | S213: 24 | T213: 15 | U213: 1 | V213: -1 | W213: -1 | X213: -1 | Y213: -1 | Z213: 12 | AA213: 2102 | AB213: 0 | AC213: Wood Shaman Staff {castSpell=Fire_Arrow:1} | AM213: [213] | AN213: =COUNTIF(knownSpells_humans!C[-39],RC[-1]) -> 3
A214: 0 | B214: 2F_BrigandLeader1 | C214: 40 | D214: 35 | E214: 25 | F214: 25 | G214: 168 | H214: -1 | I214: 19 | J214: 19 | K214: 6 | L214: 7 | M214: 20 | N214: 20 | O214: 20 | P214: 20 | Q214: 20 | R214: 20 | S214: 9 | T214: 52 | U214: 0 | V214: 10 | W214: 4 | X214: -1 | Y214: -1 | Z214: -1 | AA214: 2103 | AB214: 1 | AC214: Bronze Two Handed Axe | AE214: Leather Boots | AN214: =COUNTIF(knownSpells_humans!C[-39],RC[-1]) -> 0
A215: 0 | B215: 2F_Brigand2 | C215: 40 | D215: 35 | E215: 25 | F215: 25 | G215: 168 | H215: -1 | I215: 19 | J215: 19 | K215: 6 | L215: 7 | M215: 20 | N215: 20 | O215: 20 | P215: 20 | Q215: 20 | R215: 20 | S215: 8 | T215: 51 | U215: 0 | V215: -1 | W215: -1 | X215: -1 | Y215: -1 | Z215: -1 | AA215: 2104 | AB215: 1 | AC215: Iron Axe | AE215: Leather Boots | AN215: =COUNTIF(knownSpells_humans!C[-39],RC[-1]) -> 0
A216: 0 | B216: 2A_Brigand2 | C216: 35 | D216: 40 | E216: 25 | F216: 25 | G216: 147 | H216: -1 | I216: 20 | J216: 20 | K216: 7 | L216: 8 | M216: 20 | N216: 20 | O216: 20 | P216: 20 | Q216: 20 | R216: 20 | S216: 14 | T216: 17 | U216: 1 | V216: 20 | W216: 5 | X216: -1 | Y216: -1 | Z216: -1 | AA216: 2105 | AB216: 1 | AC216: Wood Long Bow | AE216: Leather Boots | AN216: =COUNTIF(knownSpells_humans!C[-39],RC[-1]) -> 0
A217: 0 | B217: 2M_Brigand2 | C217: 25 | D217: 25 | E217: 35 | F217: 40 | G217: 53 | H217: 168 | I217: 17 | J217: 17 | K217: 6 | L217: 5 | M217: 20 | N217: 20 | O217: 20 | P217: 20 | Q217: 20 | R217: 20 | S217: 24 | T217: 15 | U217: 1 | V217: -1 | W217: -1 | X217: -1 | Y217: -1 | Z217: 12 | AA217: 2106 | AB217: 0 | AC217: Uncommon Wood Shaman Staff {castSpell=Fire_Arrow:5} | AM217: [217] | AN217: =COUNTIF(knownSpells_humans!C[-39],RC[-1]) -> 4
A218: 0 | B218: 2F_BrigandLeader2 | C218: 45 | D218: 40 | E218: 30 | F218: 30 | G218: 243 | H218: -1 | I218: 20 | J218: 20 | K218: 7 | L218: 8 | M218: 40 | N218: 40 | O218: 40 | P218: 40 | Q218: 40 | R218: 40 | S218: 9 | T218: 52 | U218: 0 | V218: 10 | W218: 4 | X218: -1 | Y218: -1 | Z218: -1 | AA218: 2107 | AB218: 1 | AC218: Iron Two Handed Axe | AE218: Leather Boots | AN218: =COUNTIF(knownSpells_humans!C[-39],RC[-1]) -> 0
A219: 0 | B219: 2U_PeasantMale | C219: 25 | D219: 20 | E219: 25 | F219: 20 | G219: 75 | H219: -1 | I219: 16 | J219: 16 | K219: 6 | L219: 4 | M219: 0 | N219: 0 | O219: 0 | P219: 0 | Q219: 0 | R219: 0 | S219: 1 | T219: 46 | U219: 0 | V219: -1 | W219: -1 | X219: -1 | Y219: -1 | Z219: -1 | AA219: 2108 | AB219: 1 | AN219: =COUNTIF(knownSpells_humans!C[-39],RC[-1]) -> 0
A220: 0 | B220: 2U_PeasantFemale | C220: 20 | D220: 25 | E220: 20 | F220: 25 | G220: 60 | H220: -1 | I220: 17 | J220: 17 | K220: 6 | L220: 5 | M220: 0 | N220: 0 | O220: 0 | P220: 0 | Q220: 0 | R220: 0 | S220: 1 | T220: 13 | U220: 1 | V220: -1 | W220: -1 | X220: -1 | Y220: -1 | Z220: -1 | AA220: 2109 | AB220: 1 | AN220: =COUNTIF(knownSpells_humans!C[-39],RC[-1]) -> 0
A221: 0 | B221: 2F_PeasantGuard | C221: 30 | D221: 25 | E221: 20 | F221: 15 | G221: 108 | H221: -1 | I221: 17 | J221: 17 | K221: 6 | L221: 5 | M221: 10 | N221: 0 | O221: 0 | P221: 10 | Q221: 0 | R221: 0 | S221: 10 | T221: 45 | U221: 0 | V221: 7 | W221: 4 | X221: -1 | Y221: -1 | Z221: -1 | AA221: 2110 | AB221: 1 | AC221: Wood Club | AN221: =COUNTIF(knownSpells_humans!C[-39],RC[-1]) -> 0
A222: 0 | B222: 2A_PeasantGuard | C222: 25 | D222: 30 | E222: 15 | F222: 20 | G222: 90 | H222: -1 | I222: 18 | J222: 18 | K222: 6 | L222: 6 | M222: 10 | N222: 0 | O222: 0 | P222: 0 | Q222: 0 | R222: 10 | S222: 14 | T222: 16 | U222: 1 | V222: 20 | W222: 5 | X222: -1 | Y222: -1 | Z222: -1 | AA222: 2111 | AB222: 1 | AC222: Wood Short Bow | AN222: =COUNTIF(knownSpells_humans!C[-39],RC[-1]) -> 0
A223: 0 | B223: 2U_PeasantLeader | C223: 25 | D223: 25 | E223: 30 | F223: 30 | G223: 75 | H223: -1 | I223: 17 | J223: 17 | K223: 6 | L223: 5 | M223: 0 | N223: 0 | O223: 0 | P223: 0 | Q223: 0 | R223: 0 | S223: 1 | T223: 44 | U223: 0 | V223: -1 | W223: -1 | X223: -1 | Y223: -1 | Z223: -1 | AA223: 2112 | AB223: 1 | AE223: Uncommon Silver Ring | AN223: =COUNTIF(knownSpells_humans!C[-39],RC[-1]) -> 0
A224: 0 | B224: 2F_Knight1 | C224: 35 | D224: 30 | E224: 20 | F224: 20 | G224: 147 | H224: -1 | I224: 18 | J224: 18 | K224: 6 | L224: 6 | M224: 20 | N224: 20 | O224: 0 | P224: 0 | Q224: 0 | R224: 0 | S224: 4 | T224: 42 | U224: 0 | V224: 7 | W224: 4 | X224: -1 | Y224: -1 | Z224: -1 | AA224: 2113 | AB224: 1 | AC224: Bronze Long Sword | AD224: Uncommon Bronze Small Shield | AE224: Uncommon Bronze Plate Helm | AF224: Uncommon Bronze Plate Cuirass | AG224: Uncommon Bronze Plate Bracers | AH224: Bronze Scale Gauntlets | AI224: Uncommon Bronze Plate Boots | AN224: =COUNTIF(knownSpells_humans!C[-39],RC[-1]) -> 0
A225: 0 | B225: 2A_Knight1 | C225: 30 | D225: 35 | E225: 20 | F225: 20 | G225: 126 | H225: -1 | I225: 19 | J225: 19 | K225: 6 | L225: 7 | M225: 20 | N225: 0 | O225: 0 | P225: 0 | Q225: 0 | R225: 20 | S225: 15 | T225: 4 | U225: 1 | V225: 8 | W225: 16 | X225: -1 | Y225: -1 | Z225: -1 | AA225: 2114 | AB225: 1 | AC225: Wood Crossbow | AE225: Uncommon Bronze Plate Helm | AF225: Uncommon Bronze Plate Cuirass | AG225: Uncommon Bronze Plate Bracers | AH225: Bronze Scale Gauntlets | AI225: Uncommon Bronze Plate Boots | AN225: =COUNTIF(knownSpells_humans!C[-39],RC[-1]) -> 0
A226: 0 | B226: 2H_Knight1 | C226: 35 | D226: 30 | E226: 20 | F226: 20 | G226: 147 | H226: -1 | I226: 18 | J226: 18 | K226: 6 | L226: 6 | M226: 20 | N226: 0 | O226: 0 | P226: 0 | Q226: 20 | R226: 0 | S226: 21 | T226: 42 | U226: 0 | V226: 10 | W226: 4 | X226: 1 | Y226: -1 | Z226: -1 | AA226: 2115 | AB226: 1 | AC226: Bronze Pike | AD226: Uncommon Bronze Small Shield | AE226: Uncommon Bronze Plate Helm | AF226: Uncommon Bronze Plate Cuirass | AG226: Uncommon Bronze Plate Bracers | AH226: Bronze Scale Gauntlets | AI226: Uncommon Bronze Plate Boots | AN226: =COUNTIF(knownSpells_humans!C[-39],RC[-1]) -> 0
A227: 0 | B227: 2M_Knight1 | C227: 20 | D227: 20 | E227: 30 | F227: 35 | G227: 42 | H227: 147 | I227: 16 | J227: 16 | K227: 6 | L227: 4 | M227: 20 | N227: 20 | O227: 20 | P227: 20 | Q227: 20 | R227: 20 | S227: 24 | T227: 16 | U227: 1 | V227: -1 | W227: -1 | X227: -1 | Y227: -1 | Z227: 12 | AA227: 2116 | AB227: 0 | AC227: Wood Staff {castSpell=Ice_Missile:1} | AE227: Rare Robe | AF227: Cape | AG227: Uncommon Silver Ring | AM227: [227] | AN227: =COUNTIF(knownSpells_humans!C[-39],RC[-1]) -> 3
A228: 0 | B228: 2F_KnightLeader1 | C228: 40 | D228: 35 | E228: 25 | F228: 25 | G228: 216 | H228: -1 | I228: 19 | J228: 19 | K228: 6 | L228: 7 | M228: 40 | N228: 40 | O228: 0 | P228: 0 | Q228: 0 | R228: 0 | S228: 5 | T228: 33 | U228: 0 | V228: 10 | W228: 4 | X228: -1 | Y228: -1 | Z228: -1 | AA228: 2117 | AB228: 1 | AC228: Bronze Two Handed Sword | AE228: Uncommon Bronze Plate Helm | AF228: Uncommon Bronze Plate Cuirass | AG228: Uncommon Bronze Plate Bracers | AH228: Bronze Scale Gauntlets | AI228: Uncommon Bronze Plate Boots | AN228: =COUNTIF(knownSpells_humans!C[-39],RC[-1]) -> 0
A229: 0 | B229: 2F_Knight2 | C229: 40 | D229: 35 | E229: 25 | F229: 25 | G229: 216 | H229: -1 | I229: 19 | J229: 19 | K229: 6 | L229: 7 | M229: 40 | N229: 40 | O229: 0 | P229: 0 | Q229: 0 | R229: 0 | S229: 4 | T229: 42 | U229: 0 | V229: 7 | W229: 4 | X229: -1 | Y229: -1 | Z229: -1 | AA229: 2118 | AB229: 1 | AC229: Iron Long Sword | AD229: Iron Small Shield | AE229: Iron Plate Helm | AF229: Iron Plate Cuirass | AG229: Iron Plate Bracers | AH229: Iron Plate Boots | AI229: Iron Scale Gauntlets | AN229: =COUNTIF(knownSpells_humans!C[-39],RC[-1]) -> 0
A230: 0 | B230: 2A_Knight2 | C230: 35 | D230: 40 | E230: 25 | F230: 25 | G230: 189 | H230: -1 | I230: 20 | J230: 20 | K230: 7 | L230: 8 | M230: 40 | N230: 0 | O230: 0 | P230: 0 | Q230: 0 | R230: 40 | S230: 15 | T230: 4 | U230: 1 | V230: 8 | W230: 16 | X230: -1 | Y230: -1 | Z230: -1 | AA230: 2119 | AB230: 1 | AC230: Wood Crossbow | AE230: Iron Plate Helm | AF230: Iron Plate Cuirass | AG230: Iron Plate Bracers | AH230: Iron Plate Boots | AI230: Iron Scale Gauntlets | AN230: =COUNTIF(knownSpells_humans!C[-39],RC[-1]) -> 0
A231: 0 | B231: 2H_Knight2 | C231: 40 | D231: 35 | E231: 25 | F231: 25 | G231: 216 | H231: -1 | I231: 19 | J231: 19 | K231: 6 | L231: 7 | M231: 40 | N231: 0 | O231: 0 | P231: 0 | Q231: 40 | R231: 0 | S231: 21 | T231: 42 | U231: 0 | V231: 10 | W231: 4 | X231: 1 | Y231: -1 | Z231: -1 | AA231: 2120 | AB231: 1 | AC231: Iron Pike | AD231: Iron Small Shield | AE231: Iron Plate Helm | AF231: Iron Plate Cuirass | AG231: Iron Plate Bracers | AH231: Iron Plate Boots | AI231: Iron Scale Gauntlets | AN231: =COUNTIF(knownSpells_humans!C[-39],RC[-1]) -> 0
A232: 0 | B232: 2M_Knight2 | C232: 25 | D232: 25 | E232: 35 | F232: 40 | G232: 68 | H232: 216 | I232: 17 | J232: 17 | K232: 6 | L232: 5 | M232: 40 | N232: 40 | O232: 40 | P232: 40 | Q232: 40 | R232: 40 | S232: 24 | T232: 16 | U232: 1 | V232: -1 | W232: -1 | X232: -1 | Y232: -1 | Z232: 12 | AA232: 2121 | AB232: 0 | AC232: Uncommon Wood Staff {castSpell=Ice_Missile:5} | AE232: Rare Robe | AF232: Uncommon Cape | AG232: Rare Mithrill Ring | AM232: [232] | AN232: =COUNTIF(knownSpells_humans!C[-39],RC[-1]) -> 4
A233: 0 | B233: 2F_KnightLeader2 | C233: 45 | D233: 40 | E233: 30 | F233: 30 | G233: 297 | H233: -1 | I233: 20 | J233: 20 | K233: 7 | L233: 8 | M233: 60 | N233: 60 | O233: 0 | P233: 0 | Q233: 0 | R233: 0 | S233: 5 | T233: 33 | U233: 0 | V233: 10 | W233: 4 | X233: -1 | Y233: -1 | Z233: -1 | AA233: 2122 | AB233: 1 | AC233: Rare Mithrill Two Handed Sword | AE233: Iron Plate Helm | AF233: Uncommon Steel Chain Mail | AG233: Iron Plate Cuirass | AH233: Iron Plate Bracers | AI233: Iron Plate Boots | AJ233: Iron Scale Gauntlets | AN233: =COUNTIF(knownSpells_humans!C[-39],RC[-1]) -> 0
A234: 0 | B234: 2F_Knight3 | C234: 45 | D234: 40 | E234: 30 | F234: 30 | G234: 297 | H234: -1 | I234: 20 | J234: 20 | K234: 7 | L234: 8 | M234: 60 | N234: 60 | O234: 0 | P234: 0 | Q234: 0 | R234: 0 | S234: 4 | T234: 42 | U234: 0 | V234: 7 | W234: 4 | X234: -1 | Y234: -1 | Z234: -1 | AA234: 2123 | AB234: 1 | AC234: Uncommon Steel Long Sword | AD234: Uncommon Steel Large Shield | AE234: Uncommon Steel Plate Helm | AF234: Uncommon Steel Scale Mail | AG234: Uncommon Steel Plate Boots | AH234: Uncommon Steel Plate Cuirass | AI234: Uncommon Steel Scale Gauntlets | AJ234: Uncommon Steel Plate Bracers | AN234: =COUNTIF(knownSpells_humans!C[-39],RC[-1]) -> 0
A235: 0 | B235: 2A_Knight3 | C235: 40 | D235: 45 | E235: 30 | F235: 30 | G235: 264 | H235: -1 | I235: 21 | J235: 21 | K235: 7 | L235: 9 | M235: 60 | N235: 0 | O235: 0 | P235: 0 | Q235: 0 | R235: 60 | S235: 15 | T235: 4 | U235: 1 | V235: 8 | W235: 16 | X235: -1 | Y235: -1 | Z235: -1 | AA235: 2124 | AB235: 1 | AC235: Uncommon Steel Crossbow | AE235: Uncommon Steel Plate Helm | AF235: Uncommon Steel Scale Mail | AG235: Uncommon Steel Plate Boots | AH235: Uncommon Steel Plate Cuirass | AI235: Uncommon Steel Scale Gauntlets | AJ235: Uncommon Steel Plate Bracers | AN235: =COUNTIF(knownSpells_humans!C[-39],RC[-1]) -> 0
A236: 0 | B236: 2H_Knight3 | C236: 45 | D236: 40 | E236: 30 | F236: 30 | G236: 297 | H236: -1 | I236: 20 | J236: 20 | K236: 7 | L236: 8 | M236: 60 | N236: 0 | O236: 0 | P236: 0 | Q236: 60 | R236: 0 | S236: 21 | T236: 42 | U236: 0 | V236: 10 | W236: 4 | X236: 1 | Y236: -1 | Z236: -1 | AA236: 2125 | AB236: 1 | AC236: Uncommon Steel Pike | AD236: Uncommon Steel Large Shield | AE236: Uncommon Steel Plate Helm | AF236: Uncommon Steel Scale Mail | AG236: Uncommon Steel Plate Boots | AH236: Uncommon Steel Plate Cuirass | AI236: Uncommon Steel Scale Gauntlets | AJ236: Uncommon Steel Plate Bracers | AN236: =COUNTIF(knownSpells_humans!C[-39],RC[-1]) -> 0
A237: 0 | B237: 2M_Knight3 | C237: 30 | D237: 30 | E237: 40 | F237: 45 | G237: 99 | H237: 297 | I237: 18 | J237: 18 | K237: 7 | L237: 6 | M237: 60 | N237: 60 | O237: 60 | P237: 60 | Q237: 60 | R237: 60 | S237: 24 | T237: 16 | U237: 1 | V237: -1 | W237: -1 | X237: -1 | Y237: -1 | Z237: 12 | AA237: 2126 | AB237: 0 | AC237: Very Rare Magic Wood Staff {castSpell=Ice_Missile:10} | AE237: Rare Robe | AF237: Rare Cape | AG237: Very Rare Gold Ring | AM237: [237] | AN237: =COUNTIF(knownSpells_humans!C[-39],RC[-1]) -> 5
A238: 0 | B238: 2F_KnightLeader3 | C238: 50 | D238: 45 | E238: 35 | F238: 35 | G238: 390 | H238: -1 | I238: 21 | J238: 21 | K238: 7 | L238: 9 | M238: 80 | N238: 80 | O238: 0 | P238: 0 | Q238: 0 | R238: 0 | S238: 5 | T238: 33 | U238: 0 | V238: 10 | W238: 4 | X238: -1 | Y238: -1 | Z238: -1 | AA238: 2127 | AB238: 1 | AC238: Uncommon Steel Two Handed Sword | AE238: Uncommon Steel Plate Helm | AF238: Uncommon Steel Scale Mail | AG238: Uncommon Steel Plate Boots | AH238: Uncommon Steel Plate Cuirass | AI238: Uncommon Steel Scale Gauntlets | AJ238: Uncommon Steel Plate Bracers | AN238: =COUNTIF(knownSpells_humans!C[-39],RC[-1]) -> 0
A239: 0 | B239: 2F_Knight4 | C239: 50 | D239: 45 | E239: 35 | F239: 35 | G239: 390 | H239: -1 | I239: 21 | J239: 21 | K239: 7 | L239: 9 | M239: 80 | N239: 80 | O239: 0 | P239: 0 | Q239: 0 | R239: 0 | S239: 4 | T239: 42 | U239: 0 | V239: 7 | W239: 4 | X239: -1 | Y239: -1 | Z239: -1 | AA239: 2128 | AB239: 1 | AC239: Rare Mithrill Long Sword | AD239: Rare Mithrill Large Shield | AE239: Rare Mithrill Plate Helm | AF239: Rare Mithrill Chain Mail | AG239: Rare Mithrill Plate Cuirass | AH239: Rare Mithrill Plate Bracers | AI239: Rare Mithrill Plate Boots | AJ239: Rare Mithrill Scale Gauntlets | AK239: Rare Mithrill Amulet | AL239: Rare Mithrill Ring | AN239: =COUNTIF(knownSpells_humans!C[-39],RC[-1]) -> 0
A240: 0 | B240: 2A_Knight4 | C240: 45 | D240: 50 | E240: 35 | F240: 35 | G240: 351 | H240: -1 | I240: 22 | J240: 22 | K240: 7 | L240: 10 | M240: 80 | N240: 0 | O240: 0 | P240: 0 | Q240: 0 | R240: 80 | S240: 15 | T240: 4 | U240: 1 | V240: 8 | W240: 16 | X240: -1 | Y240: -1 | Z240: -1 | AA240: 2129 | AB240: 1 | AC240: Rare Mithrill Crossbow | AE240: Rare Mithrill Plate Helm | AF240: Rare Mithrill Chain Mail | AG240: Rare Mithrill Plate Cuirass | AH240: Rare Mithrill Plate Bracers | AI240: Rare Mithrill Plate Boots | AJ240: Rare Mithrill Scale Gauntlets | AK240: Rare Mithrill Amulet | AL240: Rare Mithrill Ring | AN240: =COUNTIF(knownSpells_humans!C[-39],RC[-1]) -> 0
A241: 0 | B241: 2H_Knight4 | C241: 50 | D241: 45 | E241: 35 | F241: 35 | G241: 390 | H241: -1 | I241: 21 | J241: 21 | K241: 7 | L241: 9 | M241: 80 | N241: 0 | O241: 0 | P241: 0 | Q241: 80 | R241: 0 | S241: 21 | T241: 42 | U241: 0 | V241: 10 | W241: 4 | X241: 1 | Y241: -1 | Z241: -1 | AA241: 2130 | AB241: 1 | AC241: Rare Mithrill Pike | AD241: Rare Mithrill Large Shield | AE241: Rare Mithrill Plate Helm | AF241: Rare Mithrill Chain Mail | AG241: Rare Mithrill Plate Cuirass | AH241: Rare Mithrill Plate Bracers | AI241: Rare Mithrill Plate Boots | AJ241: Rare Mithrill Scale Gauntlets | AK241: Rare Mithrill Amulet | AL241: Rare Mithrill Ring | AN241: =COUNTIF(knownSpells_humans!C[-39],RC[-1]) -> 0
A242: 0 | B242: 2M_Knight4 | C242: 35 | D242: 35 | E242: 45 | F242: 50 | G242: 137 | H242: 390 | I242: 19 | J242: 19 | K242: 7 | L242: 7 | M242: 80 | N242: 80 | O242: 80 | P242: 80 | Q242: 80 | R242: 80 | S242: 24 | T242: 16 | U242: 1 | V242: -1 | W242: -1 | X242: -1 | Y242: -1 | Z242: 12 | AA242: 2131 | AB242: 0 | AC242: Elven Magic Wood Staff {castSpell=Ice_Missile:35} | AE242: Rare Robe | AF242: Very Rare Cape | AG242: Elven Meteoric Ring | AM242: [242] | AN242: =COUNTIF(knownSpells_humans!C[-39],RC[-1]) -> 6
A243: 0 | B243: 2F_KnightLeader4 | C243: 55 | D243: 50 | E243: 40 | F243: 40 | G243: 492 | H243: -1 | I243: 22 | J243: 22 | K243: 8 | L243: 10 | M243: 99 | N243: 99 | O243: 0 | P243: 0 | Q243: 0 | R243: 0 | S243: 5 | T243: 33 | U243: 0 | V243: 10 | W243: 4 | X243: -1 | Y243: -1 | Z243: -1 | AA243: 2132 | AB243: 1 | AC243: Rare Mithrill Two Handed Sword | AE243: Rare Mithrill Plate Helm | AF243: Rare Mithrill Chain Mail | AG243: Rare Mithrill Plate Cuirass | AH243: Rare Mithrill Plate Bracers | AI243: Rare Mithrill Plate Boots | AJ243: Rare Mithrill Scale Gauntlets | AK243: Rare Mithrill Amulet | AL243: Rare Mithrill Ring | AN243: =COUNTIF(knownSpells_humans!C[-39],RC[-1]) -> 0
A244: 0 | B244: 2F_Hunter2 | C244: 30 | D244: 30 | E244: 20 | F244: 25 | G244: 126 | H244: -1 | I244: 18 | J244: 18 | K244: 6 | L244: 6 | M244: 20 | N244: 0 | O244: 20 | P244: 0 | Q244: 0 | R244: 0 | S244: 8 | T244: 48 | U244: 0 | V244: -1 | W244: -1 | X244: -1 | Y244: -1 | Z244: -1 | AA244: 2133 | AB244: 1 | AC244: Uncommon Steel Two Handed Axe | AN244: =COUNTIF(knownSpells_humans!C[-39],RC[-1]) -> 0
A245: 0 | B245: 2A_Hunter2 | C245: 30 | D245: 35 | E245: 20 | F245: 25 | G245: 126 | H245: -1 | I245: 19 | J245: 19 | K245: 6 | L245: 7 | M245: 20 | N245: 0 | O245: 0 | P245: 0 | Q245: 0 | R245: 20 | S245: 14 | T245: 14 | U245: 1 | V245: 20 | W245: 5 | X245: -1 | Y245: -1 | Z245: -1 | AA245: 2134 | AB245: 1 | AC245: Uncommon Wood Long Bow | AN245: =COUNTIF(knownSpells_humans!C[-39],RC[-1]) -> 0
A246: 0 | B246: 2F_Hunter3 | C246: 35 | D246: 35 | E246: 25 | F246: 30 | G246: 189 | H246: -1 | I246: 19 | J246: 19 | K246: 6 | L246: 7 | M246: 40 | N246: 0 | O246: 40 | P246: 0 | Q246: 0 | R246: 0 | S246: 8 | T246: 48 | U246: 0 | V246: -1 | W246: -1 | X246: -1 | Y246: -1 | Z246: -1 | AA246: 2135 | AB246: 1 | AC246: Rare Mithrill Two Handed Axe | AN246: =COUNTIF(knownSpells_humans!C[-39],RC[-1]) -> 0
A247: 0 | B247: 2A_Hunter3 | C247: 35 | D247: 40 | E247: 25 | F247: 30 | G247: 189 | H247: -1 | I247: 20 | J247: 20 | K247: 7 | L247: 8 | M247: 40 | N247: 0 | O247: 0 | P247: 0 | Q247: 0 | R247: 40 | S247: 14 | T247: 14 | U247: 1 | V247: 20 | W247: 5 | X247: -1 | Y247: -1 | Z247: -1 | AA247: 2136 | AB247: 1 | AC247: Uncommon Magic Wood Long Bow | AN247: =COUNTIF(knownSpells_humans!C[-39],RC[-1]) -> 0
A248: 0 | B248: 2F_Hunter4 | C248: 40 | D248: 40 | E248: 30 | F248: 35 | G248: 312 | H248: -1 | I248: 20 | J248: 20 | K248: 7 | L248: 8 | M248: 80 | N248: 0 | O248: 80 | P248: 0 | Q248: 0 | R248: 0 | S248: 8 | T248: 48 | U248: 0 | V248: -1 | W248: -1 | X248: -1 | Y248: -1 | Z248: -1 | AA248: 2137 | AB248: 1 | AC248: Very Rare Adamantium Two Handed Axe | AN248: =COUNTIF(knownSpells_humans!C[-39],RC[-1]) -> 0
A249: 0 | B249: 2A_Hunter4 | C249: 40 | D249: 45 | E249: 30 | F249: 35 | G249: 312 | H249: -1 | I249: 21 | J249: 21 | K249: 7 | L249: 9 | M249: 80 | N249: 0 | O249: 0 | P249: 0 | Q249: 0 | R249: 80 | S249: 14 | T249: 14 | U249: 1 | V249: 20 | W249: 5 | X249: -1 | Y249: -1 | Z249: -1 | AA249: 2138 | AB249: 1 | AC249: Rare Magic Wood Long Bow | AN249: =COUNTIF(knownSpells_humans!C[-39],RC[-1]) -> 0
A250: 0 | B250: 2F_Sword3_NPC | C250: 45 | D250: 40 | E250: 30 | F250: 45 | G250: 297 | H250: -1 | I250: 20 | J250: 20 | K250: 7 | L250: 8 | M250: 60 | N250: 60 | O250: 60 | P250: 60 | Q250: 60 | R250: 60 | S250: 5 | T250: 42 | U250: 0 | V250: 7 | W250: 4 | X250: -1 | Y250: -1 | Z250: -1 | AA250: 2139 | AB250: 1 | AC250: Very Rare Adamantium Two Handed Sword | AE250: Uncommon Steel Plate Helm | AF250: Uncommon Steel Scale Mail | AG250: Uncommon Steel Plate Boots | AH250: Uncommon Steel Plate Cuirass | AI250: Uncommon Steel Scale Gauntlets | AJ250: Uncommon Steel Plate Bracers | AK250: Uncommon Silver Ring { protectionFire=100, protectionWater=100, protectionAir=100, protectionEarth=100, protectionAstral=50, Spirit=15 } | AN250: =COUNTIF(knownSpells_humans!C[-39],RC[-1]) -> 0
A251: 0 | B251: 2F_Axe3_NPC | C251: 45 | D251: 40 | E251: 30 | F251: 45 | G251: 297 | H251: -1 | I251: 20 | J251: 20 | K251: 7 | L251: 8 | M251: 60 | N251: 60 | O251: 60 | P251: 60 | Q251: 60 | R251: 60 | S251: 9 | T251: 42 | U251: 0 | V251: 7 | W251: 4 | X251: -1 | Y251: -1 | Z251: -1 | AA251: 2140 | AB251: 1 | AC251: Very Rare Adamantium Two Handed Axe | AE251: Uncommon Steel Plate Helm | AF251: Uncommon Steel Scale Mail | AG251: Uncommon Steel Plate Boots | AH251: Uncommon Steel Plate Cuirass | AI251: Uncommon Steel Scale Gauntlets | AJ251: Uncommon Steel Plate Bracers | AK251: Uncommon Silver Ring { protectionFire=100, protectionWater=100, protectionAir=100, protectionEarth=100, protectionAstral=50, Spirit=15 } | AN251: =COUNTIF(knownSpells_humans!C[-39],RC[-1]) -> 0
A252: 0 | B252: 2F_Club3_NPC | C252: 45 | D252: 40 | E252: 30 | F252: 45 | G252: 297 | H252: -1 | I252: 20 | J252: 20 | K252: 7 | L252: 8 | M252: 60 | N252: 60 | O252: 60 | P252: 60 | Q252: 60 | R252: 60 | S252: 10 | T252: 42 | U252: 0 | V252: 7 | W252: 4 | X252: -1 | Y252: -1 | Z252: -1 | AA252: 2141 | AB252: 1 | AC252: Rare Adamantium Mace | AE252: Uncommon Steel Plate Helm | AF252: Uncommon Steel Scale Mail | AG252: Uncommon Steel Plate Boots | AH252: Uncommon Steel Plate Cuirass | AI252: Uncommon Steel Scale Gauntlets | AJ252: Uncommon Steel Plate Bracers | AK252: Uncommon Silver Ring { protectionFire=100, protectionWater=100, protectionAir=100, protectionEarth=100, protectionAstral=50, Spirit=15 } | AN252: =COUNTIF(knownSpells_humans!C[-39],RC[-1]) -> 0
A253: 0 | B253: 2F_Pike3_NPC | C253: 45 | D253: 40 | E253: 30 | F253: 45 | G253: 297 | H253: -1 | I253: 20 | J253: 20 | K253: 7 | L253: 8 | M253: 60 | N253: 60 | O253: 60 | P253: 60 | Q253: 60 | R253: 60 | S253: 12 | T253: 42 | U253: 0 | V253: 7 | W253: 4 | X253: -1 | Y253: -1 | Z253: -1 | AA253: 2142 | AB253: 1 | AC253: Very Rare Adamantium Pike | AE253: Uncommon Steel Plate Helm | AF253: Uncommon Steel Scale Mail | AG253: Uncommon Steel Plate Boots | AH253: Uncommon Steel Plate Cuirass | AI253: Uncommon Steel Scale Gauntlets | AJ253: Uncommon Steel Plate Bracers | AK253: Uncommon Silver Ring { protectionFire=100, protectionWater=100, protectionAir=100, protectionEarth=100, protectionAstral=50, Spirit=15 } | AN253: =COUNTIF(knownSpells_humans!C[-39],RC[-1]) -> 0
A254: 0 | B254: 2F_Bow3_NPC | C254: 45 | D254: 40 | E254: 30 | F254: 45 | G254: 297 | H254: -1 | I254: 20 | J254: 20 | K254: 7 | L254: 8 | M254: 60 | N254: 60 | O254: 60 | P254: 60 | Q254: 60 | R254: 60 | S254: 15 | T254: 42 | U254: 0 | V254: 7 | W254: 4 | X254: -1 | Y254: -1 | Z254: -1 | AA254: 2143 | AB254: 1 | AC254: Very Rare Adamantium Crossbow | AE254: Uncommon Steel Plate Helm | AF254: Uncommon Steel Scale Mail | AG254: Uncommon Steel Plate Boots | AH254: Uncommon Steel Plate Cuirass | AI254: Uncommon Steel Scale Gauntlets | AJ254: Uncommon Steel Plate Bracers | AK254: Uncommon Silver Ring { protectionFire=100, protectionWater=100, protectionAir=100, protectionEarth=100, protectionAstral=50, Spirit=15 } | AN254: =COUNTIF(knownSpells_humans!C[-39],RC[-1]) -> 0
A255: 0 | B255: 2F_Knight3_73 | C255: 45 | D255: 40 | E255: 30 | F255: 30 | G255: 297 | H255: -1 | I255: 20 | J255: 20 | K255: 7 | L255: 8 | M255: 60 | N255: 60 | O255: 0 | P255: 0 | Q255: 0 | R255: 0 | S255: 4 | T255: 42 | U255: 0 | V255: 7 | W255: 4 | X255: -1 | Y255: -1 | Z255: -1 | AA255: 2144 | AB255: 1 | AC255: Uncommon Steel Long Sword | AD255: Uncommon Steel Large Shield | AE255: Uncommon Steel Plate Helm | AF255: Uncommon Steel Scale Mail | AG255: Uncommon Steel Plate Boots | AH255: Uncommon Steel Plate Cuirass | AI255: Uncommon Steel Scale Gauntlets | AJ255: Uncommon Steel Plate Bracers | AN255: =COUNTIF(knownSpells_humans!C[-39],RC[-1]) -> 0
A256: 0 | B256: 2A_Knight3_73 | C256: 40 | D256: 45 | E256: 30 | F256: 30 | G256: 264 | H256: -1 | I256: 21 | J256: 21 | K256: 7 | L256: 9 | M256: 60 | N256: 0 | O256: 0 | P256: 0 | Q256: 0 | R256: 60 | S256: 15 | T256: 4 | U256: 1 | V256: 8 | W256: 16 | X256: -1 | Y256: -1 | Z256: -1 | AA256: 2145 | AB256: 1 | AC256: Uncommon Steel Crossbow | AE256: Uncommon Steel Plate Helm | AF256: Uncommon Steel Scale Mail | AG256: Uncommon Steel Plate Boots | AH256: Uncommon Steel Plate Cuirass | AI256: Uncommon Steel Scale Gauntlets | AJ256: Uncommon Steel Plate Bracers | AN256: =COUNTIF(knownSpells_humans!C[-39],RC[-1]) -> 0
A257: 0 | B257: 2H_Knight3_73 | C257: 45 | D257: 40 | E257: 30 | F257: 30 | G257: 297 | H257: -1 | I257: 20 | J257: 20 | K257: 7 | L257: 8 | M257: 60 | N257: 0 | O257: 0 | P257: 0 | Q257: 60 | R257: 0 | S257: 21 | T257: 42 | U257: 0 | V257: 10 | W257: 4 | X257: 1 | Y257: -1 | Z257: -1 | AA257: 2146 | AB257: 1 | AC257: Uncommon Steel Pike | AD257: Uncommon Steel Large Shield | AE257: Uncommon Steel Plate Helm | AF257: Uncommon Steel Scale Mail | AG257: Uncommon Steel Plate Boots | AH257: Uncommon Steel Plate Cuirass | AI257: Uncommon Steel Scale Gauntlets | AJ257: Uncommon Steel Plate Bracers | AN257: =COUNTIF(knownSpells_humans!C[-39],RC[-1]) -> 0
A258: 0 | B258: 2M_Knight3_73 | C258: 30 | D258: 30 | E258: 40 | F258: 45 | G258: 99 | H258: 297 | I258: 18 | J258: 18 | K258: 7 | L258: 6 | M258: 60 | N258: 60 | O258: 60 | P258: 60 | Q258: 60 | R258: 60 | S258: 24 | T258: 16 | U258: 1 | V258: -1 | W258: -1 | X258: -1 | Y258: -1 | Z258: 12 | AA258: 2147 | AB258: 0 | AC258: Very Rare Magic Wood Staff {castSpell=Lightning:10} | AE258: Rare Robe | AF258: Rare Cape | AG258: Very Rare Gold Ring | AM258: [258] | AN258: =COUNTIF(knownSpells_humans!C[-39],RC[-1]) -> 5
A259: 0 | B259: 2F_KnightLeader3_73 | C259: 50 | D259: 45 | E259: 35 | F259: 35 | G259: 390 | H259: -1 | I259: 21 | J259: 21 | K259: 7 | L259: 9 | M259: 80 | N259: 80 | O259: 0 | P259: 0 | Q259: 0 | R259: 0 | S259: 5 | T259: 49 | U259: 0 | V259: 10 | W259: 4 | X259: -1 | Y259: -1 | Z259: -1 | AA259: 2148 | AB259: 1 | AC259: Uncommon Steel Two Handed Sword | AE259: Uncommon Steel Plate Helm | AF259: Uncommon Steel Scale Mail | AG259: Uncommon Steel Plate Boots | AH259: Uncommon Steel Plate Cuirass | AI259: Uncommon Steel Scale Gauntlets | AJ259: Uncommon Steel Plate Bracers | AN259: =COUNTIF(knownSpells_humans!C[-39],RC[-1]) -> 0
A260: 0 | B260: 2F_Knight2_51 | C260: 40 | D260: 35 | E260: 25 | F260: 25 | G260: 216 | H260: -1 | I260: 19 | J260: 19 | K260: 6 | L260: 7 | M260: 40 | N260: 40 | O260: 0 | P260: 0 | Q260: 0 | R260: 0 | S260: 4 | T260: 42 | U260: 0 | V260: 7 | W260: 4 | X260: -1 | Y260: -1 | Z260: -1 | AA260: 2149 | AB260: 1 | AC260: Iron Long Sword | AD260: Iron Small Shield | AE260: Iron Plate Helm | AF260: Iron Plate Cuirass | AG260: Iron Plate Bracers | AH260: Iron Plate Boots | AI260: Iron Scale Gauntlets | AN260: =COUNTIF(knownSpells_humans!C[-39],RC[-1]) -> 0
A261: 0 | B261: 2A_Knight2_51 | C261: 35 | D261: 40 | E261: 25 | F261: 25 | G261: 189 | H261: -1 | I261: 20 | J261: 20 | K261: 7 | L261: 8 | M261: 40 | N261: 0 | O261: 0 | P261: 0 | Q261: 0 | R261: 40 | S261: 15 | T261: 4 | U261: 1 | V261: 8 | W261: 16 | X261: -1 | Y261: -1 | Z261: -1 | AA261: 2150 | AB261: 1 | AC261: Wood Crossbow | AE261: Iron Plate Helm | AF261: Iron Plate Cuirass | AG261: Iron Plate Bracers | AH261: Iron Plate Boots | AI261: Iron Scale Gauntlets | AN261: =COUNTIF(knownSpells_humans!C[-39],RC[-1]) -> 0
A262: 0 | B262: 2H_Knight2_51 | C262: 40 | D262: 35 | E262: 25 | F262: 25 | G262: 216 | H262: -1 | I262: 19 | J262: 19 | K262: 6 | L262: 7 | M262: 40 | N262: 0 | O262: 0 | P262: 0 | Q262: 40 | R262: 0 | S262: 21 | T262: 42 | U262: 0 | V262: 10 | W262: 4 | X262: 1 | Y262: -1 | Z262: -1 | AA262: 2151 | AB262: 1 | AC262: Iron Pike | AD262: Iron Small Shield | AE262: Iron Plate Helm | AF262: Iron Plate Cuirass | AG262: Iron Plate Bracers | AH262: Iron Plate Boots | AI262: Iron Scale Gauntlets | AN262: =COUNTIF(knownSpells_humans!C[-39],RC[-1]) -> 0
A263: 0 | B263: 2M_Knight2_51 | C263: 25 | D263: 25 | E263: 35 | F263: 40 | G263: 68 | H263: 216 | I263: 17 | J263: 17 | K263: 6 | L263: 5 | M263: 40 | N263: 40 | O263: 40 | P263: 40 | Q263: 40 | R263: 40 | S263: 24 | T263: 16 | U263: 1 | V263: -1 | W263: -1 | X263: -1 | Y263: -1 | Z263: 12 | AA263: 2152 | AB263: 0 | AC263: Uncommon Wood Staff {castSpell=Fire_Arrow:5} | AE263: Rare Robe | AF263: Uncommon Cape | AG263: Rare Mithrill Ring | AM263: [263] | AN263: =COUNTIF(knownSpells_humans!C[-39],RC[-1]) -> 4
A264: 0 | B264: 2F_KnightLeader2_51 | C264: 45 | D264: 40 | E264: 30 | F264: 30 | G264: 297 | H264: -1 | I264: 20 | J264: 20 | K264: 7 | L264: 8 | M264: 60 | N264: 60 | O264: 0 | P264: 0 | Q264: 0 | R264: 0 | S264: 5 | T264: 49 | U264: 0 | V264: 10 | W264: 4 | X264: -1 | Y264: -1 | Z264: -1 | AA264: 2153 | AB264: 1 | AC264: Iron Two Handed Sword | AE264: Iron Plate Helm | AF264: Iron Plate Cuirass | AG264: Iron Plate Bracers | AH264: Iron Plate Boots | AI264: Iron Scale Gauntlets | AN264: =COUNTIF(knownSpells_humans!C[-39],RC[-1]) -> 0
A265: 0 | B265: 2MercenaryXBowmanBase | C265: 30 | D265: 35 | E265: 15 | F265: 20 | G265: 90 | H265: -1 | I265: 19 | J265: 19 | K265: 6 | L265: 7 | M265: 0 | N265: 0 | O265: 0 | P265: 0 | Q265: 0 | R265: 23 | S265: 15 | T265: 12 | U265: 1 | V265: 8 | W265: 16 | X265: -1 | Y265: -1 | Z265: -1 | AA265: 10010 | AB265: 1 | AC265: Wood Crossbow | AN265: =COUNTIF(knownSpells_humans!C[-39],RC[-1]) -> 0
A266: 0 | B266: 2MercenaryXBowman30 | C266: 30 | D266: 35 | E266: 15 | F266: 20 | G266: 90 | H266: -1 | I266: 19 | J266: 19 | K266: 6 | L266: 7 | M266: 0 | N266: 0 | O266: 0 | P266: 0 | Q266: 0 | R266: 23 | S266: 15 | T266: 12 | U266: 1 | V266: 8 | W266: 16 | X266: -1 | Y266: -1 | Z266: -1 | AA266: 10011 | AB266: 1 | AC266: Wood Crossbow | AE266: Hard Leather Mail | AF266: Uncommon Hard Leather Boots | AG266: Hard Leather Bracers | AH266: Uncommon Hard Leather Gauntlets | AN266: =COUNTIF(knownSpells_humans!C[-39],RC[-1]) -> 0
A267: 0 | B267: 2MercenaryXBowman40 | C267: 30 | D267: 35 | E267: 15 | F267: 20 | G267: 90 | H267: -1 | I267: 19 | J267: 19 | K267: 6 | L267: 7 | M267: 0 | N267: 0 | O267: 0 | P267: 0 | Q267: 0 | R267: 32 | S267: 15 | T267: 12 | U267: 1 | V267: 8 | W267: 16 | X267: -1 | Y267: -1 | Z267: -1 | AA267: 10012 | AB267: 1 | AC267: Uncommon Steel Crossbow | AE267: Hard Leather Mail | AF267: Uncommon Hard Leather Boots | AG267: Hard Leather Bracers | AH267: Uncommon Hard Leather Gauntlets | AI267: Bronze Cuirass | AN267: =COUNTIF(knownSpells_humans!C[-39],RC[-1]) -> 0
A268: 0 | B268: 2MercenaryXBowman50 | C268: 30 | D268: 35 | E268: 15 | F268: 20 | G268: 90 | H268: -1 | I268: 19 | J268: 19 | K268: 6 | L268: 7 | M268: 0 | N268: 0 | O268: 0 | P268: 0 | Q268: 0 | R268: 41 | S268: 15 | T268: 12 | U268: 1 | V268: 8 | W268: 16 | X268: -1 | Y268: -1 | Z268: -1 | AA268: 10013 | AB268: 1 | AC268: Uncommon Steel Crossbow | AE268: Hard Leather Mail | AF268: Uncommon Hard Leather Boots | AG268: Hard Leather Bracers | AH268: Uncommon Hard Leather Gauntlets | AI268: Bronze Cuirass | AJ268: Uncommon Hard Leather Helm | AN268: =COUNTIF(knownSpells_humans!C[-39],RC[-1]) -> 0
A269: 0 | B269: 2MercenaryXBowman60 | C269: 30 | D269: 35 | E269: 15 | F269: 20 | G269: 90 | H269: -1 | I269: 19 | J269: 19 | K269: 6 | L269: 7 | M269: 0 | N269: 0 | O269: 0 | P269: 0 | Q269: 0 | R269: 50 | S269: 15 | T269: 12 | U269: 1 | V269: 8 | W269: 16 | X269: -1 | Y269: -1 | Z269: -1 | AA269: 10014 | AB269: 1 | AC269: Rare Mithrill Crossbow | AE269: Uncommon Steel Chain Mail | AF269: Uncommon Hard Leather Boots | AG269: Hard Leather Bracers | AH269: Uncommon Hard Leather Gauntlets | AI269: Uncommon Steel Chain Helm | AN269: =COUNTIF(knownSpells_humans!C[-39],RC[-1]) -> 0
A270: 0 | B270: 2MercenaryXBowman70 | C270: 30 | D270: 35 | E270: 15 | F270: 20 | G270: 90 | H270: -1 | I270: 19 | J270: 19 | K270: 6 | L270: 7 | M270: 0 | N270: 0 | O270: 0 | P270: 0 | Q270: 0 | R270: 59 | S270: 15 | T270: 12 | U270: 1 | V270: 8 | W270: 16 | X270: -1 | Y270: -1 | Z270: -1 | AA270: 10015 | AB270: 1 | AC270: Rare Mithrill Crossbow | AE270: Uncommon Steel Chain Mail | AF270: Uncommon Steel Chain Boots | AG270: Hard Leather Bracers | AH270: Uncommon Steel Chain Gauntlets | AI270: Uncommon Steel Chain Helm | AN270: =COUNTIF(knownSpells_humans!C[-39],RC[-1]) -> 0
A271: 0 | B271: 2MercenaryXBowman80 | C271: 30 | D271: 35 | E271: 15 | F271: 20 | G271: 90 | H271: -1 | I271: 19 | J271: 19 | K271: 6 | L271: 7 | M271: 0 | N271: 0 | O271: 0 | P271: 0 | Q271: 0 | R271: 68 | S271: 15 | T271: 12 | U271: 1 | V271: 8 | W271: 16 | X271: -1 | Y271: -1 | Z271: -1 | AA271: 10016 | AB271: 1 | AC271: Very Rare Adamantium Crossbow | AE271: Rare Mithrill Chain Mail | AF271: Uncommon Steel Chain Boots | AG271: Uncommon Steel Bracers | AH271: Uncommon Steel Chain Gauntlets | AI271: Uncommon Steel Chain Helm | AN271: =COUNTIF(knownSpells_humans!C[-39],RC[-1]) -> 0
A272: 0 | B272: 2MercenaryXBowman90 | C272: 30 | D272: 35 | E272: 15 | F272: 20 | G272: 90 | H272: -1 | I272: 19 | J272: 19 | K272: 6 | L272: 7 | M272: 0 | N272: 0 | O272: 0 | P272: 0 | Q272: 0 | R272: 77 | S272: 15 | T272: 12 | U272: 1 | V272: 8 | W272: 16 | X272: -1 | Y272: -1 | Z272: -1 | AA272: 10017 | AB272: 1 | AC272: Very Rare Adamantium Crossbow | AE272: Rare Mithrill Chain Mail | AF272: Rare Mithrill Chain Boots | AG272: Uncommon Steel Bracers | AH272: Uncommon Steel Chain Gauntlets | AI272: Uncommon Steel Chain Helm | AN272: =COUNTIF(knownSpells_humans!C[-39],RC[-1]) -> 0
A273: 0 | B273: 2MercenaryXBowman100 | C273: 30 | D273: 35 | E273: 15 | F273: 20 | G273: 90 | H273: -1 | I273: 19 | J273: 19 | K273: 6 | L273: 7 | M273: 0 | N273: 0 | O273: 0 | P273: 0 | Q273: 0 | R273: 86 | S273: 15 | T273: 12 | U273: 1 | V273: 8 | W273: 16 | X273: -1 | Y273: -1 | Z273: -1 | AA273: 10018 | AB273: 1 | AC273: Very Rare Meteoric Crossbow | AE273: Rare Mithrill Chain Mail | AF273: Rare Mithrill Chain Boots | AG273: Rare Mithrill Bracers | AH273: Rare Mithrill Chain Gauntlets | AI273: Rare Mithrill Chain Helm | AN273: =COUNTIF(knownSpells_humans!C[-39],RC[-1]) -> 0
A274: 0 | B274: 2MercenaryXBowman110 | C274: 30 | D274: 35 | E274: 15 | F274: 20 | G274: 90 | H274: -1 | I274: 19 | J274: 19 | K274: 6 | L274: 7 | M274: 0 | N274: 0 | O274: 0 | P274: 0 | Q274: 0 | R274: 95 | S274: 15 | T274: 12 | U274: 1 | V274: 8 | W274: 16 | X274: -1 | Y274: -1 | Z274: -1 | AA274: 10019 | AB274: 1 | AC274: Very Rare Meteoric Crossbow | AE274: Rare Mithrill Chain Mail | AF274: Rare Mithrill Chain Boots | AG274: Rare Mithrill Bracers | AH274: Rare Mithrill Chain Gauntlets | AI274: Rare Mithrill Chain Helm | AN274: =COUNTIF(knownSpells_humans!C[-39],RC[-1]) -> 0
A275: 0 | B275: 2MercenaryKnightBase | C275: 43 | D275: 35 | E275: 25 | F275: 17 | G275: 50 | H275: -1 | I275: 19 | J275: 19 | K275: 6 | L275: 7 | M275: 0 | N275: 25 | O275: 0 | P275: 0 | Q275: 0 | R275: 0 | S275: 5 | T275: 36 | U275: 0 | V275: 10 | W275: 4 | X275: -1 | Y275: -1 | Z275: -1 | AA275: 10020 | AB275: 1 | AC275: Uncommon Steel Two Handed Sword | AE275: Uncommon Steel Chain Mail | AF275: Uncommon Steel Plate Cuirass | AG275: Uncommon Steel Plate Bracers | AH275: Uncommon Steel Plate Boots | AI275: Uncommon Steel Scale Gauntlets | AN275: =COUNTIF(knownSpells_humans!C[-39],RC[-1]) -> 0
A276: 0 | B276: 2MercenaryKnight30 | C276: 43 | D276: 35 | E276: 25 | F276: 17 | G276: 50 | H276: -1 | I276: 19 | J276: 19 | K276: 6 | L276: 7 | M276: 0 | N276: 25 | O276: 0 | P276: 0 | Q276: 0 | R276: 0 | S276: 5 | T276: 36 | U276: 0 | V276: 10 | W276: 4 | X276: -1 | Y276: -1 | Z276: -1 | AA276: 10021 | AB276: 1 | AC276: Uncommon Steel Two Handed Sword | AE276: Uncommon Steel Chain Mail | AF276: Uncommon Steel Plate Cuirass | AG276: Uncommon Steel Plate Bracers | AH276: Uncommon Steel Plate Boots | AI276: Uncommon Steel Scale Gauntlets | AJ276: Uncommon Steel Helm | AN276: =COUNTIF(knownSpells_humans!C[-39],RC[-1]) -> 0
A277: 0 | B277: 2MercenaryKnight40 | C277: 43 | D277: 35 | E277: 25 | F277: 17 | G277: 50 | H277: -1 | I277: 19 | J277: 19 | K277: 6 | L277: 7 | M277: 0 | N277: 34 | O277: 0 | P277: 0 | Q277: 0 | R277: 0 | S277: 5 | T277: 36 | U277: 0 | V277: 10 | W277: 4 | X277: -1 | Y277: -1 | Z277: -1 | AA277: 10022 | AB277: 1 | AC277: Rare Mithrill Two Handed Sword | AE277: Rare Mithrill Chain Mail | AF277: Uncommon Steel Plate Cuirass | AG277: Uncommon Steel Plate Bracers | AH277: Uncommon Steel Plate Boots | AI277: Uncommon Steel Scale Gauntlets | AJ277: Rare Mithrill Ring | AK277: Rare Mithrill Amulet | AL277: Uncommon Steel Helm | AN277: =COUNTIF(knownSpells_humans!C[-39],RC[-1]) -> 0
A278: 0 | B278: 2MercenaryKnight50 | C278: 43 | D278: 35 | E278: 25 | F278: 17 | G278: 50 | H278: -1 | I278: 19 | J278: 19 | K278: 6 | L278: 7 | M278: 0 | N278: 43 | O278: 0 | P278: 0 | Q278: 0 | R278: 0 | S278: 5 | T278: 36 | U278: 0 | V278: 10 | W278: 4 | X278: -1 | Y278: -1 | Z278: -1 | AA278: 10023 | AB278: 1 | AC278: Rare Mithrill Two Handed Sword | AE278: Rare Mithrill Chain Mail | AF278: Rare Mithrill Plate Cuirass | AG278: Rare Mithrill Plate Bracers | AH278: Rare Mithrill Plate Boots | AI278: Rare Mithrill Scale Gauntlets | AJ278: Rare Mithrill Ring | AK278: Rare Mithrill Amulet | AL278: Rare Mithrill Helm | AN278: =COUNTIF(knownSpells_humans!C[-39],RC[-1]) -> 0
A279: 0 | B279: 2MercenaryKnight60 | C279: 43 | D279: 35 | E279: 25 | F279: 17 | G279: 50 | H279: -1 | I279: 19 | J279: 19 | K279: 6 | L279: 7 | M279: 0 | N279: 52 | O279: 0 | P279: 0 | Q279: 0 | R279: 0 | S279: 5 | T279: 36 | U279: 0 | V279: 10 | W279: 4 | X279: -1 | Y279: -1 | Z279: -1 | AA279: 10024 | AB279: 1 | AC279: Very Rare Adamantium Two Handed Sword | AE279: Very Rare Adamantium Scale Mail | AF279: Very Rare Adamantium Plate Cuirass | AG279: Rare Mithrill Plate Bracers | AH279: Rare Mithrill Plate Boots | AI279: Rare Mithrill Scale Gauntlets | AJ279: Very Rare Adamantium Ring | AK279: Very Rare Adamantium Amulet | AL279: Rare Mithrill Helm | AN279: =COUNTIF(knownSpells_humans!C[-39],RC[-1]) -> 0
A280: 0 | B280: 2MercenaryKnight70 | C280: 43 | D280: 35 | E280: 25 | F280: 17 | G280: 50 | H280: -1 | I280: 19 | J280: 19 | K280: 6 | L280: 7 | M280: 0 | N280: 61 | O280: 0 | P280: 0 | Q280: 0 | R280: 0 | S280: 5 | T280: 36 | U280: 0 | V280: 10 | W280: 4 | X280: -1 | Y280: -1 | Z280: -1 | AA280: 10025 | AB280: 1 | AC280: Very Rare Adamantium Two Handed Sword | AE280: Very Rare Adamantium Scale Mail | AF280: Very Rare Adamantium Plate Cuirass | AG280: Very Rare Adamantium Plate Bracers | AH280: Very Rare Adamantium Plate Boots | AI280: Very Rare Adamantium Scale Gauntlets | AJ280: Very Rare Adamantium Ring | AK280: Very Rare Adamantium Amulet | AL280: Very Rare Adamantium Helm | AN280: =COUNTIF(knownSpells_humans!C[-39],RC[-1]) -> 0
A281: 0 | B281: 2MercenaryKnight80 | C281: 43 | D281: 35 | E281: 25 | F281: 17 | G281: 50 | H281: -1 | I281: 19 | J281: 19 | K281: 6 | L281: 7 | M281: 0 | N281: 70 | O281: 0 | P281: 0 | Q281: 0 | R281: 0 | S281: 5 | T281: 36 | U281: 0 | V281: 10 | W281: 4 | X281: -1 | Y281: -1 | Z281: -1 | AA281: 10026 | AB281: 1 | AC281: Very Rare Meteoric Two Handed Sword | AE281: Very Rare Meteoric Scale Mail | AF281: Very Rare Adamantium Plate Cuirass | AG281: Very Rare Adamantium Plate Bracers | AH281: Very Rare Adamantium Plate Boots | AI281: Very Rare Adamantium Scale Gauntlets | AJ281: Very Rare Meteoric Ring | AK281: Very Rare Meteoric Amulet | AL281: Very Rare Adamantium Helm | AN281: =COUNTIF(knownSpells_humans!C[-39],RC[-1]) -> 0
A282: 0 | B282: 2MercenaryKnight90 | C282: 43 | D282: 35 | E282: 25 | F282: 17 | G282: 50 | H282: -1 | I282: 19 | J282: 19 | K282: 6 | L282: 7 | M282: 0 | N282: 79 | O282: 0 | P282: 0 | Q282: 0 | R282: 0 | S282: 5 | T282: 36 | U282: 0 | V282: 10 | W282: 4 | X282: -1 | Y282: -1 | Z282: -1 | AA282: 10027 | AB282: 1 | AC282: Very Rare Meteoric Two Handed Sword | AE282: Very Rare Meteoric Scale Mail | AF282: Very Rare Meteoric Plate Cuirass | AG282: Very Rare Meteoric Plate Bracers | AH282: Very Rare Meteoric Plate Boots | AI282: Very Rare Meteoric Scale Gauntlets | AJ282: Very Rare Meteoric Ring | AK282: Very Rare Meteoric Amulet | AL282: Very Rare Meteoric Helm | AN282: =COUNTIF(knownSpells_humans!C[-39],RC[-1]) -> 0
A283: 0 | B283: 2MercenaryKnight100 | C283: 43 | D283: 35 | E283: 25 | F283: 17 | G283: 50 | H283: -1 | I283: 19 | J283: 19 | K283: 6 | L283: 7 | M283: 0 | N283: 88 | O283: 0 | P283: 0 | Q283: 0 | R283: 0 | S283: 5 | T283: 36 | U283: 0 | V283: 10 | W283: 4 | X283: -1 | Y283: -1 | Z283: -1 | AA283: 10028 | AB283: 1 | AC283: Very Rare Crystal Two Handed Sword | AE283: Very Rare Meteoric Scale Mail | AF283: Very Rare Crystal Plate Cuirass | AG283: Very Rare Meteoric Plate Bracers | AH283: Very Rare Meteoric Plate Boots | AI283: Very Rare Meteoric Scale Gauntlets | AJ283: Very Rare Crystal Ring | AK283: Very Rare Crystal Amulet | AL283: Very Rare Crystal Plate Helm | AN283: =COUNTIF(knownSpells_humans!C[-39],RC[-1]) -> 0
A284: 0 | B284: 2MercenaryKnight110 | C284: 43 | D284: 35 | E284: 25 | F284: 17 | G284: 50 | H284: -1 | I284: 19 | J284: 19 | K284: 6 | L284: 7 | M284: 0 | N284: 97 | O284: 0 | P284: 0 | Q284: 0 | R284: 0 | S284: 5 | T284: 36 | U284: 0 | V284: 10 | W284: 4 | X284: -1 | Y284: -1 | Z284: -1 | AA284: 10029 | AB284: 1 | AC284: Very Rare Crystal Two Handed Sword | AE284: Very Rare Meteoric Scale Mail | AF284: Very Rare Crystal Plate Cuirass | AG284: Very Rare Crystal Plate Bracers | AH284: Very Rare Crystal Plate Boots | AI284: Very Rare Crystal Scale Gauntlets | AJ284: Very Rare Crystal Ring{ defence=10} | AK284: Very Rare Crystal Amulet {defence=15} | AL284: Very Rare Crystal Plate Helm | AN284: =COUNTIF(knownSpells_humans!C[-39],RC[-1]) -> 0
A285: 0 | B285: 2MercenaryMageBase | C285: 20 | D285: 27 | E285: 39 | F285: 42 | G285: 30 | H285: 70 | I285: 17 | J285: 17 | K285: 7 | L285: 5 | M285: 0 | N285: 0 | O285: 0 | P285: 50 | Q285: 40 | R285: 30 | S285: 23 | T285: 17 | U285: 0 | V285: -1 | W285: -1 | X285: -1 | Y285: -1 | Z285: 12 | AA285: 10060 | AB285: 0 | AE285: Rare Shoes | AF285: Rare Dress | AG285: Rare Cape | AM285: [285] | AN285: =COUNTIF(knownSpells_humans!C[-39],RC[-1]) -> 7
A286: 0 | B286: 2MercenaryMage60 | C286: 20 | D286: 27 | E286: 39 | F286: 42 | G286: 30 | H286: 70 | I286: 17 | J286: 17 | K286: 7 | L286: 5 | M286: 0 | N286: 0 | O286: 0 | P286: 50 | Q286: 40 | R286: 30 | S286: 23 | T286: 17 | U286: 0 | V286: -1 | W286: -1 | X286: -1 | Y286: -1 | Z286: 12 | AA286: 10064 | AB286: 0 | AE286: Rare Shoes | AF286: Rare Dress | AG286: Rare Cape | AM286: [286] | AN286: =COUNTIF(knownSpells_humans!C[-39],RC[-1]) -> 7
A287: 0 | B287: 2MercenaryMage70 | C287: 20 | D287: 27 | E287: 39 | F287: 42 | G287: 30 | H287: 70 | I287: 17 | J287: 17 | K287: 7 | L287: 5 | M287: 0 | N287: 0 | O287: 0 | P287: 59 | Q287: 47 | R287: 35 | S287: 23 | T287: 17 | U287: 0 | V287: -1 | W287: -1 | X287: -1 | Y287: -1 | Z287: 12 | AA287: 10065 | AB287: 0 | AE287: Rare Shoes | AF287: Rare Dress | AG287: Rare Cape | AM287: [287] | AN287: =COUNTIF(knownSpells_humans!C[-39],RC[-1]) -> 8
A288: 0 | B288: 2MercenaryMage80 | C288: 20 | D288: 27 | E288: 39 | F288: 42 | G288: 30 | H288: 70 | I288: 17 | J288: 17 | K288: 7 | L288: 5 | M288: 0 | N288: 0 | O288: 0 | P288: 68 | Q288: 54 | R288: 40 | S288: 23 | T288: 17 | U288: 0 | V288: -1 | W288: -1 | X288: -1 | Y288: -1 | Z288: 12 | AA288: 10066 | AB288: 0 | AE288: Rare Shoes | AF288: Rare Dress | AG288: Rare Cape | AM288: [288] | AN288: =COUNTIF(knownSpells_humans!C[-39],RC[-1]) -> 10
A289: 0 | B289: 2MercenaryMage90 | C289: 20 | D289: 27 | E289: 39 | F289: 42 | G289: 30 | H289: 70 | I289: 17 | J289: 17 | K289: 7 | L289: 5 | M289: 0 | N289: 0 | O289: 0 | P289: 77 | Q289: 61 | R289: 45 | S289: 23 | T289: 17 | U289: 0 | V289: -1 | W289: -1 | X289: -1 | Y289: -1 | Z289: 12 | AA289: 10067 | AB289: 0 | AE289: Rare Shoes | AF289: Rare Dress | AG289: Rare Cape | AM289: [289] | AN289: =COUNTIF(knownSpells_humans!C[-39],RC[-1]) -> 11
A290: 0 | B290: 2MercenaryMage100 | C290: 20 | D290: 27 | E290: 39 | F290: 42 | G290: 30 | H290: 70 | I290: 17 | J290: 17 | K290: 7 | L290: 5 | M290: 0 | N290: 0 | O290: 0 | P290: 86 | Q290: 68 | R290: 50 | S290: 23 | T290: 17 | U290: 0 | V290: -1 | W290: -1 | X290: -1 | Y290: -1 | Z290: 12 | AA290: 10068 | AB290: 0 | AE290: Rare Shoes | AF290: Rare Dress | AG290: Rare Cape | AM290: [290] | AN290: =COUNTIF(knownSpells_humans!C[-39],RC[-1]) -> 12
A291: 0 | B291: 2MercenaryMage110 | C291: 20 | D291: 27 | E291: 39 | F291: 42 | G291: 30 | H291: 70 | I291: 17 | J291: 17 | K291: 7 | L291: 5 | M291: 0 | N291: 0 | O291: 0 | P291: 95 | Q291: 75 | R291: 55 | S291: 23 | T291: 17 | U291: 0 | V291: -1 | W291: -1 | X291: -1 | Y291: -1 | Z291: 12 | AA291: 10069 | AB291: 0 | AE291: Rare Shoes | AF291: Rare Dress | AG291: Rare Cape | AM291: [291] | AN291: =COUNTIF(knownSpells_humans!C[-39],RC[-1]) -> 12
A292: 0 | B292: DM_Swordsman | C292: 45 | D292: 39 | E292: 25 | F292: 20 | G292: 50 | H292: -1 | I292: 20 | J292: 20 | K292: 7 | L292: 8 | M292: 0 | N292: 70 | O292: 70 | P292: 70 | Q292: 70 | R292: 70 | S292: 5 | T292: 49 | U292: 0 | V292: 10 | W292: 4 | X292: -1 | Y292: -1 | Z292: -1 | AA292: 10300 | AB292: 1 | AC292: Very Rare Adamantium Long Sword | AD292: Rare Adamantium Large Shield | AE292: Very Rare Crystal Plate Cuirass | AF292: Very Rare Crystal Plate Helm | AG292: Very Rare Meteoric Scale Mail | AH292: Very Rare Crystal Plate Boots | AI292: Very Rare Crystal Scale Gauntlets | AJ292: Very Rare Crystal Plate Bracers | AN292: =COUNTIF(knownSpells_humans!C[-39],RC[-1]) -> 0
A293: 0 | B293: DM_Axeman | C293: 45 | D293: 35 | E293: 25 | F293: 20 | G293: 50 | H293: -1 | I293: 19 | J293: 19 | K293: 6 | L293: 7 | M293: 0 | N293: 70 | O293: 70 | P293: 70 | Q293: 70 | R293: 70 | S293: 5 | T293: 49 | U293: 0 | V293: 10 | W293: 4 | X293: -1 | Y293: -1 | Z293: -1 | AA293: 10301 | AB293: 1 | AC293: Very Rare Adamantium Two Handed Axe | AE293: Very Rare Crystal Plate Cuirass | AF293: Very Rare Crystal Plate Helm | AG293: Very Rare Meteoric Scale Mail | AH293: Very Rare Crystal Plate Boots | AI293: Very Rare Crystal Scale Gauntlets | AJ293: Very Rare Crystal Plate Bracers | AK293: Very Rare Crystal Ring | AL293: Very Rare Crystal Amulet | AN293: =COUNTIF(knownSpells_humans!C[-39],RC[-1]) -> 0
A294: 0 | B294: DM_Clubman | C294: 41 | D294: 35 | E294: 25 | F294: 20 | G294: 50 | H294: -1 | I294: 19 | J294: 19 | K294: 6 | L294: 7 | M294: 0 | N294: 70 | O294: 70 | P294: 70 | Q294: 70 | R294: 70 | S294: 5 | T294: 49 | U294: 0 | V294: 10 | W294: 4 | X294: -1 | Y294: -1 | Z294: -1 | AA294: 10302 | AB294: 1 | AC294: Rare Adamantium Morning Star{damageAstral=10-15} | AD294: Rare Adamantium Large Shield | AE294: Very Rare Crystal Plate Cuirass | AF294: Very Rare Crystal Plate Helm | AG294: Very Rare Meteoric Scale Mail | AH294: Very Rare Crystal Plate Boots | AI294: Very Rare Crystal Scale Gauntlets | AJ294: Very Rare Crystal Plate Bracers | AN294: =COUNTIF(knownSpells_humans!C[-39],RC[-1]) -> 0
A295: 0 | B295: DM_Pikeman | C295: 41 | D295: 45 | E295: 25 | F295: 36 | G295: 50 | H295: -1 | I295: 21 | J295: 21 | K295: 7 | L295: 9 | M295: 0 | N295: 70 | O295: 70 | P295: 70 | Q295: 70 | R295: 70 | S295: 5 | T295: 49 | U295: 0 | V295: 10 | W295: 4 | X295: -1 | Y295: -1 | Z295: -1 | AA295: 10303 | AB295: 1 | AC295: Very Rare Adamantium Pike | AD295: Rare Adamantium Large Shield | AE295: Very Rare Crystal Plate Cuirass | AF295: Very Rare Crystal Plate Helm | AG295: Very Rare Meteoric Scale Mail | AH295: Very Rare Crystal Plate Boots | AI295: Very Rare Crystal Scale Gauntlets | AJ295: Very Rare Crystal Plate Bracers | AN295: =COUNTIF(knownSpells_humans!C[-39],RC[-1]) -> 0
A296: 0 | B296: DM_Crossbowman | C296: 41 | D296: 45 | E296: 25 | F296: 36 | G296: 50 | H296: -1 | I296: 21 | J296: 21 | K296: 7 | L296: 9 | M296: 0 | N296: 70 | O296: 70 | P296: 70 | Q296: 70 | R296: 70 | S296: 5 | T296: 49 | U296: 0 | V296: 10 | W296: 4 | X296: -1 | Y296: -1 | Z296: -1 | AA296: 10304 | AB296: 1 | AC296: Very Rare Adamantium Crossbow | AE296: Very Rare Crystal Plate Cuirass | AF296: Very Rare Crystal Plate Helm | AG296: Very Rare Meteoric Scale Mail | AH296: Very Rare Crystal Plate Boots | AI296: Very Rare Crystal Scale Gauntlets | AJ296: Very Rare Crystal Plate Bracers | AN296: =COUNTIF(knownSpells_humans!C[-39],RC[-1]) -> 0
A297: 0 | B297: DM_Fire Mage | C297: 26 | D297: 33 | E297: 37 | F297: 36 | G297: 30 | H297: 70 | I297: 19 | J297: 19 | K297: 7 | L297: 7 | M297: 0 | N297: 70 | O297: 70 | P297: 70 | Q297: 70 | R297: 70 | S297: 23 | T297: 20 | U297: 1 | V297: -1 | W297: -1 | X297: -1 | Y297: -1 | Z297: 12 | AA297: 10305 | AB297: 0 | AE297: Uncommon None Shoes | AF297: None Dress {absorbtion=10} | AM297: [297] | AN297: =COUNTIF(knownSpells_humans!C[-39],RC[-1]) -> 5
A298: 0 | B298: DM_Water Mage | C298: 20 | D298: 33 | E298: 30 | F298: 42 | G298: 30 | H298: 70 | I298: 19 | J298: 19 | K298: 7 | L298: 7 | M298: 0 | N298: 70 | O298: 70 | P298: 70 | Q298: 70 | R298: 70 | S298: 23 | T298: 6 | U298: 1 | V298: -1 | W298: -1 | X298: -1 | Y298: -1 | Z298: 12 | AA298: 10306 | AB298: 0 | AE298: Uncommon None Dress | AF298: Uncommon None Cloak {absorbtion=10} | AM298: [298] | AN298: =COUNTIF(knownSpells_humans!C[-39],RC[-1]) -> 5
A299: 0 | B299: DM_Air Mage | C299: 24 | D299: 33 | E299: 35 | F299: 46 | G299: 30 | H299: 70 | I299: 19 | J299: 19 | K299: 7 | L299: 7 | M299: 0 | N299: 70 | O299: 70 | P299: 70 | Q299: 70 | R299: 70 | S299: 23 | T299: 9 | U299: 1 | V299: -1 | W299: -1 | X299: -1 | Y299: -1 | Z299: 12 | AA299: 10307 | AB299: 0 | AE299: Uncommon None Shoes | AF299: None Dress {absorbtion=10} | AM299: [299] | AN299: =COUNTIF(knownSpells_humans!C[-39],RC[-1]) -> 5
A300: 0 | B300: DM_Earth Mage | C300: 28 | D300: 33 | E300: 42 | F300: 38 | G300: 30 | H300: 70 | I300: 19 | J300: 19 | K300: 7 | L300: 7 | M300: 0 | N300: 70 | O300: 70 | P300: 70 | Q300: 70 | R300: 70 | S300: 23 | T300: 15 | U300: 0 | V300: -1 | W300: -1 | X300: -1 | Y300: -1 | Z300: 12 | AA300: 10308 | AB300: 0 | AE300: Uncommon Robe | AF300: Uncommon Cloak {absorbtion=14} | AM300: [300] | AN300: =COUNTIF(knownSpells_humans!C[-39],RC[-1]) -> 5

Sheet: knownSpells_humans
A1: PARENTID | B1: [VALUE]
A2: ParentID | B2: [value]
A3: [25] | B3: Heal
A4: [25] | B4: Shield
A5: [26] | B5: Heal
A6: [26] | B6: Shield
A7: [30] | B7: Heal
A8: [31] | B8: Heal
A9: [33] | B9: Bless
A10: [33] | B10: Fire Arrow
A11: [33] | B11: Haste
A12: [33] | B12: Heal
A13: [33] | B13: Protection from Fire
A14: [33] | B14: Shield
A15: [47] | B15: Fire Arrow
A16: [47] | B16: Fire Ball
A17: [47] | B17: Heal
A18: [47] | B18: Ice Missile
A19: [47] | B19: Invisibility
A20: [47] | B20: Poison Cloud
A21: [47] | B21: Stone Curse
A22: [47] | B22: Teleport
A23: [47] | B23: Wall of Fire
A24: [48] | B24: Blizzard
A25: [48] | B25: Diamond Dust
A26: [48] | B26: Fire Arrow
A27: [48] | B27: Invisibility
A28: [48] | B28: Lightning
A29: [48] | B29: Poison Cloud
A30: [48] | B30: Protection from Air
A31: [48] | B31: Stone Curse
A32: [48] | B32: Teleport
A33: [60] | B33: Control Spirit
A34: [60] | B34: Drain Life
A35: [60] | B35: Fire Arrow
A36: [60] | B36: Fire Ball
A37: [60] | B37: Heal
A38: [60] | B38: Ice Missile
A39: [60] | B39: Invisibility
A40: [60] | B40: Poison Cloud
A41: [60] | B41: Protection from Earth
A42: [60] | B42: Stone Curse
A43: [60] | B43: Teleport
A44: [60] | B44: Wall of Fire
A45: [61] | B45: Blizzard
A46: [61] | B46: Control Spirit
A47: [61] | B47: Diamond Dust
A48: [61] | B48: Fire Arrow
A49: [61] | B49: Invisibility
A50: [61] | B50: Light
A51: [61] | B51: Lightning
A52: [61] | B52: Poison Cloud
A53: [61] | B53: Protection from Air
A54: [61] | B54: Protection from Water
A55: [61] | B55: Stone Curse
A56: [61] | B56: Teleport
A57: [73] | B57: Bless
A58: [73] | B58: Control Spirit
A59: [73] | B59: Drain Life
A60: [73] | B60: Fire Arrow
A61: [73] | B61: Fire Ball
A62: [73] | B62: Haste
A63: [73] | B63: Heal
A64: [73] | B64: Ice Missile
A65: [73] | B65: Invisibility
A66: [73] | B66: Poison Cloud
A67: [73] | B67: Protection from Earth
A68: [73] | B68: Protection from Fire
A69: [73] | B69: Stone Curse
A70: [73] | B70: Summon
A71: [73] | B71: Teleport
A72: [73] | B72: Wall of Fire
A73: [74] | B73: Acid Stream
A74: [74] | B74: Bless
A75: [74] | B75: Blizzard
A76: [74] | B76: Control Spirit
A77: [74] | B77: Darkness
A78: [74] | B78: Diamond Dust
A79: [74] | B79: Fire Arrow
A80: [74] | B80: Heal
A81: [74] | B81: Invisibility
A82: [74] | B82: Light
A83: [74] | B83: Lightning
A84: [74] | B84: Poison Cloud
A85: [74] | B85: Protection from Air
A86: [74] | B86: Protection from Earth
A87: [74] | B87: Protection from Water
A88: [74] | B88: Stone Curse
A89: [74] | B89: Teleport
A90: [75] | B90: Acid Stream
A91: [75] | B91: Blizzard
A92: [75] | B92: Darkness
A93: [75] | B93: Diamond Dust
A94: [75] | B94: Drain Life
A95: [75] | B95: Fire Arrow
A96: [75] | B96: Heal
A97: [75] | B97: Ice Missile
A98: [75] | B98: Invisibility
A99: [75] | B99: Light
A100: [75] | B100: Lightning
A101: [75] | B101: Poison Cloud
A102: [75] | B102: Protection from Air
A103: [75] | B103: Protection from Water
A104: [75] | B104: Stone Curse
A105: [75] | B105: Teleport
A106: [75] | B106: Wall of Fire
A107: [104] | B107: Fire Arrow
A108: [104] | B108: Poison Cloud
A109: [108] | B109: Fire Arrow
A110: [108] | B110: Poison Cloud
A111: [108] | B111: Protection from Air
A112: [112] | B112: Fire Arrow
A113: [112] | B113: Poison Cloud
A114: [112] | B114: Protection from Air
A115: [116] | B115: Bless
A116: [116] | B116: Darkness
A117: [116] | B117: Fire Arrow
A118: [118] | B118: Fire Arrow
A119: [118] | B119: Poison Cloud
A120: [119] | B120: Fire Arrow
A121: [119] | B121: Poison Cloud
A122: [120] | B122: Fire Arrow
A123: [120] | B123: Poison Cloud
A124: [120] | B124: Protection from Air
A125: [121] | B125: Fire Arrow
A126: [121] | B126: Poison Cloud
A127: [122] | B127: Bless
A128: [122] | B128: Poison Cloud
A129: [122] | B129: Protection from Air
A130: [123] | B130: Bless
A131: [123] | B131: Poison Cloud
A132: [123] | B132: Protection from Air
A133: [124] | B133: Bless
A134: [124] | B134: Darkness
A135: [124] | B135: Fire Arrow
A136: [124] | B136: Poison Cloud
A137: [125] | B137: Bless
A138: [125] | B138: Darkness
A139: [125] | B139: Fire Arrow
A140: [125] | B140: Poison Cloud
A141: [129] | B141: Fire Arrow
A142: [129] | B142: Poison Cloud
A143: [134] | B143: Fire Arrow
A144: [134] | B144: Poison Cloud
A145: [139] | B145: Poison Cloud
A146: [139] | B146: Protection from Air
A147: [144] | B147: Darkness
A148: [148] | B148: Fire Arrow
A149: [148] | B149: Poison Cloud
A150: [151] | B150: Fire Arrow
A151: [151] | B151: Poison Cloud
A152: [154] | B152: Poison Cloud
A153: [154] | B153: Protection from Air
A154: [157] | B154: Darkness
A155: [157] | B155: Poison Cloud
A156: [160] | B156: Fire Arrow
A157: [160] | B157: Poison Cloud
A158: [161] | B158: Fire Arrow
A159: [161] | B159: Poison Cloud
A160: [162] | B160: Fire Arrow
A161: [162] | B161: Poison Cloud
A162: [163] | B162: Fire Arrow
A163: [163] | B163: Poison Cloud
A164: [164] | B164: Poison Cloud
A165: [164] | B165: Protection from Air
A166: [165] | B166: Poison Cloud
A167: [165] | B167: Protection from Air
A168: [166] | B168: Bless
A169: [166] | B169: Darkness
A170: [166] | B170: Poison Cloud
A171: [167] | B171: Bless
A172: [167] | B172: Darkness
A173: [167] | B173: Poison Cloud
A174: [172] | B174: Darkness
A175: [174] | B175: Fire Arrow
A176: [174] | B176: Poison Cloud
A177: [175] | B177: Bless
A178: [175] | B178: Darkness
A179: [180] | B179: Heal
A180: [180] | B180: Lightning
A181: [180] | B181: Shield
A182: [180] | B182: Stone Curse
A183: [183] | B183: Heal
A184: [183] | B184: Poison Cloud
A185: [183] | B185: Shield
A186: [183] | B186: Stone Curse
A187: [184] | B187: Drain Life
A188: [184] | B188: Heal
A189: [184] | B189: Prismatic Spray
A190: [184] | B190: Shield
A191: [185] | B191: Heal
A192: [185] | B192: Shield
A193: [189] | B193: Heal
A194: [189] | B194: Shield
A195: [191] | B195: Bless
A196: [191] | B196: Darkness
A197: [191] | B197: Poison Cloud
A198: [195] | B198: Heal
A199: [195] | B199: Lightning
A200: [195] | B200: Shield
A201: [196] | B201: Heal
A202: [196] | B202: Prismatic Spray
A203: [196] | B203: Shield
A204: [196] | B204: Stone Curse
A205: [202] | B205: Heal
A206: [202] | B206: Lightning
A207: [202] | B207: Shield
A208: [203] | B208: Diamond Dust
A209: [203] | B209: Fire Ball
A210: [203] | B210: Heal
A211: [203] | B211: Shield
A212: [213] | B212: Fire Arrow
A213: [213] | B213: Heal
A214: [213] | B214: Shield
A215: [217] | B215: Fire Ball
A216: [217] | B216: Heal
A217: [217] | B217: Lightning
A218: [217] | B218: Shield
A219: [227] | B219: Heal
A220: [227] | B220: Ice Missile
A221: [227] | B221: Shield
A222: [232] | B222: Diamond Dust
A223: [232] | B223: Fire Ball
A224: [232] | B224: Heal
A225: [232] | B225: Shield
A226: [237] | B226: Bless
A227: [237] | B227: Heal
A228: [237] | B228: Lightning
A229: [237] | B229: Poison Cloud
A230: [237] | B230: Shield
A231: [242] | B231: Bless
A232: [242] | B232: Haste
A233: [242] | B233: Heal
A234: [242] | B234: Prismatic Spray
A235: [242] | B235: Shield
A236: [242] | B236: Stone Curse
A237: [258] | B237: Bless
A238: [258] | B238: Heal
A239: [258] | B239: Lightning
A240: [258] | B240: Poison Cloud
A241: [258] | B241: Shield
A242: [263] | B242: Diamond Dust
A243: [263] | B243: Fire Ball
A244: [263] | B244: Heal
A245: [263] | B245: Shield
A246: [285] | B246: Bless
A247: [285] | B247: Diamond Dust
A248: [285] | B248: Haste
A249: [285] | B249: Heal
A250: [285] | B250: Lightning
A251: [285] | B251: Protection from Earth
A252: [285] | B252: Shield
A253: [286] | B253: Bless
A254: [286] | B254: Diamond Dust
A255: [286] | B255: Haste
A256: [286] | B256: Heal
A257: [286] | B257: Lightning
A258: [286] | B258: Protection from Earth
A259: [286] | B259: Shield
A260: [287] | B260: Bless
A261: [287] | B261: Diamond Dust
A262: [287] | B262: Haste
A263: [287] | B263: Heal
A264: [287] | B264: Lightning
A265: [287] | B265: Protection from Air
A266: [287] | B266: Protection from Earth
A267: [287] | B267: Shield
A268: [288] | B268: Bless
A269: [288] | B269: Control Spirit
A270: [288] | B270: Diamond Dust
A271: [288] | B271: Haste
A272: [288] | B272: Heal
A273: [288] | B273: Lightning
A274: [288] | B274: Prismatic Spray
A275: [288] | B275: Protection from Air
A276: [288] | B276: Protection from Earth
A277: [288] | B277: Shield
A278: [289] | B278: Bless
A279: [289] | B279: Control Spirit
A280: [289] | B280: Diamond Dust
A281: [289] | B281: Haste
A282: [289] | B282: Heal
A283: [289] | B283: Invisibility
A284: [289] | B284: Lightning
A285: [289] | B285: Prismatic Spray
A286: [289] | B286: Protection from Air
A287: [289] | B287: Protection from Earth
A288: [289] | B288: Shield
A289: [290] | B289: Bless
A290: [290] | B290: Control Spirit
A291: [290] | B291: Diamond Dust
A292: [290] | B292: Haste
A293: [290] | B293: Heal
A294: [290] | B294: Invisibility
A295: [290] | B295: Lightning
A296: [290] | B296: Prismatic Spray
A297: [290] | B297: Protection from Air
A298: [290] | B298: Protection from Earth
A299: [290] | B299: Shield
A300: [290] | B300: Wall of Earth
A301: [291] | B301: Bless
A302: [291] | B302: Control Spirit
A303: [291] | B303: Diamond Dust
A304: [291] | B304: Haste
A305: [291] | B305: Heal
A306: [291] | B306: Invisibility
A307: [291] | B307: Lightning
A308: [291] | B308: Prismatic Spray
A309: [291] | B309: Protection from Air
A310: [291] | B310: Protection from Earth
A311: [291] | B311: Shield
A312: [291] | B312: Wall of Earth
A313: [297] | B313: Fire Arrow
A314: [297] | B314: Fire Ball
A315: [297] | B315: Heal
A316: [297] | B316: Teleport
A317: [297] | B317: Wall of Fire
A318: [298] | B318: Blizzard
A319: [298] | B319: Heal
A320: [298] | B320: Ice Missile
A321: [298] | B321: Poison Cloud
A322: [298] | B322: Teleport
A323: [299] | B323: Heal
A324: [299] | B324: Invisibility
A325: [299] | B325: Lightning
A326: [299] | B326: Prismatic Spray
A327: [299] | B327: Teleport
A328: [300] | B328: Diamond Dust
A329: [300] | B329: Heal
A330: [300] | B330: Stone Curse
A331: [300] | B331: Teleport
A332: [300] | B332: Wall of Earth

Sheet: buildings
A1: NAME | B1: WIDTH | C1: HEIGHT | D1: SCANRANGE | E1: HEALTHMAX | F1: CANNOTPASS | G1: TILES | H1: TILES
A2: name | B2: width | C2: height | D2: scanRange | E2: healthMax | F2: canNotPass | G2: tiles | H2: tiles | I2: задано
A3: Goblin Hut | B3: 3 | C3: 2 | D3: 4 | E3: 300 | F3: [3] | G3: =COUNTIF(canNotPass!C[-6],RC[-1]) -> 5 | H3: [3] | I3: =COUNTIF(tiles!C[-8],RC[-1]) -> 6
A4: Goblin Hut 2 | B4: 3 | C4: 2 | D4: 4 | E4: 300 | F4: [4] | G4: =COUNTIF(canNotPass!C[-6],RC[-1]) -> 5 | H4: [4] | I4: =COUNTIF(tiles!C[-8],RC[-1]) -> 6
A5: Orc Hut | B5: 3 | C5: 2 | D5: 4 | E5: 300 | F5: [5] | G5: =COUNTIF(canNotPass!C[-6],RC[-1]) -> 4 | H5: [5] | I5: =COUNTIF(tiles!C[-8],RC[-1]) -> 6
A6: Orc Hut 2 | B6: 3 | C6: 2 | D6: 4 | E6: 300 | F6: [6] | G6: =COUNTIF(canNotPass!C[-6],RC[-1]) -> 4 | H6: [6] | I6: =COUNTIF(tiles!C[-8],RC[-1]) -> 6
A7: Mill | B7: 3 | C7: 3 | D7: 4 | E7: 1000 | F7: [7] | G7: =COUNTIF(canNotPass!C[-6],RC[-1]) -> 5 | H7: [7] | I7: =COUNTIF(tiles!C[-8],RC[-1]) -> 9
A8: Mill 2 | B8: 3 | C8: 3 | D8: 4 | E8: 1000 | F8: [8] | G8: =COUNTIF(canNotPass!C[-6],RC[-1]) -> 6 | H8: [8] | I8: =COUNTIF(tiles!C[-8],RC[-1]) -> 9
A9: Mill 3 | B9: 3 | C9: 3 | D9: 4 | E9: 1000 | F9: [9] | G9: =COUNTIF(canNotPass!C[-6],RC[-1]) -> 7 | H9: [9] | I9: =COUNTIF(tiles!C[-8],RC[-1]) -> 9
A10: Well | B10: 2 | C10: 2 | D10: 0 | E10: 1000 | F10: [10] | G10: =COUNTIF(canNotPass!C[-6],RC[-1]) -> 4 | H10: [10] | I10: =COUNTIF(tiles!C[-8],RC[-1]) -> 4
A11: Pizant Hut | B11: 3 | C11: 3 | D11: 5 | E11: 1000 | F11: [11] | G11: =COUNTIF(canNotPass!C[-6],RC[-1]) -> 8 | H11: [11] | I11: =COUNTIF(tiles!C[-8],RC[-1]) -> 9
A12: Pizant Hut 2 | B12: 3 | C12: 3 | D12: 5 | E12: 1000 | F12: [12] | G12: =COUNTIF(canNotPass!C[-6],RC[-1]) -> 7 | H12: [12] | I12: =COUNTIF(tiles!C[-8],RC[-1]) -> 9
A13: Church | B13: 4 | C13: 3 | D13: 7 | E13: 30000 | F13: [13] | G13: =COUNTIF(canNotPass!C[-6],RC[-1]) -> 9 | H13: [13] | I13: =COUNTIF(tiles!C[-8],RC[-1]) -> 12
A14: Tower | B14: 2 | C14: 2 | D14: 5 | E14: 30000 | F14: [14] | G14: =COUNTIF(canNotPass!C[-6],RC[-1]) -> 4 | H14: [14] | I14: =COUNTIF(tiles!C[-8],RC[-1]) -> 4
A15: Tower 2 | B15: 2 | C15: 2 | D15: 5 | E15: 30000 | F15: [15] | G15: =COUNTIF(canNotPass!C[-6],RC[-1]) -> 4 | H15: [15] | I15: =COUNTIF(tiles!C[-8],RC[-1]) -> 4
A16: Cave | B16: 3 | C16: 3 | D16: 3 | E16: 1000 | F16: [16] | G16: =COUNTIF(canNotPass!C[-6],RC[-1]) -> 6 | H16: [16] | I16: =COUNTIF(tiles!C[-8],RC[-1]) -> 6
A17: Magic Well 2 | B17: 2 | C17: 2 | D17: 0 | E17: 3 | F17: [17] | G17: =COUNTIF(canNotPass!C[-6],RC[-1]) -> 4 | H17: [17] | I17: =COUNTIF(tiles!C[-8],RC[-1]) -> 4
A18: Magic Well 3 | B18: 3 | C18: 3 | D18: 0 | E18: 3 | F18: [18] | G18: =COUNTIF(canNotPass!C[-6],RC[-1]) -> 9 | H18: [18] | I18: =COUNTIF(tiles!C[-8],RC[-1]) -> 9
A19: Human House 3a | B19: 3 | C19: 3 | D19: 5 | E19: 2000 | F19: [19] | G19: =COUNTIF(canNotPass!C[-6],RC[-1]) -> 5 | H19: [19] | I19: =COUNTIF(tiles!C[-8],RC[-1]) -> 9
A20: Human House 3b | B20: 3 | C20: 3 | D20: 5 | E20: 2000 | F20: [20] | G20: =COUNTIF(canNotPass!C[-6],RC[-1]) -> 8 | H20: [20] | I20: =COUNTIF(tiles!C[-8],RC[-1]) -> 9
A21: Human House 2a | B21: 3 | C21: 3 | D21: 5 | E21: 2000 | F21: [21] | G21: =COUNTIF(canNotPass!C[-6],RC[-1]) -> 9 | H21: [21] | I21: =COUNTIF(tiles!C[-8],RC[-1]) -> 9
A22: Human House 2b | B22: 3 | C22: 3 | D22: 5 | E22: 2000 | F22: [22] | G22: =COUNTIF(canNotPass!C[-6],RC[-1]) -> 8 | H22: [22] | I22: =COUNTIF(tiles!C[-8],RC[-1]) -> 9
A23: Ogre House | B23: 3 | C23: 3 | D23: 4 | E23: 500 | F23: [23] | G23: =COUNTIF(canNotPass!C[-6],RC[-1]) -> 8 | H23: [23] | I23: =COUNTIF(tiles!C[-8],RC[-1]) -> 9
A24: Ogre House 2 | B24: 3 | C24: 3 | D24: 4 | E24: 500 | F24: [24] | G24: =COUNTIF(canNotPass!C[-6],RC[-1]) -> 8 | H24: [24] | I24: =COUNTIF(tiles!C[-8],RC[-1]) -> 9
A25: Ogre House 3 | B25: 3 | C25: 3 | D25: 4 | E25: 500 | F25: [25] | G25: =COUNTIF(canNotPass!C[-6],RC[-1]) -> 8 | H25: [25] | I25: =COUNTIF(tiles!C[-8],RC[-1]) -> 9
A26: Bee House | B26: 1 | C26: 1 | D26: 2 | E26: 100 | F26: [26] | G26: =COUNTIF(canNotPass!C[-6],RC[-1]) -> 1 | H26: [26] | I26: =COUNTIF(tiles!C[-8],RC[-1]) -> 1
A27: Bee House 2 | B27: 1 | C27: 1 | D27: 2 | E27: 100 | F27: [27] | G27: =COUNTIF(canNotPass!C[-6],RC[-1]) -> 1 | H27: [27] | I27: =COUNTIF(tiles!C[-8],RC[-1]) -> 1
A28: Leg's House | B28: 2 | C28: 1 | D28: 3 | E28: 100 | F28: [28] | G28: =COUNTIF(canNotPass!C[-6],RC[-1]) -> 2 | H28: [28] | I28: =COUNTIF(tiles!C[-8],RC[-1]) -> 2
A29: Magic Symbol | B29: 3 | C29: 3 | D29: 3 | E29: 0 | F29: [29] | G29: =COUNTIF(canNotPass!C[-6],RC[-1]) -> 0 | H29: [29] | I29: =COUNTIF(tiles!C[-8],RC[-1]) -> 9
A30: Switch | B30: 1 | C30: 1 | D30: 1 | E30: 1 | F30: [30] | G30: =COUNTIF(canNotPass!C[-6],RC[-1]) -> 1 | H30: [30] | I30: =COUNTIF(tiles!C[-8],RC[-1]) -> 1
A31: Switch 2 | B31: 1 | C31: 1 | D31: 1 | E31: 1 | F31: [31] | G31: =COUNTIF(canNotPass!C[-6],RC[-1]) -> 1 | H31: [31] | I31: =COUNTIF(tiles!C[-8],RC[-1]) -> 1
A32: Ruins | B32: 3 | C32: 1 | D32: 0 | E32: 0 | F32: [32] | G32: =COUNTIF(canNotPass!C[-6],RC[-1]) -> 2 | H32: [32] | I32: =COUNTIF(tiles!C[-8],RC[-1]) -> 3
A33: Ruins 2 | B33: 2 | C33: 2 | D33: 0 | E33: 0 | F33: [33] | G33: =COUNTIF(canNotPass!C[-6],RC[-1]) -> 3 | H33: [33] | I33: =COUNTIF(tiles!C[-8],RC[-1]) -> 4
A34: Ruins 3 | B34: 1 | C34: 1 | D34: 0 | E34: 0 | F34: [34] | G34: =COUNTIF(canNotPass!C[-6],RC[-1]) -> 1 | H34: [34] | I34: =COUNTIF(tiles!C[-8],RC[-1]) -> 1
A35: Vertical Wooden Bridge | B35: 1 | C35: 1 | D35: 0 | E35: 0 | F35: [35] | G35: =COUNTIF(canNotPass!C[-6],RC[-1]) -> 1 | H35: [35] | I35: =COUNTIF(tiles!C[-8],RC[-1]) -> 1
A36: Shop | B36: 3 | C36: 3 | D36: 4 | E36: 0 | F36: [36] | G36: =COUNTIF(canNotPass!C[-6],RC[-1]) -> 8 | H36: [36] | I36: =COUNTIF(tiles!C[-8],RC[-1]) -> 9
A37: Shop 2 | B37: 3 | C37: 3 | D37: 4 | E37: 0 | F37: [37] | G37: =COUNTIF(canNotPass!C[-6],RC[-1]) -> 8 | H37: [37] | I37: =COUNTIF(tiles!C[-8],RC[-1]) -> 9
A38: Hanging Peasant | B38: 2 | C38: 1 | D38: 0 | E38: 0 | F38: [38] | G38: =COUNTIF(canNotPass!C[-6],RC[-1]) -> 2 | H38: [38] | I38: =COUNTIF(tiles!C[-8],RC[-1]) -> 2
A39: Horisontal Wooden Bridge | B39: 1 | C39: 1 | D39: 0 | E39: 0 | F39: [39] | G39: =COUNTIF(canNotPass!C[-6],RC[-1]) -> 1 | H39: [39] | I39: =COUNTIF(tiles!C[-8],RC[-1]) -> 1
A40: Horisontal Bridge | B40: 6 | C40: 4 | D40: 0 | E40: 0 | F40: [40] | G40: =COUNTIF(canNotPass!C[-6],RC[-1]) -> 12 | H40: [40] | I40: =COUNTIF(tiles!C[-8],RC[-1]) -> 24
A41: King's Grave 1 | B41: 2 | C41: 2 | D41: 0 | E41: 0 | F41: [41] | G41: =COUNTIF(canNotPass!C[-6],RC[-1]) -> 4 | H41: [41] | I41: =COUNTIF(tiles!C[-8],RC[-1]) -> 4
A42: King's Grave 2 | B42: 2 | C42: 2 | D42: 0 | E42: 0 | F42: [42] | G42: =COUNTIF(canNotPass!C[-6],RC[-1]) -> 4 | H42: [42] | I42: =COUNTIF(tiles!C[-8],RC[-1]) -> 4
A43: Common Grave 1 | B43: 1 | C43: 1 | D43: 0 | E43: 0 | F43: [43] | G43: =COUNTIF(canNotPass!C[-6],RC[-1]) -> 1 | H43: [43] | I43: =COUNTIF(tiles!C[-8],RC[-1]) -> 1
A44: Common Grave 2 | B44: 1 | C44: 1 | D44: 0 | E44: 0 | F44: [44] | G44: =COUNTIF(canNotPass!C[-6],RC[-1]) -> 1 | H44: [44] | I44: =COUNTIF(tiles!C[-8],RC[-1]) -> 1
A45: Inn 1 | B45: 3 | C45: 3 | D45: 3 | E45: 30000 | F45: [45] | G45: =COUNTIF(canNotPass!C[-6],RC[-1]) -> 7 | H45: [45] | I45: =COUNTIF(tiles!C[-8],RC[-1]) -> 9
A46: Inn 2 | B46: 3 | C46: 3 | D46: 3 | E46: 30000 | F46: [46] | G46: =COUNTIF(canNotPass!C[-6],RC[-1]) -> 9 | H46: [46] | I46: =COUNTIF(tiles!C[-8],RC[-1]) -> 9
A47: Inn 3 | B47: 3 | C47: 3 | D47: 3 | E47: 30000 | F47: [47] | G47: =COUNTIF(canNotPass!C[-6],RC[-1]) -> 8 | H47: [47] | I47: =COUNTIF(tiles!C[-8],RC[-1]) -> 9
A48: Guard Tower 1 | B48: 2 | C48: 3 | D48: 5 | E48: 30000 | F48: [48] | G48: =COUNTIF(canNotPass!C[-6],RC[-1]) -> 6 | H48: [48] | I48: =COUNTIF(tiles!C[-8],RC[-1]) -> 6
A49: Guard Tower 2 | B49: 2 | C49: 3 | D49: 5 | E49: 30000 | F49: [49] | G49: =COUNTIF(canNotPass!C[-6],RC[-1]) -> 6 | H49: [49] | I49: =COUNTIF(tiles!C[-8],RC[-1]) -> 6
A50: Teleport Pad | B50: 3 | C50: 3 | D50: 5 | E50: 0 | F50: [50] | G50: =COUNTIF(canNotPass!C[-6],RC[-1]) -> 0 | H50: [50] | I50: =COUNTIF(tiles!C[-8],RC[-1]) -> 9
A51: Training School 1 | B51: 3 | C51: 4 | D51: 3 | E51: 30000 | F51: [51] | G51: =COUNTIF(canNotPass!C[-6],RC[-1]) -> 10 | H51: [51] | I51: =COUNTIF(tiles!C[-8],RC[-1]) -> 12
A52: Training School 2 | B52: 3 | C52: 4 | D52: 3 | E52: 30000 | F52: [52] | G52: =COUNTIF(canNotPass!C[-6],RC[-1]) -> 10 | H52: [52] | I52: =COUNTIF(tiles!C[-8],RC[-1]) -> 12
A53: Training School 3 | B53: 3 | C53: 4 | D53: 3 | E53: 30000 | F53: [53] | G53: =COUNTIF(canNotPass!C[-6],RC[-1]) -> 9 | H53: [53] | I53: =COUNTIF(tiles!C[-8],RC[-1]) -> 12
A54: Vertical Bridge | B54: 4 | C54: 6 | D54: 0 | E54: 0 | F54: [54] | G54: =COUNTIF(canNotPass!C[-6],RC[-1]) -> 12 | H54: [54] | I54: =COUNTIF(tiles!C[-8],RC[-1]) -> 24
A55: Camp Fire | B55: 1 | C55: 1 | D55: 1 | E55: 0 | F55: [55] | G55: =COUNTIF(canNotPass!C[-6],RC[-1]) -> 1 | H55: [55] | I55: =COUNTIF(tiles!C[-8],RC[-1]) -> 1
A56: Skrakan Tower | B56: 3 | C56: 3 | D56: 5 | E56: 0 | F56: [56] | G56: =COUNTIF(canNotPass!C[-6],RC[-1]) -> 9 | H56: [56] | I56: =COUNTIF(tiles!C[-8],RC[-1]) -> 9
A57: Skrakan Tower 2 | B57: 4 | C57: 3 | D57: 5 | E57: 0 | F57: [57] | G57: =COUNTIF(canNotPass!C[-6],RC[-1]) -> 10 | H57: [57] | I57: =COUNTIF(tiles!C[-8],RC[-1]) -> 12
A58: Mage's tower | B58: 2 | C58: 2 | D58: 5 | E58: 30000 | F58: [58] | G58: =COUNTIF(canNotPass!C[-6],RC[-1]) -> 4 | H58: [58] | I58: =COUNTIF(tiles!C[-8],RC[-1]) -> 4
A59: Castle | B59: 11 | C59: 4 | D59: 5 | E59: 30000 | F59: [59] | G59: =COUNTIF(canNotPass!C[-6],RC[-1]) -> 38 | H59: [59] | I59: =COUNTIF(tiles!C[-8],RC[-1]) -> 38
A60: Sphinx | B60: 3 | C60: 2 | D60: 3 | E60: 0 | F60: [60] | G60: =COUNTIF(canNotPass!C[-6],RC[-1]) -> 6 | H60: [60] | I60: =COUNTIF(tiles!C[-8],RC[-1]) -> 6
A61: Sphinx 2 | B61: 3 | C61: 2 | D61: 3 | E61: 0 | F61: [61] | G61: =COUNTIF(canNotPass!C[-6],RC[-1]) -> 6 | H61: [61] | I61: =COUNTIF(tiles!C[-8],RC[-1]) -> 6
A62: Sphinx 3 | B62: 3 | C62: 2 | D62: 3 | E62: 0 | F62: [62] | G62: =COUNTIF(canNotPass!C[-6],RC[-1]) -> 6 | H62: [62] | I62: =COUNTIF(tiles!C[-8],RC[-1]) -> 6
A63: Sphinx 4 | B63: 3 | C63: 2 | D63: 3 | E63: 0 | F63: [63] | G63: =COUNTIF(canNotPass!C[-6],RC[-1]) -> 6 | H63: [63] | I63: =COUNTIF(tiles!C[-8],RC[-1]) -> 6
A64: Sphinx 5 | B64: 3 | C64: 2 | D64: 3 | E64: 0 | F64: [64] | G64: =COUNTIF(canNotPass!C[-6],RC[-1]) -> 6 | H64: [64] | I64: =COUNTIF(tiles!C[-8],RC[-1]) -> 6
A65: Sphinx 6 | B65: 3 | C65: 2 | D65: 3 | E65: 0 | F65: [65] | G65: =COUNTIF(canNotPass!C[-6],RC[-1]) -> 6 | H65: [65] | I65: =COUNTIF(tiles!C[-8],RC[-1]) -> 6
A66: Sphinx 7 | B66: 3 | C66: 2 | D66: 3 | E66: 0 | F66: [66] | G66: =COUNTIF(canNotPass!C[-6],RC[-1]) -> 6 | H66: [66] | I66: =COUNTIF(tiles!C[-8],RC[-1]) -> 6
A67: Sphinx 8 | B67: 3 | C67: 2 | D67: 3 | E67: 0 | F67: [67] | G67: =COUNTIF(canNotPass!C[-6],RC[-1]) -> 6 | H67: [67] | I67: =COUNTIF(tiles!C[-8],RC[-1]) -> 6
A68: Multiplayer Church | B68: 4 | C68: 3 | D68: 7 | E68: 0 | F68: [68] | G68: =COUNTIF(canNotPass!C[-6],RC[-1]) -> 9 | H68: [68] | I68: =COUNTIF(tiles!C[-8],RC[-1]) -> 12
A69: Multiplayer Inn 1 | B69: 3 | C69: 3 | D69: 3 | E69: 0 | F69: [69] | G69: =COUNTIF(canNotPass!C[-6],RC[-1]) -> 7 | H69: [69] | I69: =COUNTIF(tiles!C[-8],RC[-1]) -> 9
A70: Multiplayer Inn 2 | B70: 3 | C70: 3 | D70: 3 | E70: 0 | F70: [70] | G70: =COUNTIF(canNotPass!C[-6],RC[-1]) -> 9 | H70: [70] | I70: =COUNTIF(tiles!C[-8],RC[-1]) -> 9
A71: Multiplayer Inn 3 | B71: 3 | C71: 3 | D71: 3 | E71: 0 | F71: [71] | G71: =COUNTIF(canNotPass!C[-6],RC[-1]) -> 8 | H71: [71] | I71: =COUNTIF(tiles!C[-8],RC[-1]) -> 9
A72: Pointer 1 | B72: 1 | C72: 1 | D72: 0 | E72: 0 | F72: [72] | G72: =COUNTIF(canNotPass!C[-6],RC[-1]) -> 1 | H72: [72] | I72: =COUNTIF(tiles!C[-8],RC[-1]) -> 1
A73: Pointer 2 | B73: 1 | C73: 1 | D73: 0 | E73: 0 | F73: [73] | G73: =COUNTIF(canNotPass!C[-6],RC[-1]) -> 1 | H73: [73] | I73: =COUNTIF(tiles!C[-8],RC[-1]) -> 1
A74: Pointer 3 | B74: 1 | C74: 1 | D74: 0 | E74: 0 | F74: [74] | G74: =COUNTIF(canNotPass!C[-6],RC[-1]) -> 1 | H74: [74] | I74: =COUNTIF(tiles!C[-8],RC[-1]) -> 1
A75: Pointer 4 | B75: 1 | C75: 1 | D75: 0 | E75: 0 | F75: [75] | G75: =COUNTIF(canNotPass!C[-6],RC[-1]) -> 1 | H75: [75] | I75: =COUNTIF(tiles!C[-8],RC[-1]) -> 1
A76: Pointer 5 | B76: 1 | C76: 1 | D76: 0 | E76: 0 | F76: [76] | G76: =COUNTIF(canNotPass!C[-6],RC[-1]) -> 1 | H76: [76] | I76: =COUNTIF(tiles!C[-8],RC[-1]) -> 1
A77: Pointer 6 | B77: 1 | C77: 1 | D77: 0 | E77: 0 | F77: [77] | G77: =COUNTIF(canNotPass!C[-6],RC[-1]) -> 1 | H77: [77] | I77: =COUNTIF(tiles!C[-8],RC[-1]) -> 1
A78: Altar 1 | B78: 2 | C78: 2 | D78: 0 | E78: 1 | F78: [78] | G78: =COUNTIF(canNotPass!C[-6],RC[-1]) -> 4 | H78: [78] | I78: =COUNTIF(tiles!C[-8],RC[-1]) -> 4
A79: Altar 2 | B79: 2 | C79: 2 | D79: 0 | E79: 1 | F79: [79] | G79: =COUNTIF(canNotPass!C[-6],RC[-1]) -> 4 | H79: [79] | I79: =COUNTIF(tiles!C[-8],RC[-1]) -> 4
A80: Necro House 1 | B80: 3 | C80: 2 | D80: 5 | E80: 500 | F80: [80] | G80: =COUNTIF(canNotPass!C[-6],RC[-1]) -> 6 | H80: [80] | I80: =COUNTIF(tiles!C[-8],RC[-1]) -> 6
A81: Necro House 1 | B81: 3 | C81: 2 | D81: 5 | E81: 500 | F81: [81] | G81: =COUNTIF(canNotPass!C[-6],RC[-1]) -> 6 | H81: [81] | I81: =COUNTIF(tiles!C[-8],RC[-1]) -> 6
A82: Necro House 1 | B82: 3 | C82: 2 | D82: 5 | E82: 500 | F82: [82] | G82: =COUNTIF(canNotPass!C[-6],RC[-1]) -> 6 | H82: [82] | I82: =COUNTIF(tiles!C[-8],RC[-1]) -> 6
A83: Shed 1 | B83: 3 | C83: 3 | D83: 5 | E83: 300 | F83: [83] | G83: =COUNTIF(canNotPass!C[-6],RC[-1]) -> 9 | H83: [83] | I83: =COUNTIF(tiles!C[-8],RC[-1]) -> 9
A84: Shed 2 | B84: 3 | C84: 3 | D84: 5 | E84: 300 | F84: [84] | G84: =COUNTIF(canNotPass!C[-6],RC[-1]) -> 6 | H84: [84] | I84: =COUNTIF(tiles!C[-8],RC[-1]) -> 9
A85: Shed 3 | B85: 3 | C85: 3 | D85: 5 | E85: 300 | F85: [85] | G85: =COUNTIF(canNotPass!C[-6],RC[-1]) -> 8 | H85: [85] | I85: =COUNTIF(tiles!C[-8],RC[-1]) -> 9
A86: Orc Shaman House 1 | B86: 3 | C86: 2 | D86: 5 | E86: 400 | F86: [86] | G86: =COUNTIF(canNotPass!C[-6],RC[-1]) -> 6 | H86: [86] | I86: =COUNTIF(tiles!C[-8],RC[-1]) -> 6
A87: Orc Shaman House 2 | B87: 3 | C87: 3 | D87: 5 | E87: 400 | F87: [87] | G87: =COUNTIF(canNotPass!C[-6],RC[-1]) -> 5 | H87: [87] | I87: =COUNTIF(tiles!C[-8],RC[-1]) -> 9
A88: Orc Shaman House 3 | B88: 3 | C88: 2 | D88: 5 | E88: 400 | F88: [88] | G88: =COUNTIF(canNotPass!C[-6],RC[-1]) -> 6 | H88: [88] | I88: =COUNTIF(tiles!C[-8],RC[-1]) -> 6
A89: Big Human House 1 | B89: 4 | C89: 4 | D89: 5 | E89: 800 | F89: [89] | G89: =COUNTIF(canNotPass!C[-6],RC[-1]) -> 15 | H89: [89] | I89: =COUNTIF(tiles!C[-8],RC[-1]) -> 16
A90: Big Human House 2 | B90: 4 | C90: 4 | D90: 5 | E90: 800 | F90: [90] | G90: =COUNTIF(canNotPass!C[-6],RC[-1]) -> 15 | H90: [90] | I90: =COUNTIF(tiles!C[-8],RC[-1]) -> 16
A91: Big Human House 3 | B91: 4 | C91: 4 | D91: 5 | E91: 800 | F91: [91] | G91: =COUNTIF(canNotPass!C[-6],RC[-1]) -> 15 | H91: [91] | I91: =COUNTIF(tiles!C[-8],RC[-1]) -> 16
A92: Kaarg Shop 1 | B92: 4 | C92: 4 | D92: 5 | E92: 30000 | F92: [92] | G92: =COUNTIF(canNotPass!C[-6],RC[-1]) -> 15 | H92: [92] | I92: =COUNTIF(tiles!C[-8],RC[-1]) -> 16
A93: Kaarg Shop 2 | B93: 4 | C93: 4 | D93: 5 | E93: 30000 | F93: [93] | G93: =COUNTIF(canNotPass!C[-6],RC[-1]) -> 14 | H93: [93] | I93: =COUNTIF(tiles!C[-8],RC[-1]) -> 16
A94: Kaarg Shop 3 | B94: 4 | C94: 4 | D94: 5 | E94: 30000 | F94: [94] | G94: =COUNTIF(canNotPass!C[-6],RC[-1]) -> 16 | H94: [94] | I94: =COUNTIF(tiles!C[-8],RC[-1]) -> 16
A95: Multiplayer Kaarg Shop 1 | B95: 4 | C95: 4 | D95: 5 | E95: 0 | F95: [95] | G95: =COUNTIF(canNotPass!C[-6],RC[-1]) -> 15 | H95: [95] | I95: =COUNTIF(tiles!C[-8],RC[-1]) -> 16
A96: Multiplayer Kaarg Shop 2 | B96: 4 | C96: 4 | D96: 5 | E96: 0 | F96: [96] | G96: =COUNTIF(canNotPass!C[-6],RC[-1]) -> 14 | H96: [96] | I96: =COUNTIF(tiles!C[-8],RC[-1]) -> 16
A97: Multiplayer Kaarg Shop 3 | B97: 4 | C97: 4 | D97: 5 | E97: 0 | F97: [97] | G97: =COUNTIF(canNotPass!C[-6],RC[-1]) -> 16 | H97: [97] | I97: =COUNTIF(tiles!C[-8],RC[-1]) -> 16
A98: Kaarg Inn 1 | B98: 3 | C98: 3 | D98: 3 | E98: 30000 | F98: [98] | G98: =COUNTIF(canNotPass!C[-6],RC[-1]) -> 8 | H98: [98] | I98: =COUNTIF(tiles!C[-8],RC[-1]) -> 9
A99: Kaarg Inn 2 | B99: 3 | C99: 3 | D99: 3 | E99: 30000 | F99: [99] | G99: =COUNTIF(canNotPass!C[-6],RC[-1]) -> 7 | H99: [99] | I99: =COUNTIF(tiles!C[-8],RC[-1]) -> 9
A100: Kaarg Inn 3 | B100: 3 | C100: 3 | D100: 3 | E100: 30000 | F100: [100] | G100: =COUNTIF(canNotPass!C[-6],RC[-1]) -> 9 | H100: [100] | I100: =COUNTIF(tiles!C[-8],RC[-1]) -> 9
A101: Multiplayer Kaarg Inn 1 | B101: 3 | C101: 3 | D101: 3 | E101: 0 | F101: [101] | G101: =COUNTIF(canNotPass!C[-6],RC[-1]) -> 8 | H101: [101] | I101: =COUNTIF(tiles!C[-8],RC[-1]) -> 9
A102: Multiplayer Kaarg Inn 2 | B102: 3 | C102: 3 | D102: 3 | E102: 0 | F102: [102] | G102: =COUNTIF(canNotPass!C[-6],RC[-1]) -> 7 | H102: [102] | I102: =COUNTIF(tiles!C[-8],RC[-1]) -> 9
A103: Multiplayer Kaarg Inn 3 | B103: 3 | C103: 3 | D103: 3 | E103: 0 | F103: [103] | G103: =COUNTIF(canNotPass!C[-6],RC[-1]) -> 9 | H103: [103] | I103: =COUNTIF(tiles!C[-8],RC[-1]) -> 9
A104: Druid Shop 1 | B104: 4 | C104: 3 | D104: 7 | E104: 30000 | F104: [104] | G104: =COUNTIF(canNotPass!C[-6],RC[-1]) -> 11 | H104: [104] | I104: =COUNTIF(tiles!C[-8],RC[-1]) -> 12
A105: Druid Shop 2 | B105: 4 | C105: 3 | D105: 7 | E105: 30000 | F105: [105] | G105: =COUNTIF(canNotPass!C[-6],RC[-1]) -> 12 | H105: [105] | I105: =COUNTIF(tiles!C[-8],RC[-1]) -> 12
A106: Druid Shop 3 | B106: 4 | C106: 3 | D106: 7 | E106: 30000 | F106: [106] | G106: =COUNTIF(canNotPass!C[-6],RC[-1]) -> 12 | H106: [106] | I106: =COUNTIF(tiles!C[-8],RC[-1]) -> 12
A107: Multiplayer Druid Shop 1 | B107: 4 | C107: 3 | D107: 7 | E107: 0 | F107: [107] | G107: =COUNTIF(canNotPass!C[-6],RC[-1]) -> 11 | H107: [107] | I107: =COUNTIF(tiles!C[-8],RC[-1]) -> 12
A108: Multiplayer Druid Shop 2 | B108: 4 | C108: 3 | D108: 7 | E108: 0 | F108: [108] | G108: =COUNTIF(canNotPass!C[-6],RC[-1]) -> 12 | H108: [108] | I108: =COUNTIF(tiles!C[-8],RC[-1]) -> 12
A109: Multiplayer Druid Shop 3 | B109: 4 | C109: 3 | D109: 7 | E109: 0 | F109: [109] | G109: =COUNTIF(canNotPass!C[-6],RC[-1]) -> 12 | H109: [109] | I109: =COUNTIF(tiles!C[-8],RC[-1]) -> 12
A110: Druid Inn 1 | B110: 4 | C110: 3 | D110: 7 | E110: 30000 | F110: [110] | G110: =COUNTIF(canNotPass!C[-6],RC[-1]) -> 10 | H110: [110] | I110: =COUNTIF(tiles!C[-8],RC[-1]) -> 12
A111: Druid Inn 2 | B111: 4 | C111: 3 | D111: 7 | E111: 30000 | F111: [111] | G111: =COUNTIF(canNotPass!C[-6],RC[-1]) -> 10 | H111: [111] | I111: =COUNTIF(tiles!C[-8],RC[-1]) -> 12
A112: Druid Inn 3 | B112: 4 | C112: 3 | D112: 7 | E112: 30000 | F112: [112] | G112: =COUNTIF(canNotPass!C[-6],RC[-1]) -> 11 | H112: [112] | I112: =COUNTIF(tiles!C[-8],RC[-1]) -> 12
A113: Multiplayer Druid Inn 1 | B113: 4 | C113: 3 | D113: 7 | E113: 0 | F113: [113] | G113: =COUNTIF(canNotPass!C[-6],RC[-1]) -> 10 | H113: [113] | I113: =COUNTIF(tiles!C[-8],RC[-1]) -> 12
A114: Multiplayer Druid Inn 2 | B114: 4 | C114: 3 | D114: 7 | E114: 0 | F114: [114] | G114: =COUNTIF(canNotPass!C[-6],RC[-1]) -> 10 | H114: [114] | I114: =COUNTIF(tiles!C[-8],RC[-1]) -> 12
A115: Multiplayer Druid Inn 3 | B115: 4 | C115: 3 | D115: 7 | E115: 0 | F115: [115] | G115: =COUNTIF(canNotPass!C[-6],RC[-1]) -> 11 | H115: [115] | I115: =COUNTIF(tiles!C[-8],RC[-1]) -> 12
A116: Barbarian Hut 1 | B116: 3 | C116: 2 | D116: 3 | E116: 300 | F116: [116] | G116: =COUNTIF(canNotPass!C[-6],RC[-1]) -> 5 | H116: [116] | I116: =COUNTIF(tiles!C[-8],RC[-1]) -> 6
A117: Barbarian Hut 2 | B117: 3 | C117: 2 | D117: 3 | E117: 300 | F117: [117] | G117: =COUNTIF(canNotPass!C[-6],RC[-1]) -> 6 | H117: [117] | I117: =COUNTIF(tiles!C[-8],RC[-1]) -> 6
A118: Barbarian Hut 3 | B118: 3 | C118: 2 | D118: 3 | E118: 300 | F118: [118] | G118: =COUNTIF(canNotPass!C[-6],RC[-1]) -> 6 | H118: [118] | I118: =COUNTIF(tiles!C[-8],RC[-1]) -> 6
A119: Crater | B119: 4 | C119: 4 | D119: 0 | E119: 0 | F119: [119] | G119: =COUNTIF(canNotPass!C[-6],RC[-1]) -> 4 | H119: [119] | I119: =COUNTIF(tiles!C[-8],RC[-1]) -> 16
A120: Vigvam 1 | B120: 2 | C120: 2 | D120: 3 | E120: 0 | F120: [120] | G120: =COUNTIF(canNotPass!C[-6],RC[-1]) -> 4 | H120: [120] | I120: =COUNTIF(tiles!C[-8],RC[-1]) -> 4
A121: Vigvam 2 | B121: 2 | C121: 2 | D121: 3 | E121: 0 | F121: [121] | G121: =COUNTIF(canNotPass!C[-6],RC[-1]) -> 4 | H121: [121] | I121: =COUNTIF(tiles!C[-8],RC[-1]) -> 4
A122: Vigvam 3 | B122: 2 | C122: 2 | D122: 3 | E122: 0 | F122: [122] | G122: =COUNTIF(canNotPass!C[-6],RC[-1]) -> 4 | H122: [122] | I122: =COUNTIF(tiles!C[-8],RC[-1]) -> 4
A123: Open Grave 1 | B123: 3 | C123: 3 | D123: 3 | E123: 0 | F123: [123] | G123: =COUNTIF(canNotPass!C[-6],RC[-1]) -> 7 | H123: [123] | I123: =COUNTIF(tiles!C[-8],RC[-1]) -> 9
A124: Open Grave 2 | B124: 3 | C124: 3 | D124: 3 | E124: 0 | F124: [124] | G124: =COUNTIF(canNotPass!C[-6],RC[-1]) -> 7 | H124: [124] | I124: =COUNTIF(tiles!C[-8],RC[-1]) -> 9
A125: Open Grave 3 | B125: 3 | C125: 3 | D125: 3 | E125: 0 | F125: [125] | G125: =COUNTIF(canNotPass!C[-6],RC[-1]) -> 7 | H125: [125] | I125: =COUNTIF(tiles!C[-8],RC[-1]) -> 9
A126: Tent 1 | B126: 2 | C126: 2 | D126: 3 | E126: 80 | F126: [126] | G126: =COUNTIF(canNotPass!C[-6],RC[-1]) -> 4 | H126: [126] | I126: =COUNTIF(tiles!C[-8],RC[-1]) -> 4
A127: Tent 2 | B127: 2 | C127: 2 | D127: 3 | E127: 80 | F127: [127] | G127: =COUNTIF(canNotPass!C[-6],RC[-1]) -> 4 | H127: [127] | I127: =COUNTIF(tiles!C[-8],RC[-1]) -> 4
A128: Tent 3 | B128: 2 | C128: 2 | D128: 3 | E128: 80 | F128: [128] | G128: =COUNTIF(canNotPass!C[-6],RC[-1]) -> 4 | H128: [128] | I128: =COUNTIF(tiles!C[-8],RC[-1]) -> 4
A129: Big tent 1 | B129: 3 | C129: 3 | D129: 3 | E129: 100 | F129: [129] | G129: =COUNTIF(canNotPass!C[-6],RC[-1]) -> 9 | H129: [129] | I129: =COUNTIF(tiles!C[-8],RC[-1]) -> 9
A130: Big tent 2 | B130: 3 | C130: 3 | D130: 3 | E130: 100 | F130: [130] | G130: =COUNTIF(canNotPass!C[-6],RC[-1]) -> 9 | H130: [130] | I130: =COUNTIF(tiles!C[-8],RC[-1]) -> 9
A131: Big tent 3 | B131: 3 | C131: 3 | D131: 3 | E131: 100 | F131: [131] | G131: =COUNTIF(canNotPass!C[-6],RC[-1]) -> 9 | H131: [131] | I131: =COUNTIF(tiles!C[-8],RC[-1]) -> 9
A132: Torture 1 | B132: 2 | C132: 2 | D132: 3 | E132: 0 | F132: [132] | G132: =COUNTIF(canNotPass!C[-6],RC[-1]) -> 4 | H132: [132] | I132: =COUNTIF(tiles!C[-8],RC[-1]) -> 4
A133: Torture 2 | B133: 2 | C133: 2 | D133: 3 | E133: 0 | F133: [133] | G133: =COUNTIF(canNotPass!C[-6],RC[-1]) -> 4 | H133: [133] | I133: =COUNTIF(tiles!C[-8],RC[-1]) -> 4
A134: Torture 3 | B134: 2 | C134: 2 | D134: 3 | E134: 0 | F134: [134] | G134: =COUNTIF(canNotPass!C[-6],RC[-1]) -> 4 | H134: [134] | I134: =COUNTIF(tiles!C[-8],RC[-1]) -> 4
A135: Sclep 1 | B135: 3 | C135: 3 | D135: 3 | E135: 0 | F135: [135] | G135: =COUNTIF(canNotPass!C[-6],RC[-1]) -> 8 | H135: [135] | I135: =COUNTIF(tiles!C[-8],RC[-1]) -> 9
A136: Sclep 2 | B136: 3 | C136: 3 | D136: 3 | E136: 0 | F136: [136] | G136: =COUNTIF(canNotPass!C[-6],RC[-1]) -> 9 | H136: [136] | I136: =COUNTIF(tiles!C[-8],RC[-1]) -> 9
A137: Sclep 3 | B137: 3 | C137: 3 | D137: 3 | E137: 0 | F137: [137] | G137: =COUNTIF(canNotPass!C[-6],RC[-1]) -> 9 | H137: [137] | I137: =COUNTIF(tiles!C[-8],RC[-1]) -> 9
A138: Kaarg Tower 1 | B138: 2 | C138: 1 | D138: 5 | E138: 30000 | F138: [138] | G138: =COUNTIF(canNotPass!C[-6],RC[-1]) -> 2 | H138: [138] | I138: =COUNTIF(tiles!C[-8],RC[-1]) -> 2
A139: Kaarg Tower 2 | B139: 2 | C139: 1 | D139: 5 | E139: 30000 | F139: [139] | G139: =COUNTIF(canNotPass!C[-6],RC[-1]) -> 2 | H139: [139] | I139: =COUNTIF(tiles!C[-8],RC[-1]) -> 2
A140: Dragon's nest | B140: 3 | C140: 3 | D140: 4 | E140: 0 | F140: [140] | G140: =COUNTIF(canNotPass!C[-6],RC[-1]) -> 1 | H140: [140] | I140: =COUNTIF(tiles!C[-8],RC[-1]) -> 9
A141: Necro Tower | B141: 3 | C141: 3 | D141: 8 | E141: 30000 | F141: [141] | G141: =COUNTIF(canNotPass!C[-6],RC[-1]) -> 9 | H141: [141] | I141: =COUNTIF(tiles!C[-8],RC[-1]) -> 9
A142: Druid House 1 | B142: 4 | C142: 3 | D142: 7 | E142: 30000 | F142: [142] | G142: =COUNTIF(canNotPass!C[-6],RC[-1]) -> 10 | H142: [142] | I142: =COUNTIF(tiles!C[-8],RC[-1]) -> 12
A143: Druid House 2 | B143: 4 | C143: 3 | D143: 7 | E143: 30000 | F143: [143] | G143: =COUNTIF(canNotPass!C[-6],RC[-1]) -> 10 | H143: [143] | I143: =COUNTIF(tiles!C[-8],RC[-1]) -> 12
A144: Druid House 3 | B144: 4 | C144: 3 | D144: 7 | E144: 30000 | F144: [144] | G144: =COUNTIF(canNotPass!C[-6],RC[-1]) -> 10 | H144: [144] | I144: =COUNTIF(tiles!C[-8],RC[-1]) -> 12
A145: Grave Doors 1 | B145: 5 | C145: 1 | D145: 3 | E145: 0 | F145: [145] | G145: =COUNTIF(canNotPass!C[-6],RC[-1]) -> 4 | H145: [145] | I145: =COUNTIF(tiles!C[-8],RC[-1]) -> 5
A146: Grave Doors 2 | B146: 5 | C146: 1 | D146: 3 | E146: 0 | F146: [146] | G146: =COUNTIF(canNotPass!C[-6],RC[-1]) -> 4 | H146: [146] | I146: =COUNTIF(tiles!C[-8],RC[-1]) -> 5
A147: BlackSmith 1 | B147: 4 | C147: 3 | D147: 4 | E147: 500 | F147: [147] | G147: =COUNTIF(canNotPass!C[-6],RC[-1]) -> 12 | H147: [147] | I147: =COUNTIF(tiles!C[-8],RC[-1]) -> 12
A148: BlackSmith 2 | B148: 4 | C148: 3 | D148: 4 | E148: 500 | F148: [148] | G148: =COUNTIF(canNotPass!C[-6],RC[-1]) -> 12 | H148: [148] | I148: =COUNTIF(tiles!C[-8],RC[-1]) -> 12
A149: StoneHenge 1 | B149: 1 | C149: 2 | D149: 4 | E149: 0 | F149: [149] | G149: =COUNTIF(canNotPass!C[-6],RC[-1]) -> 2 | H149: [149] | I149: =COUNTIF(tiles!C[-8],RC[-1]) -> 2
A150: StoneHenge 2 | B150: 2 | C150: 2 | D150: 4 | E150: 0 | F150: [150] | G150: =COUNTIF(canNotPass!C[-6],RC[-1]) -> 4 | H150: [150] | I150: =COUNTIF(tiles!C[-8],RC[-1]) -> 4
A151: StoneHenge 3 | B151: 2 | C151: 2 | D151: 4 | E151: 0 | F151: [151] | G151: =COUNTIF(canNotPass!C[-6],RC[-1]) -> 4 | H151: [151] | I151: =COUNTIF(tiles!C[-8],RC[-1]) -> 4
A152: StoneHenge 4 | B152: 2 | C152: 2 | D152: 4 | E152: 0 | F152: [152] | G152: =COUNTIF(canNotPass!C[-6],RC[-1]) -> 4 | H152: [152] | I152: =COUNTIF(tiles!C[-8],RC[-1]) -> 4
A153: StoneHenge 5 | B153: 2 | C153: 2 | D153: 4 | E153: 0 | F153: [153] | G153: =COUNTIF(canNotPass!C[-6],RC[-1]) -> 4 | H153: [153] | I153: =COUNTIF(tiles!C[-8],RC[-1]) -> 4
A154: StoneHenge 6 | B154: 2 | C154: 2 | D154: 4 | E154: 0 | F154: [154] | G154: =COUNTIF(canNotPass!C[-6],RC[-1]) -> 4 | H154: [154] | I154: =COUNTIF(tiles!C[-8],RC[-1]) -> 4
A155: StoneHenge 7 | B155: 2 | C155: 2 | D155: 4 | E155: 0 | F155: [155] | G155: =COUNTIF(canNotPass!C[-6],RC[-1]) -> 4 | H155: [155] | I155: =COUNTIF(tiles!C[-8],RC[-1]) -> 4
A156: StoneHenge 8 | B156: 2 | C156: 2 | D156: 4 | E156: 0 | F156: [156] | G156: =COUNTIF(canNotPass!C[-6],RC[-1]) -> 4 | H156: [156] | I156: =COUNTIF(tiles!C[-8],RC[-1]) -> 4
A157: Barbarian Hut 4 | B157: 4 | C157: 3 | D157: 4 | E157: 300 | F157: [157] | G157: =COUNTIF(canNotPass!C[-6],RC[-1]) -> 10 | H157: [157] | I157: =COUNTIF(tiles!C[-8],RC[-1]) -> 12
A158: Barbarian Hut 5 | B158: 4 | C158: 3 | D158: 4 | E158: 300 | F158: [158] | G158: =COUNTIF(canNotPass!C[-6],RC[-1]) -> 11 | H158: [158] | I158: =COUNTIF(tiles!C[-8],RC[-1]) -> 12
A159: Barbarian Hut 6 | B159: 4 | C159: 4 | D159: 4 | E159: 300 | F159: [159] | G159: =COUNTIF(canNotPass!C[-6],RC[-1]) -> 15 | H159: [159] | I159: =COUNTIF(tiles!C[-8],RC[-1]) -> 16
A160: Barbarian Hut 7 | B160: 4 | C160: 4 | D160: 4 | E160: 300 | F160: [160] | G160: =COUNTIF(canNotPass!C[-6],RC[-1]) -> 13 | H160: [160] | I160: =COUNTIF(tiles!C[-8],RC[-1]) -> 16
A161: Barbarian Hut 8 | B161: 4 | C161: 4 | D161: 4 | E161: 300 | F161: [161] | G161: =COUNTIF(canNotPass!C[-6],RC[-1]) -> 14 | H161: [161] | I161: =COUNTIF(tiles!C[-8],RC[-1]) -> 16
A162: Barbarian Hut 9 | B162: 4 | C162: 4 | D162: 4 | E162: 300 | F162: [162] | G162: =COUNTIF(canNotPass!C[-6],RC[-1]) -> 14 | H162: [162] | I162: =COUNTIF(tiles!C[-8],RC[-1]) -> 16
A163: Kaarg Hut 1 | B163: 3 | C163: 3 | D163: 3 | E163: 300 | F163: [163] | G163: =COUNTIF(canNotPass!C[-6],RC[-1]) -> 9 | H163: [163] | I163: =COUNTIF(tiles!C[-8],RC[-1]) -> 9
A164: Kaarg Hut 2 | B164: 3 | C164: 3 | D164: 3 | E164: 300 | F164: [164] | G164: =COUNTIF(canNotPass!C[-6],RC[-1]) -> 9 | H164: [164] | I164: =COUNTIF(tiles!C[-8],RC[-1]) -> 9
A165: Kaarg Hut 3 | B165: 3 | C165: 3 | D165: 3 | E165: 300 | F165: [165] | G165: =COUNTIF(canNotPass!C[-6],RC[-1]) -> 9 | H165: [165] | I165: =COUNTIF(tiles!C[-8],RC[-1]) -> 9
A166: Kaarg Hut 4 | B166: 3 | C166: 3 | D166: 3 | E166: 300 | F166: [166] | G166: =COUNTIF(canNotPass!C[-6],RC[-1]) -> 9 | H166: [166] | I166: =COUNTIF(tiles!C[-8],RC[-1]) -> 9
A167: Kaarg Hut 5 | B167: 3 | C167: 3 | D167: 3 | E167: 300 | F167: [167] | G167: =COUNTIF(canNotPass!C[-6],RC[-1]) -> 9 | H167: [167] | I167: =COUNTIF(tiles!C[-8],RC[-1]) -> 9
A168: Kaarg Hut 6 | B168: 3 | C168: 3 | D168: 3 | E168: 300 | F168: [168] | G168: =COUNTIF(canNotPass!C[-6],RC[-1]) -> 9 | H168: [168] | I168: =COUNTIF(tiles!C[-8],RC[-1]) -> 9
A169: Mine 1 | B169: 3 | C169: 3 | D169: 3 | E169: 300 | F169: [169] | G169: =COUNTIF(canNotPass!C[-6],RC[-1]) -> 9 | H169: [169] | I169: =COUNTIF(tiles!C[-8],RC[-1]) -> 9
A170: Mine 2 | B170: 3 | C170: 3 | D170: 3 | E170: 300 | F170: [170] | G170: =COUNTIF(canNotPass!C[-6],RC[-1]) -> 9 | H170: [170] | I170: =COUNTIF(tiles!C[-8],RC[-1]) -> 9
A171: Mine 3 | B171: 3 | C171: 3 | D171: 3 | E171: 300 | F171: [171] | G171: =COUNTIF(canNotPass!C[-6],RC[-1]) -> 9 | H171: [171] | I171: =COUNTIF(tiles!C[-8],RC[-1]) -> 9
A172: Ore 1 | B172: 2 | C172: 2 | D172: 3 | E172: 0 | F172: [172] | G172: =COUNTIF(canNotPass!C[-6],RC[-1]) -> 4 | H172: [172] | I172: =COUNTIF(tiles!C[-8],RC[-1]) -> 4
A173: Ore 2 | B173: 2 | C173: 2 | D173: 3 | E173: 0 | F173: [173] | G173: =COUNTIF(canNotPass!C[-6],RC[-1]) -> 4 | H173: [173] | I173: =COUNTIF(tiles!C[-8],RC[-1]) -> 4
A174: Ore 3 | B174: 2 | C174: 2 | D174: 3 | E174: 0 | F174: [174] | G174: =COUNTIF(canNotPass!C[-6],RC[-1]) -> 4 | H174: [174] | I174: =COUNTIF(tiles!C[-8],RC[-1]) -> 4
A175: StoneCrusher 1 | B175: 3 | C175: 2 | D175: 3 | E175: 300 | F175: [175] | G175: =COUNTIF(canNotPass!C[-6],RC[-1]) -> 6 | H175: [175] | I175: =COUNTIF(tiles!C[-8],RC[-1]) -> 6
A176: StoneCrusher 2 | B176: 3 | C176: 2 | D176: 3 | E176: 300 | F176: [176] | G176: =COUNTIF(canNotPass!C[-6],RC[-1]) -> 6 | H176: [176] | I176: =COUNTIF(tiles!C[-8],RC[-1]) -> 6
A177: StoneCrusher 3 | B177: 2 | C177: 3 | D177: 3 | E177: 300 | F177: [177] | G177: =COUNTIF(canNotPass!C[-6],RC[-1]) -> 6 | H177: [177] | I177: =COUNTIF(tiles!C[-8],RC[-1]) -> 6
A178: Pyramid 1 | B178: 3 | C178: 3 | D178: 3 | E178: 0 | F178: [178] | G178: =COUNTIF(canNotPass!C[-6],RC[-1]) -> 7 | H178: [178] | I178: =COUNTIF(tiles!C[-8],RC[-1]) -> 9
A179: Pyramid 2 | B179: 3 | C179: 2 | D179: 3 | E179: 0 | F179: [179] | G179: =COUNTIF(canNotPass!C[-6],RC[-1]) -> 6 | H179: [179] | I179: =COUNTIF(tiles!C[-8],RC[-1]) -> 6
A180: Pyramid 3 | B180: 3 | C180: 2 | D180: 3 | E180: 0 | F180: [180] | G180: =COUNTIF(canNotPass!C[-6],RC[-1]) -> 6 | H180: [180] | I180: =COUNTIF(tiles!C[-8],RC[-1]) -> 6
A181: Pyramid 4 | B181: 3 | C181: 2 | D181: 3 | E181: 0 | F181: [181] | G181: =COUNTIF(canNotPass!C[-6],RC[-1]) -> 6 | H181: [181] | I181: =COUNTIF(tiles!C[-8],RC[-1]) -> 6

Sheet: canNotPass
A1: PARENTID | B1: FIRST | C1: SECOND
A2: ParentID | B2: first | C2: second
A3: [3] | B3: 0 | C3: 0
A4: [3] | B4: 1 | C4: 0
A5: [3] | B5: 1 | C5: 1
A6: [3] | B6: 2 | C6: 0
A7: [3] | B7: 2 | C7: 1
A8: [4] | B8: 0 | C8: 0
A9: [4] | B9: 1 | C9: 0
A10: [4] | B10: 1 | C10: 1
A11: [4] | B11: 2 | C11: 0
A12: [4] | B12: 2 | C12: 1
A13: [5] | B13: 0 | C13: 0
A14: [5] | B14: 1 | C14: 0
A15: [5] | B15: 1 | C15: 1
A16: [5] | B16: 2 | C16: 0
A17: [6] | B17: 0 | C17: 0
A18: [6] | B18: 1 | C18: 0
A19: [6] | B19: 1 | C19: 1
A20: [6] | B20: 2 | C20: 0
A21: [7] | B21: 0 | C21: 1
A22: [7] | B22: 1 | C22: 0
A23: [7] | B23: 1 | C23: 1
A24: [7] | B24: 1 | C24: 2
A25: [7] | B25: 2 | C25: 1
A26: [8] | B26: 0 | C26: 1
A27: [8] | B27: 0 | C27: 2
A28: [8] | B28: 1 | C28: 0
A29: [8] | B29: 1 | C29: 1
A30: [8] | B30: 1 | C30: 2
A31: [8] | B31: 2 | C31: 1
A32: [9] | B32: 0 | C32: 1
A33: [9] | B33: 0 | C33: 2
A34: [9] | B34: 1 | C34: 0
A35: [9] | B35: 1 | C35: 1
A36: [9] | B36: 1 | C36: 2
A37: [9] | B37: 2 | C37: 1
A38: [9] | B38: 2 | C38: 2
A39: [10] | B39: 0 | C39: 0
A40: [10] | B40: 0 | C40: 1
A41: [10] | B41: 1 | C41: 0
A42: [10] | B42: 1 | C42: 1
A43: [11] | B43: 0 | C43: 1
A44: [11] | B44: 0 | C44: 2
A45: [11] | B45: 1 | C45: 0
A46: [11] | B46: 1 | C46: 1
A47: [11] | B47: 1 | C47: 2
A48: [11] | B48: 2 | C48: 0
A49: [11] | B49: 2 | C49: 1
A50: [11] | B50: 2 | C50: 2
A51: [12] | B51: 0 | C51: 1
A52: [12] | B52: 0 | C52: 2
A53: [12] | B53: 1 | C53: 0
A54: [12] | B54: 1 | C54: 1
A55: [12] | B55: 1 | C55: 2
A56: [12] | B56: 2 | C56: 1
A57: [12] | B57: 2 | C57: 2
A58: [13] | B58: 0 | C58: 1
A59: [13] | B59: 1 | C59: 0
A60: [13] | B60: 1 | C60: 1
A61: [13] | B61: 1 | C61: 2
A62: [13] | B62: 2 | C62: 0
A63: [13] | B63: 2 | C63: 1
A64: [13] | B64: 2 | C64: 2
A65: [13] | B65: 3 | C65: 1
A66: [13] | B66: 3 | C66: 2
A67: [14] | B67: 0 | C67: 0
A68: [14] | B68: 0 | C68: 1
A69: [14] | B69: 1 | C69: 0
A70: [14] | B70: 1 | C70: 1
A71: [15] | B71: 0 | C71: 0
A72: [15] | B72: 0 | C72: 1
A73: [15] | B73: 1 | C73: 0
A74: [15] | B74: 1 | C74: 1
A75: [16] | B75: 0 | C75: 0
A76: [16] | B76: 0 | C76: 1
A77: [16] | B77: 1 | C77: 0
A78: [16] | B78: 1 | C78: 1
A79: [16] | B79: 2 | C79: 0
A80: [16] | B80: 2 | C80: 1
A81: [17] | B81: 0 | C81: 0
A82: [17] | B82: 0 | C82: 1
A83: [17] | B83: 1 | C83: 0
A84: [17] | B84: 1 | C84: 1
A85: [18] | B85: 0 | C85: 0
A86: [18] | B86: 0 | C86: 1
A87: [18] | B87: 0 | C87: 2
A88: [18] | B88: 1 | C88: 0
A89: [18] | B89: 1 | C89: 1
A90: [18] | B90: 1 | C90: 2
A91: [18] | B91: 2 | C91: 0
A92: [18] | B92: 2 | C92: 1
A93: [18] | B93: 2 | C93: 2
A94: [19] | B94: 0 | C94: 1
A95: [19] | B95: 1 | C95: 0
A96: [19] | B96: 1 | C96: 1
A97: [19] | B97: 1 | C97: 2
A98: [19] | B98: 2 | C98: 1
A99: [20] | B99: 0 | C99: 0
A100: [20] | B100: 0 | C100: 1
A101: [20] | B101: 1 | C101: 0
A102: [20] | B102: 1 | C102: 1
A103: [20] | B103: 1 | C103: 2
A104: [20] | B104: 2 | C104: 0
A105: [20] | B105: 2 | C105: 1
A106: [20] | B106: 2 | C106: 2
A107: [21] | B107: 0 | C107: 0
A108: [21] | B108: 0 | C108: 1
A109: [21] | B109: 0 | C109: 2
A110: [21] | B110: 1 | C110: 0
A111: [21] | B111: 1 | C111: 1
A112: [21] | B112: 1 | C112: 2
A113: [21] | B113: 2 | C113: 0
A114: [21] | B114: 2 | C114: 1
A115: [21] | B115: 2 | C115: 2
A116: [22] | B116: 0 | C116: 0
A117: [22] | B117: 0 | C117: 1
A118: [22] | B118: 1 | C118: 0
A119: [22] | B119: 1 | C119: 1
A120: [22] | B120: 1 | C120: 2
A121: [22] | B121: 2 | C121: 0
A122: [22] | B122: 2 | C122: 1
A123: [22] | B123: 2 | C123: 2
A124: [23] | B124: 0 | C124: 0
A125: [23] | B125: 0 | C125: 1
A126: [23] | B126: 1 | C126: 0
A127: [23] | B127: 1 | C127: 1
A128: [23] | B128: 1 | C128: 2
A129: [23] | B129: 2 | C129: 0
A130: [23] | B130: 2 | C130: 1
A131: [23] | B131: 2 | C131: 2
A132: [24] | B132: 0 | C132: 0
A133: [24] | B133: 0 | C133: 1
A134: [24] | B134: 1 | C134: 0
A135: [24] | B135: 1 | C135: 1
A136: [24] | B136: 1 | C136: 2
A137: [24] | B137: 2 | C137: 0
A138: [24] | B138: 2 | C138: 1
A139: [24] | B139: 2 | C139: 2
A140: [25] | B140: 0 | C140: 0
A141: [25] | B141: 0 | C141: 1
A142: [25] | B142: 1 | C142: 0
A143: [25] | B143: 1 | C143: 1
A144: [25] | B144: 1 | C144: 2
A145: [25] | B145: 2 | C145: 0
A146: [25] | B146: 2 | C146: 1
A147: [25] | B147: 2 | C147: 2
A148: [26] | B148: 0 | C148: 0
A149: [27] | B149: 0 | C149: 0
A150: [28] | B150: 0 | C150: 0
A151: [28] | B151: 1 | C151: 0
A152: [30] | B152: 0 | C152: 0
A153: [31] | B153: 0 | C153: 0
A154: [32] | B154: 0 | C154: 0
A155: [32] | B155: 2 | C155: 0
A156: [33] | B156: 0 | C156: 0
A157: [33] | B157: 0 | C157: 1
A158: [33] | B158: 1 | C158: 1
A159: [34] | B159: 0 | C159: 0
A160: [35] | B160: 0 | C160: 0
A161: [36] | B161: 0 | C161: 0
A162: [36] | B162: 0 | C162: 1
A163: [36] | B163: 1 | C163: 0
A164: [36] | B164: 1 | C164: 1
A165: [36] | B165: 1 | C165: 2
A166: [36] | B166: 2 | C166: 0
A167: [36] | B167: 2 | C167: 1
A168: [36] | B168: 2 | C168: 2
A169: [37] | B169: 0 | C169: 0
A170: [37] | B170: 0 | C170: 1
A171: [37] | B171: 1 | C171: 0
A172: [37] | B172: 1 | C172: 1
A173: [37] | B173: 1 | C173: 2
A174: [37] | B174: 2 | C174: 0
A175: [37] | B175: 2 | C175: 1
A176: [37] | B176: 2 | C176: 2
A177: [38] | B177: 0 | C177: 0
A178: [38] | B178: 1 | C178: 0
A179: [39] | B179: 0 | C179: 0
A180: [40] | B180: 0 | C180: 0
A181: [40] | B181: 0 | C181: 3
A182: [40] | B182: 1 | C182: 0
A183: [40] | B183: 1 | C183: 3
A184: [40] | B184: 2 | C184: 0
A185: [40] | B185: 2 | C185: 3
A186: [40] | B186: 3 | C186: 0
A187: [40] | B187: 3 | C187: 3
A188: [40] | B188: 4 | C188: 0
A189: [40] | B189: 4 | C189: 3
A190: [40] | B190: 5 | C190: 0
A191: [40] | B191: 5 | C191: 3
A192: [41] | B192: 0 | C192: 0
A193: [41] | B193: 0 | C193: 1
A194: [41] | B194: 1 | C194: 0
A195: [41] | B195: 1 | C195: 1
A196: [42] | B196: 0 | C196: 0
A197: [42] | B197: 0 | C197: 1
A198: [42] | B198: 1 | C198: 0
A199: [42] | B199: 1 | C199: 1
A200: [43] | B200: 0 | C200: 0
A201: [44] | B201: 0 | C201: 0
A202: [45] | B202: 0 | C202: 0
A203: [45] | B203: 0 | C203: 1
A204: [45] | B204: 1 | C204: 0
A205: [45] | B205: 1 | C205: 1
A206: [45] | B206: 1 | C206: 2
A207: [45] | B207: 2 | C207: 0
A208: [45] | B208: 2 | C208: 1
A209: [46] | B209: 0 | C209: 0
A210: [46] | B210: 0 | C210: 1
A211: [46] | B211: 0 | C211: 2
A212: [46] | B212: 1 | C212: 0
A213: [46] | B213: 1 | C213: 1
A214: [46] | B214: 1 | C214: 2
A215: [46] | B215: 2 | C215: 0
A216: [46] | B216: 2 | C216: 1
A217: [46] | B217: 2 | C217: 2
A218: [47] | B218: 0 | C218: 0
A219: [47] | B219: 0 | C219: 1
A220: [47] | B220: 1 | C220: 0
A221: [47] | B221: 1 | C221: 1
A222: [47] | B222: 1 | C222: 2
A223: [47] | B223: 2 | C223: 0
A224: [47] | B224: 2 | C224: 1
A225: [47] | B225: 2 | C225: 2
A226: [48] | B226: 0 | C226: 0
A227: [48] | B227: 0 | C227: 1
A228: [48] | B228: 0 | C228: 2
A229: [48] | B229: 1 | C229: 0
A230: [48] | B230: 1 | C230: 1
A231: [48] | B231: 1 | C231: 2
A232: [49] | B232: 0 | C232: 0
A233: [49] | B233: 0 | C233: 1
A234: [49] | B234: 0 | C234: 2
A235: [49] | B235: 1 | C235: 0
A236: [49] | B236: 1 | C236: 1
A237: [49] | B237: 1 | C237: 2
A238: [51] | B238: 0 | C238: 1
A239: [51] | B239: 0 | C239: 2
A240: [51] | B240: 0 | C240: 3
A241: [51] | B241: 1 | C241: 0
A242: [51] | B242: 1 | C242: 1
A243: [51] | B243: 1 | C243: 2
A244: [51] | B244: 1 | C244: 3
A245: [51] | B245: 2 | C245: 1
A246: [51] | B246: 2 | C246: 2
A247: [51] | B247: 2 | C247: 3
A248: [52] | B248: 0 | C248: 1
A249: [52] | B249: 0 | C249: 2
A250: [52] | B250: 0 | C250: 3
A251: [52] | B251: 1 | C251: 0
A252: [52] | B252: 1 | C252: 1
A253: [52] | B253: 1 | C253: 2
A254: [52] | B254: 1 | C254: 3
A255: [52] | B255: 2 | C255: 1
A256: [52] | B256: 2 | C256: 2
A257: [52] | B257: 2 | C257: 3
A258: [53] | B258: 0 | C258: 1
A259: [53] | B259: 0 | C259: 2
A260: [53] | B260: 1 | C260: 0
A261: [53] | B261: 1 | C261: 1
A262: [53] | B262: 1 | C262: 2
A263: [53] | B263: 1 | C263: 3
A264: [53] | B264: 2 | C264: 1
A265: [53] | B265: 2 | C265: 2
A266: [53] | B266: 2 | C266: 3
A267: [54] | B267: 0 | C267: 0
A268: [54] | B268: 0 | C268: 1
A269: [54] | B269: 0 | C269: 2
A270: [54] | B270: 0 | C270: 3
A271: [54] | B271: 0 | C271: 4
A272: [54] | B272: 0 | C272: 5
A273: [54] | B273: 3 | C273: 0
A274: [54] | B274: 3 | C274: 1
A275: [54] | B275: 3 | C275: 2
A276: [54] | B276: 3 | C276: 3
A277: [54] | B277: 3 | C277: 4
A278: [54] | B278: 3 | C278: 5
A279: [55] | B279: 0 | C279: 0
A280: [56] | B280: 0 | C280: 0
A281: [56] | B281: 0 | C281: 1
A282: [56] | B282: 0 | C282: 2
A283: [56] | B283: 1 | C283: 0
A284: [56] | B284: 1 | C284: 1
A285: [56] | B285: 1 | C285: 2
A286: [56] | B286: 2 | C286: 0
A287: [56] | B287: 2 | C287: 1
A288: [56] | B288: 2 | C288: 2
A289: [57] | B289: 0 | C289: 0
A290: [57] | B290: 0 | C290: 1
A291: [57] | B291: 1 | C291: 0
A292: [57] | B292: 1 | C292: 1
A293: [57] | B293: 1 | C293: 2
A294: [57] | B294: 2 | C294: 0
A295: [57] | B295: 2 | C295: 1
A296: [57] | B296: 2 | C296: 2
A297: [57] | B297: 3 | C297: 0
A298: [57] | B298: 3 | C298: 1
A299: [58] | B299: 0 | C299: 0
A300: [58] | B300: 0 | C300: 1
A301: [58] | B301: 1 | C301: 0
A302: [58] | B302: 1 | C302: 1
A303: [59] | B303: 0 | C303: 0
A304: [59] | B304: 0 | C304: 3
A305: [59] | B305: 1 | C305: 0
A306: [59] | B306: 1 | C306: 1
A307: [59] | B307: 1 | C307: 3
A308: [59] | B308: 2 | C308: 0
A309: [59] | B309: 2 | C309: 1
A310: [59] | B310: 2 | C310: 2
A311: [59] | B311: 2 | C311: 3
A312: [59] | B312: 3 | C312: 0
A313: [59] | B313: 3 | C313: 1
A314: [59] | B314: 3 | C314: 2
A315: [59] | B315: 3 | C315: 3
A316: [59] | B316: 4 | C316: 0
A317: [59] | B317: 4 | C317: 1
A318: [59] | B318: 4 | C318: 2
A319: [59] | B319: 4 | C319: 3
A320: [59] | B320: 5 | C320: 0
A321: [59] | B321: 5 | C321: 1
A322: [59] | B322: 5 | C322: 2
A323: [59] | B323: 5 | C323: 3
A324: [59] | B324: 6 | C324: 0
A325: [59] | B325: 6 | C325: 1
A326: [59] | B326: 6 | C326: 2
A327: [59] | B327: 6 | C327: 3
A328: [59] | B328: 7 | C328: 0
A329: [59] | B329: 7 | C329: 1
A330: [59] | B330: 7 | C330: 2
A331: [59] | B331: 7 | C331: 3
A332: [59] | B332: 8 | C332: 0
A333: [59] | B333: 8 | C333: 1
A334: [59] | B334: 8 | C334: 2
A335: [59] | B335: 8 | C335: 3
A336: [59] | B336: 9 | C336: 0
A337: [59] | B337: 9 | C337: 1
A338: [59] | B338: 9 | C338: 3
A339: [59] | B339: 10 | C339: 0
A340: [59] | B340: 10 | C340: 2
A341: [60] | B341: 0 | C341: 0
A342: [60] | B342: 0 | C342: 1
A343: [60] | B343: 1 | C343: 0
A344: [60] | B344: 1 | C344: 1
A345: [60] | B345: 2 | C345: 0
A346: [60] | B346: 2 | C346: 1
A347: [61] | B347: 0 | C347: 0
A348: [61] | B348: 0 | C348: 1
A349: [61] | B349: 1 | C349: 0
A350: [61] | B350: 1 | C350: 1
A351: [61] | B351: 2 | C351: 0
A352: [61] | B352: 2 | C352: 1
A353: [62] | B353: 0 | C353: 0
A354: [62] | B354: 0 | C354: 1
A355: [62] | B355: 1 | C355: 0
A356: [62] | B356: 1 | C356: 1
A357: [62] | B357: 2 | C357: 0
A358: [62] | B358: 2 | C358: 1
A359: [63] | B359: 0 | C359: 0
A360: [63] | B360: 0 | C360: 1
A361: [63] | B361: 1 | C361: 0
A362: [63] | B362: 1 | C362: 1
A363: [63] | B363: 2 | C363: 0
A364: [63] | B364: 2 | C364: 1
A365: [64] | B365: 0 | C365: 0
A366: [64] | B366: 0 | C366: 1
A367: [64] | B367: 1 | C367: 0
A368: [64] | B368: 1 | C368: 1
A369: [64] | B369: 2 | C369: 0
A370: [64] | B370: 2 | C370: 1
A371: [65] | B371: 0 | C371: 0
A372: [65] | B372: 0 | C372: 1
A373: [65] | B373: 1 | C373: 0
A374: [65] | B374: 1 | C374: 1
A375: [65] | B375: 2 | C375: 0
A376: [65] | B376: 2 | C376: 1
A377: [66] | B377: 0 | C377: 0
A378: [66] | B378: 0 | C378: 1
A379: [66] | B379: 1 | C379: 0
A380: [66] | B380: 1 | C380: 1
A381: [66] | B381: 2 | C381: 0
A382: [66] | B382: 2 | C382: 1
A383: [67] | B383: 0 | C383: 0
A384: [67] | B384: 0 | C384: 1
A385: [67] | B385: 1 | C385: 0
A386: [67] | B386: 1 | C386: 1
A387: [67] | B387: 2 | C387: 0
A388: [67] | B388: 2 | C388: 1
A389: [68] | B389: 0 | C389: 1
A390: [68] | B390: 1 | C390: 0
A391: [68] | B391: 1 | C391: 1
A392: [68] | B392: 1 | C392: 2
A393: [68] | B393: 2 | C393: 0
A394: [68] | B394: 2 | C394: 1
A395: [68] | B395: 2 | C395: 2
A396: [68] | B396: 3 | C396: 1
A397: [68] | B397: 3 | C397: 2
A398: [69] | B398: 0 | C398: 0
A399: [69] | B399: 0 | C399: 1
A400: [69] | B400: 1 | C400: 0
A401: [69] | B401: 1 | C401: 1
A402: [69] | B402: 1 | C402: 2
A403: [69] | B403: 2 | C403: 0
A404: [69] | B404: 2 | C404: 1
A405: [70] | B405: 0 | C405: 0
A406: [70] | B406: 0 | C406: 1
A407: [70] | B407: 0 | C407: 2
A408: [70] | B408: 1 | C408: 0
A409: [70] | B409: 1 | C409: 1
A410: [70] | B410: 1 | C410: 2
A411: [70] | B411: 2 | C411: 0
A412: [70] | B412: 2 | C412: 1
A413: [70] | B413: 2 | C413: 2
A414: [71] | B414: 0 | C414: 0
A415: [71] | B415: 0 | C415: 1
A416: [71] | B416: 1 | C416: 0
A417: [71] | B417: 1 | C417: 1
A418: [71] | B418: 1 | C418: 2
A419: [71] | B419: 2 | C419: 0
A420: [71] | B420: 2 | C420: 1
A421: [71] | B421: 2 | C421: 2
A422: [72] | B422: 0 | C422: 0
A423: [73] | B423: 0 | C423: 0
A424: [74] | B424: 0 | C424: 0
A425: [75] | B425: 0 | C425: 0
A426: [76] | B426: 0 | C426: 0
A427: [77] | B427: 0 | C427: 0
A428: [78] | B428: 0 | C428: 0
A429: [78] | B429: 0 | C429: 1
A430: [78] | B430: 1 | C430: 0
A431: [78] | B431: 1 | C431: 1
A432: [79] | B432: 0 | C432: 0
A433: [79] | B433: 0 | C433: 1
A434: [79] | B434: 1 | C434: 0
A435: [79] | B435: 1 | C435: 1
A436: [80] | B436: 0 | C436: 0
A437: [80] | B437: 0 | C437: 1
A438: [80] | B438: 1 | C438: 0
A439: [80] | B439: 1 | C439: 1
A440: [80] | B440: 2 | C440: 0
A441: [80] | B441: 2 | C441: 1
A442: [81] | B442: 0 | C442: 0
A443: [81] | B443: 0 | C443: 1
A444: [81] | B444: 1 | C444: 0
A445: [81] | B445: 1 | C445: 1
A446: [81] | B446: 2 | C446: 0
A447: [81] | B447: 2 | C447: 1
A448: [82] | B448: 0 | C448: 0
A449: [82] | B449: 0 | C449: 1
A450: [82] | B450: 1 | C450: 0
A451: [82] | B451: 1 | C451: 1
A452: [82] | B452: 2 | C452: 0
A453: [82] | B453: 2 | C453: 1
A454: [83] | B454: 0 | C454: 0
A455: [83] | B455: 0 | C455: 1
A456: [83] | B456: 0 | C456: 2
A457: [83] | B457: 1 | C457: 0
A458: [83] | B458: 1 | C458: 1
A459: [83] | B459: 1 | C459: 2
A460: [83] | B460: 2 | C460: 0
A461: [83] | B461: 2 | C461: 1
A462: [83] | B462: 2 | C462: 2
A463: [84] | B463: 0 | C463: 1
A464: [84] | B464: 0 | C464: 2
A465: [84] | B465: 1 | C465: 0
A466: [84] | B466: 1 | C466: 1
A467: [84] | B467: 1 | C467: 2
A468: [84] | B468: 2 | C468: 1
A469: [85] | B469: 0 | C469: 1
A470: [85] | B470: 0 | C470: 2
A471: [85] | B471: 1 | C471: 0
A472: [85] | B472: 1 | C472: 1
A473: [85] | B473: 1 | C473: 2
A474: [85] | B474: 2 | C474: 0
A475: [85] | B475: 2 | C475: 1
A476: [85] | B476: 2 | C476: 2
A477: [86] | B477: 0 | C477: 0
A478: [86] | B478: 0 | C478: 1
A479: [86] | B479: 1 | C479: 0
A480: [86] | B480: 1 | C480: 1
A481: [86] | B481: 2 | C481: 0
A482: [86] | B482: 2 | C482: 1
A483: [87] | B483: 0 | C483: 1
A484: [87] | B484: 1 | C484: 0
A485: [87] | B485: 1 | C485: 1
A486: [87] | B486: 1 | C486: 2
A487: [87] | B487: 2 | C487: 1
A488: [88] | B488: 0 | C488: 0
A489: [88] | B489: 0 | C489: 1
A490: [88] | B490: 1 | C490: 0
A491: [88] | B491: 1 | C491: 1
A492: [88] | B492: 2 | C492: 0
A493: [88] | B493: 2 | C493: 1
A494: [89] | B494: 0 | C494: 0
A495: [89] | B495: 0 | C495: 1
A496: [89] | B496: 0 | C496: 2
A497: [89] | B497: 1 | C497: 0
A498: [89] | B498: 1 | C498: 1
A499: [89] | B499: 1 | C499: 2
A500: [89] | B500: 1 | C500: 3
A501: [89] | B501: 2 | C501: 0
A502: [89] | B502: 2 | C502: 1
A503: [89] | B503: 2 | C503: 2
A504: [89] | B504: 2 | C504: 3
A505: [89] | B505: 3 | C505: 0
A506: [89] | B506: 3 | C506: 1
A507: [89] | B507: 3 | C507: 2
A508: [89] | B508: 3 | C508: 3
A509: [90] | B509: 0 | C509: 1
A510: [90] | B510: 0 | C510: 2
A511: [90] | B511: 0 | C511: 3
A512: [90] | B512: 1 | C512: 0
A513: [90] | B513: 1 | C513: 1
A514: [90] | B514: 1 | C514: 2
A515: [90] | B515: 1 | C515: 3
A516: [90] | B516: 2 | C516: 0
A517: [90] | B517: 2 | C517: 1
A518: [90] | B518: 2 | C518: 2
A519: [90] | B519: 2 | C519: 3
A520: [90] | B520: 3 | C520: 0
A521: [90] | B521: 3 | C521: 1
A522: [90] | B522: 3 | C522: 2
A523: [90] | B523: 3 | C523: 3
A524: [91] | B524: 0 | C524: 1
A525: [91] | B525: 0 | C525: 2
A526: [91] | B526: 0 | C526: 3
A527: [91] | B527: 1 | C527: 0
A528: [91] | B528: 1 | C528: 1
A529: [91] | B529: 1 | C529: 2
A530: [91] | B530: 1 | C530: 3
A531: [91] | B531: 2 | C531: 0
A532: [91] | B532: 2 | C532: 1
A533: [91] | B533: 2 | C533: 2
A534: [91] | B534: 2 | C534: 3
A535: [91] | B535: 3 | C535: 0
A536: [91] | B536: 3 | C536: 1
A537: [91] | B537: 3 | C537: 2
A538: [91] | B538: 3 | C538: 3
A539: [92] | B539: 0 | C539: 0
A540: [92] | B540: 0 | C540: 1
A541: [92] | B541: 0 | C541: 2
A542: [92] | B542: 1 | C542: 0
A543: [92] | B543: 1 | C543: 1
A544: [92] | B544: 1 | C544: 2
A545: [92] | B545: 1 | C545: 3
A546: [92] | B546: 2 | C546: 0
A547: [92] | B547: 2 | C547: 1
A548: [92] | B548: 2 | C548: 2
A549: [92] | B549: 2 | C549: 3
A550: [92] | B550: 3 | C550: 0
A551: [92] | B551: 3 | C551: 1
A552: [92] | B552: 3 | C552: 2
A553: [92] | B553: 3 | C553: 3
A554: [93] | B554: 0 | C554: 0
A555: [93] | B555: 0 | C555: 1
A556: [93] | B556: 0 | C556: 2
A557: [93] | B557: 1 | C557: 0
A558: [93] | B558: 1 | C558: 1
A559: [93] | B559: 1 | C559: 2
A560: [93] | B560: 1 | C560: 3
A561: [93] | B561: 2 | C561: 0
A562: [93] | B562: 2 | C562: 1
A563: [93] | B563: 2 | C563: 2
A564: [93] | B564: 2 | C564: 3
A565: [93] | B565: 3 | C565: 0
A566: [93] | B566: 3 | C566: 1
A567: [93] | B567: 3 | C567: 2
A568: [94] | B568: 0 | C568: 0
A569: [94] | B569: 0 | C569: 1
A570: [94] | B570: 0 | C570: 2
A571: [94] | B571: 0 | C571: 3
A572: [94] | B572: 1 | C572: 0
A573: [94] | B573: 1 | C573: 1
A574: [94] | B574: 1 | C574: 2
A575: [94] | B575: 1 | C575: 3
A576: [94] | B576: 2 | C576: 0
A577: [94] | B577: 2 | C577: 1
A578: [94] | B578: 2 | C578: 2
A579: [94] | B579: 2 | C579: 3
A580: [94] | B580: 3 | C580: 0
A581: [94] | B581: 3 | C581: 1
A582: [94] | B582: 3 | C582: 2
A583: [94] | B583: 3 | C583: 3
A584: [95] | B584: 0 | C584: 0
A585: [95] | B585: 0 | C585: 1
A586: [95] | B586: 0 | C586: 2
A587: [95] | B587: 1 | C587: 0
A588: [95] | B588: 1 | C588: 1
A589: [95] | B589: 1 | C589: 2
A590: [95] | B590: 1 | C590: 3
A591: [95] | B591: 2 | C591: 0
A592: [95] | B592: 2 | C592: 1
A593: [95] | B593: 2 | C593: 2
A594: [95] | B594: 2 | C594: 3
A595: [95] | B595: 3 | C595: 0
A596: [95] | B596: 3 | C596: 1
A597: [95] | B597: 3 | C597: 2
A598: [95] | B598: 3 | C598: 3
A599: [96] | B599: 0 | C599: 0
A600: [96] | B600: 0 | C600: 1
A601: [96] | B601: 0 | C601: 2
A602: [96] | B602: 1 | C602: 0
A603: [96] | B603: 1 | C603: 1
A604: [96] | B604: 1 | C604: 2
A605: [96] | B605: 1 | C605: 3
A606: [96] | B606: 2 | C606: 0
A607: [96] | B607: 2 | C607: 1
A608: [96] | B608: 2 | C608: 2
A609: [96] | B609: 2 | C609: 3
A610: [96] | B610: 3 | C610: 0
A611: [96] | B611: 3 | C611: 1
A612: [96] | B612: 3 | C612: 2
A613: [97] | B613: 0 | C613: 0
A614: [97] | B614: 0 | C614: 1
A615: [97] | B615: 0 | C615: 2
A616: [97] | B616: 0 | C616: 3
A617: [97] | B617: 1 | C617: 0
A618: [97] | B618: 1 | C618: 1
A619: [97] | B619: 1 | C619: 2
A620: [97] | B620: 1 | C620: 3
A621: [97] | B621: 2 | C621: 0
A622: [97] | B622: 2 | C622: 1
A623: [97] | B623: 2 | C623: 2
A624: [97] | B624: 2 | C624: 3
A625: [97] | B625: 3 | C625: 0
A626: [97] | B626: 3 | C626: 1
A627: [97] | B627: 3 | C627: 2
A628: [97] | B628: 3 | C628: 3
A629: [98] | B629: 0 | C629: 0
A630: [98] | B630: 0 | C630: 1
A631: [98] | B631: 1 | C631: 0
A632: [98] | B632: 1 | C632: 1
A633: [98] | B633: 1 | C633: 2
A634: [98] | B634: 2 | C634: 0
A635: [98] | B635: 2 | C635: 1
A636: [98] | B636: 2 | C636: 2
A637: [99] | B637: 0 | C637: 0
A638: [99] | B638: 0 | C638: 1
A639: [99] | B639: 1 | C639: 0
A640: [99] | B640: 1 | C640: 1
A641: [99] | B641: 1 | C641: 2
A642: [99] | B642: 2 | C642: 0
A643: [99] | B643: 2 | C643: 1
A644: [100] | B644: 0 | C644: 0
A645: [100] | B645: 0 | C645: 1
A646: [100] | B646: 0 | C646: 2
A647: [100] | B647: 1 | C647: 0
A648: [100] | B648: 1 | C648: 1
A649: [100] | B649: 1 | C649: 2
A650: [100] | B650: 2 | C650: 0
A651: [100] | B651: 2 | C651: 1
A652: [100] | B652: 2 | C652: 2
A653: [101] | B653: 0 | C653: 0
A654: [101] | B654: 0 | C654: 1
A655: [101] | B655: 1 | C655: 0
A656: [101] | B656: 1 | C656: 1
A657: [101] | B657: 1 | C657: 2
A658: [101] | B658: 2 | C658: 0
A659: [101] | B659: 2 | C659: 1
A660: [101] | B660: 2 | C660: 2
A661: [102] | B661: 0 | C661: 0
A662: [102] | B662: 0 | C662: 1
A663: [102] | B663: 1 | C663: 0
A664: [102] | B664: 1 | C664: 1
A665: [102] | B665: 1 | C665: 2
A666: [102] | B666: 2 | C666: 0
A667: [102] | B667: 2 | C667: 1
A668: [103] | B668: 0 | C668: 0
A669: [103] | B669: 0 | C669: 1
A670: [103] | B670: 0 | C670: 2
A671: [103] | B671: 1 | C671: 0
A672: [103] | B672: 1 | C672: 1
A673: [103] | B673: 1 | C673: 2
A674: [103] | B674: 2 | C674: 0
A675: [103] | B675: 2 | C675: 1
A676: [103] | B676: 2 | C676: 2
A677: [104] | B677: 0 | C677: 0
A678: [104] | B678: 0 | C678: 1
A679: [104] | B679: 1 | C679: 0
A680: [104] | B680: 1 | C680: 1
A681: [104] | B681: 1 | C681: 2
A682: [104] | B682: 2 | C682: 0
A683: [104] | B683: 2 | C683: 1
A684: [104] | B684: 2 | C684: 2
A685: [104] | B685: 3 | C685: 0
A686: [104] | B686: 3 | C686: 1
A687: [104] | B687: 3 | C687: 2
A688: [105] | B688: 0 | C688: 0
A689: [105] | B689: 0 | C689: 1
A690: [105] | B690: 0 | C690: 2
A691: [105] | B691: 1 | C691: 0
A692: [105] | B692: 1 | C692: 1
A693: [105] | B693: 1 | C693: 2
A694: [105] | B694: 2 | C694: 0
A695: [105] | B695: 2 | C695: 1
A696: [105] | B696: 2 | C696: 2
A697: [105] | B697: 3 | C697: 0
A698: [105] | B698: 3 | C698: 1
A699: [105] | B699: 3 | C699: 2
A700: [106] | B700: 0 | C700: 0
A701: [106] | B701: 0 | C701: 1
A702: [106] | B702: 0 | C702: 2
A703: [106] | B703: 1 | C703: 0
A704: [106] | B704: 1 | C704: 1
A705: [106] | B705: 1 | C705: 2
A706: [106] | B706: 2 | C706: 0
A707: [106] | B707: 2 | C707: 1
A708: [106] | B708: 2 | C708: 2
A709: [106] | B709: 3 | C709: 0
A710: [106] | B710: 3 | C710: 1
A711: [106] | B711: 3 | C711: 2
A712: [107] | B712: 0 | C712: 0
A713: [107] | B713: 0 | C713: 1
A714: [107] | B714: 1 | C714: 0
A715: [107] | B715: 1 | C715: 1
A716: [107] | B716: 1 | C716: 2
A717: [107] | B717: 2 | C717: 0
A718: [107] | B718: 2 | C718: 1
A719: [107] | B719: 2 | C719: 2
A720: [107] | B720: 3 | C720: 0
A721: [107] | B721: 3 | C721: 1
A722: [107] | B722: 3 | C722: 2
A723: [108] | B723: 0 | C723: 0
A724: [108] | B724: 0 | C724: 1
A725: [108] | B725: 0 | C725: 2
A726: [108] | B726: 1 | C726: 0
A727: [108] | B727: 1 | C727: 1
A728: [108] | B728: 1 | C728: 2
A729: [108] | B729: 2 | C729: 0
A730: [108] | B730: 2 | C730: 1
A731: [108] | B731: 2 | C731: 2
A732: [108] | B732: 3 | C732: 0
A733: [108] | B733: 3 | C733: 1
A734: [108] | B734: 3 | C734: 2
A735: [109] | B735: 0 | C735: 0
A736: [109] | B736: 0 | C736: 1
A737: [109] | B737: 0 | C737: 2
A738: [109] | B738: 1 | C738: 0
A739: [109] | B739: 1 | C739: 1
A740: [109] | B740: 1 | C740: 2
A741: [109] | B741: 2 | C741: 0
A742: [109] | B742: 2 | C742: 1
A743: [109] | B743: 2 | C743: 2
A744: [109] | B744: 3 | C744: 0
A745: [109] | B745: 3 | C745: 1
A746: [109] | B746: 3 | C746: 2
A747: [110] | B747: 0 | C747: 0
A748: [110] | B748: 0 | C748: 1
A749: [110] | B749: 1 | C749: 0
A750: [110] | B750: 1 | C750: 1
A751: [110] | B751: 1 | C751: 2
A752: [110] | B752: 2 | C752: 0
A753: [110] | B753: 2 | C753: 1
A754: [110] | B754: 2 | C754: 2
A755: [110] | B755: 3 | C755: 0
A756: [110] | B756: 3 | C756: 1
A757: [111] | B757: 0 | C757: 0
A758: [111] | B758: 0 | C758: 1
A759: [111] | B759: 1 | C759: 0
A760: [111] | B760: 1 | C760: 1
A761: [111] | B761: 1 | C761: 2
A762: [111] | B762: 2 | C762: 0
A763: [111] | B763: 2 | C763: 1
A764: [111] | B764: 2 | C764: 2
A765: [111] | B765: 3 | C765: 0
A766: [111] | B766: 3 | C766: 1
A767: [112] | B767: 0 | C767: 0
A768: [112] | B768: 0 | C768: 1
A769: [112] | B769: 0 | C769: 2
A770: [112] | B770: 1 | C770: 0
A771: [112] | B771: 1 | C771: 1
A772: [112] | B772: 1 | C772: 2
A773: [112] | B773: 2 | C773: 0
A774: [112] | B774: 2 | C774: 1
A775: [112] | B775: 2 | C775: 2
A776: [112] | B776: 3 | C776: 0
A777: [112] | B777: 3 | C777: 1
A778: [113] | B778: 0 | C778: 0
A779: [113] | B779: 0 | C779: 1
A780: [113] | B780: 1 | C780: 0
A781: [113] | B781: 1 | C781: 1
A782: [113] | B782: 1 | C782: 2
A783: [113] | B783: 2 | C783: 0
A784: [113] | B784: 2 | C784: 1
A785: [113] | B785: 2 | C785: 2
A786: [113] | B786: 3 | C786: 0
A787: [113] | B787: 3 | C787: 1
A788: [114] | B788: 0 | C788: 0
A789: [114] | B789: 0 | C789: 1
A790: [114] | B790: 1 | C790: 0
A791: [114] | B791: 1 | C791: 1
A792: [114] | B792: 1 | C792: 2
A793: [114] | B793: 2 | C793: 0
A794: [114] | B794: 2 | C794: 1
A795: [114] | B795: 2 | C795: 2
A796: [114] | B796: 3 | C796: 0
A797: [114] | B797: 3 | C797: 1
A798: [115] | B798: 0 | C798: 0
A799: [115] | B799: 0 | C799: 1
A800: [115] | B800: 0 | C800: 2
A801: [115] | B801: 1 | C801: 0
A802: [115] | B802: 1 | C802: 1
A803: [115] | B803: 1 | C803: 2
A804: [115] | B804: 2 | C804: 0
A805: [115] | B805: 2 | C805: 1
A806: [115] | B806: 2 | C806: 2
A807: [115] | B807: 3 | C807: 0
A808: [115] | B808: 3 | C808: 1
A809: [116] | B809: 0 | C809: 0
A810: [116] | B810: 1 | C810: 0
A811: [116] | B811: 1 | C811: 1
A812: [116] | B812: 2 | C812: 0
A813: [116] | B813: 2 | C813: 1
A814: [117] | B814: 0 | C814: 0
A815: [117] | B815: 0 | C815: 1
A816: [117] | B816: 1 | C816: 0
A817: [117] | B817: 1 | C817: 1
A818: [117] | B818: 2 | C818: 0
A819: [117] | B819: 2 | C819: 1
A820: [118] | B820: 0 | C820: 0
A821: [118] | B821: 0 | C821: 1
A822: [118] | B822: 1 | C822: 0
A823: [118] | B823: 1 | C823: 1
A824: [118] | B824: 2 | C824: 0
A825: [118] | B825: 2 | C825: 1
A826: [119] | B826: 1 | C826: 1
A827: [119] | B827: 1 | C827: 2
A828: [119] | B828: 2 | C828: 1
A829: [119] | B829: 2 | C829: 2
A830: [120] | B830: 0 | C830: 0
A831: [120] | B831: 0 | C831: 1
A832: [120] | B832: 1 | C832: 0
A833: [120] | B833: 1 | C833: 1
A834: [121] | B834: 0 | C834: 0
A835: [121] | B835: 0 | C835: 1
A836: [121] | B836: 1 | C836: 0
A837: [121] | B837: 1 | C837: 1
A838: [122] | B838: 0 | C838: 0
A839: [122] | B839: 0 | C839: 1
A840: [122] | B840: 1 | C840: 0
A841: [122] | B841: 1 | C841: 1
A842: [123] | B842: 0 | C842: 0
A843: [123] | B843: 0 | C843: 1
A844: [123] | B844: 1 | C844: 0
A845: [123] | B845: 1 | C845: 1
A846: [123] | B846: 1 | C846: 2
A847: [123] | B847: 2 | C847: 1
A848: [123] | B848: 2 | C848: 2
A849: [124] | B849: 0 | C849: 1
A850: [124] | B850: 0 | C850: 2
A851: [124] | B851: 1 | C851: 0
A852: [124] | B852: 1 | C852: 1
A853: [124] | B853: 1 | C853: 2
A854: [124] | B854: 2 | C854: 0
A855: [124] | B855: 2 | C855: 1
A856: [125] | B856: 0 | C856: 0
A857: [125] | B857: 0 | C857: 1
A858: [125] | B858: 0 | C858: 2
A859: [125] | B859: 1 | C859: 0
A860: [125] | B860: 1 | C860: 1
A861: [125] | B861: 1 | C861: 2
A862: [125] | B862: 2 | C862: 1
A863: [126] | B863: 0 | C863: 0
A864: [126] | B864: 0 | C864: 1
A865: [126] | B865: 1 | C865: 0
A866: [126] | B866: 1 | C866: 1
A867: [127] | B867: 0 | C867: 0
A868: [127] | B868: 0 | C868: 1
A869: [127] | B869: 1 | C869: 0
A870: [127] | B870: 1 | C870: 1
A871: [128] | B871: 0 | C871: 0
A872: [128] | B872: 0 | C872: 1
A873: [128] | B873: 1 | C873: 0
A874: [128] | B874: 1 | C874: 1
A875: [129] | B875: 0 | C875: 0
A876: [129] | B876: 0 | C876: 1
A877: [129] | B877: 0 | C877: 2
A878: [129] | B878: 1 | C878: 0
A879: [129] | B879: 1 | C879: 1
A880: [129] | B880: 1 | C880: 2
A881: [129] | B881: 2 | C881: 0
A882: [129] | B882: 2 | C882: 1
A883: [129] | B883: 2 | C883: 2
A884: [130] | B884: 0 | C884: 0
A885: [130] | B885: 0 | C885: 1
A886: [130] | B886: 0 | C886: 2
A887: [130] | B887: 1 | C887: 0
A888: [130] | B888: 1 | C888: 1
A889: [130] | B889: 1 | C889: 2
A890: [130] | B890: 2 | C890: 0
A891: [130] | B891: 2 | C891: 1
A892: [130] | B892: 2 | C892: 2
A893: [131] | B893: 0 | C893: 0
A894: [131] | B894: 0 | C894: 1
A895: [131] | B895: 0 | C895: 2
A896: [131] | B896: 1 | C896: 0
A897: [131] | B897: 1 | C897: 1
A898: [131] | B898: 1 | C898: 2
A899: [131] | B899: 2 | C899: 0
A900: [131] | B900: 2 | C900: 1
A901: [131] | B901: 2 | C901: 2
A902: [132] | B902: 0 | C902: 0
A903: [132] | B903: 0 | C903: 1
A904: [132] | B904: 1 | C904: 0
A905: [132] | B905: 1 | C905: 1
A906: [133] | B906: 0 | C906: 0
A907: [133] | B907: 0 | C907: 1
A908: [133] | B908: 1 | C908: 0
A909: [133] | B909: 1 | C909: 1
A910: [134] | B910: 0 | C910: 0
A911: [134] | B911: 0 | C911: 1
A912: [134] | B912: 1 | C912: 0
A913: [134] | B913: 1 | C913: 1
A914: [135] | B914: 0 | C914: 0
A915: [135] | B915: 0 | C915: 1
A916: [135] | B916: 1 | C916: 0
A917: [135] | B917: 1 | C917: 1
A918: [135] | B918: 1 | C918: 2
A919: [135] | B919: 2 | C919: 0
A920: [135] | B920: 2 | C920: 1
A921: [135] | B921: 2 | C921: 2
A922: [136] | B922: 0 | C922: 0
A923: [136] | B923: 0 | C923: 1
A924: [136] | B924: 0 | C924: 2
A925: [136] | B925: 1 | C925: 0
A926: [136] | B926: 1 | C926: 1
A927: [136] | B927: 1 | C927: 2
A928: [136] | B928: 2 | C928: 0
A929: [136] | B929: 2 | C929: 1
A930: [136] | B930: 2 | C930: 2
A931: [137] | B931: 0 | C931: 0
A932: [137] | B932: 0 | C932: 1
A933: [137] | B933: 0 | C933: 2
A934: [137] | B934: 1 | C934: 0
A935: [137] | B935: 1 | C935: 1
A936: [137] | B936: 1 | C936: 2
A937: [137] | B937: 2 | C937: 0
A938: [137] | B938: 2 | C938: 1
A939: [137] | B939: 2 | C939: 2
A940: [138] | B940: 0 | C940: 0
A941: [138] | B941: 1 | C941: 0
A942: [139] | B942: 0 | C942: 0
A943: [139] | B943: 1 | C943: 0
A944: [140] | B944: 1 | C944: 1
A945: [141] | B945: 0 | C945: 0
A946: [141] | B946: 0 | C946: 1
A947: [141] | B947: 0 | C947: 2
A948: [141] | B948: 1 | C948: 0
A949: [141] | B949: 1 | C949: 1
A950: [141] | B950: 1 | C950: 2
A951: [141] | B951: 2 | C951: 0
A952: [141] | B952: 2 | C952: 1
A953: [141] | B953: 2 | C953: 2
A954: [142] | B954: 0 | C954: 0
A955: [142] | B955: 0 | C955: 1
A956: [142] | B956: 1 | C956: 0
A957: [142] | B957: 1 | C957: 1
A958: [142] | B958: 1 | C958: 2
A959: [142] | B959: 2 | C959: 0
A960: [142] | B960: 2 | C960: 1
A961: [142] | B961: 2 | C961: 2
A962: [142] | B962: 3 | C962: 0
A963: [142] | B963: 3 | C963: 1
A964: [143] | B964: 0 | C964: 0
A965: [143] | B965: 0 | C965: 1
A966: [143] | B966: 1 | C966: 0
A967: [143] | B967: 1 | C967: 1
A968: [143] | B968: 1 | C968: 2
A969: [143] | B969: 2 | C969: 0
A970: [143] | B970: 2 | C970: 1
A971: [143] | B971: 2 | C971: 2
A972: [143] | B972: 3 | C972: 0
A973: [143] | B973: 3 | C973: 1
A974: [144] | B974: 0 | C974: 0
A975: [144] | B975: 0 | C975: 1
A976: [144] | B976: 1 | C976: 0
A977: [144] | B977: 1 | C977: 1
A978: [144] | B978: 1 | C978: 2
A979: [144] | B979: 2 | C979: 0
A980: [144] | B980: 2 | C980: 1
A981: [144] | B981: 2 | C981: 2
A982: [144] | B982: 3 | C982: 0
A983: [144] | B983: 3 | C983: 1
A984: [145] | B984: 0 | C984: 0
A985: [145] | B985: 1 | C985: 0
A986: [145] | B986: 3 | C986: 0
A987: [145] | B987: 4 | C987: 0
A988: [146] | B988: 0 | C988: 0
A989: [146] | B989: 1 | C989: 0
A990: [146] | B990: 3 | C990: 0
A991: [146] | B991: 4 | C991: 0
A992: [147] | B992: 0 | C992: 0
A993: [147] | B993: 0 | C993: 1
A994: [147] | B994: 0 | C994: 2
A995: [147] | B995: 1 | C995: 0
A996: [147] | B996: 1 | C996: 1
A997: [147] | B997: 1 | C997: 2
A998: [147] | B998: 2 | C998: 0
A999: [147] | B999: 2 | C999: 1
A1000: [147] | B1000: 2 | C1000: 2
A1001: [147] | B1001: 3 | C1001: 0
A1002: [147] | B1002: 3 | C1002: 1
A1003: [147] | B1003: 3 | C1003: 2
A1004: [148] | B1004: 0 | C1004: 0
A1005: [148] | B1005: 0 | C1005: 1
A1006: [148] | B1006: 0 | C1006: 2
A1007: [148] | B1007: 1 | C1007: 0
A1008: [148] | B1008: 1 | C1008: 1
A1009: [148] | B1009: 1 | C1009: 2
A1010: [148] | B1010: 2 | C1010: 0
A1011: [148] | B1011: 2 | C1011: 1
A1012: [148] | B1012: 2 | C1012: 2
A1013: [148] | B1013: 3 | C1013: 0
A1014: [148] | B1014: 3 | C1014: 1
A1015: [148] | B1015: 3 | C1015: 2
A1016: [149] | B1016: 0 | C1016: 0
A1017: [149] | B1017: 0 | C1017: 1
A1018: [150] | B1018: 0 | C1018: 0
A1019: [150] | B1019: 0 | C1019: 1
A1020: [150] | B1020: 1 | C1020: 0
A1021: [150] | B1021: 1 | C1021: 1
A1022: [151] | B1022: 0 | C1022: 0
A1023: [151] | B1023: 0 | C1023: 1
A1024: [151] | B1024: 1 | C1024: 0
A1025: [151] | B1025: 1 | C1025: 1
A1026: [152] | B1026: 0 | C1026: 0
A1027: [152] | B1027: 0 | C1027: 1
A1028: [152] | B1028: 1 | C1028: 0
A1029: [152] | B1029: 1 | C1029: 1
A1030: [153] | B1030: 0 | C1030: 0
A1031: [153] | B1031: 0 | C1031: 1
A1032: [153] | B1032: 1 | C1032: 0
A1033: [153] | B1033: 1 | C1033: 1
A1034: [154] | B1034: 0 | C1034: 0
A1035: [154] | B1035: 0 | C1035: 1
A1036: [154] | B1036: 1 | C1036: 0
A1037: [154] | B1037: 1 | C1037: 1
A1038: [155] | B1038: 0 | C1038: 0
A1039: [155] | B1039: 0 | C1039: 1
A1040: [155] | B1040: 1 | C1040: 0
A1041: [155] | B1041: 1 | C1041: 1
A1042: [156] | B1042: 0 | C1042: 0
A1043: [156] | B1043: 0 | C1043: 1
A1044: [156] | B1044: 1 | C1044: 0
A1045: [156] | B1045: 1 | C1045: 1
A1046: [157] | B1046: 0 | C1046: 0
A1047: [157] | B1047: 0 | C1047: 1
A1048: [157] | B1048: 1 | C1048: 0
A1049: [157] | B1049: 1 | C1049: 1
A1050: [157] | B1050: 2 | C1050: 0
A1051: [157] | B1051: 2 | C1051: 1
A1052: [157] | B1052: 2 | C1052: 2
A1053: [157] | B1053: 3 | C1053: 0
A1054: [157] | B1054: 3 | C1054: 1
A1055: [157] | B1055: 3 | C1055: 2
A1056: [158] | B1056: 0 | C1056: 0
A1057: [158] | B1057: 0 | C1057: 1
A1058: [158] | B1058: 0 | C1058: 2
A1059: [158] | B1059: 1 | C1059: 0
A1060: [158] | B1060: 1 | C1060: 1
A1061: [158] | B1061: 1 | C1061: 2
A1062: [158] | B1062: 2 | C1062: 0
A1063: [158] | B1063: 2 | C1063: 1
A1064: [158] | B1064: 2 | C1064: 2
A1065: [158] | B1065: 3 | C1065: 0
A1066: [158] | B1066: 3 | C1066: 1
A1067: [159] | B1067: 0 | C1067: 0
A1068: [159] | B1068: 0 | C1068: 1
A1069: [159] | B1069: 0 | C1069: 2
A1070: [159] | B1070: 1 | C1070: 0
A1071: [159] | B1071: 1 | C1071: 1
A1072: [159] | B1072: 1 | C1072: 2
A1073: [159] | B1073: 1 | C1073: 3
A1074: [159] | B1074: 2 | C1074: 0
A1075: [159] | B1075: 2 | C1075: 1
A1076: [159] | B1076: 2 | C1076: 2
A1077: [159] | B1077: 2 | C1077: 3
A1078: [159] | B1078: 3 | C1078: 0
A1079: [159] | B1079: 3 | C1079: 1
A1080: [159] | B1080: 3 | C1080: 2
A1081: [159] | B1081: 3 | C1081: 3
A1082: [160] | B1082: 0 | C1082: 0
A1083: [160] | B1083: 0 | C1083: 1
A1084: [160] | B1084: 0 | C1084: 2
A1085: [160] | B1085: 1 | C1085: 0
A1086: [160] | B1086: 1 | C1086: 1
A1087: [160] | B1087: 1 | C1087: 2
A1088: [160] | B1088: 2 | C1088: 0
A1089: [160] | B1089: 2 | C1089: 1
A1090: [160] | B1090: 2 | C1090: 2
A1091: [160] | B1091: 2 | C1091: 3
A1092: [160] | B1092: 3 | C1092: 1
A1093: [160] | B1093: 3 | C1093: 2
A1094: [160] | B1094: 3 | C1094: 3
A1095: [161] | B1095: 0 | C1095: 0
A1096: [161] | B1096: 0 | C1096: 1
A1097: [161] | B1097: 0 | C1097: 2
A1098: [161] | B1098: 1 | C1098: 0
A1099: [161] | B1099: 1 | C1099: 1
A1100: [161] | B1100: 1 | C1100: 2
A1101: [161] | B1101: 1 | C1101: 3
A1102: [161] | B1102: 2 | C1102: 0
A1103: [161] | B1103: 2 | C1103: 1
A1104: [161] | B1104: 2 | C1104: 2
A1105: [161] | B1105: 2 | C1105: 3
A1106: [161] | B1106: 3 | C1106: 1
A1107: [161] | B1107: 3 | C1107: 2
A1108: [161] | B1108: 3 | C1108: 3
A1109: [162] | B1109: 0 | C1109: 0
A1110: [162] | B1110: 0 | C1110: 1
A1111: [162] | B1111: 0 | C1111: 2
A1112: [162] | B1112: 1 | C1112: 0
A1113: [162] | B1113: 1 | C1113: 1
A1114: [162] | B1114: 1 | C1114: 2
A1115: [162] | B1115: 1 | C1115: 3
A1116: [162] | B1116: 2 | C1116: 0
A1117: [162] | B1117: 2 | C1117: 1
A1118: [162] | B1118: 2 | C1118: 2
A1119: [162] | B1119: 2 | C1119: 3
A1120: [162] | B1120: 3 | C1120: 1
A1121: [162] | B1121: 3 | C1121: 2
A1122: [162] | B1122: 3 | C1122: 3
A1123: [163] | B1123: 0 | C1123: 0
A1124: [163] | B1124: 0 | C1124: 1
A1125: [163] | B1125: 0 | C1125: 2
A1126: [163] | B1126: 1 | C1126: 0
A1127: [163] | B1127: 1 | C1127: 1
A1128: [163] | B1128: 1 | C1128: 2
A1129: [163] | B1129: 2 | C1129: 0
A1130: [163] | B1130: 2 | C1130: 1
A1131: [163] | B1131: 2 | C1131: 2
A1132: [164] | B1132: 0 | C1132: 0
A1133: [164] | B1133: 0 | C1133: 1
A1134: [164] | B1134: 0 | C1134: 2
A1135: [164] | B1135: 1 | C1135: 0
A1136: [164] | B1136: 1 | C1136: 1
A1137: [164] | B1137: 1 | C1137: 2
A1138: [164] | B1138: 2 | C1138: 0
A1139: [164] | B1139: 2 | C1139: 1
A1140: [164] | B1140: 2 | C1140: 2
A1141: [165] | B1141: 0 | C1141: 0
A1142: [165] | B1142: 0 | C1142: 1
A1143: [165] | B1143: 0 | C1143: 2
A1144: [165] | B1144: 1 | C1144: 0
A1145: [165] | B1145: 1 | C1145: 1
A1146: [165] | B1146: 1 | C1146: 2
A1147: [165] | B1147: 2 | C1147: 0
A1148: [165] | B1148: 2 | C1148: 1
A1149: [165] | B1149: 2 | C1149: 2
A1150: [166] | B1150: 0 | C1150: 0
A1151: [166] | B1151: 0 | C1151: 1
A1152: [166] | B1152: 0 | C1152: 2
A1153: [166] | B1153: 1 | C1153: 0
A1154: [166] | B1154: 1 | C1154: 1
A1155: [166] | B1155: 1 | C1155: 2
A1156: [166] | B1156: 2 | C1156: 0
A1157: [166] | B1157: 2 | C1157: 1
A1158: [166] | B1158: 2 | C1158: 2
A1159: [167] | B1159: 0 | C1159: 0
A1160: [167] | B1160: 0 | C1160: 1
A1161: [167] | B1161: 0 | C1161: 2
A1162: [167] | B1162: 1 | C1162: 0
A1163: [167] | B1163: 1 | C1163: 1
A1164: [167] | B1164: 1 | C1164: 2
A1165: [167] | B1165: 2 | C1165: 0
A1166: [167] | B1166: 2 | C1166: 1
A1167: [167] | B1167: 2 | C1167: 2
A1168: [168] | B1168: 0 | C1168: 0
A1169: [168] | B1169: 0 | C1169: 1
A1170: [168] | B1170: 0 | C1170: 2
A1171: [168] | B1171: 1 | C1171: 0
A1172: [168] | B1172: 1 | C1172: 1
A1173: [168] | B1173: 1 | C1173: 2
A1174: [168] | B1174: 2 | C1174: 0
A1175: [168] | B1175: 2 | C1175: 1
A1176: [168] | B1176: 2 | C1176: 2
A1177: [169] | B1177: 0 | C1177: 0
A1178: [169] | B1178: 0 | C1178: 1
A1179: [169] | B1179: 0 | C1179: 2
A1180: [169] | B1180: 1 | C1180: 0
A1181: [169] | B1181: 1 | C1181: 1
A1182: [169] | B1182: 1 | C1182: 2
A1183: [169] | B1183: 2 | C1183: 0
A1184: [169] | B1184: 2 | C1184: 1
A1185: [169] | B1185: 2 | C1185: 2
A1186: [170] | B1186: 0 | C1186: 0
A1187: [170] | B1187: 0 | C1187: 1
A1188: [170] | B1188: 0 | C1188: 2
A1189: [170] | B1189: 1 | C1189: 0
A1190: [170] | B1190: 1 | C1190: 1
A1191: [170] | B1191: 1 | C1191: 2
A1192: [170] | B1192: 2 | C1192: 0
A1193: [170] | B1193: 2 | C1193: 1
A1194: [170] | B1194: 2 | C1194: 2
A1195: [171] | B1195: 0 | C1195: 0
A1196: [171] | B1196: 0 | C1196: 1
A1197: [171] | B1197: 0 | C1197: 2
A1198: [171] | B1198: 1 | C1198: 0
A1199: [171] | B1199: 1 | C1199: 1
A1200: [171] | B1200: 1 | C1200: 2
A1201: [171] | B1201: 2 | C1201: 0
A1202: [171] | B1202: 2 | C1202: 1
A1203: [171] | B1203: 2 | C1203: 2
A1204: [172] | B1204: 0 | C1204: 0
A1205: [172] | B1205: 0 | C1205: 1
A1206: [172] | B1206: 1 | C1206: 0
A1207: [172] | B1207: 1 | C1207: 1
A1208: [173] | B1208: 0 | C1208: 0
A1209: [173] | B1209: 0 | C1209: 1
A1210: [173] | B1210: 1 | C1210: 0
A1211: [173] | B1211: 1 | C1211: 1
A1212: [174] | B1212: 0 | C1212: 0
A1213: [174] | B1213: 0 | C1213: 1
A1214: [174] | B1214: 1 | C1214: 0
A1215: [174] | B1215: 1 | C1215: 1
A1216: [175] | B1216: 0 | C1216: 0
A1217: [175] | B1217: 0 | C1217: 1
A1218: [175] | B1218: 1 | C1218: 0
A1219: [175] | B1219: 1 | C1219: 1
A1220: [175] | B1220: 2 | C1220: 0
A1221: [175] | B1221: 2 | C1221: 1
A1222: [176] | B1222: 0 | C1222: 0
A1223: [176] | B1223: 0 | C1223: 1
A1224: [176] | B1224: 1 | C1224: 0
A1225: [176] | B1225: 1 | C1225: 1
A1226: [176] | B1226: 2 | C1226: 0
A1227: [176] | B1227: 2 | C1227: 1
A1228: [177] | B1228: 0 | C1228: 0
A1229: [177] | B1229: 0 | C1229: 1
A1230: [177] | B1230: 0 | C1230: 2
A1231: [177] | B1231: 1 | C1231: 0
A1232: [177] | B1232: 1 | C1232: 1
A1233: [177] | B1233: 1 | C1233: 2
A1234: [178] | B1234: 0 | C1234: 0
A1235: [178] | B1235: 0 | C1235: 1
A1236: [178] | B1236: 1 | C1236: 0
A1237: [178] | B1237: 1 | C1237: 1
A1238: [178] | B1238: 1 | C1238: 2
A1239: [178] | B1239: 2 | C1239: 0
A1240: [178] | B1240: 2 | C1240: 1
A1241: [179] | B1241: 0 | C1241: 0
A1242: [179] | B1242: 0 | C1242: 1
A1243: [179] | B1243: 1 | C1243: 0
A1244: [179] | B1244: 1 | C1244: 1
A1245: [179] | B1245: 2 | C1245: 0
A1246: [179] | B1246: 2 | C1246: 1
A1247: [180] | B1247: 0 | C1247: 0
A1248: [180] | B1248: 0 | C1248: 1
A1249: [180] | B1249: 1 | C1249: 0
A1250: [180] | B1250: 1 | C1250: 1
A1251: [180] | B1251: 2 | C1251: 0
A1252: [180] | B1252: 2 | C1252: 1
A1253: [181] | B1253: 0 | C1253: 0
A1254: [181] | B1254: 0 | C1254: 1
A1255: [181] | B1255: 1 | C1255: 0
A1256: [181] | B1256: 1 | C1256: 1
A1257: [181] | B1257: 2 | C1257: 0
A1258: [181] | B1258: 2 | C1258: 1

Sheet: tiles
A1: PARENTID | B1: FIRST | C1: SECOND
A2: ParentID | B2: first | C2: second
A3: [3] | B3: 0 | C3: 0
A4: [3] | B4: 0 | C4: 1
A5: [3] | B5: 1 | C5: 0
A6: [3] | B6: 1 | C6: 1
A7: [3] | B7: 2 | C7: 0
A8: [3] | B8: 2 | C8: 1
A9: [4] | B9: 0 | C9: 0
A10: [4] | B10: 0 | C10: 1
A11: [4] | B11: 1 | C11: 0
A12: [4] | B12: 1 | C12: 1
A13: [4] | B13: 2 | C13: 0
A14: [4] | B14: 2 | C14: 1
A15: [5] | B15: 0 | C15: 0
A16: [5] | B16: 0 | C16: 1
A17: [5] | B17: 1 | C17: 0
A18: [5] | B18: 1 | C18: 1
A19: [5] | B19: 2 | C19: 0
A20: [5] | B20: 2 | C20: 1
A21: [6] | B21: 0 | C21: 0
A22: [6] | B22: 0 | C22: 1
A23: [6] | B23: 1 | C23: 0
A24: [6] | B24: 1 | C24: 1
A25: [6] | B25: 2 | C25: 0
A26: [6] | B26: 2 | C26: 1
A27: [7] | B27: 0 | C27: 0
A28: [7] | B28: 0 | C28: 1
A29: [7] | B29: 0 | C29: 2
A30: [7] | B30: 1 | C30: 0
A31: [7] | B31: 1 | C31: 1
A32: [7] | B32: 1 | C32: 2
A33: [7] | B33: 2 | C33: 0
A34: [7] | B34: 2 | C34: 1
A35: [7] | B35: 2 | C35: 2
A36: [8] | B36: 0 | C36: 0
A37: [8] | B37: 0 | C37: 1
A38: [8] | B38: 0 | C38: 2
A39: [8] | B39: 1 | C39: 0
A40: [8] | B40: 1 | C40: 1
A41: [8] | B41: 1 | C41: 2
A42: [8] | B42: 2 | C42: 0
A43: [8] | B43: 2 | C43: 1
A44: [8] | B44: 2 | C44: 2
A45: [9] | B45: 0 | C45: 0
A46: [9] | B46: 0 | C46: 1
A47: [9] | B47: 0 | C47: 2
A48: [9] | B48: 1 | C48: 0
A49: [9] | B49: 1 | C49: 1
A50: [9] | B50: 1 | C50: 2
A51: [9] | B51: 2 | C51: 0
A52: [9] | B52: 2 | C52: 1
A53: [9] | B53: 2 | C53: 2
A54: [10] | B54: 0 | C54: 0
A55: [10] | B55: 0 | C55: 1
A56: [10] | B56: 1 | C56: 0
A57: [10] | B57: 1 | C57: 1
A58: [11] | B58: 0 | C58: 0
A59: [11] | B59: 0 | C59: 1
A60: [11] | B60: 0 | C60: 2
A61: [11] | B61: 1 | C61: 0
A62: [11] | B62: 1 | C62: 1
A63: [11] | B63: 1 | C63: 2
A64: [11] | B64: 2 | C64: 0
A65: [11] | B65: 2 | C65: 1
A66: [11] | B66: 2 | C66: 2
A67: [12] | B67: 0 | C67: 0
A68: [12] | B68: 0 | C68: 1
A69: [12] | B69: 0 | C69: 2
A70: [12] | B70: 1 | C70: 0
A71: [12] | B71: 1 | C71: 1
A72: [12] | B72: 1 | C72: 2
A73: [12] | B73: 2 | C73: 0
A74: [12] | B74: 2 | C74: 1
A75: [12] | B75: 2 | C75: 2
A76: [13] | B76: 0 | C76: 0
A77: [13] | B77: 0 | C77: 1
A78: [13] | B78: 0 | C78: 2
A79: [13] | B79: 1 | C79: 0
A80: [13] | B80: 1 | C80: 1
A81: [13] | B81: 1 | C81: 2
A82: [13] | B82: 2 | C82: 0
A83: [13] | B83: 2 | C83: 1
A84: [13] | B84: 2 | C84: 2
A85: [13] | B85: 3 | C85: 0
A86: [13] | B86: 3 | C86: 1
A87: [13] | B87: 3 | C87: 2
A88: [14] | B88: 0 | C88: 0
A89: [14] | B89: 0 | C89: 1
A90: [14] | B90: 1 | C90: 0
A91: [14] | B91: 1 | C91: 1
A92: [15] | B92: 0 | C92: 0
A93: [15] | B93: 0 | C93: 1
A94: [15] | B94: 1 | C94: 0
A95: [15] | B95: 1 | C95: 1
A96: [16] | B96: 0 | C96: 0
A97: [16] | B97: 0 | C97: 1
A98: [16] | B98: 1 | C98: 0
A99: [16] | B99: 1 | C99: 1
A100: [16] | B100: 2 | C100: 0
A101: [16] | B101: 2 | C101: 1
A102: [17] | B102: 0 | C102: 0
A103: [17] | B103: 0 | C103: 1
A104: [17] | B104: 1 | C104: 0
A105: [17] | B105: 1 | C105: 1
A106: [18] | B106: 0 | C106: 0
A107: [18] | B107: 0 | C107: 1
A108: [18] | B108: 0 | C108: 2
A109: [18] | B109: 1 | C109: 0
A110: [18] | B110: 1 | C110: 1
A111: [18] | B111: 1 | C111: 2
A112: [18] | B112: 2 | C112: 0
A113: [18] | B113: 2 | C113: 1
A114: [18] | B114: 2 | C114: 2
A115: [19] | B115: 0 | C115: 0
A116: [19] | B116: 0 | C116: 1
A117: [19] | B117: 0 | C117: 2
A118: [19] | B118: 1 | C118: 0
A119: [19] | B119: 1 | C119: 1
A120: [19] | B120: 1 | C120: 2
A121: [19] | B121: 2 | C121: 0
A122: [19] | B122: 2 | C122: 1
A123: [19] | B123: 2 | C123: 2
A124: [20] | B124: 0 | C124: 0
A125: [20] | B125: 0 | C125: 1
A126: [20] | B126: 0 | C126: 2
A127: [20] | B127: 1 | C127: 0
A128: [20] | B128: 1 | C128: 1
A129: [20] | B129: 1 | C129: 2
A130: [20] | B130: 2 | C130: 0
A131: [20] | B131: 2 | C131: 1
A132: [20] | B132: 2 | C132: 2
A133: [21] | B133: 0 | C133: 0
A134: [21] | B134: 0 | C134: 1
A135: [21] | B135: 0 | C135: 2
A136: [21] | B136: 1 | C136: 0
A137: [21] | B137: 1 | C137: 1
A138: [21] | B138: 1 | C138: 2
A139: [21] | B139: 2 | C139: 0
A140: [21] | B140: 2 | C140: 1
A141: [21] | B141: 2 | C141: 2
A142: [22] | B142: 0 | C142: 0
A143: [22] | B143: 0 | C143: 1
A144: [22] | B144: 0 | C144: 2
A145: [22] | B145: 1 | C145: 0
A146: [22] | B146: 1 | C146: 1
A147: [22] | B147: 1 | C147: 2
A148: [22] | B148: 2 | C148: 0
A149: [22] | B149: 2 | C149: 1
A150: [22] | B150: 2 | C150: 2
A151: [23] | B151: 0 | C151: 0
A152: [23] | B152: 0 | C152: 1
A153: [23] | B153: 0 | C153: 2
A154: [23] | B154: 1 | C154: 0
A155: [23] | B155: 1 | C155: 1
A156: [23] | B156: 1 | C156: 2
A157: [23] | B157: 2 | C157: 0
A158: [23] | B158: 2 | C158: 1
A159: [23] | B159: 2 | C159: 2
A160: [24] | B160: 0 | C160: 0
A161: [24] | B161: 0 | C161: 1
A162: [24] | B162: 0 | C162: 2
A163: [24] | B163: 1 | C163: 0
A164: [24] | B164: 1 | C164: 1
A165: [24] | B165: 1 | C165: 2
A166: [24] | B166: 2 | C166: 0
A167: [24] | B167: 2 | C167: 1
A168: [24] | B168: 2 | C168: 2
A169: [25] | B169: 0 | C169: 0
A170: [25] | B170: 0 | C170: 1
A171: [25] | B171: 0 | C171: 2
A172: [25] | B172: 1 | C172: 0
A173: [25] | B173: 1 | C173: 1
A174: [25] | B174: 1 | C174: 2
A175: [25] | B175: 2 | C175: 0
A176: [25] | B176: 2 | C176: 1
A177: [25] | B177: 2 | C177: 2
A178: [26] | B178: 0 | C178: 0
A179: [27] | B179: 0 | C179: 0
A180: [28] | B180: 0 | C180: 0
A181: [28] | B181: 1 | C181: 0
A182: [29] | B182: 0 | C182: 0
A183: [29] | B183: 0 | C183: 1
A184: [29] | B184: 0 | C184: 2
A185: [29] | B185: 1 | C185: 0
A186: [29] | B186: 1 | C186: 1
A187: [29] | B187: 1 | C187: 2
A188: [29] | B188: 2 | C188: 0
A189: [29] | B189: 2 | C189: 1
A190: [29] | B190: 2 | C190: 2
A191: [30] | B191: 0 | C191: 0
A192: [31] | B192: 0 | C192: 0
A193: [32] | B193: 0 | C193: 0
A194: [32] | B194: 1 | C194: 0
A195: [32] | B195: 2 | C195: 0
A196: [33] | B196: 0 | C196: 0
A197: [33] | B197: 0 | C197: 1
A198: [33] | B198: 1 | C198: 0
A199: [33] | B199: 1 | C199: 1
A200: [34] | B200: 0 | C200: 0
A201: [35] | B201: 0 | C201: 0
A202: [36] | B202: 0 | C202: 0
A203: [36] | B203: 0 | C203: 1
A204: [36] | B204: 0 | C204: 2
A205: [36] | B205: 1 | C205: 0
A206: [36] | B206: 1 | C206: 1
A207: [36] | B207: 1 | C207: 2
A208: [36] | B208: 2 | C208: 0
A209: [36] | B209: 2 | C209: 1
A210: [36] | B210: 2 | C210: 2
A211: [37] | B211: 0 | C211: 0
A212: [37] | B212: 0 | C212: 1
A213: [37] | B213: 0 | C213: 2
A214: [37] | B214: 1 | C214: 0
A215: [37] | B215: 1 | C215: 1
A216: [37] | B216: 1 | C216: 2
A217: [37] | B217: 2 | C217: 0
A218: [37] | B218: 2 | C218: 1
A219: [37] | B219: 2 | C219: 2
A220: [38] | B220: 0 | C220: 0
A221: [38] | B221: 1 | C221: 0
A222: [39] | B222: 0 | C222: 0
A223: [40] | B223: 0 | C223: 0
A224: [40] | B224: 0 | C224: 1
A225: [40] | B225: 0 | C225: 2
A226: [40] | B226: 0 | C226: 3
A227: [40] | B227: 1 | C227: 0
A228: [40] | B228: 1 | C228: 1
A229: [40] | B229: 1 | C229: 2
A230: [40] | B230: 1 | C230: 3
A231: [40] | B231: 2 | C231: 0
A232: [40] | B232: 2 | C232: 1
A233: [40] | B233: 2 | C233: 2
A234: [40] | B234: 2 | C234: 3
A235: [40] | B235: 3 | C235: 0
A236: [40] | B236: 3 | C236: 1
A237: [40] | B237: 3 | C237: 2
A238: [40] | B238: 3 | C238: 3
A239: [40] | B239: 4 | C239: 0
A240: [40] | B240: 4 | C240: 1
A241: [40] | B241: 4 | C241: 2
A242: [40] | B242: 4 | C242: 3
A243: [40] | B243: 5 | C243: 0
A244: [40] | B244: 5 | C244: 1
A245: [40] | B245: 5 | C245: 2
A246: [40] | B246: 5 | C246: 3
A247: [41] | B247: 0 | C247: 0
A248: [41] | B248: 0 | C248: 1
A249: [41] | B249: 1 | C249: 0
A250: [41] | B250: 1 | C250: 1
A251: [42] | B251: 0 | C251: 0
A252: [42] | B252: 0 | C252: 1
A253: [42] | B253: 1 | C253: 0
A254: [42] | B254: 1 | C254: 1
A255: [43] | B255: 0 | C255: 0
A256: [44] | B256: 0 | C256: 0
A257: [45] | B257: 0 | C257: 0
A258: [45] | B258: 0 | C258: 1
A259: [45] | B259: 0 | C259: 2
A260: [45] | B260: 1 | C260: 0
A261: [45] | B261: 1 | C261: 1
A262: [45] | B262: 1 | C262: 2
A263: [45] | B263: 2 | C263: 0
A264: [45] | B264: 2 | C264: 1
A265: [45] | B265: 2 | C265: 2
A266: [46] | B266: 0 | C266: 0
A267: [46] | B267: 0 | C267: 1
A268: [46] | B268: 0 | C268: 2
A269: [46] | B269: 1 | C269: 0
A270: [46] | B270: 1 | C270: 1
A271: [46] | B271: 1 | C271: 2
A272: [46] | B272: 2 | C272: 0
A273: [46] | B273: 2 | C273: 1
A274: [46] | B274: 2 | C274: 2
A275: [47] | B275: 0 | C275: 0
A276: [47] | B276: 0 | C276: 1
A277: [47] | B277: 0 | C277: 2
A278: [47] | B278: 1 | C278: 0
A279: [47] | B279: 1 | C279: 1
A280: [47] | B280: 1 | C280: 2
A281: [47] | B281: 2 | C281: 0
A282: [47] | B282: 2 | C282: 1
A283: [47] | B283: 2 | C283: 2
A284: [48] | B284: 0 | C284: 0
A285: [48] | B285: 0 | C285: 1
A286: [48] | B286: 0 | C286: 2
A287: [48] | B287: 1 | C287: 0
A288: [48] | B288: 1 | C288: 1
A289: [48] | B289: 1 | C289: 2
A290: [49] | B290: 0 | C290: 0
A291: [49] | B291: 0 | C291: 1
A292: [49] | B292: 0 | C292: 2
A293: [49] | B293: 1 | C293: 0
A294: [49] | B294: 1 | C294: 1
A295: [49] | B295: 1 | C295: 2
A296: [50] | B296: 0 | C296: 0
A297: [50] | B297: 0 | C297: 1
A298: [50] | B298: 0 | C298: 2
A299: [50] | B299: 1 | C299: 0
A300: [50] | B300: 1 | C300: 1
A301: [50] | B301: 1 | C301: 2
A302: [50] | B302: 2 | C302: 0
A303: [50] | B303: 2 | C303: 1
A304: [50] | B304: 2 | C304: 2
A305: [51] | B305: 0 | C305: 0
A306: [51] | B306: 0 | C306: 1
A307: [51] | B307: 0 | C307: 2
A308: [51] | B308: 0 | C308: 3
A309: [51] | B309: 1 | C309: 0
A310: [51] | B310: 1 | C310: 1
A311: [51] | B311: 1 | C311: 2
A312: [51] | B312: 1 | C312: 3
A313: [51] | B313: 2 | C313: 0
A314: [51] | B314: 2 | C314: 1
A315: [51] | B315: 2 | C315: 2
A316: [51] | B316: 2 | C316: 3
A317: [52] | B317: 0 | C317: 0
A318: [52] | B318: 0 | C318: 1
A319: [52] | B319: 0 | C319: 2
A320: [52] | B320: 0 | C320: 3
A321: [52] | B321: 1 | C321: 0
A322: [52] | B322: 1 | C322: 1
A323: [52] | B323: 1 | C323: 2
A324: [52] | B324: 1 | C324: 3
A325: [52] | B325: 2 | C325: 0
A326: [52] | B326: 2 | C326: 1
A327: [52] | B327: 2 | C327: 2
A328: [52] | B328: 2 | C328: 3
A329: [53] | B329: 0 | C329: 0
A330: [53] | B330: 0 | C330: 1
A331: [53] | B331: 0 | C331: 2
A332: [53] | B332: 0 | C332: 3
A333: [53] | B333: 1 | C333: 0
A334: [53] | B334: 1 | C334: 1
A335: [53] | B335: 1 | C335: 2
A336: [53] | B336: 1 | C336: 3
A337: [53] | B337: 2 | C337: 0
A338: [53] | B338: 2 | C338: 1
A339: [53] | B339: 2 | C339: 2
A340: [53] | B340: 2 | C340: 3
A341: [54] | B341: 0 | C341: 0
A342: [54] | B342: 0 | C342: 1
A343: [54] | B343: 0 | C343: 2
A344: [54] | B344: 0 | C344: 3
A345: [54] | B345: 0 | C345: 4
A346: [54] | B346: 0 | C346: 5
A347: [54] | B347: 1 | C347: 0
A348: [54] | B348: 1 | C348: 1
A349: [54] | B349: 1 | C349: 2
A350: [54] | B350: 1 | C350: 3
A351: [54] | B351: 1 | C351: 4
A352: [54] | B352: 1 | C352: 5
A353: [54] | B353: 2 | C353: 0
A354: [54] | B354: 2 | C354: 1
A355: [54] | B355: 2 | C355: 2
A356: [54] | B356: 2 | C356: 3
A357: [54] | B357: 2 | C357: 4
A358: [54] | B358: 2 | C358: 5
A359: [54] | B359: 3 | C359: 0
A360: [54] | B360: 3 | C360: 1
A361: [54] | B361: 3 | C361: 2
A362: [54] | B362: 3 | C362: 3
A363: [54] | B363: 3 | C363: 4
A364: [54] | B364: 3 | C364: 5
A365: [55] | B365: 0 | C365: 0
A366: [56] | B366: 0 | C366: 0
A367: [56] | B367: 0 | C367: 1
A368: [56] | B368: 0 | C368: 2
A369: [56] | B369: 1 | C369: 0
A370: [56] | B370: 1 | C370: 1
A371: [56] | B371: 1 | C371: 2
A372: [56] | B372: 2 | C372: 0
A373: [56] | B373: 2 | C373: 1
A374: [56] | B374: 2 | C374: 2
A375: [57] | B375: 0 | C375: 0
A376: [57] | B376: 0 | C376: 1
A377: [57] | B377: 0 | C377: 2
A378: [57] | B378: 1 | C378: 0
A379: [57] | B379: 1 | C379: 1
A380: [57] | B380: 1 | C380: 2
A381: [57] | B381: 2 | C381: 0
A382: [57] | B382: 2 | C382: 1
A383: [57] | B383: 2 | C383: 2
A384: [57] | B384: 3 | C384: 0
A385: [57] | B385: 3 | C385: 1
A386: [57] | B386: 3 | C386: 2
A387: [58] | B387: 0 | C387: 0
A388: [58] | B388: 0 | C388: 1
A389: [58] | B389: 1 | C389: 0
A390: [58] | B390: 1 | C390: 1
A391: [59] | B391: 0 | C391: 0
A392: [59] | B392: 0 | C392: 3
A393: [59] | B393: 1 | C393: 0
A394: [59] | B394: 1 | C394: 1
A395: [59] | B395: 1 | C395: 3
A396: [59] | B396: 2 | C396: 0
A397: [59] | B397: 2 | C397: 1
A398: [59] | B398: 2 | C398: 2
A399: [59] | B399: 2 | C399: 3
A400: [59] | B400: 3 | C400: 0
A401: [59] | B401: 3 | C401: 1
A402: [59] | B402: 3 | C402: 2
A403: [59] | B403: 3 | C403: 3
A404: [59] | B404: 4 | C404: 0
A405: [59] | B405: 4 | C405: 1
A406: [59] | B406: 4 | C406: 2
A407: [59] | B407: 4 | C407: 3
A408: [59] | B408: 5 | C408: 0
A409: [59] | B409: 5 | C409: 1
A410: [59] | B410: 5 | C410: 2
A411: [59] | B411: 5 | C411: 3
A412: [59] | B412: 6 | C412: 0
A413: [59] | B413: 6 | C413: 1
A414: [59] | B414: 6 | C414: 2
A415: [59] | B415: 6 | C415: 3
A416: [59] | B416: 7 | C416: 0
A417: [59] | B417: 7 | C417: 1
A418: [59] | B418: 7 | C418: 2
A419: [59] | B419: 7 | C419: 3
A420: [59] | B420: 8 | C420: 0
A421: [59] | B421: 8 | C421: 1
A422: [59] | B422: 8 | C422: 2
A423: [59] | B423: 8 | C423: 3
A424: [59] | B424: 9 | C424: 0
A425: [59] | B425: 9 | C425: 1
A426: [59] | B426: 9 | C426: 3
A427: [59] | B427: 10 | C427: 0
A428: [59] | B428: 10 | C428: 2
A429: [60] | B429: 0 | C429: 0
A430: [60] | B430: 0 | C430: 1
A431: [60] | B431: 1 | C431: 0
A432: [60] | B432: 1 | C432: 1
A433: [60] | B433: 2 | C433: 0
A434: [60] | B434: 2 | C434: 1
A435: [61] | B435: 0 | C435: 0
A436: [61] | B436: 0 | C436: 1
A437: [61] | B437: 1 | C437: 0
A438: [61] | B438: 1 | C438: 1
A439: [61] | B439: 2 | C439: 0
A440: [61] | B440: 2 | C440: 1
A441: [62] | B441: 0 | C441: 0
A442: [62] | B442: 0 | C442: 1
A443: [62] | B443: 1 | C443: 0
A444: [62] | B444: 1 | C444: 1
A445: [62] | B445: 2 | C445: 0
A446: [62] | B446: 2 | C446: 1
A447: [63] | B447: 0 | C447: 0
A448: [63] | B448: 0 | C448: 1
A449: [63] | B449: 1 | C449: 0
A450: [63] | B450: 1 | C450: 1
A451: [63] | B451: 2 | C451: 0
A452: [63] | B452: 2 | C452: 1
A453: [64] | B453: 0 | C453: 0
A454: [64] | B454: 0 | C454: 1
A455: [64] | B455: 1 | C455: 0
A456: [64] | B456: 1 | C456: 1
A457: [64] | B457: 2 | C457: 0
A458: [64] | B458: 2 | C458: 1
A459: [65] | B459: 0 | C459: 0
A460: [65] | B460: 0 | C460: 1
A461: [65] | B461: 1 | C461: 0
A462: [65] | B462: 1 | C462: 1
A463: [65] | B463: 2 | C463: 0
A464: [65] | B464: 2 | C464: 1
A465: [66] | B465: 0 | C465: 0
A466: [66] | B466: 0 | C466: 1
A467: [66] | B467: 1 | C467: 0
A468: [66] | B468: 1 | C468: 1
A469: [66] | B469: 2 | C469: 0
A470: [66] | B470: 2 | C470: 1
A471: [67] | B471: 0 | C471: 0
A472: [67] | B472: 0 | C472: 1
A473: [67] | B473: 1 | C473: 0
A474: [67] | B474: 1 | C474: 1
A475: [67] | B475: 2 | C475: 0
A476: [67] | B476: 2 | C476: 1
A477: [68] | B477: 0 | C477: 0
A478: [68] | B478: 0 | C478: 1
A479: [68] | B479: 0 | C479: 2
A480: [68] | B480: 1 | C480: 0
A481: [68] | B481: 1 | C481: 1
A482: [68] | B482: 1 | C482: 2
A483: [68] | B483: 2 | C483: 0
A484: [68] | B484: 2 | C484: 1
A485: [68] | B485: 2 | C485: 2
A486: [68] | B486: 3 | C486: 0
A487: [68] | B487: 3 | C487: 1
A488: [68] | B488: 3 | C488: 2
A489: [69] | B489: 0 | C489: 0
A490: [69] | B490: 0 | C490: 1
A491: [69] | B491: 0 | C491: 2
A492: [69] | B492: 1 | C492: 0
A493: [69] | B493: 1 | C493: 1
A494: [69] | B494: 1 | C494: 2
A495: [69] | B495: 2 | C495: 0
A496: [69] | B496: 2 | C496: 1
A497: [69] | B497: 2 | C497: 2
A498: [70] | B498: 0 | C498: 0
A499: [70] | B499: 0 | C499: 1
A500: [70] | B500: 0 | C500: 2
A501: [70] | B501: 1 | C501: 0
A502: [70] | B502: 1 | C502: 1
A503: [70] | B503: 1 | C503: 2
A504: [70] | B504: 2 | C504: 0
A505: [70] | B505: 2 | C505: 1
A506: [70] | B506: 2 | C506: 2
A507: [71] | B507: 0 | C507: 0
A508: [71] | B508: 0 | C508: 1
A509: [71] | B509: 0 | C509: 2
A510: [71] | B510: 1 | C510: 0
A511: [71] | B511: 1 | C511: 1
A512: [71] | B512: 1 | C512: 2
A513: [71] | B513: 2 | C513: 0
A514: [71] | B514: 2 | C514: 1
A515: [71] | B515: 2 | C515: 2
A516: [72] | B516: 0 | C516: 0
A517: [73] | B517: 0 | C517: 0
A518: [74] | B518: 0 | C518: 0
A519: [75] | B519: 0 | C519: 0
A520: [76] | B520: 0 | C520: 0
A521: [77] | B521: 0 | C521: 0
A522: [78] | B522: 0 | C522: 0
A523: [78] | B523: 0 | C523: 1
A524: [78] | B524: 1 | C524: 0
A525: [78] | B525: 1 | C525: 1
A526: [79] | B526: 0 | C526: 0
A527: [79] | B527: 0 | C527: 1
A528: [79] | B528: 1 | C528: 0
A529: [79] | B529: 1 | C529: 1
A530: [80] | B530: 0 | C530: 0
A531: [80] | B531: 0 | C531: 1
A532: [80] | B532: 1 | C532: 0
A533: [80] | B533: 1 | C533: 1
A534: [80] | B534: 2 | C534: 0
A535: [80] | B535: 2 | C535: 1
A536: [81] | B536: 0 | C536: 0
A537: [81] | B537: 0 | C537: 1
A538: [81] | B538: 1 | C538: 0
A539: [81] | B539: 1 | C539: 1
A540: [81] | B540: 2 | C540: 0
A541: [81] | B541: 2 | C541: 1
A542: [82] | B542: 0 | C542: 0
A543: [82] | B543: 0 | C543: 1
A544: [82] | B544: 1 | C544: 0
A545: [82] | B545: 1 | C545: 1
A546: [82] | B546: 2 | C546: 0
A547: [82] | B547: 2 | C547: 1
A548: [83] | B548: 0 | C548: 0
A549: [83] | B549: 0 | C549: 1
A550: [83] | B550: 0 | C550: 2
A551: [83] | B551: 1 | C551: 0
A552: [83] | B552: 1 | C552: 1
A553: [83] | B553: 1 | C553: 2
A554: [83] | B554: 2 | C554: 0
A555: [83] | B555: 2 | C555: 1
A556: [83] | B556: 2 | C556: 2
A557: [84] | B557: 0 | C557: 0
A558: [84] | B558: 0 | C558: 1
A559: [84] | B559: 0 | C559: 2
A560: [84] | B560: 1 | C560: 0
A561: [84] | B561: 1 | C561: 1
A562: [84] | B562: 1 | C562: 2
A563: [84] | B563: 2 | C563: 0
A564: [84] | B564: 2 | C564: 1
A565: [84] | B565: 2 | C565: 2
A566: [85] | B566: 0 | C566: 0
A567: [85] | B567: 0 | C567: 1
A568: [85] | B568: 0 | C568: 2
A569: [85] | B569: 1 | C569: 0
A570: [85] | B570: 1 | C570: 1
A571: [85] | B571: 1 | C571: 2
A572: [85] | B572: 2 | C572: 0
A573: [85] | B573: 2 | C573: 1
A574: [85] | B574: 2 | C574: 2
A575: [86] | B575: 0 | C575: 0
A576: [86] | B576: 0 | C576: 1
A577: [86] | B577: 1 | C577: 0
A578: [86] | B578: 1 | C578: 1
A579: [86] | B579: 2 | C579: 0
A580: [86] | B580: 2 | C580: 1
A581: [87] | B581: 0 | C581: 0
A582: [87] | B582: 0 | C582: 1
A583: [87] | B583: 0 | C583: 2
A584: [87] | B584: 1 | C584: 0
A585: [87] | B585: 1 | C585: 1
A586: [87] | B586: 1 | C586: 2
A587: [87] | B587: 2 | C587: 0
A588: [87] | B588: 2 | C588: 1
A589: [87] | B589: 2 | C589: 2
A590: [88] | B590: 0 | C590: 0
A591: [88] | B591: 0 | C591: 1
A592: [88] | B592: 1 | C592: 0
A593: [88] | B593: 1 | C593: 1
A594: [88] | B594: 2 | C594: 0
A595: [88] | B595: 2 | C595: 1
A596: [89] | B596: 0 | C596: 0
A597: [89] | B597: 0 | C597: 1
A598: [89] | B598: 0 | C598: 2
A599: [89] | B599: 0 | C599: 3
A600: [89] | B600: 1 | C600: 0
A601: [89] | B601: 1 | C601: 1
A602: [89] | B602: 1 | C602: 2
A603: [89] | B603: 1 | C603: 3
A604: [89] | B604: 2 | C604: 0
A605: [89] | B605: 2 | C605: 1
A606: [89] | B606: 2 | C606: 2
A607: [89] | B607: 2 | C607: 3
A608: [89] | B608: 3 | C608: 0
A609: [89] | B609: 3 | C609: 1
A610: [89] | B610: 3 | C610: 2
A611: [89] | B611: 3 | C611: 3
A612: [90] | B612: 0 | C612: 0
A613: [90] | B613: 0 | C613: 1
A614: [90] | B614: 0 | C614: 2
A615: [90] | B615: 0 | C615: 3
A616: [90] | B616: 1 | C616: 0
A617: [90] | B617: 1 | C617: 1
A618: [90] | B618: 1 | C618: 2
A619: [90] | B619: 1 | C619: 3
A620: [90] | B620: 2 | C620: 0
A621: [90] | B621: 2 | C621: 1
A622: [90] | B622: 2 | C622: 2
A623: [90] | B623: 2 | C623: 3
A624: [90] | B624: 3 | C624: 0
A625: [90] | B625: 3 | C625: 1
A626: [90] | B626: 3 | C626: 2
A627: [90] | B627: 3 | C627: 3
A628: [91] | B628: 0 | C628: 0
A629: [91] | B629: 0 | C629: 1
A630: [91] | B630: 0 | C630: 2
A631: [91] | B631: 0 | C631: 3
A632: [91] | B632: 1 | C632: 0
A633: [91] | B633: 1 | C633: 1
A634: [91] | B634: 1 | C634: 2
A635: [91] | B635: 1 | C635: 3
A636: [91] | B636: 2 | C636: 0
A637: [91] | B637: 2 | C637: 1
A638: [91] | B638: 2 | C638: 2
A639: [91] | B639: 2 | C639: 3
A640: [91] | B640: 3 | C640: 0
A641: [91] | B641: 3 | C641: 1
A642: [91] | B642: 3 | C642: 2
A643: [91] | B643: 3 | C643: 3
A644: [92] | B644: 0 | C644: 0
A645: [92] | B645: 0 | C645: 1
A646: [92] | B646: 0 | C646: 2
A647: [92] | B647: 0 | C647: 3
A648: [92] | B648: 1 | C648: 0
A649: [92] | B649: 1 | C649: 1
A650: [92] | B650: 1 | C650: 2
A651: [92] | B651: 1 | C651: 3
A652: [92] | B652: 2 | C652: 0
A653: [92] | B653: 2 | C653: 1
A654: [92] | B654: 2 | C654: 2
A655: [92] | B655: 2 | C655: 3
A656: [92] | B656: 3 | C656: 0
A657: [92] | B657: 3 | C657: 1
A658: [92] | B658: 3 | C658: 2
A659: [92] | B659: 3 | C659: 3
A660: [93] | B660: 0 | C660: 0
A661: [93] | B661: 0 | C661: 1
A662: [93] | B662: 0 | C662: 2
A663: [93] | B663: 0 | C663: 3
A664: [93] | B664: 1 | C664: 0
A665: [93] | B665: 1 | C665: 1
A666: [93] | B666: 1 | C666: 2
A667: [93] | B667: 1 | C667: 3
A668: [93] | B668: 2 | C668: 0
A669: [93] | B669: 2 | C669: 1
A670: [93] | B670: 2 | C670: 2
A671: [93] | B671: 2 | C671: 3
A672: [93] | B672: 3 | C672: 0
A673: [93] | B673: 3 | C673: 1
A674: [93] | B674: 3 | C674: 2
A675: [93] | B675: 3 | C675: 3
A676: [94] | B676: 0 | C676: 0
A677: [94] | B677: 0 | C677: 1
A678: [94] | B678: 0 | C678: 2
A679: [94] | B679: 0 | C679: 3
A680: [94] | B680: 1 | C680: 0
A681: [94] | B681: 1 | C681: 1
A682: [94] | B682: 1 | C682: 2
A683: [94] | B683: 1 | C683: 3
A684: [94] | B684: 2 | C684: 0
A685: [94] | B685: 2 | C685: 1
A686: [94] | B686: 2 | C686: 2
A687: [94] | B687: 2 | C687: 3
A688: [94] | B688: 3 | C688: 0
A689: [94] | B689: 3 | C689: 1
A690: [94] | B690: 3 | C690: 2
A691: [94] | B691: 3 | C691: 3
A692: [95] | B692: 0 | C692: 0
A693: [95] | B693: 0 | C693: 1
A694: [95] | B694: 0 | C694: 2
A695: [95] | B695: 0 | C695: 3
A696: [95] | B696: 1 | C696: 0
A697: [95] | B697: 1 | C697: 1
A698: [95] | B698: 1 | C698: 2
A699: [95] | B699: 1 | C699: 3
A700: [95] | B700: 2 | C700: 0
A701: [95] | B701: 2 | C701: 1
A702: [95] | B702: 2 | C702: 2
A703: [95] | B703: 2 | C703: 3
A704: [95] | B704: 3 | C704: 0
A705: [95] | B705: 3 | C705: 1
A706: [95] | B706: 3 | C706: 2
A707: [95] | B707: 3 | C707: 3
A708: [96] | B708: 0 | C708: 0
A709: [96] | B709: 0 | C709: 1
A710: [96] | B710: 0 | C710: 2
A711: [96] | B711: 0 | C711: 3
A712: [96] | B712: 1 | C712: 0
A713: [96] | B713: 1 | C713: 1
A714: [96] | B714: 1 | C714: 2
A715: [96] | B715: 1 | C715: 3
A716: [96] | B716: 2 | C716: 0
A717: [96] | B717: 2 | C717: 1
A718: [96] | B718: 2 | C718: 2
A719: [96] | B719: 2 | C719: 3
A720: [96] | B720: 3 | C720: 0
A721: [96] | B721: 3 | C721: 1
A722: [96] | B722: 3 | C722: 2
A723: [96] | B723: 3 | C723: 3
A724: [97] | B724: 0 | C724: 0
A725: [97] | B725: 0 | C725: 1
A726: [97] | B726: 0 | C726: 2
A727: [97] | B727: 0 | C727: 3
A728: [97] | B728: 1 | C728: 0
A729: [97] | B729: 1 | C729: 1
A730: [97] | B730: 1 | C730: 2
A731: [97] | B731: 1 | C731: 3
A732: [97] | B732: 2 | C732: 0
A733: [97] | B733: 2 | C733: 1
A734: [97] | B734: 2 | C734: 2
A735: [97] | B735: 2 | C735: 3
A736: [97] | B736: 3 | C736: 0
A737: [97] | B737: 3 | C737: 1
A738: [97] | B738: 3 | C738: 2
A739: [97] | B739: 3 | C739: 3
A740: [98] | B740: 0 | C740: 0
A741: [98] | B741: 0 | C741: 1
A742: [98] | B742: 0 | C742: 2
A743: [98] | B743: 1 | C743: 0
A744: [98] | B744: 1 | C744: 1
A745: [98] | B745: 1 | C745: 2
A746: [98] | B746: 2 | C746: 0
A747: [98] | B747: 2 | C747: 1
A748: [98] | B748: 2 | C748: 2
A749: [99] | B749: 0 | C749: 0
A750: [99] | B750: 0 | C750: 1
A751: [99] | B751: 0 | C751: 2
A752: [99] | B752: 1 | C752: 0
A753: [99] | B753: 1 | C753: 1
A754: [99] | B754: 1 | C754: 2
A755: [99] | B755: 2 | C755: 0
A756: [99] | B756: 2 | C756: 1
A757: [99] | B757: 2 | C757: 2
A758: [100] | B758: 0 | C758: 0
A759: [100] | B759: 0 | C759: 1
A760: [100] | B760: 0 | C760: 2
A761: [100] | B761: 1 | C761: 0
A762: [100] | B762: 1 | C762: 1
A763: [100] | B763: 1 | C763: 2
A764: [100] | B764: 2 | C764: 0
A765: [100] | B765: 2 | C765: 1
A766: [100] | B766: 2 | C766: 2
A767: [101] | B767: 0 | C767: 0
A768: [101] | B768: 0 | C768: 1
A769: [101] | B769: 0 | C769: 2
A770: [101] | B770: 1 | C770: 0
A771: [101] | B771: 1 | C771: 1
A772: [101] | B772: 1 | C772: 2
A773: [101] | B773: 2 | C773: 0
A774: [101] | B774: 2 | C774: 1
A775: [101] | B775: 2 | C775: 2
A776: [102] | B776: 0 | C776: 0
A777: [102] | B777: 0 | C777: 1
A778: [102] | B778: 0 | C778: 2
A779: [102] | B779: 1 | C779: 0
A780: [102] | B780: 1 | C780: 1
A781: [102] | B781: 1 | C781: 2
A782: [102] | B782: 2 | C782: 0
A783: [102] | B783: 2 | C783: 1
A784: [102] | B784: 2 | C784: 2
A785: [103] | B785: 0 | C785: 0
A786: [103] | B786: 0 | C786: 1
A787: [103] | B787: 0 | C787: 2
A788: [103] | B788: 1 | C788: 0
A789: [103] | B789: 1 | C789: 1
A790: [103] | B790: 1 | C790: 2
A791: [103] | B791: 2 | C791: 0
A792: [103] | B792: 2 | C792: 1
A793: [103] | B793: 2 | C793: 2
A794: [104] | B794: 0 | C794: 0
A795: [104] | B795: 0 | C795: 1
A796: [104] | B796: 0 | C796: 2
A797: [104] | B797: 1 | C797: 0
A798: [104] | B798: 1 | C798: 1
A799: [104] | B799: 1 | C799: 2
A800: [104] | B800: 2 | C800: 0
A801: [104] | B801: 2 | C801: 1
A802: [104] | B802: 2 | C802: 2
A803: [104] | B803: 3 | C803: 0
A804: [104] | B804: 3 | C804: 1
A805: [104] | B805: 3 | C805: 2
A806: [105] | B806: 0 | C806: 0
A807: [105] | B807: 0 | C807: 1
A808: [105] | B808: 0 | C808: 2
A809: [105] | B809: 1 | C809: 0
A810: [105] | B810: 1 | C810: 1
A811: [105] | B811: 1 | C811: 2
A812: [105] | B812: 2 | C812: 0
A813: [105] | B813: 2 | C813: 1
A814: [105] | B814: 2 | C814: 2
A815: [105] | B815: 3 | C815: 0
A816: [105] | B816: 3 | C816: 1
A817: [105] | B817: 3 | C817: 2
A818: [106] | B818: 0 | C818: 0
A819: [106] | B819: 0 | C819: 1
A820: [106] | B820: 0 | C820: 2
A821: [106] | B821: 1 | C821: 0
A822: [106] | B822: 1 | C822: 1
A823: [106] | B823: 1 | C823: 2
A824: [106] | B824: 2 | C824: 0
A825: [106] | B825: 2 | C825: 1
A826: [106] | B826: 2 | C826: 2
A827: [106] | B827: 3 | C827: 0
A828: [106] | B828: 3 | C828: 1
A829: [106] | B829: 3 | C829: 2
A830: [107] | B830: 0 | C830: 0
A831: [107] | B831: 0 | C831: 1
A832: [107] | B832: 0 | C832: 2
A833: [107] | B833: 1 | C833: 0
A834: [107] | B834: 1 | C834: 1
A835: [107] | B835: 1 | C835: 2
A836: [107] | B836: 2 | C836: 0
A837: [107] | B837: 2 | C837: 1
A838: [107] | B838: 2 | C838: 2
A839: [107] | B839: 3 | C839: 0
A840: [107] | B840: 3 | C840: 1
A841: [107] | B841: 3 | C841: 2
A842: [108] | B842: 0 | C842: 0
A843: [108] | B843: 0 | C843: 1
A844: [108] | B844: 0 | C844: 2
A845: [108] | B845: 1 | C845: 0
A846: [108] | B846: 1 | C846: 1
A847: [108] | B847: 1 | C847: 2
A848: [108] | B848: 2 | C848: 0
A849: [108] | B849: 2 | C849: 1
A850: [108] | B850: 2 | C850: 2
A851: [108] | B851: 3 | C851: 0
A852: [108] | B852: 3 | C852: 1
A853: [108] | B853: 3 | C853: 2
A854: [109] | B854: 0 | C854: 0
A855: [109] | B855: 0 | C855: 1
A856: [109] | B856: 0 | C856: 2
A857: [109] | B857: 1 | C857: 0
A858: [109] | B858: 1 | C858: 1
A859: [109] | B859: 1 | C859: 2
A860: [109] | B860: 2 | C860: 0
A861: [109] | B861: 2 | C861: 1
A862: [109] | B862: 2 | C862: 2
A863: [109] | B863: 3 | C863: 0
A864: [109] | B864: 3 | C864: 1
A865: [109] | B865: 3 | C865: 2
A866: [110] | B866: 0 | C866: 0
A867: [110] | B867: 0 | C867: 1
A868: [110] | B868: 0 | C868: 2
A869: [110] | B869: 1 | C869: 0
A870: [110] | B870: 1 | C870: 1
A871: [110] | B871: 1 | C871: 2
A872: [110] | B872: 2 | C872: 0
A873: [110] | B873: 2 | C873: 1
A874: [110] | B874: 2 | C874: 2
A875: [110] | B875: 3 | C875: 0
A876: [110] | B876: 3 | C876: 1
A877: [110] | B877: 3 | C877: 2
A878: [111] | B878: 0 | C878: 0
A879: [111] | B879: 0 | C879: 1
A880: [111] | B880: 0 | C880: 2
A881: [111] | B881: 1 | C881: 0
A882: [111] | B882: 1 | C882: 1
A883: [111] | B883: 1 | C883: 2
A884: [111] | B884: 2 | C884: 0
A885: [111] | B885: 2 | C885: 1
A886: [111] | B886: 2 | C886: 2
A887: [111] | B887: 3 | C887: 0
A888: [111] | B888: 3 | C888: 1
A889: [111] | B889: 3 | C889: 2
A890: [112] | B890: 0 | C890: 0
A891: [112] | B891: 0 | C891: 1
A892: [112] | B892: 0 | C892: 2
A893: [112] | B893: 1 | C893: 0
A894: [112] | B894: 1 | C894: 1
A895: [112] | B895: 1 | C895: 2
A896: [112] | B896: 2 | C896: 0
A897: [112] | B897: 2 | C897: 1
A898: [112] | B898: 2 | C898: 2
A899: [112] | B899: 3 | C899: 0
A900: [112] | B900: 3 | C900: 1
A901: [112] | B901: 3 | C901: 2
A902: [113] | B902: 0 | C902: 0
A903: [113] | B903: 0 | C903: 1
A904: [113] | B904: 0 | C904: 2
A905: [113] | B905: 1 | C905: 0
A906: [113] | B906: 1 | C906: 1
A907: [113] | B907: 1 | C907: 2
A908: [113] | B908: 2 | C908: 0
A909: [113] | B909: 2 | C909: 1
A910: [113] | B910: 2 | C910: 2
A911: [113] | B911: 3 | C911: 0
A912: [113] | B912: 3 | C912: 1
A913: [113] | B913: 3 | C913: 2
A914: [114] | B914: 0 | C914: 0
A915: [114] | B915: 0 | C915: 1
A916: [114] | B916: 0 | C916: 2
A917: [114] | B917: 1 | C917: 0
A918: [114] | B918: 1 | C918: 1
A919: [114] | B919: 1 | C919: 2
A920: [114] | B920: 2 | C920: 0
A921: [114] | B921: 2 | C921: 1
A922: [114] | B922: 2 | C922: 2
A923: [114] | B923: 3 | C923: 0
A924: [114] | B924: 3 | C924: 1
A925: [114] | B925: 3 | C925: 2
A926: [115] | B926: 0 | C926: 0
A927: [115] | B927: 0 | C927: 1
A928: [115] | B928: 0 | C928: 2
A929: [115] | B929: 1 | C929: 0
A930: [115] | B930: 1 | C930: 1
A931: [115] | B931: 1 | C931: 2
A932: [115] | B932: 2 | C932: 0
A933: [115] | B933: 2 | C933: 1
A934: [115] | B934: 2 | C934: 2
A935: [115] | B935: 3 | C935: 0
A936: [115] | B936: 3 | C936: 1
A937: [115] | B937: 3 | C937: 2
A938: [116] | B938: 0 | C938: 0
A939: [116] | B939: 0 | C939: 1
A940: [116] | B940: 1 | C940: 0
A941: [116] | B941: 1 | C941: 1
A942: [116] | B942: 2 | C942: 0
A943: [116] | B943: 2 | C943: 1
A944: [117] | B944: 0 | C944: 0
A945: [117] | B945: 0 | C945: 1
A946: [117] | B946: 1 | C946: 0
A947: [117] | B947: 1 | C947: 1
A948: [117] | B948: 2 | C948: 0
A949: [117] | B949: 2 | C949: 1
A950: [118] | B950: 0 | C950: 0
A951: [118] | B951: 0 | C951: 1
A952: [118] | B952: 1 | C952: 0
A953: [118] | B953: 1 | C953: 1
A954: [118] | B954: 2 | C954: 0
A955: [118] | B955: 2 | C955: 1
A956: [119] | B956: 0 | C956: 0
A957: [119] | B957: 0 | C957: 1
A958: [119] | B958: 0 | C958: 2
A959: [119] | B959: 0 | C959: 3
A960: [119] | B960: 1 | C960: 0
A961: [119] | B961: 1 | C961: 1
A962: [119] | B962: 1 | C962: 2
A963: [119] | B963: 1 | C963: 3
A964: [119] | B964: 2 | C964: 0
A965: [119] | B965: 2 | C965: 1
A966: [119] | B966: 2 | C966: 2
A967: [119] | B967: 2 | C967: 3
A968: [119] | B968: 3 | C968: 0
A969: [119] | B969: 3 | C969: 1
A970: [119] | B970: 3 | C970: 2
A971: [119] | B971: 3 | C971: 3
A972: [120] | B972: 0 | C972: 0
A973: [120] | B973: 0 | C973: 1
A974: [120] | B974: 1 | C974: 0
A975: [120] | B975: 1 | C975: 1
A976: [121] | B976: 0 | C976: 0
A977: [121] | B977: 0 | C977: 1
A978: [121] | B978: 1 | C978: 0
A979: [121] | B979: 1 | C979: 1
A980: [122] | B980: 0 | C980: 0
A981: [122] | B981: 0 | C981: 1
A982: [122] | B982: 1 | C982: 0
A983: [122] | B983: 1 | C983: 1
A984: [123] | B984: 0 | C984: 0
A985: [123] | B985: 0 | C985: 1
A986: [123] | B986: 0 | C986: 2
A987: [123] | B987: 1 | C987: 0
A988: [123] | B988: 1 | C988: 1
A989: [123] | B989: 1 | C989: 2
A990: [123] | B990: 2 | C990: 0
A991: [123] | B991: 2 | C991: 1
A992: [123] | B992: 2 | C992: 2
A993: [124] | B993: 0 | C993: 0
A994: [124] | B994: 0 | C994: 1
A995: [124] | B995: 0 | C995: 2
A996: [124] | B996: 1 | C996: 0
A997: [124] | B997: 1 | C997: 1
A998: [124] | B998: 1 | C998: 2
A999: [124] | B999: 2 | C999: 0
A1000: [124] | B1000: 2 | C1000: 1
A1001: [124] | B1001: 2 | C1001: 2
A1002: [125] | B1002: 0 | C1002: 0
A1003: [125] | B1003: 0 | C1003: 1
A1004: [125] | B1004: 0 | C1004: 2
A1005: [125] | B1005: 1 | C1005: 0
A1006: [125] | B1006: 1 | C1006: 1
A1007: [125] | B1007: 1 | C1007: 2
A1008: [125] | B1008: 2 | C1008: 0
A1009: [125] | B1009: 2 | C1009: 1
A1010: [125] | B1010: 2 | C1010: 2
A1011: [126] | B1011: 0 | C1011: 0
A1012: [126] | B1012: 0 | C1012: 1
A1013: [126] | B1013: 1 | C1013: 0
A1014: [126] | B1014: 1 | C1014: 1
A1015: [127] | B1015: 0 | C1015: 0
A1016: [127] | B1016: 0 | C1016: 1
A1017: [127] | B1017: 1 | C1017: 0
A1018: [127] | B1018: 1 | C1018: 1
A1019: [128] | B1019: 0 | C1019: 0
A1020: [128] | B1020: 0 | C1020: 1
A1021: [128] | B1021: 1 | C1021: 0
A1022: [128] | B1022: 1 | C1022: 1
A1023: [129] | B1023: 0 | C1023: 0
A1024: [129] | B1024: 0 | C1024: 1
A1025: [129] | B1025: 0 | C1025: 2
A1026: [129] | B1026: 1 | C1026: 0
A1027: [129] | B1027: 1 | C1027: 1
A1028: [129] | B1028: 1 | C1028: 2
A1029: [129] | B1029: 2 | C1029: 0
A1030: [129] | B1030: 2 | C1030: 1
A1031: [129] | B1031: 2 | C1031: 2
A1032: [130] | B1032: 0 | C1032: 0
A1033: [130] | B1033: 0 | C1033: 1
A1034: [130] | B1034: 0 | C1034: 2
A1035: [130] | B1035: 1 | C1035: 0
A1036: [130] | B1036: 1 | C1036: 1
A1037: [130] | B1037: 1 | C1037: 2
A1038: [130] | B1038: 2 | C1038: 0
A1039: [130] | B1039: 2 | C1039: 1
A1040: [130] | B1040: 2 | C1040: 2
A1041: [131] | B1041: 0 | C1041: 0
A1042: [131] | B1042: 0 | C1042: 1
A1043: [131] | B1043: 0 | C1043: 2
A1044: [131] | B1044: 1 | C1044: 0
A1045: [131] | B1045: 1 | C1045: 1
A1046: [131] | B1046: 1 | C1046: 2
A1047: [131] | B1047: 2 | C1047: 0
A1048: [131] | B1048: 2 | C1048: 1
A1049: [131] | B1049: 2 | C1049: 2
A1050: [132] | B1050: 0 | C1050: 0
A1051: [132] | B1051: 0 | C1051: 1
A1052: [132] | B1052: 1 | C1052: 0
A1053: [132] | B1053: 1 | C1053: 1
A1054: [133] | B1054: 0 | C1054: 0
A1055: [133] | B1055: 0 | C1055: 1
A1056: [133] | B1056: 1 | C1056: 0
A1057: [133] | B1057: 1 | C1057: 1
A1058: [134] | B1058: 0 | C1058: 0
A1059: [134] | B1059: 0 | C1059: 1
A1060: [134] | B1060: 1 | C1060: 0
A1061: [134] | B1061: 1 | C1061: 1
A1062: [135] | B1062: 0 | C1062: 0
A1063: [135] | B1063: 0 | C1063: 1
A1064: [135] | B1064: 0 | C1064: 2
A1065: [135] | B1065: 1 | C1065: 0
A1066: [135] | B1066: 1 | C1066: 1
A1067: [135] | B1067: 1 | C1067: 2
A1068: [135] | B1068: 2 | C1068: 0
A1069: [135] | B1069: 2 | C1069: 1
A1070: [135] | B1070: 2 | C1070: 2
A1071: [136] | B1071: 0 | C1071: 0
A1072: [136] | B1072: 0 | C1072: 1
A1073: [136] | B1073: 0 | C1073: 2
A1074: [136] | B1074: 1 | C1074: 0
A1075: [136] | B1075: 1 | C1075: 1
A1076: [136] | B1076: 1 | C1076: 2
A1077: [136] | B1077: 2 | C1077: 0
A1078: [136] | B1078: 2 | C1078: 1
A1079: [136] | B1079: 2 | C1079: 2
A1080: [137] | B1080: 0 | C1080: 0
A1081: [137] | B1081: 0 | C1081: 1
A1082: [137] | B1082: 0 | C1082: 2
A1083: [137] | B1083: 1 | C1083: 0
A1084: [137] | B1084: 1 | C1084: 1
A1085: [137] | B1085: 1 | C1085: 2
A1086: [137] | B1086: 2 | C1086: 0
A1087: [137] | B1087: 2 | C1087: 1
A1088: [137] | B1088: 2 | C1088: 2
A1089: [138] | B1089: 0 | C1089: 0
A1090: [138] | B1090: 1 | C1090: 0
A1091: [139] | B1091: 0 | C1091: 0
A1092: [139] | B1092: 1 | C1092: 0
A1093: [140] | B1093: 0 | C1093: 0
A1094: [140] | B1094: 0 | C1094: 1
A1095: [140] | B1095: 0 | C1095: 2
A1096: [140] | B1096: 1 | C1096: 0
A1097: [140] | B1097: 1 | C1097: 1
A1098: [140] | B1098: 1 | C1098: 2
A1099: [140] | B1099: 2 | C1099: 0
A1100: [140] | B1100: 2 | C1100: 1
A1101: [140] | B1101: 2 | C1101: 2
A1102: [141] | B1102: 0 | C1102: 0
A1103: [141] | B1103: 0 | C1103: 1
A1104: [141] | B1104: 0 | C1104: 2
A1105: [141] | B1105: 1 | C1105: 0
A1106: [141] | B1106: 1 | C1106: 1
A1107: [141] | B1107: 1 | C1107: 2
A1108: [141] | B1108: 2 | C1108: 0
A1109: [141] | B1109: 2 | C1109: 1
A1110: [141] | B1110: 2 | C1110: 2
A1111: [142] | B1111: 0 | C1111: 0
A1112: [142] | B1112: 0 | C1112: 1
A1113: [142] | B1113: 0 | C1113: 2
A1114: [142] | B1114: 1 | C1114: 0
A1115: [142] | B1115: 1 | C1115: 1
A1116: [142] | B1116: 1 | C1116: 2
A1117: [142] | B1117: 2 | C1117: 0
A1118: [142] | B1118: 2 | C1118: 1
A1119: [142] | B1119: 2 | C1119: 2
A1120: [142] | B1120: 3 | C1120: 0
A1121: [142] | B1121: 3 | C1121: 1
A1122: [142] | B1122: 3 | C1122: 2
A1123: [143] | B1123: 0 | C1123: 0
A1124: [143] | B1124: 0 | C1124: 1
A1125: [143] | B1125: 0 | C1125: 2
A1126: [143] | B1126: 1 | C1126: 0
A1127: [143] | B1127: 1 | C1127: 1
A1128: [143] | B1128: 1 | C1128: 2
A1129: [143] | B1129: 2 | C1129: 0
A1130: [143] | B1130: 2 | C1130: 1
A1131: [143] | B1131: 2 | C1131: 2
A1132: [143] | B1132: 3 | C1132: 0
A1133: [143] | B1133: 3 | C1133: 1
A1134: [143] | B1134: 3 | C1134: 2
A1135: [144] | B1135: 0 | C1135: 0
A1136: [144] | B1136: 0 | C1136: 1
A1137: [144] | B1137: 0 | C1137: 2
A1138: [144] | B1138: 1 | C1138: 0
A1139: [144] | B1139: 1 | C1139: 1
A1140: [144] | B1140: 1 | C1140: 2
A1141: [144] | B1141: 2 | C1141: 0
A1142: [144] | B1142: 2 | C1142: 1
A1143: [144] | B1143: 2 | C1143: 2
A1144: [144] | B1144: 3 | C1144: 0
A1145: [144] | B1145: 3 | C1145: 1
A1146: [144] | B1146: 3 | C1146: 2
A1147: [145] | B1147: 0 | C1147: 0
A1148: [145] | B1148: 1 | C1148: 0
A1149: [145] | B1149: 2 | C1149: 0
A1150: [145] | B1150: 3 | C1150: 0
A1151: [145] | B1151: 4 | C1151: 0
A1152: [146] | B1152: 0 | C1152: 0
A1153: [146] | B1153: 1 | C1153: 0
A1154: [146] | B1154: 2 | C1154: 0
A1155: [146] | B1155: 3 | C1155: 0
A1156: [146] | B1156: 4 | C1156: 0
A1157: [147] | B1157: 0 | C1157: 0
A1158: [147] | B1158: 0 | C1158: 1
A1159: [147] | B1159: 0 | C1159: 2
A1160: [147] | B1160: 1 | C1160: 0
A1161: [147] | B1161: 1 | C1161: 1
A1162: [147] | B1162: 1 | C1162: 2
A1163: [147] | B1163: 2 | C1163: 0
A1164: [147] | B1164: 2 | C1164: 1
A1165: [147] | B1165: 2 | C1165: 2
A1166: [147] | B1166: 3 | C1166: 0
A1167: [147] | B1167: 3 | C1167: 1
A1168: [147] | B1168: 3 | C1168: 2
A1169: [148] | B1169: 0 | C1169: 0
A1170: [148] | B1170: 0 | C1170: 1
A1171: [148] | B1171: 0 | C1171: 2
A1172: [148] | B1172: 1 | C1172: 0
A1173: [148] | B1173: 1 | C1173: 1
A1174: [148] | B1174: 1 | C1174: 2
A1175: [148] | B1175: 2 | C1175: 0
A1176: [148] | B1176: 2 | C1176: 1
A1177: [148] | B1177: 2 | C1177: 2
A1178: [148] | B1178: 3 | C1178: 0
A1179: [148] | B1179: 3 | C1179: 1
A1180: [148] | B1180: 3 | C1180: 2
A1181: [149] | B1181: 0 | C1181: 0
A1182: [149] | B1182: 0 | C1182: 1
A1183: [150] | B1183: 0 | C1183: 0
A1184: [150] | B1184: 0 | C1184: 1
A1185: [150] | B1185: 1 | C1185: 0
A1186: [150] | B1186: 1 | C1186: 1
A1187: [151] | B1187: 0 | C1187: 0
A1188: [151] | B1188: 0 | C1188: 1
A1189: [151] | B1189: 1 | C1189: 0
A1190: [151] | B1190: 1 | C1190: 1
A1191: [152] | B1191: 0 | C1191: 0
A1192: [152] | B1192: 0 | C1192: 1
A1193: [152] | B1193: 1 | C1193: 0
A1194: [152] | B1194: 1 | C1194: 1
A1195: [153] | B1195: 0 | C1195: 0
A1196: [153] | B1196: 0 | C1196: 1
A1197: [153] | B1197: 1 | C1197: 0
A1198: [153] | B1198: 1 | C1198: 1
A1199: [154] | B1199: 0 | C1199: 0
A1200: [154] | B1200: 0 | C1200: 1
A1201: [154] | B1201: 1 | C1201: 0
A1202: [154] | B1202: 1 | C1202: 1
A1203: [155] | B1203: 0 | C1203: 0
A1204: [155] | B1204: 0 | C1204: 1
A1205: [155] | B1205: 1 | C1205: 0
A1206: [155] | B1206: 1 | C1206: 1
A1207: [156] | B1207: 0 | C1207: 0
A1208: [156] | B1208: 0 | C1208: 1
A1209: [156] | B1209: 1 | C1209: 0
A1210: [156] | B1210: 1 | C1210: 1
A1211: [157] | B1211: 0 | C1211: 0
A1212: [157] | B1212: 0 | C1212: 1
A1213: [157] | B1213: 0 | C1213: 2
A1214: [157] | B1214: 1 | C1214: 0
A1215: [157] | B1215: 1 | C1215: 1
A1216: [157] | B1216: 1 | C1216: 2
A1217: [157] | B1217: 2 | C1217: 0
A1218: [157] | B1218: 2 | C1218: 1
A1219: [157] | B1219: 2 | C1219: 2
A1220: [157] | B1220: 3 | C1220: 0
A1221: [157] | B1221: 3 | C1221: 1
A1222: [157] | B1222: 3 | C1222: 2
A1223: [158] | B1223: 0 | C1223: 0
A1224: [158] | B1224: 0 | C1224: 1
A1225: [158] | B1225: 0 | C1225: 2
A1226: [158] | B1226: 1 | C1226: 0
A1227: [158] | B1227: 1 | C1227: 1
A1228: [158] | B1228: 1 | C1228: 2
A1229: [158] | B1229: 2 | C1229: 0
A1230: [158] | B1230: 2 | C1230: 1
A1231: [158] | B1231: 2 | C1231: 2
A1232: [158] | B1232: 3 | C1232: 0
A1233: [158] | B1233: 3 | C1233: 1
A1234: [158] | B1234: 3 | C1234: 2
A1235: [159] | B1235: 0 | C1235: 0
A1236: [159] | B1236: 0 | C1236: 1
A1237: [159] | B1237: 0 | C1237: 2
A1238: [159] | B1238: 0 | C1238: 3
A1239: [159] | B1239: 1 | C1239: 0
A1240: [159] | B1240: 1 | C1240: 1
A1241: [159] | B1241: 1 | C1241: 2
A1242: [159] | B1242: 1 | C1242: 3
A1243: [159] | B1243: 2 | C1243: 0
A1244: [159] | B1244: 2 | C1244: 1
A1245: [159] | B1245: 2 | C1245: 2
A1246: [159] | B1246: 2 | C1246: 3
A1247: [159] | B1247: 3 | C1247: 0
A1248: [159] | B1248: 3 | C1248: 1
A1249: [159] | B1249: 3 | C1249: 2
A1250: [159] | B1250: 3 | C1250: 3
A1251: [160] | B1251: 0 | C1251: 0
A1252: [160] | B1252: 0 | C1252: 1
A1253: [160] | B1253: 0 | C1253: 2
A1254: [160] | B1254: 0 | C1254: 3
A1255: [160] | B1255: 1 | C1255: 0
A1256: [160] | B1256: 1 | C1256: 1
A1257: [160] | B1257: 1 | C1257: 2
A1258: [160] | B1258: 1 | C1258: 3
A1259: [160] | B1259: 2 | C1259: 0
A1260: [160] | B1260: 2 | C1260: 1
A1261: [160] | B1261: 2 | C1261: 2
A1262: [160] | B1262: 2 | C1262: 3
A1263: [160] | B1263: 3 | C1263: 0
A1264: [160] | B1264: 3 | C1264: 1
A1265: [160] | B1265: 3 | C1265: 2
A1266: [160] | B1266: 3 | C1266: 3
A1267: [161] | B1267: 0 | C1267: 0
A1268: [161] | B1268: 0 | C1268: 1
A1269: [161] | B1269: 0 | C1269: 2
A1270: [161] | B1270: 0 | C1270: 3
A1271: [161] | B1271: 1 | C1271: 0
A1272: [161] | B1272: 1 | C1272: 1
A1273: [161] | B1273: 1 | C1273: 2
A1274: [161] | B1274: 1 | C1274: 3
A1275: [161] | B1275: 2 | C1275: 0
A1276: [161] | B1276: 2 | C1276: 1
A1277: [161] | B1277: 2 | C1277: 2
A1278: [161] | B1278: 2 | C1278: 3
A1279: [161] | B1279: 3 | C1279: 0
A1280: [161] | B1280: 3 | C1280: 1
A1281: [161] | B1281: 3 | C1281: 2
A1282: [161] | B1282: 3 | C1282: 3
A1283: [162] | B1283: 0 | C1283: 0
A1284: [162] | B1284: 0 | C1284: 1
A1285: [162] | B1285: 0 | C1285: 2
A1286: [162] | B1286: 0 | C1286: 3
A1287: [162] | B1287: 1 | C1287: 0
A1288: [162] | B1288: 1 | C1288: 1
A1289: [162] | B1289: 1 | C1289: 2
A1290: [162] | B1290: 1 | C1290: 3
A1291: [162] | B1291: 2 | C1291: 0
A1292: [162] | B1292: 2 | C1292: 1
A1293: [162] | B1293: 2 | C1293: 2
A1294: [162] | B1294: 2 | C1294: 3
A1295: [162] | B1295: 3 | C1295: 0
A1296: [162] | B1296: 3 | C1296: 1
A1297: [162] | B1297: 3 | C1297: 2
A1298: [162] | B1298: 3 | C1298: 3
A1299: [163] | B1299: 0 | C1299: 0
A1300: [163] | B1300: 0 | C1300: 1
A1301: [163] | B1301: 0 | C1301: 2
A1302: [163] | B1302: 1 | C1302: 0
A1303: [163] | B1303: 1 | C1303: 1
A1304: [163] | B1304: 1 | C1304: 2
A1305: [163] | B1305: 2 | C1305: 0
A1306: [163] | B1306: 2 | C1306: 1
A1307: [163] | B1307: 2 | C1307: 2
A1308: [164] | B1308: 0 | C1308: 0
A1309: [164] | B1309: 0 | C1309: 1
A1310: [164] | B1310: 0 | C1310: 2
A1311: [164] | B1311: 1 | C1311: 0
A1312: [164] | B1312: 1 | C1312: 1
A1313: [164] | B1313: 1 | C1313: 2
A1314: [164] | B1314: 2 | C1314: 0
A1315: [164] | B1315: 2 | C1315: 1
A1316: [164] | B1316: 2 | C1316: 2
A1317: [165] | B1317: 0 | C1317: 0
A1318: [165] | B1318: 0 | C1318: 1
A1319: [165] | B1319: 0 | C1319: 2
A1320: [165] | B1320: 1 | C1320: 0
A1321: [165] | B1321: 1 | C1321: 1
A1322: [165] | B1322: 1 | C1322: 2
A1323: [165] | B1323: 2 | C1323: 0
A1324: [165] | B1324: 2 | C1324: 1
A1325: [165] | B1325: 2 | C1325: 2
A1326: [166] | B1326: 0 | C1326: 0
A1327: [166] | B1327: 0 | C1327: 1
A1328: [166] | B1328: 0 | C1328: 2
A1329: [166] | B1329: 1 | C1329: 0
A1330: [166] | B1330: 1 | C1330: 1
A1331: [166] | B1331: 1 | C1331: 2
A1332: [166] | B1332: 2 | C1332: 0
A1333: [166] | B1333: 2 | C1333: 1
A1334: [166] | B1334: 2 | C1334: 2
A1335: [167] | B1335: 0 | C1335: 0
A1336: [167] | B1336: 0 | C1336: 1
A1337: [167] | B1337: 0 | C1337: 2
A1338: [167] | B1338: 1 | C1338: 0
A1339: [167] | B1339: 1 | C1339: 1
A1340: [167] | B1340: 1 | C1340: 2
A1341: [167] | B1341: 2 | C1341: 0
A1342: [167] | B1342: 2 | C1342: 1
A1343: [167] | B1343: 2 | C1343: 2
A1344: [168] | B1344: 0 | C1344: 0
A1345: [168] | B1345: 0 | C1345: 1
A1346: [168] | B1346: 0 | C1346: 2
A1347: [168] | B1347: 1 | C1347: 0
A1348: [168] | B1348: 1 | C1348: 1
A1349: [168] | B1349: 1 | C1349: 2
A1350: [168] | B1350: 2 | C1350: 0
A1351: [168] | B1351: 2 | C1351: 1
A1352: [168] | B1352: 2 | C1352: 2
A1353: [169] | B1353: 0 | C1353: 0
A1354: [169] | B1354: 0 | C1354: 1
A1355: [169] | B1355: 0 | C1355: 2
A1356: [169] | B1356: 1 | C1356: 0
A1357: [169] | B1357: 1 | C1357: 1
A1358: [169] | B1358: 1 | C1358: 2
A1359: [169] | B1359: 2 | C1359: 0
A1360: [169] | B1360: 2 | C1360: 1
A1361: [169] | B1361: 2 | C1361: 2
A1362: [170] | B1362: 0 | C1362: 0
A1363: [170] | B1363: 0 | C1363: 1
A1364: [170] | B1364: 0 | C1364: 2
A1365: [170] | B1365: 1 | C1365: 0
A1366: [170] | B1366: 1 | C1366: 1
A1367: [170] | B1367: 1 | C1367: 2
A1368: [170] | B1368: 2 | C1368: 0
A1369: [170] | B1369: 2 | C1369: 1
A1370: [170] | B1370: 2 | C1370: 2
A1371: [171] | B1371: 0 | C1371: 0
A1372: [171] | B1372: 0 | C1372: 1
A1373: [171] | B1373: 0 | C1373: 2
A1374: [171] | B1374: 1 | C1374: 0
A1375: [171] | B1375: 1 | C1375: 1
A1376: [171] | B1376: 1 | C1376: 2
A1377: [171] | B1377: 2 | C1377: 0
A1378: [171] | B1378: 2 | C1378: 1
A1379: [171] | B1379: 2 | C1379: 2
A1380: [172] | B1380: 0 | C1380: 0
A1381: [172] | B1381: 0 | C1381: 1
A1382: [172] | B1382: 1 | C1382: 0
A1383: [172] | B1383: 1 | C1383: 1
A1384: [173] | B1384: 0 | C1384: 0
A1385: [173] | B1385: 0 | C1385: 1
A1386: [173] | B1386: 1 | C1386: 0
A1387: [173] | B1387: 1 | C1387: 1
A1388: [174] | B1388: 0 | C1388: 0
A1389: [174] | B1389: 0 | C1389: 1
A1390: [174] | B1390: 1 | C1390: 0
A1391: [174] | B1391: 1 | C1391: 1
A1392: [175] | B1392: 0 | C1392: 0
A1393: [175] | B1393: 0 | C1393: 1
A1394: [175] | B1394: 1 | C1394: 0
A1395: [175] | B1395: 1 | C1395: 1
A1396: [175] | B1396: 2 | C1396: 0
A1397: [175] | B1397: 2 | C1397: 1
A1398: [176] | B1398: 0 | C1398: 0
A1399: [176] | B1399: 0 | C1399: 1
A1400: [176] | B1400: 1 | C1400: 0
A1401: [176] | B1401: 1 | C1401: 1
A1402: [176] | B1402: 2 | C1402: 0
A1403: [176] | B1403: 2 | C1403: 1
A1404: [177] | B1404: 0 | C1404: 0
A1405: [177] | B1405: 0 | C1405: 1
A1406: [177] | B1406: 0 | C1406: 2
A1407: [177] | B1407: 1 | C1407: 0
A1408: [177] | B1408: 1 | C1408: 1
A1409: [177] | B1409: 1 | C1409: 2
A1410: [178] | B1410: 0 | C1410: 0
A1411: [178] | B1411: 0 | C1411: 1
A1412: [178] | B1412: 0 | C1412: 2
A1413: [178] | B1413: 1 | C1413: 0
A1414: [178] | B1414: 1 | C1414: 1
A1415: [178] | B1415: 1 | C1415: 2
A1416: [178] | B1416: 2 | C1416: 0
A1417: [178] | B1417: 2 | C1417: 1
A1418: [178] | B1418: 2 | C1418: 2
A1419: [179] | B1419: 0 | C1419: 0
A1420: [179] | B1420: 0 | C1420: 1
A1421: [179] | B1421: 1 | C1421: 0
A1422: [179] | B1422: 1 | C1422: 1
A1423: [179] | B1423: 2 | C1423: 0
A1424: [179] | B1424: 2 | C1424: 1
A1425: [180] | B1425: 0 | C1425: 0
A1426: [180] | B1426: 0 | C1426: 1
A1427: [180] | B1427: 1 | C1427: 0
A1428: [180] | B1428: 1 | C1428: 1
A1429: [180] | B1429: 2 | C1429: 0
A1430: [180] | B1430: 2 | C1430: 1
A1431: [181] | B1431: 0 | C1431: 0
A1432: [181] | B1432: 0 | C1432: 1
A1433: [181] | B1433: 1 | C1433: 0
A1434: [181] | B1434: 1 | C1434: 1
A1435: [181] | B1435: 2 | C1435: 0
A1436: [181] | B1436: 2 | C1436: 1

Sheet: spells
A1: EMPTY | B1: NAME | C1: LEVEL | D1: MANACOST | E1: SPHERE | F1: ITEM | G1: SPELLTARGET | H1: DELIVERYSYSTEM | I1: MAXRANGE | J1: EFFECTSPEED | K1: DISTRIBUTION | L1: RADIUS | M1: AREAAFFECT | N1: AREADURATION | O1: AREAFREQUENCY | P1: UNITAPPLYMETHOD | Q1: DURATION | R1: FREQUENCY | S1: DAMAGEMIN | T1: DAMAGEMAX | U1: DEFENSIVE | V1: SKILLOFFSET | W1: SCROLLCOST | X1: BOOKCOST | Y1: EFFECT
A2: empty | B2: name | C2: level | D2: manaCost | E2: sphere | F2: item | G2: spellTarget | H2: deliverySystem | I2: maxRange | J2: effectSpeed | K2: distribution | L2: radius | M2: areaAffect | N2: areaDuration | O2: areaFrequency | P2: unitApplyMethod | Q2: duration | R2: frequency | S2: damageMin | T2: damageMax | U2: defensive | V2: skillOffset | W2: scrollCost | X2: bookCost | Y2: effect
A3: 0 | B3: Fire Arrow | C3: 3 | D3: 5 | E3: 1 | F3: 0 | G3: 1 | H3: 2 | I3: 7 | J3: 200 | K3: 1 | L3: 0 | M3: 0 | N3: 0 | O3: 0 | P3: 1 | Q3: 0 | R3: 0 | S3: 7 | T3: 8 | U3: -1 | V3: 0 | W3: 50 | X3: 150000
A4: 0 | B4: Fire Ball | C4: 10 | D4: 30 | E4: 1 | F4: 0 | G4: 2 | H4: 2 | I4: 10 | J4: 384 | K4: 3 | L4: 1 | M4: 0 | N4: 0 | O4: 0 | P4: 1 | Q4: 0 | R4: 0 | S4: 7 | T4: 13 | U4: -1 | V4: 0 | W4: 70 | X4: 500000
A5: 0 | B5: Wall of Fire | C5: 20 | D5: 30 | E5: 1 | F5: 0 | G5: 2 | H5: 1 | I5: 6 | J5: 0 | K5: 4 | L5: 2 | M5: 0 | N5: 10 | O5: 1 | P5: 1 | Q5: 0 | R5: 0 | S5: 1 | T5: 3 | U5: -1 | V5: 0 | W5: 100 | X5: 30000000
A6: 0 | B6: Protection from Fire | C6: 10 | D6: 40 | E6: 1 | F6: 0 | G6: 1 | H6: 1 | I6: 5 | J6: 0 | K6: 1 | L6: 0 | M6: 0 | N6: 0 | O6: 0 | P6: 2 | Q6: 15 | R6: 0 | S6: -1 | T6: -1 | U6: 1 | V6: 0 | W6: 1000 | X6: 2000000 | Y6: protectionFire=+30: duration 30
A7: 0 | B7: Ice Missile | C7: 3 | D7: 7 | E7: 2 | F7: 0 | G7: 1 | H7: 2 | I7: 7 | J7: 200 | K7: 1 | L7: 0 | M7: 0 | N7: 0 | O7: 0 | P7: 1 | Q7: 0 | R7: 0 | S7: 4 | T7: 11 | U7: -1 | V7: 0 | W7: 50 | X7: 250000
A8: 0 | B8: Poison Cloud | C8: 20 | D8: 30 | E8: 2 | F8: 0 | G8: 2 | H8: 1 | I8: 6 | J8: 0 | K8: 3 | L8: 2 | M8: 0 | N8: 10 | O8: 2 | P8: 2 | Q8: 5 | R8: 1 | S8: -1 | T8: -1 | U8: -1 | V8: 0 | W8: 200 | X8: 20000000 | Y8: health=-2:continuous 8
A9: 0 | B9: Blizzard | C9: 20 | D9: 100 | E9: 2 | F9: 0 | G9: 2 | H9: 1 | I9: 10 | J9: 0 | K9: 5 | L9: 4 | M9: 0 | N9: 8 | O9: 1 | P9: 1 | Q9: 0 | R9: 0 | S9: 10 | T9: 30 | U9: -1 | V9: 0 | W9: 500 | X9: 99000000
A10: 0 | B10: Protection from Water | C10: 10 | D10: 40 | E10: 2 | F10: 0 | G10: 1 | H10: 1 | I10: 5 | J10: 0 | K10: 1 | L10: 0 | M10: 0 | N10: 0 | O10: 0 | P10: 2 | Q10: 15 | R10: 0 | S10: -1 | T10: -1 | U10: 1 | V10: 0 | W10: 1000 | X10: 1000000 | Y10: protectionWater=+30: duration 30
A11: 0 | B11: Acid Stream | C11: 20 | D11: 100 | E11: 2 | F11: 0 | G11: 2 | H11: 1 | I11: 3 | J11: 0 | K11: 5 | L11: 3 | M11: 0 | N11: 0 | O11: 0 | P11: 1 | Q11: 0 | R11: 0 | S11: 10 | T11: 14 | U11: -1 | V11: 0 | W11: 2000 | X11: 1000
A12: 0 | B12: Lightning | C12: 10 | D12: 10 | E12: 3 | F12: 0 | G12: 1 | H12: 2 | I12: 7 | J12: 60 | K12: 1 | L12: 0 | M12: 0 | N12: 0 | O12: 0 | P12: 1 | Q12: 0 | R12: 0 | S12: 1 | T12: 14 | U12: -1 | V12: 0 | W12: 50 | X12: 25000
A13: 0 | B13: Prismatic Spray | C13: 20 | D13: 80 | E13: 3 | F13: 0 | G13: 1 | H13: 2 | I13: 7 | J13: 60 | K13: 1 | L13: 0 | M13: 0 | N13: 0 | O13: 0 | P13: 1 | Q13: 0 | R13: 0 | S13: 5 | T13: 15 | U13: -1 | V13: 0 | W13: 5000 | X13: 2500000
A14: 0 | B14: Invisibility | C14: 25 | D14: 100 | E14: 3 | F14: 0 | G14: 1 | H14: 1 | I14: 5 | J14: 0 | K14: 1 | L14: 0 | M14: 0 | N14: 0 | O14: 0 | P14: 2 | Q14: 10 | R14: 0 | S14: -1 | T14: -1 | U14: 1 | V14: 0 | W14: 3000 | X14: 40000000 | Y14: Invisibility = ON
A15: 0 | B15: Protection from Air | C15: 10 | D15: 40 | E15: 3 | F15: 0 | G15: 1 | H15: 1 | I15: 5 | J15: 0 | K15: 1 | L15: 0 | M15: 0 | N15: 0 | O15: 0 | P15: 2 | Q15: 15 | R15: 0 | S15: -1 | T15: -1 | U15: 1 | V15: 0 | W15: 1000 | X15: 2000000 | Y15: protectionAir=+30: duration 30
A16: 0 | B16: Darkness | C16: 3 | D16: 5 | E16: 3 | F16: 0 | G16: 2 | H16: 1 | I16: 6 | J16: 0 | K16: 3 | L16: 4 | M16: 0 | N16: 15 | O16: 0 | P16: 1 | Q16: 0 | R16: 0 | S16: -1 | T16: -1 | U16: -1 | V16: 0 | W16: 50 | X16: 1000 | Y16: scanRange=-2:duration 1
A17: 0 | B17: Light | C17: 3 | D17: 5 | E17: 3 | F17: 0 | G17: 2 | H17: 1 | I17: 6 | J17: 0 | K17: 3 | L17: 4 | M17: 0 | N17: 15 | O17: 0 | P17: 1 | Q17: 0 | R17: 0 | S17: -1 | T17: -1 | U17: 1 | V17: 0 | W17: 50 | X17: 1000 | Y17: scanRange=+2:duration 1
A18: 0 | B18: Diamond Dust | C18: 3 | D18: 3 | E18: 4 | F18: 0 | G18: 1 | H18: 2 | I18: 7 | J18: 200 | K18: 1 | L18: 0 | M18: 0 | N18: 0 | O18: 0 | P18: 1 | Q18: 0 | R18: 0 | S18: 5 | T18: 10 | U18: -1 | V18: 0 | W18: 50 | X18: 750000
A19: 0 | B19: Wall of Earth | C19: 20 | D19: 15 | E19: 4 | F19: 0 | G19: 2 | H19: 1 | I19: 6 | J19: 0 | K19: 4 | L19: 2 | M19: 0 | N19: 10 | O19: 0 | P19: 1 | Q19: 0 | R19: 0 | S19: -1 | T19: -1 | U19: -1 | V19: 0 | W19: 500 | X19: 15000000
A20: 0 | B20: Stone Curse | C20: 20 | D20: 40 | E20: 4 | F20: 0 | G20: 1 | H20: 1 | I20: 5 | J20: 0 | K20: 1 | L20: 0 | M20: 0 | N20: 0 | O20: 0 | P20: 2 | Q20: 10 | R20: 0 | S20: -1 | T20: -1 | U20: -1 | V20: 0 | W20: 10000 | X20: 999000000 | Y20: "absorbtion=+5:duration 8,defence=-20:duration 8"
A21: 0 | B21: Protection from Earth | C21: 10 | D21: 40 | E21: 4 | F21: 0 | G21: 1 | H21: 1 | I21: 5 | J21: 0 | K21: 1 | L21: 0 | M21: 0 | N21: 0 | O21: 0 | P21: 2 | Q21: 15 | R21: 0 | S21: -1 | T21: -1 | U21: 1 | V21: 0 | W21: 1000 | X21: 10000000 | Y21: protectionEarth=+30: duration 30
A22: 0 | B22: Bless | C22: 3 | D22: 10 | E22: 5 | F22: 0 | G22: 1 | H22: 1 | I22: 5 | J22: -1 | K22: 1 | L22: 0 | M22: 0 | N22: 0 | O22: 0 | P22: 2 | Q22: 10 | R22: 0 | S22: -1 | T22: -1 | U22: 1 | V22: 0 | W22: 50 | X22: 5000 | Y22: toHit=+1:duration 30
A23: 0 | B23: Haste | C23: 10 | D23: 10 | E23: 5 | F23: 0 | G23: 1 | H23: 1 | I23: 5 | J23: -1 | K23: 1 | L23: 0 | M23: 0 | N23: 0 | O23: 0 | P23: 2 | Q23: 10 | R23: 0 | S23: -1 | T23: -1 | U23: 1 | V23: 0 | W23: 50 | X23: 1500000 | Y23: speed=+2: duration 30
A24: 0 | B24: Control Spirit | C24: 20 | D24: 30 | E24: 5 | F24: 0 | G24: 2 | H24: 1 | I24: 5 | J24: 0 | K24: 1 | L24: 0 | M24: 0 | N24: 0 | O24: 0 | P24: 1 | Q24: 0 | R24: 0 | S24: -1 | T24: -1 | U24: -1 | V24: 0 | W24: 2500 | X24: 75000000
A25: 0 | B25: Teleport | C25: 20 | D25: 60 | E25: 5 | F25: 0 | G25: 2 | H25: 1 | I25: 1 | J25: 0 | K25: 1 | L25: 0 | M25: 0 | N25: 0 | O25: 0 | P25: 1 | Q25: 0 | R25: 0 | S25: -1 | T25: -1 | U25: 1 | V25: 0 | W25: 10000 | X25: 50000000
A26: 0 | B26: Heal | C26: 3 | D26: 5 | E26: 5 | F26: 0 | G26: 1 | H26: 1 | I26: 6 | J26: 0 | K26: 1 | L26: 0 | M26: 0 | N26: 0 | O26: 0 | P26: 1 | Q26: 0 | R26: 0 | S26: 8 | T26: 16 | U26: 1 | V26: 0 | W26: 10 | X26: 1000
A27: 0 | B27: Summon | C27: 20 | D27: 100 | E27: 5 | F27: 0 | G27: 2 | H27: 1 | I27: 0 | J27: 0 | K27: 1 | L27: 0 | M27: 0 | N27: 0 | O27: 0 | P27: 1 | Q27: 0 | R27: 0 | S27: -1 | T27: -1 | U27: -1 | V27: 0 | W27: 2000 | X27: 3000000
A28: 0 | B28: Drain Life | C28: 10 | D28: 20 | E28: 5 | F28: 0 | G28: 1 | H28: 1 | I28: 7 | J28: 0 | K28: 1 | L28: 0 | M28: 0 | N28: 0 | O28: 0 | P28: 1 | Q28: 0 | R28: 0 | S28: 4 | T28: 6 | U28: -1 | V28: 0 | W28: 50 | X28: 50000
A29: 0 | B29: Shield | C29: 3 | D29: 10 | E29: 5 | F29: 0 | G29: 2 | H29: 1 | I29: 0 | J29: 0 | K29: 1 | L29: 0 | M29: 0 | N29: 0 | O29: 0 | P29: 2 | Q29: 20 | R29: 0 | S29: -1 | T29: -1 | U29: 1 | V29: 0 | W29: 1000 | X29: 100000 | Y29: absorbtion=+5:duration 30
A30: 0 | B30: Curse | C30: 10 | D30: 10 | E30: 5 | F30: 0 | G30: 1 | H30: 1 | I30: 5 | J30: -1 | K30: 1 | L30: 0 | M30: 0 | N30: 0 | O30: 0 | P30: 2 | Q30: 10 | R30: 0 | S30: -1 | T30: -1 | U30: -1 | V30: 0 | W30: 50 | X30: 1000 | Y30: toHit=-1:duration 30
A31: 0 | B31: Slow | C31: 10 | D31: 10 | E31: 5 | F31: 0 | G31: 1 | H31: 1 | I31: 5 | J31: -1 | K31: 1 | L31: 0 | M31: 0 | N31: 0 | O31: 0 | P31: 2 | Q31: 10 | R31: 0 | S31: -1 | T31: -1 | U31: -1 | V31: 0 | W31: 50 | X31: 1000 | Y31: speed=-2: duration 30
A32: 1
A33: 1
A34: 1
A35: 1
A36: 1